u_id,u_rate,p_id,review,review_en
병수 전,5,1002,"예술의 전당 식사와 공연 관람이 가능한 한적한 서울 남부 지역입니다. 뒤에 산도 있어서 간단한 산행도 가능합니다. 교통도 비교적 좋아요^^ 지하철, 자가용 등 사실 서울의 몇 안되는 공연전문 건물입니다","It is a quiet southern part of Seoul where you can eat and watch performances at the Seoul Arts Center. There is a mountain behind you, so you can go for a simple hike. Traffic is relatively good, too. It's actually one of the few performance buildings in Seoul, including subways and private cars."
songn962,4,1002,사진관람전 로이터사진관람전 2016년 사진관람전 힐링이필요하시면 이곳으로 오세요 시원하고 보는즐거움 새로운세계로 초대 남부터미널에서 걸어서10분 마을버스이용가능,"Photo exhibition, Reuters photo exhibition, 2016 photo exhibition, if you need healing, come here to enjoy the cool and enjoyable world. You can walk from Nambu Terminal for 10 minutes."
파도피아노,5,1002,최고의 전시회를 감상하려면 여기로 오세요! 얼마 전 샤갈전을 보러 오랜만에 방문하였습니다. 언제나 외국 및 국내 화가들의 유명 전시회를 이 곳에서 관람하곤 합니다. 멋진 작품들과 그에 걸맞는 전시관의 구조가 조화를 이뤄 최고의 시간을 선사해 주는 것 같네요.,"Come here to enjoy the best exhibition! Not long ago, I visited Chagalljeon after a long time. We always see famous exhibitions by foreign and domestic artists here. It seems to give you the best time by harmonizing the wonderful works with the structure of the exhibition hall."
yusoooooo,3,1002,"분위기는 좋으나, 공간이 작다. 미술작품 표현을 하기에 정말 괜찮지만, 내가 본 전시회가 그랫는지 상당히 장소가 협소해보였다. 그래도 다양한 전시를 하는 곳이니 만큼 전문적이다.","The atmosphere is good, but the space is small. It's really nice to express the artwork, but the place looked quite small as if the exhibition I saw was like that. Still, it is as professional as it is a place where various exhibitions are held."
yusoooooo,4,1002,"공연보기 정말 좋은 장소 시설 내에 있는 식당이 비싼편이긴 하나, 특별한 하루를 보내며 뮤지컬, 전시 등 문화생활을 하기에 최적화 되어있는 곳이다. 소극장에서 대극장, 미술관이 있음으로 다양한 경험을 할수 있다.","Although the restaurant in the facility is expensive, it is optimized for cultural life such as musicals and exhibitions while spending a special day. There is a large theater and art museum in the small theater, so you can experience various things."
snr1120,5,1002,"가족과 산책하기 좋아요! 자전거는 무리지만..킥보드 가져가심을 추천,,아이가 너무 좋아했어요, 시끄럽게 놀지않는다는 전제하에,,,","It's great to take a walk with your family! Bicycles are too much, but...I recommend you to take the kickboard, and the kid loved it so much, provided he didn't play too loud."
seyoung h,4,1002,"예술의전당 예술의전당은 공연보러도 가지만 대부분 전시회를 보러 많이가는거같다 . 사진전시회, 미술등등 볼거리가 많아요~","Seoul Arts Center Seoul Arts Center goes to see performances, but most of them go to exhibitions. There are many things to see such as photo exhibitions, art, etc."
ainocross,3,1002,오페라극장 시야는 좋으나 음향이 다른 극장에 비해 부족하게 느껴짐. 특히 뮤지컬 공연시 내용전달이 어려울 정도로 잘 안 들림. 그 외 화장실 충분하고 로비 등의 공간이 넓어서 쾌적함,"The opera theater has a good view, but the sound is less than that of other theaters. Especially when performing in a musical, I can't hear the contents well enough to the point where it's hard to hear. Other than that, there is plenty of restrooms and a lot of space for example."
연화 이,4,1002,한가람 미술관 서울 서초동 예술의 전당 안에 있는 한가람 미술관 앤서니 브라운 전을 보러 갔습니다. 항상 멋진 전시회가 있어서 보고 싶은 전시회는 놓치지 않고 보려고 해요 전시회장도 넓고 그래서 관람하기에 너무 좋아요 해외 미술관 못지 않아요~,"I went to see Anthony Brown Exhibition at Hangaram Art Museum in Seocho-dong, Seoul. There is always a great exhibition, so I don't want to miss it. The exhibition hall is spacious, so it's great to see. It's as good as an overseas art museum."
연화 이,4,1002,예술의 전당 서울시 서초구 서초동에 있는 예술의 전당 전시회나 공연을 보러 가끔 가는데요. 오페라하우스. 음악당. 한가람미술관 등으로 넓게 조성되어 있어서 너무 좋구요 특히나 여름밤에 음악분수가 너무 멋져요,"I sometimes go to the Seoul Arts Center in Seocho-dong, Seocho-gu, Seoul to see exhibitions or performances. an opera house It's so nice to have a large concert hall and Hangaram Art Museum. Especially on summer nights, the music fountain is so cool."
정원 신,4,1002,공연보러 종종 공연보러 종종 방문합니다. 공간이 개방적이라 여유있는 이미지가 좋습니다. 지하철로 방문하는 교통은 좀 번거로운편입니다.,"I often visit to see a performance. The space is open, so I like an image that is relaxed. The traffic visiting by subway is a bit cumbersome."
Hyein O,5,1002,주요 미술전시회의 메카 한가람미술관에서는 정말 좋은 미술 전시회를 많이 열고 있지요. 유모차로 진입하기에도 어렵지 않게 엘리베이터가 연결되어 있어 좋구요. 시시때때로 (최근엔 앤서니 브라운) 좋은 공연과 전시들이 끊이지 않아 좋은 곳입니다.,"The Mecca Hangaram Museum of Art, a major art exhibition, has a lot of great art exhibitions. It's good to have an elevator connected so that it's not difficult to get into a stroller. From time to time (recently Anthony Brown) It's a great place because there are so many good performances and exhibitions."
봉봉마루,5,1002,아이랑 미술전시회보러 가끔갑니다.. 아이랑 미술전시회보러 가끔 갑니다..좀 번잡하고 정신없긴하지만 입장후 전시회보는건 참 좋습니다..주차도 비교적 쉬운 편입니다..주변경치가 좋습니다,"I sometimes go to an art exhibition with my child. I sometimes go to an art exhibition with my child.It's a bit crowded and chaotic, but it's nice to see the exhibition after entering.Parking is relatively easy.The scenery is nice."
봉봉마루,5,1002,우면산을 끼고 있어 공기가 좋습니다 봄에 아이(초3)랑 전시회를 보러 갔는데 음악분수도 나오고 날씨도 좋아서 어디 먼곳에 온 느낌이었어요.. 주말에 가족들이랑 그냥 산책하러 가도 좋을 분위기였습니다..,"The air is fresh with Mt. Umyeon. I went to see an exhibition with my kid in the spring, and it felt like I was far away because of the music fountain and the weather. It was a good atmosphere to go for a walk with my family on the weekend."
멋돌이,4,1002,시간보내기 좋은곳 가끔 시간을 보내기 위해 예당의 가는데 혼자 돌아다니기 괜찮고 화장실을 이용하면서 무슨공연이 있나 찾아보고 즉석 예매하여 공연보는것도 상당한 즐거움이라고 생각합니다,It's a good place to spend some time in Yedang. It's nice to walk around alone. I think it's a great pleasure to go to Yedang and use the bathroom to find out what kind of performances there are and to book and watch performances on the spot.
HL1LFC,4,1002,가족과 나들이 좋아요 가끔 가족들과 놀러갑니다. 걷기도 하고 따뜻한 핫초코도 마시고 때론 공연도 보고... 여유롭고 바쁘지 않게 걷기 좋아요,"I love my family and going out. I sometimes go out with my family. Walking, drinking hot chocolate, sometimes watching performances... It's good to walk leisurely and busily."
vstellav,4,1002,많은 전시와 공연 1년 내내 많은 전시와 공연이 열립니다. 다양한 종류의 공연이라 골라보기도 좋습니다. 교통이 좀 많이 불편한것 빼고는 다 좋습니다,There are many exhibitions and performances throughout the year. It's good to choose because it's a variety of performances. Everything is fine except the traffic is very inconvenient.
vstellav,4,1002,생각보다 작은규모 버스가 많이있긴하나 지하철에서 떨어져있어 교통이불편합니다. 카페테리아가 있어 전시보고 식사하기에도 좋습니다. 다른 전시장들도있어 이동이 좋습니다,"There are a lot of smaller buses than I thought, but it is convenient to take transportation because they are far from the subway. There is a cafeteria, so it's good for exhibition and eating. There are other exhibition halls, so it's good to go."
여정현,4,1002,"우면산 탐방로로도 좋은 곳 보통은 전시회, 음악회, 발레공연이 자주 열리지만 우면산 탐방과, 운동으로도 적당한 곳이다.","It is also a good place to visit Umyeon Mountain. Usually, exhibitions, concerts, and ballet performances are held frequently, but it is also suitable for visiting Umyeon Mountain and exercising."
yhj9072,4,1002,예술에 모든 것을 느낄수 있는 곳 미술관람을 위해 방문했던 곳인데 가족들도 나들이 겸 많이 왔더라구요. 광장에서 커피한잔 마시면서 밤공기를 마시는 것도 이곳의 장점인듯 하네요,"The place where I can feel everything about art is where I visited for art viewing, and many of my family members came out for a picnic. I think drinking a cup of coffee at the square and the night air is another advantage here."
Jiyoung P,5,1002,한가람 미술관을 위해서 한가람 미술관을 위해서 다녀왔는데. 넓고 좋지만 여름에는 오르막길을 걸어가야되기 때문에 꼭!!! 버스타고 올라가길 추천,"I went to Hanaram Museum of Art for Hanaram Museum. It's spacious and nice, but you have to walk uphill in the summer, so make sure!!! I recommend you to take the bus."
맛부림러,4,1002,"미술 전시회를 보러오기에 좋습니다 다만 교통이 불편해 걷거나 버스를 갈아타야합니다 주변에는 아무것도 없다시피해 관광을 즐기기에 다소 부족합니다 하지만 내부의 행사와 전시, 공연으로도 갈 이유가 충분합니다","It's good for an art exhibition. However, I have to walk or change buses because of the inconvenient traffic. There's nothing around.It's not enough to enjoy the damage, but there's plenty of reason to go to events, exhibitions, and performances inside."
으헤헤헤헹,5,1002,좋죠 좋아요 특히 가을게 놀러가세요 가을에 공연보러가는것을 추천합니다 그리고 사실 주변에 먹을 거리가 많지 않습니다. 여기오기전에 식사를 하고 오시거나 혹은 실사를 하러 다른곳으로 가셔야 할것 입니다.,"It's good. It's good. Especially in the fall. I recommend you to go to a performance in the fall. And in fact, there's not much to eat around here. You'll have to eat before you come here or go somewhere else to do due diligence."
Josephine0617,4,1002,여름 저녁에 가면 좋아요 5시 쯤부터 전시 보고 카페 테리아에서 간단히 저녁 먹으면 참 좋아요. 저는 특히 여름이 좋더라구요.,It's good to go to the exhibition at around 5 o'clock and have a quick dinner at Cafe Terria. I especially like summer.
hohomj,5,1002,골저스 특별하게 해주는 분위기 차분해지게 해주는 예술 집합소 화장실부터 숨은 곳곳 세세하게 신경쓴 것이 보인다.,"From the restrooms of the art collection center to calm the atmosphere that makes the Golzus special, it seems that he paid close attention to all the hidden places."
qberwy,5,1002,"좋은 전시/공연이 있습니다. 예술의 전당 좋은 전시나 공연이 있어서 자주 가는 곳이에요. 사진 전시회나 오페라 공연등을 보러가기에 좋은 곳 같습니다. 1층에 카페나 시설들도 잘되어있고, 깨끗하게 관리되어서 가볼만한 곳같습니다.","There is a good exhibition/performance. I often go to the Seoul Arts Center because it has a good exhibition or performance. I think it's a good place to go to a photo exhibition or an opera performance. There are good cafes and facilities on the first floor, and it looks like a good place to visit because it's clean."
자카르,4,1002,여름분수와 함께하는 시원하고 분위기 있는 공연 친구들과 함께 오랜만에 연주회 공연을 보러 갔는데 가격도 적당하고 연주회도 마음에 들었어요. 그런데 교통이 불편해서 시간이 넉넉하면 역에서 내려 걸어가는 것도 나쁘지 않을듯 해요. 음악분수는 오후시간에 가면 9시 넘어까지 노래와 함께 무료로 볼 수 있어서 아주 좋았어요.,"I went to see a concert with my friends after a long time, and the price was reasonable and I liked the concert. But if you have enough time due to the inconvenient traffic, it would be nice to walk down from the station. If I go to the music fountain in the afternoon, I could watch it for free with music until after 9 pm."
펭귄뒷구르기,5,1002,"공연이 많아서 최고입니다. 접근성이 정말 좋고, 다양한 공연이 많아서 자주 갑니다. 실내도 쾌적하고 맛있는 식당도 꽤 있어서 데이트 겸 기분전환 겸 즐기기 좋은 장소입니다.","It's the best because there are many performances. It's very accessible and there are many different performances, so I go there often. There are many pleasant and delicious restaurants inside, so it's a good place to go on a date, refresh, and enjoy."
Ksirius,4,1002,아늑한 분위기 좋은 연주회 가족들과 같이 연주회 방문을 했는데 적정 가격에 좋은 연주회를 감상할 수 있었음. 주말에는 교통이 다소 불편함.,"I visited the concert with my family, and we were able to enjoy the concert at a reasonable price. Traffic is rather inconvenient on weekends."
포미아빠,5,1002,"컨디션이 괜찮습니다. 관리도 잘되고 있고, 좋은 전시들도 많아요. 큐레이터들의 기획력이 좋습니다. 접근성이 떨어지지만 그건 어쩔 수 없는 일이죠","I'm in good condition. It's well managed, and there are many good exhibitions. Curators have good planning skills. It's not accessible, but it can't be helped."
avecmoi82,5,1002,"요즘같은 여름날에 음악분수와 먹거리가 있어 나들이 가기 딱 좋아요 전시나 공연 보시고 바로 집에 가지 마시고 푸드트럭에서 음식과 맥주 구입하시고 음악분수까지 즐기고 오시면 딱 좋아요. 주말 음악분수 공연 시간은 저녁 6시반, 9시반입니다.","On summer days like this, there's a fountain of music and food, so it's perfect to go out for a picnic. Don't go home right after an exhibition or performance. Buy food and beer from a food truck and enjoy a fountain of music. The weekend music fountain performance time is 6:30 p.m. and 9:30 p.m."
사자비,4,1002,"고급스러운 음악회는 이곳에서 우면산에 자리잡은 이 곳은 공연이나 전시회를 볼 목적이 아니더라도 가볍게 산책하기 좋은 장소다. 접근성도 좋고, 주변에 맛집들도 제법 있는편. 물론 이곳을 방문하는 가장 큰 목적은 음악회나 전시회일것이다. 크고 작은 규모와 장르를 가리지 않고 다양한 예술공연을 접하기 좋다.","Situated on Mount Umyeon here, the luxurious concert is a good place to take a walk, even if not for the purpose of seeing performances or exhibitions. It has good accessibility and there are quite a few good restaurants around it. Of course, the biggest purpose of visiting this place will be a concert or exhibition. It is good to see various art performances of all sizes and genres."
Jacque S,4,1002,"좋은 공연 비싼 식당 식사는 무조건 바깥에서 하고 오시길 바란다. 공연이 끝나면 나오려는 자동차가 줄을 서기 때문에, 웬만해선 대중교통을 이용하길 바란다. 이 곳의 미술관은 넓기 때문에 천천히 관람하기에 좋다. 여러 미술전시와 공연이 있기에 시간이 많다면 방문하기에 아주 좋다.","I hope you will have a good performance and expensive restaurant meal outside. After the performance, the cars that are about to come out are lined up, so I hope you can use public transportation. The museum here is spacious, so it's good for slow viewing. There are many art exhibitions and performances, so if you have a lot of time, it is very good to visit."
보리사랑,4,1002,뮤지컬 레베카 뮤지컬 레베카를 보러 오랜만에 예술의 전당에 방문하였습니다.. 3층에서 관람하였는데 배우의 표정을 보려면 오페라글라스가 필요합니다. 다음에 클래식공연을 보러갈 예정입니다.,I visited the Seoul Arts Center to see the musical Rebecca. I watched it on the 3rd floor and I need opera glasses to see the actor's face. I'm going to see a classical performance next time.
soul8486,5,1002,"말 그대로 예술의 전당! 좋은 전시회도 많고, 예술의 전당은 정말 분위기가 좋아요. 가끔 사람이 너무 많은게 흠이기는 하지만 전반적으로 예술의 전당에서 하는 공연, 전시는 참 좋습니다.","Literally the Seoul Arts Center! There are many good exhibitions, and the Seoul Arts Center has a great atmosphere. Sometimes too many people are a flaw, but overall, the show at the Seoul Arts Center, is very good."
oriwife,4,1002,깔끔한 미술관 아이들 미술교육에 좋은 전시회를 많이 기획하는것 같아요. 시설 좋고 주차비는 비싸도 주차하기도 좋고 전시회 보고 인근 우면산에 잠시 다녀와도 좋아요. 근데 근처에 먹을 만한데는 없는것 같아요,"I think they plan a lot of good exhibitions for neat art museum children's art education. The facilities are good, the parking fee is expensive, but it's good to park, see the exhibition, and visit nearby Umyeon Mountain for a while. But I don't think there's anywhere near here to eat."
고다이바한,5,1002,"멕시코로의 그림 여행 멕시코의 그림 영웅 프리다와 디에고 전을 보고 왔습니다. 두 분의 작품을 가장 많이 보유한 멕시코 올메다 미술관의 작품들을 가져 온 전시회였는데 멕시코 특유의 열정과 위트를 느낄 수 있어 좋았고 한가람 미술관은 우리 나라 전시관 중 으뜸이라 생각합니다. 기획의 차별성이나 위치, 부대시설 등 항상 top인 거 같습니다.","Picture Journey to Mexico I've seen Mexican painting heroes Freda and Diego. It was an exhibition that brought the works of Mexico's Olmeda Museum, which has the most works of both of them, and it was great to feel the passion and wit unique to Mexico, and I think Hangaram Museum is the best exhibition hall in Korea. It seems that the differentiation, location, and auxiliary facilities of planning are always top."
edinya,5,1002,"잘 선택된 공연과 쾌적한 환경 기분 좋은 어느날, 음악회, 오페라, 연극 등 공연 하나 보고 싶으면 안심하고 선택할 수 있는 곳입니다. 주차장 넉넉하고, 넓은 공간에 산책도 할 수 있는 도심 속의 문화 공간, 예술의 전당은 언제나 마음의 평화를 주는 행복한 공간입니다.","If you want to see a performance such as a concert, opera, play, etc., it is a place where you can choose with confidence. The cultural space in the city center, where you can take a walk in a spacious parking lot, and the Seoul Arts Center is always a happy place that gives you peace of mind."
bongza12,5,1002,"그냥 쏘쏘한 미술과 미술관을 자주 가는건 아니지만, 생각보다 작은 미술관이라 생각함. 그래도 마음은 편안함..","I don't go to the museum often, but I think it's smaller than I thought. Still, it's comfortable..."
bongza12,5,1002,소소한 쉼터 웅장한 크기에 공연을 안봐도 가볍게 산책을 하거나 쉴수있는공간. 주차요금이 조금 비싼게 흠.,The small shelter is magnificent and you can take a walk or rest without watching the performance. The parking fee is a little high.
gi0g0a,4,1002,"여긴 관광지가 아니라 공연장이라는...초여름 산책코스로도 손색없다는.... 공연보러 자주 가는 편인데요....최근엔 4월에 있었던 ""한화와 함께하는 2016 교향악 축제""였습니다. 한화가 17년째 후원하고 있는 대표적인 메세나 프로그램 중 하나였네요. 저는 이번엔 처음 알았습니다. 메세나는 금호그룹만 기억이 남는데요. 제가 간 날은 부천필하모닉과 피아니스트 문지영의 협연이 있었습니다. 예술의전당은 굳이 공연을 보지 않더라도 요즘같은 초여름엔 저녁 산책코스로도 손색없습니다. 가족과 아님 연인들이 손잡고 걸으면서 저녁 밤바람을 만끽할 수 있는 곳이라고 생각합니다.","0This isn't a tourist spot, it's a concert hall.It's a perfect early summer walking course.I go to the theater often...Recently, it was the 2016 Symphony Festival with Hanwha in April.It was one of the representative Messina programs sponsored by Hanwha for 17 years.I knew for the first time this time.Only Kumho Group remembers the message.On the day I went, there was a collaboration between Bucheon Philharmonic and pianist Moon Ji-young.Even if you don't have to watch a performance, the Seoul Arts Center is perfect for an evening stroll in early summer.I think it is a place where family or lovers can walk hand in hand and enjoy the night breeze."
hophopwo,5,1002,"공연보기 좋죠 점점 대중화되는 것 같아요. 특히 미술전시가 십년 전과 비교하면 정말 대중화되었어요. 많은 이들이 데이트삼아서도 오고, 가족단위로도 오고요. 잠깐씩 있는 연주회도 좋은것 같던데, 집이 가까우면 더 자주 가고싶은 곳입니다.","It's good to watch. It's getting popular. Especially, art exhibitions have become very popular compared to 10 years ago. A lot of people come on dates and families. I think concerts that are held briefly are good, but if you are close to home, you want to go there more often."
호호홍홍홍,5,1002,"여유로움과 문화가 함께 있는 곳 지하철로 가기는 좀 힘들지만 다양한 버스 이용가능합니다. 미술 음악 전시회 등 다양한 문화생활을 접할 수 있고, 저녁에 조명과 함께 예쁜 음악분수도 낭만적입니다.","It's hard to get there by subway where there's a lot of leisure and culture, but you can use various buses. You can experience various cultural life such as art, music, and exhibition, and the beautiful music fountain with lighting in the evening is romantic."
혜진김1101,5,1002,썰렁했어요 공연이 없는날이었는데 견학겸 체험학습하려고 갔었는데 먹거리도 많지않고 주차요금만 ..ㅠㅠ 어쨌든 다음번에는 공연이 있을 떄 가보려구요 그래도 서울 한복판에 ㅇㅖ당이 있어서 조아요,"It was a boring day. I went on a field trip and a field trip. There was not much food and parking fee..Anyway, I will go next time when there is a performance, but there is a Yedang in the middle of Seoul, so I doze off."
chocopang,5,1002,"데이트 하기로도 좋고, 전시회도 한번에 많이 열려서 좋은장소. 주변이 조용하고, 탁트여서 데이트 하기로도 좋습니다. 한번에 서너개 전시구경하기도 좋은 장소!","It's a good place to go on a date, and there are many exhibitions at once. It's quiet around here, and it's great to go out on a date. A good place to look around three or four exhibitions at once!"
depart1018,5,1002,"아름다운 예술의 전당 아이와 함께 음악회에 가기 위해 1년 만에 찾은 예술의전당. 예전보다 더 활기찬 느낌이랄까.... 음악분수가 정말 좋았고 예전엔 보이지 않던 푸드트럭들이 있어 좀 더 대중화 된 느낌이었다. 음악분수 옆 레스토랑 테라스에서 치즈케이크와 커피, 핫초코를 마시며 음악분수를 바라보니 정말 좋았다.","The Seoul Arts Center visited after a year to go to a concert with a child of the beautiful Seoul Arts Center. It feels more energetic than before. The music fountain was really good and it felt more popular because there were food trucks that were not seen before. It was really nice to look at the music fountain while drinking cheesecake, coffee, and hot chocolate at the terrace of the restaurant next to the music fountain."
PJH,5,1002,"서초동의 랜드마크 집근처에 이렇게 훌륭한 곳이 있다는게 너무 좋습니다~ 음악회및 전시회는 물론이고 여름날 저녁에 볼수있는 야외분수쇼나 산책할수있는 코스도 있고, 식사를 할 수 있는 모짜르트카페도 있고 곳곳에 음료를 테이크아웃해서 마실수 있는곳도 여러곳있어요!! 데이트 장소로도 굿굿!!","It's so nice to have such a great place near a landmark house in Seocho-dong. In addition to concerts and exhibitions, there are outdoor fountain shows and walking courses on summer evenings, Mozart cafes where you can eat, and many places where you can take out drinks!! Good, good, good, good, good, good!"
