u_id,u_rate,p_id,review,review_en
soul8486,5,1002,"한가람 미술관 좋아요 전시회 있을 때마다 늘 찾는 편인데 도슨트가 있는 시간에 가면 더 좋습니다. 물론, 오디오가이드로도 설명을 들을 수 있지만 도슨트에게 직접 듣는 설명이 훨씬 더 와닿습니다. ^^","Hangaram Art Museum is great. I always visit whenever there is an exhibition, but it's better to go when there is a docent. Of course, you can hear the audio guide, but the instructions you hear directly from the docent are even more relevant. ^^"
jhyyoo,5,1002,야간분수쇼! 한경필하모닉 연주회 감상 차 들렀습니다. 공연장 밤 8시쯤에 해 주는 음악분수가 멋있습니다 ^^ 시설도 깔끔하고 언제나 데이트하기 좋은 장소같네요.,Night fountain show! I stopped by to watch the Hankyung Philharmonic concert. The music fountain at 8 p.m. at the concert hall is cool.  시설 시설 The facilities are clean and it seems like a good place to go out all the time.
701irenek,5,1002,한국의 자부심! 한국엔 이렇다 할 복합 문화공간이 많지 않은 것 같은데 예술의 전당이야 말로 이름 값을 하는 곳이 아닌가 싶어요 봄에는 뒷산으로 소풍도 가고 ^^ 큰 음악회 뿐 아니라 작은 전시회들도 구경하기 좋은 곳이에요,"Korea's pride! I don't think there are many complex cultural spaces in Korea, but I think the Seoul Arts Center is worth its name. In spring, you can go on a picnic in the mountains behind you and see small exhibitions as well as big concerts."
스베스베,5,1002,"꼭 공연이 아니라도 데이트하기 좋은 곳 여름에는 노래하는 분수, 겨울에는 아이스링크로 가볍게 데이트하기 좋은 장소입니다. 산책하기 좋은 코스",It's a good place to go on a date even if it's not a performance. It's a good place to go on a date with a singing fountain in summer and an ice rink in winter. a good course for a walk
ssanggi,4,1002,한가람 미술관 후기 한가람 미술관은 서초 예술의 전당 옆에 있습니다. 종종 수준 높은 문화재와 미술작품이 전시됩니다. 다만 너무 어린아이들이 가기에는 수준이 높고 가격도 수준 이상이라는 것이 단점,"Hangaram Museum of Art Review Hangaram Museum is located next to Seocho Arts Center. High-quality cultural assets and artworks are often displayed. However, the disadvantage is that it is too high for young children to go and the price is above the level."
mmom661,5,1002,문화 공간으로는 최고 보고싶었던 전시를 보러 들렸어요. 쾌적한 공간에서 친절한 직원들 덕에 전시 관람권 결제할 때도 좋았고요. 만족할만한 수준으로 즐거웠던 곳.,"I stopped by to see the exhibition that I wanted to see the best cultural space. Thanks to the friendly staff in a pleasant space, it was good to pay for the pleasant space. A place where I enjoyed to a satisfactory level."
ssanggi,5,1002,음악과 맥주 와이프와 가족들과 여러번 왔었고 친구들과도 공연 없는 날에도 와서 맥주 한잔씩 했습니다. 독일등에서 유학한 음악가들이 와서 한잔씩 한다고들 하던데 역시 본토 맛을 아는 그들을 만족시키기 위해서 그런지 맥주 맛이 최고입니다.,"I came to music and beer with my wife and family several times, and my friends and I had a glass of beer even when there was no performance. Musicians who studied in Germany and other countries come and drink together, but beer tastes the best to satisfy those who know the taste of the mainland."
springspring404,5,1002,"미술전 보고왔어요 시설은 좋고, 좋은 그림도 많은데.. 아이들 동반한 주부들이 많이 있어서 다소 어수선 합니다. 아이들 안올 날짜나 시간으로 보고 구경가세요~ 그래도... 뉴욕 소마 같은데 보다는 훨 한적하지요~","I saw the art exhibition. The facilities are good, and there's a lot of good pictures. There are many housewives with children, so it's a bit messy. Look at the dates and times when the kids aren't coming, but... It's much quieter than New York Soma."
syhyrrr,5,1002,서울에서의 문화생활 질적으로나 양적으로나 풍부한 공연들이 많이 올라와요. 발레도 좋고 연극도 좋고.. 문화생활이 필요할 때 방문하기 좋은 곳인 것 같습니다.!,"There are many performances in Seoul, both in terms of quality and quantity. I like ballet, I like theater. I think it's a good place to visit when you need a cultural life!"
THE_GREAT_K,5,1002,"예술의 전당에 있는 한가람 미술관 최고~ 예술의 전당내 한가람 미술관. 한번도 가볼 기회가 없었는데... 내셔날지오그래픽 사진전 갈 기회가 있어서 갔다왔는데...사진도 감동적이었고, 미술관도 정말 좋았습니다.",Hangaram Art Museum in Seoul Arts Center. Best~ Hangaram Art Museum in Seoul Arts Center. I've never had a chance to go... I went to the National Geographic Photo Exhibition because I had a chance to go...The picture was touching and the museum was really nice.
THE_GREAT_K,5,1002,"최고의 문화공간 서울에서 최고의 문화적 혜택을 누릴 수 있는 공간. 공연, 전시 등 어떤 것이든지 만족할만한 수준으로 즐길수 있는 곳입니다.","The best cultural space in Seoul where you can enjoy the best cultural benefits. It is a place where you can enjoy any kind of performance, exhibition, etc. at a satisfactory level."
초초미,5,1002,다양한 작품을 가까이에서 볼 수 있어서 좋다 피카소라든지 다양한 미술작품을 한가람미술관에서는 자주 볼 수 있어서 좋다. 문화의 날에는 저렴한 가격으로도 볼 수 있다.,It is good to see various works closely and to see various works of art such as Picasso and Hanaram Art Museum. It can be seen at a low price on Culture Day.
초초미,5,1002,좋은 문화를 체험할 수 있다 여러 전시회를 많이 열어 다양한 문화를 체험할 수 있다. 문화의 날에는 보다 저렴한 가격으로 전시회도 볼 수 있다.,"You can experience a good culture. You can experience various cultures by holding many exhibitions. On Culture Day, you can also see exhibitions at a lower price."
protte,4,1002,예술의 전당 4살짜리 아이를 데리고 맘 편히 가서 힐링하고 올 수 있는 곳. 덤으로 봄~가을까지는 멋진 분수쇼까지!!!최고예요,A place where you can take your 4-year-old child to relax and heal. Even a great fountain show from spring to fall!!!It's the best.
KSOY,4,1002,도심 속의 쉼터 보고싶던 전시들이 제일 많이 여는 곳 조용하고 한적해서 데이트 장소로도 좋아요~~ 근처 맛집도 많아요,The place where I wanted to see the rest area in the city is the most open place is quiet and quiet so it's good for a date. There are many good restaurants nearby.
KSOY,4,1002,"여러 전시와 공연, 문화가 있는 곳! 여러 전시와 공연, 문화가 있는 곳! 다른 미술관 곳보다 더 많은 미술작품이 펼쳐지고 무료전시도 많아서 좋아요","A place with various exhibitions, performances, and culture! A place with various exhibitions, performances, and culture! I like it because there are more artworks and free exhibitions than other art galleries."
다다333,5,1002,시간의 공존 그림을 본다 바라본다 그리고 또 생각한다 오랜시간이 지나도 변하지 않는 그들의 색채미에 빠져든다,I look at the picture of the coexistence of time and think again. They fall into their colors that never change after a long time.
다다333,5,1002,후덥지근한 여름날 쏟아지는 분수를 바라보며 여름의 더위를 식혔던 기억...그리고 공연을 보며 추억과 쓸쓸함도 남았던..뜨거웠던 여름날의 기억.,The memory of cooling off the summer heat looking at the pouring fountain on a hot summer day...And watching the performance left memories and loneliness.The memory of a hot summer day.
dtracy99,4,1002,아이데리고 네시간 공연. 전시 아이데리고 최대 4시간 채우기 좋은 곳. 때에 따라서 보석같은 컨텐츠가 많아서 자주 지켜보면 좋은 전시나 공연을 즐길수 있음.,"Aiderigo's four-hour concert. A good place to fill up to four hours of exhibition Aidero. Depending on the time, there are many contents like jewelry, so if you watch it often, you can enjoy good exhibitions or performances."
js34152,4,1002,기분 전환에 딱! 공연을 보지 않더라도 날씨 좋은 가을에 한번씩 들르면 기분이 딱 좋아지는 곳입니다. 여름 저녁에도 좋을 것 같네요,"It's perfect for a change of mood! Even if you don't watch a performance, it's a perfect place to stop by in autumn. I think it'll be good for summer evenings."
하얀구름,4,1002,"내셔널지오그래픽 전시회 내셔널지오그래픽 전시회를 보고 왔습니다. 미술전시회와 달리 이런 사진전시회는 우리 인간의 모습을 잘 보여주는 전시회인 것 같습니다. 자연을 향한 도전, 자연을 훼손하는 인간, 따뜻한 인간애 등 여러 모습을 볼 수 있었습니다. 주말이어서 꽤나 사람이 많았던 것을 빼면 즐거웠던 전시회이었습니다. 한가람 미술관이 집 근처에 있었으면 정말 좋았을텐데...","I saw the National Geographic Exhibition National Geographic Exhibition. Unlike the art exhibition, this photo exhibition seems to be an exhibition that shows the image of humans well. I could see many aspects of nature, such as challenges to nature, humans damaging nature, and warm humanity. It was a fun exhibition except that there were quite a lot of people on the weekend. It would have been great if Hangaram Art Museum was near my house..."
ahye0ng,5,1002,좋아요 다양한 전시와 관람을 할 수 있어서 좋아요 문화적 혜택을 누리는 것 같아 좋기도 하고요 꼭 가야죠,Good. It's good to be able to see various exhibitions. It's good to enjoy cultural benefits. I have to go.
bdragon8,5,1002,"공연보고 왔어요 클래식 공연을 보고 왔는데, 넓고 좋습니다. 주변에 먹거리가 많지 않아서 쪼금 나가서 먹고 왔습니다.","I watched a performance. I watched a classical performance. It's spacious and nice. I didn't have much food around, so I went out a little bit and ate."
여행쪼아,4,1002,다양한 공연과 전시가 있는 문화공간 대표적인 공연문화와 전시가 연중 진행되는 곳입니다. 유료회원으로 가입하면 공연/전시에 따라 할인을 받을 수 있고 주차장도 넉넉하여 이용이 편리합니다,"It is a cultural space with various performances and exhibitions. It is a place where representative performance culture and exhibition are held throughout the year. If you sign up as a paid member, you can get a discount depending on the performance/show, and there is plenty of parking lot, so it's convenient to use."
네모입술,5,1002,대영박물관전을 보고 왔어욧 한가람 미술관은 5년만에 방문한거 같네요 여전히 깔끔했고 미술관의 가장 중요한 부분이 사람을 얼마나 잘 통제하는지라고 생각하는데 한가람 미술관은 관람객을 잘 통제한다. 가끔 전시회를 가면 사진을 마구 찍어대서 주변 사람들을 불편하게 하는 사람들도 있는데 이런것들이 잘 통제되어 관람에 집중할수 있었다. 차는 되도록 대중교통을 이용하는것을 추천!! 주말에 주차하기 굉장히 힘듭니다.,"I saw the British Museum exhibition. It's been five years since I visited the Hangaram Museum. It was still neat and I think the most important part of the museum is how well it controls people, but Hanaram Museum of Art controls visitors well. There are people who make people uncomfortable by taking pictures whenever I go to exhibitions, but these things were well controlled, so I could concentrate on watching. I recommend using public transportation as much as possible!! It's very hard to park on weekends."
everlsk,5,1002,한가람 미술관 예술의 전당에 있는 한가람 미술관. 재미난 전시들이 연중 꾸준히 이어지는 멋진 곳입니다. 겨울에는 바로 옆에 스케이트 장도 오픈하니 아이들과 함께 가기에도 좋습니다.,"Hangaram Art Museum. Hangaram Art Museum in the Seoul Arts Center. It's a great place where fun exhibitions continue throughout the year. In winter, there is also a skating rink right next to it, so it is good to go with children."
sdc0503,4,1002,"한국 문화예술의 요람 거의 매일 클래식 콘서트와 전시회가 열리고 있으며 다양한 카페와 레스토랑들이 위치하고 있어서 연인,가족들끼리 나들이 오기에도 훌륭한 곳입니다. 다만 출차시 공연 종료시간은 피하시는게 좋습니다. 출차하는데만 30분넘게 걸립니다.","Classic concerts and exhibitions are held almost every day, and various cafes and restaurants are located, making it a great place for couples and families to go out. However, you'd better avoid the end of the performance when you leave. It takes more than 30 minutes just to get out."
everlsk,5,1002,예술의 전당 각종 문화공연과 전시가 열리는 예술의 전당. 지하철역에서 걸어가기에는 거리가 있기에 마을버스를 이용하면 접근이 편리합니다.,"Seoul Arts Center. Seoul Arts Center, where various cultural performances and exhibitions are held. There is a street to walk from the subway station, so it is convenient to use the town bus."
HaileySong,5,1002,좋은 전시 많이 열어주세요^^ 이번에 인상주의 전시 열린다고 해서 가려고요^^ 전에 퓰리쳐사진전에 정말 구름같은 인파에 데어서 좀 걱정이 되긴 하지만 좋은 전시 열어주셔서 감사합니다~,"Please open up a lot of good exhibitions.I'm going to go to an impressionist exhibition. I'm a little worried about the cloud-like crowd before the Pulitzer exhibition, but thank you for opening the exhibition."
Doreen1208,5,1002,"좋은 전시가 많이 열리는 곳 특별전시가 많이 열리는 장소입니다. 국내의 대표적인 미술관 중 하나이며, 방문전에 그 기간에 열리는 전시를 꼭 확인하시고 가세요.","It is a place where there are many good exhibitions and special exhibitions are held a lot of special exhibitions. It is one of the representative art museums in Korea, and make sure to check the exhibition held during that period before your visit."
Doreen1208,5,1002,"서울에서 가볼만한 곳 아주 오래 된 서울의 좋은 문화시설중 하나입니다. 주변환경도 좋고, 따듯한날 잔디밭도 좋습니다.","It is one of the best cultural facilities in Seoul that are very old. The surroundings are good, and the lawn is good on a warm day."
sangyun k,4,1002,"예술의 전당은 기본이겠져 =_= 리뷰 쓰는 것도 이상할 정도로 유명한 곳입니다. 각종 행사가 워낙 많은 곳이라 종종 가는 곳이고, 바로 뒷편으로 우면산은 걸어서 3시간 내외로 서울시 전경이 바라보이는 전망대까지 갔다가 올수있기때문에 상당히 좋은 곳이라 할수 있습니다.","The Seoul Arts Center must be basic. It is strangely famous for writing reviews. There are so many events, so I often go there. Umyeonsan Mountain is a nice place because you can go to the observatory where you can see the view of Seoul for about 3 hours on foot."
갓천재,5,1002,한가람 미술관! 예술의 전당 내부에 있다. 나는 예술의 전당을 간다고 하면 한가람 미술관에 간다고 할 수 있을 정도로 여기를 가는 용도로 예술의 전당을 이용했다. 미술전시회 중에 가장 수준이 높은 곳이 이 곳이 아닌가 싶다.,Hangaram Museum of Art! It's inside the Seoul Arts Center. I used the Seoul Arts Center to go to the Hangaram Art Museum. I think this place is the highest quality art exhibition.
다님,4,1002,"아쉬움이 남아요 예전에는 서울에 좋은 건축이 별로 없으니까 여기도 정말 좋게 느껴졌지만 이제는 서울을 대표하는 미술관 수준에 많이 부족한 것 같아요. 낡기도 했고 건축도 아름답지 않아요. 예술의 전당 위치가 좋기는 하지만, 주차요금은 너무 비싸고 대중교통 접근도 마을버스로 갈아타야 되는 등 떨어지고요. 입장료 많이 받는 대형전시는 많이 유치하고 관람객들로 넘쳐나지만 수준높은 미술관인가 자체 콜렉션이 있는가 생각하면 많이 부족하죠. 아트샵도 맨날 똑같고 변화를 좀 꾀했으면 하네요","It's a shame. In the past, there weren't many good buildings in Seoul, so this place felt really good, but now it's not enough to be the representative art museum in Seoul. It's old and the architecture is not beautiful. Although the location of the Seoul Arts Center is good, parking fees are too high and public transportation access is also falling, such as changing to a town bus. Large exhibitions that charge a lot of entrance fees are very attractive and overflowing with visitors, but if you think about whether it's a high-quality art museum or its own collection, it's not enough. Art shops are always the same, and I'd like to make some changes."
Perception0,4,1002,"깔끔한 시설, 수준높은 프로그램 깔끔한 시설, 수준높은 프로그램. 무엇보다도 공연관람편의가 다른곳보다 월등히 뛰어나서 관람객 입장에서는 선호하는 곳임. 그러나 대중교통이 다소 불편한 편이고, 주차공간도 넓은 편은 아님.","Clean facilities, high-quality programs, high-quality programs. Above all, the performance convenience is far superior to other places, so it is a preferred place for visitors. However, public transportation is a bit inconvenient and parking space is not large."
blissso,4,1002,서울에 있는 미술관 중 가볼만한 미술관 입니다 서울에 있는 미술관 중 가볼만한 미술관 입니다. 특히 그림쪽이 잘들어오는 것 같아요 위치도 데이트하기 좋은 장소에 있습니다,It is a good museum to visit among the museums in Seoul. It is a good museum to visit among art museums in Seoul. I think I'm especially good at drawing. We're in a good place to go on a date.
mister1207,5,1002,"공연보러 갈때면 1순위 선택지. 예술의전당 공연을자주가게되어 나에겐 익숙하고 좋은곳.. 특히 봄,가을에 가면 좋은것은 야외 테이블있는곳에서 커피한잔마시고 음악분수 즐기기에도 좋습니다.","When you go to a concert, it's your number one option. I am used to performing at the Seoul Arts Center often, and it is a good place for me. Especially in spring and fall, it is good to drink a cup of coffee at an outdoor table and enjoy the music fountain."
reverb83,2,1002,접근성 부족 개관 후에 심도깊은 관리나 전시가 이루어지는 곳이라 할 수 없음 급조해서 만든 배경이 그대로 유지된다고 생각함,Lack of accessibility is not a place where in-depth management or exhibition takes place after the opening of the exhibition. I believe that the background created in a hurry will remain the same.
reverb83,2,1002,접근성이 그다지 특별히 집념어린 공간이라기 보다는 그들만의 리그적 취향이 강한 곳이라는 개인적 의견임 번잡할 수도 있으니 그다지 추천은 안함,"It's not a particularly focused place for accessibility, it's a personal opinion that it's a place with strong league tastes, so I don't recommend it very much."
renahoony,5,1002,여러가지 공연과 전시를 보러갈때 최고예요! 일단 뮤지컬볼때 좌석간 단차가 좋고 간격이 좋아 자주 찾게 되는 곳이예요~ 자리가 불편하면 뮤지컬이 아무리 재밌어도 지루해지기 마련인데 예술의 전당에서는 몰입해서 볼 수 있어 좋아요! 이번에 공연하는 베르테르도 내리기전에 꼭 보러가고싶어요~ 그리고 전시회 때문에도 몇번 방문했는데 널찍널찍해서 좋고 로비쪽에 앉을 수 있는 공간도 있어서 좋아요! 전시 보다보면 다리 아파서 앉고 싶은데 앉을 의자가 있으니 전시 다보고 쉬었다가기 좋더라구요~ :),"It's the best when you go to see various performances and exhibitions! First of all, when I watch musicals, I visit this place often because there's a good gap between seats and the space. If the seats are uncomfortable, no matter how fun the musical is, it gets boring, but at the Seoul Arts Center, you can immerse yourself in it and watch it. It's good! I really want to go see Werther before I get off. And I've visited several times for the exhibition, and it's nice because it's spacious and there's a space to sit in the lobby! When I watch the exhibition, I want to sit down because my legs hurt, but there is a chair to sit on, so it's good to take a rest after the exhibition."
Rocket416,4,1002,"고품격 문화생활 1,2,3층으로 이루어진 공연장은 무대에서 울려퍼지는 소리가 잘 모아지도록 설계된 듯한 느낌이었습니다. 3층이라 무대에 있는 사람들의 생김새는 잘 보이진 않았지만, 좋은 음향덕택에! 좋은 연주를 감명깊게 들을수 있었습니다. 벅찬 감동을 안겨주었던 음악회가 그립네요","The concert hall, which consists of the first, second and third floors of high-quality cultural life, seemed to be designed to collect the sound that resonated on the stage. It's the third floor, so I can't really see the people on stage, but thanks to the good sound! I was impressed by the good performance. I miss the concert that touched my heart."
종대리,4,1002,예술의 전당 음악회 서울에 있는 몇 안되는 문화공간인 이 곳은 접근성이 뛰어나고 근처에 많은 식당이 자리잡고 있으며 강남도 쉽게 접근할 수 있다. 주위 조경도 좋은 편이다. 그러나 주차시설이 오래되어 개선이 필요하다.,"The Seoul Arts Center Concert, one of the few cultural spaces in Seoul, has excellent accessibility, many restaurants nearby, and is easily accessible to Gangnam. The surrounding landscape is also good. However, parking facilities are old and need improvement."
774nan,4,1002,어느 누구나 쉽게 참관할 수 있는 미술관.. 매번 다른 아이템의 전시회가 열리는 고 퀄리티의 미술관.. 어느누구나 쉽게 참관할 수 있는 곳이다.,"An art gallery where anyone can easily see. High-quality art museum, where exhibitions of different items are held every time. It is an easy place for anyone to observe."
haeaaa,4,1002,문화의날~ 팁을 드리자면 매월 마지막주 수요일이 문화의날로 지정되어있어서 저렴한 가격으로 전시를 관람할수 있습니다.! 저렴하게 볼수 있는 만큼 사람이 정말 많아요 ㅠㅠㅠ 문화의날 가시려면 일찍일찍 가세요!!!,"Culture Day~ To give you a tip, the last Wednesday of every month is designated as Culture Day, so you can watch the exhibition at a low price! There are so many people as much as you can see cheaply. If you want to go to Culture Day, go early!!!"
staycalm2015,5,1002,"하루 나들이로 충분히 좋아요 가족 나들이, 하루 나들이로 충분히 좋아요. 여름엔 분수가 겨울에 스케이트장도 있어서 애들 놀기에 좋구요. 봄 가을이 확실히 더 평화로운 느낌을 줘서 좋아요.","It's good enough for a one-day outing. A family outing, a one-day outing is good enough. In summer, the fountain has a skating rink in winter, so it's good for kids to play. I like spring and fall because they definitely give me a more peaceful feeling."
냥냥이1004,5,1002,고품격공연 얼마전 오페라공연을 가족들과 함계 갔는데 역시나 3층으로된 건물에 자막까지 영상의 3층에 멀리있어도 보이는 전망에 놀랏습니다,"Not long ago, I went to the opera concert with my family and I was surprised to see the view even if I was far away from the 3rd floor of the video to the 3rd floor of the building and subtitles."
미리뽕뽕,5,1002,좋습니다. 공연보러 종종가는데 좋아요 차가 많이 막혀서 대중교통을 이용하는게 더 편할 것 같고 날씨좋을때 주변 둘러보기도 좋은것같아요,"Good. I often go to see performances. There's a lot of traffic, so it's easier to use public transportation, and it's better to look around when the weather is nice."
seoulyoung,5,1002,"예술의 전당 공연이나 전시장을 꼭 안 가더라도 산보가듯 들리면 좋습니다. 자가용을 타고가면 남부순환로에서 바로 들어가면 되고, 지하철로는 남부터미널역에서 내리면 되고 마을버스도 많습니다. 여름에는 반짝거리는 분수 공연도 볼 수 있습니다.","Even if you don't go to the Seoul Arts Center or the exhibition hall, it's good to sound like a walk. If you take a car, you can go straight to Nambu Expressway, and you can get off at Nambu Terminal Station by subway, and there are many village buses. In summer, you can also see sparkling fountain performances."
궁디팡팡,2,1002,너무 시끄럽네요 아이들 우는소리. 뛰는 아이들. 휴대폰 벨소리. 떠드는 아이. 애들 천지 입니다. 조용히 관람할만한 장소가 못됩니다.,It's too loud. The sound of children crying. running children Cell phone ringtone. a noisy child Children are everywhere. It's not a place to watch quietly.
