u_id,u_rate,p_id,review,review_en
Juhyeong_Jeong,5,1002,"다양한 문화예술 컨텐츠를 통해 영감을 얻을 수 있는 곳. 오페라, 클래식 연주, 전시 등 다양한 문화예술 작품을 만나 볼 수 있는 곳. 연중 계속 되는 공연과 다양한 전시 프로그램으로 자주 가도 질리지 않는 곳. 레스토랑과 휴식공간, 아트샵 등 부대시설도 있어 정말 하루 종일 머무를 수도 있는 곳입니다. 자주 갈 수 있다면 멤버쉽 가입을 통해 정기적으로 정보도 제공받을 수 있고 할인 혜택도 받을 수 있습니다.","A place where you can get inspiration from various cultural and artistic contents. A place where visitors can see various cultural and artistic works such as opera, classical music, and exhibition. A place where you don't get tired of frequent performances and various exhibition programs throughout the year. There are restaurants, rest areas, art shops, and other facilities, so you can stay all day. If you can go there often, you can get information regularly and get discounts through membership."
아무야,4,1002,전시회 구경가요 다양한 공연과 전시회가 있는 예술의 전당. 1층에는 커피숍과 음식점도 있어요. 가족들과 또는 친구들이 나들이 가기 좋은거 같아용,Let's go to the exhibition. Seoul Arts Center with various performances and exhibitions. There are also coffee shops and restaurants on the first floor. I think it's good for family or friends to go out.
딸기야,5,1002,한가람 이 한가람 미술관은 여러종류의 미술ㄷ글을 한곳에서 여러가지의 에술을 좀더 가까이 이해할수 있는 곳입니다,Hangaram Museum of Art is a place where you can understand various kinds of art in one place.
딸기야,5,1002,에술의 전당 이 예술의전당은 우리나라의 뮤지컬 클랙식 다양한 모든 콘텐츠를 다방면 이해하고 즐기실수 있는 곳 입니다,Hall of Arts This Seoul Arts Center is a place where you can understand and enjoy various contents of Korean musical Clack.
skfdkfkt1,5,1002,늘 가고 싶은 곳- 한가람 미술관 자주 가는 곳. 최근에는 모딜리아니 전시회를 갔지요. 일층에 보관함에 짐을 넣고 편안하게 다니면서 관람합니다.,Where I always want to go - where I often go to the Hangaram Art Museum. I recently went to the Modigliani exhibition. Put your luggage in the storage box on the first floor and watch comfortably.
darkjedi73,4,1002,"문화의 향기 예술의 전당은 각종 공연장과 연습장이 모여 있는 곳이다. 그곳에서 문화의 향기를 즐기고, 여가의 시간을 보내는 것은 선택받은 자의 느낌을 남긴다. 가끔 일부러라도 찾아가면 좋은 곳이다.","The Scent of Culture Art Center is a place where various performance halls and practice halls are gathered. Enjoying the scent of culture there, and spending leisure time leave a feeling of the chosen one. Sometimes it's a good place to visit on purpose."
alice,3,1002,쾌적하고 좋아요 가끔 미술관가서 그림보면서 지쳤던 심신을 달래곤 합니다. 휴가내고 평일에 잠깐 들르면 사람도 많이 없고 좋더라구요,It's pleasant and nice. Sometimes I go to the art museum and see paintings to soothe my tired mind and body. It's nice to stop by on weekdays after a vacation and there's not much people.
DMSTMD,5,1002,넓은 또 작은 공간 공연 전시 두루 두루 볼 수 있고 또 광장에서 즐길수 있는곳 ㅡㅡ 모자르트의 음식점 맛있었다.,"A wide space, small space, performance exhibitions, and a place to enjoy in the square -- the restaurant in Mottes was delicious."
DMSTMD,5,1002,"키아 키아, 몬델리아 간만에 여유가 있었다. 어렸을때 동생 방에 있던 목긴 여성의 그림이 몬델리아의 그림있었다, 감회가ㅡㅡ","Kia Kia, Mondelia, had some time to relax. When I was a kid, there was a picture of a woman with a neck in her brother's room, and it was a painting of a Mondelia."
ECU_TANTALLHOTE,5,1002,언제나 일정수준 이상의 전시회가 있는 모딜리아니전을 하고 있는 한가람 미술관... 주말 오전 우면산으로 방향을 잡고 2층에 있는 카페에서 에스프레소 한잔을 마신후 4층 모딜리아니전을 관람하는 작은 여유가 삶을 더욱 풍요롭게 해준다. 4층의 모딜리아니전의 관람이 끝나고 그냥가기 아쉽다면 3층에 있는 키아 환상과 신화전을 관람하는 것도 주말을 잘 보내는 방법중 하나이다.,"The Hangaram Museum of Art is always holding a Modigliani exhibition with more than a certain level of exhibitions. On the weekend morning, the small leisure of drinking a cup of espresso at the cafe on the second floor and watching the Modigliani exhibition on the fourth floor enrich your life. If you don't want to leave after the Modigliani exhibition on the fourth floor, watching the Kia Fantasy and Shinhwa exhibition on the third floor is one of the ways to spend the weekend well."
fortunepicker,5,1002,야간 분수 쇼를 볼 수 있는 장소 음악회나 전시회를 언제나 볼 수 있고 산책하기엔 더할 나위 없이 좋은 선택! 대중교통으로는 셔틀버스가 운행중이며 카페나 레스토랑도 가능함,A place to watch night fountain shows You can always see concerts or exhibitions and make the best choice to take a walk! Shuttle buses are running on public transportation and cafes and restaurants are available.
효영심,5,1002,"연인, 가족, 아이들과 함께 시간보내기 좋은 곳! 연인, 가족, 아이들과 함께 시간보내기 좋은 곳! 좋은 공연 이나 전시회 뿐아니라 가족과 함께 야외 분수대와 시간을 보내기 좋습니다. 교통은 버스로 타거나 자가용 이용시 막힐 수 있어서 약간 번거로움.","A good place to spend time with lovers, family and children! A good place to spend time with lovers, family and children! It is good to spend time with your family with outdoor fountains as well as good performances and exhibitions. Traffic can be a bit cumbersome because you can get stuck by bus or car."
ecolove7,4,1002,"다양한 문화 예술이 펼쳐지는 예술의 전당,, 도심에 인접하여 접근성이 훌륭합니다. 공연, 전시 등 다양한 문화, 예술작품을 접할 수 있는 서울의 핫플레이스죠..","The Seoul Arts Center, a center of diverse cultural arts, has excellent access to the city center. It is a hot place in Seoul where you can see various cultural and artistic works such as performances and exhibitions."
JSMY77,5,1002,미술전시 및 뮤지컬까지 다양해요 명성황후 관람하고 왔어요 가곡의 밤 행사해서 좋은 음악까지 덤으로 들었네요. 산책하기도 좋고 가족 연인과 함께 하기 좋아요,Art exhibitions and musicals. See Empress Myeongseong and I'm here. You even listened to good music at the singing night event. It's good to take a walk and be with family lovers.
2875rosa,4,1002,머리를 식히고 싶을때 방문하면 좋아요 공연이나 전시회 등 문화 예술을 접할수 있는 장소입니다. 카페나 휴게실도 같이 있어요 ㅎㅎ,It's good to visit when you want to cool your head. It is a place where you can experience culture and art such as performances and exhibitions. There's a cafe and a lounge. Haha
날아라오리,5,1002,"도심속 친환경문화공간 문화와 휴식을 모두 즐길수있는 도심속 오아시스, 편의점부터 레스토랑까지 있어 주머니사정에 맞는 요기도 가능.","There is an oasis in the city where you can enjoy both culture and relaxation in the eco-friendly cultural space of the city, from convenience stores to restaurants, so you can enjoy the food that suits your pocket situation."
Inho_Ryan_JEONG,5,1002,"도심속에서 즐기는 수준있는, 하지만 부담없는 휴식! 저에게는 추억이 많은 장소입니다. 세계음악분수라는 볼거리가 있고, 또 괜찮은 까페들과 야외 테라스에 앉아서 먹기좋은 레스토랑도 있구요. 도심 속에 이런 공간이 있다는게 참 좋은거 같아요. 오페라극장, 음악당등에서 열리는 공연을 꼭 돈내고 보지 않아도 이렇게 공간을 함께 구경하는것만으로도 수준있고 즐거운 데이트가 되지 않을까 생각되네요.^^","A decent, but light rest in the city center! It's a place where I have a lot of memories. There's a place called the World Music Fountain, and there's a nice cafe and a nice restaurant to sit on the outdoor terrace. I think it's nice to have a place like this in the city center. Even if you don't have to pay to watch performances held at opera theaters and music halls, just looking around the space will be a good and enjoyable date.^^"
icehoneywater,5,1002,몬주익 못지 않은 예술의 전당 분수쇼 초가을의 분수쇼는 예술적입니다. 음악과 분수가 잘 어우러지며 시원한 산바람을 맞으며 저녁 한때를 보내기 좋습니다. 잔디밭에 돗자리를 깔고 앉아도 되고 아이들이 뛰어다니며 음악과 분수쇼에 맞추어 춤추고 노는 모습을 보는 것 만으로도 힐링이 됩니다.,Seoul Arts Center's fountain show early autumn is as artistic as Monjuik. It's good to spend the evening in a cool mountain breeze with music and fountains. You can sit on a mat on the grass or just watch the children run around and dance to music and fountain shows.
RaaaaaY,4,1002,전시의 메카! 전시의 메카! 작고 큰 좋은 전시가 항상 열리고 있습니다. 워낙 유명한 전시들이 많아서 주말과 방학 때면 좀 너무 붐비는 감이 없진 않지만 오전이나 평일에 가면 그래도 좋은 환경에서 많은 작품들을 감상할 수 있습니다.,"The Mecca of Exhibition! The Mecca of Exhibition! There are always good small and big exhibitions. There are so many famous exhibitions that it feels a bit crowded on weekends and vacations, but if you go in the morning or on weekdays, you can still enjoy many works in a good environment."
RaaaaaY,4,1002,"한국 공연의 메카! 공연의 메카! 뮤지컬, 연극, 클래식 공연에 세계적인 전시회까지 각종 문화 행사를 한 번에 만나 볼 수 있는 그야말로 문화의 중심지입니다.","Mecca of Korean performances! Mecca of performances! It is a cultural center where you can see various cultural events, including musicals, plays, and classical performances, as well as world-class exhibitions."
lucykim27,4,1002,다양한 전시회 전시회가 항상 볼 만한 것을이 열려서 기분이 좋다. 입장료는 조금 비싼편. 사람이 많은 대형전시 위주라 조용하게 관람하기는 어려운편.,I'm happy that various exhibitions are always open. Admission is a little expensive. It is difficult to watch quietly because it is mainly focused on large-scale exhibitions.
포비왕,5,1002,"서울에 살기 가장 좋은 기분을 낳게 하는 예술의 전당! 항상 클래식을 접할려면 여기만한 곳이 없습니다. 여유있는 서울생활을 느끼게 해 줄수 있고, 주말에는 야외에서도 가끔 공연을 해서 가족들과 여유있는 산책도 가끔할 수 있는 좋은 곳 입니다.","Seoul Arts Center gives you the best feeling to live in Seoul! There's no place like this to always have access to classical music. It can make you feel relaxed in Seoul, and it is a good place to take a walk with your family sometimes because you can perform outdoors on weekends."
sabina1028,5,1002,서울의 유명 전시회 장소 일년 중에 많게는 세 개 정도의 큰 전시회가 있습니다. 대부분 유료 전시회지만 서울에서 큰 전시가 열리는 몇 안 되는 곳이기도 합니다.,"Seoul's famous exhibition place. There are as many as three large exhibitions in the year. Most of them are paid exhibitions, but they are one of the few places where big exhibitions are held in Seoul."
irulsuga,4,1002,퓰리처상 사진전 좋았어요. 전시관이 좀 작은 감은 있지만 그래도 다양한 전시가 열리니까 좋아요. 가장 최근 방문은 좀 오래된 듯 싶지만 퓰리처상 사진전이었는데 전에 봤던 사진들이 중복된 것들이 꽤 있더라구요. 보도사진은 어쩔 수 없는건가 싶기도 하지만 그건 아쉬웠어요. 그래도 갈 때마다 설레는 공간입니다.,"I liked the Pulitzer Prize photo exhibition. The exhibition hall is a bit small, but it's nice to have various exhibitions. The most recent visit seems a little old, but it was a Pulitzer Prize photo exhibition, and there were quite a few duplicates of the previous photos. I'm afraid there's nothing I can do about the press photo, but it's a shame. But it's a place that makes my heart flutter every time I go."
jen3247,2,1002,위치 및 동선이 불편 공연 보러 혹은 분수쇼 보러 가는 곳인데 위치적으로도 불편하고... 건물 내부 안에서 움직일때도 동선이 꽤 불편하네요 ㅠㅠ,"It's a place where you go to see a performance or a fountain show, but it's also inconvenient... It's pretty uncomfortable to move around inside the building. ᅲᅲ"
irulsuga,5,1002,우리나라엔 많지 않은 분수쇼! 물론 마카오나 라스베가스의 호텔들과는 비교도 안되지만 예술의 전당에도 작고 귀여운 분수가 있어요. 조촐하지만 음악에 맞춰 춤을 추기도 하고요. 쉬는 날에 가끔 가보면 아이들 데리고 오신 부모님들도 많이 있지요. 시원한 산바람도 불고 저녁으로 넘어가면서 하늘빛도 예쁜 것이 제법 괜찮은 휴식처에요. 분수 옆 레스토랑 모짜르트에서 따끈하고 고소한 호박스프도 한그릇 하시면 더 좋고요.,"Not many fountain shows in our country! Of course, it's not comparable to hotels in Macau or Las Vegas, but the Seoul Arts Center also has a small and cute fountain. It's simple, but I also dance to the music. There are many parents who brought their children when I go there on holidays. The cool mountain breeze and the beautiful sky is a good place to rest. It's better to have a bowl of hot and savory Hobakf at Mozart, the restaurant next to the fountain."
giutaek,4,1002,앤디워홀 전시회 미술관에선 늘 새로운 전시들이 기획되고 있습니다. 지리적으로도 교통이 편리하며 다만 주차장이 조금 협소합니다.,"New exhibitions are always being planned at the Andy Warhol Museum of Art. It is also geographically convenient, but the parking lot is a little small."
giutaek,3,1002,문화예술 공간 한국을 대표하는 예술의 공간으로 다양한 문화예술 전시 공연 공간입니다. 파우스트 공연을 보았는데 참 좋았습니다.,Culture and Arts Space It is a space of art representing Korea and is a space of various cultural arts exhibitions and performances. I saw the Faust performance and it was great.
Lauralee627,5,1002,예술을 즐기고 싶다면 이곳으로. 여러가지 문화행사를 체험하고 관람할 수 있는 곳! 한국에서 손꼽히는 문화/예술의 장이죠! 강북 지역에는 세종문화회관이 있다면 강남 지역에는 예술의 전당이 있다! 미술 전시부터 뮤지컬까지. 다양한 컨텐츠를 즐길 수 있습니다! :),"If you want to enjoy art, come here. A place where you can experience and see various cultural events! It is one of Korea's leading cultural/art fields! If there is Sejong Center for the Performing Arts in Gangbuk, there is Seoul Arts Center in Gangnam! From art exhibitions to musicals. Enjoy a variety of content! :)"
하얀마음,4,1002,뮤지컬보고 왔어요 뮤지컬때문에 처음 가봤었어요~ 내부도 엄청 크고 깔끔하고 공연장도 다른데보다 넓어요~ 대신 너무 넓어서 배우분들 보러 가시는거면 힘드실거에요 ㅎㅎ,"I saw the musical. It was my first time going to a musical. The inside is really big and clean, and the concert hall is wider than other venues. But it's too big to go see the actors. Haha"
eoto34,5,1002,좋아요 촤고!! 다들 알다시피 최고의 미술관 이아니가하는생각이네요 아주휼륭합니다 !! 아직안가보신분있다면 함번가보세요 정말좋아요,"All right, let's go! As you all know, it's the best art museum, Lee Ani. It's great! If you haven't been there yet, go there together. I love it."
eoto34,5,1002,너무좋아요 괜찬아요! 너무너무 좋아요!!! 아이와함께 했는데 공간도 크고 좋아요 !!! 또한번 다시 찾아가고싶네요,"I love it! I love it! I love it!!! I did it with my child, and the space is big and nice! I'd like to visit you again."
이안팍,5,1002,음악분수 짱 음악분수가 참 좋아요 특히 밤에요 무용 연습하시는 분도 볼 수 있었고요 가면 마음이 편해지는 장소입니다,"The music fountain is the best. The music fountain is very good. Especially at night, I could see people practicing dance, and it's a place where I can relax."
도도아빠,5,1002,예술의 전당 산책 지갑 열지 않고도 문화를 자유롭게 즐길수 있는 곳 가족들과 가끔 갈때 없으면 여기 산책하러 옮니다. 편안하게 산책 하면서 가족들과 대화 나누기에 좋아요~ (분위기가 굿),"A place where I can enjoy culture freely without opening my wallet at the Seoul Arts Center. If I don't go sometimes, I go for a walk here. It's good to take a walk and talk to your family."
sumi8816,5,1002,좋아요 거리도 괜찮고 시설도 좋고 가끔 들리는 한가람미술관 . 대체적으로 미술관 느낌 그대로입니다,"All right, the streets, the facilities, the Hangaram Museum of Art, which you can see from time to time, is basically the same as the museum itself."
궁디팡팡,5,1002,예술의 전당 공연을 보러 자주 가곤합니다. 요즘 전시 풍년인듯. 근데 주변에 차가 막히면 답이 없네요. 대중교통 이용하는 것도 좋은 방법인듯요.,0I often go to the Seoul Arts Center to see performances.It seems to be a good harvest these days.But there's no answer if there's traffic around.I think it's a good idea to use public transportation.
궁디팡팡,4,1002,"보테르 전 페르난도보테르 전을 보러 다녀왔어요, 주말에는 아이들도 많고 정신 없더라구요. 한적하게 평일에 가면 여유롭고 조용히 즐길 수 있을 듯 합니다.","Bauter, I went to see Fernando Botter, and on weekends I had a lot of kids and a lot of stuff. If I go on a quiet weekday, I think I can relax and enjoy it quietly."
sumi8816,5,1002,좋아요 회사근처이며 전시회 구경하러 종종들리는 예술의 전당. 깨끗하며 기본 시설이 잘 되어 있어서 만족합니다.,"All right. Near the company, Seoul Arts Center, where people often come to see exhibitions. I'm satisfied because it's clean and has good basic facilities."
동양동의별,5,1002,감동이있는 사진전 제나할러웨이 사진전을 보고왔습니다. 감동이있는 사진들을 많이 보고왔습니다. 한번씩들 꼭 가보세요 후회하지않습니다.,"I saw the moving photo exhibition, Jenna Halloway photo exhibition. I saw a lot of touching pictures. Make sure you go there once in a while. I don't regret it."
동양동의별,5,1002,"너무나멋진 공연장소 시설면에서도 단연 좋다고 할수있습니다. 오페라 하우스, 음악당, 미술관, 서예관, 예술자료관, 야외극장너무좋은거같아요 누구든적극추천합니다.","It's definitely good in terms of great performance facilities. Opera house, music hall, art museum, calligraphy museum, art museum, outdoor theater are so nice. I recommend anyone to be positive."
주연 오,4,1002,예술을 알고 싶거든예술의 전당으로 예술을 느낄 수 있고 보고 하는 우리나라의 제일 좋은 명소.날씨에 상관없이 공연이나 미술관람을 할 수 있는곳,"If you want to know about art, you can feel art as a hall of art and see the best place in Korea.A place where you can perform or watch art regardless of the weather."
톰블리,5,1002,문화와 예술의 중심 다양한 문화생활을 할수 있는공간이 마련되어있다. 저녁때 잠시 나와서 이런걸 볼수있다니... 처음으로 서울사람들이 부러웠다. 집에서 가까운거리가 아님에도 불구하고 종종 가고싶어지는 곳!,"There is a space for various cultural life centered on culture and art. I can't believe I can come out and see this in the evening. For the first time, I envied the people of Seoul. Even though it's not close to home, I often want to go there!"
톰블리,5,1002,한가람 미술관!! zena holloway 의 사진전을 보기위해 처음 방문했다. 대중교통을 이용해 가기도 수월하고 내용도 알차 좋은 경험이 되었다.,Hangaram Museum of Art!! I visited for the first time to see a photo exhibition of Jena Holloway. It was easy to use public transportation and it was a great experience.
bahajia,4,1002,"대가들의 전시가 많이 열리는 미술관 주로 유명한 작가들의 전시를 많이 하는 곳, 물품 보관소가 있어 가벼운 어깨로 관람할 수 있어서 좋음","The museum, where many masterpieces are exhibited, is usually a place where many famous artists are exhibited, and there is a store for items, so it is good to see with light shoulders."
bahajia,4,1002,"음악분수와 맛있는 커피가 있는 예술의전당 좋은 공연도 많이 하고, 공연을 보지 않아도 산책하기 좋은 곳. 음악분수 시간에 맞춰 가면 더욱 좋고 근처 카페의 비엔나 커피가 유명함.","The Seoul Arts Center, which has a musical fountain and delicious coffee, has many good performances, and is a good place to take a walk without having to watch the performance. It's better to go on time for the music fountain and Vienna coffee at a nearby cafe is famous."
mkla1004,3,1002,공연보기엔 좋아요 국악공원을 해서 가봤는데 . 마을버스가 앞까지 가서 교통은 괜찮았어요 . 조금만 내려가면 예술의전당도 있고 산책해도 괜찮아요 .,"It's good for a show. I went to the Gugak Park. The traffic was fine because the town bus went to the front. If you go down a little bit, there is Seoul Arts Center and you can take a walk."
mkla1004,3,1002,도심의 문화생활 교통편이 좀 불편하긴 하지만 지하철에서 조금 걸어가면 되요 . 1층카페는 매우 복잡하지만 위에 올라가면 밖에서 차를 마실수도 있고 괜찮아요 .,"The cultural life transportation in the city center is a little inconvenient, but you can walk a little bit from the subway. The cafe on the first floor is very complicated, but if you go upstairs, you can drink tea outside."
ddneverland,5,1002,"쾌적하고 관람이 편한 예술의 전당 좋습니다. 전시회가 열릴때마다 가끔 찾는 예술의 전당, 한가하고 쾌적한 시설이어서 여러모로 문화생활 즐기기에 좋아요.","The Seoul Arts Center, which is pleasant and comfortable to watch, is nice. The Seoul Arts Center is a leisurely and pleasant facility that I visit every time an exhibition is held, so it is good for enjoying cultural life in many ways."
nalbee,4,1002,예술의전당 방문 예술의 전당 은 서울의 대표적인 공연장 입니다 규모면에선 제일 큰것 같아요 종종 관람차 방문합니다,Seoul Arts Center Visiting Seoul Arts Center is a representative concert hall in Seoul. I think it's the biggest one on the scale. I often visit the Ferris wheel.
2jin,5,1002,좋은 공연이 많이 있는 곳 주말에 좋은 공연이 많이 있어요 ~ 미리 예매하고 오셔야 좋은 공연을 볼수 있어요 그냥 산책하기에도 좋은곳,There are many good performances. There are many good performances on weekends. You have to book in advance to see a good performance. A good place to just take a walk.
2jin,4,1002,예술을 좋아하는분들께 추천 예술을 좋아하는 분들께 추천하지만 대중적인 곳은 아니에요~ 유명한 전시나 작품이 있는건 아니지만 천천히 즐기기엔 좋아요,"I recommend it to people who like art. I recommend it to people who like art, but it's not a popular place. I don't have any famous exhibits or works, but they're good for slow enjoyment."
JUNE_HEE,5,1002,우리나라 전시의 대표적인 이 곳 무더위 시원한 음악분수와 함께해요 경쾌한 음악에 맞춰 변화하는 분수를 보고 미술관에서 아름다운 작품도 감상하고 일석이조,"Let's go to this hot and cool fountain of music which is the representative place of Korea's exhibition. Watching the changing fountain with cheerful music, enjoying beautiful works at the museum, killing two birds with one stone"
JUNE_HEE,5,1002,음악분수와 함께하는 예술의 전당 무더위 시원한 음악분수와 함께해요 경쾌한 음악에 맞춰 변화하는 분수를 보며 얼마 안남은 무더위지만 시원하게 보낼 수 있어요,"Seoul Arts Center with Music Fountain Let's Stay With Cool Music Fountain It's hot soon, but you can stay cool while watching the changing fountain with cheerful music."
chunglang,4,1002,시원한 음악분수 꼭 공연을 관람하지 않더라도 음악당 옆에 있는 음악분수대를 보는것 만으로도 시원한 여름을 보낼수 있어요^^,"Even if you don't watch the performance, you can spend a cool summer just by watching the music fountain next to the music hall.^^"
