u_id,u_rate,p_id,review,review_en
래비니아,5,1002,모든 예술이 한자리에 예술을 좋아하는 사람이라면 언제 가도 전시와 공연을 만날 수 있어요. 미술영재교육기관도 함께 하기에 수준이 높은 곳이죠. 저는 미술전시와 발레공연과 음악공연으로 자주 가기에 영혼의 쉼터같아요.,"If you like art in one place, you can always see exhibitions and performances. It's a high-quality place for art gifted and talented education institutions to join. I often go to art exhibitions, ballet performances, and music performances, so it's like a resting place for the soul."
별일 별,5,1002,그야말로 예술의 전당 뮤지컬부터 세계의 유명한 전시회를 한국에서 편히 볼 수 있어서 좋아요. 지금은 툴루즈 전과 세잔에서부터 모네까지 등을 하고 있어요. 많은 좋은 기회들을 얻을 수 있는 소중한 곳입니다.,It's really nice to see the musical of the Seoul Arts Center and the world's famous exhibitions in Korea. Now I'm doing Toulouse's ex-convict from Cezanne to Monet. It's a precious place to get many good opportunities.
MW Yeon,4,1002,뮤지컬 빅피쉬 연말 마지막밤 방문함. 사당 IC에서 정체는 극악이었지만 공연으로 맘을 다스림. CJ 토월극장 이용함. 규모는 예상보다 아담했음. 외부는 멋짐.,"Visiting musical Big Fish at the end of the year-end. At Sadang IC, the identity was a terrible evil, but he controlled his mind by performing. Use CJ Towol Theater. Size was smaller than expected. Exterior beauty."
ahirity,4,1002,"문화공연하기 좋은 장소입니다. 강남지역에 위치한 예술의 전당입니다. 전시회, 연극, 뮤지컬 등 다채로운 문화공연을 만날 수 있습니다. 주말에 시민들이 공원나들이 오기도 합니다.","It's a good place for cultural performances. It is the Seoul Arts Center located in Gangnam area. You can see various cultural performances such as exhibitions, plays, and musicals. Citizens come to the park on weekends."
martin.k,5,1002,"대한민국 1등 공연장 항상 다양한 주제를 가진 공연이 있습니다. 뮤지컬, 발레, 오케스트라 등등. 저녁에는 수 많은 불이 점등되어 또 다른 매력을 느낄 수 있습니다.","There is always a performance with a variety of themes at the first place in Korea. Musical, ballet, orchestra, etc. In the evening, a lot of lights are on and you can feel another attraction."
ye0ngjus,3,1002,예술의 전당 여러 음악 예술 공연이 열리는 곳이다. 공연 일정을 홈페이지에서 미리 체크해서 예매를 하고 가는 것을 추천한다. 꽤 규모가 크고 건물 외관만 산책하듯 구경해도 나쁘지 않은 곳이다.,It is the place where various music and art performances are held at the Seoul Arts Center. I recommend you to make a reservation by checking the performance schedule in advance on the website. It is quite large and it is not a bad place to take a walk around the exterior of the building.
김석찬,5,1002,혼자 여행 바쁜 일상에서 문화를 접하고 산다는 것은 어쩌면 평범한 도시인의 사치일 수 있다. 그러나 잠시 짬을 내서 방문하면 기웃거려보는 것만으로 힐링이 된다. 그림 보는 것이 좀 서툴러도 되고 클래식을 좀 이해를 못해도 보고 들어보면서 야외의 계단에 앉아 보기도 하며 커피 한잔을 들고 천천히 걸어 보고 기웃거려봄이 문화인으로 한발짝 다가가는 것이 아닐까. 혼자도 좋고 누군가의 손을 꼭잡고 걸어도 좋고...,"Traveling alone in a busy daily life with culture may be a luxury for ordinary urbanites. However, if you take a moment to visit, just looking around is a healing experience healing. It's okay to be clumsy at painting, or even if you don't understand classical music, you can sit on the stairs outside and listen to it, walk slowly with a cup of coffee, and snoop a step closer to being a cultural figure. You can walk alone, you can walk with someone's hand..."
사장님,4,1002,한 여름 밤의 휴식 예술의 전당에서 저녁 공연 보고나와서 음악 분수대 앞에서 잠시 쉬었다가면 참 여유롭고 좋아요!! 예쁜 음악 선율에 맞춰 컬러플하게 분수대가 춤추는게 또 다른 공연을 보는듯 합니다,"Midsummer Night's Rest. After watching the evening performance at the Seoul Arts Center, take a break in front of the music fountain. It's so relaxing and nice!! It seems like watching another performance where the fountain dances to the beautiful music."
Jyk,4,1002,굿 좋은 전시와 공연이 열리는 곳 전시 뮤지컬 연주회 등 다양한 문화생활에 저녁에는 음악분수까지 즐길 수 있는 도심속 문화공간,"A cultural space in the city where you can enjoy various cultural activities such as a good exhibition and performance, an exhibition, a musical concert, and even a fountain of music in the evening."
triphyun,4,1002,에릭요한슨 전시회보러 ! 예술의전당에서 하는 전시회는 처음 가봤습니다. 겉에는 건물이 커서 내부도 클줄 알았는데 전시관 내부는 좀 협소했습니다. 그래도 전체적으로 깔끔했습니다.,"To see Eric Yohansen's exhibition! I went to the Seoul Arts Center for the first time. I thought the interior would be big because the building was big on the outside, but the interior of the exhibition hall was a bit small. But overall, it was neat."
ahirity,4,1002,"산책, 공연관련, 전시회 목적으로 방문하기 좋은 곳 산책, 공연관련, 전시회 목적으로 방문하기 좋은 곳입니다. 주말에 방문하는 사람들이 많습니다. 지하철역에서 버스 혹은 도보로 15분이 소요됩니다.","It is a good place to visit for a walk, performance, exhibition, and exhibition. There are many visitors on weekends. It takes 15 minutes by bus or on foot from the subway station."
김도영,5,1002,꽤나 괜찮다 구경하는 느낌으로 가서 쭉 돌아보고 우면산까지 올라 갔습니다. 다양한 공연도하고 여름에는 분수쇼도 하기 때문에 가볼만한 곳입니다. 산책겸 가보세요.,"It's pretty good. I went looking around and went up to Mt. Umyeon. There are various performances and fountain shows in summer, so it's a good place to visit. Go for a walk."
EDGAR.S,2,1002,최악의 연주당 여기는 일단 위치가 왜 이런 곳에 대중적 음악회 장소를 만들었는지 만든 사람 한번 만나보고 싶을 정도로 접근성이 서울 중요 핫스팟 중 최악입니다.,"This is the worst concert hall in Seoul, where I want to meet the person who created the place for the popular concert."
Jieun L,4,1002,뮤지컬 라이온킹관람하고왔어요 전시나공연도다양하고좋아요 지하철역에서도조금만걸으면되고시설도낡은느낌없이좋아요,I watched the musical Lion King. There are various exhibitions and performances. You can walk a little bit from the subway station and the facilities are good.
BYUNG BOK AHN,4,1002,"한가람 미술관에서 에바 앨머슨 전시회 구경 한가람 미술관에서 에바 앨머슨 전시회를 구경했는데, 정말 잘 되어있고, 가격이 저렴했어요. 다만 단점은 음악관쪽으로 주차하면 한참 걸어야 한다는 게 단점입니다.","At Hangaram Museum of Art, I watched the Eva Almerson Exhibition at Hangaram Museum of Art, and it was very well-made and inexpensive. However, the downside is that you have to walk for a long time if you park near the music hall."
KIM Gyunghee,3,1002,"공연 아니면 갈 일이 많지 않아요 공연을 볼 생각이 아니라면 갈 일이 별로 없죠. 길도 많이 막히고요. 건축물도 별로긴 하지만, 가끔 좋은 전시도 해요. (유료무료 관계 없이)","I don't have much to go to unless it's a performance. I don't have much to go unless I'm going to watch the show. There's a lot of traffic. The architecture is not that great, but sometimes there are good exhibitions. (whether paid or not)"
gingertea,5,1002,항상 좋은 전시가 있습니다. 좋은 전시가 많아 꾸준히 방문하는 곳입니다. 대중교통으로는 다소 불편하지만 날씨 좋을 때 걸어가는 길을 좋아합니다. 이 곳에서 하는 전시는 대부분 무조건 좋습니다.,"There is always a good exhibition. It is a place where I visit steadily because there are many good exhibitions. It's a little inconvenient by public transportation, but I like walking when the weather is nice. Most exhibitions here are absolutely good."
snoopy419,4,1002,"나의 문화예술 공간 발레나 피아노 독주회, 오케스트라 연주회 등 많은 공연을 보러 가게 됩니다. 소리전달도 다른 홀에 비해 잘 되어서 듣기 좋고, 발레 공연하는 오페라 극장은 무대장치가 늘 놀랍습니다. 여름, 가을에는 분수쇼나 무료 야외공연들도 있어서 산책삼아 방문하는 것도 추천합니다.","I go to see many performances such as ballet, piano recital, orchestra concert, etc. The sound transmission is better than other halls, and the stage setting is always amazing at the opera theater where ballet performances are performed. In summer and fall, there are fountain shows and free outdoor performances, so I recommend you to take a walk."
walkingwanderer206,3,1002,"탁트인 멋진 공간 수준 높은 좋은 공연을 많이 하는 멋진 건물들이 있는 매력적인 공간이에요. 최근에도 오랜만에 멋진 공연을 봐서 너무 좋았는데요 아쉬웠던 건 앞좌석 왼쪽 사이드에 앉았는데 차라리 뒤에 앉은 것이 나을 정도로 거의 무대가 보이지 않았어요. 그 자리에서만 그런 건지 음향도 좋은 것 같지 않았는데, 공연 보러 갈때 아무리 앞자리라도 왼쪽 사이드 자리는 피하시는 걸 추천드려요.(콘서트홀)","It's a great space with lots of great buildings with high quality performances. It was great to see a great performance in a long time no see. What was unfortunate was that I sat on the left side of the front seat, but I could hardly see the stage so that I would rather sit in the back. I don't think the sound was good either, but I recommend that you avoid the left side seat even if you are in the front seat when you go to the concert."" (Concert Hall)"
seongeun y,4,1002,다양한 공연과 전시를 볼 수 있는 장소 철철마다 때때마다 다양한 공연과 전시가 활발하게 이루어지는 곳으로 3호선을 타고 가면 쉽게 갈 수 있는 교통의 요지에 있다.,It is a place where you can see various performances and exhibitions. It is a place where various performances and exhibitions are held every time during the season. It is a transportation hub that is easy to get there by subway line 3.
pic_bd,4,1002,"뷔에르 앙상블 공연 관람. 뷔에르 앙상블 공연을 보러 오랜만에 예술의 전당에 재방문 했습니다. 서울같지 않은 느낌을 가진 곳이라해야할까요. 생각보다 주변에 높은 건물도 없고, 넓게 펼쳐진 장소가 마음을 편안하게 합니다.","Watch the Buier Ensemble. I revisited the Seoul Arts Center to see the performance of the Buer Ensemble in a long time ago. This place doesn't feel like Seoul. There are no tall buildings around me than I thought, and the wide open space makes me feel at ease."
soniasunyoungh,5,1002,밤의 물분수쇼를 칭찬해 실내 공간이 전보다 개선된 점도 좋지만 무엇보다 이왕 간김에 분수쇼는 꼭 봐야 한다고 봅니다. 내부 만큼 이나 외부공간 조성을 잘 해놓았어요.,"It is also good that the indoor space has been improved by praising the water fountain show at night, but most of all, I think you should watch the fountain show while you are there. The interior is as good as the outer space."
Hyuna P,5,1002,"오! 에르베튈레 전시 방학기간 아이와 함께 보기 좋은 전시를 하고 있어요. 오! 에르베튈레 색색깔깔전~ 아이를 위해 같지만, 어른에게도 정말 기분 좋음을 선사하는 전시였습니다.","Oh! The Erbe Tulle Exhibition is having a nice exhibition with my child during the vacation. Oh! Herbe Tulle Color Colors! It's the same for children, but it's also a great exhibition for adults."
sytahk,5,1002,오페라 극장 이 오페라 극장 건물 차제가 아름답고 여기서 하는 공연들은 언제사 어느 정도 수준 이상은 된다. 이번에는 La Boheme를 감상하였다. 요즘은 무대가 전처럼 사실적이고 복잡하지 않은 경우가 많다. 그런 트렌드에 맞는 공연이었다. 한국의 문화. 에술의 수준을 가늠할 수 있는 공간이다.,"Opera Theater The opera house is beautiful, and the performances here are always above some level. This time, I watched La Boheme. Nowadays, the stage is often not as realistic and complex as before. It was a performance that suited that trend. It is a space where you can measure the level of Korean culture and art."
junseokk2018,5,1002,"한국에 오면 꼭 들려야 하는 전시관람장소 당신이 한국에 온다면 이 곳에서 전시회를 꼭 보길 바랍니다 후회없는 선택이 되는 곳 입니다, 주변에 맛집 또한 많으니 꼭 들려보세요~","If you come to Korea, I hope you can see the exhibition here. It's a place where you don't regret it, there are many good restaurants around you, so make sure to visit them.~"
walkingwanderer206,3,1002,위치는 좋아요 지하에 무료 사물함이 있어서 이용하기 편리하구요 바로 앞에 마을버스도 있고 버스 정류장들도 가까워서 교통은 편리한 편이에요. 마리 로랑생전은 좋았구요 반고흐 to마티스전은 디지털 전시 위주여서 별로였네요.,"The location is good. There's a free locker underground. It's convenient to use. There is a town bus right in front of us and the bus stop is close, so traffic is convenient. Marie Laurent's life was good, and the Van Gogh to Martis was digital."
JJJY_Mom,5,1002,"겨울에 스케이트장 운영해요. 겨울에 호두깍기 인형 보러갔는데, 공연이 너무 좋았어요. 앞마당에 스케이트장 운영하는데 분위기가 너무 좋아서 다른 사람들 타는 것 구경하는 것도 좋았네요. 여름에는 한밤의 음악회같은 것을 한다고 하니, 이번 여름에 다시 방문해야 겠어요.","We run a skating rink in winter. I went to see a walnut ball doll in the winter, and the performance was so good. The atmosphere in the front yard was so good that it was nice to see other people riding. I heard that there is a midnight concert in summer, so I should visit again this summer."
Joon K,5,1002,"갓모양의 지붕이 눈에 띄는곳 건축물도 독특하지만, 분수 역시도 좋은거 같습니다. 특별할거 없는 분수이지만 거기에 운치가 있는거 같습니다. 클래식 공연을 종종가시는 분이라면 추천합니다.","The building where the roof of the hat stands out is unique, but the fountain is also good. It's nothing special, but there seems to be a beautiful place. I recommend it to those who often go to classical concerts."
chunbbo,5,1002,"진짜 너무 좋아요~ 진짜 너무 좋아요~ 여름에는 음악분수쇼. 겨울에는 스케이트장으로 변신. 전시회나, 연주회 다양한 문화컨텐츠를 즐길 수 있는공간!! 다른 공연장보다 뮤지컬은 확실히 음향시설이 좋다고 느껴짐!","It's really great. I love it. I love it's great.~ Music fountain show in summer. In winter, it turns into a skating rink. A space where you can enjoy various cultural contents such as exhibitions and concerts. Musicals definitely have better acoustics than other venues!"
기쁨이,5,1002,미술관 다녀옸어요 한국에서 제일좋은 예술관입니다.항상갈때마다 새로운 전시와 공연이 있어 설레이는 곳입니다. 그리고 주변공원이 잘되어있어서 연인과함께하길 추천드려요 .,I went to an art museum. It is the best art museum in Korea.It's a place where I'm always excited because there are new exhibitions and performances. And I recommend you to join your lover because the surrounding park is well built.
형근 김,5,1002,예술의 전당 한가람 미술관 예술의 전당 내 있습니다. 아이들 교육에 좋은 전시회를 많이 하고 있어 좋습니다. 주차공간도 널찍해서 차 가지고 가기도 좋고 지하철 3호선 예술의 전당역에서도 가깝습니다.,"Seoul Arts Center, Hangaram Art Museum, Seoul Arts Center. It's good to have many exhibitions for children's education. The parking space is spacious, so you can take a car and it is close to Seoul Arts Center Station on Subway Line 3."
muzicrabeat,4,1002,잘 정돈된 미술관 좋은 전시들이 많이 열리는 깔끔한 건물. 내부에서 길찾기가 약간..헷갈린다. 종종 전시 보러 들름. 만족한다.,A well-organized art museum. A neat building with many fine exhibits. It's kind of like finding a way from the inside.Confused. Often stopping by to see exhibitions. Satisfied.
muzicrabeat,4,1002,"이곳의 공연과 작품들은 다 훌륭하지만 서울의 유명한 장소 치고 꽤 불편한 교통편 접근성, 근처에 먹거리가 별로 없음. 그냥 좋은 공연 후딱 보고 다른곳으로 이동해야...","All the performances and works here are great, but for a famous place in Seoul, the accessibility of transportation is quite inconvenient, and there is not much food nearby. Just look quickly a good show and moved somewhere else ..."
ktk166,4,1002,"한번가고 또 생각난다. 한국에 있는 문화홀 중 가장 다양한 볼거리가 있는 곳이라 생각한다. 단지, 도심 복판에 있기 때문에 주차하기가 힘든게 단점이다.",It reminds me of that. I think it is the most diverse cultural hall in Korea. The downside is that it is difficult to park just because it is in the middle of the city.
Hune Kim,4,1002,전시 관람을 위해 방문 전시 내용도 좋았고 시설도 깔끔했으나 주변 교통체증이 심했다. 알찬 전시를 자주해서 다음에도 방문 예정이다.,"The contents of the visit to the exhibition were good and the facilities were clean, but the surrounding traffic was heavy. I am planning to visit there next time because I often exhibit a lot of things."
썬샤,5,1002,감성 충만 하기 좋아요~ 차분하고 따뜻한 분위기에 기분 좋아집니다! 로비에는 무료 전시도 하니까 별 일 없고 한가할때 들러도 좋아요 토월극장은 작아서 연극 공연 장 같지만요,"It's good to be full of emotions. It's nice to have a calm and warm atmosphere. There's a free exhibition in the lobby, so you can stop by when you're free. The Towol Theater is small, so it's like a theater."
용마사,4,1002,예술의 전당 한국의 전통의 갓 모양으로 되어있는 건물이죠!!~~다양한 전시회가 많이 열려요!!! 좋습니다,Seoul Arts Center is a traditional Korean gat-shaped building!!There are many different exhibitions!!! That'sirreally good.
jinlee0201,5,1002,"산책차 들리기에도 좋은곳 가끔 공연이나 전시를 보러도 가지만, 근처 볼일이 있어 갈 때 산책차 들리기도 합니다. 내부와 외관모두 잘 꾸며져 있어서 시간적 여유가 있을 때 둘러보면 좋아요.","A good place to stop by for a walk. Sometimes I go to see performances or exhibitions, but sometimes I come by for a walk because I have something to do nearby. Both the interior and exterior are well decorated, so it's good to look around when you have time."
J J,2,1002,교통 불편 도로 옆에 동떨어진 섬처럼 건물이 서있다. 남부지하철역에서 꼭 마을버스를 타야해서 불편했다.,A building stands like an island far away from traffic. It was inconvenient because I had to take a village bus at the Nambu subway station.
Jelsomina,4,1002,여러 공연들이 펼쳐지는 곳 서울의 대표적인 공연들이 많이 열리는 곳이죠. 공연들이 보고 싶다면 예술의 전당을 한번 방문해 보세요.,"The place where various performances are held is the place where many representative performances are held. If you want to see the performances, visit the Seoul Arts Center."
Hyewon P,4,1002,예술의 중심지 다양한 전시와 공연이 열립니다. 공연 관람 후 내부에 있는 카페에서 커피 한잔 마시고 나오면 삶의 질이 높아지는 기분이에요 ㅎㅎ,"Various exhibitions and performances will be held in the center of art. After watching the show, I feel like my quality of life is getting better after drinking a cup of coffee at a cafe inside. Haha"
harperrr,3,1002,괜찮아요 수도권에서 오기 좋고 다양한 공연을 관람할 수 있어 좋습니다. 가끔 문화생활을 위해 가볼만한 곳이예요,It's okay. It's good to come from the Seoul metropolitan area and you can see various performances. It's a good place to visit for a cultural life sometimes.
수리23,5,1002,예술적인 기분이 확 드는 곳! 음악회 보느라 들리게 됐는데 뒷편에있는 음악분수가 정말 멋있더라구요 ㅎㅎ 옆에 카페랑 레스토랑도 있어서 참 좋았어요.,"A place where you feel like an artist! I stopped by to watch the concert, and the music fountain in the back was really cool. It was nice to have a cafe and a restaurant next to him."
Ju-yeon Y,2,1002,"좀 상업적.. 점점 한가람 미술관은 사람들이 좋아하는 , 대세이자 유행따라가는 작품이 많아지는 것 같아요. 속빈 강정이라는 말이 생각나는 게 막상 전시를 보게되면 입장료에 비해 턱없이 적은 그림, 그림이 걸려도 판화나 제자들이 그린 그림들로 가득한 걸 볼때마다 실망스럽습니다..","It's a little commercial, and it seems like Hangaram Museum is becoming more popular and trendy. The phrase ""empty Gangjeong"" reminds me of every time I see an exhibition, I am disappointed when I see a picture filled with prints and drawings that are far less than the entrance fee."
Sj K,4,1002,좋았습니다 전시회를 보러 갔는데 넓고 깨끗해서 좋았어요~ 카페가 있어서 간단히 커피한잔 하기도 좋았습니다.,It was good. I went to see the exhibition and it was nice because it was wide and clean. It was good to have a cup of coffee simply because there was a cafe.
인경 전,5,1002,"공연, 전시가 좋은 곳 예술의 전당은 공연이나 전시를 보러가는 목적이 크지만 전시장 뒤쪽으로 분수대도 있고 푸드트럭도 있어서 시간을 보내기 좋은 장소","The Seoul Arts Center is a great place to spend time at the back of the exhibition hall, with a fountain and a food truck."
Ju-yeon Y,3,1002,좋아요 공연 보다는 미술관 관람이 더 좋은 것 같아요 좋은 뮤지컬을 하는 경우는 별로 없는 것 같네요.. 남부터미널에서 마을버스 타고 가야해서 접근성은 쏘쏘합니다.,"Okay. I think it's better to go to the museum than to perform. I don't think there are many good musicals. I have to take the village bus from Nambu Terminal, so the accessibility is very simple."
Seohyeong J,4,1002,한국의 문화를 보고 싶다면 이곳으로 한가람 미술관은 예술의 전당 내에 있는 미술관 입니다. 가장 대표적인 문화 시설로 다양한 전시회를 관람할 수 있답니다. 서초역과 인접하고 곳곳에 많은 맛집들이 있습니다.,"If you want to see Korean culture, Hangaram Art Museum is an art museum in Seoul Arts Center. It is the most representative cultural facility and you can see various exhibitions. There are many good restaurants near Seocho Station."
Seon Na G,4,1002,전시방문 다양한 전시가 언제나 있어서 어제 방문해도 좋은 전시를 볼수 있는 곳입니다. 여우롭게 시간을 가지고 방문하기를 추천합니다.,"There are always various exhibitions in the exhibition visit, so you can see the exhibition that you can visit yesterday. I recommend you to take your time and visit."
dkfma0657,5,1002,잘보고갑니다 가까운곳에 큰 미술관이 있으니 너무 좋네요 시설도 좋고 전시관도 커서 자주 방문합니다. ㅎㅎ,Thank you. It's so nice to have a big museum nearby. I visit often because the facilities are good and the exhibition hall is big. Haha
Seohyeong J,5,1002,"한국의 예술을 즐길 수 있는 곳 제가 한국에서 가장 좋아하는 곳입니다. 한국의 다양한 문화를 즐길 수 있습니다. 음악, 미술 등 다채로운 예술을 즐길 수 있으니 꼭 가보세요. 강남 근처라 근접성도 좋답니다.","The place where I can enjoy Korean art is my favorite place in Korea. You can enjoy various cultures of Korea. You can enjoy a variety of arts such as music and art, so make sure to visit there. It's near Gangnam, so it's also close."
미령 황,5,1002,전시관람 프리다 칼로와 디에고의 전시작품을 보러 갔었습니다. 가끔 전시와 공연을 보기 위해 찾는곳인데 시설 깨끗하고 편의시설 잘되어있습니다. 주차시설도 좋구요.,"I went to see the exhibits of Frida Kaller and Diego. Sometimes I visit this place to see exhibitions and performances, but the facilities are clean and convenient. Parking is good."
