u_id,u_rate,p_id,review,review_en
걸어서지구한바퀴,4,1101,"어린이를 동반한 가족들에게 최고의 나들이 장소 장흥아트파크는 유모차를 동반한 가족단위부터 어린이까지, 또는 풋풋한 연애를 하는 커플들이 와도 좋을 전시와 체험이 어우러진 전시공원이다. 장흥아트파크 입장료는 1인 어른기준 8천원으로 다소 비싼편;;; 양주시, 의정부시 지역주민은 천원 할인 혜택을 받을수 있다. 장흥 아트파크 바로 앞에는 조그마한 놀이동산(탤런트 임채무씨가 운영하는 두리랜드)도 있으니 아이들을 데리고 나들이하기에 더 없이 좋은 곳이다.","Jangheung Art Park, the best place for families accompanied by children, is an exhibition park that combines exhibitions and experiences that can be enjoyed by families with strollers to children, or couples with young lovers. Admission to Jangheung Art Park is rather expensive at 8,000 won per adult;; residents of Yangju and Uijeongbu can get a 1,000 won discount. In front of Jangheung Art Park, there is also a small amusement park (Duri Land run by actress Lim Moo-moo), which is a great place to take children out."
슈퍼댁댁,5,1101,데이트코스로 추천합니다. 여기 좋아요 그런데 입장료가 좀.... 비싸서 살짝 비추긴해요. 그래서 한번쯤 방문하는걸로 추천을 합니다. 예술 작품이 많아서 사색하기도 좋고요,"I recommend it as a date course. It's nice here, but the entrance fee is a little... It's a little too expensive. So I recommend you to visit once. There's a lot of art, so it's nice to think about."
영애 조,5,1101,어린이집 소풍~ 비지니스라고 하기 좀 애매하지만 직장에서 간거라... ㅎㅎ 어린이집 아이들 데리고 장흥 아트파크로 소풍 갔다 왔어요~ 볼 것도 많고 아이들이 체험할 수 있는 것도 많고 가족끼리 가도 좋을 듯 해요^^,"A picnic at a daycare center. It's kind of vague to call it a business trip, but I went to work... I went on a picnic to Jangheung Art Park with the children of the day care center. There are a lot of things to see and experience. It would be nice to go with my family.^^"
푸켇홀릭,4,1101,아이들과 함께하기 좋아요~ 제가 사는 곳과 가까워 가끔 놀러갑니다. 아이들과 함께 즐길수 있는 것이 많아 아이들 있는집에 좋아요. 아기자기한 조형물. 아이들을 위한 놀이시설 등... 아이들 있는 집에 추천합니다.,"It's great to be with kids. It's close to where I live, so I sometimes go to play. There are many things to enjoy with children, so it's good for a house with children. a cute sculpture Playgrounds for children, etc. I recommend a house with children."
재영 윤,4,1101,할머니 생신즈음 이여서 방문했던곳 할머니 생신이여서 가족끼리 함께 갔었는데 생각보다 멋지게 되어있어서 사진도 많이 남기고 즐거웠던곳이다 .작게 물도 있어서 아이들 물놀이하기도 좋고 각각 조각상들도 직접만질수 있게 되어있어서 사진찍기도 좋고 즐거웠던곳,"The place I visited around my grandmother's birthday was my grandmother's birthday, so I went there with my family and it was a place where I had a lot of pictures and had fun.It was nice to take a picture of the small water, so it was nice for children to play in the water, and you can touch the statues yourself."
SEAN L,5,1101,"아이들을 위해 매우 좋은 곳. 아이들 위주이며, 체험학습등도 매우 만족함. 어른들이 할 수 있는 것에 비해 어른 가격이 다소 비싸다고 생각되나, 아이들에게는 매우 유용함,","A very good place for children. It's focused on children, and I'm very satisfied with the experience and learning. I think it's a little bit more expensive than what adults can do, but it's very useful for children."
