u_id,review,u_rate,p_id,review_en
Alpertbyun,서울시내를 둘러싸고 있는 서울한양도성. 입구는 여러군데에 위치하고 있습니다. 입구에따라 가벼운코스도있습니다. 야경보기좋습니다.,4,1218,"The entrance of Seoul Hanyangdoseong, which surrounds Seoul, is located in various places. There is also a light course depending on the entrance. The night view is nice."
Traveling Foodie,어둑어둑 해질무렵쯤에 가시는 것을 강추합니다. 어디에서 시작해도 좋지만 동대문에서 저녁식사를 먹은 후 시작해서 노천 까페에서 야경도 즐기고 낙산공원쪽으로 내려와 혜화에서 야식을 먹으면 딱 좋습니다.,5,1218,"I strongly recommend that you go around dusk. You can start anywhere, but after dinner at Dongdaemun, you can enjoy the night view at an open-air cafe and come down to Naksan Park and have a late night snack at Hyehwa."
ahirity,접근성이 좋으며 밤에 방문하면 돌담길이 예쁩니다. 대신 높낮이가 있어서 여성분이 구두를 신고 방문하면 이동이 힘들 수 있습니다.,3,1218,"It has good accessibility and the stonewall walkway is pretty when you visit it at night. Instead, it can be difficult for a woman to move if she visits with her shoes on."
지현 이,"지난 가을 한양도성길 1, 2, 5, 6구간 다녀왔는데 너무 좋았습니다. 서울에 이런곳이 있다는걸 모르고 살았네요 올해는 6개 구간 다 가볼생각이에요",5,1218,"Last fall, I went to Hanyangdoseong-gil section 1, 2, 5, 6 and it was so nice. I didn't know there was a place like this in Seoul. I'm thinking of going to all six sections this year."
민석 권,서울 중심부를 둘러싼 인왕산 북악산 낙산 남산을 둘러싼 오래된 성벽으로 이 성벽을 중심으로 서울 중심부를 돌수있습니다 4개의 권역으로 나눠져있어서 어디든 원하는곳에서 산책을 즐길수 있습니다 서울의 역사와 자연을 한번에 느낄수 있습니다,5,1218,"The old walls surrounding Inwangsan Mountain, Bukaksan Mountain, Naksan Mountain, and Namsan Mountain surrounding the central part of Seoul are located around this wall. It is divided into 4 areas, so you can enjoy a walk anywhere you want. You can feel the history and nature of Seoul at once."
snoopy419,"산책겸, 옛 숨결을 느낄겸, 방문하기 좋은 곳입니다. 날씨가 좋은 날 방문했는데, 파란 하늘과 성곽, 도심의 풍경이 하나의 그림처럼 보여서 더 좋았습니다. 이런 곳이 더 많아졌음 좋겠습니다.",4,1218,"It's a good place to take a walk, feel the old breath, and visit. I visited on a fine day, and I liked the blue sky, the castle, and the view of the city center looked like a picture. I hope there are more places like this."
yangcho0311,서울의 현대적인 발전된 모습도 좋지만 이러한 곳이 얼마 남지 않은 것 같아서 국가차원에서 많이 보호하고 살려두어야 할것 같다.,5,1218,"Modern development of Seoul is good, but it seems that there are not many places left like this, so we should protect and keep them alive at the national level."
J J,서울역에서 나와 남산가는길에 있다. 성곽을 재현해 색다른 느낌이 든다. 산책하기 좋은 곳이다.,4,1218,I'm on my way to Namsan from Seoul Station. It feels different because it recreates the castle. It's a good place to take a walk.
민석 권,조선시대 건축된 한양도성을 걷는 길 서대문에서 인왕산 북악산 동대문 남산으로 이어지는 둘레길은 중간중간 끊어져버린 구간도 있고 북악산은 경비강화구역이라 정해진 시간만 들어갈수있고 신분증도 필요하지만 그런 불편이 있더라도 한양도성길을 걸으며 바라보는 도시의 모습은 정말 아름답습니다. 어느정도 체력도 필요합니다,4,1218,"Walking along Hanyangdoseong Fortress, which was built during the Joseon Dynasty, the Dulegil from Seodammun Gate to Inwangsan Mountain, Bukaksan Mountain, Dongdaemun and Namsan Mountain has been cut off from time to time, and Bukaksan Mountain is a security-enhancing zone, so you can only enter for a certain amount of time, but even if you have such inconvenience, the view of the city while walking along Hanyangdoseong-gil is very beautiful. We need some physical strength."
apeach11,"도성 한반퀴 성곽따라 걸으면 20km 정도 됩니다. 전 2일에 걸쳐서 완주하면서 기념 뱃지를 받았습니다. 창의문에서 시작하여 북악산(백악산)~혜화문. 동대문 코스 1일, 남산~강북삼성병원 2일차 완료. 북악산만 살짝 힘들지만 보람있고 좋습니다.",4,1218,"It is about 20km away from the Han River Quiz Castle. I received a commemorative badge as I finished the race for two days. Starting from Changi Gate, Bukaksan Mountain (Baekaksan Mountain)~Hyehwamun. Dongdaemun course 1st, Namsan~Gangbuk Samsung Hospital 2nd day. Only Mt. Bukak is slightly difficult, but it's rewarding and nice."
진선 유,"뭔 도성이야 하시는분들 많은데, 서울이라는 튼 도시안에 이런 자연 공간이 길게 이어져 있다는 거 느껴보시면 큰 충격일겁니다. 중간중간 서울 도심지와의 경치도 보기 좋으니까 아파트숲 벗어나고 각잡고 걷고싶으신 분은 두번가세여 세번가세여",5,1218,"There are a lot of people who think it's a capital city, but it's a big shock to feel that there's a long line of natural spaces in Seoul. If you want to get out of the apartment forest and walk, you can go two, three, three, three, three, three, three."
PINKSHOW01,"옛 한양의 성곽길을 따라 만들어진 한양도성길은 서울 시내를 뺑 둘러 만들어져 있어서, 서울을 한 눈에 보기에 매우 좋은 길임. 중간중간 좀 가파른 코스가 있긴 하지만, 그래도 아주 많이 힘들지 않게 운동 겸 다닐 수 있음. 간혹 성곽길이 도로 때문에 끊어질 때가 있는 데, 그때는 바닥에 표시를 해 두어서 옛 성곽길의 흔적을 느낄 수 있게 해 두었음",4,1218,"Hanyangdoseong-gil, which was built along the old Hanyang Fortress Trail, is a great way to see Seoul at a glance. There are some steep courses in between, but you can still work out without much difficulty. Sometimes the fortress road is cut off due to the road, but at that time, it was marked on the floor so that you could feel the traces of the old castle road."
이안팍,4대문 안의 경계가 되는 한영 도성이다 평지에 있는 곳도 있고 산속에 있는 곳도 있는데 도심에 복원된 곳을 보면 왠지 마음이 편안해 진다,4,1218,It is a Korean-English capital city which is the boundary of the four gates. Some places are flat and some places are in the mountains. Some places in the city center make me feel comfortable.
SCY,"한양 도성길은 성균관대학교와 이어져 있습니다. 도성길을 가는 중에 탁 트인 서울 시내도 볼 수 있습니다. 중간에 운동기구와 벤치, 화장실도 있고, 다양한 식물도 볼 수 있어서 서울 구경을 하기 좋은 곳 입니다 서울 중심가와도 바로 연결되어있기 때문에 둘러보기 좋습니다.",5,1218,"Hanyang Doseong-gil is connected to Sungkyunkwan University. You can also see the open downtown Seoul on your way to the Doseong-gil. There are sports equipment, benches, restrooms, and various plants in the middle, so it is a good place to look around Seoul. It's also connected directly to downtown Seoul, so it's good to look around."
BillNabilah,한양 도성은 조선 시대의 한양을 지키기 위해 세워졌습니다. 500 년 이상 도시를 지키고있었습니다. 방문 할 가치가 있습니다.,4,1218,Hanyang City Wall was built to protect Hanyang during the Joseon Dynasty. I've been guarding the city for over 500 years. It's worth a visit.
Haliza Ali,동대문으로가는 길에 이화 벽화 마을에서 왔어요. 나는 거의 일몰의 끝을 향해 거기에 있었고 그것은 아름다웠다. 사진을 찍기 위해 그 자리 중 하나까지 올라가는 좋은 운동을했고 그것은 알함브라의 K-드라마 추억의 마지막 장면을 생각 나게했습니다 ~ :),4,1218,"I came from Ewha Mural Village on my way to Dongdaemun. I was there almost towards the end of the sunset and it was beautiful. I went up to one of those places to take pictures, and it reminded me of the last scene of Alhambra's K-drama memory. ~ :)"
Diviva,벽의 낙산-동대문 구역 방문 보기는 훌륭했다. 그리고 우리는 서울의 더 조용한 쪽을 볼 수 있었다. 이 섹션은 모든 연령대의 사람들에게 적합한 도보입니다.,4,1218,The view of Naksan on the wall-Visit the Dongdaemun District was excellent. And we could see the quieter side of Seoul. This section is suitable for people of all ages.
sarracene,"강박 적으로 고집적인 문화적 한국 방식으로 인해, 자녀가있는 경우이 '소풍'에가는 것을 후회할 수 있습니다. 주변에서 걷기를 시작하면 청와대 (한국 백악관)를 지나갈 때 어느 시점에서 여권을 확인할 수 없으며 심지어 여권을 확인할 수도 있습니다. .",3,1218,"Due to the obsessive cultural Korean style, children may regret going on a picnic. If you start walking around, you can't check your passport at some point and even check your passport when you pass through Cheong Wa Dae (the White House in Korea). ."
Meander800093,"약간의 산보를했고, 그것이 정말로 좋은 것을 알았다. 멋진 작은 카페와 멋진 사진을 볼 수있는 전망대가 있습니다.",5,1218,"I took a little walk, and I knew it was really good. There is a nice little cafe and an observatory where you can see nice pictures."
JDTS,"지하철을 타고 동대문역으로 가면 남문과 벽이 보입니다. 서울 주변의 고대 도시 전체를 둘러싸고있는 벽의 일부입니다. 현지 음식과 제품을 판매하는 현지 상점과 길가의 보행자가 있습니다. 현지 오뎅 (깨끗한 수프에 담긴 어묵), 떡볶이 (약간 매운 그레이비를 곁들인 떡), 지역 소세지를 맛보세요. 근처에는 동대문 디자인 플라자 (스타 트렉 영화와 같은 구조)와 면세점 (담배 및 주류 제외)을 포함한 다양한 쇼핑몰이 있습니다.",4,1218,"If you take the subway to Dongdaemun Station, you can see the south gate and the wall. It is part of a wall that surrounds the entire ancient city around Seoul. There are local stores selling local food and products and pedestrians on the street. Try local fish cakes (fish cakes in clean soup), tteokbokki (rice cake with a bit of spicy gravy), and local sausage. Nearby, there are various shopping malls, including Dongdaemun Design Plaza (a structure like Star Trek movies) and duty-free shops (except cigarettes and alcoholic beverages)."
Kenny Ho,여행을 마치고 서울 성벽으로 하이킹을하면서 자연과 다시 연결을 시도한 겨울이 추워지면서 길은 더 쉬워졌습니다. TOP에서 서울시의 절경!,4,1218,"After the trip, I tried to reconnect with nature while hiking to the wall of Seoul, and the road became easier as winter got colder. Seoul's spectacular view from TOP!"
John A,"성벽에는 따라야 할 부분이 많이 있습니다. 나는 Mt. 남산 공원 남산 서울 타워 그것은 케이블카 역을 넘어 약 500m의 섹션이었고, momiji 단풍 잎 변화로 아름다운 목가적 인 숲을 가로 질러 지나갔습니다. 완전히 평화로운 환경. 시청 플랫폼을 사용하면 도시 섹션과 이전 방어를 더 잘 볼 수 있습니다.",5,1218,There are many things to follow in the walls. I was Mt. Namsan Park Namsan Seoul Tower It was a section of about 500m beyond the cable car station and passed through the beautiful pastoral forest with the change of momiji maple leaves. a perfectly peaceful environment The City Hall platform provides a better view of city sections and previous defenses.
Robert B,도시 전망이 좋고 길 건너편의 게이트가 밝게 빛나므로 저녁에 갈 것을 권장합니다.,4,1218,We recommend you to go in the evening because the city view is good and the gate across the street is bright.
Anirban,동대문의 중심에는 바로 역사가 있습니다. 흥인지문 근처에서 2 분 정도 올라갑니다. 여기에서 보는 경치는 놀랍습니다. 최고의 경험을 위해 해가지기 전에 올라가서 도시의 불빛이 거기에서 나오는 것을 지켜보십시오.,5,1218,At the center of Dongdaemun is history. It takes about 2 minutes to go up near Heunginjimun Gate. The view from here is amazing. Go up and watch the city lights come out of it before you do it for the best experience.
Keshira haLev F,"우리는 서울 성벽의 한 부분을 걷는 데 하루를 보냈습니다. Changuimum Gate 로의 대중 교통은 쉽고 간단했고 게이트 근처에 달콤한 작은 카페가 몇 군데 있었으므로 점심과 커피를 마시 러 들렀습니다. 우리가 걷기 시작하면 도시의 멋진 전망을 감상 할 수있었습니다. 이 섹션의 유일한 단점은 군사 기지에 접해 사진이 금지되었다는 것입니다. 전체적으로, 그것은 명소와 아름다운 단풍을 가져 가면서, 몇 시간을 보내는 좋은 방법이었다!",5,1218,"We spent a day walking on a part of the wall in Seoul. Public transportation to Changuimum Gate was easy and simple, and there were some sweet little cafes near the gate, so I stopped by for lunch and coffee. When we started walking, we could enjoy the wonderful view of the city. The only drawback of this section is that photography is prohibited in contact with military bases. Overall, it was a good way to spend hours, bringing in the sights and beautiful fall leaves!"
gyulagyula,벽을 따라 천천히 산책하면서 옛날의 정신을 느껴보십시오. 위는 도시의 멋진 전망입니다.,5,1218,Take a slow walk along the wall and feel the old spirit. Above is a wonderful view of the city.
The Wandering Chris,"태양이지는 것에 따라 나는 오른쪽 정상까지 하이킹을했다. 그리고 그것은 아슬 아슬했다. 당신 주위의 아름다운 자연, 새들이 rp 거리고, 바람이 불고, 일몰으로 서울의 도시의 불빛이 풍경을 차지하는 것을 볼 수 있습니다.",5,1218,"As the sun went down, I hiked to the top right. And it was a close call. You can see the beautiful nature around you, the birds rp, the wind blowing, and the lights of the city of Seoul occupy the landscape."
CoolBrewster,조선 시대를 통해 성벽과 역사를 배울 수있는 훌륭한 박물관입니다. 실제 동대문 (대 동문)에서 언덕 위로 걸어서 갈 수 있습니다. 시간 (및 체력)이 허용되면 벽 자체를 계속 움직여 멋진 사진 작전을하십시오. 게이트 옆에 걸어서 갈 수있는 거리에는 DDP와 무료 스타디움 박물관도 있습니다. 두타 백화점과 JW 메리어트도 한 블록 안에 있습니다.,5,1218,"It is a great museum where you can learn about the wall and history through the Joseon Dynasty. You can walk up the hill from Dongdaemun (the Great East Gate). If time (and physical strength) is allowed, keep moving the wall itself, and have a great photo op. There is also a DDP and a free stadium museum on foot next to the gate. Duta Department Store and JW Marriott are also in one block."
NC0114,Inwangson 산을 하이킹하는 동안 우리는 성벽을 따랐다. . . 정상의 관점은 훌륭하지만 모든 정직에서 서울의 성벽은 지난 달에 지어진 것처럼 보입니다. 인근 수원의 성벽이 훨씬 인상적입니다.,2,1218,"While hiking in Inwangson, we followed the ramparts. . . . . The top view is excellent, but in all honesty, Seoul's ramparts seem to have been built last month. The walls of nearby Suwon are much more impressive."
Ann C,"시간이 허락하면 벽 박물관을 확인하여 벽의 광범위한 역사, 파괴 및 중생에 대해 교육하십시오. 4 개의 정문은 유교의 4 가지 미덕을 나타냅니다. 서울 성벽지도라는 맵이 있는데, 우표를 모두 모으면 벽 전체를 다니면서 기념 배지를 얻을 수 있습니다.",5,1218,"If time permits, check the Wall Museum to educate you about the extensive history, destruction, and Mesozoic of the Wall. The four gates represent the four virtues of Confucianism. There is a map called Seoul Wall Map. If you collect all the stamps, you can go all over the wall and get a commemorative badge."
emma,우리는 실제로 여러 곳에서 오래된 서울 성벽을 볼 수있었습니다. 오래된 성벽을 보는 것이 흥미 롭습니다. 남산 공원 근처에서 우리는 그것의 긴 부분을 볼 수있었습니다.,4,1218,"We could actually see the old walls of Seoul from many places. It's interesting to see the old walls. Near Namsan Park, we could see a long part of it."
Lynn W,밤에 가십시오-훌륭한 조명. 그 외에는 문이없는 오래된 벽의 재구성 된 섹션입니다. 15 분이 걸립니다,3,1218,"Go at night-good lighting. Other than that, it is a reconstructed section of an old wall with no doors. It takes 15 minutes."
tigger2594,내가 도시를 통해 계획되지 않은 작업을하고있을 때 실수로 산보를 발견했습니다. 산책은 낡았 고 오래된 도시를 보호하기 위해 능선을 따라갑니다. 줄이 끊어짐에 따라 벽을 찾은 다음 줄을 따라 걸 으면 다시 풀 수 있습니다. 나는 벽이 좋은 상태라고 생각했고 추가 방어를 받았어야했지만 지금은 벽일뿐입니다. 만리 장성이 아니라 장벽 일뿐입니다.,4,1218,"I found a walk by mistake when I was doing unplanned work through the city. The walk follows the ridge to protect the old and old city. As the line breaks, you can find the wall, and then walk along the line to untie it again. I thought the wall was in a good condition and should have been further defended, but now it's just a wall. It's not the Great Wall, it's the Wall."
Mr C,원래 18km의 약 12km는 여전히 도시의 여러 위치에 존재합니다. 벽을 따라 걸 으면 남산 힐과 북산 힐이 좋은 선택입니다. 중국의 만리 장성을 기대하지 마십시오. 안으로 들어가면 벽이 매우 낮습니다.,4,1218,"About 12 kilometers, originally 18 kilometers, still exist in different locations in the city. Namsan Hill and Buksan Hill are the best choices if you walk along the wall. Don't expect China's Great Wall. If you go inside, the wall is very low."
AlanD-Denver,도시의 다른 곳에서 벽의 일부를 볼 수 있습니다. 내가 가장 좋아하는 곳은 남산 공원입니다.,3,1218,You can see parts of the wall elsewhere in the city. My favorite place is Namsan Park.
Sammy,집중 호우 때도 서울의 아름다운 경치와 정말 근사한 산책! 격렬하지는 않지만 트레이너는 꽤 모래 같아서 착용하십시오.,5,1218,"Even during torrential rains, Seoul's beautiful scenery and a really nice walk! It's not intense, but the trainer looks like sand, so wear it."
BRENDA V,나는 부분 만했다. 뜨겁게. . . . 그러나 완전한 투어를하는 것은 정말로 좋은 생각입니다. 도시 벽 박물관에서 시작하십시오. . . . 당신은 도시에서 자연 그대로의 모습으로 걷습니다. 박물관도 좋습니다! 당신은 도시에 대한 멋진 전망을 가지고 있습니다.,3,1218,"I was only a part. Hot. . . . . . . . But taking a complete tour is a really good idea. Start at the City Wall Museum. . . . . you walk in the city in a natural way. Museums are great, too! You have a wonderful view of the city."
Grace,"벽화 마을에서 동대문까지 비교적 쉬운 인상. 높이에서 서울 풍경을 즐기고 멀리 떨어진 남산 타월을 볼 수 있습니다. 낙산 공원 근처의 정상에서 서울을 한 눈에 볼 수 있습니다. 매우 훌륭합니다. 이 벽 뒤에는 많은 역사가 있으며, 벽의 변화와 왕조의 변화를 설명하는 표지판이기도합니다. 약간의 역사와 하이킹을 즐기는 사람들은이 장소를 좋아할 것입니다.",5,1218,"A relatively easy impression from the mural village to Dongdaemun. You can enjoy the view of Seoul from the height and see the distant Namsan towel. You can see Seoul at a glance from the summit near Naksan Park. It's very good. Behind this wall, there is a lot of history, and it is also a sign that explains the changes in the wall and the dynastic changes. People who enjoy some history and hiking will love this place."
Scott W,"낙산 공원까지의 등산은 서울시의 벽에 뒤따라 사고가났다. 길은 동대문 문 북쪽에서 시작됩니다. 벽의 내부를 걸어갔습니다. (벽을 통해 최상의 전망을 제공합니다.) 벽의 바깥쪽에 내려 왔습니다 (벽 자체의 좋은 사진 촬영 기회). 물 (특히 여름에), 모자, 좋은 신발과 카메라를 가져 가라. 낙산 공원까지가는 길에 멈출 곳이 많습니다. (운동장은 피트니스 회로의 두 배가되고 그늘진 좌석이 많습니다.) 길은 포장 도로와 비 포장 도로 사이에 다릅니다. 어린 아이들에게는 적합하지 않습니다.",5,1218,"Climbing to Naksan Park was followed by an accident following the wall of Seoul City. The road starts north of Dongdaemun Gate. I walked through the interior of the wall. (The wall provides the best view.) I came down to the outside of the wall (a good photo opportunity for the wall itself). Water (especially in summer), bring a hat, good shoes, and a camera. There are many places to stop on the way to Naksan Park. (The playground has twice as many shady seats as the fitness circuitry.) The roads differ between paved and unpaved roads. It's not suitable for young children."
Sophie,내가 도시 벽 위에서 캠프를 할 때 나는 동대문을 걷고 있었다! ! 동대문 (Dongdaemun) 역에서 빠져 나왔다. 그것은 좋았고 많은 역사가있었습니다. 여유로운 시간을 보내기 위해 여기에 오십시오. . . . 그래서 저녁에 좋았습니다. 그리고 보니 좋았습니다.,3,1218,I was walking through Dongdaemun when I camped on the city wall! I escaped from Dongdaemun Station. It was good and had a lot of history. Please come here to have some free time. . . . . . . . . so it was good for dinner. And it was good to see you.
Kathalina916,낙산 공원에서 도보로 DDP쪽으로 내려가는 것이 확실히 바람직한 길입니다. 오르막길은 쾌적하지만 지형으로 인해 다른 방향으로는 더 어려울 것입니다. 주민들이 그렇게 선호하는 것을 고려하여 벽화 마을을 건너 뛰기로 결정했습니다.,5,1218,"Walking down to DDP from Naksan Park is certainly a desirable path. The uphill is pleasant, but the terrain will make it more difficult in other directions. Considering the residents' preference, we decided to skip the mural village."
Ali Alizadeh,"한양 도성은 600 년 전부터 독특한 역사, 순간, 사람, 그리고 많은 일기로 서울을 포옹합니다. 나는 Funday Korea Networks에서이 멋진 장소를 방문 할 두 번째 기회를 얻었습니다. 그들 덕분에이 벽에 대한 흥미로운 정보를 제공하는 독특한 여행 가이드를 제공합니다. 서울을 방문하는 경우 현대 도시의 중심부에있는이 역사적인 매력을 방문 할 기회를 놓치지 마십시오. 이 멋진 장소를 방문하는 가장 중요한 다섯 가지 이유를 살펴 보겠습니다.  1 : 하이킹 팬이라면 적어도 한 번",5,1218,"Hanyang City Wall has embraced Seoul with its unique history, moments, people, and many diaries since 600 years ago. I got a second chance to visit this wonderful place at Funay Korea Networks. Thanks to them, they offer a unique tour guide that provides interesting information about the wall. If you visit Seoul, don't miss the opportunity to visit this historic attraction in the heart of the modern city. Let's take a look at the five most important reasons to visit this wonderful place.  1: If you're a hiking fan, at least once"
Marlon&Magda,"1396 년에 건축 된 한양 도성 (서울 성벽)은 세계에서 가장 긴 벽으로 서울 방문 중 놓치지 말아야 할 장소입니다. 거기에가는 것은 쉬운 작업입니다. 버스 나 지하철은 특히 한국에서의 이동 작업에 편리합니다. 정지 목록에서 멈춰야하는 중지는 동대문 (???)입니다. 우리 선택은 버스이었다. 그리고 당신은 지평선에서 문을 볼 때 당신이 가깝다는 것을 알고있다. 그러나 지하철로 오는 경우 9 번과 10 번 출구가 바로 앞에 있습니다. 도시 벽의 흔적의 시작에 도달하기 위해, 당신은 큰 애비뉴를",5,1218,"Built in 1396, Hanyang City Wall (Seoul Wall) is the longest wall in the world and should not be missed during a visit to Seoul. Going there is an easy task. Buses and subways are especially convenient for transportation in Korea. The stop that must be stopped in the stop list is Dongdaemun (??). Our choice was the bus. And you know you're close when you look at the door from the horizon. However, if you come by subway, exits 9 and 10 are right in front of you. To reach the beginning of the city wall trail, you've got a big Avenue."
