u_id,review,u_rate,p_id,review_en
Bening M,"우선, 말해 좋다는 걷기, 진짜. 그래서 저는 서울 성곽 이 아니라, 정말 흥분 되었다. 에 대한 전체 경로를 가지고 있지만, 남산공원에서 조금만, 아주 만족 했습니다. 거리에서, 서울의 풍경 볼 수 있습니다. 하지만, 메모 하고, 해야 할 것 또는 이전 사람이 아이들과 함께 여행 합니다.",5,1218,"First of all, walking is good to talk about, really. So I was really excited, not Seoul Castle. I have a full path to , but I was very satisfied with a little bit at Namsan Park. On the street, you can see the scenery of Seoul. However, take notes, do what you have to do or travel with your children."
manucanuck,"한 부품들이 주위에 남산공원 만 따라 동대문, 다시 돌아갈 날을 권장하는 웹 사이트에 있는 한국 관광 노선! 그보다 훨씬 더 준비하기 1 - 2일 수원 에서 관석!",5,1218,"Dongdaemun along Namsan Park is a Korean tour route on a website that recommends a day to go back! More than that, the 1st - 2nd day seats in Suwon!"
Truthful Reviews,나는 벽까지 걸어갈 수 있는 도시에 대해 잘 모르는 최대 남산공원 이 되어 있더군요! 때 갈 수 있는 좋은 구조 및 공원으로 향한 벽을 볼 수 있는 서울. 벽 위에서 볼 수 있다 서울에 있는 남산 타워가 특별한 방문을 할 필요가 없습니다. 그냥 가서 일일 관광 여행 정보를 들을 수 있는 것을 볼 수 가는 길.,5,1218,"I'm the biggest Namsan Park I don't know much about the city that can walk to the wall! Seoul, where you can see the good structure and the wall facing the park. You can see it on the wall. Namsan Tower in Seoul doesn't need to make a special visit. Just the way to go and see what you can hear about your daily tour."
quadform,"도시는 아주 잘 짜여 있고 일부 싱부재. 다른 사람들 모두 함께 이빠짐. 에서 길을 잃기 쉽... 하지만 일부 구역은 다시 잘 되어 있고, 특히 로컬 zhangijiajia. 어쨌든, 그것은 매우 도전 하는데 하루 벽부를. 시작하기 전에, 남산 (남쪽) 섹션은 보통이었지만 잘 발달. 낙산 구간이 짧은 이스트 사이드. 힘들지만, 이렇게 두 개의 커다란 봉우리가 북쪽에 오르막 섹션을 통해 노스 웨스트, 340 미터 높은 각. 해당되는 활성 영역 단면 웨어 북한군이 여권이 필요한 것을. 해보는 즐거운",4,1218,"The city is very well-organized and some Singbujae. All the others fall in together. Easy to get lost in... But some of the zones are well again, especially local zhangijiajiajia. Anyway, it's a day's wall in very challenging ways. Before we begin, the Namsan (southern) section was normal but well developed. East Side with short Naksan section. Tough, but these two large peaks go up the north section, north west, 340 meters high angle. Applicable active area sectional wear North Korean military needs passport. joyous to try"
OSFlanker,"저는 서울 성곽 흔적이 섹션에서는 습니다, 제가 잘못 방향을 틈 을 벗어난 너무 멀고 다음 섹션의 흔적, 그리고 너무 비가 오기 시작. 그렇게 해서 버스로 시내 대신 계속. 부여된 geat 의 그 중국, 많은 부품이 아닌 원본 및 복원됩니다. 그렇지만, 이곳은 여전히 전망이 뛰어난 좋은 인상으로 모든 (날씨가). 그에 비해 서울 - 쇼핑, 뷰티 살롱 및 성형외과, 이 역시 저에게는. 다음에 서울 꼭 하이킹 변경다른 섹션을 루프를.",5,1218,"I find the traces of the Seoul Fortress in the section too far away from my wrong direction, the traces of the next section, and it's starting to rain too much. So we'll continue instead of downtown by bus. The China of given geat, original and restored, not many parts. However, this place still has a good view, and it's all (weather). By comparison, Seoul - shopping, beauty salons and plastic surgery - to me too. Make sure to go hiking in Seoul next time. Loop another section."
