u_id,review,u_rate,p_id,review_en
Dar-2000,"서울은 600 년 넘게 벽으로 둘러싸여 있다는 것을 알고 계셨습니까? Funday Korea Networks 덕분에 벽의 배경에 대해 알게되었습니다. 서울 성벽은 한양 도성이라는 이름으로 지어졌으며 방어적인 목적으로 지어졌습니다. 오늘날 그것은 세계에서 가장 긴 장벽이며 사적 제 10 호로서 국가 보호를 받고 있습니다. 이러한 사실들이 당신을 방문 할 동기를 부여하기에 충분하지 않다면, 여기 서울에 오는 모든 이들에게 꼭 필요한 다섯 가지 이유가 있습니다.  1 . 역사적 의의 : 서울시는",5,1218,"Did you know that Seoul has been surrounded by walls for over 600 years? Thanks to Funay Korea Networks, I learned about the background of the wall. The Seoul Wall was built under the name of Hanyang City Wall and was built for defensive purposes. Today it is the longest barrier in the world and is protected by the state as Historic No. 10. If these facts are not enough to motivate you to visit, there are five essential reasons for everyone coming here to Seoul.  1. Historical significance: Seoul City"
Moriii,"3 월 16 일에는 Funday Korea Networks 덕분에 서울 성벽으로도 알려진 한양 도성을 방문했습니다. 벽은 약 18 km 길이 다. 그리고 우리는 단지 벽의 낙산 산을 찾아 갔다.  (낙양산 코스, 한양 도성)  이 장소를 방문하는 것은 처음이 아니었지만이 장소의 역사적 배경을 알게되면 더 특별했습니다. 이 투어는 서울 시티 월뿐만 아니라 올드 서울의 역사에 대해 더 많은 것을 알 수있는 놀라운 기회였습니다. 그리고 지금 나는 모두가이 장소를 확실히 방문 할 필요가있는 몇 가지",5,1218,"On March 16, I visited Hanyang City, also known as the Seoul Wall, thanks to Funay Korea Networks. The wall is about 18 kilometers long. And we just went to Naksan Mountain on the wall. (Nakyangsan Course, Hanyang City Wall) It wasn't the first time to visit this place, but it was even more special to know the historical background of this place. The tour was an amazing opportunity to learn more about the history of Old Seoul as well as Seoul City Wall. And now I have a few things that everyone definitely needs to visit this place."
Anh Tu,"저는 이번 달 초, Funday Korea Networks 덕분에 한양 도성을 따라 걷는 친구들과 멋진 하루를 보냈습니다. 제가 처음 5 개월 전에 이곳에 왔을 때부터 매혹적이고 역사적인 매력을 가진 서울을 처음 본 것은 이번이 처음입니다. 이 장소는 서울에 오면 꼭 가봐야 할 곳입니다. 여기 5 가지 이유가 있습니다.  1 . 요새 벽 뒤에, 당신은 아름다운 풍경에 목욕 수 있습니다. 총 길이가 18 인 벽. 서울의 많은 산들을 따라 6km 뻗어있어 모두를위한 아름다운 산책로를 만듭니다.",5,1218,"Earlier this month, I had a wonderful day with my friends walking along Hanyang City Wall thanks to Funday Korea Networks. This is the first time I've seen Seoul with a fascinating and historic attraction since I first came here five months ago. This place is a must-visit place when you come to Seoul. Here are five reasons.  1. Behind the walls these days, you can bathe in beautiful scenery. A wall with a total length of eighteen. It stretches 6km along many mountains in Seoul, making beautiful trails for everyone."
Aisha G.,"1 . 한국과 인민의 역사 :이 벽을보고 역사를 배울 때 그것은 단지 벽 이상입니다. 그것은 열심히 일하고, 국가에 대한 충성심과 힘을 상징합니다. 벽은 돌, 목재 및 기타 재료로 만들어졌으며 목적은 침략자로부터 도시를 보호하는 것이 었습니다. 원래의 벽은 14 세기 후반 조선 시대에 지어졌으며 다른 지역에서 들어온 사람들이 약 98 일 만에지었습니다. 주요 재료는 진흙으로 묶인 중간 크기의 돌로 만들어졌습니다. 시간이 지나고 벽이 무너지기 시작하자 서로 다른 재료가 사용되었습니다. 벽을 따라",5,1218,"1. History of Korea and the People: When you look at this wall and learn history, it is more than just a wall. It symbolizes hard work, loyalty and power to the nation. The walls were made of stone, wood, and other materials, and the purpose was to protect the city from invaders. The original wall was built during the late 14th century during the Joseon Dynasty and was built by people from other regions in about 98 days. The main material is made of medium-sized stones tied in mud. As time passed and the walls began to collapse, different materials were used. along the wall"
Alexandra Micu,"한국에서 3 년 이상 거주해온 서울 시티 월 (Seoul City Wall)은 제가 계속해서 지켜야 할 랜드 마크 중 하나입니다. 그 경험은 매번 다른 경험으로 인해 최근에야 깨닫게되었습니다. 그래서 서울을 방문하는 모든 사람들이 왜 한양 도성을 그들의 여정에 포함시켜야하는지에 대한 간단한 목록을 작성했습니다.  1 . 600여 년 전에 세워진 서울 성은 한국의 장인 정신과 근면함의 가장 오래 살아있는 증거 중 하나입니다. 사용 된 여러 종류의 암석은 여러 수복물, 그것을 지은 사람들, 그리고",5,1218,"Seoul City Wall, which has been living in Korea for more than three years, is one of the landmarks I have to keep. The experience was only recently realized by different experiences every time. So everyone who visited Seoul made a brief list of why the city should be included in their journey.  Built more than 600 years ago, Seoul Castle is one of the longest living proofs of Korea's craftsmanship and diligence. The various kinds of rocks used were various kinds of water repellents, the people who built them, and"
DoctorBug,미리 계획을 세우십시오 - 벽은 오랫동안 verrrrrry입니다! 전체 벽은 걷기 하루 종일 걸릴 것입니다. 그러나 그것은 편리하게 구역으로 나뉘며 웹 사이트에는 다우로드 가능한지도가 있습니다. 그것은 도시의 특정 지역에서 매우 접근 가능하며 도시의 멋진 전망을 제공하는 많은 관광 명소 (낙산 공원과 같이)가 있습니다. 벽을 걸을 때 다른 관광 명소에 쉽게 접근 할 수 있습니다.,5,1218,"Plan ahead - Walls are verrrrrrry for a long time! The entire wall will take a whole day to walk. However, it is conveniently divided into sections and there is a map that can be Dowloaded on the web site. It is very accessible from certain parts of the city and has many tourist attractions (such as Naksan Park) that provide a great view of the city. You can easily access other tourist attractions when you walk on the wall."
Như Anh Nguyễn,"한국에서 5 개월 이상 공부하면서 운 좋게도이 나라를 발견 할 기회를 얻었습니다. 특히 서울에서 더 많은 흥미로운 곳을 알아보십시오. Funday Korea Network의 한양 도성 투어 덕분에 서울 근교의 여러 건축물 중 한양 도성이라 불리우는 역사적인 골동품 색을 입거나 서울의 도시 벽, 도시 역사의보고, 이 증거로 서있다. 그래서 여러분,이 놀라운 장소를 방문해야하는 5 가지 이유가 있습니다.  1 . 한국사에 대한 지식을 넓히세요. 서울의 성벽을 따라 1396 ~ 1398 년 사이에",5,1218,"I was lucky to get a chance to discover this country while studying in Korea for more than 5 months. Find out more interesting places, especially in Seoul. Thanks to the Funay Korea Network's tour of Hanyang City Wall, among the many buildings near Seoul, the city's walls, city history, and the evidence are either worn in historical antique colors called Hanyang City Wall. So, everyone, there are five reasons to visit this amazing place.  1. Expand your knowledge of Korean history. between 1396 and 1398 along the walls of Seoul"
Le Ha,"남산 타워, 남미 섬 또는 명동 방문은 서울에 왔을 때 평생 한번 경험해보아야 할 경험입니다. 그러나이 기사에서는 위의 위치와 완전히 다른 스타일을 제안합니다. 한양 도성 (서울 성벽)과 그 이유를 묻는 05 가지 이유입니다.  1 . 역사적 중요성 영어로, 한양 도성은 ""옛 서울의 성벽""을 의미합니다. 그것은 태조 임금 1396 년에 지어졌습니다. 벽은 18입니다. 627 킬로미터 길이로 서울의 4 대 내륙 산맥 인 백악산 (낙산산), 낙산산, 몽명산 (남산), 인왕산 등이있다. 태초에이",5,1218,"0A visit to Namsan Tower, South American island or Myeong-dong is an experience you should experience once in your lifetime when you come to Seoul.However, this article suggests a completely different style from the above location.There are 05 reasons to ask about Hanyang City Wall and its reason.1 .Historical importance In English, Hanyang City Wall means the walls of old Seoul.It was built in 1396 King Taejo's year.The wall is 18.It is 627 kilometers long and includes Seoul's four largest inland mountain ranges: Mt. Baekdu, Mt. Naksan, Mt. Mongmyeong, Mt. Namsan, and Mt. Inwang.Taecho A."
toushiksh,"#Soul City Wall (18.667 킬로미터), 10 시간 이상 걸음. . . . . . 자연의 아름다움이 역사와 만나는 곳. 서울시를 구하기 위해 600 년 이상 전에 지어졌습니다. 벽의 고고 학적 아름다움은 방문객을 놀라게하고 국가와 전사의 옛날을 상기시킵니다. 4 개의 주요 문과 4 개의 작은 보조 문은 한국의 옛날 나라의 일상적인 기쁨과 슬픔을 목격했습니다. 4 개의 산들 (북악산, 낙산, 몽면산, 인왕산)과 연결된 벽은 녹색과 아름다운 경관으로 방문자의 눈을 풍부하게합니다.",5,1218,"#Soul City Wall (18.667 kilometers), more than 10 hours of walking. . . . . .where the beauty of nature meets history. It was built more than 600 years ago to save the city. The archaeological beauty of the wall surprises visitors and reminds them of the old days of the country and warriors. Four main doors and four small auxiliary doors witnessed the daily joys and sorrows of the ancient Korean kingdom. The walls connected to the four mountains (Bukaksan, Naksan, Mongmyun, and Inwangsan) enrich visitors' eyes with green and beautiful scenery."
byeollotravel,"한국에 오면이 곳을 방문해야합니다. 대부분의 관광객들이 남산 타워 또는 롯데 타워로가는 동안 도시의 아름다움을 보려면이 요새까지 올라 가면됩니다. 나 같은 독주자를위한 완벽한 장소. (개인적으로, 나는 역사적인 것들에 대한 팬이 아니기 때문에 여기에 시간을 보내기 위해 2 시간에서 3 시간 정도를 추천한다.)  [이 장소를 방문하기 전에 먼저 기록을 검색하고 싶을 수 있습니다.] 조언 :  1 . 해가 질 때이 곳을 방문하고 밤을 지내면 서울의 야경에 매료 될 것입니다.  2. 이것은 숨겨진",5,1218,"If you come to Korea, you should visit this place. If you want to see the beauty of the city while most tourists go to Namsan Tower or Lotte Tower, you can go up to this fortress. A perfect place for soloists like me. (Personally, I recommend two to three hours to spend time here because I am not a fan of historical things.) [You may want to search the records first before you visit this place.] Advice: 1. Visit this place at sunset and spend the night, you will be fascinated by the night view of Seoul.  2. It's a hidden one."
Sarah53187,우리는 남산 공원에서 도시 벽을 따라 남산 정상에서 명동까지 걸었다. 벽은 아름답고 흥미 롭습니다. 보존과 재건에 대한 노력을 보는 것이 영감입니다. 서울로 돌아가 도시의 더 많은 벽을보고 관련 박물관을 방문하고 싶습니다.,4,1218,"We walked from Namsan Park to Myeong-dong along the city wall. The walls are beautiful and interesting. It is an inspiration to see the efforts for conservation and reconstruction. I want to go back to Seoul, see more walls of the city, and visit related museums."
Calvin C,"나는 마침내 도시 벽 전체를 따라 가야한다는 목표를 성취했다. 이렇게하는 경우 일찍 시작하고 충분한 물과 간식을 가져 오십시오. 특히 물의 섭취가 많은 곳이 없기 때문에, 특히 동그라미의 북부와 가장 거친 부분에 있습니다. 일정을 확인하십시오, 당신은 낮에는 월요일 부분이 아니라 북부 구간을 방문 할 수 있습니다. 하이킹에 대한 자세한 내용은 우수 웹 사이트를 확인하십시오. 잠시 휴식을 취하고 약 12 시간이 걸렸습니다. 나는 그것이 가장 힘든 곳이기 때문에 북부 지역을 먼저했다. 당신은",5,1218,"I finally achieved the goal of following the whole city wall. If this is the case, start early and bring plenty of water and snacks. Especially since there is no place with a high intake of water, it is especially in the northern part of the circle and the roughest part. Check the schedule, you can visit the northern section during the day, not the Monday part. For more information on hiking, visit the top Web site. It took about 12 hours to relax. I put the northern part first because it's the hardest part. You're."
Been a few places,우리는 서울의 성벽 중 절반 정도를 걸 으면서 환상적인 하루를 보냈습니다. 우리가 더 많은 것을하지 않은 유일한 이유는 남편이 잘못된 신발을 신 었다는 사실이었습니다. 아름답게 양지 바른 날이었고 도시 위의보기는 훌륭했다. 그리고 우리는 길을 따라 lovely 한 점심을 먹었다. 나는 당신이 도시에 있으며 자연과 역사에 동시에 몰두하고 있다는 사실을 좋아했습니다. 그것은 벽의 여러 섹션을 위아래로 많은 단계가 있기 때문에 쉬운 하이킹이 아니지만 그 좋은 운동을 의미합니다! 하이킹은 모든 하이킹,5,1218,"We had a fantastic day walking about half the walls of Seoul. The only reason we didn't do more was that my husband wore the wrong shoes. It was a beautiful sunny day and the view above the city was excellent. And we had a lovely lunch along the road. I liked the fact that you were in the city and immersed in nature and history at the same time. It's not an easy hike because there are many steps up and down in different sections of the wall, but it means the good exercise! Hiking is all hiking"
JHL,"조선 시대 서울 (한양)을 중심으로 구축 된 놀라운 성벽입니다. 수십 년에 걸쳐 대부분의 부품이 재구성되었지만 방문하는 것은 재미 있습니다.  - 당시 한국인들은 산책을하고 도시 벽의 경치를 즐기곤했습니다. 그리고 오늘 다시 그것을 느낄 수있는 안내지도가 있습니다.  - 성벽 중 동대문 성곽 공원과 백복 공원 (백백 광장)은 쉽게 접근 할 수 있습니다.  - 도시의 벽은 몇 개의 트랙으로 구성되어 있는데, 이는 완전히 연결되지 않았 음을 의미합니다. 낙산 공원과 남산 공원은 두 가지로 붐비고",5,1218,"It was built around Seoul (Hanyang) during the Joseon Dynasty. Over the decades, most parts have been reconstructed, but visiting is fun.  - At that time, Koreans used to take a walk and enjoy the view of city walls. And there's a guide map to feel it again today.  - Among the walls, Dongdaemun Fortress Park and Baekbok Park are easily accessible.  - The city walls consist of several tracks, which means they are not fully connected. Naksan Park and Namsan Park are crowded in two ways."
Amy M,"성벽을 걷는 것이 얼마나 현대적인 서울 되고, 동시에 과거의 경험을 깜박입니다 정말 좋은 방법입니다! 일 수 있는 시간에 따라 쉽고 간단한 1시간 경로 또는 열심히 3선택할 수 있습니다. 5시간 경로. 시간을 정말 짧은 경우 아주 멋진 최대 낙산 직접 계단을 올라 4개 걸어서 갈 수 있습니다! 저희는 동대문 게이트 시작한 서울 도시 성벽 박물관(무료)을 통해 걸어 나서 낙산 박은 계속했다. 한시간 정도가 걸렸습니다. 이 경로에 가파른, 매우 안전하고. 벽 옆에 즉시 않는 이상 경로를 시멘트",4,1218,"Walking on the walls becomes a modern Seoul, and at the same time blinks past experiences. That's a great idea! You can choose an easy and simple one-hour route or three hard times depending on how long you can be. a five-hour route If the time is really short, you can walk up the most spectacular direct stairs to get there! We walked through the Seoul City Wall Museum (free) where Dongdaemun Gate started, and continued Naksan Park. It took about an hour. Steep on this path, very safe. cement path unless immediately beside wall"
TravelEatXplore,"상단 긴 벽을 당신이 원하는 있으므로 운동화. 당신이 집을 몇 번 이 지역에 다시 생성된 참조 벽을 따라. 도시의 환상적인 전망을 볼 수 있습니다 꼭대기. 볼만 했다. 이곳은 무료. 모든 길을 걷고 싶지 않다면, 길을 왼쪽으로, 내리막 및 지역 참조하십시오. 오래된 사람들 가운데 일부는 놀라운 형태를 이루고 있습니다. 그들은 가는 겁니다 최대 가파른 길을 따라 걸어. 근처에 있는 서울 박물관이 있습니다. 먼저 참조하십시오.",4,1218,"Sneakers because you want the top long wall. Along the reference wall that you have recreated your home several times in this area. You can see a fantastic view of the city. Top. It was worth seeing. This place is free. If you don't want to walk all the way, see Road to the left, Downhill and Region. Some of the older people have an amazing form. They're going. Walk along the steepest road. There is a Seoul museum nearby. See first."
Indra Sadewa,도시의 매우 아름다운 전망을 줄 수 있는 꼭대기가 걸어 확인합니다. 하이킹 및 시간 가치가 있어요. 이 박물관에서 너무 드롭다운 목록에서 확인합니다.,4,1218,Walk from the top that gives you a very beautiful view of the city. It's worth hiking and time. See too much drop-down list for this museum.
bwkchang,"서울 성곽 중 상당 부분을 제거합니다. 서울의 오래된 도시 벽 보고 나머지 부분을 그대로 유지됩니다. 그러나, 우리는 수 많은 현대적인 수리를 볼 수 있는 유지 관리 도시 벽. 경우 가 본 중국 만리장성, 시안 시티의 벽, 있습니다, 서울 성곽 이 특별한 것도 느낄 수 없었다.",2,1218,"It removes a large part of the Seoul fortress. The rest of Seoul's old city walls are kept intact. However, we can see countless modern repairs on the maintenance city walls. I could not feel anything special about the Great Wall of China, the walls of Xian City, and the Seoul Fortress."
Truthful Reviews,이는 벽에 비하면 만리장성. 그러나 수 벽 위에서 좋은 사진을 가지고 있는 남산공원. 바람 은 위에서 아래로 벽 입니다. 다음의 벽이 없는 마음에 넣어두면 가장 위쪽 또는 아래쪽에 있는 운동!,5,1218,"Compared to the wall, this is the Great Wall. But Namsan Park, which has good pictures on several walls. Wind is a wall from top to bottom. The exercise at the top or bottom when placed in a heart without the following walls!"
Kim T,"성곽 을 따라 산책을 즐길 수 있게. 자연과 도시의 멋진 전망을 가지고. 저는 저녁에 산책하기, 밝은 바깥에 있어서 제가 시작 및 완료, 어두워. 없지만, 밤에 조명이 많은 도시 벽 램프 및 밝기를 어두운 경로를 다른 뷰. 벽을 따라 수많은 자연 뿐만 아니라, 옆에 있는 몇 가지 zhangijiajia. 오갈 뿐, 꽤 괜찮은 벽을 따라 산책을 하기 때문에 운동 기구. 한 지역에 많은 휴식을 붇돋아주었고. 관광 명소를 방문한다면 꼭 방문해야 하는 연습을 하면서 서울에 있는 환상적인 전망!",5,1218,"To enjoy a walk along the castle. with a fine view of nature and the city I'm taking a walk in the evening, and it's bright outside, so I start and finish, and it's dark. No, but a different view of illuminated city wall lamps and dark paths at night. Any of several zhangijiajiajia beside, as well as numerous nature along the wall.Exercise instruments, as they take a walk along a fairly decent wall. It gave a lot of rest in one area. A fantastic view of Seoul while practicing what you must visit if you visit tourist attractions!"
Anna H,동대문에 플라자 호텔에서 짧은 도보 거리. 먹을 수 있는 게이트가 된 부품의 도시 벽에 둘러 싸여 이제 도시 에서 한 번 envaders. 밤에는 입장료 없이 볼 것이 가장 좋습니다. 보기 좋은 바쁜 도로.,3,1218,"A short walking distance from the Plaza Hotel in Dongdaemun. Surrounded by the city walls of edible parts, now once in the city, it's best to see them at night without entrance fees. a pleasant busy road"
mmrie,"저는 동대문 역에서 내리면, 어느 경로를 쉽게 찾을 수 있는. 후에 가보고 왼쪽 ihwa 빌리지에 - 손으로 하면, 많은 카페들이 있는 경우 매우 들뿐이었고 selfie - 튀김. 일단 방문한 최상위 낙산 공원, 이곳을 오른쪽 경로 - 손으로 벽 옆 (제가 내 리트레이스에 대해 단계). 저는 걸어서 갈 수 있지만 해당 경로 정보 센터 문 창의문 으로 완전히 덮여 있는 얼음 malbawi 숙정문, 내 신발은 내 입 에서 관리할 수 없습니다. 나는 결국 길을 조금, 삼청 공원에서 산책 후, 이",5,1218,"If I get off at Dongdaemun Station, which route can I find easily? Go later and go to the left ihwa Village - if you do it by hand, it was very crowded if there were many cafes and selfie - fried. The best Naksan Park you've ever visited, this is the right path - by the wall by hand (I'm in the process of my retrace). I can walk, but I can't manage my shoes from my mouth, the ice Malbawi Correctional Gate, which is completely covered by the corresponding Path Information Center door window. I ended up walking a little bit on the road, after a walk in Samcheong Park, Lee,"
Sam,"좋은 인상. 바로 옆에 mariott 지하철역, 쇼핑 시장. 한 인상의 작은 도시의 멋진 풍경",5,1218,"Good impression. Mariott subway station, shopping market right next to it. Great view of a small city with one impression."
HelmerAslaksen,"저는 서울에서 가장 좋은 것은! 전체적으로 반복할 수 있다 하루, 또는 부분 이 작업을 수행할 수 있습니다. 미리 여행사를 맵을 계획. 부품을 통해 백악산 343 m, 340 인황 산 m, m 및 m 124 호점 271 낙산 단계 다. 이 등산, 산책한 공원. 이 길을 찾기 어려울 수, 특히 성벽 이 도시가 없습니다. 다행히도, 작은 판 또는 원형 에 있어 도로, 건물 벽 램프 포스트 또는 요새 트레일 또는 연결된 라고 hanyangdoseong. 또한 이 점을 주의 깊게 봐 경로 맵 어서,",5,1218,"The best thing about Seoul is! can be repeated as a whole You can do this for a day or part of the day. Plan to map out the travel agency in advance. Through the parts, it is 343 m from the White House, 340 phosphoric acid, m, and m 124 from the second point, 271 from the second stage. This hiking, this walking park. It can be difficult to find this way, especially the Wall, without this city is not here. Fortunately, on a small plate or circle, a road, a building wall lamp post, or a fortress trail or connected. Also, look carefully at this point, route map, come on,"
JuliaGo2014,"저는 정말 많은 즐거움 이 있어 몇 시간이나 걸어서 갈 수 있는 느린 속도. 서울의 멋진 전망을 얻을 수 있고, 감사합니다, 여러 곳에 있는 동안 휴식. 하지만 안 좋았습니다 - 이 산을 걷는 것 같기 두 도시. 물을 - 내 실수 였습니다. 이 말을 - 해서 힘든 순간 들 - 서울에 있는 습기가 많은 기후 나고, 좋지 않아서. 편안한 신발을 선택 및 스포츠, 카메라 및 잊지 마세요. 전망이 정말 놀라운, 특히 공원 이 있습니다.",4,1218,"I've got so much fun that I can walk for hours at a slow pace. You can get a nice view of Seoul, and thank you, relax while you're in many places. But it was bad - it felt like walking on this mountain two cities. Water - it was my mistake. That's what I'm saying. - So hard times. - There's a humid climate in Seoul, and it's not good. Choose comfortable shoes and don't forget sports, cameras, and all. There's a park where the view is really amazing."
e-Laurent,"이 긴 산책 의 일부는 매우 가파른 18 km 이다. 트레일을 따라 이 카운티까지 걸어갈 수 있는 요새 벽, 몇 번을 서울의 전망도 (있는 경우 암호를 통해) 에서 경비를 제한 영역, 카메라 및 동작 감지기 (블루 하우스 보안).",4,1218,"Part of this long walk is very steep 18 km. The fortress walls that can be walked along the trail to this county, several times on the view map of Seoul (by password, if any) to limit security, cameras and motion detectors (blue house security)."
