u_id,u_rate,p_id,review,review_en
emscheong,3,1338,"제주 전용 제품 수령 오설록 차 박물관 근처의 이니스프리 제주 하우스에는 카페와 상점이 있습니다. 그 선택은 훌륭하지 않으며 무료 샘플을 제공하지 않지만 일부 제주에만 점수를 매길 수 있습니다. 틀림없이이 제품들이별로 없었습니다. 명주로 가면 지갑에 훨씬 더 만족스럽고 쉽게 갈 수 있습니다. 아니면 DIY 비누 만들기 활동 (상점에서 키트를 판매하기 때문에 직접 할 수도 있음)을 들러보고 싶으면 도시의 번잡함을 벗어나는 평화로운 방법 인 것 같습니다. 나는 Innisfree 제품을 좋아해서 들러 보지 않았지만,","Receiving products exclusively for Jeju, Innisfree Jeju House near the Oseolok Tea Museum has cafes and shops. The choice is not great and we don't offer free samples, but only some Jeju Island can be scored. I'm sure there weren't many of these products. If you go to Myungjoo, you're much more satisfied with your wallet and it's easier to get there. Or if you want to stop by DIY soap making activities (you can do them yourself because they sell kits at stores), it's a peaceful way out of the city's hustle and bustle. I like Innisfree products so I didn't visit them."
Shufen C,1,1338,여기에 시간 낭비하지 마라. 제주에서 많은 흥미로운 곳을 방문 할 수 있습니다. 제한된 범위의 제품. 실망. 그것이 내가 낮은 점수를주는 이유입니다. 비누 만들기? 모든 방송국이 꽉 찼습니다. . 선반에서 날아 다니는 제품은 보지 못합니다. 쇼핑을 많이하면서 사람들이 상점을 벗어나는 것을 보지도 않습니다. 징후를 알려라! 옆집에가. 오술록 차 박물관. 먹고 거기서 보내십시오. . .,"Don't waste your time here. You can visit many interesting places in Jeju. Limited range of products. Disappointed. That's why I give low scores. Making soap? All stations are full. I can't see the products flying on the shelves. While shopping a lot, I don't even see people leave the store. Let me know the signs! Next door. The Osulok Tea Museum. Eat and spend there. . . . ."
bjklms,5,1338,"유기 비누 만들기 작업장 및 녹차 간식 비누 만들기 워크샵은 아이들과 커플에게 재미 있고 재미 있습니다. Innisfree Jeju House는 유명한 O'Sulloc 녹차 옆에 있으며, 차 농장에서 비누 만들기 워크샵, 차 휴식 및 사진 작업을하기 위해 최소한 2 시간에서 3 시간 정도는이 두 장소에서 보낼 수 있습니다.","Organic soap making workshops and green tea snack soap making workshops are fun and fun for children and couples. Innisfree Jeju House is located next to the famous O'Sulloc green tea, and you can spend at least two to three hours on tea farms for soap making workshops, tea breaks, and photography."
Vivien F,5,1338,"내 fav 장소! 우리가 여기에 도착하기 위해 버스를 타 았던 이래로 우리가이 장소에 도착하는 것은 잠시했다. 장소는 우리가 거기에서 점심을 먹는 정말로 조용하고 평온하다. 그러나, 일부 소녀들은 흥분을 상상할 수 있도록 사진을 찍고 있습니다. 웃음! 또한 Hallabong 주스와 같은 다른 매장에서는 사용할 수없는 일부 Innisfree 제품을 구입할 수 있습니다. 나는 내가 더 사지 않았다는 것을 후회했다! 다음에, 나는 더 살 것이다! = P","My fav place! It's been a while since we took the bus to get here. The place is really quiet and peaceful where we have lunch there. However, some girls are taking pictures so that they can imagine their excitement. Laughter! You can also purchase some Innisfree products that are not available in other stores such as Hallabong Juice. I regretted that I didn't buy more! Next time, I will live more! = P"
XUANLIN,4,1338,"점심을 먹고 DIY 비누를 만들었습니다. 참조 용으로 첨부 된 메뉴. 우리는 다이버 세트, 눈 볶음 차 자몽, 카놀라 꿀 라떼를 주문 했습니까? 아주 맛있어! 비누 세트는 15,000 원입니다!","I made DIY soap after lunch. A menu attached for reference. Did we order a set of divers, fried snow tea grapefruit, and canola honey latte? It's very delicious! A soap set costs 15,000 won!"
JungleTraveller,4,1338,"음료와 먹거리를위한 평화로운 장소 뒤에서 또는 Osulloc 차 박물관 Innisfree 집입니다. 이것은 마실 것과 작은 식사를 먹는 훨씬 더 평화로운 장소 다. 그러나 불행하게도, 우리는 Osulloc에서 그러므로 우리 음료를 인식하지 않고 있었다. 그러나 평화로 웠기 때문에 우리는 여기에서 또 다른 마실 것을 마셨다. 그리고 우리는 평온을 필요로했다. 우리가 Osulloc에서 Innisfree까지 30 걸음 걸었다 고 귀엽다. 우리는 뱀이 있다는 신호를 보았다. . . 우리는 군중과 소음의 양으로 생각할 것입니다, 뱀은","Behind a peaceful place for drinks and food, or at the Osulloc Tea Museum Innisfree House. This is a much more peaceful place to drink and eat small meals. Unfortunately, however, we were therefore not recognizing our drinks in Osulloc. But because we had peace, we drank another drink here. And we needed peace. We walked 30 steps from Osulloc to Innisfree and cute. We saw a sign that there was a snake. . . . . we would think of it as the amount of crowd and noise, the snake."
Zac C,3,1338,작은 장소 오슬록 차 박물관과 비교하면 껍질을 벗긴다.하지만 그들은 나란히 서있다. 기프트 샵의 제품은 널리 사용되는 이니스 프리 (Innisfree) 페이셜 제품입니다.,Peel off the skin compared to the small place Oslo tea museum.But they are standing side by side. Gift Shop products are widely used Innisfree facial products.
Jaclyn Rosa,5,1338,"비누 만드는 세션 재미 나는 이 곳을 SOAP 제공하는 소리가 나는 즉시 것입니다. 사실 꽤 재미, 15K-자료를 구입할 수 있습니다3 기본, 3 ppl 함께 공유할 수 있습니다. Tablet 지침에 따라 쉽고 15내에 20분 합니다. 사진을 찍을 수 있는 작은 차 농장.","Soap making session. It's as soon as you hear the sound of SOAP providing this fun place. In fact, it's quite fun, you can buy 15K-materials.3 Basic, 3 ppl can be shared together. Follow the Tablet instructions for 20 minutes within 15 minutes. A small tea farm where you can take pictures."
travellero23,4,1338,방문하기 좋은 이 우리가 방문한 첫 번째 장소입니다. 매우 흥미로운 비누 만드는 프로그램을 시도했습니다. 녹차 필드를 모두 멋진,This is the first place we've visited. I tried a very interesting soap-making program. All green tea fields are wonderful
putriizwaniza,5,1338,"아름다운 카페 나는 다른 사람들이 언급한 것을 반복하지 않습니다. 개인적으로 저는 이 곳을 좋아하 한다. 동안에 나는 봄 4월 2017, 날씨는 완벽했다. 음식은 아름답게 제시, 라떼 맛있을 것 였다. 채소 는 그 음식을 장식하는 - 가치가 있습니다! 내 친구들과 내가 야외에서 하는 아침 식사, 차가 내려다 보이는 농장. 스킨 케어 제품의 판매 독점 이 있는, 몇 가지 사 길 정말 잘했다고 생각. 제주도에 방문한다면 꼭 다시 갈 수 있었어요.","Beautiful cafe I don't repeat what other people have mentioned. Personally, I like this place. During the spring, April 2017, the weather was perfect. The food was beautifully presented, and the latte would be delicious. Vegetables are worth decorating the food! Breakfast that my friends and I have outdoors, a farm overlooking a car. I think I did a really good job buying some of the things that have exclusive sales of skincare products. If I visit Jeju Island, I could definitely go again."
Piggogo,3,1338,"즐거운 카페 분위기 좋은 카페가 많은 사람들이 아침에 있었다. 전망도 즐길 수 있었는데 정말 아늑한 벽난로 카운티까지. 검은색 돼지 고기 소시지 도 나쁘지 않았다. 이 곳은 사람이었는데, 그가 많은 멋진 것일 것이다. 안에 들어 있는 비누를 직접 만들 수도 한번 하지 않았다. 나같은 제품. 저는 구입하지 않은 모든 처럼 같은 서울에 없는 거래. 그래서 모든 방법을 확인하지 않았다 는 도시의 마지막까지.","There were many people in the morning who had a pleasant cafe atmosphere. I could have enjoyed the view, and it was really cozy up to the fireplace county. Black pork sausage wasn't bad either. This place was a man, and he must be a lot of cool stuff. I never made my own soap inside. A product like me. I'm not in the same Seoul as everyone I didn't buy. So to the end of the city that didn't check all the ways."
Jochiang,4,1338,"비누 를 직접 우리가 간 이 곳에는 비누를 직접 워크숍. 재미있고 쉬운, 그냥 단계에 따라 컴퓨터 앞에서 비디오를 보여 주었다. 그런 다음 고객의 독특한 비누 만들지 수 있습니다. 카페도 있어서 가벼운 점심. 여러 제품을 사도 이니스프리 광고! 좋은 곳을 한 시간 동안 비가 내리는 날.","We went to this place where we went to the soap ourselves, and we went to the workshop. Fun and easy, just following the steps, I showed the video in front of the computer. Then you can make your customers' unique soap. There's also a cafe, so light lunch. Even if you buy a variety of products, Innisfree ads! A rainy day for an hour at a nice place."
Msmagmay,3,1338,특별한 아무것도 관광객이 많은 곳이고. 할 수 있는 특별한 것이 아무것도 없습니다. 이 제품의 구입 했지만 제주도 여행 무료 국가는 세금을 세금. 쇼핑할 경우 airpot.,"Nothing special is touristy, nothing special can be done. I bought this product, but free travel to Jeju Island is tax. If I shop, I buy it."
Sgrocks,4,1338,"쉽게 갈 수 있는 지 제주 시내에서 이동하기 쉬운. 갈 때는 버스를 타고 30분 정도 시간이 걸리는 것. 바로 옆에 있어서 방문하기 좋은 두 곳을 동시에 osulloc. 보지 않는 비누를 만들 수 있는 작은 팩을 곳이 다. 카페에서 식사를 했습니다. 예쁜 레이아웃, 얼음 이 기 때문이다. 네 가 할 수 있는 음식. 언제나 음식이 준비된 에피 택셜층을, 여행을 갈 만 다.","Easy to go, easy to move from downtown Jeju. It takes about 30 minutes by bus to get on the bus. Two good places to visit because it's right next to you at the same time osulloc. A small pack for making unseen soap. I had a meal at the cafe. It's because of the pretty layout, ice. The food you can make. The Epi Tactics, where the food is always ready, deserve a trip."
thetravellingfugu,5,1338,"비누 를 만드는 좋은 카페 닿을 수 있는 그대로 o ' 설록차 뮤지엄, 꼭 가봐야 하는 곳입니다 - 오! 나는 당신이 자신의 비누 에 강력하게 추천합니다 - 이곳의 재미있고 독특한 경험! 할 것이다 잡아 먹고 카페에 있지만 맛있는 음식이 건강한 음식 뿐만 아니라!","A good cafe for making soap. O'Sulrokcha Museum, it's a must-see place. - Oh! I strongly recommend you to your soap - a fun and unique experience here! Eating and staying at a cafe, but delicious food is not only healthy food!"
Lee_LL,5,1338,"건강한 식사와 함께 편안한 분위기를 이 장소는 버스로 쉽게, 다음 o ' 차 설록차 뮤지엄. 에 들어가는 순간부터 아주 아늑한 느낌이 들게 만든다. 이 카페도 만들 수 있는 워크숍 장소는 없었다. 또한 자신의 제품 판매 (한정). 나는 놀라울 정도로 건강한 아침 식사는 아주 맛있는 유기농. 하지만, 이는 비싼 편.","This place is easy by bus with a healthy meal and comfortable atmosphere. Next o ' tea Seolok tea museum. It makes you feel very cozy from the moment you enter. There was no workshop place to make this cafe. Also, sell your product (limited). I have an amazingly healthy breakfast that is very delicious organic. However, it is expensive."
Lolyta Darmawan,4,1338,즐기고 휴식을 취할 이 곳은 매우 상쾌한 및 를 진정. 오후의 차를 즐길 수 있는 좋은 곳. 서명 음료를 다하 적오렌지색을. 제주에 있기 때문에 그는 아주 정상 작동이 확인된.,"This place to enjoy and relax is very refreshing and soothing. A nice place to enjoy the afternoon tea. Red orange with all the signed drinks. Since he is in Jeju, he has been confirmed to be in good working order."
kspace,5,1338,"작지만 좋은 음식과 비누 크라프츠 이니스프리 브랜드 매장이 많은 한국은 아시아 대륙 에 걸쳐 한다. 이 제주도에서 유래, 주로 한국이 유출구. 기대했던 것보다 훨씬 작고, 단 하나의 긴 건물 주택 공장과 카페. 갖춰져 있는 조용한 세면도구와 화장품 은 다양한 상점, 천연 비누 만드는 활동과 함께 사용할 수 있습니다. 카운터 구입할 수 팩, 비누 향내 를 선택, 화면에는 정거자 비누 과정을 안내하는 단계별. 가게 직원들이 함께 지원을 요청할 수 있습니다. 그 말에, 수있게 에코 백 팩 비누를 선물로. 이 카페 에는 넓은 좌석은","South Korea, which has small but good food and many Innisfree brand stores, spans the Asian continent. Originating from Jeju Island, Korea is mainly an outlet. Much smaller than expected, only one long building housing factory and cafe. Silent toiletries and cosmetics can be used with various shops and activities to make natural soap. Select Counter Purchase Water Pack, Soap Scent, and on the screen, step by step to guide you through the station soap process. Store employees can request support together. In that sense, give me eco-bag soap as a gift. This cafe has spacious seats."
Agustini90,3,1338,"근사하고 아늑한 그 옆에 있는 o ' 차 설록차 뮤지엄. 오, 그냥 버스 정류장에서 버스를 타고 no. 755 바인딩되는 pyonghwa - 댐핑할 글로벌 교육 및 았는지 한다 ' 차 설록차 뮤지엄 역. 판매 화장품, 스킨 케어 제품, stationaries, 비누 d.i.y, 등... 또한 파는 카페가 있는데 bingsu, 음료 및 음식. 생각해보세요. (쵸코 쿠키 쉐이크) 초코쿠키쉐이크, 6000원 정도의 맛은 좋았지만 양이 조금 작은 것 (를). 좋은 방문 하기를 방문한다면 o ' 설록차 차 박물관 바로…","O' Tea Sulok Tea Museum next to it, nice and cozy. Oh, no. 755 binding by bus at the bus stop, no. 755 binding pyonghwa - 'Cha Sulokcha Museum Station. Sales cosmetics, skincare products, stations, soap d.i.y., etc. There is also a cafe that sells bingsu, drinks and food. Think about it. (Choco Cookie Shake) Chocolate Cookie Shake, which tasted good for 6,000 won, but has a small amount. Have a nice visit. O'O 'Sulrokcha Tea Museum..."
Ming Zhe L,3,1338,그냥 카페 기본적으로 많은 이니스프리 제주에 카페와 상점은 없었지만. 가격이 비싸다는 점도 카페에서. 매우 저렴한 가게도 항목이 없습니다. 수 있는 것이 제주공항 면세점에서 마스크를 만들어 사용할 수 있는 스프와 제외.,There were no cafes and shops in Innisfree Jeju. The fact that it's expensive is also at the cafe. Even very cheap stores don't have items. What you can do is make a mask at the duty-free shop at Jeju Airport and exclude soups that you can use.
