u_id,u_rate,p_id,review,review_en
사장님,3,1338,카페가 더 멋있는 이니스프리 제품만 판매하지 않고 제주 특산품으로 만든 음료까지 판매하는 카페가 있어 정말 좋았어요 그리고 이니스프리 제품도 여기서먼 구입 할 수 있는게 있어 신기하고 좋았네요,"It was really nice to have a cafe that doesn't only sell fancy Innisfree products, but also sells drinks made from Jeju specialties. And it was amazing and nice to have Innisfree products only here."
Luc,5,1338,카페 형식으로 구성되어있어서 생각보다 좋았어요. 굳이 제주도에 와서 이니스프리 매장을 왜 가야하나 생각했는데 여기서만 파는(본점) 제품이 있다고 해서 시간도 비는 김에 방문했는데요. 카페 형식으로 되어 있고 넓은 공간 내에 다양한 상품들이 진열되어 있어서 둘러보고 디퓨저 등을 시향하기에 좋았어요. 장사가 잘 되는지 옆에 새로 건물을 하나 더 오픈했더라고요. 일반 이니스프리 매장을 방문하는 것과 달리 여행 온 느낌이 나서 특히 좋았어요.,"It was better than I thought because it was organized in the form of a cafe. I was wondering why I had to go to Innisfree store in Jeju Island, but I heard that there was a product only sold here, so I visited while I was free. It was in the form of a cafe and various products were displayed in a large space, so it was good to look around and try diffusers. They opened another building next to them to see if the business is going well. It was especially good because it felt like I was traveling, unlike visiting a regular Innisfree store."
H L,4,1338,위미올래감귤에이드 오설록은 돗대기 시장 같아서 정신이 없었는데 이니스프리 제주하우스 자연 컨셉도 좋았고 오설록차밭이 바로 창가에서 보여서 좋았어요. 위미올래감귤에이드는 가격이 좀 있었지만 (6500원) 보라색 도라지액을 부어 마시는 게 신기했어요. 강추합니다...사람도 적고 분위기 넘 좋았어요~,"Wimi Olae Tangerine Ade O'Sullock was busy because it was like a matting market, but Innisfree Jeju House's natural concept was good, and it was nice to see the O'Sullok tea field right by the window. Wimiola citrusade was a bit expensive, but it was amazing to pour purple balloon flower juice. I strongly recommend...There were few people and the atmosphere was so nice."
triphyun,5,1338,나름 조용하고 쉬기 좋았던곳 오설록에서 쇼핑좀 하고 잠시 들러 벚꽃히비스커스 차를 먹었습니다. 사람들도 오설록에 비하면 완전 없는수준이라 조용하게 차한잔 먹을수있는 분위기라 편히 쉴수있었어요. 차를 좋아하시는 분이면 히비스커스차도 드셔보세요!,"I went shopping at Oseolok, where it was quiet and easy to rest, and stopped by for a while and had a cherry blossom hibiscus tea. People were not as good as Osulok, so they could enjoy a cup of tea quietly, so they could relax. If you like tea, try the hibiscus tea!"
ShinSKim,5,1338,브런치 추천합니다 아이와 함께 브런치를 먹으러 방문을 했습니다. 6살 아이도 맛있게 잘 먹는 제주도시락 브런치 강추합니다. 도시락을 먹은 후 비누만들기 체험도 재미있게 했어요.,"I recommend brunch. I went to eat brunch with my child. I strongly recommend Jeju lunch box brunch for a 6-year-old child. After eating the lunch box, I had fun making soap."
쏘옹쏭,3,1338,오설록 간김에 들르는곳? 오설록 티하우스처럼 뭔가 브랜드 배경이나 설명이 있어도 좋지 않았을까 싶습니다 그냥 구경하긴 나쁘지 않은데 카페도 메뉴 많지만 이미 오설록 들렀다 갈 가능성이 높으니까 마실 일이 거의 없을거같고요 차라리 이 매장에서만 파는 제품이 있다거나 그랬으면 어땠을지..,"A stop in the middle of a bump? I think it would have been nice to have a brand background or explanation like Oh Seol-rok's T-House. It's not bad to just look around, but there's a lot of food in the cafe, but it's very likely that we'll stop by already, so I don't think we'll ever have much to drink. I'd rather have a product that's only sold in this store or something like that."
Connector706652,5,1338,오셜록 옆에 있으나 비교적 매우한산한편 이달에만 두번 정도 방문햤는데 ㅋㅋㅋㅋ 브런치 도시락 꼭 시켜 먹으세요 사진이랑 존똑으로 나옴... 대체로 음료들은 달지않고 후..복숭아 디저트는 이쁜데...이쁘기만함,"It's next to O'Sherlock, but it's relatively quiet, so I've visited there about twice this month. Please order brunch lunch box. Photographs and john-knock... Usually, drinks aren't sweet.Peach dessert is pretty...Just pretty"
게으른여행자,4,1338,"가족여행. 딸이 좋아하는 장소 오설록뮤지엄 옆에 위치한 이니스프리의 차별화된 공간. 제주에서만 판매하는 일부 제품이 있으나, 많지안음. 스탬프찍기, 비누만들기 등 체험할 것이 조금 있으나, 아주 재밌지는 않음. 이곳의 가장 만족스러운 부분은 내부의 카페테리아로 제주스러운 음료와 먹거리가 있다는 점. 가격은 다소 비싸게 느낄지 모르겠지만, 비주얼이 좋아서 인증샷찍기에는 아주 좋은 아이템. 맛도 좋은 편. 연인 혹은 초등학교 고학년에서 중학생 정도의 딸아이가 함께하는 여행자들에게 추천함.","Family trip. The daughter's favorite place, the differentiated space of Innisfree, located next to the O'Sullock Museum. There are some products sold only in Jeju, but not many. There are some things to experience such as stamping, making soap, etc., but it is not very fun. The most satisfying part of this place is the cafeteria inside, which has Jeju-style drinks and food. The price may seem a bit expensive, but it's a very good item to take a proof shot because it looks good. It tastes good, too. Recommended for travelers with a lover or a daughter from a senior to a middle school student."
Dalnim S,4,1338,밥 맛있음 여기 카페에서 해녀 바구니? 사먹었는데 자극 없고 아주 맛있게 먹었어요 특별한 메뉴는 아닌데 간도 슴슴하니 맛있었어요 제주도에서만 파는 이니스프리 제품이라고 그래서 샀는데 패키지만 그렇고 다른데서도 팔았음,"The rice is delicious. Do you have a haenyeo basket here at the cafe? I bought it, but it didn't irritate me, and I enjoyed it. It's not a special menu, but it was delicious because it was salty. I bought it because they said it was only sold in Jeju Island, but it was sold elsewhere including package."
dulheemom,4,1338,아이 데리고 가도 좋아요 오설록 간 김에 들르는 곳이지만 아이들이 비누 만들이 체험을 할 수 있어 아주 좋아했어요. 원하는 비누만들기 키트를 선택하면 만드는 방법을 친절하게 알려주십니다. 카페도 있는데 오설록보다 한가해서 시끄러운 것 싫으신 분들은 이 곳에서 쉬었다 가시는 것도 좋을거 같았어요.,"You can take your child with you. It was a place where I stopped by while I was in Oseolok, but the children were very happy because they could experience making soap. If you choose the soap making kit you want, it kindly tells you how to make it. There's a cafe, but if you don't want to be loud because it's more leisurely than Oseolok, you might want to take a rest here."
cony76,5,1338,나만이 알고 싶으나 너무나 추천하고 싶은 매장 오설록이 너무나 유명하여 옆에 있으면서도 빛을 바라지 못한 매장~ 강추합니다. 특히 마시기에도 아까운 아이스티와 커피~ 그리고 추운 날 너무나 따뜻하게 먹었던 스프까지~ 오설록에 비해 가격은 조금 더 저렴한 편이나 매장의 인테리어나 재미와 제품 모두 너무나 만족했습니다. 제주도 오설록 가시는 분들 꼭 들러보세요~ 후회하지 않으실 꺼예요`,"Oh Seol-rok, the store that only I want to know but I really want to recommend, is so famous that I can't wait for the light even though I'm next to him. I strongly recommend it. Especially iced tea and coffee. And the soup that I had on a cold day. The price is a little lower than Oseolok, but I was very satisfied with the interior of the store, the fun and the product. If you're going to Oseolok in Jeju Island, make sure to stop by. You won't regret it.`"
순늉,4,1338,여유 바로 앞 오설록티하우스 보다 사람이 적습니다. 브런치도 팔고 차도 팔고 브런치 먹고 휴식하기 좋은 카페같습니다. 아이들은 비누체험 및 엽서만들기등 다양한 것들이 많네요...오설록티하우스 바로 옆인데 분위기가 여기가 더 괜찮은거 같아요.,"Fewer people than the O'Sulrock House right in front of the margins. It seems like a good cafe to sell brunch, tea, brunch and rest. Children have a lot of things like soap experience and postcard making.It's right next to the O'Sullock House, but I think the atmosphere here is better."
Seoyoung Y,4,1338,오설록 옆 조금 한적한 곳 오설록 뮤지움 옆에 있어 오설록 보다 조금 덜 붐벼요. 하지만 음식이나 화장품 구경은 이니스프리가 훨씬 좋아요. 1시간 정도 걸리는 비누 만들기 체험도 즐겁습니다.,"It's a little quiet next to Oseolok. It's a little less crowded than Oseolok because it's next to the Oseolok Museum. But Innisfree is much better for food and cosmetics. Making soap, which takes about an hour, is also fun."
938yeseulk,3,1338,감귤 빙수가 그저 그랬음 한라산의 모양을 본따 만든 감귤 빙수는 맛이 평범했고 인테리어도 그다지 특별할 게 없음. 한쪽에서 비누 만들기를 진행하는 것 같던데 어린 아이들에게는 좋은 경험이 될지도.,"The tangerine shaved ice, which was made after the shape of Hallasan Mountain, tasted ordinary and its interior was not that special. It seems like you're making soap on one side, but it might be a good experience for young children."
조욘,3,1338,"정말 자연과 어우러지게 잘 꾸며놓은 곳 오설록 티뮤지엄을 들리는 김에 들리기 좋아요! 아니, 오히려 이니스프리 제주하우스 들리는겸 오설록을 슬쩍보고오는게 좋아요. 이니스프리 제주하우스는 화장실까지 잘 꾸며 놓았을 정도로 볼게 많아요! 제주에만 파는 화장품도 있고 (물론 사와서 잘 쓰진않지만! ㅎㅎ) 체험거리도 있구요. 앞에 오설록 녹차 밭이 있는데 정말 넓고 이쁘더라구요. 사진찍기도 정말 좋습니다. 하지만 뚜벅이 여행자에게는 생략을 해도 괜찮을만한 곳인것 같습니다. 물론 대중교통을 이용해서도 갈 수 있지만 버스를 한시간 넘게","It's a great place to visit while listening to the Oseolok Museum, which is well-decorated in harmony with nature. No, it's better to visit Innisfree Jeju House and take a peek at Oh Seol-rok. Innisfree Jeju House has so many things to see that it even decorated the bathroom! Some cosmetics are sold only in Jeju (of course, I don't use them often! There are things to experience. There was a green tea field in front of me and it was really wide and pretty. It's really nice to take pictures. But I think it's a good place to skip for travelers. Of course, you can use public transportation, but you can take the bus for more than an hour."
joywoong,5,1338,"티뮤지엄 보다 여기가 더 트렌디하고 멋집니다. 기업에서 꾸민 곳이라 기대 안했는데 매장이 너무 멋지고 커다란 창으로 보이는 풍경도 환상적입니다. 게다가 까페에서는 다른 곳에서 맛보기 힘든 개성있는 음료수가 한가득. 다 먹어보고 싶었지만 입이 둘이라서. 오설록 티뮤지엄은 까페에 사람이 너무 많아 앉기도 힘든데, 이 곳은 그나마 조금 여유가 있었습니다. 직접 비누 만들기 같은 체험도 가능해서 아이들이 시간 보내기도 좋아 보였습니다.","This place is more trendy and cool than the T-Museum. I didn't expect this place to be decorated by a company, but the store is so nice and the view that it looks like a big window is fantastic. Besides, there are many unique drinks that are hard to taste elsewhere in the cafe. I wanted to try them all, but I have two mouths. It's hard to sit in the cafe because there are too many people, but this place was a little more comfortable. Children seemed to be able to spend time because they could experience making soap by themselves."
졍,5,1338,"오설록티뮤지엄 바로옆 오설록 티 뮤지엄 방문했다가 들렀던 이니스프리 제주하우스. 하우스 안에 까페도 있고 직접 손으로 수제비누도 만들수 있고 제품 종류가 많아서 그게 좋았던 것 같아요. 저는 가서 디퓨저 구매 했는데, 집근처에서는 그 향이 다 없었던 것 같은데 분위기도 좋고 직원들도 친절해서 좋았어요","The Innisfree Jeju House, which I visited after visiting the Oseolok Tea Museum right next to the Oseolok Tea Museum. There is a cafe in the house and you can make handmade soap by yourself. I think that was good because there are many kinds of products. I went and bought a diffuser, but I didn't think there was a scent near my house, but the atmosphere was nice and the staff was kind."
zizibe9505,3,1338,"제주스러운 느낌은좋은데,사람이 너무 많아 제주스러운 느낌이 좋은데 관광객이 너무 많아 구경하기 힘들정도에요. 비누만들기 체험도 괜찮고 다 좋은데 사람이 많아서 정신없네요. 오설록 갔다가 들르기 좋아요.","I like the feeling of Jeju, but I like the feeling of Jeju because there are so many people, but it's hard to see because there are so many tourists. Making soap is good and everything is good, but it's hectic because there are so many people. It's good to stop by."
ryuskywalker,4,1338,"예쁜 인테리어와 맛있는 메뉴 오설록 티하우스와 붙어있는 이니스프리 제주 하우스. 이니스프리 화장품도 같이 판매하고 있고, 한켠에는 DIY수제 비누 체험관도 있다. 카페 메뉴는 제주 특산물로 만든 독특한 것들이 있는데, 그중 당근주스와 더불어 바나나우도땅콩두유 강추. 진심 이거 너무 맛있다.... 아무 생각없이 시켰다가 혼자 3잔 마신듯.","Innisfree Jeju House with beautiful interior and delicious menu Ohsulok T-House. Innisfree cosmetics are also on sale, and there is a DIY handmade soap experience center on the side. There are some unique Jeju specialties on the cafe menu. Along with carrot juice, banana milk is also highly recommended. Seriously, this is so delicious... It's like I ordered 3 cups of coffee without thinking about it's like I drank 3 cups alone."
Aehee P,4,1338,갈수록 사람들이 많아지네요. 처음 갔을 때보다 사람들이 더 많아져서 이제 좀 정신이 없네요. 녹차밭을 바라보면서 한적하게 브런치를 즐기기에 좋은 곳이라고 생각했는데 이제는 너무 복잡해요.,"There are more and more people. It's a bit chaotic now because there are more people than when I first went. I thought it was a good place to enjoy brunch while looking at the green tea field, but now it's too complicated."
헬레나향,5,1338,제주스러운 청량한 느낌의 이니스프리샵 제주 오설록 옆 낮은 언덕에 위치한 이니스프리 샵입니다. 아모레계열사들이기 떄문에 오설록과 스토리의 일관성이 있어요. 이니스프리가 제주도에 근거하여 자연주의를 표방하고 있기에 더더군다나 아름답고 세련되게 꾸며진 곳이죠. 천연비누를 만들 수 있는 체험존이 있는데 항상 사람이 많아요. 아이들도 체험하기 좋아서 제주도에만 가면 들릅니다. 각종 향을 테스트해볼 수 있는 공간도 있구요. 간단한 차와 먹을거리들도 팔고 있어요. 옆쪽으로 펼쳐진 녹차밭 뷰도 정말 멋지죠. 추천하는 공간입니다.,"Innisfree Shop with a Jeju-style refreshing feeling is Innisfree Shop located on a low hill next to Jeju Oseolok. Oseolok and the story are consistent because of the Amore affiliates. Innisfree is advocating naturalism based on Jeju Island.I'm a beautiful and stylish place. There is an experience zone where you can make natural soap and there are always a lot of people. It's good for children to experience, so they stop by Jeju Island only. There is also a space where you can test various scents. They also sell simple tea and food. The green tea field view on the side is amazing. This is the recommended space."
Diviva,1,1338,"지루하고 친절한 직원 이니스프리 제품을 구입하기 위해 여기에 오려면, 제품이 명동에서 찾을 수있는 것보다 훨씬 적습니다. 여기에서 유일한 매력은 비누 만들기 경험과 작은 차 농장입니다. 위치가 없습니다-여기에서만 판매되는 제품 만 있습니다. 매우 한정된 상품 판매. 직원들은 친절하지 않으며 항상 긴 얼굴을 당기고 있습니다. 방문 할 가치가 없습니다.","To come here to buy a boring and kind employee Innisfree product, there are far fewer products than you can find in Myeongdong. The only attraction here is the experience of making soap and a small tea farm. No location.-We only sell products here. a very limited sale of goods The employees are not friendly and always pull their long faces. It's not worth visiting."
beeling2018,4,1338,"1에서 3 경험 우리는 같은 지역에서 차 농장, 차 및 이니스프리 제품 쇼룸 및 카페를 볼 수 있기 때문에 1 경험에서 3이라고 불렀습니다. 좋은 제품, 음식 및 서비스가있는 곳입니다. 그것은 나에게 기억에 남는 경험이며 나는 그것을 매우 즐겼습니다!","1 to 3 Experience We call it 3 from 1 experience because we can see tea farms, tea and innisfree product showrooms and cafes in the same area. It has good products, food, and services. It was a memorable experience for me and I enjoyed it very much!"
JooS,5,1338,"편안한 분위기와 재미있는 워크샵 차 농장 옆에 자리 잡은이 아름답고 편안한 카페를 좋아하십시오. 아이들은 DIY 비누와 버블 폭탄 제작 워크샵을 즐겼습니다. 세트당 15,000 원으로 키트를 구매하면 다음 30 분 동안 반죽하고 DIY 과정을 즐길 수 있습니다. 온 가족을위한 재미있는 활동. 케이크와 음료도 v 좋습니다! 추억의 장소!","Enjoy a beautiful and comfortable cafe located next to a comfortable workshop tea farm. The children enjoyed DIY soap and bubble bomb making workshops. If you buy a kit for 15,000 won per set, you can knead it for the next 30 minutes and enjoy the DIY process. Fun activities for the whole family. Cake and drinks are good too! A place of remembrance!"
zyy,5,1338,재미와 치료 경험 폐관 시간 2 시간 전 오후 4 시경에 방문했지만 모든 것이 가능했습니다. 우리는 DIY 비누 제조와 목욕 폭탄 제조를 시도했습니다. 세금 환급도받을 수 있으므로 여권을 지참하십시오. DIY 세션은 매우 즐거웠으며 어린이에게는 훌륭한 경험이었습니다. 이니스프리 하우스는 작지만 매우 잘 관리되고 치료 적입니다. 얼굴 및 피부 관리를 위해 다양한 이니스프리 제품을 판매합니다. 카페 음료와 디저트도 훌륭했으며 차를 마시 러 가야 할 가치가 있습니다.,"Fun and treatment experience Two hours before closing time, I visited around 4 p.m., but everything was possible. We tried to manufacture DIY soap and bath bombs. You can also get a tax refund, so please bring your passport with you. The DIY session was very enjoyable and a great experience for children. Innisfree House is small but very well managed and therapeutic. We sell a variety of Innisfree products for facial and skin care. Café drinks and desserts were great, and it's worth a cup of tea."
Swee Cheng,4,1338,즐거운 방문 지난달 우리는 Yeha와 함께하는 제주 에코 & 역사 서해안 투어에서 서귀포에있는 이니스프리 제주 하우스를 방문했습니다. 이니스프리 화장품의 주력 매장이며 바로 옆에 Osulloc Museum & Cafe가 있습니다. 이것은 천연 성분으로 만들어진 모든 스킨 케어 및 미용 제품을 얻을 수있는 좋은 장소입니다. 장소의 디자인과 가구는 매우 달콤하고 세련되고 햇빛이 비치고 전체 장소를 밝게 해주는 충분한 길이의 창문으로 세련되게 완성되었습니다. 방문객들을위한 종이와 우표가있는 코너가 있습니다,"Last month, we visited Innisfree Jeju House in Seogwipo on Jeju Eco & History West Coast Tour with Yeha. It is the main store of Innisfree cosmetics and there is Osulloc Museum & Cafe right next to it. This is a good place to get all skin care and beauty products made of natural ingredients. The design and furniture of the place are very sweet and refined, with a window of sufficient length to illuminate the whole place with sunlight. There is a corner with paper and stamps for visitors."
FaizalP61,4,1338,좋은 음식과 비누 키트 비오는 날에 DIY 비누 키트를 사용하여 비누를 만들기 위해 방문했습니다. 다양한 모양과 향기로 자신의 비누 바를 매핑 할 수 있습니다. 레스토랑은 흥미로운 요리와 음료로 매우 좋습니다.,Good food and soap kit I visited to make soap using DIY soap kit on rainy days. You can map your soap bar with various shapes and scents. Restaurants are very good for interesting dishes and drinks.
SerCh,1,1338,"수리를 위해 휴관 6 월 4 일에이 장소를 방문했지만 수리를 위해 닫혔습니다. 운 좋게 그 옆에, O'sulloc Tea 상점과 박물관이있다. 그러나이 장소는 혼잡스럽고 화장실은 제주 전체에서 가장 악취가 난다. 그것을 건너 뛰고 한국의 다른 곳에서 Innisfree를 구입하십시오.","I visited this place on June 4th, when it was closed for repair, but it was closed for repairs. Luckily, next to it, there is an O'suloc Tea store and a museum. However, this place is crowded and the bathroom is the most stinking place in the whole of Jeju. Skip it and buy Innisfree elsewhere in Korea."
Jesslynn G,1,1338,수리 마감 2019 년 6 월 7 일에 방문하여 2019 년 9 월까지 수리를 위해 폐쇄되었다는 것을 알아 냈습니다. Thankfully 히 우리는 didnt한다 그렇게 비웃는 여행을 할 정도로 그것 옆에 Osulloc 차 박물관이 바로 있었다!,"The repair deadline was June 7, 2019 to discover that it had been closed for repair until September 2019. Thankfully he. We diddnt. There was the Osulloc Tea Museum right next to it so much as to make such a sneering trip!"
Tifany E,3,1338,"너의 제품을 사용하지 않는다면 흥미로운 것은 아무것도 .. 나는이 제품을 사용하는 사용자에게이 제품을 방문 할 것을 강력히 권하지 만, 거래가 콘센트보다 좋을 것이라고 기대하지는 않습니다.","If you don't use your product, there's nothing interesting. I strongly recommend that users of this product visit this product, but I do not expect a deal to be better than an outlet."
Leon,1,1338,"당신이 당신의 자신의 DIY 비누를 만들고 싶지 않는 한 올 것이다 점이 없다 부산, 대구, 서울의 무상 상점과 비교할 때 가격이 비싸기 때문에 구매하는 것이 어렵지 않습니다. 실제로 오슬록 차 박물관 (O'sulloc Tea Museum)과 가깝습니다. TLDR : 너의 시간 가치가 없어, 제주도 너무 아름다워 어딘가에!","Come as long as you don't want to make your own DIY soap. It is not difficult to buy because it is expensive compared to free shops in Busan, Daegu, and Seoul. It's actually close to the O'sulloc Tea Museum. TLDR: It's not worth your time, Jeju Island is so beautiful somewhere!"
carbs_at_night,1,1338,실망! 내가 본 5 성급 리뷰 모두가 너무 실망 스러웠다. 나는이 장소를보기를 고대하고 있었다. 기본적으로 가격이 비싼 평범한 음식과 차를 제공하는 Innisfree 상점입니다. 나는이 장소를 추천하지 않는다.,"Disappointed! All of the five hasty reviews I saw were so disappointing. I was looking forward to seeing this place. Basically, Innisfree stores offer expensive, common food and tea. I don't recommend this place."
EssaJtan,5,1338,"좋고 차분한 내가 키트와 함께 비누를 만들어야하는 곳은 꽤 평온한 곳이다. iPad (English, Chinese 포함)에서 영어 설명서로 쉽게 할 수 있습니다. 그들의 벚꽃 박하 추가하고 아름답게 만들어진 hallabong 디저트했다. 특히 Innisfree 사용자를 위해 방문하기 좋은 곳.","The place where I have to make soap with a kit is quite tranquil. It is easy to do with an English manual in iPad (including English, Chinese). Their cherry blossom mints were added and beautifully made hallabong desserts. A good place to visit, especially for Innisfree users."
Erico2709,2,1338,제품을 사용하는 경우에만 자신의 제품을 사용하고있는 여성들에게이 제품은 그 제품을 위해 반드시 멈추어야한다고 생각합니다. 그렇지 않으면 나는 이것을 놓치지 않을 것입니다.,"For women who are using their products only when using them, I think this product must be stopped for that product. Otherwise I won't miss this."
