u_id,review,u_rate,p_id,review_en
czdy,리모델링 전에는 작고 별볼일 없는 다리였는데 다리 중간에 전망대를 만드니 나름 한강의 랜드마크가 된것 같아요. 다만 즐길 컨텐츠가 조금 빈약한 느낌이에요.,4,168,"Before the remodeling, it was a small and insignificant bridge, but it became a landmark of the Han River by building an observatory in the middle of the bridge. However, the content to enjoy seems a little weak."
bonghwa,"다리아래 전망대가 있는데 바닥이 투명 유리로 되어 있는곳이 있습니다. 한강에서 다리 아래 전망대가 있는곳은 이곳 뿐입니다,.",2,168,"There's an observatory in Dariarae, and there's a place with transparent glass on the floor. This is the only place where there is an observatory under the bridge in the Han River."
용범 김,"걷기 좋은 다리입니다. 차도 별로 안다니고 데이트하기에 좋을것 같습니다. 또, 다리밑에 미술관이 있어서 좋은것 같습니다.",4,168,"It's a good bridge to walk on. I think it's good for a date without much traffic. Also, it is good to have an art museum under the bridge."
정명진,광진교는 서울에 있는 다른 다리에 비해서 다리 폭이 좁다 보니 차량들이 많이 다니지 않는 다리 입니다. 거기다 야경도 멋진 곳이라 사람들이 많이 걸어 다니고 있는 곳 입니다.,4,168,"Gwangjin Bridge has a narrow bridge compared to other bridges in Seoul, so there are not many vehicles. In addition, the night view is nice, so many people are walking around."
Gina S,한강공원을 산책하거나 자전거를 타다가 슬쩍 올라가기 좋아요. 왕복 2차선의 좁은 다리인데 한강 조망할 수 있게 벤치라던가 조경을 잘 해둬서 데이트하면서 가기에도 좋습니다.,5,168,"It's good to take a walk or ride a bike in Hangang Park. It's a narrow two-lane bridge with a view of the Han River, so it's good to go on a good bench or landscaping."
goodtripgo,한강 공원 산책하다가 천호동 방면에서 접근 가능 아이리스 촬영지라 출연자들 사진도 있음. 영화도 상영하고 음악회 열리니 시간 맞춰 관람하면 좋음 여기서 보는 야경도 멋짐,5,168,"While walking in Hangang Park, Iris is a filming location for Iris, which is accessible from Cheonho-dong, so there are photos of the cast. The movie will be screened and the concert will be held, so it's good to watch it on time. The night view here is great."
