review,u_id,u_rate,p_id,review_en
도심속 대형공원 대형공원으로 한바퀴돌고나면 나름운동되고좋아요 봄가을에피크닉가기좋아요 특히봄에 벛꽃나무들이 멋있어요 양재천인근이라 양재천까지둘러보기도좋아요,mimi,5,224,"If you go around the big park in the city center, it's good to exercise. Spring, fall, Picnic is good. Especially in the spring, the cherry trees are wonderful. It's good to look around Yangjaecheon Stream because it's near Yangjaecheon Stream."
엄청 넓어요 서울 시내에 이런 곳이 있다는게 너무 좋아요. 가을이 되면 온통 가을이 되는 곳. 양재에 사는 사람들이 부러워질 정도로 자연 그대로의 모습입니다,예쁜아줌마,5,224,It's huge. I love having such a place in downtown Seoul. A place where autumn comes all the way. It's so natural that I'm jealous of the people living in Yangjae.
양재시민공원 양재시민공원 요즘같은 계절에 단풍이 참 이뻐요 산책하기오 좋고 아제 영옹2교에사 바라본 양재천의 모습입니다 흐린 날씨라,준일오,5,224,"Yangjae Citizens Park Yangjae Citizens Park These days, the autumn leaves are so pretty. It's nice to take a walk. This is Yangjaecheon from Yeongong 2ndgyo Temple. It's cloudy."
텐트 간이 텐트치고 쉬기 정말 좋은 곳입니다. 깨끗하고 고즈넉하고 양재천이 근접해 있어요! 봄에는 벚꽃 가을에는 가을의 매력이 있습니다.,고은 심,5,224,"It's a great place to put up a tent and rest. It's clean, quiet, and close to Yangjaecheon! Cherry blossoms are attractive in spring and autumn."
가벼이 산책하고 여유를 즐기기 좋다. 약간 외곽진 곳에 위치한 것일까? 서울숲과 비교하면 비슷한 포지션인데 서울숲 만큼 잘 되어있음에도 한산해서 좋다. 서울숲이 어린이들 가득 즐길 컨텐츠가 많은 화사한 곳이라면 양재 시민의 숲은 되게 차분하다. 프로그램이라고 할만한게 딱히 있는건 아니지만 1시간 정도 천천히 전체 트래킹이 가능하고 중간중간 텐트를 쳐둘수도있다. 치킨을 사와서 돗자리 깔고 노는 사람들이 보기 좋았따. 지압 산책로도 좋다.,팜므파탈캣,4,224,"It's good to take a light walk and relax. Is it located a little out of the way? Compared to Seoul Forest, it is similar position, but it is quiet even though it is as good as Seoul Forest. If Seoul Forest is a sunny place with many contents to enjoy for children, Yangjae Citizens' Forest is very calm. There's not much to be called a program, but you can slowly track the whole thing for about an hour and set up a tent in between. It was nice to see people who bought chicken and played on the mat. Chiropractic trails are also good."
산책하기 좋아요 산책하기 좋고 조용한 곳이에요. 주변에 양재천도 있어서 시민공원에서 산책하다 양재천 산책하면 더 좋습니다. 볼거리가 많은 것은 아니지만 넓고 쾌적해서 추천합니다.,재현 탁,4,224,"It's good for a walk. It's a nice and quiet place to take a walk. There is Yangjaecheon nearby, so it's better to take a walk in the citizens' park and take a walk in Yangjaecheon. I recommend it because it's spacious and comfortable, although it's not a lot of things to see."
봄날엔 벚꽃놀이도 할 수 있어요. 드넓은 숲에 놀이터도 있어서 아이들과 함게 산책하기에 참 좋은 곳입니다. 봄날에는 양재시민의숲 역 출구 앞쪽으로 양재천을 따라 아름다운 벚꽃길이 생겨 나들이할 만 합니다.,agreewithyou,5,224,"You can also enjoy cherry blossoms on spring days. It is a great place to take a walk with children because there is a playground in a vast forest. On a spring day, there is a beautiful cherry blossom road along Yangjaecheon Stream in front of the exit of Yangjae Citizen's Forest Station."
조용하게 산책하기 좋습니다. 예전에 인근 동네에 살아서 주말이나 저녁에 짧게 산책하고나 운동하기 좋았습니다. 가족단위로 와서 쉬다가면 좋은 곳입니다. 조금만 나가면 양재천도 있어서 그길을 따라 이동하면 꽤나 긴 거리을 산책할수 있습니다.,시리우드,3,224,"It's good for a quiet walk. I used to live in a neighborhood, so I enjoyed taking a short walk on weekends or evenings or working out. It's a good place to rest in your family. There is Yangjaecheon if you go a little further, so if you go along the road, you can take a long walk."
좋아요 날씨따듯할때 가면 좋아요 자전거 빌릴수있어서 좋아요 주차는ㅂ ㅜㄹ편해요 지하철 신분당선타면 ㅈ호아요,해비치 정,4,224,"Good. It's good to go when the weather is warm. I like it because I can rent a bike. Parking is convenient. If you get on the subway line, you'll get in."
돗자리 펴고 앉아있기 좋은곳 봄이 돗자리 펴고 앉아있으면 좋아요 장소가 넓어서 그런지 사람이 많았지만 괜찮았어요 주차장도 의외로 넓어요 한쪽켠에 바베큐 시설이 있는데 여긴 미리 신청해야 해요 산책길이 나 있어서 한바퀴 하기도 좋아요,hongs925,4,224,"It's good to sit on a mat. Spring is good for sitting on a mat. There were a lot of people, but it was okay. The parking lot was surprisingly spacious. There's a barbecue facility on one side, and you have to apply in advance. There's a walkway, so it's good to take a lap."
"주변에 있다면 모를까 굳이 찾아갈 관광지는 아니에요. 강남에서는 보기 어려운 꽤 넓은 녹지입니다. 주변 회사나 주택에서 점심시간이나 주말에 산책 나오기 좋은 공원이지만, 화려한 볼거리나 특별한 식물은 없습니다. 도심 속 녹지를 즐길 수 있는 공간임에는 틀림 없지만, 별도로 시간을 내서 찾아갈 관광지는 아닙니다.",791Seoul,2,224,"If you're around, it's not a tourist attraction. It's a pretty large green area that's hard to see in Gangnam. It's a good park to go for a walk during lunchtime or on weekends from nearby companies or houses, but there's no spectacular sightings or special plants. It must be a place where you can enjoy green areas in the city, but it is not a tourist destination where you can take your time to visit."
완전 좋은 휴식 공간 진짜 좋아요 무지넓어요 생각보다 주차는 조금 불편할수잇는데 위치가 좋네요 사람도 안많고 시원하고 산책하기 좋아요 가보세요,hshan,5,224,"I love this great resting place. It's huge. Parking can be a little inconvenient than I thought, but the location is good. It's not crowded, it's cool, it's good for a walk Go ahead."
아름다운 강남에 휴식처 큰 빌딩숲들 사이로 이런곳이 있을까 싶은 도심속 자연공원입니다 양재천이.흐르고 자전거길 산책길 너무나더 편안하고 깨끗한 곳입니다.,민석 권,5,224,It is a natural park in the city center where you might think there is a resting place in the beautiful Gangnam among the large building forests. Yangjaecheon Stream flows and bike paths walk so comfortably and clean.
도심속의 산림욕장 양재천을 따라 도보코스를 잘 만들어 두었다. 양재천 걷는 것 말고도 시민공원안에서의 휴식도 아주 좋다. 특히 가을 단풍철. 새로운 모습으로 다가왔다.,이혜숙,4,224,"The walking course is well-made along Yangjaecheon Stream, a forest bath in the city center. Besides walking on Yangjaecheon Stream, the rest in the civic park is also very good. especially the autumn foliage season. I came up with a new look."
봄에 방문하세요~ 도심에 이런 공원이 있는게 참 잘 어울리네요 ㅋㅋ 회사 근처여서 자주 방문했는데 봄에 벚꽃이 정말 예쁩니다!!! 벚꽃보러 멀리 가실필요 없이 여기로 오세요! 강따라 벚꽃길이 쭉 있습니다!,haeaaa,4,224,"Visit in spring~ It suits you very well to have a park like this in the city center. I visit there often because it's near the company. Cherry blossoms are really pretty in spring!!! You don't have to go far to see the cherry blossoms, come here! There is a cherry blossom road along the river!"
"미국, 유럽 같은 느낌이 드는 나무와 잔디 키가 크고 굵은 나무들과 잔디가 한국 같지 않는 느낌이 듭니다. 양재천이 바로 옆에 흐르고 있어서 양재천을 걸어 과천쪽이나 강남쪽 어느족으로든 산책할 수 있기도 합니다. 공공 대여자전거도 길가에 있는걸 봤는데 무료인지는 모르겠습니다. 지하철로 가기에도 가깝지만 차를 가져가도 주차장이 있습니다. 근처 윤봉길 기념관 주차장이 요금이 쌉니다. 우리나라 항일역사에 관심이 있다면 기념관을 관람하는 것도 감동적일 겁니다.",다님,5,224,"The trees and grass that feel like America and Europe are tall and thick, and the grass does not feel like Korea. Yangjaecheon Stream flows right next to it, so you can walk along Yangjaecheon Stream and take a walk in Gwacheon or Gangnam. I saw a public rental bike by the side of the road, but I don't know if it's free. It's close to going by subway, but there's a parking lot even if you take your car. The parking lot of the nearby Yunbong-gil Memorial Hall is cheap. If you are interested in anti-Japanese history in Korea, it would be touching to visit the memorial hall."
정말 좋은 곳입니다. 아직 많이 알려지지 않아서 더 좋은곳 인것 같네요 숲도 정말 크고 여름에는 근처에 야외수영장도 이용할 수 있어요 날씨가 좋을때는 텐트치고 쉬는 사람들도 많답니다,lavayou,5,224,"It's a really nice place. I think it's a better place because it's not well known yet. The forest is really big and you can use an outdoor swimming pool nearby in the summer. When the weather is nice, many people put up tents and rest."
되게 큰 시민의숲 생각보다 무지 커서 깜짝 놀랫어요 양재시민의숲 가을이나 봄에 가기좋은것 같애요 산책겸이라도 꼭 가보세요,hshan,5,224,"It's a big civic forest. It's bigger than I thought, so I was surprised. I think it is good to go to Yangjae Citizens' Forest in fall or spring. Make sure you go for a walk."
멋진 숲 공원입니다. 반드시 관광객들에게 오는 것은 아닙니다. 강남구 남부의 멋진 공원. 그것은 거대하고 숲은 훌륭합니다. 그러나 관광객은 대부분의 관광지와는 거리가 멀기 때문에 이곳에 올 필요가 없습니다.  - 많은 높이의 나무들이 그늘을 만들어 여름에 더위를 피하는 것이 좋습니다.  - 주변 도로와 결혼식 공간이 있습니다. 아이들과 캠핑 텐트도. 침묵의 평화를 느끼지 않기 위해 약간 실망 스럽습니다.  - 약간의 스낵바가 있고 사물의 가격이 비쌉니다.  - 도로로 나뉘어 진 두 부분으로 구성됩니다. 그들 사이에는 지하철역이 있습니다.  - 아래 부분에는,JHL,5,224,"It's a wonderful forest park. It doesn't necessarily come to tourists. A nice park in the south of Gangnam-gu. It is huge and the forest is great. However, tourists don't have to come here because they are far from most tourist attractions.  - It's good to avoid the heat in the summer because many tall trees create shade.  - There are surrounding roads and wedding areas. The kids and the camping tent. It's a little disappointing not to feel a peace of silence.  - There is some snack bar and things are expensive.  - It consists of two parts divided by road. There is a subway station between them.  - In the lower part."
"양재 시민 숲 공원 - 커플을위한 낭만적 인 휴양지 양재동에 위치한 양재 시민 숲은 느티 나무 공원으로, 느티 나무, 단풍 나무, 소나무 등 70여 종의 나무가 특징입니다. 서울 시민들에게 인기있는 피크닉 장소로, 한국의 멋진 가을 색을 즐길 수있는 평화 롭고 숨겨진 보석입니다. 이 공원은 한국 드라마와 마찬가지로 가족과 커플이 낭만적 인 산책을 할 수있는 절대적인 천국입니다. 관광객들과는 거리가 먼 가을의 색과 변화하는 계절의 풍요 로움을 느껴보세요. 약도 : 양재 시민 공원 5 번 출구 양재 시민의 숲",Soo K,5,224,"Yangjae Citizens' Forest Park - Located in Yangjae-dong, a romantic resort for couples, Yangjae Citizen's Forest is a zelkova tree park featuring more than 70 species of trees, including zelkova trees, maple trees and pine trees. It is a popular picnic spot for Seoul citizens, and it is a peaceful and hidden gem where you can enjoy Korea's wonderful autumn colors. Like Korean dramas, this park is an absolute paradise for families and couples to take romantic walks. Feel the colors of autumn and the richness of the changing seasons, which are far from tourists. Yangjae Citizens' Forest, Exit 5 of Yangjae Citizens' Park"
