u_id,review,u_rate,p_id,review_en
ì´ì•ˆíŒ,ì—¬ë¦„ì—ëŠ” ì‹œì›í•œ ê³³ ê²¨ìš¸ì—ëŠ” ì¼ë£¨ë¯¸ë„¤ì´ì…˜ ë•Œë¬¸ì— ê°€ë³´ê³  ì‹¶ì€ ê³³ì´ë‹¤ ì´ëª…ë°• ì „ ëŒ€í†µë ¹ì´ ì„œìš¸ì‹œì¥ ë•Œ ì œì¼ ì˜ í•œ ì¼ ì¤‘ì— í•œ ê°€ì§€ ì¸ ê±° ê°™ë‹¤,4,225,"I want to go because of a cool place in winter illumination in the summer place. Lee Myung-bak, the former president did one of the best at the Seoul mayor seems huge."
withjames,í¬ë¦¬ìŠ¤ë§ˆìŠ¤ë•Œ ì²­ê³„ì²œ ê±°ë¦¬ë¥¼ ê°”ëŠ”ë° ìŒ ìš°ì„  ë¶„ìœ„ê¸°ëŠ” ì¢‹ê¸´ì¢‹ì•˜ëŠ”ë° ì‚¬ëŒë“¤ì— ë„ˆë¬´ ì¹˜ì˜€ë„¤ìš” .ã…œ í‰ì¼ì— ê°€ê¸´ ê´œì°®ì„ë“¯,4,225,I went to Cheonggyecheon street on Christmas and the atmosphere was nice but I was hit by people.It would be nice to go on weekdays.
ã„´maybeã„±,"ë‚®ì—ë„ ì¢‹ì§€ë§Œ, ì—­ì‹œ ì¡°ëª… ì˜ˆìœ ë°¤ì— ê°€ë©´ í›¨ì”¬ ë¶„ìœ„ê¸° ì¢‹ì•„ìš”. ë°ì´íŠ¸ í•˜ëŠ” ì»¤í”Œë“¤ë„ ë§ê³  ì—†ëŠ” ì‚¬ë‘ë„ ìƒê¸°ëŠ” ê³³ì´ì—ìš”. ã…ã… ë‚ ì”¨ ì¡°ê¸ˆ í’€ë¦¬ë©´, ë°ì´íŠ¸ í•˜ëŸ¬ ê°€ì•¼ê² ì–´ìš” :D",5,225,"It's good during the day, but the atmosphere is much better at night when the lights are pretty. It's a place where there are many couples on dates and there's also love without them. When the weather gets warmer, I should go on a date. :D"
vipvip2016,"ì œê°€ ì—„ì²­ ì¢‹ì•„í•˜ëŠ” ê³³ì´ì—ìš”. ë“±ë¶ˆ ì¶•ì œ, í¬ë¦¬ìŠ¤ë§ˆìŠ¤ ì¶•ì œ ë“± ì¶•ì œë„ ì—„ì²­ ë§ì´ í•˜ê³  ì´ë»ìš”. ê·¸ì¹˜ë§Œ ê²¨ìš¸ì— ê°€ë©´ ì¶”ìš°ë‹ˆê¹ ë“ ë“ í•˜ê²Œ ì…ìœ¼ì…”ì•¼ í•´ìš”.",5,225,"It's my favorite place. There are many festivals such as lantern festivals and Christmas festivals, and they are pretty. But it's cold in winter, so make sure you dress up well."
ì—”ë„ë§ˆë©”,ë“±ì¶•ì œ ì‹œì¦Œì—ëŠ” ë°œë””ë”œ í‹ˆì´ ì—†ì§€ë§Œ í‰ì†Œì—ëŠ” ê±¸ì„ ë§Œ í•©ë‹ˆë‹¤. ì—¬ë¦„ì—ëŠ” ë²Œë ˆê°€ ë§ì•„ì„œ ì…ì„ ë²Œë¦´ ìˆ˜ ì—†ì§€ë§Œ ì§€ê¸ˆê°™ì€ ì‹œì¦Œì—ëŠ” ì¢‹ì„ê±° ê°™ìŠµë‹ˆë‹¤.,4,225,"There's no time to tread during the Lantern Festival season, but it's usually worth walking. I can't open my mouth in the summer because there are many bugs, but I think it will be good for this season."
sashenka78,ì•„ì´ë“¤ê³¼ í¬ë¦¬ìŠ¤ë§ˆìŠ¤ ë¹›ì¶•ì œë¥¼ ë‹¤ë…€ì™”ì–´ìš”.. ë‹¤ì–‘í•œ ì „ì‹œë¬¼ê³¼ í¬ë¦¬ìŠ¤ë§ˆìŠ¤ ìºë¦­í„° ë¶ˆë¹›ë“¤ì´ ë„ˆë¬´ ì˜ˆì˜ê²Œ ì „ì‹œë˜ì–´ ì¢‹ì•˜ëŠ”ë°... ì‚¬ëŒì´ ë„ˆë¬´ë§ì•„ ìœ ì•„ë¥¼ ë™ë°˜í•œ ê°€ì¡±ì€ ì•ˆì „ì— ìœ ì˜í•´ì•¼ê² ì–´ìš”... ì²­ê³„ì²œì€ ì—¬ë¦„ì— ì•„ì´ë“¤ê³¼ ê°„ë‹¨í•˜ê²Œ ë¬¼ì— ë°œë‹´ê·¸ê³  ë†€ê¸°ì—ë„ ì¢‹ì€ê²ƒ ê°™ì•„ìš”~~,4,225,I went to the Christmas Festival with my children. I loved the display of various exhibits and Christmas character lights. There are too many people. Families with infants should be careful about safety... Cheonggyecheon Stream is good for children to simply dabble in the water in summer.~~
mhs0922,ì²­ê³„ì²œ ê±°ë¦¬ë¥¼ ì´ìœ ì „êµ¬ë“±ìœ¼ë¡œ ê¾¸ë©°ì„œ ë§Œë“  ë¶ˆë¹› ê±°ë¦¬.. ì‚¬ëŒì´ ë„ˆë¬´ ë§ì´ ìˆê¸°ëŠ” í•˜ì§€ë§Œ ê°€ì¡± ë‹¨ìœ„ë¡œ êµ¬ê²½í•˜ê¸°ì—ëŠ” ë„ˆë¬´ë‚˜ë„ ì¢‹ì€ê³³ì´ë‹¤,5,225,"The lighting street made by decorating Cheonggyecheon street with pretty light bulbs. There are too many people, but it is too good for families to look around."
ComiNyang,ì˜¤í›„ì— ì—¬ìœ ê°€ ëœë‹¤ë©´ ì²­ê³„ì²œ ê¸¸ì„ ê±¸ìœ¼ë©° íœ´ì‹ì„ ì·¨í•˜ëŠ”ê²ƒë„ ì°¸ ì¢‹ì€ê²ƒê°™ì•„ìš”~ íŒíŒí•œ ì¼ìƒì—ì„œ ë¬¼ì†Œë¦¬ë¥¼ ë“¤ì„ ìˆ˜ ìˆê³  ì´ˆë¡ì˜ ìˆ˜í’€ë“¤ì´ ë§ˆìŒì„ ì •ë§ ì•ˆì •ì ì´ê²Œ í•´ì¤ë‹ˆë‹¤~ ê°€ë” ì²œì—ì„œ ë›°ë…¸ëŠ” ì•„ì´ë“¤ì„ ë³´ë©´ ë„ˆë¬´ ê·€ì—½ê³  ê·¸ ê´‘ê²½ìì²´ê°€ ì°¸ ì•„ë¦„ë‹¤ì›Œìš”~,5,225,"If you have time in the afternoon, it would be nice to take a rest while walking along Cheonggyecheon. You can hear the sound of water in your daily life, and the green bushes make you feel really stable. Sometimes when I see children running around in the cloth, they are so cute and the scenery itself is so beautiful."
reverb83,"êµ¬ë„ì‹¬ì˜ ì¤‘ì‹¬ë¶€ë¥¼ ê´€í†µí•˜ëŠ” ë³µì›í˜• ì¸ê³µí•˜ì²œì´ë¼, ê·¸ êµ¬ì—­ì´ ìƒë‹¹íˆ í˜„ì‹¤ì ì¸ ê³µê°„ì´ë¼, ì‚¬ì‹¤ ê´€ê´‘ê°ì—ê²Œ ë³´ë‹¤ëŠ” ìƒì—…ì— ì¢…ì‚¬í•˜ëŠ” ê·¸ ê³µê°„ì˜ ì‚¬ëŒë“¤ì—ê²Œ ìƒë‹¹íˆ ìœ ìµí•œ ê³³ì„",4,225,"It's a restorative artificial stream that runs through the heart of the old city center, and it's a very realistic area, so it's actually a very beneficial place for the people of that space who are engaged in their daily lives rather than tourists."
lordauch,ì‚°ì±…ì‚¼ì•„ í•œë²ˆì¦˜ ê±¸ì–´ë³¼ë§Œ í•œê³³ì´ìš” ì£¼ë§ì—ëŠ” ë§ì€ ì—°ì¸ë“¤ê³¼ ê°€ì¡±ë“¤ì´í•¨ê»˜ ì˜µë‹ˆë‹¤. ë™ëŒ€ë¬¸ì—ì„œ ê´‘í™”ë¬¸ê°€ì§€ ì´ì–´ì ¸ìˆìœ¼ë‹ˆ ì¤‘ê°„ì¤‘ê°„ ì‹ì‚¬ë¥¼ í• ë§Œí•œ ê°€ê²Œë‚˜ êµ¬ê²½ê±°ë¦¬ëŠ” ë§ì•„ìš”!,3,225,"A place worth walking around for a walk. On weekends, many couples and families come together. Dongdaemun to Gwanghwamun Gate is connected, so there are many restaurants and attractions to eat in between!"
ì€ëŒ•ì‡,"12ì›”ì— ë¶ˆë¹›ì¶•ì œë•Œ ë‹¤ë…€ì™”ìŠµë‹ˆë‹¤~ í•­ìƒ ì´ë²¤íŠ¸ë‚˜ í–‰ì‚¬ë“¤ë„ ë§ê³  ë³¼ê±°ë¦¬ê°€ ë§ê³ , ì‚°ì±…í•˜ê¸°ë„ ë¶„ìœ„ê¸° ìˆì–´ì„œ ìì£¼ ê°€ëŠ”í¸ì´ì—ìš”~ ì„œìš¸ ë„ì‹¬ì—ì„œ ì—¬ìœ  ëŠë¼ê¸° ì¢‹ì€ê³³ì…ë‹ˆë‹¤",4,225,"I went to the light festival in December. There are many events, things to see, and the atmosphere of taking a walk, so I go there often. It's a good place to relax in downtown Seoul."
ë™ê¸€ë¼ë¯¸,ê·¼ì²˜ì—ì„œ ì €ë… ë¨¹ê³ ì„œ ì²œì²œíˆ ê±¸ì–´ì™€ì„œ ì²­ê³„ì²œ ê±¸ì–´ë³´ì„¸ìš”. ì‚´ì§ ì–´ë‘ì›Œì§€ë©´ ë¶„ìœ„ê¸°ë„ ì¢‹ê³  ì„ ì„ í•œ ë°”ëŒì´ ë¶ˆë©´ ì •ë§ ê¸°ë¶„ ì¢‹ê²Œ ì‚°ì±…í•  ìˆ˜ ìˆìŠµë‹ˆë‹¤. ê²¨ìš¸ì—ëŠ” ë„ˆë¬´ ì¶¥ì§€ë§Œ ì¡°ê¸ˆ ë‚  í’€ë¦¬ë©´ ë°ì´íŠ¸ì½”ìŠ¤ë¡œ ê¼­ í•œë²ˆ ê°€ë³´ì„¸ìš”,4,225,"After having dinner nearby, walk slowly and walk through Cheonggyecheon. When it gets a little dark, the atmosphere is good and when the cool wind blows, you can take a walk in a really good mood. It's too cold in winter, but when it gets warmer, you should go on a date course."
kelly7778,ì¸ì‚¬ë™ì—ì„œ ë‚˜ì™€ì„œ ì²­ê³„ì²œê¹Œì§€ ê±¸ì–´ê°€ì„œ ì‚°ì±…í•˜ê¸° ì¢‹ì€ê³³ì…ë‹ˆë‹¤.ì—ì „ì—ëŠ” í’€ì´ ë§ì•˜ëŠ”ë° ìµœê·¼ì—ëŠ” ì •ë¦¬í•´ì„œ ë³´ê¸° ì¢‹ë”ë¼êµ¬ìš”.,5,225,"It's a good place to walk out of Insadong and walk to Cheonggyecheon Stream.There used to be a lot of grass in the past, but it's nice to see it organized recently."
ë¦¬ë‚˜ ìµœ,"ë‚ ì´ í’€ë¦¬ë©´ í•œë‹¬ì— í•œë‘ë²ˆ ê¼­ ë°©ë¬¸í•˜ëŠ” ê³³ì…ë‹ˆë‹¤. ì‚¬ëŒì´ ë§ì§€ë§Œ, ê±°ìŠ¬ë¦´ ì •ë„ëŠ” ì•„ë‹ˆê³  ì¹œêµ¬, ì—°ì¸ê³¼ ê±·ê¸° ì•„ì£¼ ì¢‹ìŠµë‹ˆë‹¤.",5,225,"It's a place I always visit once or twice a month when the weather gets warmer. There are a lot of people, but it's not annoying and it's great to walk with friends and lovers."
solmarutimsd,ì´ëª…ë°• ì „ ëŒ€í†µë ¹ì´ ìš•ì„ ë¨¹ì§€ë§Œ ì‹œì¥ìœ¼ë¡œì„œì˜ ê·¸ ì—…ì ì¤‘ í•˜ë‚˜ì´ì§€ìš”. ì²­ê³„ì²œ ë³µì›ì€ ì •ë§ ì˜í•œë“¯. ë‹¤ë§Œ ì´ê³³ì—ì„œ ë°œ ì”»ì§€ëŠ” ë§ˆì„¸ìš”,4,225,"Lee Myung-bak if the president called names, but the market as one of that work. The restoration of Cheonggye Stream seems to have been very good. But don't wash your feet here."
ë°í‚¤ë©ë©,"ë™ëŒ€ë¬¸ì¢…í•©ì‹œì¥ì„ ìì£¼ê°€ëŠ”í¸ì…ë‹ˆë‹¤ ì²­ê³„ì²œì„ ë”°ë¼ ê±¸ì–´ì„œ ë§›ì§‘ì—ì„œ ì‹ì‚¬ë¥¼ í•˜ê³  (ìƒì„ êµ¬ì´ê³¨ëª©,ë‹­í•œë§ˆë¦¬ì¹¼êµ­ìˆ˜..ì£¼ë³€ì— ë§›ì§‘ë“¤ì´ ë§ì•„ì„œ ì¢‹ì•„ìš”) ê¼­ ì²­ê³„ì²œì— ë‚´ë ¤ì™€ ì²œì²œíˆ ê±¸ìœ¼ë©´ì„œ ì‚°ì±…ì€ ê¼­ í•´ì¤ë‹ˆë‹¤ íŠ¹íˆ ë°¤ì— ê±¸ìœ¼ë©´ ìš´ì¹˜ìˆê³  ì¢‹ì•„ìš” ì£¼ë§ì—ëŠ” ê°€ë” ê³µì—°ë„í•´ì„œ ë³¼ê±°ë¦¬ë„ ë§êµ¬ìš” ì‘ì§€ë§Œ ì´ìœ ì²­ê³„ì²œ ì¢‹ì•„ìš”",5,225,"I often go to Dongdaemun Market. Walk along Cheonggyecheon Stream and eat at a good restaurant.I like it because there are many famous restaurants around me. I always come down to Cheonggyecheon Stream and walk slowly. Especially if you walk at night, it's beautiful and nice. On weekends, there are a lot of performances to see. I like Cheonggyecheon Stream which is small but pretty."
ì£¼ë§Œ ê¹€,ë”¸ê³¼ í•¨ê»˜ ë”°ëœ»í•œ ë¼ë–¼ì™€ ë„ì‹¬ ì† ì—¬ìœ ë¡œìš´ ì‚°ì±…ê¸¸ì€ ê±°ë‹ ìˆ˜ ìˆì–´ì„œ ë„ˆë¬´ ì¢‹ì•˜ìŠµë‹ˆë‹¤. ì¡°ê¸ˆì€ ì¶”ì› ì§€ë§Œ í•œê°•ì„ ê±°ë‹ˆëŠ” ê²ƒì— ë¹„í•˜ë©´ ë§Œì¡±í•©ë‹ˆë‹¤,5,225,"I was so happy to be able to walk around the warm latte and the leisurely stroll in the city with my daughter. It was a little cold, but I'm satisfied compared to walking along the Han River."
waytoLiah,"í‰ì†Œì—ë„ ì¡°ìš©íˆ ì‚°ì±…í•˜ê¸° ì¢‹ì€ê³³ì´ì§€ë§Œ, íŠ¹íˆ ì™¸êµ­ì—ì„œ ì˜¨ ì¹œêµ¬ê°€ ì²­ê³„ì²œì„ ë¬´ì²™ ì¢‹ì•„í•˜ì˜€ìŠµë‹ˆë‹¤. ì™¸êµ­ì—ì„œ ì˜¨ ì¹œêµ¬ì™€ ì¸ì‚¬ë™ì—ì„œ ì‹ì‚¬ë¥¼ í•˜ê³  ì²­ê³„ì²œìœ¼ë¡œ ì´ë™í•˜ì—¬ ì‚°ì±…ì„ í–ˆìŠµë‹ˆë‹¤. í•œê²¨ìš¸ ë„ˆë¬´ ì¶”ìš¸ ë•Œë§Œ ë¹¼ê³ ëŠ” ì–¸ì œë‚˜ ì—°ì¸ë“¤ì´ ë°ì´íŠ¸ë¥¼ ì¦ê¸°ê¸°ì—ë„ ì¢‹ì€ ê³³ì…ë‹ˆë‹¤.",5,225,"It's a good place to walk quietly, but my friend from abroad especially liked Cheonggyecheon. I had a meal with my friend from abroad in Insadong and went to Cheonggyecheon for a walk. It's always a good place for couples to enjoy dating except when it's too cold in the middle of winter."
inwooy,"ë™ëŒ€ë¬¸, ëª…ë™, ì¢…ë¡œë¥¼ ë™ì„œë¡œ ê°€ë¡œì§€ë¥´ëŠ” ì§€ë¦„ê¸¸ì¸ ì²­ê³„ì²œ ì¸ìœ„ì ì¸ ëƒ„ìƒˆê°€ ê°•í•˜ë‹¤. ì–´ì¨Œë“  ë„ì‹¬ê³¼ ë¬¼ì´ë¼ëŠ” ì˜ë¯¸ëŠ” ê¸ì •ì ì´ë‹¤. í•˜ì§€ë§Œ ë„ˆë¬´ í° ê¸°ëŒ€ëŠ” í•˜ì§€ë§ì.",2,225,"The artificial smell of Cheonggyecheon, a shortcut that crosses Dongdaemun, Myeong-dong, and Jongno, is strong. Anyway, the meaning of downtown and water is positive. But let's not expect too much."
Jiyoon Y,"ìš”ì¦˜ì€ ì¶”ì›Œì„œ ê±·ê¸°ê°€ ì¡°ê¸ˆ ë¶€ë‹´ìŠ¤ëŸ½ì§€ë§Œ ë´„,ì—¬ë¦„,ê°€ì„ê¹Œì§€ ë§ì€ ë¶„ë“¤ì´ ì¢‹ì•„í•˜ëŠ” ë°ì´íŠ¸ì¥ì†Œì£ ! ì¡¸ì¡¸ íë¥´ëŠ” ë¬¼ì†Œë¦¬ ë“¤ìœ¼ë©° ì•‰ì•„ë§Œ ìˆì–´ë„ ë¨¸ë¦¬ê°€ ë§‘ì•„ì§€ëŠ” ê¸°ë¶„ì´ ë“œëŠ”ê³³â˜…",5,225,"It's a bit hard to walk these days because it's cold, but it's a place that many people like, spring, summer, and fall! Just sitting there listening to the dripping sound of the water makes me feel like my head is clear â˜…"
ì¹˜ì¸íŠ¸,"ë¬¸êµ¬ê±°ë¦¬ë¥¼ ì§€ë‚˜ ì˜¤ë¥¸ìª½ìœ¼ë¡œ ë‚˜ê°€ì‹œë©´ ì²­ê³„ì²œì´ ë³´ì…ë‹ˆë‹¤ ì²­ê³„ì²œì„ ê±¸ì–´ê°€ë‹¤ ë³´ë©´ ì¢…ë¡œë„ ë³´ì´ê³ , ë°˜ëŒ€ ë°©í–¥ì€ ë§ˆíŠ¸ë„ ìˆìŠµë‹ˆë‹¤",4,225,"If you go to the right after passing the stationery store, you will see Cheonggyecheon Stream. If you walk along Cheonggyecheon Stream, you can see Jongno, and there is a mart in the opposite direction."
jesusprise,ë„ì‹¬ì†ì— ì´ëŸ°ê³³ì´ ìˆë‹¤ë‹ˆ ì •ë§ ì¢‹ì•„ìš”~~ ê°€ì¡±ë‚˜ë“¤ì´ í•˜ê¸°ë„ ì¢‹ê³  ì—°ì¸ë“¤ë¼ë¦¬ ê±·ê¸°ë„ ì¢‹ì•„ì„œ ìì£¼ ê°€ëŠ”ë° ê·¼ì²˜ì— êµ¬ê²½ê±°ë¦¬ë„ ë§ê³  ì¢‹ì•„ìš”~ã…,5,225,"It's really nice to have a place like this in the city center~ It's good for family outings and couples to walk together, so I go there often. There are a lot of things to see around here.~h"
ì§„ê·œ ì´,"ì—¬ëŸ¬ ë¶€ì •ì ì¸ í‰ê°€ë‚˜ ì•…ì¬ì— ì‹œë‹¬ë¦¬ê¸´ í–ˆì§€ë§Œ ì—¬ì „íˆ ì‚¬ë‘ ë°›ê³  ìˆëŠ” ì„œìš¸ì˜ ì¸ê³µ ìì—° ëª…ì†Œ, ì²­ê³„ì²œ... ì„œìš¸ì˜ ì¤‘ì‹¬ë¶€ì— ê°œì²œì´ ì—´ë ¤ìˆê³  ê·¸ ë¬¼ê°€ë¥¼ ê±¸ìœ¼ë©° í•˜ëŠ˜ì„ ë³´ë©´, ì ì‹œ ê·¸ê³³ì´ ì„œìš¸ì¸ì§€ë¥¼ ìŠê²Œ ëœë‹¤. ë¬¼ íë¥´ëŠ” ì†Œë¦¬ê°€ ì ì‹œì˜ íœ´ì‹ì´ ë˜ì–´ì£¼ê³  ë§ˆìŒì˜ í˜¼ëˆì— ì–´ë–¤ íë¦„ì„ ë§Œë“¤ì–´ í¸ì•ˆí•˜ê²Œ í•´ì¤€ë‹¤. ê±·ëŠ” ì¦ê±°ì›€ì„ ìƒˆë¡­ê²Œ ëŠë¼ê²Œ í•´ì£¼ê¸°ë„ í•œë‹¤. ì•¼ê°„ì—ëŠ” ê·¸ ì •ì·¨ê°€ ë” ê¹Šê³  ì¦ê²ë‹¤. ì´ì™•ì— ëš«ë¦° ë¬¼ê¸¸ì´ë‹¤. ì´ì œëŠ” ë‹¤ë¥¸ ìƒê°ì€ ë‚´ë ¤ë†“ê³  ì¢‹ì€ ê²ƒë§Œ ì·¨í•´ ì¦ê¸°ëŠ” ì„œìš¸ì˜ í–‰ë³µí•œ ì¼ë¶€ë¼ê³  ìƒê°í•˜ëŠ” ê²ƒì´ ì¢‹ì„",4,225,"Cheonggye Stream, an artificial natural attraction in Seoul that has been plagued by negative reviews and negative factors but is still loved... The stream is open in the heart of Seoul, and when you walk along the waterfront and look at the sky, you forget for a moment whether it is Seoul or not. The sound of water flowing is a temporary respite and creates a certain flow in the chaos of the mind, making it comfortable. It also makes you feel the joy of walking again. At night the mood is deeper and more pleasant. It's been a long way since the water. Now, it's better to think of it as a happy part of Seoul where you can put down other thoughts and enjoy only good things."
jjjjj111,ì¸ê³µì´ê¸´ í•˜ì§€ë§Œ ì²­ê³„ì²™ ë³µêµ¬ì‚¬ì—…ì€ ì˜ í–ˆë‹¤ê³  ìƒê°í•œë‹¤. ê°•ë¶ì— í‘¸ë¥´ë¦„ì„ ì„ ì‚¬í•œë‹¤ê³ ë‚˜ í• ê¹Œ. ì²­ê³„ì²œê¸¸ ì‚°ì±…í•˜ë©´ ì™ ì§€ ì—¬ìœ ë¡œì›Œì§!,5,225,"Although it is man-made, I think the restoration project of Cheonggye-cheok has done well. It gives the northern part of the river green. Walking along Cheonggyecheon-gil makes you feel relaxed!"
ê³°ëŒí† ê¹½,ë„ì‹¬ë‚´ì— íë¥´ëŠ” ì²­ê³„ì²œì„ ë¼ê³  ê±·ê¸° ì¢‹ì€ê³³ ë‹¤ë§Œ ì—¬ë¦„ì—” ë‚ ë²Œë ˆ ê°€ ë„ˆë¬´ë§ê³  ê°€ë” ë¬¼ì´ ì‹¬í•˜ê²Œ í˜¼íƒí•´ì ¸ì„œ ëƒ„ìƒˆê°€ ë‚ ë•Œê°€ ìˆìŠµë‹ˆë‹¤.,4,225,"It is a good place to walk along Cheonggyecheon Stream in the city center, but there are times when there are too many flying insects in the summer and sometimes the water gets very muddy and smells bad."
ëŸ¬ë¸”ë¦¬ëª…,ë‚ ì”¨ê°€ ì¶”ì›Œì„œ ê²¨ìš¸ì—ëŠ” ì˜ ì•ˆ ê±·ê²Œë˜ëŠ”ë° ë¶ˆë¹› ì¥ì‹ì„ ì •ë§ ì´ì˜ê²Œ í•´ ë†“ì•„ì„œ ì¶”ì›Œë„ êµ¬ê²½í•˜ë©´ì„œ ê±·ê¸°ì— êµ‰ì¥íˆ ì¢‹ìŠµë‹ˆë‹¤ ì²­ê³„ì²œ ì£¼ë³€ìœ¼ë¡œ ì»¤í”¼ìˆê³¼ ìŒì‹ì ì´ ë§ì•„ì„œ ê±·ë‹¤ê°€ ì¶”ìš°ë©´ ë°”ë¡œ ë“¤ì–´ ê°€ì„œ ì‰´ìˆ˜ ìˆì–´ì„œ ì¢‹ì•„ìš”,4,225,"I don't usually walk in the winter because of the cold weather, but the lighting is so pretty that it's good to walk while looking around even if it's cold. There are a lot of coffee shops and restaurants around Cheonggyecheon Stream, so if it's cold, I can go right in and relax."
w221,ê²¨ìš¸ì—ëŠ” ì¡°ê¸ˆ ì¶¥ìŠµë‹ˆë‹¤... ì‹œì²­ ê´‘ì¥ ìª½ì—ì„œ ë©€ì–´ì§ˆ ìˆ˜ë¡ ë³¼ê±°ë¦¬ê°€ ì¡°ê¸ˆ ì¤„ì–´ë“¤ì–´ìš” ^^; ë´„ì—¬ë¦„ê°€ì„ì—ëŠ” í•˜ë¥˜ ìª½ ì‹ìƒë„ ë³¼ë§Œí•˜ì§€ë§Œ ê²¨ìš¸ì—ëŠ” ì¡°ëª… ì„¤ì¹˜ëœ ê³³ì—ì„œ ì¡°ê¸ˆ ë…¸ì‹œë‹¤ê°€ ì˜¬ë¼ê°€ì‹œëŠ” ê±° ì¶”ì²œí•©ë‹ˆë‹¤.,5,225,"It is a little cold in winter. The farther away from City Hall Square, the less things to see. ^^; In spring, summer and fall, you can see the downstream vegetation, but in winter, I recommend you to play a little bit in the lighted area before going up."
jinna,1/1 ì¢…ê°ì— ìƒˆí•´ í–‰ì‚¬ë¥¼ ë³´ëŸ¬ ì™¸êµ­ì¸ ì¹œêµ¬ë“¤ê³¼ ì´ë™í•˜ë©´ì„œ ëª…ë™ì—ì„œ ì¢…ê°ìœ¼ë¡œ ì´ë™í•˜ë©° ì²­ê³„ì²œì„ ê±¸ì—ˆëŠ”ë° ì‹œë‚´ ì¤‘ê°„ì— ì´ëŸ° ì²œì´ ìˆë‹¤ëŠ” ê²ƒì— ê°íƒ„í•˜ë”ë¼êµ¬ìš” ê·¸ë¦¬ê³  ê·¸ ë‚  ì²­ê³„ì²œì— ë“±ë¶ˆì„ ë– ë‚´ë ¤ê°€ê²Œ í•´ë†¨ë˜ë° ë„ˆë¬´ ì˜ˆë»¤ì–´ìš”. ìë‘ìŠ¤ëŸ¬ì›Œìš”,4,225,"I was traveling with foreign friends to see the New Year's Day event on the first Jonggak, and I walked from Myeong-dong to Jonggak and I was amazed that there was a cloth like this in the middle of the city. And on that day, they let the lanterns float down in Cheonggyecheon Stream, and it was so pretty. I'm proud of you."
ATOM,ì—¬ë¦„ì— ê±·ë‹¤ë³´ë©´ ê½¤ë‚˜ ì‹œì›í•˜ë‚˜ ê·¸ëŠ˜ì´ ì¡°ê¸ˆë¶€ì¡±í•œê²Œ í ì„ ì €ë…ì—ëŠ” ìƒê°ë³´ë‹¤ ê±·ê¸°ì¢‹ê³  í•œì í• ë•Œ ê±¸ìœ¼ë©´ ë¶„ìœ„ê¸° ìˆìŒ.,5,225,"If you walk in summer, it's quite cool, but there's not enough shade. In the evening, it's better to walk than you think, and it's nice to walk when it's quiet."
ë‡½ì•„,ì²­ê³„ì²œ ë„ˆë¬´ ì´ì˜ê³  ë°ì´íŠ¸í•˜ê¸° ì¢‹ì€ ì¥ì†Œê°™ì•„ìš”~ íŠ¹íˆ ë°¤ì—! ì¡°ëª…ì´ ë„ˆë¬´ ë¶„ìœ„ê¸° ìˆëŠ” ë“¯ ã…ã…,5,225,Cheonggyecheon is so pretty and it's a great place to go on a date. Especially at night! The lighting seems to be too moody.
ë¯¸ë‡¨,"ìœ„ìª½ì—ëŠ” ë²„ìŠ¤, ì°¨ë“¤ì´ ì§€ë‚˜ê°€ì§€ë§Œ ì•„ë˜ìª½ì€ ë¬¼ì´ íë¥´ëŠ” ë˜ë‹¤ë¥¸ í’ê²½ì´ í¼ì³ì§€ëŠ”ê³³! ì§€ê¸ˆë„ í•˜ëŠ”ì§€ëŠ” ëª¨ë¥´ê² ì§€ë§Œ, ì‘ë…„ì— ë“±ì¶•ì œ í• ë•Œ ë„ˆë¬´ ì¢‹ì•˜ë–¤ ê¸°ì–µì´ë‚˜ë„¤ìš”! ëˆˆì´ ì˜¤ë©´ ë˜ë‹¤ë¥¸ ëŠë‚Œì´ ë„ˆë¬´ ë§¤ë ¥ì ì¸ ê³³ì…ë‹ˆë‹¤.",4,225,"Buses and cars pass on the top, but another scene of water running on the bottom! I don't know if it's still on, but I remember it was so good when we had a lantern festival last year! When it snows, another feeling is so attractive."
everlsk,ë§¤ë…„ 11ì›”ì´ë©´ ì—´ë¦¬ëŠ” ì„œìš¸ë“±ì¶•ì œê°€ ì²­ê³„ì²œì˜ ë§¤ë ¥ì„ ê°€ì¥ ì˜ ë‚˜íƒ€ë‚´ ì¤ë‹ˆë‹¤. ë´„~ê°€ì„ì—ëŠ” ì‚°ì±…ì‚¼ì•„ ì²­ê³„ì²œì„ ë”°ë¼ ê±·ê¸°ì—ë„ ì¢‹ìŠµë‹ˆë‹¤.,5,225,"The Seoul Lantern Festival, which is held every November, best represents the attraction of Cheonggyecheon. It is also good for walking along Cheonggyecheon Stream during spring and fall."
kyuseon,ë“± ì¶•ì œë¥¼ í•˜ê±°ë‚˜ í¬ë¦¬ìŠ¤ë§ˆìŠ¤ ì¥ì‹ì´ ìˆì„ ë•ŒëŠ” ì•¼ê²½ì´ ì •ë§ ì¢‹ì•„ìš”. ë°”ëŒì´ ì¢€ ë¶€ëŠ” ìœ„ì¹˜ì§€ë§Œ ë°ì´íŠ¸í•˜ë©° ê±·ê¸°ì—ëŠ” ë”±ì¸ ê²ƒ ê°™ìŠµë‹ˆë‹¤. ë‚®ë³´ë‹¤ ë°¤ì„ ì¶”ì²œí•´ìš”,4,225,"The night view is really nice when there is a lantern festival or Christmas decorations. It's a bit windy, but I think it's perfect for a date. I recommend night rather than day."
KevinYejun,ì‚¬ë¬´ì‹¤ì´ ì²­ê³„ì²œ ë°”ë¡œ ì•ì…ë‹ˆë‹¤. ê·¸ë˜ì„œ ì •ì‘ ì²­ê³„ì²¨ì„ ê±°ë‹ì§€ëŠ” ì•Šì§€ë§Œ ë§¤ì¼ ì˜¤ê°€ë©° ë³´ê²Œ ë©ë‹ˆë‹¤. ì…ì¥ë£Œë„ ì—†ìœ¼ë‚˜ ê·¼ì²˜ ë³¼ ê±°ë¦¬ê°€ ë§ì•„ì„œ í•­ìƒ ê´€ê´‘ê°ì´ ë¶ë¹•ë‹ˆë‹¤. íŠ¹íˆ ì§€ê¸ˆ ì‹œì¦Œì—” í¬ë¦¬ìŠ¤ë§ˆìŠ¤ ì¥ì‹ê³¼ ì˜ˆìœ ë¶ˆë¹› ì¥ì‹ìœ¼ë¡œ í™”ë ¤í•œ ìíƒœë¥¼ ë½‘ë‚´ê³  ìˆë”êµ°ìš”. ì—¬ë¦„ì€ ì—¬ë¦„ëŒ€ë¡œ ê²¨ìš¸ì€ ê²¨ìš¸ëŒ€ë¡œ ì´ìœ ê³³ì…ë‹ˆë‹¤.,5,225,"The office is right in front of Cheonggyecheon. So I don't actually walk around Cheonggye chum, but I come and go every day to see it. There is no entrance fee, but there are many things to see nearby, so tourists are always crowded. Especially in this season, they are pulling out colorful figures with Christmas decorations and pretty lights. Summer is pretty and winter is pretty."
ì‘¤ì•¼,ì—°ë§ì„ ë§ì•„ í™”ë ¤í•œ ì¥ì‹ë“¤ë¡œ ì¸í•´ì„œ ê·¼ì²˜ì—ì„œ ê°€ë³ê²Œ í•œì”í•˜ê³  ì¹œêµ¬ì™€ ì´ëŸ°ì €ëŸ° ì–˜ê¸°ë¥¼ ë‚˜ëˆ„ë©° ì‚°ì±…í•˜ê¸° ë„ˆë¬´ ì¢‹ì•˜ìŠµë‹ˆë‹¤,5,225,It was so nice to have a light drink nearby and talk with my friend for a walk due to the colorful decorations at the end of the year.
nekoyang h,í•œë²ˆì”© ë“±ë¹›ì¶•ì œ ê°™ì€ ê²ƒì„ í• ë•Œë©´ ëŠ˜ ì‚¬ëŒë“¤ì´ ë§ë‹¤. ì‚¬ì§„ì°ê¸°ë„ ì¢‹ê³  ë¶„ìœ„ê¸° ë‚´ê¸°ë„ ì¢‹ë‹¤. ì¡°ëª…ì•„ë˜ ì•‰ì•„ ë¬¼ì†Œë¦¬ ë“¤ìœ¼ë©´ íë§ë˜ëŠ” ê¸°ë¶„,5,225,There are always a lot of people when there is a lantern festival. It's good to take pictures and create an atmosphere. Sitting under the light and listening to the sound of water makes me feel refreshed.
