u_id,review,u_rate,p_id,review_en
MahiHediSafina,"ì´ ê³³ì€ ë°¤ì— ì˜¬ ê²½ìš° íŠ¹íˆ ì¢‹ì€ ë©‹ì§„ ì „ë§. ì¡°ëª…ì´ ë©‹ì§„ ê°• ì˜†ì— ê°•ì´ ë§Œë“¤ì§€ ìˆ˜ ìˆìŠµë‹ˆë‹¤. ì´ ê°•ì´ ë§ê¸° ë•Œë¬¸ì—, í•  ìˆ˜ ìˆëŠ” ì§€í•˜ì²  ì—­ì—ì„œ. ì €ëŠ” ë™ëŒ€ë¬¸ ì—­ì—ì„œ ì‡¼í•‘ì„ í•˜ê³  ì™”ì–´ìš”.",4,225,"This place is especially nice if you come at night. A river can be created next to a river with good lighting. Since there are many rivers, at the subway station where you can. I went shopping at Dongdaemun station."
Susanne H,"ë§ˆìŒì´, ë‚®ì´ë‚˜ ë°¤. ëª¨ë“  ì˜·ì„ ì‡¼í•‘ ì§€ì—­ê¹Œì§€ ê±¸ì—ˆë‹¤. ì´ê³³ì€ ì •ë§ ì¢‹ê³ , ëª¨ë“  í° ë„ì‹œ ê°™ì€ í•´ë‹¹ ê¶Œí•œì´ ìˆì–´ì•¼ í•©ë‹ˆë‹¤. ê°ì‚¬í•©ë‹ˆë‹¤!",5,225,"The mind, day or night. I walked all my clothes to the shopping area. This place is really nice, and it has to have the authority of every big city. Thank you!"
Emily C,"ì‚¬ì§„ì— ë³´ì´ëŠ” ë‘˜ì´ ì¢‹ë„¤ìš”. ì–´ë‘ìš´ ì¡°ëª…ê³¼ ê·¸ë¦¼ ë“¤ì´ í¬ë¦¬ìŠ¤ë§ˆìŠ¤ ì´ ê²ƒì´ë‹¤!). ì•„ì§ í˜ë¥´ë‹¤, ê²½í—˜í•  ìˆ˜ ìˆ. ë°¤ì—ëŠ” ì‹œì›í•˜ì§€ëŠ” ì•Šë‹¤. ë” ìœ„ì‹± ì›° ì—ˆìœ¼ë©°, ë•Œë¬¸ì— ê°€ëŠ” ê²ƒì´ì—ìš”. ì‚¬ì§„ê³¼ ì‹¤ë§ì´ì—ˆìŠµë‹ˆë‹¤.",3,225,"I like the two in the picture. Dark lights and pictures are Christmas!) Still spilling, you can experience. It's not cool at night. It was The Wishing Well, and that's why I'm going. It was a photo and disappointment."
Nila S,"ì €ëŠ” ë™ëŒ€ë¬¸ ê·¼ì²˜ì— ìœ„ì¹˜í•œ ìŠ¤í”„ë§ ì‹œì¦Œ ë™ì•ˆ cheonggyeochon ìŠ¤íŠ¸ë¦¼ ì´ë‹¤. ì²˜ìŒì—. ì €ëŠ” ìš°ì—°íˆ ë³¸ ì´ ì¥ì†ŒëŠ” ì •ë§ ì•„ë¦„ë‹¤ìš´ ì˜¤í›„. í•œ ë•Œ. ë‚˜ëŠ” ë‹¤ì‹œ í•œ ë²ˆ ë°©ë¬¸í•œ ì´ ê°• ì´ë©° ì—¬ì „íˆ ë©‹ì§„ ìƒìƒí•  ìˆ˜ ìˆë‹¤. ë¬¼ì€ ì •ë§ ë§‘ê³  ë²¤ì¹˜ ì— ì•‰ì•„ì„œ ê°•ì´ ìˆ˜ ë°œì„ ë¬¼ ì†ì— ë„£ì–´ ë‘ë©´, ì´ ìˆ˜ ìˆì§€ë§Œ ë§¤ìš° ê°„ë‹¨í•œ ìƒì¾Œí•œ! ì´ ë•Œë¬¸ì— ë§ì€ ì‹œê°„ì„ ë³´ë‚¸ ê°•ì„ ë³¼ ìˆ˜ ìˆëŠ” ê³³ì´ ê·¼ì²˜ì— ìˆê³  ë¡œë§¨í‹±í•œ ëŠë‚Œ: ì„œìš¸ì—ì„œ ê¼­ ê°€ë´ì•¼ í•  ê²ƒ!",5,225,"I am a cheonggyeochon stream during the spring season near Dongdaemun. At first. I can still imagine this place I happened to see is a really beautiful afternoon. Once. I've visited this river once again, and it's still a wonderful place. The water is so clear and if the river sits on the bench and puts its feet in the water, it can be this but very simple refreshing! For this reason, there's a place nearby where you can see the river where you spent a lot of time: You must go to Seoul!"
GordonCP,"12ì›” ì–´ëŠ ì¶”ìš´ ë°¤ì— ë°©ë¬¸í•œ íŠ¹ë³„í•œ í¬ë¦¬ìŠ¤ë§ˆìŠ¤ ì¡°ëª…ì´ ì•„ë¦„ë‹¤ì›Œ ë´…ë‹ˆë‹¤ ., ì‚°ì±…í•˜ê¸° ì¢‹ì€ ê³³ì— ê°€ì„œ ì¹œêµ¬ë“¤ê³¼ í•¨ê»˜ ì‚¬ë‘í•˜ëŠ” ì‚¬ëŒë“¤. ì­‰ ë»—ì€ ê¸¸ì´ ì•½ 1 km ë¶ˆ. ì¢‹ì€ ì¹´ë©”ë¼ë¥¼ ê°€ì§€ê³ .",4,225,The special Christmas lights that you visit on a cold night in December look beautiful. Go to a good place to take a walk and love with your friends. It's about 1km long. With a good camera.
Hongkongboy55,ì €ëŠ” ì¡°ê¸ˆ ì‹¤ë§ìŠ¤ëŸ¬ì› ê³  ë…¸ë²½ì— ì‚¬ì´íŠ¸ë¥¼ ë„ì°©í•œ ì—°ì£¼ ìŒì•…; ì „ì ìœ¼ë¡œ ë‹¤ë¥¸ ì‚¬ëŒë“¤ì˜ ì‚¬ì§„. ì•„ë§ˆë„. ì €ëŠ” ê·¸ëƒ¥ ì˜†ì— ì˜ëª»ëœ ë¶€ë¶„ì€ ë†“ì¹˜ì§€ dondaemun ì„¹ì…˜ì„ íƒ€ë‹¨.,3,225,I was a little disappointed and the music of the performance that arrived at the site on the road wall; entirely pictures of others. Maybe. I just miss the wrong part next to it. I go through the dondaemun section.
Francis B,"ìœ„ì˜ ë¶„ì£¼í•¨ì—ì„œ ìƒì¾Œí•œ ì€ì‹ ì²˜ ì´ë‹¤. ë°¤ì— ì•„ë¦„ë‹¤ìš´ ì¡°ëª… ì˜€ë‹¤ í•˜ê¸° ë•Œë¬¸ì—, ì¡°ìš©í•œ ê³³ì´ë‚˜ ë¬¼ íë¥´ëŠ” ì†Œë¦¬ë¥¼ ë“¤ì—ˆìŠµë‹ˆë‹¤.",5,225,"It is a refreshing hiding place from the bustle above. Because it was a beautiful light at night, I heard a quiet place or a sound of water flowing."
jaye_w,ë‚˜ëŠ” ë‹¤ë¥¸ ì„¹ì…˜ì— ìˆëŠ” í›Œë¥­í•œ ì˜ˆì…ë‹ˆë‹¤ ì„œìš¸ í˜ë¥´ë‹¤ ë…¹í™” ë„ì‹œ ê³µê°„.,5,225,I'm an excellent example in the other section. The space of Seoul's recording city.
rockriverbum,"ì´ ë„ì‹œì˜ ì¤‘ì‹¬ì— ìˆëŠ” í‰í™”ë¡œìš´ ì‚°ì±… í˜ë¥´ë‹¤. ë°©ë¬¸í•˜ëŠ” ë™ì•ˆì— ê±¸ì–´ì„œ ê°ˆ ìˆ˜ ìˆì—ˆê±°ë“ ìš”. ê¸¸ì„ ë”°ë¼ ì‡¼í•‘ê³¼ ì‹ì‚¬ë¥¼ í•˜ê³ , ê·¸ëƒ¥ ê³„ë‹¨ì´ ë§ì•„ ìµœëŒ€ì˜ ë¶„ì£¼í•¨ ì…ë‹ˆë‹¤.",4,225,"take a peaceful stroll in the heart of this city I could walk there during the visit. Shopping and eating along the street, and just having a lot of stairs, it's the busiest."
Ogie Manlungat,ê¹¨ë—í•˜ê³  íˆ¬ëª…í•œ ë†€ë¼ìš´ ë¬˜ê¸° ì•„ë¦¬ë§ˆë¥¼ ìŠ¤íŠ¸ë¦¼ì˜ ì¤‘ì‹¬ì— ìœ„ì¹˜í•œ ë„ì‹œ. ê±¸ì–´ì„œ ê°ˆ ìˆ˜ ìˆëŠ” ìœ ëª…í•œ ëŠë‚Œì´ ì •ë§ ì¢‹ì€ ì•„ì¹¨ì´ í˜ë¥´ë‹¤. ì¸ê³µ í­í¬ ë¬¼ ì†Œë¦¬ë¥¼ ì§„ì • í•  ìˆ˜ë„ ìˆê³ . ë¬¼ì€ ì•„ì£¼ ê¹¨ë—í•˜ê³  ì‹¤ì œë¡œëŠ” ì‰ì–´ ì™€ ë‹¤ë¥¸ ë¬¼ê³ ê¸°ë“¤ì„ ë³´ì•˜ë‹¤. ìš°ë¦¬ì˜ íˆ¬ì–´ ê°€ì´ë“œë¥¼ í•˜ê¸°ë¥¼ ì´ ë°¤ì— íŠ¹íˆ ì—¬ë¦„ì— ë” ë§ì€ ì‚¬ëŒë“¤ì´ ì£¼ìœ„ì— ê·¸ëƒ¥ ë§¤ë‹¬ë ¤ ìˆì§€ìš”. ë°©ë¬¸í•  ê°€ì¹˜ê°€ ìˆìŠµë‹ˆë‹¤!,4,225,"A city located in the center of a stream of amazing clean and transparent tricks Arima. The famous feeling of walking is a really good morning. It can calm the sound of artificial waterfalls. The water was very clean and actually saw carp and other fish. More people are just hanging around at night, especially in summer, to be our tour guide. It's worth visiting!"
Lynns98816,ì—¬ê¸° ë°©ë¬¸í–ˆëŠ”ë° ì£¼ë³€ì— ë°”ëŒì´ ë¶€ëŠ” 4.00 p.m. ëŠê»´ì§€ê¸° ë•Œë¬¸ì— ë†€ë¼ ìµœì•…ì˜ ì œì¼ ìŠ¤íŠ¸ë¦¼ì„ ë³€ê²½í•  ìˆ˜ ìˆìŠµë‹ˆë‹¤. ì¡°ëª…ì´ ì‚¬ë°©ì— í¬ë¦¬ìŠ¤ë§ˆìŠ¤ ì¥ì‹ ë˜ì—ˆë‹¤. ë°©ë¬¸í•  ê°€ì¹˜ê°€ ìˆëŠ” ì°¨ ì´ì—ˆì§€ë§Œ.,4,225,"I've been here, and I can feel 4.00 p.m. of wind blowing around here, so I'm surprised to change the worst stream. Lights were decorated everywhere for Christmas. It was a car worth visiting."
Oztravellergirl,ì¡°ëª…ì´ ë¬´ì²™ ì•„ë¦„ë‹¤ì› ìŠµë‹ˆë‹¤! ì •ë§ ì‚¬ë‘ìŠ¤ëŸ¬ìš´ ë°©ë²•ì„ ë”°ë¼ í¬ë¦¬ìŠ¤ë§ˆìŠ¤ ì¡°ëª…ì´ ë¦¬ë¼ˆê´€. ì´ ë‹¤ë¦¬ê°€ ê¸´ ë³µì—­ í•´ ì‚¬ì´ì— ë‹¤ë¥¸ í…Œë§ˆ.,5,225,The lighting was so beautiful! Christmas lights follow a lovely way to get a rib cage. Different theme between these long-legged years.
NiÃ±a G,ë†€ë¼ìš´! DAEBAK! ì•„ë¦„ë‹¤ìš´! ë‚˜ëŠ” ë°¤ì— ë” ì¢‹ì€ ì œì•ˆì„ ê¼­ ë°©ë¬¸í•˜ë©´ ìŠ¤íŠ¸ë¦¬ë°ëœ latern í¬ë¦¬ìŠ¤ë§ˆìŠ¤ ë‚˜ì˜ ì¶•ì œ! ì •ë§ ë‚­ë§Œì ì´ê³  ì•„ë¦„ë‹¤ìš´!,5,225,Amazing! DAEBAK! Beautiful! I must visit a better offer at night and streamed late Christmas my festival! What a romantic and beautiful one!
Natasha Musafarudin,ì´ ê³³ì— ìˆëŠ” ì¢‹ì€ ì•„ì¹¨ì´ë‚˜ ì €ë… í•¨ê»˜ ì‚°ì±…. ì´ ê³³ì´ ë” ì¡°ìš©í•˜ê³  ì•„ì¹¨ì´ë‚˜ ë°¤ì—ëŠ” íŠ¹íˆ ë´„ì— í•œ ì»¤í”Œ ë°ì´íŠ¸ ì´ ê°€ë“. ì´ ë“±ë¶ˆ ì€ 11ì›” ì¤‘ì— /.,5,225,"A good morning or evening stroll here together. It's quieter here and at night, especially in the spring, it's full of couple dates. This lamp will be in November."
imariahpapaya,"ì €ëŠ” ì´ ì‚¬ë‘ìŠ¤ëŸ¬ìš´ ê³µê°„ ë‹¤ì‹œ ìŠ¤íŠ¸ë¦¼ì„ ë”°ë¼ ì‚°ì±…ì„ ì¦ê¸¸ ìˆ˜ ë…„ ë™ì•ˆ. ê±¸ì–´ì„œ ê°ˆ ìˆ˜ ìˆê¸°ì— ì¢‹ì€ ê³³ì´ê³  ì–˜ê¸°í•˜ê³ , ì‚¬ì§„ì„ ì°ì§€ í•˜ê±°ë‚˜, ë³´ëŠ” ì‚¬ëŒë“¤, í”¼í¬ë‹‰, ì“°ê¸°, íœ´ì‹ì„ ì·¨í•  ìˆ˜ ìˆê³ . ì»¤í”¼ í•œ ì”ì„ ì¡ì•„ ë³´ë©´ ê²°êµ­, ë˜í•œ ë‹¤ë¥¸ í¥ë¯¸ë¡œìš´ ì¥ì†Œì— ìˆëŠ” ì¢‹ì€ ë°©ë²•ì´ ì•¼. ë‚˜ëŠ” ë‚˜ì˜ ì•„ë¦„ë‹¤ìš´ ê²½ê´€ì„ ì¦ê¸¸ ìˆ˜ ìˆëŠ” ì´ ì°¨ ì‹±ë¶€ì¬.",5,225,"I've been enjoying this lovely space for years, following the stream again. It's a great place to walk, talk, take pictures, or take a picnic, write, or relax. Catch a cup of coffee and after all, it's also a good way to be in another interesting place. I can enjoy my beautiful scenery this tea Singbujae."
Zabook,"í¬ë¦¬ìŠ¤ë§ˆìŠ¤ ì „ì— ê°€ë´¤ëŠ”ë°, ê·¸ ë¹›ì€ ê·¸ëƒ¥ ê°€ ì¥ì‹ë˜ì–´ ìˆë‹¤. ì •ë§ ì•„ë¦„ë‹¤ì› ìŠµë‹ˆë‹¤. ì¬ë¯¸ë¥¼ ë³¼ ìˆ˜ ìˆëŠ” ì§€ì—­. ë§ì€ ì¹´í˜ì™€ ì‹ë‹¹ë“¤ì´ ì£¼ë³€ì— ìˆë‹¤.",5,225,"I've been there before Christmas, and the light is just adorned with. It was so beautiful. a fun-loving area There are many cafes and restaurants around."
Anna,íŠ¹ë³„í•œ ê²ƒì€ ë§Œì„ ë”°ë¼ ê±¸ì§€ í˜ë¥´ë‹¤. ëª…ë™ì— ë”°ë¼ì„œ ì— ì‚¬ìš©í•  ìˆ˜ ìˆ.,3,225,"Special things hang along the bay. Depending on Myeong-dong, it can be used in ."
Rachel K,í¥ë¯¸ë¡­ê³  ì¢‹ì€ ë°©ë²•ì„ í•  ìˆ˜ ìˆëŠ” ë©”ì¸ ê±°ë¦¬. ë©‹ì§„ í¬ë¦¬ìŠ¤ë§ˆìŠ¤ ì¡°ëª…. ì €ëŠ” íŠ¹ë³„í•œ ì—¬í–‰ì„ ëª°ë¼ì„œ ì—¬ê¸°ë¡œ ì´ë™ì„ í•˜ì§€ë§Œ. ì–´ì©Œë©´ ë” ë”ìš´ ë‚ ì”¨ê°€ ì•„ë‹ˆë¼ ê²¨ìš¸.,3,225,"Main street where interesting and good methods can be done. Nice Christmas lights. I don't know any special trips, so I'm moving here. Maybe not hotter weather, but winter."
bertha_borneo,ê°œìš¸ ì€ ì•„ì£¼ ê¹¨ë—í•˜ê³  ìƒì¾Œí•œ. ìš°ë¦¬ì˜ ë°œì„ ë‹´ê¸€ ìˆ˜ ìˆëŠ” ì´ ê³³ì—ì„œ í¸ì•ˆí•œ ë§ˆì‚¬ì§€ë¥¼ ë°›ì„ ìˆ˜ ìˆëŠ”. ë˜í•œ ê·¼ì²˜ì— ë ˆìŠ¤í† ë‘ì´ ìˆê³  ë•Œë¡œëŠ” ë§ì€ ê³µì—°ì„ ë³¼ ìˆ˜ ìˆìŠµë‹ˆë‹¤.,4,225,"The stream is very clean and refreshing. You can get a comfortable massage here where you can dip our feet in. Also, there is a restaurant nearby and sometimes you can see many performances."
Brittanylai,"ì €ëŠ” ë“±ë¶ˆ ì´ í•„ìš”ê°€ ìˆë‹¤. ë„ˆë¬´ ì•„ë¦„ë‹¤ìš´, ëª¨ë“  ì‚¬ëŒë“¤ì¸ ê²ƒ. ì œê°€ ë³¸ ë§ì€ ì»¤í”Œ, ê°€ì¡±ì´ë‚˜ ì¹œêµ¬ë“¤. ë‚´ ì„œìš¸ì—ì„œ ê°€ì¥ ì¢‹ì•„í•˜ëŠ” ê³³ ì¤‘ í•˜ë‚˜ì´ë‹¤.",4,225,"I need a lamp. So beautiful, everyone. Many couples, family or friends I've seen. It is one of my favorite places in Seoul."
Shazeen M,11ì›”ì— ë°©ë¬¸í•´ ë³¼ ìˆ˜ ìˆì–´ ì—°ê°„ ë“±ë¶ˆ í˜ë¥´ë‹¤. ì „ë“± ìœ¼ë¡œ ë§ì€ ë‹¤ì–‘í•œ ì‚´ë¦¬ì§€ instillations. ì´ ì‹œê°„ ë™ì•ˆ ê¼­!,4,225,The annual lanterns flow as visitors can visit in November. A lot of different kinds of lights. During this time!
Krisna_eM,"ê¹¨ë—í•˜ê³  ì¢‹ì•˜ì–´ìš” í˜ë¥´ë‹¤. 11ì›”ì— ë°©ë¬¸í•˜ëŠ” ê²½ìš°ë¥¼ ë³¼ ìˆ˜ ìˆëŠ” ëœí„´ í˜ìŠ¤í‹°ë²Œ, ë¡œë§¨í‹±í•œ ì»¤í”Œì´ beaitifull :)",4,225,"It was clean and nice. It spilled. The Lantern Festival, where visitors can see the November visit, is beautifulifull :)"
Alice C,ì•„ë¦„ë‹¤ìš´ ë°¤ ì…ë‹ˆë‹¤. ë§ì€ ì˜ˆìˆ ì ì¸ ìŠ¤íŠ¸ë¦¼ì€ ì•„ë¦„ë‹¤ì›Œ ëª¨ë‘ í‘œì‹œë©ë‹ˆë‹¤. 11ì›” ì€ íŠ¹íˆ ì•„ë§ˆ ì»¤í”Œë“¤ì´ ë°©ë¬¸í•˜ëŠ” ê²ƒì²˜ëŸ¼ ë³´ì˜€ë‹¤. ì œ ìƒê°ì— ì¢‹ì€ ê²ƒì´ ì—¬ë¦„ì„ ì‹íˆ ë‹¤.,5,225,It's a beautiful night. Many artistic streams are beautiful and displayed. November was especially likely to be visited by couples. I think the good thing is to cool down the summer.
jjjoana,"ì „ ì„œìš¸ì— ë°©ë¬¸í•  ë•Œ, ë§ì€ ì¹œêµ¬ë“¤ì—ê²Œ ì¶”ì²œí•˜ê³  ì´ í˜ë¥´ë‹¤. ê·¸ë˜ì„œ ë”°ë¡œ í•˜ë£¨ ë°˜ë‚˜ì ˆ ì„ ë°©ë¬¸ì´ í˜ë¥´ë‹¤. ì´ ë„ì‹œì˜ ì¤‘ì‹¬ì— ìœ„ì¹˜í•œ ì•„ë¦„ë‹¤ìš´ ê°œìš¸. ì„ ë”°ë¼ ì‚°ì±…ì„ í•˜ê³  ìˆëŠ” ê²ƒë„ ì¢‹ê³  ê°œìš¸ ì—ì„œ íœ´ì‹ì— ë°”ìœ ì¼ì…ë‹ˆë‹¤. ë‚˜ëŠ” í•¨ê»˜ ê±¸ì–´ ê°œìš¸ ë°”ë¡œ í­í¬ê¹Œì§€ ê°€ í•¨ê»˜ ì‚¬ì§„ì„ ì°ëŠ” ì‚¬ëŒë“¤ì´ ìˆì—ˆê³  í­í¬ ìŠ¤íŠ¸ë¦¼ì„ í•˜ê¸° ì‹œì‘í–ˆë‹¤. ëˆ„êµ¬ì—ê²Œë‚˜ ì¶”ì²œí•˜ê³  ì‹¶ì–´ ê¸´ ê±°ë¦¬ë¥¼ ì¬ë„ë¡ í•˜ì„¸ ìš” ëª¨ë“  ì•„ë¦„ë‹µì§€ í˜ë¥´ë‹¤.",5,225,"When I visit Seoul, I recommend it to many friends and spill it. So I have to visit for a day and a half. It's nice to take a walk along a beautiful stream in the heart of the city, and it's busy relaxing in the stream. I walked together, went straight to the stream, to the waterfall, and there were people taking pictures together, and I began to stream the waterfall. I'd like to recommend it to anyone, so let's take a long distance. It's all beautiful."
Snowbird888,"ë§ì€ ë¦¬ë·°ë¥¼ ì½ê³  ë§ì´ ì˜¤ì—¼ë˜ì–´ ìˆëŠ” í™˜ê²½ì˜ ì„±ê³µì ì¸ ê²½í—˜ì´ì—ˆì–´ìš” í˜ë¥´ë‹¤. ë‚˜ëŠ” ê·¸ì˜ ë†’ì€ ê¸°ëŒ€ë¥¼ ì°¸ì¡°í•˜ì‹­ì‹œì˜¤. í•œ ë™ì•ˆì€ í•  ìˆ˜ ìˆëŠ” ë§¤ìš° ê¹¨ë—í•˜ê³ , ë„ˆë¬´ ì¸ìœ„ì  ì´ê³  ì¸ê³µì ì¸ ë¹„íŠ¸ëŠ” ì •ë§ ì•„ë¬´ê²ƒë„ ""ë„¤ì´ì²˜"". 100% ì†ŒìŠ¤ ìŠ¤íŠ¸ë¦¼ì˜ ë„ì‹œëŠ” ìˆ˜ë—ë¬¼, ê¹¨ë—í•˜ê¸°ë„ í•˜ëŠ” ì´ìœ !",4,225,"0I read a lot of reviews and it was a successful experience of a polluted environment.I refer to his high expectations.Very clean and too artificial for a while, and the artificial beat is really nothing Nature.The city with 100 source streams is also clean in tap water."
izzatun_nashiin3004,"ì²­ê³„ì²œì€ ë”ëŸ¬ìš´ ê°•ì„ í•œ ë²ˆ ìŠ¤íŠ¸ë¦¼, ì§€ê¸ˆì€ ì„œìš¸ ì•„ë¦¬ë§ˆë¥¼. ë‚®ê³¼ ë°¤ì˜ ì•„ë¦„ë‹¤ìš´ ìˆ™ì†Œì…ë‹ˆë‹¤. ìš´ì´ ì¢‹ìœ¼ë©´ ë“±ë¶ˆ ë§Œ ìˆë‹¤ë©´ ì—¬í–‰ ì¤‘ 11ì›”ì— ìˆì„ ê²ƒì´ë‹¤. ì •ë§ ì•„ë¦„ë‹¤ìš´ ë°¤ ì…ë‹ˆë‹¤.",4,225,"Cheonggyecheon stream once streamed dirty river, now Arima, Seoul. It is a beautiful accommodation of day and night. If you're lucky, it'll be in November during your trip if you have only a lantern. What a beautiful night."
Chat P,"ì ˆëŒ€ì ìœ¼ë¡œ ì•„ë¦„ë‹¤ìš´ ê³³, ê°€ì¥ íŠ¹ë³„í•œ ë°¤. ì´ ìë¦¬ì— ìˆëŠ” ë ˆì´ì € ì‡¼ì— ëŒ€í•´ ì„¤ì •í•  ìˆ˜ ìˆëŠ” ì›Œí„° ìŠ¤í”„ë ˆì´. ì •ë§ ì¢‹ê³  ì‚°ì±… ì€í–‰, itì˜ ì—­ì‚¬ë„ ê½¤ í¥ë¯¸ë¡œìš´.",5,225,"An absolutely beautiful place, the most special night. Water spray that can be set up for the laser show here. It's really nice and the history of the promenade bank, it's quite interesting."
Vivid12345,"ë‚´ cheoonggyecheon ì˜ ë™ìª½ ëì— ìœ„ì¹˜í•˜ê³  ìˆì—ˆê³ . ê·¸ë˜ì„œ ì €ëŠ” ê±¸ì–´ì„œ ê°€ë©´ west end, ë‹¤ìŒì´ gwuangdaemun. ì œê°€ ë³¸ ë§ì€ ì‚¬ëŒë“¤ì´ ìì „ê±°ë¥¼ íƒ€ê³ , ì¡°ê¹…ì´ë‚˜ ì£¼ìœ„ ê¶ê¸ˆí•©ë‹ˆë‹¤. ìˆ˜ì˜ì¥ ë¬¼ì´ ë§¤ìš° ê¹¨ë—í•˜ê³  ë¬¼ê³ ê¸°ë“¤ì„ ë³¼ ìˆ˜ ìˆëŠ”, ê½¤ í° ì¼ë¶€ ë¬¼íšŒêµ­ìˆ˜ë¥˜. ìƒˆë“¤ì´ í•˜ê¸°ì— ì´ëŸ¬í•œ ë¸ŒëŸ¬ì‰¬ ë° ìˆ¨ê¸°ê¸°. ë‚˜ëŠ” ì•„ì¹¨ì—ëŠ” ì†ì—ì„œ í¸ì•ˆí•˜ê²Œ. ë‚œ ë‹¤ì‹œ ë°¤ í’ê²½ì— ë‹¤ìŒ ì—¬í–‰í•  ìˆ˜ ìˆìŠµë‹ˆë‹¤.",5,225,"It was located at the eastern end of my cheoonggyecheon. So when I walk to the west end, the next is Gwuangdaemun. Many people I see ride bicycles and go jogging. Some pretty large mulhoe guksu, where the pool water is very clean and you can see fish. These brushes and hiding for birds. I feel comfortable inside in the morning. I can travel again to the night scenery."
The_Dr_MAK,"ë‚®ì´ë‚˜ ë°¤, íƒˆì¶œ í•  ìˆ˜ ìˆëŠ” ì¢‹ì€ ê³³ì´ ã…†ìœ¼ë©´ ê·¸ ë„ì‹œì˜ ë¶„ì£¼í•¨. ì£¼ë³€ì— ë§ì€ ì‚¬ëŒë“¤ì´ ê¶ê¸ˆí•´ ì°¾ì„ ìˆ˜ ìˆëŠ”, ëª‡ ëª‡ ìƒ‰ë°€ë„ì˜, ì–´ë–¤ ì§€ì—­ì„ ì°¸ì¡°í•˜ì—¬: Pda (ì˜ ê³µê°œ ê² ì£ ). ì €ëŠ” ì´ ë©‹ì§„. ì‹œê°„ì´ ìˆë‹¤ë©´, ì´ ê³³ì€ ë†“ì¹  ìˆ˜ ì—†ëŠ”, ì…ë‹ˆë‹¤.",4,225,"the busyness of the city when there is a good place to escape day or night. A few color-density, some area that many people around you might be wondering about: it's the unveiling of a PCA. I like this cool. If there's time, this place can't be missed."
Ria R,ì´ ê³³ì€ íŠ¹íˆ ë°¤ì— ì„œìš¸ì— ê°ˆ ë•Œ ê¼­ ë´ì•¼ í•  ê³³. ì´ ê³³ì€ ì‹œí‹° í™€ ì—­ê³¼ ì„œìš¸ ì‹œì²­ ê·¼ì²˜. ë§ì€ ì Šì€ ì‚¬ëŒë“¤ì´ ë°¤ì— ê°€ì„œ ë†€ ì¹œêµ¬ ë˜ëŠ” ì»¤í”Œ ë“±ê³¼ í•¨ê»˜. ìì£¼ ê°€ëŠ” ê³³ì´ ì‹œì¥ì´ ìŒì•…ë“¤ë„ ë˜í•œ ì„±ëŠ¥ì„ ì°¸ì¡°í•˜ì‹­ì‹œì˜¤.,5,225,"This is a must-see place especially when you go to Seoul at night. This place is near City Hall Station and Seoul City Hall. Many young people go to play at night with friends or couples, etc. I often go to the market and check out the music as well."
singinggigi,"ì €ëŠ” ë“±ë¶ˆ ì´ ìˆìŠµë‹ˆë‹¤. ë‚˜ëŠ” ë°¤ì— ì¡°ëª…ì„ ì‚´ë¦¬ê³  ë° ê¹Œì§€ ê¸°ë‹¤ë ¸ë‹¤. ì •ë§ í™˜ìƒì ì´ê³  ë‚­ë§Œì  ì´ì—ˆë‹¤. ì„¤ì¹˜í•œ ê° ëœí„´ì´ ìì‹ ì˜ í…Œë§ˆ, ëŒ€ë¶€ë¶„ì˜ í•œêµ­ ì‚¬ëŒë“¤ì˜ ì´ì•¼ê¸°. êµ‰ì¥íˆ í¸ì•ˆí•œ ê³µê°„. ìì› ë´‰ì‚¬ì ë¥¼ ì•ˆë‚´í•˜ëŠ” ì‚¬ëŒë“¤ë„ ìˆì—ˆë‹¤. ì‹ ì„ í•œ ê³µê¸°ê°€ ìˆ¨ì€ ë„ì‹œ ë¹ ë¥¸ ì‘ì—….",4,225,"I have a lamp. I saved the lights at night and waited until . It was fantastic and romantic. Each Lantern installed has its own theme, the story of most Koreans. A very comfortable place. There were also people guiding volunteers. Rapid work in a city where fresh air is hidden."
bluekoala35,ê°€ ë“¤ì–´ ìˆëŠ” ë“±ë¶ˆ ì— ë”°ë¼ ì´ì—ˆë‹¤. ë„ˆë¬´ ë„ˆë¬´ ì¢‹ì•˜ì–´ìš”. ë°”ëŒë„ ì¢‹ê³  ê·¸ëƒ¥ ì²œì²œíˆ ìŠ¤ë ˆë”©ëœ latern í‘œì‹œë¥¼ ë”°ë¼ ì‚°ì±…ì„ í•œ ê³µê°„ì´ ì´ì—ˆë‹¤. ê°ˆ ìˆ˜ ìˆëŠ” ì¢‹ì€ ì¥ì†Œì¸ ë°¤ì— ë‹«ëŠ” ìƒì ë“¤.,4,225,"followed by a lamp with It was so great. It was just a place where the wind was nice and I took a walk along the slowly threaded watermark. Night-closing shops, a good place to go."
travelbugAZ,"ì‚°ì±…í•˜ê¸° ì¢‹ì€ ê³³ì´ 11ì›”ì— ë“±ë¶ˆ ì¤‘. ë˜í•œ í›Œë¥­í•œ ëœë“œë§ˆí¬ë¥¼ ì°¾ê¸°ì— ê±¸ì–´ê°ˆ ìˆ˜ ìˆëŠ” ë°©ë²• ì¤‘ í•˜ë‚˜ê°€ ì„œìš¸, ëª…ë™ ì„ ìì£¼ í•´ ì£¼ê³  í˜¸í…”ê¹Œì§€ ê±¸ì–´ ë‹¤ë…€ë„ ë„ì‹œì˜ ë¶ìª½ ì§€ì—­ì—.",4,225,"A good place to take a walk is lighting up in November. Also, one of the ways to walk to find a great landmark is to walk around Seoul, Myeongdong, and even if you walk to a hotel, in the northern part of the city."
tina lestary,ì´ ê³³ì€ ë‚´ê°€ ê°€ì¥ ì¢‹ì•„í•˜ëŠ” ê²ƒ ì¤‘ì— ìœ„ì— ìˆëŠ” ì„œìš¸. ê°• ì€ ê°€ì¥ ì¢‹ì€ ê³³ì— ìˆê¸°ì— ê±¸ì–´ì„œ ì„œìš¸ ì‹œì¥ ë˜ëŠ” ê°ˆë¦¬ì§„í‹ˆ... Kekeke,5,225,"This is Seoul which is above my favorite. The river is in the best place, so you can walk to the mayor of Seoul or at a crossroads... Kekeke"
divya2866,"ì´ì— ë”°ë¼ ì ì ˆí•œ ì‚°ì±…ë¡œì¸, íŠ¹íˆ ì €ë…ì—. ëœí„´ í˜ìŠ¤í‹°ë²Œì€ 11ì›”ì— ë˜ í•˜ë‚˜ì˜ ê´€ê´‘ëª…ì†Œ",4,225,"A suitable walkway accordingly, especially in the evening. The Lantern Festival is another tourist attraction in November."
tutelee,"ìš°ë¦¬ëŠ” ê±¸ì–´ì„œ í•˜ë£¨ ë™ì•ˆ ë³¸ ì¹´íˆ° êµ¬ì¡°, í•˜ì§€ë§Œ ì¼ìš”ì¼ ë°¤, ì‹œì²­ ê´‘ì¥ì€ ì‚¬ëŒë“¤ì´ í¬ì¥ì„ ì³ ëŒ€ê¸° ì „ ì„¸ê³„ ìˆ˜ë§Œ ì—¬ ê³³ì˜ íì¤‘ ê°•ì„ ë”°ë¼ ì‚°ì±…ì„ í•˜ê³  ë“¤ì–´ê°ˆ ìˆ˜ ìˆëŠ” ë™ë¬¼ ledê°€ ì¼œì¡ŒìŠµë‹ˆë‹¤. ë‚˜ëŠ” ê³¼ì¥ì´ ì•„ë‹™ë‹ˆë‹¤. ìœ„ë¥¼ ë”°ë¼ ê±¸ì–´ ë³¼ë§Œ í–ˆë‹¤. ì—„ì²­ë‚œ ìˆ˜ì˜ ê°€ì¡±ì´ë‚˜ ëŠ¦ì€ ì¼ìš”ì¼ì—. ì˜ ì‹¤í–‰í•œ ê³µê³µ ì£¼ì°¨ì¥!",5,225,"We walked for a day and saw the structure of the cartoon, but on Sunday night, the city hall square was packed by people and turned on animal reds that allowed us to take a walk along tens of thousands of quujung rivers around the world. I'm not a section chief. It was worth a walk up there. A huge number of families or late Sunday. Well-executed public parking!"
Afif A,"ì˜¬ ì €ë…ì—” ì—°ì¸, ê°€ì¡±, ì¹œêµ¬ë“¤, ëª¨ë“  ì‚¬ëŒë“¤ì´ ì¦ê¸¸ ìˆ˜ ìˆë‹¤ ë³¼ ìˆ˜ ìˆìŠµë‹ˆë‹¤. ê·¸ëƒ¥ ì¹´ë©”ë¼ë¥¼ ìŠì§€ë§ˆì„¸ìš”.",5,225,"This evening, lovers, family, friends, and everyone can enjoy it. Just don't forget the camera."
