u_id,review,u_rate,p_id,review_en
TehFarahaini,"ìŠ¤íŠ¸ë¦¼ì„ ë°©ë¬¸, íŠ¹íˆ ë°¤ì—. ì—¬ê¸°ì— ê°€ì„œ, ì§€í•˜ì²  (line 1 ë˜ëŠ” 4) dondaemon ì—­ì„ ##8 ë˜ëŠ” 9 ë²ˆ ì¶œêµ¬. ìƒì„ ì„ íŒŒëŠ” ê°€ê²Œê°€ ìˆì–´ì„œ ê·¸ë¦´ (ì´ìŠ¬ëŒ ì— ê°€ ë„ ë¨¹ì„ ìˆ˜ ìˆëŠ”) ê³³ì´ ì£¼ë³€ì— ë§ì€ ìƒì ì´ ìˆê³  (dondaemon).",4,225,"A visit to a stream, especially at night. Go here, subway (line 1 or 4) dondaemon station, exit ##8 or 9. There's a fish shop, so there's a lot of shops around (dondaemon) where you can go to the grill."
Chang L,ë°¤ì—ëŠ” ì¡°ëª…ì´ ì¢‹ì€ ë³¼ ìˆ˜ ìˆìŠµë‹ˆë‹¤. ì‚¬ì§„ ì°ì„ ìˆ˜ ìˆëŠ” ë°˜ë“œì‹œ ì˜¤í›„ê°€ ëœ ë³´ê¸° ì¢‹ë„¤ìš”. ê²¨ìš¸ì— ìˆê¸° ì¢‹ì€ ê³³ì€ ì‚°ì±…ë„ ì—†ëŠ” ê³¤ì¶© ë“¤! ì €ëŠ” ì´ ê¸°ê°„ ë™ì•ˆ ê·¸ëŠ” ëª‡ ë‹¬ ì „ì— ìŠ¤íŠ¸ë¦¬ë° ë„ ê°€ì„ ì´ ë”ì°í•œ ê²½í—˜ì€ íŒŒë¦¬ë“¤ ì´ ìˆì–´ì„œ ëì—†ëŠ” ì–‘. ì œê°€ ê·¸ëƒ¥ ë‚˜ê°€ì§€ ëª¨ë“  íŒŒë¦¬ ì˜€ë‹¤.,5,225,"You can see the light at night. It's nice to see that it's an afternoon where you can take pictures. Insects without a walk are good places to stay in the winter! During this time, he streamed a few months ago, and this terrible experience was endless because of flies. I just went out. It was all Paris."
Restless Traveller,ì•„ì£¼ ì˜ˆì˜ê³  ê±¸ì–´ì„œ ì„œìš¸ì—ì„œ ìµœì ì˜ ì¥ì†Œ ì…ë‹ˆë‹¤. ê±´ë¬¼ê³¼ í’ê²½ì´ ì •ë§ ê¹”ë”í•œ ë³¼ ìˆ˜ ìˆìŠµë‹ˆë‹¤.,5,225,It's very pretty and it's the best place in Seoul on foot. You can see the buildings and the scenery very neatly.
Stephen1158,"ê°œìš¸ì„ ë”°ë¼ ì‚°ì±…, ì´ê³³ì€ ì•„ì£¼ í‰í™”ë¡­ê³  ê°€ë©´ ë³µì¡í•˜ì§€ ì•Šê³  ì¦ê¸¸ ìˆ˜ ìˆëŠ” íŠ¸ë˜í”½.",5,225,"Walk along the stream, this place is very peaceful and easy to enjoy traffic."
shiqinzulkifli,ë§ì€ ê²ƒì„ ì œì™¸í•˜ê³¤ ì•„ë¬´ê²ƒë„ ì‚°ì±…í•˜ê³  ê±·ê³  ì¦ê¸°ëŠ” ë¶„ìœ„ê¸° ì˜€ë‹¤. ë§ì´ íŒë§¤ í¬ì¥ ë§ˆì°¨ ê±°ë¦¬ ìŒì‹ì„ ì¦ê¸¸ ìˆ˜ ìˆë‹¤ë‹ˆ,4,225,"Except for many things, there was an atmosphere of walking, walking, and enjoying nothing. I can't believe you can enjoy street food."
khoedebecke,"ì—¬ê¸°ì— ìˆëŠ” ê²½ìš° ë¡œì»¬ ì´ë²¤íŠ¸ë¥¼ ì¶”ì²œ í•œë‹¤. ì˜ˆë¥¼ ë“¤ì–´, ìµœê·¼ì— ë°©ë¬¸í•œ ê°€ì¡± ì €ë… ì‹œê°„ì—ëŠ” ì•„ì´ë“¤ì˜ ì¶•ì œë¥¼ ì‚´ë¦¬ì§€ ì—ˆìŠµë‹ˆë‹¤. ì•„ì´ë“¤ì´ ì•„ì£¼ ì˜ˆìœ ì¡°ëª… ì˜€ë‹¤.",4,225,"Local events are recommended if they are here. For example, during the recent family dinner, we saved the children's festival. The children were very pretty lights."
crishie2,"ë‚˜ëŠ” í•  ìˆ˜ ìˆëŠ” ìŠ¤íŠ¸ë¦¼ì— ê±¸ì–´ì„œ ê°ˆ ìˆ˜ ìˆìŠµë‹ˆë‹¤. ìì—° ì€ ë‚˜ì—ê²Œ ìˆì–´ì„œ ë‚˜ëŠ” ì„ ëª…ë„ í”¼ìŠ¤ ê°•ì„ ë”°ë¼ ìˆ¨ ì—ˆë‹¤. ì œê°€ ì´ê³³ì— ì—¬ë¦„ì´ ì¦ê±°ìš´. ì € ë˜í•œ ì´ê³³ì— í¬ë¦¬ìŠ¤ë§ˆìŠ¤ ë™ì•ˆ í¬ì¥, ë¶ˆì´ ì •ë§ ì•„ë¦„ë‹µê³  ì‹¶ì„ ê²ƒì´ë‹¤!",5,225,"I can walk to a stream that I can do. Nature is to me that I hide in clearness along the Peace River. I'm here to enjoy summer. I will also want to be here for Christmas, and the lights will be beautiful!"
bose_rima,"ìŠ¤íŠ¸ë¦¼ ì€ ì„œìš¸ì— ìœ„ì¹˜í•œ, ì¢‹ì€ ê³³ì— ë“¤ëŸ¬ ì €ë…ì— ì¼ì„ ë§ˆì¹˜ê³ , ì‹œì›í•œ ê°œìš¸ ì— ë°œì„ ë‹´ê·¸ê³  ë•Œë¬¸ì— ê±°ëŒ€í•œ ê±´ë¬¼ë“¤.",4,225,"Stream is located in Seoul, where you can stop by a nice place, finish your work in the evening, and soak your feet in a cool stream, so they are huge buildings."
Jason R,"ë°©ë¬¸ í–ˆì„ ë•Œ ê°€ ìˆì–´. ì•„ë‹Œ ì‚¬ì§„ ê°™ì´ ì—¬ë¦„ì² , ê¹”ë”í•œ ê±°ë¦¬ì˜€ì§€ë§Œ. ë³€ê²½ë‹¤ë¥¸ ë·°ë¥¼ ë³´ë‹¤ ëœ ë°”ìœ ê¸¸. ì‘ì€ ë¬¼ê³ ê¸°ë¥¼ ì‚¬ë‘í•˜ëŠ” ì•„ì´ë“¤ì„ ë³¼ ìˆ˜ ìˆëŠ” ìŠ¤íŠ¸ë¦¼ì„ í†µí•´ ì—¬ëŸ¬ ìœ„ì¹˜ì— ìˆëŠ” ë°”ìœ„. 6 ê³¼ 9ì‚´ì´ ì‰½ê²Œ ê±´ë„ˆ ìê¸°.",4,225,I'm there when I visit. It was a neat street in summer like a picture. Changed Less Busier Roads for Other Views. Rock in various positions through a stream where you can see small fish-loving children. 6 and 9 years old sleep easily.
Lina J,"ì•„ì˜¤ ì´ ë§ì€ ë¦¬ë·°ì— ëŒ€í•œ ì•„ë¦„ë‹¤ìš´ ê³³ ì…ë‹ˆë‹¤. ì „ì²´ ì¡°ëª…ì´ ë§í•œë‹¤. ì œê°€ ê°”ì„ ë•Œ ì´ì§€ë§Œ, ì•ˆíƒ€ê¹ê²Œë„ í‰ë²”í•œ ì¡°ëª…. ê·¸ë˜ì„œ, ì•„ë¦„ë‹¤ìš´ ë¹› ì„ ë³¼ ìˆ˜ ìˆëŠ” ì‹œê°„ì„ ì£¼ì„¸ìš”",3,225,"Oh, this is a beautiful place for many reviews. says the whole light. It was when I went, but unfortunately, ordinary lighting. So, give me time to see the beautiful light."
psylocketravel,ì¢€ ê±¸ë¦´ ê²½ìš° ì „ì²´ ìŠ¤íŠ¸ë ˆì¹­í•˜ê¸° ì „ì—ëŠ” ì´ ìŠ¤íŠ¸ë¦¼ì˜ ì¢‹ì€ ì‹œê°„ì´ ìˆë‹¤ë©´ ì‹œë„í•´ ë³´ê³ . ë‚˜ëŠ” ë´„ê³¼ ê²¨ìš¸ ë¹„ìˆ˜ê¸°ì—¬ì„œ ë‚˜ëŠ” ë§¤ë²ˆ ë‹¤ë¥¸ ëŠë‚Œ. ê°€ê¹Œìš´ ê³³ì— ì—­ì´ ê°€ê¹ê³  ë‹¤ë¥¸ ê´€ê´‘ì§€ ì˜ ë ì˜€ë‹¤.,5,225,"If it takes a while, try this stream if you have a good time before stretching. It's the off-season of spring and winter, so I feel different every time. It was close to the station and the end of other tourist attractions."
Darryl G,"ì´ ê´œì°®ë‹¤. í•  ìˆ˜ë„ ìˆê² ì§€ë§Œ. í•´ì•¼ í•  ë•Œ, ê·¸ëƒ¥ ì§§ì€ ì—¬í–‰ì„. ê·¼ì²˜ì— ê°€ì¥ ì¢‹ì€ ê³³ì„ ë³¼ ìˆ˜ ìˆëŠ” ì¢…ë¡œ ì˜ ë‹¤ë¥¸ ì¡°ëª…ì€ ë°¤ì— ë³¸ 3.",1,225,"That's nice. You could do it. When you have to, just a short trip. The other lighting in Jongno, where you can see the best place nearby, is 3."
Aldrin,ì´ ë†€ë¼ìš´ ë“±ë¶ˆì„ ë°©ë¬¸í•œ ì‚´ë ¤ ë†“ì•˜ê¸° ë•Œë¬¸ì— ì¥ì‹ ë˜ì–´ ìˆë‹¤. ì•„ì£¼ ì¢‹ì€ ì €ë… ì‚°ì±… ì¤‘. ì‚¬ì§„ì„ ì°ê¸°ì— ì¢‹ì€ ê³³.,4,225,This amazing lamp is decorated because it was kept alive during a visit. Taking a very good evening stroll. A good place to take a picture.
thetravellingfugu,"ë§¤ìš° ê¸´ ì‹¤í–‰ ìŠ¤íŠ¸ë¦¼ ë„ì‹œ, ì™„ë²½í•œ ê³³ì´ê¸°ì— í•˜ë£¨ ì¢…ì¼ ê´€ê´‘. í…Œì´í¬ ì•„ì›ƒ ì£¼ë¬¸ í•˜ì˜€ë‹¤, ì´ ìë¦¬ì— ì•‰ì•„ íœ´ì‹ì„ ì·¨í•˜ëŠ” stream!",4,225,"It's a very long running stream city, perfect place for sightseeing all day long. I ordered take-out, a relaxing stream in this seat!"
Rabbit12,ê¹¨ë—í•˜ê³  ì¡°ìš©í•˜ê³  ìŠ¤íŠ¸ë¦¼ì— ë„ˆë¬´ë„ ê¹Šì€ ì œ ìì‹ ì˜ ìƒê°ì„ í•©ë‹ˆë‹¤. ì¢‹ì€ ì‚¬ì§„ ì°ì„ ìˆ˜ ìˆë‹¤.,4,225,"It's clean, quiet, and I think about myself too deep in the stream. I can take a good picture."
SM-Travellers,"ì°½ì¡°ì ì¸, ìì—° ê³¼ í•¨ê»˜ ì•„í‚¤í…ì²˜, ì™„ë²½í•œ ê³³ì´ ì¢‹ì€ ì‚°ì±…. ì´ê³³ì€ ì„œìš¸ì„ ë°©ë¬¸ í•˜ê¸° ì— ì¼ë¶€ë¡œ.",5,225,"Creative, architecture with nature, perfect walking. This place is part of my visit to Seoul."
Melvin M,"ê´‘ì¥ ì‹œì¥ì€ ê±¸ì–´ì„œ ê·¼ì²˜ì— ì‹ì‚¬ë¥¼ í•˜ê³  ë‚˜ì„œ. ì´ì— ë”°ë¼ ì™„ë²½í•œ ê³³ì´ ë‹¤ ì¹¼ë¡œë¦¬ ìŠ¤íŠ¸ë¦¼ ì‚¬ìš©í•  ìˆ˜ ìˆìŠµë‹ˆë‹¤. ê¸°ëŒ€í•œ ê²ƒë„ ê±°ì¹ ì–´ ì§€ëŠ” ì§€ê¸ˆ, ì´ ëŠë¦° ì‹¤í–‰ ìŠ¤íŠ¸ë¦¼ì„ ë¬¼ê³ ê¸°ì™€ ì˜¤ë¦¬. ì•„ì£¼ ê²½ì¹˜ê°€. ìœ ì¼í•œ ë‹¨ì ì€, ë§ì€ ê´€ê´‘ê°ë“¤ì´ ìˆë‹¤. ìš°ë¦¬ëŠ” ì €ë…ì— ì˜¬ ë•ŒëŠ” ì¡°ëª… ì´ì§€ë§Œ ìŠ¤íŠ¸ë¦¼ì´ ê²ƒì´ ì¢‹ìŠµë‹ˆë‹¤.",3,225,"After having a meal near the plaza on foot. As a result, the perfect place can use a calorie stream. Now that expectations are getting rough, the slow-running stream is fish and ducks. The view is very. The only drawback is, there are many tourists. We prefer the light in the evening, but we prefer the stream."
Linda929,ì¡°ìš©í•œ ì‚°ì±…í•˜ê¸° ì¢‹ì€ ë” ë‚˜ì€ ê²½ìš° ë„ ë“±ë¶ˆ ì…ë‹ˆë‹¤. ëª¨ë“  ì˜ë¯¸ë¥¼ ì‚´ë¦¬ì§€ í•˜ëŠ” ì¸ìƒì ì¸ ì¥ë©´ì„ plaque ì„¤ëª…í•˜ëŠ” ëª¨ë“  / ì¡°ê° ë“¤. ë§ì€ ê²ƒë“¤ì´ ë‹¤. ì´ ì¢‹ì€ ê³³ì— ê°€ì„œ ì²´í¬ ì•„ì›ƒ í›„ íŒ°ë¦¬ìŠ¤. ì´ë™í•˜ê¸° ì „ì— ì‰´ ìˆ˜ ìˆìŠµë‹ˆë‹¤.,4,225,"A better way to take a quiet walk is also a light. Any of the pieces that explain the impressive scenes that make use of all the whole meaning. A lot of things. Go to this nice place, check out, then Palace. You can rest before moving."
kentmc,"ì¡°ëª…ì„ ì˜ ì‚´ë¦´ ê°€ì¹˜ê°€ ìˆë‹¤, ë‚˜ëŠ” í•œ ê²ƒì´ ì¸ìƒì ì´ì§€ë§Œ, ì €ëŠ” í•œ ì°¾ì„ ìˆ˜ ì—†ì—ˆê¸° ë•Œë¬¸ì—. ë§¤ë ¥ì ì¸ ì„¤ì • ì…ë‹ˆë‹¤. ë” í° ì¡°ëª…ì´ ë§ì€ ë¶€ë™ ì†Œìˆ˜ì  ì— ë‚ ë ¤ë³´ë‚´ëŠ” í•  ìˆ˜ ìˆëŠ” ë§¤ë ¥ì ì¸ ìŠ¤íŠ¸ë¦¼ì´ ì¤‘ê°„ ì— ìˆë‹¤.",3,225,"It's worth keeping the lights alive, I'm impressed with what I did, but I couldn't find one. It's an attractive setting. There is an attractive stream in the middle that can be blown away by larger lights at more floating points."
travelsafer,"ë‹¤ìŒ ì§ì›ë“¤ì´ ì ì‹¬ ì‹œê°„ ë™ì•ˆ, ì €í¬ê°€ ê³„ë‹¨ì¼ ë…¹ìƒ‰ ì˜ì—­ ì•ˆì— ì‘ì€ ê°•ì´ íë¥´ëŠ” ì¤‘ê°„ì— ìˆëŠ” ë„ì‹œ. ë§ì€ ì‹ë¬¼, ë‹¤ë¦¬ê°€ ë§Œë“¤ì–´ì ¸ ë¬¼ ì–´ ì ¸ ê¸´ ì—­ì‚¬ì ì¸ ë²½í™”ê°€ ì”ëœ© í–‰ì§„ê³¼ ì‘ì€ í­í¬. ì •ë§ í¸ì•ˆí•œ ì‚°ì±… ì´ë‹¤.",5,225,"The next staff will be at lunchtime, a city in the middle where we have a small river in the green area of the stairwell. A lot of plants, bridges, and long historical murals full of parades and small waterfalls. It's a really comfortable walk."
Janice And Max K,"ê°œìš¸ì„ ë”°ë¼ ì‚°ì±…í•˜ê¸° ì¢‹ì€ ê³³ì„ ë°©ë¬¸ í•˜ê³ , ìœ„ì— ì‚¬ëŒë“¤ì´ ë‹¤. ì‹œì›í•œ ë¬¼ì— ë°œì„ ìˆ˜ë„ ìˆìŠµë‹ˆë‹¤. ì •ë§ ì¦ê¸¸ ìˆ˜ ìˆì—ˆë‹¤.",4,225,"Visit a good place to take a walk along the stream, and all the people above. You can also put your feet in cool water. I could really enjoy it."
wvzjxq,ì‰½ê²Œ ì‚°ì±… ì˜ ì¤‘ì‹¬ì— ìˆëŠ” ë„ì‹œ. ì´ê³³ì— ì˜¨ ë“±ë¶ˆ. ë¬¼ì€ ê¹¨ë—í•˜ì§€ë§Œ ì¼ë¶€ëŠ” í•˜ìˆ˜êµ¬ ëƒ„ìƒˆê°€ ë‚˜.,3,225,"a city at the center of an easy walk a lantern that came here The water is clean, but some of it smells like sewers."
Paula J,"ì´ê³³ì€ ì €ë…ì— ì‚°ì±…í•˜ê¸°. ëª…ë™ê¹Œì§€ ê±¸ì–´ì„œ ê°ˆ ìˆ˜ ìˆëŠ”, ì¢…ë¡œ ì¸ì‚¬ë™ê¹Œì§€. ìš°ë¦¬ëŠ” ì´ê³³ì„ ê°•ë ¥ ì¶”ì²œí•©ë‹ˆë‹¤. ë˜í•œ ì´ íœ´ì‹ì„ ì·¨í•˜ê¸°ì— ì•„ì£¼ ì¢‹ì€ ì´ë²¤íŠ¸ ë° ì˜ˆìˆ  ì‘í’ˆë“¤ì„ ë³´ê³  ìˆëŠ” í‘œì‹œë©ë‹ˆë‹¤.",4,225,"Take a walk in the evening here. You can walk to Myeong-dong, Jongno Insa-dong. We strongly recommend this place. It's also a great place to relax, and it's a great place to look at the events and artworks."
Danish Harraz,ìƒê°í•  ê²ƒì´ í•˜ê¸°ì— ë§¤ë ¥ì ì´ê³  ë¡œë§¨í‹±í•œ ë°¤ ì˜€ë‹¤ í•˜ê³  íë¥´ëŠ” ê°œìš¸ ì†Œë¦¬ê°€ í¬ë¯¸í•œ ì¡°ëª… ê³¼ í•¨ê»˜ ì„¤ì •í•  ìˆ˜ ìˆìŠµë‹ˆë‹¤. í™•ì‹¤í•œ ë„ì‹œì—ì„œ ë²—ì–´ë‚˜ ì´ë™í•´ì•¼ í•©ë‹ˆë‹¤.,5,225,"It's a charming and romantic night to think about, and you can set it up with a dim light that sounds like a stream. Certain you need to move out of the city."
MagicalFish,ìµœê³ ì˜ ì•„ì´ë””ì–´ëŠ” ë“± í° ë„ì‹œì—ì„œ ë´…ë‹ˆë‹¤. ë°”ìœ ë„ì‹œì— ìˆëŠ” ì•„ì£¼ íš¨ê³¼ì  ì…ë‹ˆë‹¤. ë³¼ ìˆ˜ê°€ ìˆì–´!,5,225,The best ideas are seen in big cities. It's very effective in a busy city. I can see it!
Kiragi27,"ì— ë§ì€ ì¼ë“¤ì´ ì¼ì–´ë‚˜ê³  ìˆëŠ” ë‹¤ì–‘í•œ ì„¹ì…˜ì„ ë”°ë¼ ì˜€ë‹¤. ë‚˜ëŠ” ì—­ì—ì„œ ê±¸ì–´ 3 ê·¼ì²˜ì— ìˆëŠ” ë³´ì‹ ê° (ì²´í¬ ê´€ê´‘ ì§€ë„, ë‹¤ì–‘í•œ ì—­ì— ìˆëŠ” ê°œìš¸ì„ ë”°ë¼) ë¡œ ì‹œì¥ pyeonghwa. ì´ ì¢‹ì€ ê¸´ ì‚°ì±…. ê³„ì† ìœ„ìª½ ë° ì•„ë˜ìª½, ì˜¤ë¥¸ìª½ì— ê´€ê´‘ì§€ë“¤ì´ ê°€ë” í•¨ê»˜ ìŠ¤íŠ¸ë¦¼, ê°™ì€ ë²½í™” ë¥¼ ë³´ì—¬ ì£¼ëŠ” í–‰ì§„ ì˜ ì™• ì •ì¡°ì˜, ë˜ëŠ” ìœ„ë¡œ ë‹¤ë¦¬ (ì´ì–´ì˜¬ ì¼ë¶€ í¬ì´ì¸ , ì´ë¦„ì„ ê¸°ì–µí•˜ì§€ ì•ŠëŠ”ë‹¤). ì´ ì‚´ê³  ìˆëŠ” íšŒìƒ‰ ì˜ í—¤ë¡  ì˜€ë‹¤. ê·¸ëŠ” ì•„ì£¼ ì¹œì ˆí•˜ê³ , í•¨ê»˜ ì´ë™ ë•ŒëŠ” ì¡°ì‹¬í•˜ì„¸ìš”. ê·¸ëŠ” ë‚˜ì—ê²Œ ë‚˜ì˜ ì‚¬ì§„ì„ ê±¸ì–´",5,225,"followed the various sections where many things were going on. I walk from the station and I walk to Bosingak (Check Tourism Map, along the stream at various stations) market pyonghwa. This good long walk. King Jeongjo's or up-leg (some poits to follow, I don't remember the name) of the march, in which tourist attractions sometimes show streams together and the same murals on the right. This was the grayish Heron living in. He's very kind, and be careful when you move with him. He hung my picture on me"
Nepal_Mountain_Lover,ì¢‹ì€ í™œë™ ì…ë‹ˆë‹¤ - ì„œìš¸ì— ìˆëŠ” ë¥¼ ì°¸ì¡°í•˜ì‹­ì‹œì˜¤. ì €í¬ëŠ” ìš´ì´ ì¢‹ì•„ì„œ ê±°ì˜ ë§¤ì¼ ì €ë… ë¬µì„ ë¹„êµì  ê°€ê¹Œì´ ê°”ë‹¤. ì‚¬ë‘ìŠ¤ëŸ¬ìš´ ê³³ì´ë©° ì‚¬ëŒë“¤ - ë³¼ ìˆ˜ ìˆëŠ”. ë§ˆì§€ë§‰ ë°¤ì— ë“±ë¶ˆì„ ë³´ëŠ” ê²ƒì€ í–‰ìš´ì´ í–ˆë‹¤. í™•ì‹¤íˆ ì¢‹ìŠµë‹ˆë‹¤.,5,225,Good activity - see in Seoul. We were lucky enough to get relatively close to the lodging almost every evening. It's a lovely place and people - you can see. It was lucky to see the lanterns on the last night. It's definitely good.
Keehye S,"ë¡œì»¬ì—. ë‚˜ëŠ” í•­ìƒ ë°¤ì— ì¹œêµ¬ë“¤ê³¼ í•¨ê»˜ ì¦ê¸¸ ìˆ˜ ìˆëŠ” ì•½ê°„ì˜ ì‚°ì±… í•œ í›„ ì €ë… ì‹ì‚¬. ê¶Œí•˜ê³  ì‹¶ì§€ ì•Šê¸°ì— ì£¼ ëª©ì , í•˜ì§€ë§Œ ê²½ìš°, ë§ì€ ê´€ê´‘ì§€ì— ë”°ë¼ ê´€ê´‘ì§€ë“¤ì´ ì˜€ë‹¤. ë‚´ ë§ˆìŒì— ë“œëŠ” ì½”ìŠ¤ ë¥¼ ì‹œì‘í•˜ë©´ ì‹œì‘ ì ì—ì„œ ì£¼ëŠ” ë™ìª½ìœ¼ë¡œ ì¢…ë¡œ5ê°€ ga ê´‘í™”ë¬¸ ì¹´ìš´í‹°ê¹Œì§€ ê¸¸ ì‚°ì±…, ê°€ëŠ” ë¡œì»¬ ì‹œì¥ ì´ë¼ê³  í•  ìˆ˜ ìˆê¸°ë¥¼ "" sijang ê´‘ì¥ (ì‹œì¥)"" ë§›ìˆëŠ” ê¸¸ê±°ë¦¬ ìŒì‹!",5,225,"0on the local sideI always take a little walk with my friends at night and then have dinner.I didn't want to recommend it, so the main purpose was tourist attractions, depending on many tourist attractions.If you start the course you like, you can say that it is a local market that goes for a walk to the east of Jongno 5-ga Ga Gwanghwamun County. Sijang Square Market. Delicious street food."
Carmen T,"ë“±ë¶ˆê³¼ ê°™ì€ ê²ƒì¸ë° ìš°ë¦¬ëŠ” ë§¤ìš° ì¸ê¸° ìˆëŠ” ì‹œê°„ ë™ì•ˆ ì£¼ë¯¼ë“¤ì€ ê´€ê´‘ê°ìœ¼ë¡œ ë°©ë¬¸í•˜ê¸°. ì ˆëŒ€ì ìœ¼ë¡œ ì•„ë¦„ë‹¤ìš´ ì‚´ë¦¬ì§€ ê²ƒì´ ë” ì¦ê±°ìš´ ì‚°ì±… ì˜€ë‹¤. í‰ì¼ ì €ë…ì— ë§¤ìš° í˜¼ì¡ í•˜ì—¬, ìš°ë¦¬ëŠ” ìš°ë¦¬ì˜ ì°¨ë¡€ ë¥¼ ê¸°ë‹¤ë ¤ì•¼ í•˜ëŠ” ì‚¬ì§„ì´ ì‚´ë¦¬ì§€ ì•ì—. ì œê°€ 2 ë…„ ì „ ê²¨ìš¸ì— í•˜ë£¨ ë™ì•ˆ, ë§¤ìš° ë‹¤ë¥¸ ëŠë‚Œ. ì´ ì¶”ìš´ ë‚ ì”¨ì— ë³¼ ìˆ˜ ìˆëŠ” ì´ ë§ì§€ ì•ŠìŠµë‹ˆë‹¤. ì•„ì£¼ ê³ ìš”í•œ ì‚°ì±…ì„ í–ˆì§€ë§Œ ê¼­ ì²´í¬ ì•„ì›ƒì´ë‚˜ ì°¾ëŠ”ë‹¤ë©´ ì¡°ìš©í•œ ë„ì‹œì˜ í•µì‹¬ ì…ë‹ˆë‹¤.",5,225,"It's like a lantern, but we visit the residents as tourists during a very popular time. The absolute beauty of saving was a more enjoyable walk. It's very crowded on weekday evenings, so we have to wait our turn in front of the save. For a day in winter two years ago, it felt very different. There aren't many things you can see in this cold weather. I took a very quiet walk, but if I had to check out, it would be the core of the quiet city."
kiwisteve57,ì—¬ê¸°ì— ìˆëŠ” ê²ƒì´ ë§ì§€ëŠ” ì•Šì„ ë•Œì˜ ê·¸ ì¶•ì œ ì…ë‹ˆë‹¤. ëœí„´ í˜ìŠ¤í‹°ë²Œì„ í–ˆëŠ”ë° ë‹¤ë¥¸ ë§ì€ ë“±ë¶ˆ ì´ì—ˆê³  ë§¤ìš° ë‹¤ì±„ë¡œìš´ í…Œë§ˆ. ì•„ì£¼ ì˜ ì •ëˆ ë˜ì–´ ìˆê¸° ë•Œë¬¸ì— íŠ¹ì • ë°©í–¥ì„ ì§€ì‹œí•  ìˆ˜ ìˆëŠ” ìœ ì¼í•œ.,4,225,"It's the festival when there isn't much here. There was a lantern festival, and there were many other lanterns and very colorful themes. The only one that can direct a particular direction because it is very well organized."
Denise Ho MC,ë™ëŒ€ë¬¸ì—ì„œ ì˜¬ë¼ì˜¨ ê¸¸. ìƒì¾Œí•œ ì¥ì†Œì— ìˆëŠ” í•œ ë„ì‹œ. íŠ¹ë³„í•œ ì—¬í–‰ì„ í•  ìˆ˜ ìˆì§€ë§Œ ë§Œë“¤ì§€ í•„ìš”ê°€ ì—†ìŠµë‹ˆë‹¤.,3,225,"A road from Dongdaemun. A city in a refreshing place. You can make a special trip, but you don't have to make it."
still m,ë™ëŒ€ë¬¸ ë””ìì¸ í”Œë¼ì í˜¸í…”ì„ ë– ë‚  ìˆ˜ ìˆëŠ” ê³³ì…ë‹ˆë‹¤. ì €ëŠ” ìƒìœ„ ìˆ˜ì¤€ì—ì„œ ë³¼ ìˆ˜ ìºë„ì— ìš´í•˜ë¥¼ ë”°ë¼ ê±¸ìœ¼ë©´ í•˜ì§€ ì•Šì•˜ë‹¤. ë§ì´ ë³¼ ìˆ˜ ìˆëŠ” ê³³,2,225,You can leave Dongdaemun Design Plaza Hotel. I didn't want to walk along the canals at the upper level. a place where one can see a lot
Michael H,"í•˜, ì§€í•˜ ì´ ìµœê·¼ untiil. ì´ì œ, ë¬¸ìê°€ ìˆëŠ” ì½˜í¬ë¦¬íŠ¸ ë²½ìœ¼ë¡œ ë‘˜ëŸ¬ì‹¸ì¸ ìºë‹ˆì–¸, í•œ ìˆ˜ì¤€ ì•„ë˜ì— ìŠ¤í† ë¦¬ ê°€ ìˆìŠµë‹ˆë‹¤. ê±¸ì„ ë•Œ ì‚¬ìš©í•  ìˆ˜ ìˆê¸° ë•Œë¬¸ì— ì¡°ìš©í•˜ê³  ì¢‹ë‹¤. ì‚¬ë‘ìŠ¤ëŸ¬ìš´. ì´ ê±°ëŒ€í•œ ë„ì‹œì˜ í•œ ê°€ìš´ë°.",5,225,"Ha, underground this latest until. Now, there's a canyon surrounded by concrete walls with letters, one level below the story. It is quiet and good because it can be used when walking. Lovely. In the middle of this huge city."
kupunakane,"ì´ ê³µê°„ì„ í†µí•´ ì´ í•œ ì„œìš¸ì˜ ì¤‘ì‹¬ë¶€ê°€ ê°„ë‹¤. ì „ì²´ ì§€ì—­ì€ ë§¤ìš° ê¹¨ë—í–ˆê³ , ì¹¨ëŒ€ ë“± ë¬¼ ë° ìŠ¤íŠ¸ë¦¼, ì–‘ìª½ ëª¨ë‘ ê±¸ì–´, ê·¸ë¦¬ê³  ë²¤ì¹˜. í•˜ëŠ” ì„¹ì…˜ì—ì„œ ì‹œì‘ ë° ë™ëŒ€ë¬¸ ë³´ë‹¤ í›¨ì”¬ ë” ë§¤ë ¥ì ìœ¼ë¡œ ì„œìª½ ë™ìª½ìœ¼ë¡œ í–¥í•˜ê³  ìˆëŠ” ì„¹ì…˜ ìˆ˜ ìˆìŠµë‹ˆë‹¤. ë˜í•œ ê²½ë¡œì— ë¶ìª½ì— ìˆëŠ” ë‚¨ìª½ ë³´ë‹¤ í›¨ì”¬ ì¢‹ì•˜ì–´ìš”. ì—¬ëŸ¬ ê³³ì˜ ë‚¨ë¶€ ê²½ë¡œ ë° ë°”ë‹¥, ê±¸ì–´ê°ˆ ìˆ˜ ìˆëŠ” ê²ƒì´ ì–´ë µì§€ ì•Šì§€ë§Œ ë˜ëŠ” ìœ„í—˜, í•„ìš”í•œ ì£¼ì˜ ì´ë‹¤. í›Œë¥­í•œ ì˜ˆìˆ ì‘í’ˆë“¤ì´ ìˆëŠ” ê²ƒì´ ì¤‘ìš”í•˜ê¸° ë•Œë¬¸ì— ê²½ë¡œë¥¼ ë”°ë¼ ë¶ìª½ ë²½ì— ìµœê³ ì˜€ìŠµë‹ˆë‹¤. ë°¤ì—ëŠ” ì¡°ëª…ì´ ìˆ˜ ìˆì§€ë§Œ,",5,225,"Through this space, the center of Seoul goes. The entire area was very clean, with water and streams, such as beds, walking on both sides, and benches. sections that are much more attractive to the west than the start and Dongdaemun sections. It was also much better than the south, north of the route. Several southern routes and floors, it is not difficult or dangerous to walk, but necessary caution. It was the best on the north wall along the route because it was important to have great artworks. You can light up at night."
scalopages,"ìš´í•˜ ë„ì‹œ ë°°ìˆ˜ ì‹œìŠ¤í…œì—ì„œëŠ” ë””ìì¸ì´ ì˜ ë˜ê³  í•¨ê»˜ ë ˆí¬ë ˆì´ì…˜ ê³µì›. ì£¼ìœ„ì— ìˆëŠ” ì‚¬ëŒë“¤ì€ ì•„ì¹¨ì—, ì•„ì£¼ í‰í™”ë¡­ ìŠµë‹ˆë‹¤.",5,225,"In the canal city drainage system, the design works well and together the recreation park. People around you are very peaceful in the morning."
Norhasniza O,ì´ ìŠ¤íŠ¸ë¦¼ì´ ì˜ ë˜ì–´ ìˆìŠµë‹ˆë‹¤. ë˜í•œ ì•„ì£¼ ê¹¨ë—í•˜ê³  í–ˆìŠµë‹ˆë‹¤. ì²­ê³„ì²œ ì‚°ì±… í•  ìˆ˜ ìˆìŠµë‹ˆë‹¤. ë°¤ì—ëŠ” ì¡°ëª… ì´ë©° ë§¤ìš° ì•„ë¦„ë‹¤ìš´ í’ê²½.,4,225,"This stream is in good condition. It was also very clean. You can take a walk in Cheonggyecheon. At night, there are lights and very beautiful scenery."
WKWalker5297,ì´ ì„¸ìƒì—ì„œ ê°€ì¥ ì¸ìƒì ì¸ ë‚¨ë¶ ê°œì„ í•  ìˆ˜ ìˆëŠ”. í™”ë ¤í•œ ì˜ˆìˆ  ì‘í’ˆ. ìì—° í™˜ ê²½ ì˜ ì¤‘ì‹¬ì— ìˆëŠ” ë„ì‹œ.,5,225,The most impressive inter-Korean improvement in the world. a splendid work of art A city at the center of a natural hallucination.
