u_id,review,u_rate,p_id,review_en
Relax825963,ë°¤ì—ëŠ” ì•¼ê²½ì´ ë¹„ì³ ì•„ë¦„ë‹µê³  LED ë„ ì˜ ë˜ì–´ìˆì–´ì„œ ì•„ë¦„ë‹µìŠµë‹ˆë‹¤. ê²Œë‹¤ê°€ ë¬¼ë„ ê¹¨ë—í•´ë³´ì—¬ì„œ ê±·ëŠ” ëŠë‚Œë„ ë§¤ìš° ì¢‹ìŠµë‹ˆë‹¤. ì¢…ë¡œì—ì„œ ê´‘í™”ë¬¸ì¶œë°œì ìœ¼ë¡œ ê°€ë³ê²Œ ê±·ëŠ”ê±¸ ì¶”ì²œí•˜ê³ ..ë°˜ëŒ€ë¡œê°€ë©´ ëì´ì—†ìŒ ì³ ì•„ë¦„ë‹µê³  LED ë„ ì˜ ë˜ì–´ìˆì–´ì„œ ì•„ë¦„ë‹µìŠµë‹ˆë‹¤. ê²Œë‹¤ê°€ ë¬¼ë„ ê¹¨ë—í•´ë³´ì—¬ì„œ ê±·ëŠ” ëŠë‚Œë„ ë§¤ìš° ì¢‹ìŠµë‹ˆë‹¤. ë¬¼ì— ë˜ì ¸ì§„ ë™ì „ ì¤ì§€ë§ˆì„¸ìš” ì§ì›ì´ ë°”ë¡œ ë‹¬ë ¤ì˜µë‹ˆë‹¤... ì¢…ë¡œì—ì„œ ê´‘í™”ë¬¸ì¶œë°œì ìœ¼ë¡œ ê°€ë³ê²Œ ê±·ëŠ”ê±¸ ì¶”ì²œí•˜ê³ ..ë°˜ëŒ€ë¡œê°€ë©´ ëì´ì—†ìŒ í¬ë¦¬ìŠ¤ë§ˆìŠ¤ì‹œì¦Œì— ì—¬ê¸°ì˜¤ë©´ ì •ë§ ì•„ë¦„ë‹¤ìš´ LED ì¥ì‹ì„,5,225,"At night, the night view is beautiful and the LED is good so it is beautiful. Besides, the water looks clean, so the feeling of walking is very good. I recommend you to walk lightly from Jongno to Gwanghwamun.On the other hand, it's beautiful because there's no end, and the LED's are also good so it's beautiful. Besides, the water looks clean, so the feeling of walking is very good. Don't pick up coins thrown in the water. The staff is coming right up... I recommend you to walk lightly from Jongno to Gwanghwamun.On the other hand, there's no end to it. On the other hand, when you come here in Christmas season, you're going to see"
Paul.S.H.Ch,"ê°€ë‚œí•œ ì†Œë…„ê³µ, ì†Œë…€ê³µë“¤ì˜ í„°ì „ì´ì—ˆë˜ ì²­ê³„ì²œì´ ì´ë ‡ê²Œ ë°”ë€” ì¤„ì€ ì•„ë¬´ë„ ìƒìƒëª»í–ˆì„ ê²ƒì´ë‹¤. ì¤‘ê°„ì— ì‹œí–‰ì°©ì˜¤ë„ ë§ì•˜ì§€ë§Œ ì´ë ‡ê²Œ ë°”ê¾¼ ê²ƒì€ ì •ë§ ì˜í–ˆë‹¤. ì²­ê³„ì²œì„ ë³µê°œí•˜ë‹ˆ ë„ì‹¬ ì—´ì„¬ í˜„ìƒë„ ì‚¬ë¼ì¡Œë‹¤.",4,225,"No one would have imagined that Cheonggyecheon, which used to be the home of poor boys and girls, would be so changed. There were many trials and errors in the middle, but it was really good to change it like this. As the stream was covered with snow, the heat island phenomenon in the downtown area disappeared."
ì§€ì—° ìµœ,ì¢…ë¡œì—ì„œ ëª¨ì„ì´ë‚˜ ìˆ ìë¦¬ í›„ì— í•¨ê»˜ ê±¸ìœ¼ë©´ ìµœê³ ì¸ ì²­ê³„ì²œ íŠ¹íˆ ë°¤ì— ë©”ìš° ë©‹ìˆê³  ê¹¨ë—í•˜ë©° ê±¸ì–´ì„œ ë™ëŒ€ë¬¸ê¹Œì§€ ì¦ê²ê²Œ ê°ˆìˆ˜ ìˆìŒ,5,225,"The best place to walk together after a meeting or drinking party in Jongno is Cheonggyecheon Stream, especially at night, which is cool and clean, and you can enjoy walking to Dongdaemun."
jasmin0313,ê°€ì¡±ã†ì¹œêµ¬ã†ì—°ì¸ ë“± ëˆ„êµ¬ì™€ ê°€ë„ ì¢‹ì€ ê³³ ë•Œë•Œë¡œ ë°”ë€ŒëŠ” ì „ì‹œë¬¼ë„ ì¢‹ë‹¤ ê±·ê¸° ìš´ë™ì„ í•˜ê¸°ë„ ì¢‹ê³  ë‚  ë”°ëœ»í• ë• ê³³ê³³ì— ì•‰ì•„ ì‰¬ì–´ë„ ì¢‹ë‹¤. ì‚¬ì§„ì°ì„ ê³³ë„ ë§ë‹¤.,5,225,"It is good to go to places like family, friends, lovers, etc. It is good to have exhibits that change from time to time. It is good to take a walk or take a rest when the weather is warm. There are many places to take pictures."
Qjr,ì¢…ë¡œì™€ ê´‘í™”ë¬¸ ê·¼êµ ê±¸ìœ¼ë©° ì‚°ì±…ì„ ì¦ê¸¸ê¸°ì—ë„ ì¢‹ì§€ë§Œ ì–´ëŠì •ë„ì˜ ê±°ë¦¬ëŠ” ê±¸ì–´ì„œ ì´ë™ë„ ê°€ëŠ¥í•˜ì—¬ ì¢‹ì€ ê±°ë¦¬ì´ë‹¤~ ì´ë²¤íŠ¸ê°€ ë§ì€ ê³³ì´ì–´ì„œ ì¦ê¸¸ê±°ë¦¬ë„ ë§ê³  ë§›ì§‘ë„ ê³³ê³³ì— ë§ì€ ê³³!,4,225,"It's good to take a walk around Jongro and Gwanghwamun, but it's a good street because you can walk around a certain distance. There are many events, so there are a lot of things to enjoy and restaurants are everywhere!"
Jiyoun,ì €ë…ë¨¹ê³  ì‚°ì±…í•˜ê¸°ëŠ” ì¢‹ì•˜ê³  ì¡°ëª…ì´ ì¡°ê¸ˆ ë” ë°ì•˜ìœ¼ë©´ ì–´ë–¨ê¹Œ?í•˜ëŠ” ìƒê°ì„ í–ˆì–´ìš” ê¸¸ì€ í¸í•œí•˜ê³  ë¬¼ì†Œë¦¬ë„ ì¢‹ê³  ë™ì „ë˜ì§€ê¸°ë„í•˜ë©° ì˜ ë†€ì•˜ì–´ìš”,4,225,"It was nice to take a walk after dinner and what if the lights were a little brighter?That's what I thought about it. The road was comfortable, the sound of the water was good, and I enjoyed tossing coins."
ì§±ì§±ì§±,ì²­ê³„ì²œì—ì„œ ë‹¤ì–‘í•œ í–‰ì‚¬ë¥¼ í•˜ëŠ”ë° í¬ë¦¬ìŠ¤ë§ˆìŠ¤ë•ŒëŠ” í¬ë¦¬ìŠ¤ë§ˆìŠ¤ ì¶•ì œë¡œ í˜ìŠ¤í‹°ë²Œì„ í•œë‹¤. ì‚¬ëŒì´ ì—„ì²­ ë§ì•„ì„œ ì‚¬ì§„ì°ê¸°ëŠ” í˜ë“¤ìˆ˜ë„ ìˆì§€ë§Œ ì¸íŒŒê°€ ë§ë‹¤ëŠ”ê±´ ë³¼êº¼ë¦¬ê°€ ë§ë‹¤ëŠ”ê²ƒì´ê¸°ë„ í•˜ë‹¤. ë¨¹ê±°ë¦¬ ë³¼ê±°ë¦¬ë„ ë§ì•„ì„œ ì•„ì´ë“¤ê³¼ í•¨ê»˜ ë°©ë¬¸í•´ë„ ì¢‹ê² ë‹¤. ì¼ë‹¨ ë¬´ë£Œë¼ëŠ” ì ì—ì„œ ë¶€ë‹´ì—†ê³  í•œì‹œê°„ì •ë„ ì ê¹ ë“¤ë ¸ë‹¤ ê°€ëŠ”ê²ƒë„ ë°©ë²•ì´ë‹¤. ì£¼ì°¨ëŠ” ê·¼ì²˜ ì£¼ì°¨ì¥ì—ì„œ í•˜ë©´ ì˜¤ì²œì›ì •ë„ì— ê°€ëŠ¥í•˜ë‹¤.,4,225,"There are various events in Cheonggye Stream, and there is a Christmas festival on Christmas is held on Christmas. It may be hard to take pictures because there are so many people, but the fact that there are many people means there are many things to see. There are a lot of food to see, so it would be nice to visit with your children. For now, there is no burden in that it is free and it is also a way to stop by for about an hour. Parking is about 5,000 won if you park in a nearby parking lot."
yoon,ê°€ë”ì”© ì—´ë¦¬ëŠ” ì„œìš¸ë¹›ì¶•ì œ ë£¨ë¯¸ë‚˜ë¦¬ì—ëŠ” ì •ë§ ë„ˆë¬´ ì˜ˆì˜ë„¤ìš”!!! ì‚°ì±…í•˜ê¸°ì—ë„ ì„œìš¸ì‹œë‚´ë¥¼ êµ¬ê²½í•˜ê¸°ì—ë„ ë„ˆë¬´ ì¢‹ì•„ì„œ ì„œìš¸ ëª…ì†Œë¥¼ ê¼½ëŠ”ë‹¤ë©´ ê¼­ ì¶”ì²œí•©ë‹ˆë‹¤!,5,225,It's so pretty for the occasional Luminarie at the Seoul Light Festival!!! It's so good to take a walk and look around Seoul that I recommend Seoul attractions!
ì´ì—°í™”,í™•ì‹¤íˆ ì „ë³´ë‹¤ ë” ê¹”ë”í•˜ê³  ì—°ë§ì´ë¼ ë” ì´ì˜ê²Œ ê¾¸ë©°ì ¸ìˆì–´ì„œ ê°™ì´ ì‚°ì±…í•˜ê¸° ì¢‹ì•˜ìŠµë‹ˆë‹¤ã…¡ ê°ê° ê³„ì ˆë³„ë¡œ ì´ë²¤íŠ¸ì„± ë‚ ì§œëŒ€ë¡œ ê¾¸ë©°ì§€ëŠ”ê²ƒê°™ì•„ì„œ ìì£¼ ì™€ë„ ê´œì°®ì„ë“¯í•˜ë„¤ìš”ã…¡,4,225,"It was definitely cleaner and prettier at the end of the year than before, so it was good to take a walk together.I think it's okay to come here often because each season is organized according to the event schedule.-"
Alpertbyun,"ì²­ê³„ì²œ, ê´‘í™”ë¬¸ì—­ì—ì„œ ë‚˜ì™€ì„œ ì¡°ê¸ˆë§Œ ê±¸ì–´ê°€ë‹¤ë³´ë©´ ë‚˜ì˜¤ëŠ” ê³³ ì‹œì¦Œì— ë”°ë¼ ë“±ë¶ˆì¶•ì œë„ ë³¼ìˆ˜ìˆì–´ì„œ ì¢‹ê³  ê°€ì„ì—ëŠ” ë‹¨í’ì„ ë³¼ìˆ˜ìˆì–´ì„œ ì¢‹ìŠµë‹ˆë‹¤.",3,225,"After coming out of Cheonggyecheon and Gwanghwamun Station, if you walk a little bit, you can see the lantern festival depending on the season, and in autumn, you can see the fall foliage."
ì„ì”¨,ê°€ì¡±ë“¤ê³¼ í•¨ê»˜ ë°©ë¬¸í–ˆëŠ”ë° ì‚°ì±…í•˜ê¸° ì¢‹ì•„ìš”. í–‰ì‚¬ë¥¼ ë§ì´ í•˜ë‹ˆ í–‰ì‚¬ ì§„í–‰ë ë•Œ ë°©ë¬¸í•˜ì‹œë©´ ë” ì¢‹ìŠµë‹ˆë‹¤. ê·¸ë¦¬ê³  ìœ ëª¨ì°¨ëŠ” ëŒê³  ë‹¤ë‹ˆê¸° ë¶ˆí¸í•´ìš”,5,225,"I visited with my family and it's good to take a walk. There are a lot of events, so it's better to visit during the event. And the stroller's not easy to pull around."
ìœ¤ì•„ì˜,ë“±ë¶ˆì¶•ì œë•Œ ë°©ë¬¸í–ˆëŠ”ë° ë¶„ìœ„ê¸°ë„ ë„ˆë¬´ ì¢‹ê³  ì¸ìƒì ì´ì—ˆìŠµë‹ˆë‹¤! í•´ë§ˆë‹¤ í•˜ëŠ”ì§€ëŠ” ëª¨ë¥´ê² ì§€ë§Œ í•œë‹¤ë©´ ë˜ ë°©ë¬¸í•˜ê³ ì‹¶ì–´ìš” ã…ã…,5,225,"I visited during the Lantern Festival and the atmosphere was so nice and impressive! I don't know if I do it every year, but I'd like to Haha"
anixmana,ì¼ í•˜ëŠ” ê³³ ê·¼ì²˜ë¼ ë§¤ì¼ ì¶œí‡´ê·¼ ê¸¸ ì§€ë‚˜ê°€ê³  ê°€ë” ì‚°ì±…ë„ í•©ë‹ˆë‹¤. ì—¬ë¦„ì—ëŠ” ë²Œë ˆë„ ë§ì•„ ì˜ ë‹¤ë‹ˆì§€ ì•Šì•˜ëŠ”ë° ìš”ì¦˜ê°™ì€ ê°€ì„ ë‚ ì”¨ì— ê±·ê¸° ì°¸ ì¢‹ì•„ìš”.,5,225,"It's near my work place, so I pass by my commute every day and sometimes take a walk. In the summer, there were many bugs, so I didn't go around much, but it's good to walk in autumn weather like these days."
ye0ngjus,ì„œìš¸ ë„ì‹¬ì„ íë¥´ëŠ” ì²­ê³„ì²œì´ë‹¤. ê°€ë³ê²Œ ì‚°ì±…í•˜ê¸° ì¢‹ì€ ê³³ì´ê³  íŠ¹íˆ ì•¼ê²½ë„ ë©‹ì§„ ê³³ì´ë‹ˆ ì—¬í–‰ê°ë“¤ì—ê²ŒëŠ” í•˜ë£¨ë¥¼ ë§ˆë¬´ë¦¬í•˜ëŠ” ì½”ìŠ¤ë¡œë„ ì¶”ì²œí•œë‹¤.,3,225,"Cheonggyecheon Stream flows through downtown Seoul. It's a good place to take a walk and especially the night view, so I recommend it as a course to wrap up the day for travelers."
ì´ë¯¸ì‚¬ìš©ì¤‘,"ì´ë ‡ê²Œê¹Œì§€ ê¹¨ë—í•œê°€ ì‹¶ì„ ì •ë„ë¡œ ë¬¼ê³ ê¸°ë“¤ì´ ëˆˆì— ë„ëŠ” ê³³ ê°ì¢… í–‰ì‚¬ê°€ ì²­ê³„ì²œì¼ëŒ€ì—ì„œ ìì£¼ ì§„í–‰ë˜ê¸°ì— ëª©ì ì—†ì´ ë°©ë¬¸í–ˆë‹¤ê°€ ê¹œì§ì„ ë¬¼ ë°›ëŠ”ë“¯, ì¦ê±°ì›€ì„ ì–»ê³  ê°ˆ ìˆ˜ ìˆë‹¤",5,225,"In places where fish stand out to such an extent that they are so clean, various events are held frequently around Cheonggyecheon Stream, so you can have fun as if you were receiving a surprise gift after visiting for no purpose."
May B,"ì ì‹¬ì‹œê°„ì—” ì‚¬ëŒì´ ë§ì•„ìš”, ìŠ¬ì© í”¼í•´ê°€ë©´ ì²œì²œíˆ ì„œìš¸ í•œê°€ìš´ë°ì„œ ì—¬ìœ  ì¦ê¸°ê¸° ì ë‹¹í•œ ê³³ì´ì£ . ì´ë²¤íŠ¸ë„ ìì£¼ ì—´ë¦¬ë‹ˆ ì¬ë°ŒëŠ” ë³¼ê±°ë¦¬ë„ ì œë²• ìˆì–´ìš”.",4,225,"There are a lot of people at lunchtime, and if you avoid it, it's a good place to enjoy leisure time in the middle of Seoul. There are many fun things to see as there are many events."
ë‹¨ë‹¨ë‹¨,ì˜ê´€ë¦¬ë˜ê³  ìˆì–´ì„œ ê±·ê¸° ë„ˆë¬´ ì¢‹ì•˜ìŠµë‹ˆë‹¤. ì„œìš¸ì† ë°ì´íŠ¸ì½”ìŠ¤ë¡œ ì•„ì£¼ ì¢‹ì€ê²ƒ ê°™ì•„ìš”. ë§¤ë‹¬ ê±·ê²Œë©ë‹ˆë‹¤. ì™¸êµ­ì¸ë“¤ì—ê²Œ ì¢‹ì€ ì¶”ì²œ ì½”ìŠ¤ì…ë‹ˆë‹¤.,5,225,It was so good to walk because it was well managed. It's a great date course in Seoul. I walk every month. This course is good for foreigners.
407yjj,ì²­ê³„ì²œì€ ë‚®ì´ë“  ë°¤ì´ë“  ì‚°ì±…í•˜ê¸° ì•„ì£¼ ì¢‹ì€ ê³³ì¸ ê²ƒ ê°™ì•„ìš”. íŠ¹íˆ ë“±ì¶•ì œë¥¼ í•  ë•Œ ì˜¤ì‹œë©´ ì •ë§ ì•„ë¦„ë‹¤ìš´ ê´‘ê²½ì„ ë³´ì‹¤ ìˆ˜ ìˆìŠµë‹ˆë‹¤. ì£¼ë³€ì— ë“œë¥´ì‹ ë‹¤ë©´ ì‚°ì±…ì½”ìŠ¤ë¡œ ê¼­ ì§€ë‚˜ê°€ì‹œê¸¸,5,225,"I think Cheonggyecheon is a great place to take a walk, day or night. Especially when you come to the festival, you can see the beautiful scenery. If you want to stop by, make sure you pass by the walking course."
sanrio2018,ì—¬ë¦„ì—ë„ ì´ê³³ì„ ì§€ë‚˜ë©´ ì„ ì„ í•œ ê¸°ìš´ì„ ëŠë‚„ìˆ˜ìˆì–´ìš” ~ ê·¸ë˜ë„ ë•¡ë³•ìˆëŠ” í•œë‚®ë³´ë‹¨ ì˜¤í›„ ëŠ¦ê²Œ ë°©ë¬¸í•˜ë©´ í”¼ì„œ ê°€ëŠ¥! ì•¼ê°„ì— ì¡°ëª…ë„ ì˜í•´ë†¨ê³  ì¡°ê²½ë„ ì¢‹ì•„ì„œ ê´‘í™”ë¬¸ì—ì„œ ë™ëŒ€ë¬¸ê¹Œì§€ ì­‰~ ê±°ë‹ê¸° ì¢‹ìŠµë‹ˆë‹¤! ê´‘í™”ë¬¸ìª½ì€ ë§›ì§‘ë„ ë§êµ¬ìš”. ëŒ€ì‹  ìœ ëª¨ì°¨ ê¸¸ì€ ì—†ìŠµë‹ˆë‹¤ ê³„ë‹¨ìª½ ì˜¤ë¥´ë‚´ë¦´ë•Œ í˜ë“¤ìˆ˜ìˆìŠµë‹ˆë‹¤.,5,225,"Even in summer, you can feel the coolness after passing here. But rather than the midday when it's hot, you can go on a vacation if you visit late in the afternoon! The lighting is good at night and the landscaping is good, so it's good to walk from Gwanghwamun to Dongdaemun! There are many good restaurants around Gwanghwamun. But there's no stroller path. It can be hard to go up and down the stairs."
Kylie Park,ì‹œê°„ì´ ëœë‹¤ë©´ ê±¸ì–´ì„œ ì´ë™í• ë•Œ ì´ê³³ì´ ì„œìš¸ì´ë„¤~ ëŠë¼ê²Œ í•˜ëŠ” ì¥ì†Œì´ë‹¤. íŠ¹ì´ ì €ë…ì— ì¡°ëª…ì´ ìˆê³  ì‚¼ì‚¼ì˜¤ì˜¤ ì•‰ì•„ì„œ ë§¥ì£¼ë¥¼ ë§ˆì‹œëŠ” ì‚¬ëŒë“¤ë„ ìˆê³  ë¶„ìœ„ê¸° ì¢‹ë‹¤.,4,225,"If you have time, when you walk, this is Seoul. It's a place that makes you feel. There are lights and people who drink beer sitting in twos and threes in a special evening, and the atmosphere is nice."
MyEveryTime,ì²­ê³„ì²œì˜ ì•¼ê²½ì´ ë©‹ìˆë‹¤ê³  í•´ì„œ ê²½ë³µê¶ ê´€ëŒì´ ëë‚˜ëŠ” ì‹œê°„ì— ë§ì¶° ë°©ë¬¸í•˜ì˜€ë‹¤. ë¬¼ë„ ì •í™”ë˜ì–´ ê¹¨ë—í•˜ê³  ê³³ê³³ì— ì‘ì€ ë³¼ ê±°ë¦¬ë„ ìˆë‹¤.,5,225,The night view of Cheonggyecheon Stream was so beautiful that I visited the palace at the end of the tour. The water is clean and there are also small sights everywhere.
ë°¥ìŸì´,ê±·ê¸° ì¢‹ê²Œ ì˜ë˜ì–´ ìˆìŠµë‹ˆë‹¤. ì—¬ë¦„ì—” ê±·ëŠ”ê²Œ ë‹¤ì†Œ í˜ë“¤ìˆ˜ ìˆìœ¼ë‚˜ ë¬¼ê°€ë¼ ê·¸ëŠ˜ì—ì„œëŠ” ë‹¤ì†Œ ì‹œì›í•©ë‹ˆë‹¤. ë­”ê°€ í¬ê²Œ ë³¼ê²ƒì€ ì—†ìœ¼ë‚˜ ì„œìš¸ì‹œë‚´ì—ì„œ í•œì í•˜ê²Œ ê±·ê³  ì‹¶ì„ë•Œ ë‚´ë ¤ê°€ì„œ ê±·ë„¤ì—¬ ã…ã…,5,225,"It's good for walking. Walking may be a little hard in summer, but it is cool in the shade of the water. There's nothing big to see, but when I want to walk quietly in Seoul, I go down and walk."
ahirity,ì„œìš¸ ì¤‘ì‹¬ê°€ì— ìœ„ì¹˜í•œ ë‚´ì²œìœ¼ë¡œ ì €ë…ì‹ì‚¬ ì „í›„ë¡œ ì‚°ì±…í•˜ê¸° ì¢‹ì€ ê³³ì…ë‹ˆë‹¤. ëŒ€ì‹  ë¬¼ì´ ê¹¨ë—í•œ ê³³ì€ ì•„ë‹ˆë¯€ë¡œ êµ¬ê²½ë§Œ ì¶”ì²œë“œë¦½ë‹ˆë‹¤.,4,225,"Naechon, located in central Seoul, is a good place to take a walk before and after dinner. But the water is not clean, so I recommend you to look around."
daheey2017,"ê´‘í™”ë¬¸, ì„œìš¸ì‹œì²­, ë•ìˆ˜ê¶, ìƒˆì¢…ëŒ€ë¡œ ë“±ì— ê°ˆ ì¼ì´ ìˆë‹¤ë©´ ë“¤ë ¤ë³´ëŠ” ê²ƒë„ ë‚˜ì˜ì§€ ì•ŠìŠµë‹ˆë‹¤. ë”ìš´ ë‚  í•œë‚®ì—ëŠ” ë¬¼ë†€ì´í•˜ëŠ” ì–´ë¦°ì´ë“¤ êµ¬ê²½, ì €ë…ì—ëŠ” ë§¥ì£¼ í•œ ìº” í•˜ê¸°ì— ì¢‹ìŠµë‹ˆë‹¤. ì—°ë§ì´ ê°€ê¹Œì›Œì§€ë©´ ë“±ë¶ˆ ì¶•ì œê°€ ìˆì–´ì„œ í•´ê°€ ì§€ê³  ê°€ëŠ” ê²ƒì„ ì¶”ì²œí•©ë‹ˆë‹¤. ì²­ê³„ì²œ ìœ„ì— ë‹¤ì–‘í•œ ëª¨ì–‘ì˜ ë“±ë¶ˆì´ ë– ë‹¤ë‹ˆê³  ë§¤ë‹¬ë ¤ ìˆì–´ì„œ ë³¼ê±°ë¦¬ê°€ ë§ìŠµë‹ˆë‹¤.",3,225,"If you need to go to Gwanghwamun, Seoul City Hall, Deoksugung Palace, or Saejong-daero, it's not bad to stop by. It is good to see children playing in the water in the middle of the day on a hot day, and to have a can of beer in the evening. There is a lantern festival near the end of the year, so I recommend that the sun goes down. There are many things to see because various shapes of lanterns are floating and hanging over Cheonggyecheon Stream."
World Traveler,ë„ì‹¬ì— ìˆì–´ ì°¸ ì¢‹ìŒ. ê³ ê¸°ë„ ë§ì´ ì˜¬ë¼ì˜´. ì‚¬ëŒë“¤ì´ ë§ì´ ê±·ê³  ìš´ë™í•¨. ì‹œê°„ ìˆì„ë•Œ ê±¸ì–´ ë‹¤ë‹ˆê¸° ì¢‹ìŒ. ê·¸ëŸ¬ë‚˜ ì•½ê°„ ëƒ„ìƒˆê°€ ë‚¨...ã… ã… ,4,225,It's good to be in town. There's a lot of meat. People walk and exercise a lot. Good to walk around when you have time. But it smells a little...á…²á…²
Yooni,ë™ëŒ€ë¬¸ í‰í™”ì‹œì¥ ê·¸ë¦¬ê³  ì›ë‹¨ ê°€ê²Œ ì˜¤ë˜ëœ ìƒì ë“¤ê³¼ ì—°ê²°ëœ ì²­ê³„ì²œì€ ì§€ìƒì—ì„œ ì¡°ê¸ˆ ì•„ë˜ìª½ìœ¼ë¡œ ë‚´ë ¤ê°€ì„œ ì‚°ì±…í•˜ê¸° ì¢‹ë‹¤. ì–‘ë°©í–¥ìœ¼ë¡œ ê°€ìš´ë° ì²œì´ íë¥´ëŠ” êµ¬ì¡°ë¡œ ë§Œë“¤ì—ˆë‹¤. ë¬¼ì´ ìˆì–´ ê±·ëŠ”ë° ë”ìš´ë‚ ì”¨ì— ì‹œì›í•˜ê³  ì¢‹ë‹¤. ê°€ë” í•œêµ­ ì „í†µ ì¡°ëª…ì„ ì „ì‹œí•˜ê¸°ë„ í•´ì„œ ì™¸êµ­ì¸ì—ê²Œë„ ì¢‹ì€ ë³¼ê±°ë¦¬ë¥¼ ì œê³µí•œë‹¤,3,225,"Connected to Dongdaemun Peace Market and the old stores of the fabric store, Cheonggyecheon Stream is a good place to take a walk down the ground a little. It is made of a two-way flow of fabric. It is cool and good to walk in hot weather because of water. Sometimes, traditional Korean lights are displayed to provide good sights for foreigners."
Lucy L,ë°¤ì—ëŠ” ë°¤ë„ê¹¨ë¹„ì•¼ì‹œì¥ë„ ì—¬ë‹ˆê¹Œ ì‹œì¥ì—ì„œ ë¨¹ì„ ê±° ì‚¬ì„œ ëŒì•„ë‹¤ë‹ˆ ì¢‹ì•„ìš”. ğŸ‘ğŸ‘ ë§ì€ ê¸°ëŒ€ëŠ” ì•ˆí–ˆëŠ”ë° ìƒê°ë³´ë‹¤ ì˜ˆì˜ê³  ì¡°ìš©í•´ì„œ ì¢‹ì•˜ìŠµë‹ˆë‹¤!,5,225,"At night, the night market is open, so it's good to buy something to eat at the market. I didn't expect much, but I liked it because it was pretty and quiet!"
ì˜ˆìœì•„ì¤Œë§ˆ,ì˜ˆì „ì— ì²­ê³„ì²œ ë°‘ ì¤‘ê³ ë¬¼í’ˆ ìŒ“ì•„ íŒ”ë˜ê³³ì´ ìƒê°ë‚˜ë„¤ìš” ì´ë ‡ê²Œ ë³€í•˜ë‹¤ë‹ˆ ê·¸ë•Œë„ ë‚˜ë¦„ ì¬ë¯¸ìˆì—ˆì§€ë§Œ ì§€ê¸ˆì€ ì‹œì›í•˜ê³  êº ë—í•œ ì˜ˆìœ ì¥ì†Œë¡œ ë³€í–ˆë„¤ìš” ë¬¼ê³ ê¸°ë„ ìˆë”ë¼êµ¬ìš”,5,225,"It reminds me of a place that used to store used goods under Cheonggyecheon Stream. It was fun back then, but now it's a cool and clean place. There are fish."
lim,ì£¼ë³€ì— ì¹´í˜ë„ ë§ê³ . í•œì—¬ë¦„ì— ì˜¤ê¸°ì—” ë¥ì§€ë§Œ ì´ˆì—¬ë¦„ì—” ë°ì´íŠ¸í•˜ê¸° ì¢‹ì•„ìš”. ì„œìš¸ì—ì„œ ê±¸ìœ¼ë©´ì„œ ë°ì´íŠ¸í•˜ê¸°ì—” ì´ë§Œí•œ ê³³ì´ ì—†ì£ .,4,225,"There are many cafes around. It's hot to come in midsummer, but it's good to date in early summer. There's no place like this to walk and date in Seoul."
Young Choi,ì˜ˆì „ì— ê³ ê°€ë„ë¡œê°€ ì§€ë‚˜ê³  ì¡ìƒì¸ì´ ë“¤ë“ë˜ê³³ì— ë§‘ì€ ë¬¼ì´ íë¥´ê³  ë¬¼ê³ ê¸°ê°€ ì—¬ìœ ë¡­ê²Œ ë›°ë…¸ëŠ” í‰í™”ë¡œìš´ ë„ì‹¬ì˜ íœ´ì‹ì²˜ ì ì‹œ ë„íšŒì§€ë¡œ ë‚˜ì˜¨ê²ƒê°™ì€ í•œê°€ë¡œì›€ì„ ì¦ê¸¸ìˆ˜ìˆëŠ”ê³³,5,225,"A place where you can enjoy a peaceful urban resting place where clear water flows and fish run leisurely, where you can enjoy a leisurely atmosphere after passing overpasses and crowded with merchants."
ê¹€ë„ì˜,ê·¸ëƒ¥ ë”± ê¹”ë”í•˜ê³  ë°”ëŒ ì¬ëŸ¬ ë‚˜ì˜¤ê¸° ì¢‹ì€ê³³ì´ë‹¤. ì™¸êµ­ì¸ë“¤ì€ í•œë²ˆì¯¤ ì™€ì„œ ë°œ ë‹´ê¶ˆ ë³´ëŠ”ê²ƒë„ ì¢‹ì„ ë“¯ í•©ë‹ˆë‹¤. ë¬¼ë„ ê¹¨ë—í•˜ê³  ì˜ˆì©ë‹ˆë‹¤.,5,225,It's just a neat and nice place to come out for air. It would be nice for foreigners to come and dip their feet. The water is clean and pretty.
194ren,ë´„ë‚˜ë“¤ì´ ê°€ê¸°ì— ì¢‹ì€ ê³³ì´ë‹¤. ë¬¼ íë¥´ëŠ” ì†Œë¦¬ë¥¼ ë“¤ìœ¼ë©´ì„œ ê±·ë‹¤ë³´ë©´ ê¸°ë¶„ë„ ì¢‹ì•„ì§„ë‹¤. ë‚ ì”¨ ì¢‹ì€ ë‚  ë‚˜ê°€ê¸°ë¥¼ ì¶”ì²œí•©ë‹ˆë‹¤. ì²­ê³„ì²œ ì¢‹ì•„ìš”.,3,225,It's a good place to go for a spring outing. Walking while listening to the sound of water flowing makes me feel better. I recommend you to go out on a fine day. Cheonggyecheon is nice.
W.C. Seoul,"ì„œìš¸ ë„ì‹¬ ì†ì— ì²­ê³„ì²œ ë³µì¡í•œ ì„œìš¸ êµ¬ë„ì‹¬, ë§ì€ ì‚¬ëŒë“¤, ì²­ê³„ì²œì„ ë”°ë¼ì„œ ê±·ë‹¤ë³´ë©´ ì„œìš¸ì˜ ì˜›ë‚  ëª¨ìŠµ í˜„ëŒ€ì˜ ëª¨ìŠµì´ ì¡°í™” ëœ ë‹¤ì–‘í•œ ëª¨ìŠµì„ ë³¼ ìˆ˜ ìˆë‹¤",4,225,"If you walk along Cheonggyecheon Stream in downtown Seoul, you can see a variety of old and modern images of Seoul in harmony."
JIN,ë„ì‹¬ì† ì‘ì€ í•˜ì²œ ê³µì›ì´ì§€ë§Œ ê±·ê¸°ì— ì¢‹ë‹¤. ì´ê³³ì€ í¬ë¦¬ìŠ¤ë§ˆìŠ¤ë•Œ ë” ì•„ë¦„ë‹µë‹¤. ë¶ˆë¹›ì¶•ì œê°€ í•œì°½ì´ë¼ ì•„ì´ë“¤ë„ ì¢‹ì•„í•˜ë©° ì´ê³³ì—ì„œ ë‚˜ì™€ 'ì‹ ì„¸ê³„ë°±í™”ì ' ê±´ë¬¼ ì „ì²´ë¥¼ ë’¤ë®ëŠ” í¬ë¦¬ìŠ¤ë§ˆìŠ¤ ì¥ì‹ë˜í•œ ë³¼ê±°ë¦¬ë‹¤.,5,225,"Although it is a small river park in the city center, it is good for walking. This place is more beautiful at Christmas. As the light festival is in full swing, children like it, and Christmas decorations that come out of it and cover the entire ""Shinsegae Department Store"" building are also a sight to see."
337gabriel,"ë‚®ì— ë°©ë¬¸í•˜ì—¬ë„, ë°¤ì— ë°©ë¬¸í•˜ì—¬ë„ ê°ê¸° ë‹¤ë¥¸ ëŠë‚Œì„ ë°›ì„ ìˆ˜ ìˆëŠ” ê´€ê´‘ì†Œì´ì íœ´ì‹ì„ í•  ìˆ˜ ìˆëŠ” ìµœê³ ì˜ ì¥ì†Œì´ë‹¤. ê°€ì¡±ë“¤ê³¼ ì™€ë„ ì¢‹ê³ , ì—°ì¸ë¼ë¦¬ ì™€ë„ ì¢‹ì€ê³³ ì…ë‹ˆë‹¤.",5,225,It is a tourist attraction and the best place to relax during the day and at night. It's a good place to come with your family or lovers.
cheryl,"ì²­ê³„ì²œì€ ì‚¬ì‹œì‚¬ì²  ì•„ë¦„ë‹¤ì›€ì´ ë‹¤ë¥¸ ì¥ì†Œì…ë‹ˆë‹¤. íŠ¹íˆ ë´„ê³¼ ê°€ì„ì€ ì‚°ì±…í•˜ê¸° ë„ˆë¬´ë‚˜ ì¢‹ì€ ê³³ì…ë‹ˆë‹¤. ê°€ì¡±, ì¹œêµ¬, ì—°ì¸ ëˆ„êµ¬ì™€ ê±¸ì–´ë„ í–‰ë³µí•¨ì´ ë¬»ì–´ë‚˜ëŠ” ê³³ì…ë‹ˆë‹¤.",5,225,"Cheonggyecheon is a place with different beauty all year round. Especially, spring and fall are great places to take a walk. It's a place where happiness comes from walking with family, friends, and lovers."
