review,u_id,u_rate,p_id,review_en
"70분동안 힐링 저는 불꽃 크루즈를 탔습니다. 처음에는 별 기대없이 폭죽 몇번 터트려 주겠지 했는데, 생각보다 오래 터트려줬어요(약 10분) 크루즈 안에서 바이올린 (?) 연주 들으면서 한강 바람을 맞으니까 너무 즐거웠습니다. 멀미도 1도 안나요ㅎ",Lucy L,5,246,"Healing for 70 minutes. I rode a flame cruise. At first, I thought they would blow firecrackers for a few times without any expectations, but they did it longer than I thought (about 10 minutes). I enjoyed listening to the violin (?) on the cruise and being hit by the Han River wind. I don't get motion sickness at all."
한강디너크루즈 시간이 촉박해서 한강유람선을 타는데 힘들었지만 안내해준 자리가 2층 창가 자리라서 너무 좋았어요 서울 야경도 보면서 먹는 뷔폐음식과 맥주한잔의 여유로움이 느껴지는 아주 좋은 기회이었습니다,yong2lee,5,246,"It was hard to get on the Hangang River cruise ship because of the tight time at the Han River Dinner Cruise, but I was so happy that the place you guided me was by the window on the 2nd floor. It was a great opportunity to feel the relaxation of a cup of beer and the food that I ate while looking at the night view of Seoul."
"갈매기가 너무 많아요 평일 낮에 탔는데도 사람이 많고, 갈매기한테 먹이를 주려는 사람이 많아서 갈매기들이 엄청 몰려서 너무 무서웠어요 그외엔 괜찮았습니다",WINNY,3,246,"There are too many seagulls. I rode it during the daytime on weekdays, but there were a lot of people and people trying to feed the seagulls, so I was so scared of seagulls. Other than that, it was fine."
"강변 구경, 불꽃놀이! 한강 인근 구경하는거 너무 좋고 멋져요 평생 서울 살았지만 유람선 타고 보는거랑은 또 다르구요 특히 불꽃놀이 행사 볼때 최고~ 입니다! 바람이 세니까 옷 든든히 입고 타세요~",쏘옹쏭,5,246,"A river view, fireworks! It's so nice and cool to see around the Han River. I've lived in Seoul all my life, but it's different from riding a cruise ship. Especially, it's the best when watching fireworks! The wind is strong, so make sure you wear a lot of course."
한강 둘러보는데 제격인 이랜드크루즈 올만에 가족들과 서울나들이와서 여의도 한강공원에서 이랜드크루즈를 이용했습니다. 가격은 4인가족기준 5만원정도이며 매시각 정시에 운행하는데 주말에는 30분간격으로도 배가 있어요. 40분정도 운행하고 저녁에는 식사와 야경구경도 할수있는것도 있네요.,Handsome Andy,3,246,"Eland Cruise is perfect for looking around the Han River. After this year, I came to Seoul with my family and used Eland Cruise at Yeouido Hangang Park. The price is about 50,000 won for a family of four and it runs on time every hour, but there is a 30-minute boat on weekends. It runs for about 40 minutes, and you can eat and watch the night view in the evening."
"평범한 식사, 좋은 야경 서울살면서 이걸 탈 줄은 몰랐다. 몇 번 한강에서 봤을 때 가격이 너무 비싸다고 생각을 해서 내 돈 주고 가고 싶은 생각은 들지 않았다. 서울 투어 버스와 마찬가지로 회사 행사를 통해 경험하게 되었는데 그것과 반대로 서울 사람들도 충분히 즐길만한 거리가 있다고 생각이든다. 한강이 너무 넓어 한강 공원에서는 반대편 야경이 초라하게 보이지만 한강 한 가운데서 보는 야경은 색달랐다. 식사는 평범했기 때문에 평가하지 않겠다.",영준 송,4,246,"I didn't know I would ride this while living in Seoul with a normal meal and a good night view. When I saw it at Han River a few times, I thought it was too expensive, so I didn't want to pay for it. Like the Seoul tour bus, I experienced it through company events, and on the contrary, I think there is enough for Seoulites to enjoy. The Han River is so wide that the other side of the park looks shabby, but the night view from the middle of the Han River was different. I won't rate the meal because it was normal."
방문기 한강유람선을 탈 수 있는 곳입니다.한강 여의도 마포대교와 원효대교 사이에 있는 곳으로 63빌딩쪽에서도 접근이 가능합니다. 아름다운 여의도 산책로와 한강변을 크루즈로 둘러보는 것은 꽤나 즐거운 서울나들이입니다.,봉기 문,4,246,"This is the place where you can take the Han River cruise during the visit.It is located between Mapo Bridge and Wonhyo Bridge in Yeouido, Han River, and is accessible from the 63 Building. It is quite a pleasant Seoul outing to take a cruise around the beautiful Yeouido promenade and the Han River."
"가족 기념일~ 가족과 뭔가 특별한 추억을 만들고 싶어서 1개월전에 미리 예약을 했어요.창가에 앉고 싶으면 예약 순서대로,이니까 미리 예약 하셔야 합니다.음식과 서비스 음악까지,아주 좋았답니다.",Jongsoon J,4,246,"Family anniversary~ I made a reservation a month ago to make special memories with my family.If you want to sit by the window, it's in the order of reservation, so you have to make a reservation in advance.From food to service music, it was very good."
멋진 야경과 함께하는 디너 크루즈 1주년을 맞이해서 기념장소인 여의도 한강공원을 방문했습니다. 한강공원을 방문하기로 계획했기에 크루즈 자체는 염두에 두고 있었습니다. 저녁 시간 즈음에 방문할 예정이어서 배달 음식도 괜찮겠지만 유림선과 식사를 한번에 즐길 수 있는 디너 크루즈가 있다고 해서 다녀왔네요. 한정된 공간임에도 뷔페의 음식은 다양했고 꽤 맛있었습니다. 게다가 재즈 밴드가 연주해주는 라이브를 들으면서 멋진 한강 야경과 함께 하는 것은 참 즐거웠습니다. 선미 쪽 갑판에는 예쁜 하트 장식물도 있어서 커플 사진을 찍기에,Choi J,5,246,"To celebrate the 1st anniversary of Dinner Cruise with a wonderful night view, we visited Yeouido Hangang Park, a memorial site. I planned to visit the Han River Park, so the cruise itself was in mind. I'm going to visit around dinner time, so delivery food will be fine, but I heard there's a dinner cruise where you can enjoy your meal with Yurim Line at once. Even though it was a limited space, the food at the buffet was diverse and quite delicious. Moreover, listening to the live performance of a jazz band, I enjoyed the night view of the Han River. There's also a pretty heart ornament on the deck of the stern, so we can take a couple picture."
1주년 기념 이벤트 너무너무 만족스러웠고 즐거운 시간이었어요 굳이 창가자리 아니라도 좋아요 음식도 만족스러웠고 서비스도 좋았구요 서울 살면서도 처음 가본 곳인데 정말 즐거운 저녁이었습니더,Urizia J,5,246,The 1st anniversary event was very satisfying and I had a great time. It doesn't have to be a window seat. I was satisfied with the food and the service. It was my first time to visit this place even in Seoul. It was a very pleasant evening.
"한강유람선추천 서울의 멋진 야경을 한강의 유람선을타고 오랫만에 만끽하였는데 밤이라 날씨가 좀 쌀쌀하였다~ 추억의 장소,특별한 날의 이벤트로 딱인것같다",nayepp,4,246,"I enjoyed the beautiful night view of Seoul on a cruise ship of the Han River after a long time, but the weather was a bit chilly at night. It is perfect for a special day event, a place of memories."
"한강따라 멋진 서울 야경 구경, 한번쯤 타볼만한 크루즈! 강바람과 함께 아름다운 서울의 야경을 볼수 있었습니다. 다른 이동수단과는 차별화된 크루즈의 강점으로 좀더 흥미진진하게 한강을 느낄 수 있어 좋았습니다. 추운 날씨였지만, 꽤 만족스러운 투어였습니다.",NAMBONO,5,246,"A beautiful night view of Seoul along the Han River, a cruise worth a ride! I could see the beautiful night view of Seoul with the river breeze. It was good to feel the Han River more interesting because of the cruise's strength, which is different from other vehicles. It was cold weather, but it was a pretty satisfying tour."
"서울 시민들의 데이트 명소 친구랑 함께 타서 즐거웠음. 혼자는 좀 쓸쓸했을지도... 밤이 더 예뻤을 듯. 테이트를 한다면 밤을 추천. 가까이에 시장도 있어, 신선한 생선을 사다가 그 자리에서 회와 전골을 해먹었어요.",Amy0226,4,246,"It was fun riding with a friend of Seoul citizens' date attraction. Maybe I was a little lonely by myself... The night would have been prettier. If you're Tate, I recommend chestnuts. There is also a market nearby, so I bought fresh fish and ate raw fish and hot pot stew on the spot."
완전 예뻐~♡ 처음으로 한국에서 야간 유람선을 탔어요♡ 완---전 추웠지만 진짜 예뻤음~!♡ 물보라가 장난 아니었지만 박력 있었어요!!! 거기다 음악이 또 좋은 music 뿐이라 감동~♡♡ 다양한 나라의 분들이 있었어요! 평일인데 만원이었어요!! 또 가고 싶다~♡!,Aya144,5,246,"It's so pretty~ It's my first time on a night cruise in Korea. Wan---I was cold but really pretty~!! The blizzard was no joke, but it was powerful!!! In addition, music is only good music, so I'm touched~ There were people from various countries! It was full on weekdays!! I want to go again!"
"한 번 타면 충분 시간이 좀 비었길래 유람선을 타자는 아이디어가 떠올라, 여의도까지 지하철을 타고 가서 거기서 조금 걸어 선착장으로 향했습니다. 주위에는 단체객, 커플, 가족 단위가 많았고 혼자서 온 사람은 찾아볼 수 없었습니다. 대낮에 승선했습니다. 유람 자체는 썩 좋지도 나쁘지도 않았고, 강에서 빌딩을 보는 것 뿐이었습니다. 아무 변화도 없었기 때문에 후반에는 좀 지겨웠습니다. 강을 지나가는 바람이 조금 편안한 정도. 한 번 더 갈래? 라고 묻는다면 대답은 No네요.",SAM_2011_C,2,246,"Once I took a ride, I had the idea of taking a cruise ship, so I took the subway to Yeouido and walked a little to the dock. There were many group guests, couples, and family members around, and no one came alone. I boarded in broad daylight. The cruise itself was neither good nor bad, just looking at the buildings in the river. I was a little bored in the second half because there was no change. The degree to which the wind passing by the river is a little more comfortable. If you ask me if I want to go again, the answer is no."
"유람선 + 자전거 대여 = 0 여의도에서 승선했습니다. 한 시간 후의 유람선 티켓을 구입하고 그동안 근처에 있는 자전거를 대여해서 한강변의 자전거 도로를 달렸습니다. 솔직히 말씀드리면, 유람선은 그다지 감동적이지 않았지만 자전거와 병행하니 즐거움이 배가 되었습니다. 아이들이 탈 수 있는 보조 바퀴가 달린 자전거도 있습니다. 날씨 좋은 날에 바람이 불어서 유유하게 자전거를 타는 게 꽤 즐거웠습니다. 유람선 가격은 1인 1만8천원이었습니다. 노래와 춤 쇼가 있었지만 금방 실증이 났습니다. 쇼가 없는 유람선도 있다고 하는데",goagoa11,3,246,"Cruise ship + Bicycle rental = 0 I boarded from Yeouido. I bought a ticket for the cruise ship in an hour and rented a bike nearby and ran along the bike path along the Han River. To tell you the truth, the cruise ship was not very moving, but the pleasure of doing it with the bike doubled. There are also bicycles with auxiliary wheels for children to ride. The wind blew on a fine day, so I enjoyed riding my bike with ease. The price of the cruise ship was 18,000 won per person. There was a song and dance show, but I quickly became tired. There's a cruise ship without a show."
아름다워요☆ 해질 무렵에서 야경으로 바뀌는 시간대에 배를 탔습니다. 경치가 아무튼 너무 너무 아름다웠습니다.... ☆ 한강 남쪽으로는 서울 타워가 보이고 우리가 항상 관광했던 장소였던 생각에 감동! 유람선이라니….하고 생각하기 쉽겠지만 상상 외로 꽤 좋았습니다. 쇼핑이나 에스테도 좋지만 한국여행의 추억을 만들어 보면 어떨까요? 야경 크루즈는 특히 커플에게 추천합니다!,purun018,4,246,"Beautiful 워요 I got on a boat during the time when it changed from sunset to night view. The scenery was so beautiful anyway... ☆ To the south of the Han River, you can see the Seoul Tower and it was the place we always visited. A cruise ship...It's easy to think, but it was pretty good beyond my imagination. Shopping and Este are good, but why don't we make memories of our trip to Korea? Nightscape Cruise is especially recommended for couples!"
"큰 실망 직원은 무례했습니다! 그들이 우리를 전혀 원하지 않는 것처럼 우리는 매우 환영받지 못했습니다. 순항이 끝났을 때 보트에서 우리를 기다리고있는 3 명의 사람이 기다리고 있었다! 이것은 점심 크루즈가 아니며, 옆집에있는 식당에서 식사를합니다. 다시는!",star2450,1,246,"The big disappointment employee was rude! We are not very welcome as they do not want us at all. When the cruise was over, there were three people waiting for us on the boat! This is not a lunch cruise, and we eat at the restaurant next door. Again!"
"매우 전문적이고 안정적인 서비스. 처음에 나는 하루가 회색 이었기 때문에 더 번거로운 일 이었지만, 사람들이 전혀 없었고,이 활동을 위해 식당에서 우리가 가진 커피는 정말 빨랐습니다. 그러나 우리는 그렇게 도대체 할 일이 없었습니다. 우리 놀라게했다. 놀랍게도 타는 순간 (커피는 여전히 빨랐다) 더 정교 해졌다. 그러나 기내의 직원은 친절하고 즐거웠다. 우리는 즉시 위층으로 올라가서 멋진 사진을 찍었습니다 (우리가 당신과 공유하는 사진). 안전 절차 정보는 많지 않았지만 모두 선장이 매우 느리고 안정적으로 운전하면서 상당히",Culinary-Consultants,5,246,"Very professional and reliable service. At first, it was more cumbersome because the day was gray, but there were no people at all, and the coffee we had at the restaurant for this activity was really fast. But we had nothing to do. We surprised. Surprisingly, the moment of burning (the coffee was still fast) became more sophisticated. But the flight attendant was kind and pleasant. We immediately went upstairs and took a nice picture (a picture we shared with you). There wasn't much information on safety procedures, but all of them were very slow and stable when the captain was driving."
이 크루즈를 놓치지 마세요 강의 야경은 매우 장관입니다. 라이브 밴드는 크루즈 여행에서 엔터테인먼트를 제공합니다. 쾌적한!,Margaretllc,5,246,Don't miss this cruise. The night view of the river is very spectacular. Live bands offer entertainment on cruise tours. Comfortable!
한강 보트 크루즈 이것이 서울 방문을 끝내는 완벽한 방법이었습니다. 우리는 여의도 선착장으로 버스를 타고 홉을 타고 지하철로 돌아 왔습니다. 엘 랜드 크루즈 매표소에는 표지판이 명확하게 표시되어 있으며 티켓을 쉽게 구매하거나 사용할 수 있습니다. 뜨거운 음식과 맥주를 판매하는 슈퍼마켓이 있습니다. 화장실이 있습니다. 우리는 눈부신 밤 크루즈를 탔다. 서울은 밤에 멋지게 보인다. 안에 음악 쇼가 있습니다. 우리는 바람을 즐기기 위해 밖에 앉아있었습니다. 우리는 여의나루 역 (서울 지하철 5 호선)으로 약 15 분,Steve D,5,246,Han River Boat Cruise This was the perfect way to end your visit to Seoul. We took a bus to Yeouido dock and hop back to the subway. The El Land Cruise ticket office is clearly signposted and easy to purchase or use. There is a supermarket that sells hot food and beer. There is a restroom. We rode a cruise on a dazzling night. Seoul looks great at night. There is a music show inside. We were sitting outside to enjoy the wind. We're at Y 역inaru Station (Line 5 of Seoul Subway) for about 15 minutes.
기억에 남는 여행 우리는 엘란 크루즈를 통해 야간 투어 (뮤지컬)를 예약했습니다. 우리는 티켓을 확인하고 형식을 정하기 위해 한 시간 일찍 도착했습니다. 크루즈는 한 시간 정도 걸리지 만 한강에서 진행됩니다. 가이드는 없지만 전망을 즐길 수 있습니다. 강을 따라 도시를 한눈에 볼 수있는 화려한 크루즈입니다. 그들은 다리 중 하나에서 쇼가 끝날 때까지 독특한 분수대를 마련했습니다. 좋은 카메라를 가지고 사진을 찍으십시오. 그들은 음식과 음료를 제공합니다. 나는 그것을 추천합니다.,JackPC32,5,246,"A memorable trip We booked a night tour (musical) through Elan Cruise. We arrived an hour earlier to check the ticket and set the format. Cruise will be held at Han River in about an hour. There is no guide, but you can enjoy the view. It's a spectacular cruise that you can see the city at a glance along the river. They set up a unique fountain on one of the bridges until the end of the show. Take a picture with a good camera. They serve food and drinks. I recommend it."
"음악과 크루즈 놀랍게도이 크루즈에는 여러 유형의 서비스가 있습니다. 음악 크루즈, 불꽃 놀이 크루즈 등을 제공합니다. 매우 느리고 꾸준한 크루즈입니다. 크루즈의 하이라이트는 Feeding Seagulls입니다.",Ongbb,4,246,"Music and Cruise Amazingly, there are many types of services on this cruise. Music cruises, fireworks, etc. are provided. It's a very slow and steady cruise. The highlight of the cruise is Feeding Seagulls."
"펀 리버 크루즈 내 친구와 나는 저녁 불꽃 놀이 크루즈를 갔다. 나는 이것이 관광객들에게 인기가없는 것으로 놀랐습니다. 우리가 갔던 밤, 그것은 모든 지방 주민이었다. 영어를 할 줄 아는 스태프가 많지 않았으며 심지어 한국어도 무슨 일이 있었는지에 대한 설명이 많지 않았습니다. 기다렸다가 처음에는 먹지 마십시오. 당신은 어떤 순서로도 해고되지 않고 단지 모든 사람이 한 번에 올라갈 수있게합니다. 미친 듯이 서두르고 일부 ahjummas에 의해 밀리고 싶지 않다면 처음에는 올라 가지 마십시오. 많은 음식이",mk0712,4,246,"Fun River Cruise My friend and I went to the evening fireworks cruise. I was surprised that it was not popular with tourists. The night we went, it was all local residents. There weren't many staff who spoke English, and there weren't even many explanations about what happened in Korean. Wait and don't eat at first. You don't get fired in any order, you just let everyone go up at once. If you're in a frantic hurry and don't want to be pushed up by some ahjummas, don't go up at first. a lot of food"
다리에서 분수를 조심하십시오! 한강에서 크루즈를하면서 저녁 식사. 전체 여행은 약 2 시간이 걸립니다. 저녁 식사는 뷔페이지만 매우 훌륭하게 이루어지며 많은 음식이 있습니다. 남은 양이 많았 기 때문에 초기 미친 돌진에 참여할 필요가 없습니다. 생생한 음악이 있지만 방해가되지는 않지만 갑판에 올라 서울의 불빛을 보면서 대부분의 시간을 보냈습니다. 약 1 시간 후에 보트는 다리에 접근하고 승무원은 갑판에서 모든 사람을 비 웁니다. 조명 디스플레이의 일부로 다리에서 샘물이 흘러 나오는 분수대가 있기 때문입니다 (지시를 듣지 않은,MidlandsTraveller,4,246,"Watch your fountains on your legs! Dinner while cruising on the Han River. The whole trip takes about 2 hours. Dinner is a buffet, but it's very good and there's a lot of food. There was a lot left, so you don't have to participate in the initial crazy rush. I spent most of my time on the deck looking at the lights of Seoul, although there was lively music but it didn't bother me. After about an hour, the boat approaches the bridge and the crew bounces everyone off the deck. Because as part of the light display, there is a fountain running from the bridge."
멋진 야경 서울에서 가장 좋은 경험 중 하나입니다 밤에는이 크루즈를 사용하는 것이 좋습니다. 아름다운 다리와 야경이 훌륭합니다.,heyyowakeup,4,246,The beautiful night view is one of the best experiences in Seoul. We recommend using this cruise at night. The beautiful bridge and night view are great.
지루한 습한 날씨와 추운 날씨는 경험을 더욱 약화 시켰습니다. 올바른 위치로 안내 할 명확한 신호가 없었습니다. 그것은 지루한 경험이었다. 볼거리가별로 없습니다. 몇 곡을 연주 한 밴드는 평범했다. 장소는 거의 비어있었습니다.,ZMd,2,246,The boring humid weather and cold weather further weakened the experience. There was no clear signal to guide you to the correct location. It was a boring experience. There's not much to see. The band playing a few songs was mediocre. The place was almost empty.
이야기 크루즈는 갈매기로 좋은 항해를했다. 우리는 가장 저렴한 것을 골랐다. STORY CRUISE. 그리고 그건 괜찮 았어. 많이 쓰고 싶지 않을 때 좋습니다.  - 노인들에게는 할인의 흔적이 없습니다. 그러나 표 사무실에서 10 % 할인을 받았습니다.  - 스토리 크루즈는 주간에만 운행됩니다. 그래서 우리는 마지막 시간대 (17:00)에도 불구하고 일몰이나 밤의 서울을 볼 수 없었습니다.  - 승무원 가이드 한국어와 간단한 영어 / 중국어. 많은 중국어 말하기 승객이 있었다. 소수의 지방 주민과 극소수의 다른 민족과 더불어.  -,JHL,4,246,"Story Cruise made a good voyage with seagulls. We chose the cheapest one. STORY CRUISE. And that was fine. It's good when you don't want to use it a lot.  - There is no sign of discount for the elderly. However, we received a 10% discount from the ticket office.  - Story Cruise is only available during the day. So we couldn't see Seoul at sunset or at night despite the last hour (17:00).  - Crew guide in Korean and simple English / Chinese. There were many Chinese speaking passengers. with a small number of local residents and very few other peoples  -"
추운 겨울 저녁에 크루즈 여보세요; 한강 강에서 약 1 시간의 매우 쾌적한 크루즈 였고 해안에있는 서울의 중요한 건물을 멀리 바라 보았습니다. 우리는 라이브 음악을 가장 좋아했습니다. 나는 보행자와 자전거 모두를위한 선착장으로 이어지는 멋진 골목길에 깊은 인상을 받았다.,MargaretaRO,4,246,"On a cold winter evening, Cruise Hello; It was a very pleasant cruise for about an hour on the Han River and looked far away at an important building in Seoul on the coast. We liked live music the most. I was impressed by the wonderful alley leading to the marina for both pedestrians and bicycles."
"한국의 휴일 이랜드 한강 유람선은 광고 된 것과 똑같습니다. 서울을 발견하고 아름다운 경관을 즐기는 독특한 방법이었습니다. 여의도 독에서 출발하여 63 빌딩, N 서울 타워, 반포대 교, 곤항 열차, 잠실 올림픽 경기장 및 유명한 양화 대교를지나갑니다. 선상에서 우리는 라이브 밴드가 우리를 세레나데를 주면서 편안하게 앉아 편안히 쉴 수있게되어 우리의 관광 크루즈에 훌륭한 사운드 트랙을 제공했습니다. 우리는 한국의 유명한 레스토랑 체인 인 Ashley에서의 뷔페 식 저녁 식사 패키지를 구입했습니다. 뷔페에는",MrWarrenM,4,246,"The Korean holiday Eland Han River cruise ship is the same as the one advertised. It was a unique way to discover Seoul and enjoy the beautiful scenery. Departing from Yoido Dogg, we pass 63 Building, N Seoul Tower, Banpo Bridge, Gonhang Train, Jamsil Olympic Stadium, and Yanghwa Bridge. On board, we were able to sit back and relax as the live band gave us serenades, providing a great soundtrack for our tourist cruise. We bought a buffet dinner package at Ashley, a famous Korean restaurant chain. At the buffet,"
