review,u_id,u_rate,p_id,review_en
"불꽃 놀이가있는 크루즈 크루즈! 이 경험은 우리 표를 얻기 위해 어디에서 가야하는지 명확하지 않았던 것에 따라 조금 별났다 (보증인을 사용하는 것) 시작했다. 그러나 우리는 그것을 분류했다. 그리고 음식은 우리가 제공하는 선택의 톤과 함께 기대했던 것보다 매우 좋았다. 뷔페는 무서울 수 있지만 모든 것이 신선 해 보이고 필요에 따라 봉사하고 다시 채울 수있는 많은 요리사 / 승무원이있었습니다. 선착장에서 시작한 저녁 식사는 크루즈 파트로 출발했습니다. 라이브 엔터테인먼트가 있었는데 재미있었습니다. 음악가들은 군중, 특히 로빙",uostatechef,5,246,"Cruise with fireworks! This experience began a little odd (using guarantors) as it was not clear where to go to get our votes. But we sorted it out. And the food was much better than expected with the tone of choice we provided. The buffet may be scary, but there were many cooks / crew members who looked fresh and could serve and refill everything as needed. The dinner that started at the dock started as a cruise part. There was live entertainment and it was fun. Musicians are a crowd, especially roving."
사랑스러운 크루즈 우리는 Klook를 경유하여 순항을 예약했다. 그리고 그것은 실망시키지 않았다. 이것은 주로 연인을위한 것이지만 우리는 친구와 함께 있었고 크루즈는 밤에는 한강과 도시의 불빛을 잘 볼 수있었습니다.,Larissa D,5,246,"Lovely Cruise. We booked a cruise through Klook. And that didn't disappoint. This is mainly for lovers, but we were with friends and Cruise could see the lights of the Han River and the city at night."
"그럴만한 가치가있는 ... 부스에서 티켓을 구입하고 지하철 여의도 (보라색 선)로 갈 수 있습니다. . . 나는 저녁 식사를위한 것, 불꽃 놀이를 가진 더 긴 것 같은 다양한 가격이 있다고 생각한다. . . 나는 가격이 25 k won에서 시작한다고 생각한다. 약 $ 25",newyorkannie7,5,246,"It's worth it... You can buy a ticket from the booth and go to Yeouido (purple line). . . . . I think there are various prices for dinner, like longer ones with fireworks . . . I think the price starts at 25 kwon. about $25"
싸고 재미있는! 도시의 밤 풍경을 보는 훌륭한 방법. 이드는 선셋 투어를 추천하므로 반포 대교에서 태양을 내려다보고 저녁의 분수 쇼를 볼 수 있습니다.,vin L,4,246,"Cheap and funny! A great way to see the night view of the city. Eid recommends a sunset tour, so you can look down at the sun on Banpo Bridge and watch a fountain show of the evening."
"한강 페리 투어 이 연락선 여행은 꽤 흥미 있었다. 나는 한강 여행 순항을했다. 그리고 나는 그것이 여행의 완전한 길이이었을 정도로 그것이 좋은 40 또는 45 분이었다라고 생각한다. 나는 도시와 모든 다른 다리를보아야한다. 타는 것이 부드럽고 멋졌다. 그러나이 강은 확실히 할 일을해야합니다. 나는 많은 죽은 물고기가 주위에 뜨고있는 것을 보았다. 그러나 또한 그들이 물을 걱정하지 않거나, 그들이 그들의 강 하하를 돌보고 있는지에 관해 명확히하지 않고있는 약간의 사람 물 스키를 보았다. 어느 쪽의 방법이라도,",eugenia27,4,246,"The ferry tour of the Han River was quite interesting. I made a trip to the Han River. And I think it was such a good 40 or 45 minutes that it was the perfect length of the journey. I have to look at the city and all the other bridges. The ride was smooth and wonderful. But this river must do its job. I saw many dead fish floating around. But also saw some human water skis that they were not worried about water, or that they were not clear about whether they were taking care of their river descent. Either way,"
재미있는 여행 우리는 이것을 비즈니스 투어로하고 저녁 식사에 대해 이야기 할 수있었습니다. 순항에는 좋은 생일 파티뿐만 아니라 많은 생일 및 기념일 파티가있었습니다. 저녁 식사에는 선택의 여지가 많았고 처음 몇 분 동안 혼잡하여 다른 사람들이 시작하도록 권유했습니다. 무지개 다리는 모든 사람들이 그것을 보러 나가는 가장 큰 매력 인 것처럼 보였습니다.,LoveVirginia,4,246,"Fun trip We could do this on a business tour and talk about dinner. There were many birthday and anniversary parties as well as good birthday parties on the cruise. Dinner had a lot of choices, and the first few minutes were crowded and encouraged others to start. The rainbow bridge seemed to be the biggest attraction for everyone to go out to see it."
"한강에서의 아름다운 야경 40 분이 너무 짧습니다. 예약없이 티켓 카운터에서 전액을 지불했지만 온라인으로 구입할 때 10 % 할인 된 가격으로 구입할 수 있습니다. 우리는 한강에서 서울의 야경을 차가워서 차가운 바깥에서 갑판에 30 분을 보냈고, 지난 10 개의 미뉴에트는 라이브 재즈 음악으로 온기를 얻기 위해 본당으로 향했다.",sydney_park,4,246,"40 minutes of beautiful night view at Han River is too short. You paid the full price at the ticket counter without reservation, but you can buy it online at a 10% discount. We spent half an hour on deck outside cold as the night view of Seoul was cold in the Han River, and the last 10 minuet headed for the main hall to get warmth with live jazz music."
"놀라운 점심 크루즈 뷔페 It 한강 크루즈 동안 식사를 다른 경험을 좋은 음식 아름다운 전경. 음악은 멋진 크루즈 깨끗하고 유지비 잘 꾸며져 있습니다. 뷔페에, 뷔페 많은 훨씬 내가! 이는 가치가 1센트도. 편안한 2시간 식사를 위한 훌륭한 호텔입니다. 포트, 어떤 아름다운 장식이 너무 좋은 사진을 찍으세요. 실행하는 모든 팬 이 양사나이 실행되는 촬영한 장소 중 하나",ljhsquall,5,246,"Amazing lunch, cruise buffet, It Han River cruise. Other experiences are good. Beautiful view. Music is great cruise clean and well-decorated for maintenance. Buffet, buffet. Lots of me! It's worth a cent. It's a great hotel for a comfortable two-hour meal. Port, take a picture of some beautiful decorations that are so nice. One of the locations where all the fans running are running."
"할 수 있는 나이트 크루즈 크루즈는 꽤나 사건이 없는. 더 나은 것을 원한다면, 서울의 밤 크루즈 를 하는 도시의 불빛.",AnnaM,4,246,"The Night Cruise Cruise that you can do is quite caseless. If you want something better, the lights of a city on a night cruise in Seoul."
저녁에는 한강 크루즈 큰 그룹과 함께 가서. 충분한 자료를 사용하고 전체 위. 대부분의 사람들이 30분은 너무 짧은 크루즈 컬링의 조명이 꺼지기 전 마지막 5 분 후에 음료 고정된. 이 모든 과정은 매우 친절하고 직원들도 멀리 지우기 간. 배 이 기 때문에 이 인다의 이동하는 것을 알 수 있습니다. 할 수 있는 해변에 있는 식당에서. 아마 다시 방문할 것이 다 이 받지 않을 것입니다.,FreddDagg,3,246,"In the evening, I'll go with the big Han River cruise group. Use enough data and the entire stomach. Most people fix their drinks 30 minutes after the last five minutes before the lights in cruise curling go out. This whole process is very friendly and the staff is far away. Because of the length of the ship, we can see that the Inda is moving. In a restaurant on the beach where you can. Maybe all the things you need to visit again won't be accepted."
강을 따라 크루즈 여행 강을 따라 크루즈를 볼 수 있는 서울의 스카이 라인. 보트를 타고 이른 밤을 보냈습니다. 음악과 음식이 전체 여정,Rafael S,4,246,A cruise tour along the river Seoul's skyline where you can see the cruise along the river. I spent the early night by boat. the whole journey of music and food
"한강 유람선 - 큰 영양 크루즈 남편과 저는 10분 전에 도착한 터미널 하선. 우리가 예약한 20분 전에 도착 할 수 있는 사람이 필요한 하선 이, 은혜 가 되지 않지만 지하철. 그러나, 우리는 우리의 티켓을 받을 수 있도록 이 보트 크루즈. 늦게 도착 하기 때문에, 할 수 없는 자리. 좌석 아래층 객실 안에 있었는데, 그 위에는 좌석 위에 난간 을 따라 모든 덱크의. 서 있는 앞에 있는 작은 배는, 그리고 우리는 우리의 발을 쉴 수 있는 좌석 내부로 이동. 물 아래 다리 여행 했을 때, 그들은 모두 안으로 들어가 물었다.",nealstepp,4,246,"Han River Cruise Ship - Large Nutrition Cruise Husband and I arrived 10 minutes ago at Terminal Hail. We need someone who can arrive 20 minutes before we make a reservation, and the subway is not blessed. However, we have this boat cruise so that we can get our tickets. A seat that can't be taken, because it arrives late. It was in the room below the seat, and above it, along the railing on the seat, of every deck. The little boat in front of us standing, and we move our feet inside the seats where we can rest. When they traveled the bridge under the water, they all went inside and asked."
양쪽 다 좋았습니다. 여의도 에서 한강 유람선을 타고 19:30 버스가 다시 레인보우 브릿지. 크루즈 여행이 60mins. 페리 티켓 부스 에서 구입을 추천하는 대신 때문에 온라인 웹 사이트는 어떻게 환불 하지는 않을 경우 비가 오지 않을 때는 안에 앉아. 나는 운이 좋게도 비가 한 시간 전에 예약을 한 출발을 최고 전망을 즐길 수 있었습니다. 예약 및 도착 시간을 확인하기 전에 적어도 30mins 발항. 지하철을 타면 쉽게 사용할 수 있다. 사용할 수 있는 방법을: 내릴 역 3번 출구 (라인 5 여의나루역),msmcy19,5,246,"Both were good. The 19:30 bus ride from Yeouido to the Rainbow Bridge. Instead of recommending a cruise at the ferry ticket booth, the online website sits inside when it doesn't rain unless it's refundable. Luckily, I was able to enjoy the highest view from the start of Rain's booking an hour ago. Arrival at least 30 mins before checking the booking and arrival times. You can use it easily by subway. How to Use: Exit 3 of Station to Get Off (Line 5 Y역inaru Station"
"엔터테인먼트 나는 가치 있는 활동이 있어 쉴 수 있는 크루즈는 모든 조금 걷다 하루 종일 즐겁게 이 쇼는 보고 있습니다. 하지만, 라이브 밴드가 더 이상하게 생각한다. 다음에 다시 한다면, 나는 여전히 엿볼 수 있기 때문에 일몰을 보고 더 볼 수 있습니다.",Christina P,4,246,"The Cruise, who can rest because of its valuable activities, is enjoying the show all day long after walking a little. However, the live band thinks it's even more weird. If I do it again next time, I can still see it, so I can see more after sunset."
짧은 크루즈 여행의 작은 풍경 호텔 직원이 우리에게 가 70 분 리버 크루즈. 여자 분이라 티켓 부스도 큰 영양 70 크루즈. 우리는 아주 큰 배가 있어 좋았습니다. 매우 깨끗하고 좋았습니다. 하지만 다행스럽게도 보다 500배 갔을 때는 50 형편광판을. 이 아름다운 일들에 대해 물을 볼 수 있는 도시. 상단 및 하단 데크가 모두 폭파 음악 들. 다른 곡 역할들은 서로다른 각 스테이징될 수 있습니다. 하는 것은 매우 큰 소리로. 관련 내용은 없었어요. 보트를 타고 강을 올라가서 공원의 끝에 다음에 달팽이의 속도 다.,Vacati0nMania,2,246,"A hotel clerk for a short cruise goes to us. 70 minutes River Cruise. It's a woman, so the ticket booth is big. It's a 70 cruise. We were happy to have a very big ship. It was very clean and nice. But luckily, when it's 500 times higher than that, it's 50 times better. A city where you can see water about these beautiful things. Both top and bottom decks blow up music. Different song roles can be staged at different angles. to do something very loudly There was nothing to do with it. Take a boat up the river and at the end of the park, finish the snail's speed."
"좋은 리버 크루즈 서울에서 3월에 크루즈 선박을 반포대교 에 가고 싶었습니다. 3월에 그 unfortunatelly 작동하지 않습니다. 어쨌든 밤 크루즈 도 아주 아름다운. 추운 날씨에 밖에서 안쪽에 앉아 있는 경우가 있습니다. 2의 옵션이 밤 크루즈 뷔페 (매우 많이) 및 라이브 음악. 환상적인 음악을 하지 않은, 하지만 좋은 문화 체험. 기타 가 연주하는 뮤지션 들의 노래와 함께 노래 한국인이 다. 하하하",Polina P,4,246,"Good River Cruise Seoul wanted to go to Banpo Bridge on March. The unfortunatelly doesn't work in March. Anyway, the night cruise is very beautiful. There are times when you sit inside in cold weather. 2 options are night cruise buffet (very much) and live music. No fantastic music, but a good cultural experience. The song is sung by musicians who play the guitar and Korean. hahaha"
재미의 오후 좋은 경험이었습니다. 냉장 된 멋진 전망! 그 다음 해 선셋 크루즈. 제가 저녁 뷔페 유람선 이 있었지만 시간이 오후에 갈 수 있었습니다!,Ruan M,4,246,"An afternoon of fun was a good experience. Cool view refrigerated! Sunset Cruise the next year. I had a dinner buffet cruise ship, but the time could go in the afternoon!"
아름다운 강 크루즈 크루즈에서 즐기는 멋진 저녁과 밤의 한강 은 서울의 스카이라인 배경. 좋은 시간을 보낼 수 있습니다 실내가 너무 차가운 베란다에 휴양지!,Andrew L,5,246,The Han River at night and night are the background of Seoul's skyline. I can have a good time. A resort on a veranda that's too cold indoors!
"서울의 한강 유람선 은 조그마한 우리가 하지 않은 모든 좌석이, 되는 대로, 운이 좋게도 우리가 서 있는 멋진 전망. 좋은 저녁이었습니다. 본 여행에 관한 정보로 안내하는. 본 떠 있는 섬 haeahn h. 및 아키텍처, 성능 등 다양한 축제를 새로운 문화 센터, 전시, 약 5초 동안 모든 색상을 변경할 수 있는 둘러보았는데요. 많은 훌륭한 다리, 반포대교 분수 조명 물 뿐 이었거든요. 좋은 1.5 시간.",Squeekie,4,246,"Seoul's Han River cruise ship is a spectacular view of all the seats we haven't had, as far as we can go, and luckily we're standing. Good evening. guided by information on this journey We've toured a variety of festivals, including the island's haaehn h. and architecture and performance, to change all colors for about five seconds, including a new cultural center, exhibition and exhibition. There were only a lot of great bridges, water from the fountain at Banpo Bridge. Good 1.5 hours."
"근사한 저녁. 저희가 간 90분 긴 밤 크루즈 등이 포함되어 있는 물 / 빛의 쇼 중 하나를 브리지, fireworks. 우리는 맨 위로 멋진 경치가. 또한 성능을 20분에 가수, 모두가 보고 있는 듯 한 사람. 나는 나 자신을 바라보 하기가 거의, 노래는 잘 들릴 수 있습니다. 저는 이 아름다운 저녁이 매우 가치 있는 것은 크루즈 여행. 장엄한 광경 도, 모든 것이지만 아주 좋은 곳 같습니다. 매우 비싼 편이 아니라.",AZTraveller,4,246,"Nice evening. One of the water / light shows we went to, including a 90 minute long night cruise, bridge, fireworks. We're at the top with a nice view. Also, a singer who performs 20 minutes, and everyone seems to be watching. I can almost look at myself and sing well. The most valuable thing about this beautiful evening is a cruise. A magnificent view, everything, but I think it's a great place. Not very expensive."
"짧고 비싼 여행은 광고는 시간을 가지고, 그냥 오래된 것의 절반. 아닙니다 전혀 좋은 거래. 경우이지만, 바깥에 앉아, 볼륨 과방전의 이 그냥 참을.",harrie_v,2,246,"A short, expensive trip takes time, just half the old. No, it's a good deal. In the case, sit outside, you just put up with this over-discharge of volume."
"휴식 정말 즐거운 여행이었지만 두 번, 이 진짜 좋은 크루즈에서 휴식을 취하기 좋은 한강 야경 서울.",Grubbman21,5,246,"Rest It was a really enjoyable trip, but twice, Han River night view Seoul, which is good to relax on this really nice cruise."
"멋지진 않았지만 확인하는 가장 좋은 방법은 서울 안 비싼 이 보트를 타고 갔는데 잠실 지역, 리턴 90분 정도 걸린다. 나중에 보트가 있는 조용했고 진짜 그랬습니다. 아름다운 풍경이 전혀 없었지만 몇 다리가 잘 조명의 밤. 좋은 경험은 분들에겐 좋은 날씨에 서울",Lee horscraft1,4,246,"It wasn't cool, but the best way to check it out was to take this expensive boat inside Seoul, and it takes about 90 minutes to return to Jamsil area. Later, it was quiet with a boat. It was really like that. There was no beautiful scenery at all, but a few bridges were well lit night. Good experience is Seoul in good weather for you."
"좋은 휴식의 야간 크루즈 쉬면서 보기 좋은 한강의 밤. 뛰어난 음악을 쉬면서 자기가 30분 후에 나갈 수 있는 크루즈 여행, 우현 / 스턴 한 스냅은 밤에 여러 브리지를. 니스",Mathew59,5,246,A good night's rest. A good night at the Han River. A cruise tour where you can go out in 30 minutes while resting on outstanding music. A snap of starboard/stern is a bridge at night. Nice
"크리스마스 디너 크루즈 저는 디너 크루즈를 즐기는 여유로운 부두와 여의도 큰 영양 크루즈, 아주 멋진 저녁 식사와 엔터테인먼트. 약 2 시간이면 지속 한강 유람선 위에서 다리 조명. 점심에는 디너 크루즈 유람선 및 표시할 것인지에 따라 관광을 주간에 난 밤에 조명. 크리스마스 저녁 예약은 테이블에서 레스토랑 이태원 수지 는 심각하게 실망. 진짜 터키, 그냥 갖는민감한 터키 슬라이스와 바가지. 하는 쓸쓸한 크리스마스 디너는 크루즈의 결정이 있었음에도 불구하고 전혀 칠면조, 오리 만. 음식 종류가 매우 다양하고",Howard N,4,246,"Christmas Dinner Cruise. I enjoy dinner cruise with leisurely docks, big nutrition cruise in Yeouido, and wonderful dinner and entertainment. Bridge lighting on the Han River cruise ship lasts about 2 hours. Dinner cruise cruises for lunch and lights on the daytime night depending on whether to display. The reservation for Christmas dinner is a serious disappointment for the restaurant Itaewon Suzy at the table. Real Turkey. Just sensitive Turkish slices and barges. Despite Cruise's decision, the lonely Christmas dinner is nothing but turkey and duck. There are many different kinds of food."
"좋은 회사의 저녁 식사 호스팅 회사에서 저녁이 보트와 휴가 잘 했다. 비용에 대해, 회사에 다. 하는 음식은 맛있고 직원들은 저희가 필요한 것을. 비교적 짧은 동안, 것이 완벽하게 훌륭한 저녁과 시간의 연설 강행 해 선두. 사실 이곳은 친구 / 동료는 크루즈 여행에 대한, 우리는 대부분의 시간을 이야기하면서 서로의 회사.",ColinCas,4,246,"Dinner was well served on the boat and vacation at a good company's dinner hosting company. About the cost, to the company. The food is delicious and the staff members need. In a relatively short period of time, leading by pushing ahead with a perfectly fine evening and speech of time. In fact, this is where friends / colleagues talk about cruise tours, we talk about each other's company most of the time."
"오히려 실망 저는 한강 유람선 선착장 근처에서 여의나루 역. 해당 여행지에서 볼거리가 많았다. 그냥 서울 어셈브리 홀와 63 빌딩. 불행히도 심재로, 그래서 는 안됐다.",linbewie,3,246,"Rather, I was disappointed. Near the dock of the Han River cruise ship, Yeouido Station. There were many things to see at the destination. Just Seoul Assembry Hall and 63 Building. Unfortunately for the heart, so sorry."
"한강 최고의 디너 크루즈 이는 한강 유람선 은 하이라이트 중 하나는 나의 마지막 방문 서울. 여의도 선착장에서 보트 생태관 광을 통해 크루즈와 한강을> 2 이전에 우린 야경 서울 류탐상장치의 리모키에 다리 레인보우 브릿지 등의 아름다운 반포대교 분수. 뷔페 식사는 정말 호화로운 다양한 종류의 요리 또한 라이브 공연 및 선택할 수 있 오. 대체로, 좌, 가치 적극 추천한 때 서울에서.",Amethyst59,5,246,"One of the highlights of the Han River cruise is my last visit to Seoul. Before the 2nd ""Cruise and Han River"" at the Yeouido dock, we have a beautiful fountain of Banpo Bridge, including a bridge and rainbow bridge, on the remote of the Seoul Ryutamsang Unit. Buffet meals are really luxurious and various kinds of dishes can also be performed live and selected. In general, when left and value are highly recommended in Seoul."
"훌륭한 음식 우리가 한강 크루즈 전자 랜드 는 점심 뷔페. 음식은 정말 훌륭한; 시도하지 않는다 의 와플 쿠키 공극간의 하지만 원인 이었다. 직원들은 매우 친절했지만, 영어는 유창하지 않았지만. 그들도 한국 와서 거기에 앉아 안전 데모 하는 그의 구명 조끼 착용 오텐던트 이해 없이 단어 말했다. 염려하지 않아도 멀미 나 점점 뱃멀미 가 난 원인은 크루즈 진짜 부드럽게, 다. 전망도 좋지만 정말 뛰어난. 다시 돌아오고 싶지 않아요? 예, 하지만 음식.",DBrainMD,3,246,"Great food. We have a lunch buffet at Han River Cruise Electronic Land. The food was really great; it was the cause of the waffle cookie pore by not trying. The staff was very kind, but not fluent in English. They also spoke the word without understanding his life jacket-wearing attending, who came to Korea and sat there to demonstrate safety. I get seasick even though I don't have to worry about it. The reason why I get seasick is because cruise is so soft. The view is great, but it's really great. Don't you want to come back? Yes, but food."
