review,u_id,u_rate,p_id,review_en
문구제품을 저렴하게 문구 장난감을 도매가격에 저렴하게살수있어요 요즘인터넷쇼핑으로도편하게사지만 직접구경하면서사는재미가쏠쏠해요! 할로윈때 할로윈제품사러가기좋아요,mimi,4,265,"You can buy stationery toys at a reasonable price at a wholesale price. These days, I live conveniently through internet shopping, but it's fun to watch and live in person! I like to buy Halloween products on Halloween."
"나는 올드토이 콜렉터임 문구거리는 대체로 사람이 많아서 어깨빵 당하기 쉽다. 소문대로 특히나 국내산 장난감이 저렴하고 어린아이와 가족들, 젊은 키덜트까지 다양한 연령층이 어울려있는 잘 활성화되어 부활한 시장거리이다. 그런데 이 중 화가 나는 곳은 창신완구라고 ㅅㅂ 완전 대장이다. 올드토이 시세보다 비싸게 팔면서 그리고 안 팔아도 그렇게 먼지 속에 보관하면 원래 상태 안 좋아져서 저렴해지는데 관심갖는 손님들 다 도둑년 취급함.",별 권,3,265,"I'm an Old Toy collector. The stationery store is usually crowded and easy to shoulder. As it is rumored, it is a well-activated and revived market street where domestic toys are especially cheap and have a variety of age groups, including children, families, and young kidults. Among them, Changshin Wangu is the most angry one. All customers who are interested in selling more than Old Toy market prices and keeping it in the dust will make it cheaper because it's like a thief."
좋아요 학교앞 약간큰 문방구가 쭈르룩 있습니다 주차는 주변 공영주차장 이용하시면되구요 지하철보단 버스가 조금 덜 걷습니다 괜히 차끌고 오시면 낭패보기 딱좋은 길입니다 거의 일방통행길이며 골목도 좁아 한번 꼬이면 답답합니다 문구점은 다양성이 참 많습니다 학교앞 문방구 보다는 여러종류의 문구와 필기구등등이 있습니다,떠나볼래,3,265,"Okay. There's a big stationery store in front of the school. You can park at the nearby public parking lot. Buses walk a little less than subways. If you don't want to drive, it's a perfect way to see a disaster. It's almost a one-way street, and there's a narrow alley, so it's frustrating once it gets twisted. There is a lot of diversity in stationery stores. There are many kinds of stationery and writing equipment rather than stationery in front of the school."
"색상과 더 많은 색상! 문구를 선물 및 / 또는 기념품으로 구입하려면 여기에 와야합니다. 부조리에서 화려한에 이르기까지 다양한 색상의 귀엽고 귀여운 아이템을 선택할 수 있습니다. 이 골목에서 장난감 가게와 인형도 발견되었습니다. 캐릭터 아이템, 수집품 및 더 많은 것들을 정말 저렴한 가격으로 찾을 수 있습니다. 당신의 아이들이나 젊은 사람들 (더 오래된 귀여운 아이템 애호가들)도 여기서 사시는 것을 기꺼이받을 것입니다.",HidHermit,4,265,"Colors and More Colors! You must be here to purchase the phrase as a gift and / or souvenir. You can choose cute and cute items in various colors, from absurd to colorful. Toy shops and dolls were also found in this alley. You can find character items, collections, and more at a really low price. Your children and young people (older, cute item lovers) will also be glad to live here."
"그래 그래 주로 중국에서 만든 많은 고정 된 저장소,하지만 한국 영감을. 당신은 자유 시간이 있다면 이것을 확인할 수 있습니다.",Ryle Patrick N,3,265,"Yes, yes. Many fixed stores, mainly made in China, but Korean inspiration. You can check this if you have free time."
"아주 좋은 전통 음식은 아주 깨끗하고 매장 및 쇼핑몰에서 찾은 것보다 또한, 맛있는 대로 표시되면 티브이 보면 너무 ^^",Dadalism,4,265,"Very good traditional food is very clean and more delicious than found in stores and shopping malls, and if it is marked delicious, it is too much on TV ^^"
