u_id,review,u_rate,p_id,review_en
AHN按 A,화계사 절 앞에 계곡물이 흐르고 조용한 절이라 사색이 필요하시면 잠깐 들려서 걸어보세요. 공기도 좋고 옛느낌도 많이 남아 있는 곳이고 절에 올라가는 길도 주택가 골목이라 조용하고 사람 붐비는 느낌의 곳이 아니구요. 불교대학이 있으니 조용히 둘러보시면 좋습니다.,5,271,"The valley water flows in front of Hwagyesa Temple and it's a quiet temple, so if you need to think, stop by and walk. It's a place with a nice air and a lot of old vibes, and the way up to the temple is a residential alley, so it's not a quiet and crowded place. There is a Buddhist university, so you can look around quietly."
ladysome,무교이기는 하지만 가끔 머리를 비우고 싶을때 가는 곳입니다. 서울 북산한 아래에 있어 조용합니다. 탬플스테이도 가능합니다.,4,271,It's a place where I sometimes go when I want to empty my head. It's quiet because it's below the north mountain of Seoul. You can also do a tampel stay.
Euphem_Korea,"영국인 친구와 함께한 템플스테이. 템플스테이 진행자 분과 스님도 영어를 유창하게 하셔서 지내는데 불편함이 없었다. 불교에 호기심을 갖고 있다면 꼭 추천하고 싶다. 108배부터 참선, 산행 그리고 스님과의 다담까지 채식주의자라면 음식까지 만족할 수 있을 것이다.",5,271,"Templestay with an English friend. The temple stay host and the monk were also fluent in English, so there was no inconvenience in staying. If you are curious about Buddhism, I would recommend it. From 108 times to Chamsun, hiking, and Dadam with monks, vegetarians will be able to satisfy their food."
uncoeuraweigh,"근처에 살기 때문에 화계사를 몇 번 가봤습니다. 완만한 오르막길을 따라 25분 정도 걸으면 화계사가 나옵니다만, 가는 길에 마주치는 석상과 건축물들은 정말 감탄사가 절로 나옵니다. 화계사는 사진찍기에 아주 좋으니 카메라를 꼭 가져오세요. 종교활동을 하는 곳이니 무례한 행동을 삼가야 합니다. 조심해서 사진을 찍는다면 사람들의 눈살을 찌푸리게 할 일은 없을 겁니다. 사찰 내부를 돌아다니는 일은 처음에는 좀 당황스러울 수도 있습니다. 관광지가 아니라 실제 스님들이 수행하는 절이기 때문에 안내",4,271,"I've been to Hwagyesa a few times because I live nearby. If you walk along the gentle ascent for about 25 minutes, you will see Hwagye Temple, but the statues and buildings you encounter on the way are truly admired. Hwagye Temple is very good for taking pictures, so make sure to bring a camera. It's a place where we do religious activities, so we should refrain from being rude. Taking pictures carefully won't make people frown. Walking around inside the temple may be a bit embarrassing at first. Guide because it is a temple performed by actual monks, not by tourist sites."
Anna F,"내 그곳에서 벤처 했다. o 45분 정도의 데리고 152 버스, 마지막 정류장에서 걸어서 사용되는 정말 환상적인, 평화롭고. 관광, 인파가. . 주변 마법의.",5,271,"I had a venture there. o It's fantastic, peaceful, used on foot at the last stop, 152 bus with about 45 minutes. Tourism, crowds. The magic around."
Heritago,"이 역사적 사원은 건물과 많은 큰 편이었고요. It 지리산 공중에 위치하고 있어서 매우 깨끗하고, 도보 빛이 좋은 산책로. 프론트 가게에서 커피 질이(인스턴트 가족, 것 같았습니다.). 아마 한국 차 권장합니다. 한 통로에 Stream 나는 포장된 말할 것이다 짙은 숲이 있는 아주 좋습니다. 1시간 거닐며 매우 호쾌할 수 있다. (30분 이상, 편도 이용하지 않았습니다. ) 한화 호텔에 머물렀고, 0. 6마일 거리에 있어서 매우 편리합니다. 나머지 사원 안에 방은 정말 끔찍했어요.",4,271,"This historic temple was on the big side of the building. It is located in the air of Jirisan Mountain, so it is very clean and has good walking light. The quality of the coffee in the front shop (like an Instant family). Probably Korean cars are recommended. I'll say very well with a thick forest in one aisle I' forest in one aisle. An hour's walk can be very pleasant. (For more than 30 minutes, I didn't use a one-way ticket. I stayed at Hanwha Hotel, and it is very convenient because it is 0.6 miles away. The room in the rest of the temple was terrible."
JasChua,"위치는 지하철 역에서 걸어서 20 - 30min 수유점. 갈 때는 택시 대신. 이곳은 고요한, 많은 사람들 이다. 도착했을 때, 세션에 잠들곤 했어요. 고 있어서 상당히 이동을 주차장. 생각보다 훨씬 작았다. 동기화하려는 경우가 아니면 성가 중 하나 이상을 쳇발, 약 1시간 의 여행을 한 곳이고, 아직 방문 할 만하다.",5,271,"The location is a 20 to 30 min breastfeeding store on foot from the subway station. Instead of a taxi. This place is quiet, a lot of people. When I arrived, I used to fall asleep in a session. a parking lot for a great deal of traffic It was much smaller than I thought. Unless you're trying to synchronize, you've been to one or more of the songs for about an hour, and it's still worth visiting."
Thlynski,"깔끔한 장소는 서울을 방문하는 경우가. 나는 역에서 걸어 약 20분 정도 거리에 있는 수유점 4번 출구. 보행자 가길 을 가리키는 표지판, 그런데 길따라 차의 사인이 있습니다! 나는 가을에 잎 을 나무로 떨어진 후, 사원 수 있는 전망 착체 (특히 가장큰 건물) 옆에있는 언산.",4,271,"A clean place is a visit to Seoul. I walk from the station, about 20 minutes away from the breastfeeding station, Exit 4. A sign indicating a pedestrian path, but there's a car sign along the road! I fell leaves into a tree in the fall, and then an eunsan next to the temple-able prospecting frame (especially the largest building)."
