u_id,review,u_rate,p_id,review_en
endo s,"나는 2 월 2 일에 코스를 들었다. 한국에서 처음 이었지만 3 일 동안 만 머물렀으므로 가능한 한 문화와 지역 분위기에 가까워지고 싶었습니다. 이 요리 수업은 내 꿈을 실현 시켰습니다! 학급 앞에, Dave san은 우리를 시장 투어에 데려 갔다! 그는 매우 친절한 사람이었고 많은 것을 아주 명확하게 설명했습니다! 특히, 루나 신년이 오기 바로 전 이었으므로 현지 사람들로 가득 찬 시장과 매우 활기찬 분위기가 가득했습니다. 그것은 매우 잊을 수없는 일이었습니다! ! ! 그리고 우리가 요리 한",5,283,"I took a course on February 2nd. It was my first time in Korea, but I only stayed for 3 days, so I wanted to be as close to the culture and local atmosphere as possible. This cooking class made my dream come true! In front of the class, Dave san took us on a market tour! He was a very kind person and explained many things very clearly! Especially, just before Lunar New Year, there was a market full of local people and a very lively atmosphere. It was very unforgettable ! ! ! ! ! ! ! ! and that we cooked ,"
Steph C,Jihee는 전통 시장을 둘러보고 요리 수업 과정에서 분명한 지침을 제시하기에 너무나 친절하고 친절했습니다. 시간 관리가 완벽했습니다. 음식은 모든 사람의 취향에 어울리지 않지만 시도해 볼 가치가 있습니다! 맛있는 한국 음식의 비밀을 알고 싶다면 꼭 추천합니다!,5,283,"Jihee was so kind and kind to look around traditional markets and give clear instructions in the cooking class. Time management was perfect. Food doesn't suit everyone's taste, but it's worth a try! If you want to know the secret of delicious Korean food, I recommend it!"
Adam B,"로스 앤젤레스에는 많은 한국 식당과 모든 종류의 비즈니스가있는 ""K-Town""이라고 알려진 한국인이 거주하는 도시가 있습니다. 서울에서 온 누군가가 집에서 편안하게 지낼 것입니다. 수년에 걸쳐, 나는 자주 방문하고 항상 음식을 즐긴 레스토랑이 있었지만 그것을 요리하는 방법에 대해 호기심이 많았습니다. 이것은 서울에서 요리 수업을 찾는 동기였습니다. 나는 다른 수업을 연구했고, 나에게 이것은 가장 개인적인 것으로 보았다. 나는 요리 수업을 듣기로 결심하게되어 너무 기쁩니다. 나는 불고기, 계절의",5,283,"0Los Angeles has a Korean city known as KTown, which has many Korean restaurants and businesses of all kinds.Someone from Seoul will stay at home comfortably.Over the years, I have often visited and always enjoyed food, but I have been curious about how to cook it.This was my motivation to find a cooking class in Seoul.I studied other classes and saw this as the most personal thing to me.I'm so happy that I decided to take a cooking class.I'm the bulgogi season."
Luciana - from Brazil traveling around,나는 거기에서 그런 놀랄만한 저녁을 보내었다. 이 수업은 전통적인 현지 시장에서 시작됩니다. 그 후 우리는 편안한 요리 연구소에갑니다. 우리는 거의 7 가지 요리를 준비했고 어느 것이 더 완벽했는지 말할 수 없습니다. 아주 아주 좋은! 권장. 가야 해!,5,283,"I spent such a wonderful evening there. This class begins in the traditional local market. After that, we go to a comfortable cooking lab. We prepared almost seven dishes and can't say which was more perfect. Very, very, very! Recommended. We have to go!"
TM Lim,"시장 방문은 눈을 뜨게했다! 다양한 종류의 인삼, 배추, 전구의 마늘 등과 같은 한국 음식에 들어가는 모든 재료를 볼 수 있습니다. 나는 많은 한국 요리를 요리 책에서 집으로 가져 왔지만 실제로 수업에 참석하고 현지 전문가로부터 배울 때 결코 똑같지는 않습니다. 우리 주방장과 조교는 유창한 영어를 구사하며 우리가 배우는 요리에서 최상의 맛을 얻는 방법에 대한 조언을 주며 관대합니다. 나는 두 명의 십대 소녀들과 함께 수업에 참석했고 그들은 수업을 절대적으로 즐겼습니다. 그들은 가장 좋아하는 한국",5,283,"The mayor's visit opened his eyes! You can see all the ingredients in Korean food such as ginseng, cabbage, and garlic in light bulbs. I have brought many Korean dishes home from cooking books, but they are never the same when I actually attend classes and learn from local experts. Our chef and assistant speak fluent English and are generous, giving advice on how to get the best taste from the dishes we learn. I attended the class with two teenage girls and they absolutely enjoyed the class. Their favorite Korea"
Angela L,"나의 12 야와 나 자신은 전통 시장을 걷는 큰 경험을 가지고 있었고, 지방의 재료의 명소와 냄새를 알아 들었다. 전통적인 허브, 조미료, 향신료의 아름다운 향기가 우리와 같은 도시 거주자에게 완전히 새로운 경험을 선사했습니다. 전통 요리를 요리하기위한 재료가 소개되었고 우리는 절단, 자르고 찢기 시작했습니다. 모든 것이 잘 조직되고 체계적이었습니다. Ome Cooking Lab의 팀은 시연과 요리가 진행되는 동안 완벽한 팀으로 일했으며, 다른 요리를 씻고 준비하는 일이 뒤에서",5,283,"My twelve yards and myself had great experience walking in traditional markets, and I recognized the sights and smells of local ingredients. The beautiful scent of traditional herbs, condiments, and spices has given city dwellers like us a whole new experience. Ingredients for cooking traditional dishes were introduced and we started cutting, cutting, and tearing. Everything was well organized and organized. Ome Cooking Lab's team worked as a perfect team during the demonstration and cooking process, and washing and preparing other dishes was behind the scenes."
Andrew H,"우리는이 수업에서 즐거운 시간을 보냈습니다! 의학 지구와 시장의 둘레의 산보는 재미 있었고 유익했다. 그리고 Jihee와 Yuri는 매우 멋졌다 :) 우리는 화요일의 수업을했고, 우리가 만들었던 모든 음식을 좋아했다. 귀국 후 불고기, 잡채, 김치 팬케이크를 만들었습니다. 확실히이 수업을 추천합니다!",5,283,"We had a great time in this class! The walk around the medical district and market was fun and informative. And Jihee and Yuri were very nice:) We had Tuesday's class, and we liked all the food we made. I made bulgogi, japchae, and kimchi pancakes after returning home. I definitely recommend this class!"
Kimbap01,누구나이 종류의 요리를 방문해야합니다! 맛있는 요리법! 곧 다시 보길 바래! 감사! :),5,283,You should visit some kind of dish! Delicious recipes! Hope to see you again soon! Thank you! :)
Roving17806265979,정말이 수업이 마음에 듭니다. 멋진 시간 보내 주셔서 감사합니다. 한국에서 요리 교실을 찾고있는 누군가가이 코스를 시험해 볼 가치가 있다고 생각 했습니까? 재미 있니?   ??????????  ????????????? ????????????????????????????? ???????????????? ???????????????????????????? ?????????????????? ??????????! ????????????????????????? ??,5,283,I really like this class. Thank you for your wonderful time. Did anyone in Korea who is looking for a cooking class think this course is worth testing? Is it fun? ???????????????????????????????????????????????????????????????????????????????????????????????????????????????????????????????????????????????????????????????????????????????????????????????????????????????????????????????????????????????????????????????????????????????????????????????
anggitbestari,"언니가 서울을 방문했을 때 우리는 OME 요리 교실에 가입하려고 노력했고 최고의 시절을 보냈습니다! ! 역에 도착하면서, Minseon는 그녀의 따뜻한 미소로 당신을 환영 할 것이다. 어떻게 든 우리는 날이 얼마나 추웠다는 것을 잊게했다. 그녀는 우리가 이웃을 산책하는 데 걸릴 것입니다. 우리는 passerby가 그들의 따뜻한 맛좋은 차를 맛 보게하는 전통 차 찻집의 앞에 멈춰 섰다. OME 요리 실습실이 전통 시장 근처에 위치해 있기 때문에 우선 민선은 아름답고 활기찬 전통 시장을 보면서 지역",5,283,"When my sister visited Seoul, we tried to join the OME cooking class and had the best time! Arriving at the station, Minseon will welcome you with her warm smile. Somehow we forgot how cold the day was. She'll take us for a walk in the neighborhood. We stopped in front of a traditional tea shop where passerby tasted their warm delicious tea. Since the OME Cooking Lab is located near the traditional market, first of all, the popular election is to look at the beautiful and vibrant traditional market."
s95kim,전통 시장 투어에서부터 요리사로서의 재밌고 멋진 카리스마 넘치는 재능 넘치는 민선에 이르기까지 나는이 훌륭한 경험을 할 때마다 아주 좋아했습니다. ! 여행은 한국인뿐만 아니라 영어로 진행되기 때문에 한국을 여행하는 모든 사람들에게 매우 좋습니다. 멋진 사람들을 만나고 한국 요리 트릭과 팁을 배우고 싶어하는 한국인들에게도 좋습니다! ! :)) 멋진 하루! !,5,283,"From the traditional market tour to the fun and wonderful charismatic popular election as a chef, I loved every time I had this great experience. ! Traveling is very good not only for Koreans but also for everyone who travels to Korea because it is conducted in English. It is also good for Koreans who want to meet great people and learn Korean cooking tricks and tips!!) A great day!"
westcohan,처음부터 끝까지 환상적인 경험. 누구에게나 권할 것입니다. 우리 여행의 주요 사건 중의 1 개. 그들은 또한 즉석 생일 케이크와 특별한 선물로 제 아내의 생일을 특별하게했습니다. 친절하고 정통한 직원. 꼭 해봐!,5,283,Fantastic experience from start to finish. I'll recommend it to anyone. One of the main events of our trip. They also made my wife's birthday special with instant birthday cakes and special gifts. A kind and well-informed employee. Make sure you do it!
Alvaro F,"나는 이것을 매우 추천한다! 민선 팀은 매우 훌륭하고 요리하기에 아주 재미 있고 편안한 분위기를 조성합니다. 시장으로의 초기 여행은 훌륭한 출발입니다. 많은 이국적인 재료와 많은 것을 배우기. 우리가 요리했던 식사는 훌륭했다, 특히 비빔밥과 해산 식품 팬케이크. 채취 용 소스는 다음과 같은 이유로 사망했다.",5,283,"I highly recommend this! The elected team is very good and creates a very fun and comfortable atmosphere to cook. The initial trip to the market is a great start. Learning many exotic ingredients and many things. The meal we cooked was excellent, especially bibimbap and seafood pancakes. The sampling sauce died for the following reasons:"
GrandTour819519,"고전 유럽 요리 배경에서 오는이 수업은 절대적인 폭발이었습니다! 시장의 여행은 충격적이었다. 그리고 우리는 년 중의 가장 조용한 날 중의 1 개 동안 거기에 있었다. 그것이 정상적인 작동 템포 인 것처럼 상상하기 어렵습니다. , 그리고, 음식이 있었다! 그룹과의 요리는 재미 있고 유익했습니다. 김 선생님은 한국 음식에 대한 나의 아줌마 정신을 바꿔 놓은 일상 요리에 우리 모두를 소개해 주셨습니다. 맛있는 Sooo! 잘 했어! !",5,283,"This class from the background of classical European cooking was an absolute explosion! The mayor's trip was shocking. And we were there for one of the quietest days of the year. It is hard to imagine that it is a normal working tempo, and there was food! Cooking with the group was fun and informative. Mr. Kim introduced us all to everyday dishes that changed my aunt's mind about Korean food. Delicious Soooo! Good job! !"
Agathe D,OME 팀과 함께한 좋은 순간. 음식도 훌륭했고 요리 수업도 재미있었습니다.) 나는 추천한다.,5,283,A good moment with the OME team. The food was great and the cooking class was fun.) I recommend.
JoyfulTraveler7,"우리는 지역 시장의 쇼핑 투어로 요리 교실을 시작했습니다. Dave는 우리 가이드이었다. 그리고 그는 멋졌다! 그는 우리를 거대한 시장으로 데려 갔고, 그들이 무엇인지, 요리 나 약에 어떻게 사용되는지 등을 설명하면서 다양한 관심 항목을 지적했습니다. 그는 친절하고 유익하며 매우 재미있었습니다. 시장은 매우 매혹적이었고 흥미 롭습니다! 놓치지 마세요! 필요한 재료를 구입 한 후 주방장 인 민선 (Minseon)을 만났습니다. 우리는 손을 씻고 앞치마를 입은 후 민선 (그리고 데이브가",5,283,"We started the cooking class with a local market shopping tour. Dave was our guide. And he was wonderful! He took us to a huge market and pointed out a variety of interests, explaining what they were, how they were used in cooking and medicine. He was kind, informative, and very funny. The market was very fascinating and interesting! Don't miss it! After purchasing the necessary ingredients, I met Minseon, the chef. We washed our hands, put on an apron, and then we elected by popular vote."
Delia_lam,"요리 클래스를 조인 정말 행복했습니다. Dave 만났고 시장 가지고 우리를 흥미로운 재료를 보였다. 예쁜 assistant 매우 그 곳에 있는 늦게 친숙한 않았습니다. 다른 3참가자 기다려야 친절했다. 교사 Minseon 매우 재료와 준비 방법을 설명하는 환자. 우리는 요리 경험을 했다. 우리는 준비한 음식을 달걀요리, 정말 좋은 경험이었습니다. 확실히 한국 요리 배우기 분들께 추천합니다. 행복한 싱가포르.",5,283,I was really happy to join the cooking class. I met Dave and showed us interesting ingredients with the market. Pretty astant very late was not familiar there. It was kind to wait for the other 3 participants. Teacher Minseon A patient who explains very material and preparation methods. We had a cooking experience. It was a great experience for us to cook eggs. I definitely recommend it to those who learn Korean cuisine. Happy Singapore.
vivianm254,"여러 한국 음식을 요리 - 기본 생각보다 더 쉽습니다! 이 집에서 지금 시도하십시오. 시작 친절하고 유익한, 시원한 음료 및 팬(38°날씨가 시작! ) 시장에서 멋진 한국의 독특한 음식에 대한 흥미로운 사실을 발견하시고 산책. 캐주얼한 요리 클래스 있지만, 매우 효율적이고 이해하기 쉽습니다. 아주 좋은 시간을 보냈고 모두에게 추천합니다.",5,283,"Cooking multiple Korean foods - it's easier than you think! Try it now at this house. Start Kind and informative, cool drinks and fans (38°C) start! ) Take a walk after discovering interesting facts about Korea's unique food in the market. There is a casual cooking class, but it is very efficient and easy to understand. I had a great time and I recommend it to everyone."
wingyannice,이 호텔은 저에게 요리 클래스 참가를 위해 처음으로. 한국 음식을 및 한국 문화에 대해 더 많은 것을 배울 수 있습니다. 나는 앞으로 참여 다시 학습.,5,283,This hotel is my first time to participate in a cooking class. You can learn more about Korean food and Korean culture. I will participate and re-learn.
Rui987,나는 아주 따뜻한 받았습니다. 다윗과 Yunji 모두 너무 달았어요. 이 재미있는 코스는 모든 연령층의 사람들에게 적합한 곳입니다.,5,283,I received very warm. Both David and Yunji were too sweet. This fun course is suitable for people of all ages.
Andrea A,"이 클래스는 모든 것이 훌륭했습니다. Minseon 및 유리 아름답고 아주 편안하고 즐겁게 만들어 주었습니다. 아주 흥미로운 시장 방문, 멋진 만난 준비한 맛있는 음식을 먹고, 다른 방법으로 한국 문화를 배우고. 이 곳에서의 경험을 모두에게 추천합니다! !",5,283,"Everything was great in this class. Minseon and Yuri are beautiful and very comfortable and enjoyable. Visit a very interesting market, eat delicious food we prepared, and learn about Korean culture in other ways. I recommend everyone to experience here! !"
Stephen Y,"조리 클래스의 참가했다, 이곳은 제가 참석한 최고의 요리 교실. 주방장이 너무 친절합니다",5,283,"I participated in cooking class, this is the best cooking class I've ever attended. The chef is too kind."
Norman b,"아주 재미난 클래스, 가치가 시간과 한국 사랑을 경우 한국 문화와 음식을 합니다. 그들의 코스 먹어보지 망설이지 마세요. 노르만 S. - La",5,283,"In case of a very interesting class, value, time, and love for Korea, we do Korean culture and food. Don't hesitate to try their course. Norman S. - La"
현주 이,"지난주에 거기에 Visisted 친구와 함께! 우리는 우리가 큰 Dinnder. 또한 제 친구가 이 쇼핑여행이었습니다.! 서울에서 가장 큰 식자재 시장. 그리고 시장은 매우 친절했어요. 많은 한국 식자재 현지 음식 및 보았습니다. 우리는 살아 서울 느꼈습니다. 스승은 아주 전문적이고 그녀는 내가 알고 싶었던 한국 음식 모든 이야기를 했습니다. 서울 충분한 시간이 없다면, 하루 관광을 강력히 추천한다. 친구랑 같이 갔었는데 매우 만족했습니다. 시장이 정말 커서 깜짝 놀랐습니다. 이렇게 강변의",5,283,"With a Visisted friend there last week! We are the big Dinder. Also, my friend was on this shopping trip! The largest food and ingredients market in Seoul. And the mayor was very kind. I saw a lot of local food for Korean food ingredients. We felt Seoul alive. My teacher is very professional and she told me everything about Korean food that I wanted to know. If you don't have enough time in Seoul, I strongly recommend you to take a day trip. I went there with my friend and I was very satisfied. I was surprised at how big the market is. so riverside"
tweetypooh87,"서울에서 Yangmyeong 시장 및 경동 약령시장 전통 시장 두 Instructress 함께 방문했습니다. 즐거운 도보 관광, 우리는 많은 흥미로운 현지 장면이 캡처됩니다. 우리는 몇 가지 요리를 먹었는데, 관리 주로 쉽게 파전도 있어요 등과 같은 조리된 요리법을(파), 삼계탕(인삼 치킨 수프) 그리고 잡채(볶음 고구마 밀가루 국수). 좋은 결합을 경험.",5,283,"I visited Yangmyoung Market and two traditional markets in Kyungdong Yakryeong Market together in Seoul. A pleasant walking tour, we have many interesting local scenes captured. We've had a few dishes, mostly green onion pancakes. Cooked recipes such as back (pa), samgyetang (sam chicken soup), and japchae (fried sweet potato flour noodles). Experience a good combination."
Mark A,"우리는 그것이 판매하는 대한 자세한 시장의 훌륭한 미니 투어 시작된, 우리의 재료를 일부 수집! 요리 경험을 재미있었다. . 우리는 우리 선생님은 우리가 집으로 무엇을 팁 데모 및 또한 동안 익힌. 강력 추천합니다. 우리는 Viator 예약했습니다. 호스트는 Minseon, Hejeong, Yunji 너무 친절했고요.",5,283,"We've collected some of our ingredients, starting with a great mini-tour in the detailed market for which it sells! The cooking experience was interesting. We know that our teacher has something we've learned at home, something we tip demo and also something we've learned during. I highly recommend it. We made a reservation for Viator. The hosts were Minseon, Hejeong, and Yunji."
Denise F,"Minseon 즐거운 요리 경험. 우리는 몇 가지 재료를 사서 로컬 시장 투어를 시작했다. '요리 실습 다시 5요리를 향했다. (비빔밥, 콩 수프, 잡채, 스프라우트, 김치 샐러드) 아주 홈 스타일의 요리 경험. Minseon 좋은 경험 요리사와 음식과 요리에 대해 열정을 가지고 있습니다. 그녀는 모든 한국 음식과 재료를 대한 질문에. 우리는 식사를 클래스 함께 끝났다. 꼭 잊지 못할 경험. 한국 음식을 요리하는 방법을 배우고 싶은 분에게 강력 추천합니다.",5,283,"Minseon's delightful cooking experience. We bought some materials and started our local market tour. 'I went back to the cooking practice. (bibimbap, bean soup, japchae, sprout, kimchi salad) A very home-style cooking experience. Minseon has good experience and passion for food and cooking. She asked about all the Korean food and ingredients. We finished our meal together in class. an unforgettable experience I strongly recommend it to anyone who wants to learn how to cook Korean food."
Chris A,"서울 여행을 한다면 이 클래스! 음식들은 아주 맛있고, Minseon의 지침을(여러 언어로! ) 클래스 가족 같은 개인. 전세계의 동료 친구들이 작업 준비 (무엇보다도) 먹고, 수많은 요리 및 기술을 다시 집으로. 제가 서울에서 최고의 경험이었어요!",5,283,"If you travel to Seoul, this class! The food is very delicious, and Minseon's instructions (in many languages!) are individuals like class families. Fellow friends from all over the world eat their work preparation (more than anything) and return home a great deal of cooking and skill. I was the best experience in Seoul!"
Zerrin K,만약 당신이 독특한 한국 음식 이 투어를 추천합니다! 우리는 흥미로운 음식과 전에는 절대 시도하지 않았을 것을 정말 즐거웠어요. 저희 친절하고 지식이 풍부한.,5,283,"If you are unique Korean food, I recommend this tour! We really enjoyed interesting food and what we never tried before. We are kind and knowledgeable."
kdc01419,아주 좋은 시간! ! 나는 항상 한식이 알고 싶었다. Minseon 만났습니다. 그녀는 매우 한국 음식 지식이 한국 음식에 대해 많은 팁을. 그래서 저는 정말 많이 배웠습니다. 또한 한국 시장 투어를 매우 훌륭합니다. 신선하고 다양한 종류의 재료를. 그래서 나는 재료를 차이를 볼 수 있습니다. 조리 기회를 주셔서 감사합니다! !,5,283,"Very good time! I always wanted to know Korean food. I met Minseon. She has a lot of tips on Korean food. So I learned a lot. Also, the Korean market tour is very good. Fresh and various kinds of ingredients. So I can see the difference in materials. Thank you for the opportunity to cook!"
Katrien V,제 여동생과 저는 한국 음식을 사랑합니다! 우리는 정말 즐거운 시간을 요리 클래스 많이 en 배웠습니다. 한국 음식 메뉴에 있는 꼭 집에서 지금! 이 클래스는 감사합니다,5,283,My sister and I love Korean food! We learned a lot of cooking classes during a really fun time. Make sure to stay at home on the Korean food menu now! Thank you for this class.
Sebastien C,"다음 이 요리 도쿄에서의 데코 경험 좋았습니다. 이미 한국 요리 기본적인, 나는 중질유 초보자를 위한 훌륭한, 정말 요리 흥미로운 유용한 정보를 얻을 수 있습니다 말할 수 있습니다. MinSon 및 애슬리 정말 모든 질문에, 귀중한 정보를 제공합니다. 따뜻하게 이 연구는 추천합니다",5,283,"Next, I liked the decoration experience in Tokyo. Already Korean cooking basics, I can get great, really interesting, useful information for beginners of heavy oil. I can say it. MinSon and Ashley really give valuable information to every question. Warmly, I recommend this study."
Cora808,"좋은 여자 현지 음식 대한 열정을 공유하고 있습니다. 약초 뿌리 t(의학) 및 다채로운 채소, 전형적인 음식 시장의 처음 걸어. 우리가 서로 다른 요리법을 쭉 배워 결과를 맛은 아주 작은 스튜디오 도착하면 놀라워요! ! 환상적인 경험이었습니다. 가는 여자 계속;)",5,283,"We share a passion for good local food. herbal root t(medical)and colorful vegetables,the first walk in the typical food market. It's amazing when we learn different recipes and taste the results in a very small studio! It was a fantastic experience. Continuing on with the woman going;)"
