u_id,review,u_rate,p_id,review_en
arjj,먼저 다녀온 친구 추천으로 함께하게 되었습니다. 그냥 누가 해준 한식을 먹어도 좋았겠지만 또다른 여행객들과 함께 장을 보고 요리를 한다는게 익숙하면서도 새삼스럽게 느껴졌습니다. 그 기분이 좋아 리뷰를 남기지 않을 수 없었습니다!! 한식의 멋과 한국의 멋을 조화롭게 만들어낸 오미에서의 시간.. 너무 좋았습니다! 제가 갔던 날 만들었던 음식인데 보기만 해도 싱싱하고 맛있어 보이지 않나요:),5,283,"I am here with my friend who came back first. It would have been nice to eat Korean food made by someone else, but it felt new and familiar to shop and cook with other tourists. I was so happy that I couldn't help but leave a review!! Time in Omie, where Korean food and Korean style are harmonized. It was great! Doesn't it look fresh and delicious just by looking at it?)"
Seunghun M,한국 놀러온 해외친구들이랑 잼게 다녀왔습니다 ㅋ 장볼때 살짝 더웠지만 전통시장구경 좋아해서 담날 다른시장 또 데려가줬어요 ㅋㅋㅋㅋㅋㅋㅋㅋㅋㅋ 김치찌개랑 파전도 만들고 잡채는 저도 이번기회에 제대로 배웠습니다 ㅋㅋㅋ제가 마지막에 더 신나서 친구들 당황ㅋㅋㅋㅋㅋ제가 젤 신남 과일화채 만들때 재료보고 읭?하던 친구들이 먹고 놀래서 감탄연발ㅋㅋㅋㅋㅋㅋㅋㅋ잼썼습니다,5,283,"I had a great time with my friends from abroad who came to Korea. It was a little hot when I went grocery shopping, but I liked to see traditional markets, so I took him to another market to visit. lol lol lol lol lol I made kimchi stew and green onion pancake and I learned japchae properly. LOL When I was more excited at the end, my friends were flustered. LOL. When I made the most exciting fruit punch, did you see the ingredients?My friends were surprised after eating it, so I wrote, ""Amazed"" and ""fun""."
정식 최,외국인 친구랑 같이 방문했었는데 여러가지 한식을 이렇게 한번에 다 먹을 수 있었던 점이 괜찮았습니다. 아침에 8명이 함께 한다고 해서 정신없을 줄 알았는데 오히려 다같이 만드니까 더 다양하게 할 수 있었던 것 같습니다! 친구가 다음에 또 오고싶다고 했습니다. ㅎㅎ 친구가 한국에 오면 또 가겠습니다!,5,283,"I visited with a foreign friend and it was good that I could eat all kinds of Korean food at once. I thought it would be hectic to have 8 members in the morning, but I think we were able to do more variety because we made it together! My friend said he wants to come again next time. I will go again when my friend comes to Korea!"
Hong M,깨끗하고 예쁜 공간에서 한식을 배울 수 있어서 좋았어요. 같이 간 외국인 친구들도 좋아했고 다양한 국가에서 온 사람들이 함께 하는 재미가 있었습니다! 서울에 이렇기 큰 전통시장이 있는줄 몰랐었어서 시장 투어도 인상적이었습니다!,5,283,"It was nice to learn Korean food in a clean and pretty place. I liked the foreign friends I went with, and it was fun for people from various countries to join me! I didn't know there was such a big traditional market in Seoul, so the market tour was also impressive!"
ccico00,외국 바이어를 모시고 갔는데 한식을 접할 수 있고 한국 문화도 보여줄 수 있어서 만족도가 높았습니다. 선생님도 친절하고 스탭들도 친절했습니다. 개인적 알고 있는 외국인 친구들에게 소개하고 싶은 투어였습니당 ㅎㅎ,5,283,"I took a foreign buyer with me, and I was very satisfied because I could experience Korean food and show Korean culture. The teacher was kind and the staff was kind. It was a tour that I wanted to introduce to my foreign friends."
혜진 이,"외국인 친구들에게 좋은 추억을 선물하려고 방문했는데 오히려 제가 더 신났었네요ㅎㅎ 전통시장을 보여주는 것만으로도 친구들이 신기해 했는데, 오미에서 파전이랑 삼계탕을 같이 요리해 먹으면서 더욱더 즐거워해서 넘 뿌듯했어요! 담에 또 다른친구들과 놀러갈게요:-)",5,283,"I visited to give good memories to my foreign friends, but I was more excited.Haha My friends were amazed just to show the traditional market, but I was so proud that they enjoyed cooking pajeon and samgyetang together in Omi! I'll go play with other friends next time:-)"
바짜 라,"요리를 해보고 싶어하던 외국인 친구여서 같이 방문했었는데 한국인이 참여 해도 생각보다 재미있었습니다. (다양한 국가의 사람들과 함께 해서 좋았음) 한식에 대한 여러 지식들을 알 수 있었고, 이른 저녁을 배부르게 먹고 난 뒤라서 저녁을 따로 먹지 않아도 되서 좋았습니다.",5,283,"I was a foreign friend who wanted to cook, so I visited with him. It was more fun than I thought. I could learn a lot about Korean food (good to be with people from various countries), and it was good because I didn't have to eat dinner separately after having a full early dinner."
Soohan L,아이디어부터 정말 참신했구요. 평소에 한식보다는 양식 일식 중식을 즐겨 먹었는데 이제 바뀔것 같네요. 외국인친구들과 함께 갔엇는데 이보다 좋은 체험이 없는 것 같아요. 위치도 서울에 있어 정말 좋았어요. 다음에 또 갈게요 ~~,5,283,"The idea was very fresh. I used to enjoy Western Japanese and Chinese food rather than Korean food, but I think it will change now. I went with my foreign friends, but I don't think there's a better experience than this. It was really nice to have a location in Seoul. I'll come back next time. ~~"
자양이,한식에 대해 어렵게만 생각했는데 알아듣기 쉬운 설명과 저같은 초보들을 위한 맞춤강의로 더욱 유익한 시간 이었습니다. 무엇보다 깔끔하고 신선한 식자재로 만든 음식이라 좋았습니다~!!,5,283,"I thought about Korean food only hard, but it was a more useful time with easy explanations and customized lectures for beginners like me. Above all, I liked it because it was made of clean and fresh ingredients."
aran921013,"시장투어부터 재료손질, 음식 만들기, 먹기까지 지루할틈 없이 너무나도 재밋는 수업이였습니다! 영어로 수업이 진행돼 외국인 친구들도 무리없이 따라할 수 있고요. 수업공간도 아기자기하고 다른 외국인 친구와도 함께 해서 더욱 뜻깊은 시간이였습니다. 저는 중국인 친구를 위해 클래스를 예약했는데 친구도 너무 만족하고 저도 너무 만족스러웠습니다. 강력추천해요!",5,283,"From the market tour to preparing ingredients, cooking, and eating, it was a very fun class! The class is held in English, so foreign friends can follow along easily. The class space was cute and it was more meaningful because I was with other foreign friends. I booked a class for a Chinese friend, but my friend was so satisfied and I was so satisfied. I highly recommend it!"
Sophie L,"한식에 대해 다시 생각하고 너무 즐겁게 배우고 체험한 시간이였어요!!! 중간 중간 요리 꿀팁도 알려주시고, 알려주신 레시피로 집에서 만든 요리도 성공적이였습니다!! 한국에 다시 가면 다른 음식 클레스도 꼭 다시 들으러 갈게요~!!! 한국에 여행가는 친구들에게도 강추하겠습니다~!!",5,283,"I thought about Korean food again and enjoyed learning and experiencing it!!! You gave me some tips on cooking in between, and the recipe you gave me was a home-made dish. When I go back to Korea, I will definitely go listen to other food classes. I strongly recommend it to my friends who are traveling to Korea."
아름 한,장소도 너무 귀엽고! 쉽게 설명해주셔서 금방 따라할 수 있었어요~!! 집에서 혼자 도오전~!!,5,283,The place was so cute! You explained it so easily that I could copy it quickly! Dojeon at home alone!
JonnySaipan,"요리에 별로 관심은 없는 남자지만 서울에 놀러온 외국인 친구가 쿠킹클래스 가자고 해서 따라 갔는데 나름 즐거운 경험이였어요 ㅎㅎ 우리 일행 말고도 다른 외국인 친구들도 있어서, 친구도 사귈수 있고 다들 어찌나 리액션이 좋고 귀여운지 ㅋㅋ 외국인 친구들이랑 놀러가시면 좋을 거 같아요!",5,283,"I am not interested in cooking, but my foreign friend who came to Seoul asked me to go to a cooking class, and it was a fun experience. I have other foreign friends besides my group, so I can make friends. They all have great reactions and are so cute. I think it would be good to go out with foreign friends!"
상미 오,요리엔 젬병인 저도 쉽고 재미있게 따라할 수 있었던 오미의 요리들! 웃고 떠들다 보니 뚝딱 만들어진 음식들 ♡ㅅ♡ 제공해 주신 레시피대로 하니 집에서도 맛있게 만들 수 있었어요 감사합니다!! 곧 또 찾아 갈게요! :D,5,283,"I'm not good at cooking, but I was able to follow Omi's easy and fun dishes! As I laughed and chatted, I was able to make delicious food at home by following the recipe you gave me. Thank you!! I'll be right back! :D"
장미ㅋ,"10년 자취경력으로 요리에 대해 관심이 있어 다른 쿠킹클래스도 참여해 보았지만, 소규모로 다함께 재료준비하고, 다듬고, 완성하는 과정이 다른 클래스들 보다도 더 유익하고 재밌었어요!!^^ 요리 배우는 목적외에도 친구들과 좋은 추억 쌓을 수 있어 좋았습니다♡ 재방문 의사 ☆☆☆☆☆ 곧 방문하겠습니다! 오미 요리연구소 짱!",5,283,"I have been interested in cooking for 10 years, so I participated in other cooking classes, but the process of preparing, trimming, and completing ingredients together on a small scale was more beneficial and fun than other classes!!Besides the purpose of learning cooking, I was able to make good memories with my friends.♡ Revisit doctor ☆☆☆ ☆☆ I will visit you soon! Omi's Cooking Institute is the best!"
이덕,"한 나라의 문화에 있어 음식은 큰 부분을 차지한다. 식재료, 조리법, 맛은 그 나라의 기후와 역사가 담겨있기 때문이다. '오미 요리연구소'는 한국 음식을 짧지만 즐겁게 경험할 수 있는 곳이다. 친절하고 쉬운 설명, 직접 손으로 만지며 만드는 체험과 맛있게 먹는 마무리까지 유쾌함이 끊이지 않는다.",5,283,"Food is a big part of a country's culture. Because the ingredients, recipes, and flavors contain the country's climate and history. The ""Omi Cooking Institute"" is a short but enjoyable place to experience Korean food. There is no end to the pleasantness of the friendly and easy explanation, hands-on experience of making it, and the end of eating deliciously."
EunheK,고등학교 친구들과 참석했는데 수준급의 요리도 배우고 편안하게 친구들과 수다도 떨수 있는 시간이었습니다. 마지막으로 맛있는 식사는 덤. ㅎㅎ 외국인이 많은 것 같던데 한국인한테도 재밌는 체험교실로 제격일 것 같아요~ 오미 선생님 고맙습니다 ㅎㅎ,5,283,"I attended with my high school friends, and it was a time where I could learn high-quality cooking and chat comfortably with my friends. Lastly, a delicious meal is a bonus. I think there are a lot of foreigners. I think it'll be perfect for Koreans as well. Thank you, teacher Ohmi. Haha"
Su Ye M,작아요 ^^ 하지만 시장보고 만들고 ... 충분한 매력이 넘치는 곳입니다. .. 한국 사람이지만 이곳이 한국을 이해 하는데 많은 도움이 될꺼라고 장담합니다.,5,283,"It's small  하지만 만들고 But make a market report... It's a place full of charm. Although I am Korean, I am sure that this place will help me understand Korea."
현기 박,"대만에서 온 친구들을 데리고 김치요리를 만들어봤어요. 사실 어려워서 혼자는 시도도 못해봤는데 재료도 갖춰주시고 방법도 친절히 알려주셔서 재밌게 체험하고, 직접 만든 음식 맛있게 먹고 정말 좋은 경험 했습니다.~~!!!",5,283,"I made kimchi dishes with my friends from Taiwan. Actually, I couldn't even try it alone because it was hard, but they prepared ingredients and kindly taught me how to do it, so I had fun. I enjoyed the food I made myself. It was a great experience.~~!!!"
Tingtina93,저는 외국 사람이에요. 진짜 행복한 경험이에요. 감사합니다 오미~~~ 처음에 김치를 담겄어요!! 완전 맛있어요!!,5,283,I'm a foreigner. It's a really happy experience. Thank you. Oh my~~~~~~~ I'll make kimchi in the beginning!! It's so delicious!!
영주조2015,고기쟁이인 저에게 베지테리언 친구를 위한 너무 맛스럽고 멋스러운 채식요리를 알려주셨어요 +_+ 정말 가족과 친구와 함께 할 수 있는 소규모 쿠킹클래스 !!!!!!! 너무 좋아요 ❤️❤️❤️❤️❤️❤️ 진짜 짱짱 ~~~~~~~ !! 그리고 평소에도 집에서 충분히 따라 할 수 있는 재료와 레시피 ~~~~~>< 감사합니다 ~~,5,283,She taught me a very delicious and wonderful vegetarian dish for my vegetarian friend. +_+ A small cooking class where you can spend time with your family and friends!!!!!!!!! I love it! You're the best~~~~~~~~! And the ingredients and recipes that you can follow at home usually~~~~~~~~~~~~~~~~~~Thank you. ~~
영하 조,"한번은 혼자, 한번은 친구와 한번은 가족과 함께 갔었어요^_^ 모두 다른 요리를 배웠는데 배우는 것 마다 재밌고 맛있었어요! 선생님이 무척 친절하고 전문성있게 가르쳐주셔요 전 갈 때마다 외국인 손님들이 계셨는데 함께 배우는 입장임에도 불구하고 한국요리 좋아하고 한국문화체험하며 놀라워하는 모습을 보니 뿌듯하고 자랑스럽더라구요♥ 배운건 집에서 잘 써먹구 있어요!!ㅋㅋ",5,283,"Once alone, once with a friend, once with a family.We all learned different dishes, but everything we learned was fun and delicious! My teacher teaches me very kindly and professionally. Every time I went there, there were foreign guests. Even though we were learning together, I was proud to see them enjoying Korean food and experiencing Korean culture.I'm using what I've learned at home!LOL"
YuRi C,"앞에 사진은 제가 한거고, 뒤에 사진은 쿠킹클래스에서 선생님이랑 같이 만든 메뉴입니다. 친구랑 같이 요리에 초보인데 쉽게 할수 있고 선생님이 한식에 대한 얘기를 잘해주셔서 재미있었어요. 잡채는 잔치음식이라 재료들을 다 길게 채썬다는 이야기는 이번에 알았네요. 장수의 의미가 있다는 ㅎㅎㅎ 가자마자 시원한 환영의 쥬스도 주시고 선생님이 직접 볶으신 라오스산 커피도 대만족!! 정말 배부른 한끼를 잘 먹고 왔습니다. 집에서 바로 다음날 해보았는데 가족들 반응이 너무 좋아서 뿌듯하네요!!!! 처음",5,283,"The picture in the front is what I did, and the picture in the back is the menu that I made with my teacher in the cooking class. I'm a beginner in cooking with my friend, but I can do it easily and it was fun because my teacher told me about Korean food well. I just found out that japchae is a feast food, so you can make all the ingredients long. As soon as I got there, I got a nice welcome juice and I was satisfied with the Laos coffee that my teacher personally roasted. I had a really full meal. I tried it the next day at home, and I'm proud that my family reacted so well!!!! First time"
youngsooya,미국인 남자친구와 부모님과 함께 오미 요리연구소에서 즐거운 시간을 보냈습니다. 특별했던 토마토 김치도 만들고 맛있는 잡채도 먹고 정말 재미있고 맛있었어요. 한국으로 놀러오시는 외국인분들에게 강추입니다!,5,283,I had a great time with my American boyfriend and parents at the Omi Cooking Institute. I made special tomato kimchi and ate delicious japchae. It was really fun and delicious. I strongly recommend it to foreigners who come to Korea to play!
Yongsoo67,여자친구랑 요리를 배우러 오미 쿠킹클래스에 왔는데 인테리어부터 너무 예쁘고 분위기가 좋아서 시작부터 좋았습니다. 난생 처음하는 요리라 걱정을 많이했는데 선생님께서 옆에서 친절하게 설명해주시면서 함께 만들어서 쉽고 재미있었어요. 제가 만들면서도... 맛있을지... 의문이었는데 고생끝에 맛본 음식의맛은. 정말 최고였어요-!! 한국 젊은이들에게도 좋은 경험인 것 같고 외국 여행자들이 와서 체험하면 너무너무 좋을것 같아요ㅡ 강추입니다-!!,5,283,"I came to Omi Cooking Class to learn how to cook with my girlfriend, and the interior was so pretty and the atmosphere was nice, so I liked it from the start. I was worried because it was my first time cooking it, but it was easy and fun to make it together as you kindly explained it to me. When I was making it... I wonder if it'll it taste good? It was a question, but the taste of the food I tasted after hard work. It was really the best. It's a great experience for young Koreans and it'd be great if foreign travelers could come and experience it. I strongly recommend it."
Lawriem1,우리는 요리 교실에서 많은 것을 배우는 동안 많은 재미를 보았습니다! 팀은 훌륭하고 도움이되고 참을성이있었습니다. 우리는 시장에 가서 작은 투어와 시장에 대한 정보를 포함한 재료를 얻기 위해 시작합니다. 우리는 신선하게 조리 된 식사의 멋진 점심을 즐기기 전에 몇 시간 동안 요리를했습니다.,5,283,"We had a lot of fun while learning many things in the cooking class! Tim was great, helpful, and patient. We start to go to the market and get materials including small tours and information about the market. We cooked for hours before enjoying a nice lunch of a fresh, cooked meal."
GoodySK1,오후를 보내는 가장 좋은 방법! Jihee는 매우 지식이 풍부하고 열정적 인 호스트입니다. 요리를 준비하는 것은 즐거웠고 결과는 맛있는 식사였습니다. 추천!,5,283,Best way to spend the afternoon! Jihee is a very knowledgeable and enthusiastic host. Preparing the food was fun and the result was a delicious meal. Recommendation!
Domy415,매우 가정적인 환경에서 한국 요리를 요리하는 방법을 배우는 것은 훌륭한 경험이었습니다. 김과 지희는 뛰어났다. 친구들로부터 요리를 배우고 그 후에 식사를 통해 좋은 대화를 나누는 것처럼 느껴졌습니다. 한국으로의 가족 여행에 확실히 좋은 경험을 추가했습니다. 추천.,5,283,It was a great experience to learn how to cook Korean cuisine in a very domestic environment. Kim and Ji-hee were outstanding. I felt like I was learning cooking from my friends and then having a good conversation through a meal. I definitely added a good experience to my family trip to Korea. Recommendation
Nush,"나는 우선, 모두가 매우 친절하고 친절했다고 말해야합니다! 환경은 매우 환영하고 혼자 여행 할 때 매우 안심이었습니다 ^^ Dave는 가까운 시장을 둘러 보면서 유익한 여행을 갔을 때 무엇이 사용되는지 설명하고 흥미로운 사실과 이야기를 알려주었습니다. 전체적으로 매우 사랑 스럽습니다! 그러나 요리 실험실 자체가 가장 재미있었습니다! 모든 것이 너무 아름답게 배치되어 탐색하기가 쉬웠으며 요리사는 매우 훌륭했습니다. 그녀는 매우 거품이 많고 재미있었습니다! 요리가 편안하지 않고 요리가 매우",5,283,"First of all, I have to say that everyone was very kind and kind! The environment was very welcome and very reassuring when I was traveling alone. ^^ Dave toured the nearby market and explained what was used to make a beneficial trip and told interesting facts and stories. Overall, it is very lovely! But the cooking lab itself was the most fun! Everything was so beautifully arranged that it was easy to navigate and the cook was very good. She was very bubbly and funny! Cooking is not comfortable and cooking is very"
Robert,"쇼핑, 요리, 함께 먹는 것은 재미 있었고 우리는 시간이 지나가는 것을 전혀 눈치 채지 못했습니다. 첫번째로 우리는 곧 근처의 전통 시장에 갔고 약간의 재료를 샀다. 그리고 요리 연구실은 매우 가까웠다. 그래서 우리는 거기에서 직접 시장에 갔다.) 우리 요리 마스터 인 Jihee는 매우 친절하고 웃으며 친절했고, 한사람 한사람 한사람을 돌보며 멋진 분위기를 연출했습니다. Jihee! 감사합니다.",5,283,"Shopping, cooking, and eating together were fun and we didn't notice the passage of time at all. First, we soon went to a traditional market nearby and bought some ingredients. And the cooking lab was very close. So we went to the market there directly.) Our cooking master, Jihee, was very kind, smiling, and kind, taking care of each and every one of them, creating a wonderful atmosphere. Jihee! Thank you."
L Jam,주방장과 동료들 덕분입니다. 그들은 친절하고 친절합니다. 우리는 특히 시장 투어와 요리 시간을 너무나 즐겼습니다. 내 친구들에게 추천 해 줄거야.,4,283,Thanks to the chef and his colleagues. They are kind and kind. We especially enjoyed the market tour and cooking time. I will recommend it to my friends.
SHIHO A,?? 2 ?????????????????????????????????????????????? ??????????????????????????????? ??????????? 현지 시장 투어 및 요리 수업은 모두 매우 재미있었습니다! 선생님의 영어는 쉽게 이해할 수 있었고 함께 참여한 회원들도 친절하고 훌륭한 시간을 보냈습니다. 나는 다시 참여하고 싶다!,5,283,?? 2 ????????????????????????????????????????????????????????????????????????????????????????????????????????????????????????????????????????????????????????????????????????????????????????????????????????????????????????????????????????????????????????????????????????????????????????????????? I could understand your English easily and the members who participated in it were also kind and had a great time. I want to participate again!
Asyraf,"한국 요리를 배우는 좋은 시간을 보았습니다. 그들은 우리가 요리 한 불고기 요리를 먹을 수 있도록 할랄 고기도 준비했습니다. 장소는 약간 벼락치기 때문에 우리 중의 8 명은 2 개의 요리 냄비를 공유했다. 그러나 우리의 각각은 재료를 더하고, 요리를 요리하기 위해 순서를 가져 갔다. A부터 Z까지의 모든 조리 단계를 처리하는 데 자신이없는 초보자에게 좋습니다!",4,283,"I saw a good time learning Korean cuisine. They also prepared halal meat so that we can eat a bulgogi dish. Eight of us shared two cooking pots because the place was a bit crammed. But each of us added the ingredients, and took the order to cook the dishes. Good for beginners who are not confident in handling all cooking steps from A to Z!"
elysse0904,"Minseon, Jihee 및 Mahler에게 훌륭한 요리 경험을 해주셔서 감사합니다. 가족과 함께 즐거운 시간을 보냈으며이 여행을 한국에 여행하는 모든 사람들에게 적극 추천 할 것입니다. 음식은 맛 좋았고 직원들은 매우 친절했습니다.)",5,283,"Thank you for your wonderful cooking experience with Minseon, Jihee, and Mahler. I had a great time with my family and I will highly recommend this trip to everyone who travels to Korea. The food was delicious and the staff was very kind.)"
philip r,"Jihee, 우리의 시장 가이드 및 요리 강사, 뛰어난했다! 그녀는 지식이 풍부하고 매력적이며 활기차고 재미 있습니다! 시장 자체는 놀랍습니다. 작은 크기의 수업으로 재미 있고 개별화 된주의가 가능했습니다. 우리 둘은 채식주의 자이고 우리의 요구는 아름답게 조절되었습니다. 매우 추천하는",5,283,"Jihee, our market guide and cooking instructor, excellent! She is knowledgeable, charming, energetic, and funny! The market itself is amazing. Small-sized classes made it fun and individualized. We are both vegetarians and our needs are beautifully adjusted. highly recommended"
