u_id,review,u_rate,p_id,review_en
Carol M,"나는 이 요리 클래스를 너무 마음에 들었습니다! 아주 지하철 출구에서 Minseon 만날 쉬웠습니다. 통한 투어를 너무 많은 한국 시장과 이해 데 일조했습니다. 요리 강좌는 아주 멋진 한국식 홈 열렸다. 모든 것들이 부드럽게 진행되었다. 그녀는 분명히 모든 단계와 음식을 준비하는 데 필요한 음식이 설명했다. 작은 설정, 그래서 나는 물어보길 가장 편안했다. 이 요리 클래스를 정말 제가 서울에서 휴가 최고였다! ! 이곳은 또한 저렴한 호텔입니다. 우리는 준비한 점심을 너무 맛있었어요! ! ! 나는",5,283,"I loved this cooking class! It was easy to meet Minseon at the subway exit. The tour has helped us understand too many Korean markets. The cooking class was a wonderful Korean home run. Everything went smoothly. She clearly explained all the steps and the food she needed to prepare the food. A little setup, so I was most comfortable asking. This cooking class was the best vacation in Seoul! It is also a cheap hotel. The lunch we prepared was so delicious!"
Seaside367277,"시장을 출구에서 지하철 및 회의 취하고 매우 간편합니다. Minseon 시장의 투어에 기꺼이 우리를 데리고 재료를 쇼핑. 매우 인상적인 시장 그리고 너무 많은 것을 설명했다. 우리 그룹은 작고 Minseon 리사 친구와 요리 및 맛있는 음식을 먹는 하루 수집 느낌이 났습니다. 우리는 모든 솔로 여행객, 서울에 있는 새로운 친구와 함께 멋진 하루를 보냈습니다. 당신이 요리 클래스 이 한국 문화와 음식에 대해 배우며 정말 즐거운 경험이었습니다. 취하고 생각했습니다. 시간을 사진을 함께 요리법을",5,283,It's very convenient to take the subway and conference at the exit of the market. Gladly take us to Minseon's market tour to shop for the ingredients. A very impressive market and too much explained. Our group felt like a day's collection of cooking and delicious food with Minseon Lisa's friend. We had a wonderful day with all the solo travelers and new friends in Seoul. It was a very pleasant experience for you to learn about Korean culture and food in the cooking class. I got drunk and thought. We're going to spend some time working together on a recipe.
Lidiya R,"이 요리 경험을 한 지금까지는. It Minseon. Metro 찾기 쉬웠고, 그녀는 미국 시장을 통해 가이드. 그녀는 시장, 그리고 음식에 매우 지식이 풍부해서 우리가 하는 모든 질문에 대답할 수 있었습니다. 우리는 모든 것이 깔끔했고 잘 정돈되어 있었다. 작은 집으로 데려갔습니다. 그녀는 요리 경험을 따뜻하고 친근한 모두가 포함되어 있었습니다. 그녀는 우리를 잘 가르치고 매우 고무적입니다. 음식은 정말 맛있었고 요리법에 제공된 발문""을 썼지만 따르는 간단한. 이 요리 경험을 적극 추천합니다.",5,283,"0So far, I've had this cooking experience.It Minseon.Metro was easy to find and she was a guide through the American market.She was so knowledgeable about the market and food that she was able to answer all the questions we asked.We were all neat and tidy.He took her to a small house.She included all warm and friendly cooking experiences.She teaches us well and is very encouraging.The food was really delicious and simple to follow, even though I wrote the footnote provided in the recipe.I highly recommend this cooking experience."
Lynne,"정말 좋은 경험이 있는 집 이 다른 동적 으로 가져온 요리 교실 이 오. 우리는 흔히 한 로컬 시장 minseon 관광객들이 방문 하고, 다른 것들을 구입할 수 있도록 설명 해 한국 요리 집. 우리는 손을 - 최상의 재료 및 음식을 함께 요리를 준비 중. 제가 사랑하는 것이 믿을 수 없을만큼 재미있고 다시 할 수 있는!",5,283,"A house with a really good experience, this cooking class brought in a different dynamic, oh. We often visit one local market minseon tourists and explain to them that they can buy other things. We're preparing our hands - the best ingredients and food together. What I love is incredibly fun and we can do it again!"
Haslina R,"최고의 여행하기를 한 부분이 있습니다. 나에게 준 기회인 것 같은 느낌 들 중간 체 클래스. 가장 좋았던 부분은 시장 투어. 나는 내내 웃는. 요리도 멋진, 이슬람 무슬림 재료를 제공하여 주었다. 감사합니다. 나는 정말 이 지. 아주 행복한 전체 클래스 입니다.",5,283,There is a part where I wished the best trip. I think it's an opportunity you gave me. Middle sieve class. The best part was the market tour. I laugh all the time. Cooking also provided wonderful Islamic Muslim ingredients. Thank you. I'm really Lee Ji. It's a very happy whole class.
Aloushius,"우리가 만난 지하철 역 바로 옆에 있는 시장. 우리는 시장을 돌아 minseon 의 성분 에 대해 설명하는 경우 사용할 수 있습니다. 요리 교실 자체도 재미 있었어요. 편안하고 재미있는 설정 였습니다. 우리는 다른 사람들과 함께 그룹 에는 8 세계에서 좋았다. 우리가 만든 요리는 맛있 었다 (비빔밥)! 다음 번에 이 정도! 걱정 하지 말 어 쓰는 요리법, 지침이 보내주시기 답변하기 위해 사진을 전자 메일!",5,283,"The market right next to the subway station we met. We can use it when we go around the market and explain about the ingredients of minseon. The cooking class itself was fun. It was a comfortable and fun setup. We were good in Group 8 with other people. The food we made was delicious! Next time, this much! Don't worry. E-mail me a photo to answer the instructions and recipes you use!"
alkalinej97,"도착해서 쇼핑하러 갔다, 요리, 이야기 하는 좋은 시간. 우리의 신혼 여행이었기 때문에, 민성 이 아름다운 일 을 위해. 앞으로 한국에서 이렇게 없을 수 없습니다.",5,283,"Arrived and went shopping, cooking and talking good time. Since it was our honeymoon, Min-sung for this beautiful thing. From now on, I can't be without you like this in Korea."
vickyng2810,"내 어머니와 할머니와 여행, 저와 저희는 다행이 하고 여기에 클래스! 하는 것은 매우 즐거운 다양한 재료가 설명한 일을 minseon 이유들이 다른 요리 사용할 수 있습니다. 우리가 좋은 경험이었고 음식은 모두 새로 보는 데는 많은 요리를 바로! 하고 할머니는 그녀에게 minseon accomadating 을 친절하게 메뉴를 변경 해 먹을 수 없었다는 것이 할머니에게! 감사합니다 정말 멋진 경험! 우리 여행의 하이라이트 였습니다! :)",5,283,"Traveling with my mother and grandmother, me and I are fortunate to be here, and class here! is a great pleasure, and minseon reasons can use different dishes. It was a good experience for us and the food was all new and she couldn't kindly change the menu of minseon assomating to her! Thank you. What a wonderful experience! That was the highlight of our trip! :)"
Oosah K,좋은 시간을 가지고 방문하는 모든 수업을 꼭 추천할 것입니다. 우리 여행의 하이라이트였어요!,5,283,I will definitely recommend all the classes I visit with a good time. It was the highlight of our trip!
choot280,"요리 교실에 한번 중간 제조업체 중 하나는 서울에 우리 여행의 하이라이트! 우리는 아침 8 클래스 및 등록된 변경다른 학생 및 선생님을 만나서, 지하철 중 하나를 minseon. 영어와 중국어 수업에서 만난, 우리는 유럽에서 온 학생들, 대만, 홍콩 및 한국 :). 로 시작하는 투어에 신선한 재료를 시장, 한국 음식 문화의 거리 및 권장 minseon. 기억에 가서 길을 저렴한 가격에 향유 및 인삼! 단순하고 클래스는 편안하고, 학생들의 모든 재료가 준비한 요리. 주위에 앉아 있는 테이블",5,283,"Once in a cooking class, one of the intermediate manufacturers is the highlight of our trip to Seoul! We met 8 classes in the morning and other registered changed students and teachers, minseon. Meeting one of the subways in English and Chinese classes, we met students from Europe, Taiwan, Hong Kong and Korea :). Fresh ingredients for the tour, starting with the market, the streets of Korean food culture and recommended minseon. Go to memory and enjoy the streets at a low price, and enjoy a simple, class-friendly dish, prepared by all the ingredients of the students. a table sitting around"
Yap S,좋은 경험이었고 중간 체 요리 교실 개최에 전통 한옥 예상보다는. 매우 친절하고 많은 정보 파악 을 minseon 음식을 요리 하는. 사람들이 서울에 머무는 것을 추천 한다.,5,283,"It was a good experience, and rather than the expectation of traditional Korean houses to hold a mid-sized cooking class. cooking minseon food very kind and lots of information I recommend that people stay in Seoul."
Han h,"이 사랑스러운 요리 교실. 기간, 여섯 명밖에 없는. 그래서 요리를 할 수 있는 사람. 특히 이 집은 - 요리 식사. 또한 다른 식당을 경험하는 수. 교사가 하는 편이지만 맛있는 만들기도 쉽고 레시피 였습니다. 특별한 경우에도 계속 생각 요리 경험 익힐 수 있습니다. 집에서 혼자 생각 할 수 있습니다. 그것곁에, 교사는 기존 시장을 가져다 주었습니다. 제가 경험 할 수 있기 좋은 곳이지만 전통적인 시장은 지역 전통. 있는 것을 강력 추천합니다.",5,283,"This lovely cooking class. Period, with only six people. So someone who can cook. Especially in this house - a cooking meal. Also, the number of experiences in other restaurants. It was easy to make delicious food and it was a recipe. Even in special cases, you can continue to learn thinking cooking experience. I can think alone at home. By it, the teacher brought the existing market. It's a good place for me to experience, but I strongly recommend that there is a local tradition."
Craig S,"최근 서울에 방문. 생각했던 것들을 배우는 요리 교실에 참가는 한국 음식 준비. Ssi minseon 지역의 요리 교실 로 시작할 신선한 식품 시장 - 새롭고 환상적이었습니다! 요리 교실 자체는 매우 편안한 크기 (8 명 포함). 김치 하는 준비하는 방법을 배웠다 스튜, 고기 요리 2, 2 종류의 팬케이크 도 반찬 2! 저는 즐거운 경험이었고 음식도 있지만 안 배우 준비하는 방법에 대한 자세한 내용은 한국 음식 & 문화. 이 수업은 영어, ssi 및 매우 친절하고 도움이 많이 되는",5,283,"Visiting Seoul recently. Preparing Korean food to participate in cooking class to learn what you thought. Fresh Food Market to Start with a Cooking Classroom in the Ssi Minseon Area - It was new and fantastic! The cooking class itself is a very comfortable size (including eight people). I learned how to prepare Kimchi. Stew, meat, two kinds of pancakes, two kinds of side dishes, two! It was a fun experience for me and I have food, but for more information on how to prepare not to learn, Korean food and culture. This class is English, ssi, and very kind and helpful."
Nick M,"예약은 온라인으로 링크가 비아토르 만족했습니다. 수행 을 통해 의사 소통이 - 메일 및 지우기 도 신속 했습니다. 전반적으로, 우리는 다른 사람들을 정말 강력히 추천 합니다. 먼저 만날 클래스의 다른 (우리 그룹은 총 7). 그런 다음 로컬 시장을 배우는 것에 대한 다양한 유형의 상품, 사용하는 몇 가지의 요리와 한국 문화에 중요한, 어떤 종류의 음식이 될 수 있습니다 사용할 수 있습니다. 클래스 자체는 매우 여유로운 - 다시 즐거운, 많은 사진을 찍을 기회 및 질문. 수업 후, 모든 음식을",5,283,"The online link was satisfied with the reservation. Communication through action - mail and erasing were also quick. Overall, we strongly recommend others. The other class to meet first (our group is total 7). Then it can be any kind of food that is important to Korean culture, with different types of products for learning the local market. Available. The class itself is very relaxed - pleasant again, opportunities and questions to take many pictures. After class, all the food."
Jesstwiga L,"서울에 있는 멋진 작은 요리 교실 경험! Minseon - 클래스는 젊은 여성, 재미는, 집에 있는 작은 요리를 하기 위해서 할 수 있는 느낌 에 가까운 가장 번화한 거리에 있는 큰 실습 식품 시장 서울. 을 때 시작하는 재료의 투어에 얻을 수 있도록, 많은 업체를 알고 있는 일반 minseon. 그런 다음 머리 를 어떻게 minseon 의 작은 부엌이 준비하는 모든 요리. 약 6명 공동 클래스를, 많은 친구와 같은 느낌이 들고 앉아 함께 요리 하는 것. 좋은 교사 및 전체 클래스…",5,283,"Nice little cooking class experience in Seoul! Minseon - Class is the busiest street food market for young women, fun, and the feeling you can do to cook small dishes at home in Seoul. General minseon knows many companies to get on the tour of ingredients that begin with. Then, how to prepare a mini kitchen. About a six-member joint class, sitting down and cooking together with a lot of friends. Good teachers and full classes..."
seraina126,"저는 삼계탕 클래스. 먼저, 시장 근처에 있는 매우 유익한 투어 를 통해, 우리의 메인 재료 구입 요리 교실. 다시 요리 실습, 삼계탕 을 이용해서 신선한 제품 (인삼 치킨 수프, 해산물 팬케이크 김치, 미니 호박 팬케이크와 칠리 샐러드, 나 두 쌍 또는 그룹화. 따라서, 요리사는 맛있는 점심을 함께 한 가족 같은 느낌.",5,283,"I'll have samgyetang class. First, through a very informative tour near the market, our main ingredients purchase cooking class. Again, cooking practice, using samgyetang, fresh products (insam chicken soup, seafood pancake kimchi, mini pumpkin pancakes and chili salad, two pairs or groups of me. Therefore, the cook feels like a family with a delicious lunch."
Randal L,"저는 혼자 여행하는 마음을 가지고 쿠킹 클래스. 독특한 경험을 제공하지 않은 중간 체 요리 실습을 하기 전에는 다른 나라에 쿠킹 클래스 (심지어 미국에서). 내 강사 친구와 즐겁게 요리 하는 것 같은 느낌을 minseon. 시장 한 가치가 있는 여행. 왜? 모두가 알고있는 모든 사람들이 현지 시장. 이곳은 거대하고 아주 잘 배치 한 적이 있던 지하 공간인 느낌. 또한 한국에서 가장 큰 시장인 한약재. 이는 본 신선한 농산물 과 아름다운 모든 팔 붙여 다양한, 물고기, 등이 있습니다. 모든",5,283,"Cooking class with the heart of traveling alone. Cooking classes in other countries (even in the United States) before practicing medium-sized cooking without providing a unique experience. Feels like I'm enjoying cooking with my instructor friend. A trip worth a market. Why? Everyone who knows the local market. It feels like a huge, well-placed underground space. Also, the largest market in Korea, herbal medicine. It has various kinds of fish, etc. with all the beautiful arms and fresh produce. All"
SMLove226,"제 남편과 저는 최근에 하루를 기념하기 위해서 우리의 기념일 요리 실습 중간 체 요리 강습. 트립어드바이저 클래스 및 예약을 해 보이는 가격과 품질 클래스. 우리 일행 7 명을 경동 시장에 가서 재료를 구입한 식사 가이드 투어 의 강사 전에 요리. 우리 강사, 적절한 도움이 되었고 minseon. 대만 사람들의 클래스가 포함되어, 일본, 스위스 및 미국. 우리 강사는 모든 사람들이 그녀의 이야기를 쉽게 통신할 수 있는 손질사용자 정의 다양한 대상. 출시 후, 우리는 근처 스튜디오 의 교훈을",5,283,"My husband and I recently had our anniversary cooking practice mid-body cooking class to celebrate our day. TripAdvisor classes and price and quality classes that appear to be booking. Cook before the instructor of the meal guide tour, where seven of us went to Kyungdong market to buy ingredients. Our instructor, properly helpful and minseon. Includes classes of Taiwanese people, Japan, Switzerland and the United States. Our instructor customizable various subjects that everyone can easily communicate her story. After the launch, we learned a lesson from a nearby studio."
egangauntt,내가 첫 날 아이들과 저는 이 클래스의 서울. 정말 좋았어요! 여행은 아주 흥미로운 시장 및 준비 / 모든 음식은 요리 하는 많은. 강력히 추천합니다!,5,283,"On the first day, my children and I were in this class of Seoul. It was great! Travel is a very interesting market and preparation / a lot of food cooking. I strongly recommend it!"
tulipsong,저와 제 친구가 갔다 클래스 (다양한 한국 음식 중) 음력설 있다. 우리의 유일한 사람들 이었기 때문에 다 - 그래서 이 계절 처럼 개인 레슨: p 가이드 / 교사 이 아주 친절하고 훌륭한 유머 감각. 맛있는 음식이 많음. 오늘 서울 사람들에게 적극 추천합니다!,5,283,My friend and I went there. There is Lunar New Year's Day. Because they were all our only people - so private lessons like this season: p guides / teachers are very kind and good sense of humor. Lots of delicious food. I highly recommend it to the people of Seoul today!
Goh S,"이는 흥미로운 사람들을 제가 추천하는 한국 음식을 먹을 수 있는 요리 교실에 사인이 즐길 수 있습니다. 마스터 요리사 의 아주 멋진 일을 하는 젊은 여성과 그녀의 매력을 했던 daseul 정신을 보여 주었다 그녀의 경험이 조금 도 없는 사람들은 교육 방법에 맛있는 한국 요리를 요리 경험! 모든 요리는 정말 좋은 시 이와 함께 만드는 요리에 모여 있는 작은 그룹은 정말 즐거웠습니다. 그녀는 그녀가 좋고 영어를 확실히 할 음식들을 쉽고 간단하게 만들어, 제가 요리할 수 있는 아마추어 같이 있는",5,283,"This can be enjoyed by autographs in the cooking class where I can eat Korean food that I recommend. The master chef showed a young woman who did a wonderful job and the spirit of desul who attracted her. Those of you who have little experience with her cooking experience of delicious Korean cuisine in their teaching methods! Every dish is a really good poem. I really enjoyed the small group of dishes that I make with it. She makes things easy and simple for her to like and make sure she speaks English, like an amateur I can cook."
Vinod C,"강력 추천합니다. 사전에 이메일로 언급 할 특정 클래스 식이 제한. 우리 둘 이 있었는데, 두 개의 직원들, 4 가 준비 한, 아주 즐거운 경험을 했어요. 제 생각보다 훨씬 더 큰 돈 보다 많은 수의 클래스로 학생, 또는 waterborn 음식 준비. 여행은 역시 시장, 다양한 농산물 의 특성상 기회를 만들지 수 있는 질문, 생선 및 기타 항목을 사용할 수 있습니다. Kim 씨 추천 식당들이 서울에 다 있었습니다 레스토랑, 및 검토 기존 지도, 한 가치. 좋은 경험에 감사드려요!",5,283,"I highly recommend it. Restrictions on certain classes of expression to be mentioned in advance by email. There were two of us, and we had a very pleasant experience, with two employees, four ready. Students, or waterborn food preparation, in more classes than I thought. Travel can also use questions, fish, and other items that can create opportunities due to the market and the nature of various agricultural products. Kim's recommended restaurants were all in Seoul. Restaurant, and review existing map, one value. Thank you for the good experience!"
Olivia T,"할 가치가 있는, 좋은 방법인 것 같은 느낌 에 대해 로컬 및 집에서 만든 한국 요리. 사랑 이 시장 투어, 위대한 통찰력 을 로컬, 전통 시장과 같은, 사랑의 학습 에 대한 음식 문화의 배경. 선생님 이 한 분은 영어 수업, 아주 열정적이고 친절했습니다. 이 강좌를 적극 추천합니다, 우리는 꼭 여행의 하이라이트 중 하나입니다.",5,283,"Local and homemade Korean dishes for feeling like a good way to do it. Love This market tour, great insight local, traditional market, the background of food culture on learning of love. Teacher, this one person was very passionate and kind in English class. I highly recommend this course, we are definitely one of the highlights of our trip."
neesha_belle,"정말 멋진 경험이 어떻게 요리하는 한국 음식 조리 실습 중간 체. 그의 손 - 클래스, 요리는 함께 식사 하고 있다. 우리 강사, 아주 유익한 이야기가 많은 또한 변경다른 daseul 들을 hehehe 친구와 저는 시장으로 가 볼 기회가 있어. 이슬람 경우, 정보를 그냥 minseon. 할랄 요리 재료로 제공하는 대신 고기 요리 를 선택합니다. 만나고 싶다! 감사합니다 daseul & minseon",5,283,"The medium sieve of cooking Korean food, how a great experience cooks. His hands - class, cooking are dining together. Our instructor, hehehe friend and I have a chance to go to the market because we have a lot of informative stories and also changed cases. In the case of Islam, instead of just serving information as a minseon. halal cooking ingredient, choose meat cooking. I want to meet you! Thank you,daseul & minseon."
Mei Ching L,"저는 이 수업 시간을 보냈습니다. 크기도 좋고 클래스를 로컬 시장에 재료를 살 어. 요리는, 및 에 대해 한국 요리를 먹었다. 집에 돌아와서 좋은 기억. 모든 것에 감사 드립니다!",5,283,"I spent this class. It's good in size and buy materials for the class in the local market. For cooking, I ate Korean food about and . Good memories back home. Thank you for everything!"
angks1972,아내와 가족을 위한 요리 교실 을 예약을 했습니다. 김씨는 로컬 시장 투어 시작 선생님 요리와 함께 다양한 정보. 그녀는 아주 환자 중 2 여자의 요리 교실. 아주 좋은 경험을 같이 한 한국 문화를 강력 추천합니다!,5,283,I reserved a cooking class for my wife and family. Kim starts the local market tour with a variety of information along with the teacher's cooking. She is a cooking class for two women among very patients. I strongly recommend Korean culture with great experience!
HazeSingapore,"5 중 하나는 한 그릇 요리 에 대해 많은 한국 음식은 조리법 이 세션을 결과 답 게 인터넷 할 수 없습니다. 및 공유에 대해 이기 적이지 게 참을성 daseul. 정말 좋은 요리 교실, 가격과 품질 면에서.",5,283,"One out of five is a recipe for a bowl of Korean food. This session is not the answer to the Internet. And you're selfish about sharing. Very good cooking class, in terms of price and quality."
syakilla a,"저는 처음에 기대하지 않는 것을 가져다 주는 시장 투어. 이 시장에 즐거운 여행을 하는 재료 들 을 자세히 보지 못한 것이 있을 가장 확실한 것 같아. 요리 교실에, 위생 상태는 가장 중요한 것. 언니 는 우리의 손을 우리에게 minseon 세척해 활동을 시작하기 전에. 간단한 요리도 하지 않는 마음 들이 함께 있는 클래스에 비해 혼자 집에 있는 것 같아요. (: 재미 있는 내 친구들을 가지고 갈 경우 추천 합니다. 경험에 감사드립니다!",5,283,"A market tour that brings me something I don't expect at first. I'm sure there's something I haven't seen in detail about the ingredients for a pleasant trip to this market. In cooking class, hygiene is the most important thing. My sister cleans our hands before we start our activities. I feel like I'm home alone compared to the class where I don't cook simple dishes. (: I recommend you to take my funny friends with you. Thank you for your experience!"
Daniboy D,"요리 클래스는 이 흥미로운 생각하지 않습니다. 이 교사 (미안 하지 않을 수 맞춤법 이름 제대로) 도 매우 따뜻한, 친절하고 도움이 되었습니다. 해 나는 요리는 재료를 구입한 다음 시장 투어. 다시 돌아올 겁니다, 다음 번 여행 가족들과 함께. 곧 만나지.",5,283,"Cooking class doesn't think this is interesting. This teacher was also very warm, kind and helpful. The sun-flying food is a market tour after buying ingredients. I'll be back, with my next traveling family. See you soon."
