u_id,review,u_rate,p_id,review_en
Calvin S,"내가 처음 서울에 갔는데 한국 요리 교실 안을 가지고. 요리 교실에 간 때 나타나는 검색합니다. 중간 체 요리를 해주었기 때문에. 요리를 시작하기 전에, 우리는 근처 시장에 들러 기존. 클래스는 기존의 집은 한국인. 이는 명확하게 이해. 음식은 아주 좋았습니다. 엽서를 받는 모든 교육 과정의 끝. 한국 요리 교실 을 추천 할 경우에는 언제든지 서울.",4,283,"I went to Seoul for the first time and I brought it to the Korean cooking class. Search that appears when you go to the cooking class. Because I cooked it in a medium-sized. Before we start cooking, we stop by a nearby market and we're old. In the class, the existing house is Korean. This is clearly understood. The food was very good. The end of all education courses for receiving postcards. Any time you recommend a Korean cooking class, Seoul."
Jackieyin,"저는 오늘 엄마랑 함께 길거리 음식, 요리 4 가 작은 그룹이 서로 상호 작용 수 있습니다. 함께 음식을 즐길 수 있는 요리를 함께 완료 3 & 느낌 있는 친구들과 함께. 직원들은 매우 친절하고 선생님 minseon & 그녀. 하지만 여행은 짧지만 여전히 시장의 가장 큰 시장입니다 서울에서 볼 수 있습니다. 우리는 다시 한번 내 친구들에게 추천하고 싶은 즐거운 여행을 원하는 중간 체 & 뭔가 다른 쇼핑 랩온어칩에 아닌 변경다른 랩온어칩에",4,283,"Today, I can interact with my mom with small groups of street food, cooking 4. Cooked together to enjoy food together 3 & with friends with feeling. The staff are very kind and teacher minseon & her. But while travel is short, it's still the biggest market. You can see it in Seoul. We want a pleasant trip that I want to recommend to my friends once again, not on a different shopping lap-on-a-chip, but on a different lap-on-a-chip."
Skye,"저희가 방문한 십 으로 구성. 물론 정상적인 크기보다 큰 그룹은, 동시에 minseon 더 친절하게 가르쳐 준 정상 가격 같은. 우리는 한 사람 당 40000, KRW 할인도 큰 그룹이 었죠. 전자 메일 및 수업 전에 매우 반응 이 minseon 위챗 및 기차역 픽업 서비스를 제공하여 가장 가까운. 그녀는 아주 행복한 말에 대해 많이 한국 음식 조리 시간을 주었다. 우리는 언제든지 급하게 생각 하지 않았다 하는 많은. 그러나 한 숙련 된 요리사 이 적합하지 않을때 수 있는 요리 기술 개선",4,283,"a dozen of our visitors Of course groups larger than normal size, such as normal prices that minseon kindly taught at the same time. We were in a big group with 40000 and KRW discount per person. E-mail and very responsive before class by providing minseon WeChat and train station pick-up service closest . She gave a lot of Korean food cooking time for a very happy horse. A lot of things we didn't think of in a time. But a skilled cook can improve his cooking skills when he is not fit."
Adam N,"는 minseon, 지식이 교사, 수 많은 한국 음식 에 대한 릴레이, 그대로 유지한 채 즐거운 재미있는. 클래스는, 우리는 몇 가지 요리를 함께 스테이플 요리, 맛있 었다 (팬케이크, 스튜 두부, 국수, 그리고 샐러드). 걸어서 시장과 일반적인 재료를 사용하여 후에 익혀 부엌, 나머지는 도움이 되며 국가. 나는 사람들에게 추천 할 의향이 중간 체 를 방문하는 한국. 몇 시간을 이렇게 많은 가치! (Ps minseon 에 대해 몇 가지 팁 채식주의자 및 권장 사항, 모든 직원들이",5,283,"minseon, knowledge teacher, relay on countless Korean food, fun while keeping it as it is. Class, we had a few dishes together: staples, delicious (pancakes, stewed tofu, noodles, and salad). Use the market on foot and general ingredients to cook later in the kitchen, the rest helpful and national. I am willing to recommend to people in Korea to visit the middle of the world. How many hours is worth so much! (Something in tips on vegetarians and recommendations for Ps minseon, all employees)"
Abagil2016,학습 내용에 갔다. 과자 김치. 선생님 이 매우 좋고 따뜻했어요. 그녀는 음식과 그녀의 설명에서 jenouros. 가격이 매우 합리적입니다. 클래스를 추천합니다. 나는 한국 문화를 체험하는 느낌 였던 것 같아요 자세히 정보 lernd.,5,283,"I went to the contents of the study. Snack kimchi. Teacher, it was very nice and warm. She is very reasonable in food and her explanation. Recommend classes. I felt like experiencing Korean culture. Details lernd."
murra142,"모든 사람들이 요리 실습 중간 체 minseon 에 뛰어나다. 나는 내가 하고 싶어 하는 요리 교실에 가기 전에 서울에 와서 엄마가 혼자 테스트를. 정말 좋은 경험이 될 것이다 하는 이 두 번 더, 한번쯤 한국식 디저트 의 다음 일부 한국 가정 요리. 나는 그냥 나의 네 번째 예약 클래스! 한국 음식을 즐길 수 있을 뿐만 아니라 요리를 하고 함께 megafeast, 요리 실습을 하기 전에 기존 시장 구경. 모든 공급 장치 구입처 minseon 공연을 볼 수도 있고 모든 조리법 의 샘플을 다른",5,283,"Everyone excels in cooking practice intermediate sieve minseon. Before I go to the cooking class that I want to do, I come to Seoul and my mom takes a test alone. It will be a really good experience. Two more times, maybe one more time, Korean dessert, and some Korean home dishes. I'm just my fourth booking class! Not only can you enjoy Korean food, but you can also cook and go to the Megafeast before you practice cooking. You can watch minseon performances where you buy all the supplies and sample all the recipes from other recipes."
jb3377,즐거운 재미있는 경험이었습니다. 유용한 정보 너무 좋은 선생님이었습니다. 우리는 좋은 음식과 에 가서 나중에 거대한 시장을 가지게. 강력 추천합니다.,5,283,It was a fun and interesting experience. The useful information was so good teacher. We go to good food and have a huge market later. I highly recommend it.
labergeludovic,"갈 수 있는 정보는 매일 레시피 요리를 할 수 있는 한국의 집 을 다시 한 번 (토론토, 캐나다) 및 딱 맞아 떨어졌어요. 선생님 이 매우 친절했고 그녀의 지원. 이것은 정말 좋은 구매하기 전에 로컬 시장 클래스 만들지 수 있습니다. 수업 후, 동네를 산책하기 좋아요. 나는 사람들에게 추천할 것이 좋습니다( 필요는 없습니다). 귀여운 것을 살 수 있는 요리법 레시피로 요리할 (돈을 구입하지 않는). 감사합니다 좋은 경험,",4,283,"The information you can go to fits perfectly with the Korean home (Toronto, Canada) where you can cook recipes every day. Teacher Lee was very kind and her support. It can create a local market class before making a really good purchase. After class, it's good to take a walk around the neighborhood. I don't need to recommend it to people. To cook (not to buy money) with a recipe for cute things). Thank you. Good experience."
Andy L,"우수한 호스트 및 좋은 선생님 이 minseon. 그녀의 집을 방문하는 것을 보고 경험을 즐길 수 있고, 물론 한국어 교육 현장에 대한, 그리고 재미 및 무엇을 먹고 만든 사장님에게 공개되어 난처한. 또 다른 하이라이트는 여행 시장이, 있는 놀라운. 지하철 역을 쉽게 만날 수 있는 것은, 하지만 할 시간입니다. 하지 않은, 요리 실습을 찾는 것은 쉽지 않고, 심지어 지도 제공. 멋진 활동 보여 줄 수 있는 몇 가지 관광객들에게 서울을.",5,283,"Excellent host and good teacher Lee minseon. You can see her visit to her house and enjoy the experience, and of course, it is embarrassing to be revealed to the Korean language education site and to the owner who made it with fun and food. Another highlight is the travel market, the amazing. You can easily meet the subway station, but it's time to do it. It's not easy to find a cooking practice that you haven't, and even provide a map. Seoul for a few tourists who can show great activities."
Innocent4ever,"마지막으로. 나는 내 친구 번체 한국식 요리 집에 참석했습니다. 선생님은 환자 도 정말 친절하고. 이 과정은 정말 스퀴지롤러에. 모든 재료를 요리해 자신을 준비할 수 있습니다. 결국, 최종 결과를 즐길 수 있는 식당에서 함께 테이블. 꼭 추천합니다!",5,283,"Lastly, I attended my friend's Korean restaurant. The teacher is very kind to the patient. This process is really on the squiggler. Cook all the ingredients to prepare yourself. After all, a table together in a restaurant where you can enjoy the final results. I really recommend it!"
shan0811,"나는 내 친구와 함께 하는 요리 교실 해 중간 체: ) 선생님, 아주 잘 도와주지 minseon. 음식도 맛있었다. 요리 교실을, 우리가 받은 선물 의 엽서 minseon -- (그녀는 친절하다.) 모든 방문객들이 요리 교실을 추천합니다.",5,283,"I do cooking class with my friend, Middle Che: ) Teacher, you're very good at helping. The food was delicious, too. Cooking class, postcard minseon -- (she's kind.) All visitors recommend cooking class."
mandeukc,"로컬 시장이 처음 이었다. 로컬 패이스트 시음, 허브 차를 마시는 방법을 저장 및 보고 있는... 이것은 정말 흥미로운. 힘든 여행은 아니어서 둘러보면 바로 앞으로 요리하는 스튜디오. 뒤 차, 요리 교실 시작! 아닙니다 어려운 단계를 수행합니다. 가장 마음에 드는 꽃과 함께 생각하기 (실제로 먹는) 콩 된연고. 가장 어려운 건지, 그녀는 (교사) 유지 방법을 보여주는 아름다운 꽃들과, 오른쪽 점 때문에 얻을 수 있습니다. Yeahhhhh!; ) 추운 날씨에 기다리고 있는 떡 에 맵 은 국수",5,283,"It was the first local market. Local paste tasting, saving and viewing how to drink herbal tea... This is really interesting. It's not a hard trip, so if you look around, it's a cooking studio. Back car, cooking class, start! No, I'm following difficult steps. Think with your favorite flower (actually eaten) bean paste. Most difficult, she can get it because of the beautiful flowers that show how to maintain it, and the dot on the right. Yeahhhhhh!;) Rice cake waiting in cold weather with spicy silver noodles"
hyrminlee,"나는 내 친구와 함께 하는 요리 교실을 도입하기 위해 독일어 중간 체 한국 음식 문화에. 그리고. 저는 아주 만족스러워 본 클래스에서 minseon: 문화 이해, 친구 만들기, 로컬 시장을 신선한 재료, 물론, 맛있는 음식을 직접 만들어. 이 클래스는 그녀의 가장 큰 것은 아니지만 그냥 보이고 앉아 있는 통신 및 행동. 요리를 하는 동안에, 한 사람인 것임을 치료 하면서 재료를 안내 // 튀김 / minseon 수 있습니다. 그리고. 저는 가장 마음에 드는 적절한 후 점심을 함께 한 한국식",5,283,"I want to introduce cooking class with my friend in German, medium, and Korean food culture. And. I've been very satisfied with this class, minseon: Understanding culture, making friends, making local markets fresh ingredients, of course, making delicious food yourself. This class isn't her biggest, but just sitting and communicating. During cooking, you can guide the ingredients while treating them as one person. And. I like the Korean style that I had lunch with the most after the most."
Simon G,"2개의 쿠킹 클래스가 한다, 날 요리 학교. 우리는 우리의 첫 방문 후에 올 수 없습니다. 완전한 기쁨 이고 우수한 교사 minseon. 첫 번째 클래스는 걸어서 통과하는 재료를 구입할 수 있습니다. 클래스를 더욱 더 많이 할 수 있는 번화한 시장에서 맛 테스트 제품 및 본. 요리와 조리 도 재미있었고 그인터렉티브. 우리는 무엇을 먹고 앉아 있는 체리 를 함께 했습니다. 다음 여행이 기다려지는 한국, 꼭 활동해 o, 요리 교실이나 다.",5,283,"Two cooking classes do, raw cooking school. We can't come after our first visit. Minseon, a great teacher with total pleasure. The first class offers materials for walking through. Taste Test Products and Bones in a busy market where more classes can be done. Cooking and cooking were fun and interactive. We ate something and sat down with Cherry. Korea, which I am looking forward to the next trip, make sure to all activities, cooking classes or o."
Idreamofdosas,"이것이 정확히 찾을 수 있기를 기대했던 건으로 서울에서 쿠킹 클래스. 로 시작하는 매력적인 시장인 라운드를 방황 에 가서 맛있는 요리 및 다양한 종류의 전형적인 홈 스타일 요리에서 명령 선택 취소합니다. 맛있는 점심 식사 후 다시 온 시장 지역 요리를 살 수 있는 집에서 음식을 다시 만들지 수 있습니다. 이곳의 하이라이트 중 하나에 있는 또 다른 날 수 있었으면 하고 서울의 과정에서 보다 자세히 minseon, 품위 있는 호스트 챈칭 관한. 고맙습니다 :-) .",5,283,"Cooking class in Seoul was what I expected to find exactly. Go to round, an attractive market starting with , and deselect commands from delicious dishes and a variety of typical home-style dishes. After a delicious lunch, you can re-create your food at home where you can buy local dishes again. I wish I could have another day in one of the highlights here. In the process of Seoul, more detailed about minseon, elegant host Chan-ching. Thank you :-)"
Kharybdis,"그래서 더 토라을 관광 웹 사이트를 통해 조직이 요리를 경험할 수 있었습니다. 나는 호기심을 자극하는 자입니다 기 때문에, 한국 음식을 요리하는 방법만 50 $? 친구, 입니다. 한국 가정 요리 교실에 등록됩니다. 저희는 잡채 파전, 한국 된장국, 불고기, 비빔밥 과. 중국에서 배운 중국어 minseon, 아니, 그녀는 그녀의 유창한 한국어로 (에 우리!) 그녀는 영어를 아주 유창하게 구사하고, 직원들이 정보이기 때문에 걱정하지 마세요! 그는 그녀를 지하철역에 일정, 이메일을 통해",5,283,"So the organization could experience cooking through The Tora's tourist website. I am a curious man. Because of that, how to cook Korean food is 50 dollars? This is my friend. It is registered in Korean home cooking class. We are Japchae Pajeon, Korean Doenjangguk, Bulgogi, Bibimbap. Minseon, a Chinese language learned in China, no, she speaks (e we!) English very fluently in her fluent Korean, and don't worry because employees are information! He sent her to the subway station on a schedule, via e-mail."
Nicoleng23,처음으로 연결하는 요리. 매우 유연한 minseon 협조적이었어요. 그녀는 우리에게 무엇을 할 수 있는 인내심 단계별. 우리는 모두 스스로 할 수 있어. 김치를 내어 방법을 20mins. 주변에 걸어서 갈 수 있는 방법을 경험한 것은 시장은 시장 이었다.,5,283,The first dish that connects. Very flexible minseon cooperative. She's patient step by step that can do something to us. We can all do it ourselves. It was the market that experienced a way to make kimchi and walk around 20mins.
Angela S,"만족할 수 없습니다 ""한식 디저트"" 클래스 수 있습니다. 아주 아주 잘 정돈 된 유익한 정보입니다.",5,283,"0I'm not satisfied. Korean dessert classes are available.It's very, very well-organized, informative information."
menlen,"제가 체크 아웃하는 3개의 요리 교실에 참여한 긍정적인 온라인 및 중간 체 읽어보기 로 했다. 나를 실망시키지 않았다 minseon. 그녀는 아주 협조적이고. 하고 나는 쇠고기 를 먹고, 그녀는 우리의 메뉴를 추가한 제 요청: 유리 국수와 야채 튀김. 그녀는 이런 달콤한 여자! 그녀는 모든 질문에 대답 하는 방식에 대해 모든 단계. 세 가지 요리를 만드는 참 맛있었어요! 점심 식사 후, 우리가 방문했던 시장 2: 시장은 시장이 일반 질좌포는. 허브를 이용한 많은 수의 사람이고, 저는 이 허브는",5,283,"I decided to read in a positive online and medium format that I participated in the three cooking classes that I check out. Didn't disappoint me, minseon. She's very cooperative. Then I eat beef, and she adds our menu: fried glass noodles and vegetables. She's such a sweet woman! Every step in the way she answers every question. It was delicious to make three dishes! After lunch, Market Two we visited: Marketplace is a general jiljwopo. There's a large number of people using herbs, and I think this hub is..."
adhere060504,"저는 여러 번 서울을 방문하는, 그런데 이번에는 특별한 이벤트를 확인하려고 서울, 중간 체 날 실망 수 없습니다. 그녀는 그보다 더 멋진 여성 minseon 은 한국 요리 경험 / 생각합니다. 그녀는 요리를 만들어 먹은 메뉴 / 조정할 수 있습니다. 정말 즐겁게 잘 짜여 있나 클래스! 저는 여행을 즐길 수 있는 지역 시장. 이것은 아주 좋은. 한국 전통 음식에 대한, 손으로 만든 재료는 소스. 왜 요리 교실을 참여한 중간 체 에 더 관심이 서울에 여행을 합니다.",4,283,"I visit Seoul many times, but this time, I can't be disappointed in Seoul to check out a special event. She thinks Minseon, a cooler woman than him, has a Korean cooking experience. She can adjust the menu she cooked. What a pleasantly organized class! I am a local market where I can enjoy traveling. This is very good. About traditional Korean food, hand-made ingredients are sauce. Why are you more interested in intermediate sieve with cooking classes?"
alohamiss858,우리는 운 좋게 할 수 있는 길거리 음식은 서울. 정말 친절하고 지식이 minseon. 이 클래스는 매우 잘 조직 되었고 매우 그인터렉티브. 절대적으로 맛있는 요리의 진수! 우리는 정말 즐길 수 있는 현지 시장. 이 독특하고 재미있는 경험을 적극 추천합니다. 않을 것이다!,5,283,We are lucky to do street food in Seoul. Very kind and knowledge minseon. This class is very well organized and very interactive. The essence of an absolutely delicious dish! We can really enjoy the local market. I highly recommend this unique and fun experience. I won't!
jasoncb87,"그녀는 매우 친절하고 어떤 전문가가 명확하게 minseon 않습니다. 요리 수업도 사실을 한 가지 추가해서 요리 및 정보. 이 클래스는 재미와 편안한 자세는 분명히 할 일도 있지만, 이 클래스에는 모든 수준기. 우리가 한 투어도 현지 시장은 기존의 흥미로운 새 도 함께 해봐.",5,283,"She is very kind and some expert is clearly not minseon. Cooking class also adds one more fact to cooking and information. This class has something to do with fun and comfortable posture, but at all levels in this class. For the tour we did, let's do the local market with the existing exciting new."
Jocelyn G,"여기에 클래스 2015년 11월 22일 - 너무 친절하고 따뜻하고 지식 minseon! 이 클래스는 즐거운 정말 즐겁고, 음식도 맛있었습니다! 그녀는 우리가 예약하기 때문에 요청한 변경이 일반 메뉴 어떤 요리. 강력 추천합니다!",5,283,"Here, class 22 November 2015 - so kind and warm and knowledge minseon! This class was really fun and the food was delicious! She asked for a change because we made a reservation for some kind of regular menu. I highly recommend it!"
Andy H,저는 항상 즐겁게 여행할 수 있는 비즈니스 지역의 경험. 미스 킴 실망시키지 않았다. 제가 느끼기에 너무나 안락하고 집에 환영해. 그녀의 영어는 매우 개인적 이 라 좋았어요. 요리하는 경험이 많은 음식은 아주 좋았습니다! 걸어서 갈 수 있고 나중에 즐겁게 시장 였는데 비가 왔어요. 나는 그녀의 모든 것이 다 있기 때문에 많은 것을 배우. 다시 한번 감사합니다!,5,283,"I always have a business area experience where I can enjoy traveling. Miss Kim didn't disappoint. I feel so comfortable and welcome home. I liked her English because it was very personal. The food that I had a lot of experience cooking was very good! I can walk there and it was a fun market, but it rained. I learn a lot because she has everything. Thank you again!"
Christine M,"제 남편과 저는 이 요리 교실 경험. 이 클래스는 굉장히 사랑스러운 그녀의 지원 및 잘 정리된 minseon. 편안한 오후의 유용한 정보 이었다. 이 요리는 누구에게나 강력 추천하는 경험, 경험이 풍부한 경험이 풍부한 주방에 두지, 모든 것을. 하는 느낌이 들지 않지만 여행객들이 멋진 오후. 클래스는 시장과 함께 놀라운 여행.",5,283,"My husband and I have experienced this cooking class. This class was useful information for her lovely support and well-organized minseon. This dish is highly recommended to anyone, in an experienced kitchen, everything. I don't feel like it, but a nice afternoon for travelers. Class is an amazing trip with the market."
Christine R,오래된 친구 같은 회의 회의 minseon. 그녀는 매우 조용하고 편안한 처리. 운이 좋게도 제가 느낀 느낌이 라기 보다는 덜 혼자 관광 및 고객 커뮤니티. 그녀를 매우 잘도 열려 있을 뿐 자신 질문. 공급업체 및 상인들이 이야기를 준비하는 방법에 대한 재료 사이에 차이가 있습니다. 제가 추천하는 진정한 관심이 있는 사람이 볼 수 있는 클래스에 조명입니다.,5,283,"old friendlike meeting minseon She's a very quiet and comfortable process. Luckily, I felt less alone in the tourism and customer community. She's very well open, but she's asking her own questions. There are differences in materials about how vendors and merchants prepare stories. It's a class that I recommend that people who are really interested see."
the-imagemaker,"제 남편과 저는 매일 클래스에 참석 한국 요리는 보통 8월에 일이 있어서 정말 좋았습니다. 사랑스러운 사람이 minseon 좋은 시간을 보내도록 해 주었고 음식과 다양한 배경 정보 배양물. 우리는 네가지 어서 편안하고 개인적인 경험을 하게 되었다. 이후 우리는 시장, 참 좋았습니다! 강력 추천하는 클래스를 시작할 수 있다는 멋진 여행을 경험한 한국 음식들이 한 해 입니다. 다음에 서울에 다시 올 때 (하는 모든 것들이 우리의 첫 번째). 또한, 그의 사진을 보낼 minseon, 최고의 서비스.",5,283,"My husband and I are attending classes every day, and the Korean cuisine was great because we usually had work in August. A lovely person made Minseon have a good time and food and various background information cultures. We had four quick, comfortable and personal experiences. Since then, we've been the mayor, it's been great! It is a year of Korean food that has experienced a wonderful trip to start a highly recommended class. The next time we come back to Seoul (everything we do is our first). Also, minseon, the best service to send his picture."
Meggie K,"은 선생님의 요리 교실 minseon 완전 사랑스런 그녀! 배우는 삼계탕 (쌀포도박 인형의 수프) 및 기타 여러 전통적인 한국 반찬 - 그녀는 이 방법을 가르쳐 주고, 그녀는 어느 정도는 역사적 배경 / 문화의 요리. 그런 다음 그녀의 투어에 갈 수 있는 식품 시장 주변, 좋은 사람이 너무 많은 것을 알 수 정보! 그녀는 아주 친절하고 우리의 여행 일정 (서울에서 제한된 시간). 자주 걸릴 때는 요리 교실 이 클래스는 분명 가장 저렴한 휴가... 특히 이 모든 것을 할 정도입니다! 제가 가장",5,283,"Eun teacher's cooking class minseon totally adorable girl! Actor Samgyetang (rice grape gourd doll soup) and several other traditional Korean side dishes - she teaches how to do it, and she is somewhat a historical background / dish of culture. Then around the food market where she can go on her tour, you can see that there are too many good people! She is very kind and our itinerary (limited time in Seoul). This class is definitely the cheapest vacation... Especially to the point of doing all this! I'm the most..."
