review,u_id,u_rate,p_id,review_en
"인상 적 이 ㄴ 역사 에 관심 이 있 다면 한국 의 문화 와 한국 을 꼭 박물관 이 ㅂ니다. 저희 는 아주 좋 은 한국 문화 를 설명 하 는 전시 의 개발 및 선명 하 게. 불행 하 게도, 대부분 의 설명 에 한국 이 ㄴ 전용.",MH ZH,4,3,"If you are interested in history during your impression, you must have a museum of Korean culture and Korea. We are developing and clear exhibition that explains very good Korean culture. Unhappily, most of 's explanations are for the exclusive use of 'ᄂ'"
"흥미로운! 저는 많은 것을 더 선호 하기 때문에 궁 궁 경복 국립 민속 박물관 민속 박물관에 더 한국인들의 일상을 보여줍니다. 한 표시를 할 수 있는 '라이프 의 한국인' 에 온 사람이 출생 에서 죽음의, 흥미로운 곳이 였습니다.",Quack H,4,3,"Interesting! I prefer many things, so I show more of Koreans' daily lives in the Palace, Gyeongbok National Folk Museum, and Folk Museum. It was an interesting place, from birth to death, that came to the ""Korean of Life"" where you could mark a sign."
좋은 방법이 한국 역사와 문화에 대한 자세한 정보 경복궁 에서 쉽게 찾을 수 있는 박물관. 입장료 에 포함되어 있는 티켓 없이 gyengbokgung. 박물관 주변 이었기 때문에 우리가 밖에 비가 오. 하지만 흥미로운 박물관 안에 있다.,Rima P,4,3,"A good way is to learn more about Korean history and culture. You can easily find a museum in Gyeongbokgung Palace. Gyengbokgung without the ticket included in the admission fee. It was around the museum, so it's raining outside. But it's in an interesting museum."
아주 좋은 좋은 박물관 영어로 설명해 무료 입장 팰리스를 방문한 후 gyeongbokung 손쉽게 액세스할 수 있습니다. 예쁜 정원에 있는 박물관. 오디오 가이드를 이용하실 수 있습니다,Principessacaro,5,3,Great Museum. You can easily access Gyongbokung after visiting the Palace for free by explaining in English. A museum in a pretty garden. Audio guides are available.
좋 은 아키텍처 많 은 흥미 롭 은 사실 한국 역사 에 대하 여. 하루 반나절 이상의 체크 아웃 을 하 ㄹ 가치 가 있 는,Wander_Lust1969,4,3,"Good architecture, many interesting things about Korean history. Check out for more than half a day."
"멋진 캡처 한국 사람들! 국립 민속 박물관 이 박물관은 경복궁 & 창덕궁 을 여행하는 동안 볏가을을. 유익하고 좋은 전시 에는. 내가 제일 좋아하는 곳이라 특히 의료진에게 의 전시 한국 시민. 한 어린이 박물관 중 많은 영어를 연결하지 않는, 아이들과 함께 갈 기회가 있다면 체크 아웃을 할 가치가 있습니다. 오래된 마을을 통과하여 매우 좋은 전시.",GachGal,4,3,"Cool capture! Korean people! National Folk Museum of Korea This museum has rice cake autumn during its trip to Gyeongbok Palace & Changdeok Palace. at a useful and good exhibition It's my favorite place, so especially to the medical staff, exhibition of Korean citizens. It's worth checking out if you have a chance to go with your children in a children's museum that doesn't have many English connections. A very good exhibition through an old village."
"아주 큰, 무료 입장 화려한 공원 박물관에 아주 멋지게 된다. 좋은 공원과 동일한 팰리스 결합할 수 있습니다. 또한 아이들의 일부가 박물관에 아이들이 더 재미있는 박물관 에서의 학습 중에 있을 수 있습니다. 카페와 기념품 가게는",annagrem,5,3,"It's going to be great for a big, free admission park museum. You can combine the same Palace with a good park. Also, some of the children may be studying in museums where children are more interesting. Cafes and souvenir shops."
꼭 봐야 하는! 환상적인 방법의 학습에 뭔가 한국 문화 이 아름다운 서울. 나는 믿는다 별도 요금이 포함되어 입력할 수 있는 기본 티켓 경복궁. 정말 좋았습니다! 매우 유익한 방문 라테스톤을!,kris g,5,3,"Must-see! It's a fantastic way of learning. Korean culture is beautiful in Seoul. I believe in Gyeongbokgung Palace, a basic ticket that can be entered with a separate fee. It was great! A very informative visit to Lateston!"
"눈! 정말 놀라운 장소, 날씨가 좋은 더 많은 시간을 더 즐길 수 있다. 가이드 투어를 하지 않는 이곳에서 좋은 사진은 모두 모이는 물론 읽기 볏가을을. 할 수 있는 멋진 건물에 있는 모든 각도의 사진. 이 곳은 건물 상호 팰리스. 강력 추천합니다. 제가 정말 좋아하는 곳이, 오래된 집, 마을에 한 설정, 만든다는 점에서 테러의!",Nins,4,3,"Snow! What an amazing place, you can enjoy more time with better weather. In this place where there is no guide tour, all the good pictures are gathered, as well as reading rice cake autumn. Photographs of every angle in a nice building you can. This is the Building Mutual Palace. I highly recommend it. The place I really like, the setting up of an old house, a village, that's what terror!"
매력적인 방문할 가치가 있는 이 어 져 있는 모든 역사 박물관을 한국 사람들이 하는 개괄적으로 소개하는 프레젠테이션 자료입니다. 저는 실망하지 않았다 의 정말 좋은 전시 에 또한 많은 수의 한국 학생들과 아이들이 볼 수 있는 곳이 진정한 관심을 보여 주는 관광객들. 직접 가보았을 아.,babaDADA,4,3,"This is a presentation material that provides a general introduction to all of these charming historical museums by Koreans. I am not disappointed by the really good exhibition of , and the places where a large number of Korean students and children can see are tourists who show real interest . I have been there in person."
"작은 박물관 한국을 처음 방문하는 경우, 시작하기에 좋은 위치입니다. 고대 한국인들의 삶을 엿볼 수 있을 것입니다. 기다릴 수 있는 가이드 투어, 또는 오디오 헤드셋 에 자신의 속도가 받을 수 있습니다. 헤드셋을 때, 프론트에 있는 사람이 있을 경우에 id id 정보를 묻는 메시지가 나타날 때까지 헤드셋 반환됩니다. 나갈때 박물관, 메인 게이트 탈출문 수, 또는 팰리스. 경우 통해 팰리스, 티켓 입력할 수 있어야 합니다. 티켓을 구입할 수 있는 모든 부크렛 주5 중 한 궁전과 그 주변에 투어는 및 근처에",sborrink,4,3,"Small Museum It is a good place to start when you visit Korea for the first time. You will get a glimpse of the lives of ancient Koreans. You may receive your own speed on the waiting guide tour, or on the audio headset. When the headset is used, if anyone is at the front, the headset is returned until you are prompted for id id information. Museums, main gate escapees, or Palace on exit. In this case, Palace, ticket entry must be possible. Tours around and around one of the five bucret states where tickets can be purchased are available."
흥미있는 장소 흥미로운 것들 안에 있다. 또한 경복궁 에 매우 가까웠습니다. 이 곳에 방문해야 할 때입니다.,purple,4,3,Interesting places are in interesting things. It was also very close to Gyeongbokgung Palace. It's time to visit here.
"좋은 사람 국립 민속 박물관은 한국 국립 박물관, 종로구 에 위치한 부지에 경복궁, 서울.",Hari Krishnaa,5,3,"Good People National Folk Museum is located in the National Museum of Korea, Jongno-gu, Seoul, Gyeongbokgung Palace."
인상적인 건물 건물이 아주 인상적인 그 계단 오르기 힘든 수 없습니다. 박물관 자체는 서울의 역사는 좋은 배경 정보 제공.,Nimrod K,4,3,"It can't be hard to climb the stairs, where impressive building buildings are very impressive. The museum itself provides good background information on Seoul's history."
"좋은 역사 및 문화 체험 부모님과 같이 방문하는 이 박물관은 같은 날 경복궁. 바로 내 별도의 입장료를 내야 한다 하지만 실제로 방문하는 제도가 각 월의 마지막 수요일 입장료. 흥미로운 전시 가 있는 야외 공간이 있지만 오두막 등 전통적인 마을의 실물 크기 모델과 비슷하다고 생각하는 이전에 방문한 제주 민속촌 박물관 여행같은, 큰 거래를 합니다. 할 수 있는 아이들의 공간을 가지고 있는 경우 어린 아이가 있거나 유희구. 마음에 드는 부분은 음악, 한국 사람들의 언어 의식과 의식. 아름다운 전통 의상 과 악기 를 (듣는",sunshinewallflower,3,3,"A good historical and cultural experience. This museum is visited by parents at Gyeongbok Palace on the same day. I have to pay a separate admission fee right away, but the actual visiting system is the admission fee for the last Wednesday of each month. There is an outdoor space with an interesting exhibition, but there is a big deal, such as a trip to the Jeju Folk Village Museum, which is similar to a traditional life-size model of a village, such as a cabin. If you have children's room to do it, you have a little child or you have a playboy. My favorite part is music, Korean people's language consciousness and consciousness. Beautiful traditional costumes and musical instruments."
편안한 장소 아주 좋은 위치. 경복궁 바로 옆 박물관. 주변의 나무와 식물이 많아. 좋은 관광 명소와 좋은 피크닉.,Linglin Z,4,3,Comfortable place. Very good location. Museum right next to Gyeongbokgung Palace. There are many trees and plants around. A good tourist attraction and a good picnic.
서로다른 종류의 박물관 국립 민속 박물관은 방문하는 다른 장소가 및 보존하고 여행할 수 있습니다. 하지만 좋은 약이 있는 의무 쳇발 다시 만든 거리와 한국인의 일상 생활 - 하는 것은 매우 흥미로운 볼 가치가 있는 여행,Gary M,4,3,Museums of Different Kinds National Folk Museums can be preserved and traveled to different places to visit. But the obligatory re-created streets with good medicine and Koreans' daily lives - a trip worth watching - are very interesting.
"예상대로 많은 아이템 들, 전통적인 한국 스타일이 보여주었다. 이 세상에서 내가 갔던 많은 박물관과 비교, 더 많은 제품들이 박물관을 기대하지는 않았다. 어쨌든. 나는 한국에 두 번이나 갔다. 이곳에 대한 감사합니다. 그래서 제 리뷰만 될 수 있다.",Paradee N,3,3,"As expected, many items, traditional Korean style, were shown. Compared to many museums I've been to in the world, more products were not expected of museums. Anyway. I've been to Korea twice. Thank you for this place. So it can only be my review."
멋진 건물들 이지만 창의성 표시되는 항목 이는 무료 박물관 연결된 사이트 메인 궁전. 사랑스러운 건물이고 작은 창의성을 정보 표시 여기된... 하지만 무료로 사용할 수 있는 것은 이해할 수 있는 충분한 영어 레이블 (무료 부크렛). 시간 방문하면 좋은 곳이 있어.,Gazzerk57,2,3,"Cool buildings, but creative items This is the free museum-connected site main palace. It's a lovely building and little creativity is displayed here. But what's free of charge is enough English labels to understand (free Booklets). There's a good place to visit in time."
"흥미로운 한국 역사! 데이 투어의. 우리는 서둘러 였는데 꽤 흥미 를 통해. 한국은 매우 다채로운 과거. 실제로 소리도 들을 수 있는 경우 들이 있고, 흥미로운 이곳!",Squeekie,4,3,"Interesting Korean history! Day tour. We were in a hurry and through quite an interest. Korea has a very colorful past. There are cases where you can actually hear sounds, and this is an interesting place!"
방문 팰리스 팰리스 박물관을 방문할 때 동시에. 나는 그 곳에서 처음 보 팰리스. 일부 역사 수업 교정 등 좋은 책.,Joey M,5,3,"At the same time as visiting Palace Palace Museum. I've never seen a Palace there. A good book, such as some history classes and proofreading."
좋은 경험이었다. 이 곳은 잘 짜여 있고 역에서 쉽게 액세스할 수 있습니다. 건물은 깨끗하고 작은 아이들이 있었는데 우리 활동을 저장합니다. 에서 다음에는 큰 공원. 아침 점심 때까지 여행하기 좋은 곳.,scotfitz,4,3,"It was a good experience. This place is well organized and easily accessible from the station. There were clean and small children in the building, and they save our activities. Next up is a big park. A good place to travel until morning and noon."
하는 궁전에. 추가할 경우 이 일상에서 즐거운 경험을 하게 할 때. 이 곳은 찾기 어려운 예술 작품들이 전 세계 어느 곳에서나.,Matt522,5,3,"In the palace. When you add it, you can have a pleasant experience in your daily life. Art works that are hard to find here are everywhere in the world."
"민속 박물관 아주 좋은 한국의 역사와 문화 보여 주는 박물관 이다. 2 특별한 표시가 있는데, 하나는 특정 영역을 강조 표시 입니다. 방문할 가치가 있는",Mark M,5,3,"Folk museum is a museum that shows great history and culture of Korea. 2 There is a special mark, one that highlights a specific area. worth visiting"
방문 할 만하다. 가장 흥미로운 박물관도 깔끔하다. 정보는 영어에 한가지 제시 멀리 온 배경 및 문화의 이해 한국 사람들.,suem030,5,3,"deserve a visit The most interesting museum is also neat. Information presents one thing to English. Understanding the distant background and culture, Korean people."
"한국의 문화의 맛! 나는 이 곳에서 몇 시간, 하지만 항상 철저하게 둘러보세요. 많은 것을 볼 수 있는, 충분한 시간이 어서 모든 것을 확인할 수 없을 수 있습니다. 한국 문화를 경험하기 원하는 사람들을 위한 최고의 장소입니다.",minimize940314,4,3,"Taste of Korean Culture! I'm here for hours, but always look around thoroughly. Enough time to see a lot of things may not be able to check everything quickly. It is the best place for people who want to experience Korean culture."
"경복궁 근처에 있는 민속 박물관. 경복궁 건물 안에 위치하고, 갈 수 있을 때 즐길 수 있는 궁전 방문이다. 꽤 흥미로운 박물관을 좋아한다면.",lalityaa,3,3,"A folk museum near Gyeongbokgung Palace. Located inside the Gyeongbokgung Palace building, it is a visit to the palace where you can enjoy it while you can. If you like pretty interesting museums."
거의 Gyeongbukgong 이 귀여운 민속 박물관 이며 궁에서 멀지 않다. 배우고 싶은 한국 역사에 대해 체크 아웃할 수 있고 상세한 기록을 추천하는 좋은 궁궐 은 한국을 아시아의 제국의 역사 나타내기 이 부분도 아이들이 박물관은 정말 친절한 곳,Prinster A,3,3,Almost Gyungbukong is this cute folk museum and not far from the palace. You can check out the Korean history you want to learn and recommend detailed records of the palace represents the history of Asian empires. This is also a very kind place for children to visit.
"박물관을 좋아하는 사람들, 꼭 가보세요! 나는 사람들을 사랑하고 나라를 방문하는 전통적인 문화 박물관을 볼 수 있는. 이 박물관은 실망 하지 않았어요! 저는 시간이 좀 더 있고 싶은 매력적인 한국 사람들의 이야기를 전시 했습니다. 학습 방법은 제가 정말 좋아하는 김치, 주요 문화 이벤트 및 어떻게 표시됩니다. 아이들의 공간에는 별도 (체험) 및 야외 빌리지에 를 꼭 격다! 그들은 시장이 있는 사람들이 생각하는 ""서울 부모님을 알고""내 나이 즉, 나는 비록 도 생각하지 않습니다 어떻게 생각을 하지 않을 수 없는 오래된 만큼이나 30년",Saranger,5,3,"0People who like museums must visit them. I can see a traditional cultural museum that loves people and visits the country.This museum isn't disappointed. I exhibited the stories of attractive Koreans who wanted to have more time.The way to learn is how to show my favorite Kimchi major cultural event and how it is displayed.In the children's space, they set up a separate experience and outdoor village, and they found out what the marketers think of their parents in Seoul, and that is, I don't even think about their age. Thirty years as old as one cannot help thinking."
"한국 문화 일요일에 아이들이 방문하는 박물관이 에요, 좋은 곳이다. 한국의 문화와 본 이야기. 박물관 에서의 gyeongbukgong 지역, 시간을 지출해야 할 때. 교육은.",sugiphang,4,3,"The museum that children visit on Korean Culture Sunday is a good place. Korean culture and the main story. Gyungbukong area in the museum, when you have to spend time. Education."
흥미로운 올 gyeongbukgong 걷는 동안 우리는 이 박물관을 우연히 발견 되었다. 흥미로운 예술과 주요 건물이 있는 것 밖에 보이는 것과 같은 전통적인 한국의 멋진 실물 을 갑니다. 빠른 방문할 가치가 있는 경우에 자신을 찾을 수 있는.,jandtpeters,4,3,"While walking in an interesting all gyungbukong, we came across this museum. We go to traditional Korean wonderful things like interesting art and what you can see outside of the main building. To find oneself in case one is worth a quick visit."
매우 현대적이고 풍부한 역사 박물관 나는 이 흥미로운 박물관이 우리를 실망시키지 않고 현대적인 구조. 근처에 들러 보고 2개의 완벽한 궁전에 이른 아침 산책하는 여행.,Brooke D,5,3,"Very modern and rich history museum. I don't want this interesting museum to disappoint us, but a modern structure. An early morning stroll through two perfect palaces after stopping by nearby."
"참조해야합니다, 바로 옆 gyeongbukgong 바로 옆에 있는 이 작은 민속 박물관에서 gyeongbukgong, 한국의 임페리얼 팰리스를 참조해야 합니다. 기억하지 않을 수 없는 거리에서 gyeongbukgong 또는 액세스할 수 있는 경우, 아닙니다 꼭 팰리스, 방황 하는 저를 먼저 팰리스 추천합니다, 다음에 오. 좋은 시간을 보낼 수 있는 민속 박물관에 있는 한 무리의 전통 문화 유물, 고대의 한옥, 그리고 - 60년대 스타일의 쇼핑 거리. 한국 문화를 아는 사람들은 한 때. 전체가 매력적인 박물관으로, 지식의 깊이에 따라 다른 것이",Sonia M,5,3,"You should refer to the gyungbuong, the Imperial Palace of Korea, in this small folk museum right next to gyungbuong. If you can't forget to remember gyungbukong or access to it, no. Palace, I recommend you to go to Palace first. Next time, oh. A group of traditional cultural relics, ancient hanok, and -60s-style shopping streets in folk museums where you can have a good time. People who know Korean culture once. The whole museum is an attractive museum, different depending on the depth of knowledge."
참조해야합니다 서울에 있는 최고의 것을 참조하십시오. 박물관은 오래된 전통적인 궁전은 크고 거대한 정원 bery. 여행중에 함께 가아드 변경 계획은 매우 볼 수 있습니다. 풍부한 역사 의식 및 박물관에서 드레스 flok 및. 그 동안 서울을 합니다.,Hessa H,5,3,"You should refer to the best in Seoul. The museum has a large and huge garden very. You can see a lot of plans for changing the Gaad together during the trip. Dress flok and in the rich historical consciousness and museum. In the meantime, I'm in Seoul."
"감동... 하지만... 하기 때문에 나는 이곳에 온 전쟁 기념관? 이 박물관은 아니지만 여전히 인상적인 전쟁 기념관 에 갔다 서울에 있는 첫 번째 박물관, 설정된 표준, 그건 정말 높은. 이 박물관에서 꼭 방문할 수 있는 모든 방법( 같은 경우에는 경복궁 이나 북촌 또는 samgecheonro). 또한, 국립 중앙 박물관 의 경우도, 다음에 한번 필요가 없습니다. 이 박물관 엔 프렉션 의 국립 박물관은, 그러나, 깊이 관련이 있기 때문에 단지 ""민족""기록.",flipinny,3,3,"0Impressed...But...So I went to the War Memorial of Korea, which is not this museum, but still impressive. The standard set for the first museum in Seoul is really high.For all the methods that can be visited in this museum, either Gyeongbokgung Palace or Bukchon or Samgechno.The National Museum of Korea also doesn't need to do it next time.But the National Museum of the Museum Enfiction is deeply related, so it's just a national record."
"할 정도로 이미 경복궁 을 방문하는 박물관에는 오래된 시간의 기록 및 일상 생활에 대해 전시회 입니다. 박물관은 경복궁 내에 위치한 곳의 벽은, 그곳에 들러서 박물관을 추천하고 싶다.",bbrandal,3,3,"The museum, which already visits Gyeongbokgung Palace, is an exhibition about old records of time and everyday life. The museum is located in Gyeongbokgung Palace, and I would like to visit there and recommend a museum."
훌륭한 박물관 아름다운 활동을. 압도적 인 작은 발생하지 않도록 합니다. 잘 선택 음들 잘 설명합니다. 야외 전시회 도 아주 좋은. 갔을 때는 입장료가 무료였습니다. 그들은 한 목판화 무늬찍기 표시됩니다. 다른 검은 쌀과 함께 카페에서 녹차. 화장실 시설도 좋아요. 두 시간 잘 보냈다.,fallfans,5,3,"Great museum. Beautiful activities. Avoid overwhelming small occurrences. Good selection notes explain well. The outdoor exhibition is also very good. The entrance fee was free when I went there. They are marked with a woodblock print. Green tea at the cafe with other black rice. Restroom facilities are good, too. I spent two hours well."
"정말 흥미로운 박물관 한국 문화에 관심이 있다면 및 생활 몇 년 전, 이 박물관 에 가서. 그 바로 옆에 서울에서 가장 큰 궁전, 가볼만한 가치가 있다. 박물관 에서 멀지 않은 한국 전통 옷 본 수도 있습니다.",Charlie N,5,3,"If you are interested in Korean culture and a few years ago, go to this museum. Next to it, the largest palace in Seoul, is worth visiting. You may have seen traditional Korean clothes not far from the museum."
"멋진 라이프 입니다 배울 수 제 남편과 저는 이 박물관 이 기 때문에 정말 좀 (많이 의 전시 에 영어) 일반적인 역사가 들 은 또한 영어를 연결할 수 있는 - 투어 가이드는 많은 정보의 그룹 및 농업 사용하는 방법이 밥 차 농민, 꽤 멋졌습니다. 계획을 1 - 2 시간 에, 새 전시 및 체크 아웃. 우리는 중국 에 대해 많은 것을 배우고 했을 때, 정말 멋진 휴식을 2월 적용할 수 있는!",Rach-SavoringSimple,4,3,"It's a wonderful life. My husband and I, because of this museum, are some of the most common historians, and the tour guide, who can also connect English -- how to use a lot of information groups and agriculture -- was pretty cool, Bob Cha, a farmer. Plan 1 - 2 hours, new exhibition and checkout. When we learned a lot about China, we could apply a really cool break in February!"
"역사는 제가 하비 - 이 곳은 방문 저는 한국의 역사와 이 곳을 보여 훌륭한 역사, 아주 좋은 입장료 없이 표시됩니다. 저는 이 곳의 아키텍처 설계.",maxrmit,5,3,"History shows the history of Korea and this place where I visit, and it shows the history of Korea and this place, and it is displayed without a very good entrance fee. I'm designing the architecture of this place."
"한국 예술 경험. 좋은 곳이고 손에 시험해 보고 있었어요. 볼 수 있는 마스크를 만들 수 있는 한국의 드라마틱한, 뿐만 아니라 성능입니다. 한국의 민속 댄스 댄스 레슨 을 할 수 있는 전통적인 음악. 정말 즐거운 시간.",M L,5,3,Korean art experience. It's a good place and I've been testing it on my hands. It is not only dramatic but also performance that can make a mask that can be seen. Traditional music for Korean folk dance lessons. A really fun time.
"모든 면에서 환상적 특히나 오디오 가이드도 좋아, 어디에 간 자동으로 를 멀리 이동 한다. 정말 감동 받았어요.",Celia A,5,3,"Fantastic in every way, especially audio guides, automatically move away from wherever you go. I was really touched."
"평균 좋은 곳에 위치, 하지만 가난한 전시회. 둘은 밖에서 안 보인다. 경우 제한된 시간, 방문할 곳을 선택한 이유 (e. g. 전쟁 기념관).",Magdalena M,3,3,"Located in a good place on average, but poor exhibition. The two are invisible from the outside. limited time, reason for choosing a place to visit (e.g. war memorial)."
