u_id,review,u_rate,p_id,review_en
명멍이,입장할때 엉덩이 모형에서 방귀가 나오는데 그 바람때문에 아이가 놀라서 울기 시작했다. 목젖부터 식도 위장을 지나는 체험통로는 재미있었지만 소장 대장 부분은 자칫 질식 위험도 있을수 있겠단 생각이 든다 부모가 주의를 해야할듯. 놀이터는 뭐 무난하다,3,303,"As I entered, a fart came out of my butt model and the wind surprised the child and began to cry. The experience passage through the throat and esophagus gastrointestinal tract was fun, but I think there could be a risk of suffocation in the small intestine, so parents should be careful. The playground is not bad."
406대현김,"일딴 위치는 쌈지길 내부에 있습니다. 쌈지길 팝업 스토어 이구요. 들어가는 입구 앞에서 아저씨가 오카리나 연주를 하는데 그 분위기에 휩쓸려 기분좋게 들어 가면......... 일딴 요금은 6000원인데 요즘 네이버에서 예약하고 가면 4800원에 예약하고 있구요. ""똥""을 주제로한 전시물들이..... 처음부터 나를 맞아 주는 엉덩이..... 그리고 변기에 가득차있는 리얼한 똥.덩.어.리들....ㅡ_ㅡ;;; 사실감이 넘쳐 ""우웩~~~~"" 할지도 모릅니다. 하지만 내부를 탐험하다 보면",5,303,"0The location is inside Ssamzie-gil.It's a pop-up store on Ssamji-gil.When you're playing ocarina in front of the entrance and you're swept into the atmosphere and you're in a good mood... ...The fare for Ilddan is 6,000 won, but these days, I make a reservation for 4,800 won on Naver.The poop-themed exhibits...The butt that greets me from the start...And real shit filled with toilets.-_-;;; may be full of realism.But as you explore the inside."
Margaretllc,Poo poo와 wee wee는 어린 아이들에게 가장 흥미로운 두 가지 요소입니다. 이 박물관에는 대자연의 요구를 설명하는 재미있는 접근법이 있습니다. 부모와 자녀를위한 환상적인 교육 활동!,5,303,Po poo and wee wee are two of the most interesting factors for young children. The museum has an interesting approach to explaining Mother Nature's needs. Fantastic educational activities for parents and children!
christianreistrum,아주 재미있는 곳! 우리 아이들 (4 & 9)은 사진을 찍고 소화 시스템을 탐험하는 데 많은 즐거움을 얻었습니다. 트립 어드바이저의 위치가 잘못되었습니다. 런닝 맨 옆에있는 SM 면세점에서 남쪽으로 약 250 명입니다!,5,303,What an interesting place! Our children (4 & 9) had a lot of fun taking pictures and exploring the digestive system. Trip advisor is not positioned correctly. About 250 people south of SM Duty Free at the very end of the run!
Rachel K Zhang,슈퍼 재미있는 방문! 한국인이 아닌 외국인을 위해 특히 쉽게 찾을 수 있습니다. 면세점 1 곳에 있습니다. 정말 좋은 경험으로 7 살짜리 아들을 데려왔고 그는 온 곳을 사랑했습니다. 주요 부분은 소화 시뮬레이션입니다. 실제로 재미 있고 꽤 교육적 이었지만 완료하는 데 약 10 분 밖에 걸리지 않습니다. 그래도 시간을 실제로 연장 할 수 있으며 핀으로 보상을주는 스 캐빈 저 사냥을 제공합니다. 운 좋게도 Runningman 건너편에 있으므로 시간을 보낼 수 있습니다 (어린 아이들에게는 좋지는,4,303,"Super Fun Visit! It is especially easy to find for non-Korean foreigners. It's at 1 duty-free shop. I brought my 7-year-old son with a really good experience and he loved the place he came from. The main part is the fire-fighting simulation. It was actually fun and quite educational, but it only takes about 10 minutes to complete. Still, you can actually extend the time and offer a pin-rewarding S Cabin Low Hunting. Luckily, it's across from Runningman, so I can spend time."
travelbug104,웃기에 좋은 바보 같은 재미있는 장소. 그것은 크지 않으며 군중없이 30 분 안에 쉽게 돌아 다닐 수 있습니다. 명백한 간판이없는 건물 내부이므로 찾기가 약간 어렵습니다. 당신이 근처에 있고 어리석은 오락을 원한다면 내 길을 벗어나지 말고 가치가 있습니다. 폐소 공포증이 있거나 작은 / 어두운 공간이 두려운 어린 아이들이있는 경우 입안의 터널을 통과하지 마십시오. 옆문을 통해 옵트 아웃 할 수 있습니다.,4,303,"A silly fun place to laugh. It's not big and you can easily get around in 30 minutes without a crowd. It's a little hard to find because it's inside a building without a clear sign. If you're nearby and want foolish entertainment, it's worth it without getting out of my way. Do not go through the tunnels in your mouth if you have claustrophobia or if you have young children who are afraid of small / dark spaces. You can opt out through the side door."
Celine T,"이곳은 SM Coex 바닥에있는 작은 유원지로 소화에 대해 배울 수 있습니다. 불행히도 일부 정보는 한국어로만 제공되지만 방문하고 탐험 할 때 가질 수있는 많은 사진 기회가 있습니다. 디스커버리 서울 패스는 입장료 1,000 원 할인으로 8000 원입니다. 또한 답안을위한 질문지 (영어)를받습니다. 공원에는 몇 명의 직원이 걸어 다니므로 사진을 찍을 사람이 필요한 경우 가능합니다. 근처에 사물함이 있습니다. 공원은 주로 사진 원근 전시회를 포함한 다양한 영역을 유쾌하게 걸어 다니며 각 영역에서",4,303,"This is a small amusement park at the bottom of SM Coex where you can learn about digestion. Unfortunately, some information is available only in Korean, but there are many photo opportunities you can have when you visit and explore. The Discovery Seoul Pass is 8,000 won with a 1,000 won discount. You will also receive a questionnaire (English) for your answers. There are a few people walking around the park, so you can take pictures if you need someone to take them. There is a locker nearby. Parks usually walk pleasantly through various areas, including photo perspective exhibitions, and in each area,"
claptrap_the_traveltrap,이런 젠장 똥 냄새와 똥을 똥을 볼 수 내가 예상했던 것처럼 똥이 아니었다.,5,303,Holy shit. You can see shit and shit. It wasn't shit as I expected.
MouseyCrox,"우리는 7 월 25 일에 방문했습니다. 그것은 층 중 하나에있는 고층 건물에있어, 그것은 아주 쉽게 찾을 수 있도록 모든 곳의 표지판입니다. Janggak 역 3 번 출구에서 1 호선 지하철을 타려면 3 분 정도 걸립니다. 가격은 7,000 원입니다. 아이들은 퀴즈 시트를받으며 그들이 좋아하는 모든 길을 채울 수 있습니다. 우리가이 매력에 대해 즐긴 것은 모든 방이 소변관을 설명하는 다른 방이었습니다. 탄력있는 공을 가진 방이 있었고, 탄탄한 성벽과 같은 창고를 통해 짜내 야했습니다. 일단",5,303,"We visited on July 25th. It's in a high-rise building on one of the floors, and it's signs everywhere so you can find them very easily. It takes about 3 minutes to take line 1 subway from Exit 3 of Jangak Station. The price is 7,000 won. Children can fill all their favorite paths by taking quiz sheets. What we enjoyed about this attraction was the other room that explained the urine tube in every room. There was a room with a resilient ball, and it had to be woven through a warehouse like a solid wall. Once"
alisontravelsasia,소년들을위한 훌륭한 장소. 너는 방귀를 어떻게 웃지 않을 수 있니? 이 작은 박물관을 방문하는 데 30 분 밖에 걸리지 않지만 재미 있습니다. 아이들은 그것을 좋아했습니다.,4,303,"a wonderful place for boys How can you not laugh at farts? It only takes 30 minutes to visit this small museum, but it's fun. The children liked it."
al22tecc,"이 일을 혼자서하는 일은 여기서 모든 노력을 기울일만한 가치가있는 것은 아닙니다. 그러나 우리는 달리기를 위해 이곳에 왔었습니다. 달리는 사람 옆에있는 토포 땅은 훌륭한 보완 물입니다. 이것은 ""푸우""라는 단어와 관련이있는 독특한 경험을 다룹니다. 이것은 실제로 트릭 아이 박물관의 다른 버전이지만 똥을위한 전용 버전입니다.",4,303,"0Doing this alone isn't worth every effort here.But we came here to run.The soil next to the runner is a great complement.It deals with a unique experience related to the word Pooh.This is actually another version of the Trick Eye Museum, but it's a dedicated version for poop."
Margareth T,그것은 똥의 세계를 탐험하는 독특한 경험이었습니다. 그것은 아이들을위한 정말로 멋진 장소와 성인을위한 재미있는 장소 다.,5,303,It was a unique experience exploring the world of poop. It's a really nice place for children and a fun place for adults.
Faraway42,"당신이 쉽게 기분을 상하게하는 경우, 이것은 당신을위한 것이 아닙니다. 이것은 이상한 사진들과 웃음이나 방귀에 좋습니다. 그들은 퀴즈가 거의 없지만 모두가 영어를 구사하는 것은 아닙니다. 그러나 배변이나 다른 방귀를 경험하는 것은 재미있었습니다. 그것은 훌륭한 실내 활동이고 집에서 이야기 할 것이 확실합니다.",4,303,"If you easily offend, this is not for you. It is good for strange pictures and laughter and farts. They have few quizzes, but not everyone speaks English. But experiencing bowel movements and other farts was fun. It's a great indoor activity and I'm sure we'll talk at home."
tvmtg,"우리는 우리 13, 7, 5 살의 용의 언덕 오두막집에서 여기에왔다. 내 13 살짜리 소녀가 전체 시간에 낄낄 거리는 것처럼 어린 자녀에게는 대단히 적절합니다. 완료까지 약 20 분이 걸리지 만 여행을 다시 완료 할 수 있습니다. 어리석은 그림을 찍는 장소의 제비 뽑기!",4,303,"We're here from our 13, 7 and 5 year old Dragon Hill hut. Just as my 13-year-old girl giggles all the time, it's very appropriate for a young child. It takes about 20 minutes to complete before you can complete the trip again. Draw lots for places where you shoot stupid pictures!"
Ernie Sandal,"우선, 나는 똥과 관련된 것을 웃어 넘기는 사람을 위해이 장소를 권하고 싶습니다. 엄청난 똥 이모티가 멋지게 보이고 어디에서나 신음 소리와 방귀 소리가 들립니다. ?. 당신이 똥을 좋아하고 그것에서 웃음을 얻는다면 이것은 모두 당신을위한 곳입니다.",5,303,"First of all, I would like to recommend this place for someone who laughs off something related to poop. A huge poop emoticon looks great and groans and farts are heard everywhere. If you like poop and get a laugh from it, this is all for you."
Aleksssa,"엔터테인먼트 가치가 높은 작은 ""박물관""입니다. 입장료는 9000 원. 토요일 오후, 이곳에는 가족들이 모여 들었습니다. 비록 내가 여기 혼자 왔지만, 나는 많은 재미를 보았다. 다른 사람의 사진을 찍기 위해 함께 데리고 오는 것이 낫습니다. 박물관의 위치는 최근에 새 위치로 옮겨 졌기 때문에 표지판에 표시되지 않았습니다. SM Duty Free 건물의 1 층에 위치 합니다만, 바닥지도에는 전혀 나타나지 않습니다. Alive Museum까지 걸어서 갈 수있는 거리에있어 쉽게 두 곳을 결합 할 수",5,303,"0It is a small museum with high entertainment value.Admission is 9,000 won.Families gathered here on Saturday afternoon.Although I came here alone, I had a lot of fun.It's better to bring someone together to take a picture of someone else.The location of the museum was not shown on the sign because it was recently moved to a new location.It is located on the first floor of the SM Duty Free building, but it does not appear on the floor map at all.It's within walking distance of Alive Museum, so you can easily combine the two places."
ckmc188,"우리는 그것이 쌈지길 쇼핑 블록에 있다고 생각 했으므로이 장소를 찾기 위해 애를 썼지 만, 2018 년 7 월 SM 면세 건물 지하로 이동했음을 발견했습니다. 그것은 구경하는 가장 싼 장소가 아니었다. 그러나 그것은 웃음으로 가득했던 기괴하고 초현실주의의 경험이었다! 통과하는 데 약 10-15 분이 걸리지 만 원하는만큼 여러 번 과정을 통할 수 있습니다. 우리는 저녁에 갔고 우리는 스스로에게 장소를 가졌습니다.",5,303,"We thought it was in the Ssamzie-gil shopping block, so we tried to find it, but we found that it moved underground to the SM Duty Free building in July 2018. It wasn't the cheapest place to see. But it was a bizarre, surrealistic experience that was full of laughter! It takes about 10-15 minutes to get through, but you can go through as many courses as you want. We went in the evening and we had a place for ourselves."
cpyourprofessor,"이 장소를 처음 보았을 때 처음 반응하는 방법에 대해서는 잘 모릅니다. 특히 어린 아이가 ""똥""이라고 말할 때 이상하지만 재미있었습니다. . . 하하하! 이 곳은 찾기가 어려웠다. Insadong을 걷다 보니 나는 그것을 보았다. 입구는 나쁘지 않다, 내부는 다른 색과 변좌에서 고무 똥으로 가득하다. 가격 $ 6.",3,303,"0I don't know how to react the first time I see this place.Especially when a young child said poop, it was strange but fun...Hahaha this place was hard to find.Walking through Insadong, I saw it.The entrance is not bad. The interior is filled with rubber shit in different colors and constants.Price 6.."
Christina S,"나는 Poopoo Land를 방문하는 것에 대해 (아마도 그렇게 지나치게) 찌르려했다. 그리고 언뜻 나는 실망하지 않았습니다. 입구는 거꾸로 걸을 수있는 큰 뒷면으로 장식되어 있으며, 짧은 계단이 각각의 발걸음으로 다양한 방귀 소리를냅니다. 그러나 이것은 소화관을 통해 10 분간 여행을하면서 돈을 쓰지 않는 아이들을 대상으로합니다. (매력의 일부는 완전히 어둡고 단단한 짜임새입니다. 밀실 공포증 및 / 또는 어둠을 두려워하는 경우 문제가 될 수 있습니다.) 끝 부분의 ""콜론""슬라이드 아래로",3,303,"0I was probably so over-stabbed about visiting Poopoo Land.And at first glance, I wasn't disappointed.The entrance is decorated with a large backside that can walk backwards, and the short steps make various fart sounds with each step.However, it targets children who do not spend money while traveling through the digestive tract for 10 minutes.Part of the attraction is a completely dark, rigid fabric.It can be a problem if you are afraid of claustrophobia and darkness.Below the colonslide at the end."
Wendy P,나는 개인적으로 재미 있고 유머러스 한 곳으로 이곳이 작고 활동이 짧으며 15 분 안에 끝날 것입니다. 나는 개인적으로 뭔가를하고 싶다. 이것은 나를위한 것이 아니다.,3,303,"I'm personally a fun and humorous place, which is small and short and will be finished in 15 minutes. I want to do something personally. This is not for me."
badcarissa,"이 매력의 매력 중 일부는 쉽게 볼 수 없다는 것입니다. 주말 (주말) 보행자 전용 구역에서 약간의 쇼핑 플라자에 있습니다. 한 번 발견 되더라도 적절한 장소임을 확신하는 데 약간의 시간이 걸립니다. (공평하게 말하면 : 내가 아는 모든 것을 위해 ""PooPoo Land this way""라는 큰 신호가있을 수 있습니다. 방귀를 낄낄 거리는 아이들과 어른들에게 좋습니다. 재미있는 똥 / 방귀 / 화장실 사진을위한 많은 역이 있습니다. 그것은 거대하지 않습니다 - - - 우리가 알았 더라면, 아마",3,303,"0Part of the attraction is that it's not easy to see.It's in a little shopping plaza in a pedestrian zone over the weekend.Once found, it takes some time to be sure it's the right place.To be fair, there could be a big signal called PoPoo Land this way for everything I know.It's good for kids and adults who are farting.There are many stations for fun poop fart toilet pictures.It's not huge.    Maybe if we knew more."
KpopFairy,우연히이 곳을 우연히 발견하고 한 시간을 죽이는 좋은 방법! 방귀 소리를 내며 큰 엉덩이 모양의 문으로 들어서십시오. 미묘한 것은 아닙니다. 놀이 공원의 매력처럼 구조화되어 있습니다. 처음부터 끝까지 전시장을 걸어 다닙니다. 일단 통과하면 다시 돌아올 수 없습니다. 전체 경험을 통해 웃으면 서 멈출 수 없었습니다. 가장 중요한 부분은 너겟이되고 장을 통해 움직이는 음식을 시뮬레이트하기위한 장애물 코스를 통과하는 것이 었습니다. 끝이 굉장한 슬라이드가 있습니다. 싸구려 스릴과 매우 저렴한 가격!,5,303,"A good way to accidentally spot this place and kill an hour! Enter through a large butt-shaped door with a fart. It's not subtle. It's structured like the attraction of an amusement park. I walk around the exhibition hall from beginning to end. Once you pass, you can't come back. I couldn't stop laughing through the whole experience. The most important part was to pass the obstacle course to simulate nuggets and food moving through the bowels. There's a great slide at the end. Cheap thrills and very low prices!"
PaulinKa_traveller,"나는 Poo Poo Land가 정말로 우스운 장소 다라고 생각한다. 그러나 만일 당신이 천천히 가고, 재미를 빨리 거기에 가기 바란다. 작은 아이들은 위험하고 지루할 수 있기 때문에. 똥똥이 토지 농사는? miesznym miejscem, ale trzeba tam i ?? 라노.",4,303,"I think Po Poo Land is a really funny place. But if you go slowly and have fun there quickly. Because small children can be dangerous and boring. What about the shit land farming? miesznym miejscem, ale trzeba tom i? lano."
Okarahan,아이들을위한 즐거운 장소. 사실 그것은 내부가 상당히 좁고 이동하기가 어렵습니다. 특히 혼잡 한 경우 특히 그렇습니다. 그러나 아이들은 즐겁게 지내고 있습니다. 위치는 쉽게 접근 할 수 있습니다. 미술관이나 역사상 특별한 점이 없기 때문에 입회비는 훨씬 적습니다.,3,303,"a pleasant place for children In fact, it's quite narrow inside and difficult to move around. This is especially true in the case of course. But the children are having fun. The location is easily accessible. The membership fee is much lower because there is nothing special about art galleries or history."
attyjpnabua,"아이들은 정말 마음에 들어요! 너무 나쁜, 활동을 할 수가 있는 분. 가격이 합리적인 가격에 방문 합니다.",3,303,"I love the kids! Too bad, someone who can be active. I visit at a reasonable price."
tumbleweedchris,"저는 이 에 대해 보고 무엇을 한 것이 다. 많은 힌트가 되지 않은 어떤 온라인 및 웩키 재미 같았다. 웩키 계속 되는, 조금 실망했습니다. 박물관은 매우 짧은. 방귀 소리는 작고, 심하게 번역 (아마 있게 funnier) 지혜 똥, 사진 촬영 이 있었습니다. 이 장관 있는 생태적 트레일인 여행 하는 친구들이 다시 머리에 공을 버리는 연습으로 어두운 복도 에서. 결국, 나가 근처에 있는 세로 슬라이드. 약 15 20분이나 관광지가 끝 입니다. 이 확인할 정도로, 많은 기대를 하지 않지만.",3,303,"I've seen this and done everything. It was like some online and swaggy fun that wasn't a lot of hints. I'm a little disappointed. The museum is very short. The farts were small, and there was a lot of translations (probably funnier) of wisdom poop, photography. In the dark hallway, with Lee's ecologically-trail friends practicing throwing the ball back to their heads. After all, the vertical slide near me. About 15 to 20 minutes of sightseeing is over. To confirm this, I don't expect much."
John M,저렴한 가격이 니. 장기 체류 하지 않습니다. 하지만 그 웃음. 재미있는 사진을 찍을 수 있는. 슬라이드에 있는 스릴. 그는 가방을 제공하지 않습니다 수 있는 라커에 문제점을 각. 아이들은 5 시 사용할 수 없습니다.,5,303,It's a low price is low price. I'm not staying for a long time. But that smile. You can take funny pictures. The thrill on the slide. He doesn't provide bags. I'm going to have a problem with a locker. Children can't use it at 5 o'clock.
Laura C,"이 어리석은 우리의 인사동에 박물관과 가까워서, 쇼핑 몰 에 숨겨져 있다. 갈 수 없다면 웃음 의 배설물이 있는 곳은 아니나 방귀. 경우 가 존재하지 않는 것을 안다면 이 트립어드바이저 첫 발견하지 못했다. 좁은 공간이 싫어 어두울 수 없는 즐거운 시간을 "" 여행 시스템을 통해 침지의. "" 저렴한 모든 및 모든 정말 낄낄 거리 다.",4,303,"0Close to the museum in this foolish Insadong, it is hidden in a shopping mall.If you can't go, it's not a place with the feces of laughter, but a fart.This TripAdvisor was the first to be discovered if you knew it did not exist.A sleeper through a travel system for a fun time that cannot be dark because of the narrow space.All the cheap stuff and all the real giggles."
Bigg F,정말 놀라운! 정말 즐겁고 가벼운 마음으로 가치가 있었어요. 슬라이드에 아주 좋았습니다. 이 있었지만 아주 재미있기도 하고 기괴한 한 멋진 곳! 어떤 젊은 두 아이들이 우리의 사랑 하고 싶습니다,5,303,"What a surprise! It was worth it with such a pleasant and light heart. It was very good on the slide. There was this place, but it was very fun and bizarre! Some young two children want to love us."
