u_id,review,u_rate,p_id,review_en
yangcho0311,저번달에 아주 오랜만에 다시 방문. 10년만에 재방문인데 그사이에 카페나 작은 상점 옷가게가 눈에 많이 띄었다. 서울내에 한옥건물 제발 보존 해주세요,5,311,"I visited again last month after a long time. It's been 10 years since I visited again, and in the meantime, many cafes and small shops and clothing stores stood out. Please preserve the Hanok building in Seoul."
Alpertbyun,삼청동길 한옥건물들을 볼수있는 거리중 한곳 다만 예전에 비해 상권이 많이 없어졌어요.. 그래도 걸으면서 구경하기에는 좋아요.,3,311,"One of the streets where you can see the Hanok buildings in Samcheong-dong-gil, but the business district has disappeared more than before. But it's good to walk and watch."
Lee Yeyoung,이 곳에서는 기와나 목재 등을 이용해 한국의 전통적인 느낌을 살린 현대식 건물이 많아서 이색적인 도시 풍경을 감상할 수 있다. 걷기만 해도 재미있다.,5,311,"There are many modern buildings that use tiles and wood to enhance the traditional Korean feeling, so you can enjoy the exotic urban landscape. Just walking is fun."
HKKim,삼청동 팥죽 맛집 '서울에서 두번째로 맛있는 집'을 찾아 가면서 삼청동 메인거리를 걸으면서 곳곳에 임대 표시가 되어 있는 빈 가게들이 너무 많이 생긴 것을 보고 놀랐다. 이곳도 젠트리피케이션 때문에 자영업자들이 어려움을 겪고 있는 것 같은데 우리나라 대표적인 관광지인 궁 인근에 있어 우리나라 전통 공예품을 판매하는 상가들이 번성하면 좋을텐데... 아쉬움이 너무 컸다.,3,311,"I was surprised to see so many empty shops with rental signs everywhere as I walked along the main street of Samcheong-dong while visiting Samcheong-dong's second most delicious restaurant in Seoul. It seems that self-employed people are having a hard time here because of gentrification, but it is near the palace, one of the most popular tourist destinations in Korea, so it would be nice if stores selling traditional Korean crafts could flourish. It was too much to be desired."
Kylie Park,예전엔 갈만한 식당과 카페를 줄줄이 알았는데 요즘은 정보가 없다. 그래도 갈때마다 옛 추억때문인지 정겹고 좋았다. 사람이 많이 없어서 여유롭게 가기 좋은 곳.,3,311,"I used to know a lot of restaurants and cafes to go to, but I don't have any information these days. But whenever I went, it was nice and friendly because of old memories. A nice place to go because there are not many people."
ahirity,"퇴근 후 데이트코스로 좋은 길입니다. 비교적 중심부에 위치해 있으며, 저녁에 데이트 목적으로 방문하는 분들이 많습니다. 정독도서관부터 시작해 식사 후 걷기에도 괜찮습니다.",4,311,"It's a good way to go on a date course after work. It is relatively central, and many people visit for a date in the evening. After dinner starting with the Jeongdok Library to walk, all right."
triphyun,삼청동길 방문한지 얼마 되지않았어요. 길은 좁고 다니기 불편하지만 한옥들이 몰려있고 한옥카페를 즐길수있어 좋았습니다. 더군다나 루프탑의 카페가 많아 좋았어요. 여유를 제대로 느끼실수있습니다. 그리고 수제비집 유명해요 꼭 방문해서 드셔보시길.. 짱맛,5,311,"It hasn't been long since I visited Samcheong-dong-gil. The road is narrow and uncomfortable to walk around, but it was nice to enjoy the Hanok cafe with a lot of Hanok. Furthermore, it was good because there were many cafes on the rooftop. You can feel relaxed. And the sujebi restaurant is famous. Make sure you visit and try it. super flavour"
194ren,"외국인이 많이 찾아오는 삼청동길, 주말에는 국내 여행객들까지 있어 걷기 힘들때도 있다. 인기있는 골목길 말고 조용하게 산책할 수 있는 코스도 있으니 잘 찾아보면 좋다.",3,311,"Samcheong-dong-gil, which is visited by many foreigners, is sometimes difficult to walk because there are even domestic tourists on weekends. There are other courses where you can take a walk quietly rather than popular alleys, so you can look for them carefully."
민정 김,봄되면 꼭 가는 삼청동. 곳곳에 예쁜 상점들도 있고 맛있는 한식집이 많다. 사진찍기도 좋고 그냥 산책하는 것만으로도 기분 좋은 곳!,4,311,Samcheong-dong is a must-go place in spring. There are pretty shops everywhere and there are many delicious Korean restaurants. It's nice to take pictures and just take a walk!
공쥬님,데이트 장소로 추천받는 곳들 중 하나로 다양한 볼거리와 음식들이 있는 곳입니다 여기 떡볶이 집이 아주 유명하여 줄을 섭니다,4,311,"It's one of the places recommended for a date, with a variety of things to see and eat. This tteokbokki restaurant is very famous, so we're lined up."
KIM Gyunghee,예전에 명성은 아직도 있을지 모르겠지만 너무 유명해져서 되려 지금은 너무 안 좋아진 곳이죠. 북촌한옥마을로 올라가는 길과 연결되어 있어요.,2,311,"I don't know if I still have a reputation in the past, but it's become so famous that it's now so bad. It's connected to the road leading to Bukchon Hanok Village."
Roah_CA,크게 볼거리는 없지만 골목 구석구석 다니다 보면 예쁘고 아기자기한 가게들이 많이 있어요. 맛집들도 제법 있고요. 스타벅스 매장도 크게 있습니다.,4,311,"go around every corner of the alley, though it's not much to see There are many pretty and cute shops. There are quite a few good restaurants. There is also a big Starbucks store."
gingertea,삼청동의 유니크한 거리 풍경이 있었는데 지금은 뻔한 가게들과 상점들이 즐비해서 예전 느낌이 사라졌습니다. 이런 곳은 제발 프랜차이즈가 들어오지 못하게 막았으면 좋겠어요.,3,311,"There was a unique street scene in Samcheong-dong, but now there are many obvious shops and shops, so the old feeling is gone. I hope you can stop franchises from entering these places."
kururung,"와이프와 추억을 쌓고자 삼청동을 방문하고, 수제비도 먹고왔네요. 역시 맛집이라 그런지 기다리는 사람들도 많아서 기다렸지만, 기다린 만큼 맛있게 먹고 왔네요.",5,311,"I visited Samcheong-dong and ate sujebi to make memories with my wife. As expected, there were a lot of people waiting because it was a good restaurant, but I enjoyed the food as much as I waited."
seongeun y,프랜차이즈 업체의 등장과 함께 너무 비싼 임대료 탓에 이전과 같은 활기를 잃어가는 곳으로 고즈넉한 옛 모습이 그리운 지금은 조금 아쉬은 곳이다. 그래도 이곳에 음식점들이 많이 있으니 경복궁을 관람하고 찾는다면 즐거운 식사와 함게 좋은 시간을 보낼 수 있을 것 같다.,3,311,"With the advent of franchisees, it is losing its vitality as before due to the high rent, and now it is a bit of a shame to miss the quiet old look. Still, there are many restaurants here, so if you visit Gyeongbokgung Palace, you will have a good time with a nice meal."
Jinny MC,북촌에서 무작정 걷다가 길을 잃은 줄 알았으나 또 다른 보물을 찾은 듯 삼청동길이 나타났다. 북촌과 비슷한 듯 하나 먹거리에 좀더 특성화가 된 듯 하다. 여기저기 길을 길게 선 음식점들이 정말 많다. 나중에는 배고플 때 가고 싶다.,5,311,"I thought I was lost while walking in Bukchon, but Samcheong-dong-gil appeared as if I had found another treasure. It looks like Bukchon, but it seems to have become more specialized in food. There are so many restaurants here and there that have a long road. I want to go when I am hungry later."
대성 정,10년전에 인기가 많다가 외부사람이 너무 몰리고 다른 곳들이 인기 끌면서 수준이 내려갔는데 오랫만에 찾으니 많이 정돈된 느낌이다,4,311,"Ten years ago, it was very popular, but it was so crowded, and other places became popular that the level went down, but now that I'm looking for it after a long time, I feel very organized."
JUNOH L,사람들이 많았지만 거리가 아기자기하고 이뻤던 것으로 기억한다. 왜 데이트코스로 좋다고 하는지 알게되었던 지난날 이었던 것 같다.,5,311,"There were many people, but I remember the street was cute and pretty. I think it was a long time ago when I found out why it was good for a date course."
pic_bd,"예전에는 서울 데이트 코스로 한창 주목받았고 또한 인기도 엄청 났지만 현재는 많은 상업화와 성수동, 익선동 등에 밀려나는 중. 예전엔 서울사람들의 데이트 코스였다면 현재는 경복궁을 여행온 여행객들이 그 자리를 대신하고 있다.",3,311,"It used to be a popular Seoul dating course, but now it is being pushed to many commercialization and Seongsu-dong and Ikseon-dong. In the past, if it was a date course for Seoulites, now tourists who traveled to Gyeongbokgung Palace are taking the place."
Mark Yang,"예전에는 특색있는 소규모 가게가 많았는데. 그후에는 대규모 중국인 관광객들때문에 매우 지저분해 졌다가. 요즘은 오히려 많이 정돈된 느낌입니다. 서울에서 가볼만한 지역입니다. 삼청동 수제비, 서울에서 두번째로 맛있는집 두 식당은 매우 좋습니다",4,311,"There used to be a lot of unique small shops. After that, it became very messy because of the large Chinese tourists. These days, I feel a lot more organized. It's a good place to visit in Seoul. Samcheong-dong Sujebi, the second most delicious restaurant in Seoul, is very good."
muzicrabeat,"걷기 좋고 조그맣고 운치있는, 특색있는 가게들이 많아서 방문하기 좋다. 항상 가면 너무 예쁘고 또오고싶은데 자주 안가게되는것은 교통의 불편함........",4,311,"It is good to visit because there are many shops that are good for walking and small and elegant. It's always so pretty and I want to come again, but I don't go often because of the inconvenience of traffic........"
Mikyung J,걸어다니면서 즐비한 식당 카페 보는 재미도 있고요 성대 뒷산으로도 연결돼서 성대 통해 혜화까지 걸어서 천천히 산책할 수 있어요. 식당은 많은데 명성만큼은 아니라고 생각하고요. 흠.,4,311,"It's fun to walk around the restaurant and the mountain behind your vocal cords, so you can walk slowly to Hyehwa through your vocal cords. There are many restaurants, but I don't think it's as famous as it is. Huh."
석환 윤,요즘 같이 날씨가 좋은 주말에 가족과 가벼운 산책을 즐기기에는 최고의 장소인듯합니다. 또한 인근에 맛집도 많이 있어 즐거움이 배가 됩니다.,5,311,"These days, it seems to be the best place to enjoy a light walk with your family on a nice weekend. Also, there are many good restaurants nearby, so the pleasure doubles."
kpcooldawg,동네가 너무 이뻐서 사진찍기 정말 좋은 곳! 어디서 찍어도 걍 인생샷 나올듯. 아기자기한 샾들도 많고... 요즘같은 날씨에 데이트하기 정말 좋은곳 :),5,311,"The neighborhood is so pretty that it's a great place to take pictures! No matter where I take it, it'll be my best shot. There's a lot of cute boys. A great place to date in this weather :)"
missgoooo,현대적인 건물이 많이 들어서는 시대에 우리 전통가옥들이 유지하고 있는 곳이에요 그래서 갈때마다 설레이네요 아기자기한 상점들이 즐비하고 맛있는 음식과 차들이 많아요,4,311,"It's a place that our traditional houses maintain in this era of a lot of modern buildings, so I get excited every time I go. There are lots of cute shops, delicious food and cars."
Walkerxoxo,아기자기한 가게들이 많이 있는 삼청동길. 여기서 밥 먹으면 비쌀 거 같다는 이미지가 있긴 하지만 은근 저렴히 먹을 수 있는 곳도 많습니다! 요즘은 한복 입고도 많이 가는 거 같더라구요 ㅎㅎ,4,311,"Samcheong-dong Road with many cute shops. Some people think that it will be expensive to eat here, but there are many places where you can eat cheaply! I think I go there a lot in Hanbok these days. Haha"
Sungeun J,"삼청동 역시 젠트리피케이션으로 식상해지긴 마찬가지. 삼청동 메인 스트리트는 인도와 차도가 너무 좁아 오가기 불편하고, 볼 매장이나 음식점, 카페들도 별로 없습니다. 뒤쪽으로 들어오셔야 그나마 구경할 것들이 좀 있어요! (불평하지만 자주는 갑니다.)",4,311,"Samcheong-dong is also boring due to gentrification. The main street of Samcheong-dong is so narrow that it's inconvenient to come and go, and there aren't many ball stores, restaurants, and cafes. You have to come in the back to see some things! (I don't like it, but I go often.)"
Sujin S,친구와 연인과 가족과 언제든지 가도 좋은 곳. 단점은 괜찮은 카페는 많지만 '밥'을 먹을만한 곳이 별로 없음.,5,311,"Anywhere you can go with your friends, lovers, and family. The downside is that there are many good cafes, but not many places to eat 'rice'."
코츠월드,도심속에 위치하고 있지만 서울의 옛 정취를 느끼기에 아주 좋은 곳 입니다. 공원도 있고 예쁜 가게도 많아요,5,311,"It is located in the city center, but it is a great place to feel the old atmosphere of Seoul. There's a park. There's a lot of pretty shops."
ᄌ ᄀ,아기자기한 스토어들이 많아 구경하기도 좋고 쇼핑하기도 좋아요. 특색있게 만들어진 거리라 더 좋았습니다.,4,311,"There are many cute stores, so it's good to look around and shop. It was better because the street was made with unique features."
용마사,경복궁 근처에 있어요~ 길이 아기자기 하니 볼거리도 많고 쇼핑하기 좋아요~ 맛집도 많아서 친구들과 구경하기 좋아요,4,311,"It's near Gyeongbokgung Palace. It's nice to see many things to see and shop around the street. There are many good restaurants, so it's nice to see with friends."
Bora Y,한국 기와집을 그대로 유지한채 내부만 인테리어 햇기 때문에 한국스러움을 느낄 수 있습니다. 음식 맛있는 곳도 많구요,5,311,You can feel the Koreanness because the interior of the tile-roofed house is kept intact. There are many good places to eat.
luvvparis,요즘은 너무 유명해져서 사람들로 북적이지만 그나마 평일에 가면 구경할것도 많고 맛집도 많아서 좋아요,4,311,"These days, it's so popular that it's crowded, but I like it because there are many good restaurants and things to see on weekdays."
Chocogodiva,"작은 건물들이 모여 있는 길입니다. 근처에 청와대가 있어 건물들을 크기 짓지 못해 지금 까지 옜모습을 간직 하고 있어, 구 서울의 모습을 느끼고 싶은 분들께 추처드립니다. 외국인 친구들도 그런 모습에 반해 매우 좋아 했습니다.",5,311,"It's a road of small buildings. As Cheong Wa Dae is nearby and the buildings have not been built in size, it has been preserved so far, so I recommend this to those who want to feel the former Seoul. Even foreign friends liked it very much."
SONG E,"길도 동네도 예쁘고 사진찍기에도 좋아서 가끔 가지만 주차하기 힘들고, 음식점들은 사람이 많아서 대기시간 길고 가격도 대체적으로 비싸요.",3,311,"The streets and neighborhoods are pretty and nice to take pictures, so sometimes I go there, but it's hard to park, and restaurants have a lot of people, so the waiting time is long and the price is generally expensive."
jinlee0201,특이한 소품들과 예쁜 거리를 보여주러 외국인 친구들이 한국에 오면 데리고 갑니다. 모두 좋아들 해요.,5,311,I take my foreign friends to Korea to show them some unique props and pretty streets. Everyone likes it.
choichoi123,근래엔 관광객들로 미어터져 다소 낭만을 잃었지만 그럼에도 한옥식 가옥들과 나름 꾸며진 식당들을 구경하며 걷기 좋다. 주차는 지옥이다.,4,311,"Although it has lost some romance in recent years due to the crowd of tourists, it is still good to walk around hanok-style houses and its own decorated restaurants. Parking is hell."
J J,전형적인 관광지로 바뀌어 옛날 특색이 사라졌다. 가게는 너무 비싸고 감당할 임차인은 많지않다.,3,311,"It has been transformed into a typical tourist destination, and its old features have disappeared. The store is too expensive and there are not many tenants to afford it."
Ju-yeon Y,요즘 상업적으로 변한 것도 있지만 여전히 독특한 분위기의 상점과 한옥 퓨전 건축들이 눈길을 사로잡아요!,5,311,"Although it has changed commercially these days, shops and hanok fusion architecture are still eye-catching!"
인경 전,"삼청동길이 예전 같진 않지만 그래도 여전히 맛있는 수제비, 단팥죽 집이 있으며, 새로 들어선 빵집도 맛있어서 날씨 좋은날 가보기 좋은 곳",4,311,"Samcheongdong-gil is not the same as it used to be, but there are still delicious sujebi and sweet red bean porridge restaurants, and the new bakery is delicious, so it's a good place to visit on a nice day."
dhgn456,길치가 아닌 저한테 조금 적응해야하는 길.. 근데 길이 일자여서 쭉 둘러보기 좋아요 중간 중간에 골목길 때문에 헷갈려요,5,311,"I'm not bad at directions, but I need to get used to it. But the road is straight, so it's good to look around. I'm confused by the alleyway in the way."
dkfma0657,삼청동길도 종로근처라 가봤는데 나름 좋더라구요분위기도 색다르고 잘 들렸다 가요 ㅎㅎㅎㅎㅎㅎ,5,311,"Samcheong-dong-gil is near Jongno, so I went there and it was pretty good.The atmosphere is different and I can hear you well."
유이717,"맛있는 읍식, 카페도 많지만 아기자기한 소품가게 구경하는것도 재미있어요. 특색있는 카페도 많아서 데이트하기 좋아요.",5,311,"There are many delicious towns and cafes, but it is also fun to see cute prop shops. There are many unique cafes, so it's good to go on a date."
강한여자,"어느 계절에 가더라도 서울의 정겨운 모습을 볼 수 있습니다 삼청동길도 상당히 이쁘고 다만 지금은 너무나 많은 인파때문에 걷기조차 힘이 들 정도입니다.주변에 상점이나 쇼핑할 수 있는 곳도 많고 떡갈비 수제비, 김치말이국수, 팥죽 만두 등등 맛집도 굉장히 많아서 취향대로 다양한 메뉴들중에 골라 먹을 수 있는 즐거움이 있습니다",4,311,"No matter which season you go, you can see the friendly side of Seoul. Samcheong-dong-gil is pretty and it is hard to walk because of the crowds.There are a lot of shops and shopping places nearby, and there are lots of good restaurants such as tteokgalbi sujebi, kimchi-mari noodles, red bean porridge dumplings, etc., so there is a lot of fun to choose from among various menus."
mkbymk,"예전엔 정말 산책과 데이트명소였는데 요즘은 많은 프렌차이즈업체들의 진입으로 그 명성이 예전만 못하지만 그래도 봄, 가을날씨에 나들이하기에 좋은곳 입니다.",4,311,"It used to be a walking and dating spot, but these days, it is not as famous as before due to the entry of many franchise companies, but it is still a good place to go out in spring and autumn."
sodal00,"청와대 주인이 바뀌어서 그런가. 걸으면 상쾌해진다. 고풍스러운데 도시적이며, 오올드한 느낌이 없다.",5,311,"Is it because the owner of Cheong Wa Dae has changed? Walking makes you feel refreshed. It's antique, but it's urban, and it doesn't have an ould feeling."
KYUNGHEE J,"삼청동 길에 아기자기한 소품샵이나 찻집, 레스토랑 등이 많죠. 근데 물가가 많이 올라서 부담스러워요",4,311,"There are many cute prop shops, teahouses, and restaurants on Samcheong-dong. But the prices have gone up a lot, so I feel burdened."
Stereos,"여긴 길이 좀 좁아서 불편하긴 하지만, 여기저기 볼만한 매장도 많고, 맛집들도 있어서 산책에 좋아요.",3,311,"It's inconvenient because the road is a bit narrow, but there are many restaurants to see here and there, so it's good for a walk."
Mandoo F,"경복궁 우측의 아름다운 길로 가을에 은행잎이 물들면 분위기 좋습니다. 카페, 음식점, 갤러리들이 늘어선 멋진 곳입니다.",5,311,"The beautiful road on the right side of Gyeongbokgung Palace, and the ginkgo leaves in autumn, the atmosphere is nice. It's a nice place lined with cafes, restaurants, and galleries."
민석 권,경북궁에서 안국역으로 가서 쭉 올라가면 작지만 이쁜 길이 나오네요 근데 관광객이 너무 많아서 걷는게 힘들정도네요,3,311,"If you go straight up to Anguk Station from Gyeongbuk Palace, you will find a small but pretty road. But there are so many tourists that it's hard to walk."
Minsuk Y,"서울의 옛모습을 보고 싶거나, 수제비, 김치말이국수, 팥죽을 드시고 싶다면 반드시 가야할 곳 입니다. 물론 너무 늦게 가면 다 문을 닫습니다.",3,311,"If you want to see the old Seoul, or if you want to eat sujebi, kimchi rolled noodles, or red bean porridge, you must go there. Of course, if you go too late, everyone closes."
lao717,"삼청동길은 정말 숨어있는 맛집도 많고, 볼거리도 많은 곳입니다. 카메라와 튼튼한 두 다리를 들고 나가서 걸어다니다보면 즐거운 추억이 마구 쌓이는 곳이랍니다. 서울의 매력을 물씬 느낄 수 있는 거리라고 생각해요.",3,311,Samcheong-dong-gil has many hidden restaurants and attractions. to walk out with a camera and two strong legsIt's a place where you can make a lot of good memories. I think it's a street where you can feel the charm of Seoul.
42bryant,애초에 삼청동 자체가 좋은 취지로 탄생된 곳은 아닌데 고즈넉하다보니 급발전했다가 우후죽순 난립으로 현지인들은 거의 안가게되었네요. 결국 가로수길처럼 상권이 죽어 많은 상점들이 철수하리라 생각합니다,3,311,"Samcheong-dong itself was not created for a good purpose in the first place, but because it was quiet, it developed rapidly and rarely went to the locals due to the chaos. I'm sure many shops will be pulled out of business, like Garosu-gil."
천막족,"특별히 관광지라기 보다는 여기저기서 악세사리나 음료, 음식을 팔고 있는 상업지구. 나름 꾸민다고 꾸민 것 같지만 그냥 그래요. 굳이 갈 필요는 없을 것 같아요. 솔직히 말하면 한옥마을 가는 골목 지나간다고 생각했습니다.",2,311,"A commercial district that sells accessories, drinks, and food here and there, rather than as a tourist destination. I think it's for decoration, but it's just so-so. I don't think we have to go. To be honest, I thought it was passing by an alley to Hanok Village."
ychun119,"한국 전통가옥을 볼수있고, 먹거리, 볼거리가 많은 이쁜 길입니다. 사진찍기 좋아하는 외국인들이 한국 문화 체험하기 좋은 장소입니다.",5,311,"It is a pretty road where you can see Korean traditional houses, and there are many things to eat and see. It is a good place for foreigners who like to take pictures to experience Korean culture."
apeach11,북촌한옥마을 위로 가다보면 삼청동에 다다르면 삼청동이 쭉 이어져 있다. 옛 건물들과 다양한 물건을 파는 곳과 사람들과 인산인해 인곳,4,311,"If you go up to Bukchon Hanok Village, you will find Samcheong-dong all the way up to Samcheong-dong. old buildings, various places for sale, people and people."
arcticnova,가장 좋아하는 음식점 중 하나인 삼청동수제비에 가기 위해 안국역에서 걸어올라갔습니다. 요즘은 삼청동길이 주변에 새로 생긴 핫플레이스들에 인기가 뺏겼으나 여전히 사람은 많습니다. 서울(?)에서 단팥죽 두번째로 잘하는 집도 참 맛있습니다.,4,311,"I walked up from Anguk Station to go to one of my favorite restaurants, Samcheong-dong Sujebi. These days, the new hot places around Samcheong-dong-gil have lost their popularity, but there are still many people. The second best restaurant in Seoul (?) is also very delicious."
hyomin78,북촌을 구경하고 하나의 돌을 깍아 만든 돌계단길로 내려가면 바로 이어짐. 따로 구경하기 보다는 한번에 구경하고 다시 인사동으로 가면 코스가 좋음,4,311,"After looking around Bukchon, you can go straight down to the stone stairway made of a stone.m. stone. The course is good if you go back to Insadong after seeing it all at once rather than looking around separately."
