u_id,review,u_rate,p_id,review_en
진규 이,"수제비 생각 날 때 찾던 곳이 삼청동이다. 예전에도 좁은 차로 변, 꽤 맛깔나고 푸짐한 음식들을 파는 식당들이 곳곳에 있었던 삼청동이다. 맛집 좀 찾아다닌다는 사람들이 으시대며 아는 척하며 골목 골목 아는 집 소개하던 그런 동네다. 지금은 천지개벽까지는 아니더라도 상전벽해 수준의 변화의 바람이 불었다. 가정식 한정식집부터 정말이지 물고 뜯고 즐길만한 구석기 갈비집, 인도에도 없을 커리 맛집, 떡집, 맹물을 마셔도 맛있다고 할 만한 분위기 그윽한 카페에 아담하지만 예사롭지 않은 빵들 맛을 볼 수",4,311,"Samcheong-dong is the place I used to visit when I thought of sujebi. In the past, Samcheong-dong was located in many restaurants selling delicious and plentiful foods, along with narrow lanes. It is a neighborhood where people who are looking for good restaurants proudly pretended to know and introduced restaurants that know alleys. Now, there has been a wind of change at the level of the upper and lower seas, if not the opening of the sky. From home-style Korean restaurants to Paleolithic galbi restaurants to really bite and tear, curry restaurants that are not even in India, rice cake restaurants, and plain water. You can taste small but unusual breads at cafes."
클레오,처음으로 삼청동길 가봤습니다. 말만 많이 듣고. 가로수길보다 볼거리는 있었지만. 주로 주변에 먹거리들..은 똑같더군요.,3,311,I went to Samcheongdong-gil for the first time. Just listen to me a lot. There was more to see than Garosu-gil. Mainly food around.It's the same.
BB_Life_Forest,"가끔씩 가면 신기한 가게들, 특이한 음식점, 눈이 즐거운 풍경을 볼 수 있음. 주변 국립현대미술관과 같이 볼만 함.",4,311,"Sometimes you can see interesting shops, unusual restaurants, and pleasant snow scenes. Just like the National Museum of Modern and Contemporary Art nearby."
dddaisy1,사람들이 없는 평일 삼청동길을 걸으면 마음이 잔잔해지는 느낌을 받아요. 지나가다 보이는 한옥느낌의 건물들 ! 그리고 맛있는 아이스크림와플...ㅎ 데이트 코스로도 추천해요~,4,311,Walking on Samcheong-dong-gil on a weekday without people makes me feel calm. I recommend you to go on a date course with delicious ice cream waffles.
지혜 심,자주 가게 되진 않지만.. 그래도 일년에 한두번은 가게 되는것같네요. 예전만큼 붐비는 동네는 아니지만 여전히 외국인들이 많고.. 카페가 한국식이라 정겹네요..ㅎㅎ,5,311,"I don't go there often, but... But it seems like you're going once or twice a year. It's not as crowded as it used to be, but there are still many foreigners... The cafe is Korean style, so it is very friendly.Haha"
123SDF,전통적 건축물들과 젊은 예술가들이 공존하는곳으로 주말에 브런치를 하거나 아기자기한 소품들 구경하기 좋은곳입니다,4,311,"It is a place where traditional architecture and young artists coexist, and it is a good place to brunch or see cute props on weekends."
여행가자구요,"20년 전만해도 조용하고 사람이 지금만큼 많지 않았던 곳이었는데 어느새 너무 많은 사람들과 외국인 관광객들이 모여 차도 많아져, 그다지 추천하지 않습니다. 사람들 비집고 돌아다니는 걸 즐기신다면 추천합니다. 다만 어깨빵 조심하세요.",1,311,"Twenty years ago, it was quiet and there weren't as many people as it is now, but before I knew it, there were so many people and foreign tourists that there were so many cars, so I don't recommend it very much. I recommend it if you enjoy people walking around. But be careful of shoulder buns."
바람과함께살빠지다,밤에 가면 많은 카메라들이 삼각대에 꽂혀 줄 지어 있습니다. 그만큼 삼청동길의 밤은 예뻐요!,5,311,"At night, many cameras are lined up on the tripod. The night of Samcheong-dong-gil is that pretty!"
bjh3676,"안국역에서 걸어갈 수도 있고, 광화문역, 시청역, 서울역 등에서 마을버스를 타고 갈수도 있습니다. 자가용을 들고 오는 것은 추천하지 않습니다. 주차공간도 얼마 없고, 관광객들이 매우 많아서 주말이면 정체가 매우 심합니다. 그렇지만 골목골목마다 아기자기한 상점들을 보는 재미가 쏠쏠하고, 현대적인 요소와 전통적인 요소가 조화롭게 있습니다. 계절로는 가을을 추천합니다. 은행나무 가로수들이 매우 인상적입니다.",3,311,"You can walk from Anguk Station, or take a village bus from Gwanghwamun Station, City Hall Station, or Seoul Station. I don't recommend bringing a car. There is not much parking space, and there are so many tourists, so it is very congested on weekends. However, every alley is fun to see cute shops, and there is a combination of modern and traditional elements. I recommend autumn for the season. The ginkgo trees are very impressive."
cheum3,한복스냅을 찍으면서 가게되었는데 고즈넉한 우리나라 한옥의 분위기가 너무 맘에들어 시간될때 차를두고 가게됩니다. 맛있는 한식과 전통차도 찾아서 먹고 시간이된다면 삼청동 스테이도 한번 해보고싶네요,4,311,"I went there while taking a picture of Hanbok, and I liked the quiet atmosphere of Korean traditional house, so I left my car when I had time. I want to find delicious Korean food and traditional tea, and if I have time, I want to try Samcheong-dong Stay."
sungshin248,"점심 시간에 산책 겸 자주 들르는 곳입니다. 평일에는 그래도 조금 한가한 편이지만, 주말에는 관광객들이 많아서 번잡스럽습니다. 이제는 프랜차이즈 매장들이 많아졌지만, 그래도 곳곳에 아기자기한 가게들이 많이 있습니다.",3,311,"It's a place I often stop by during lunchtime to take a walk. I'm a little free on weekdays, but it's crowded on weekends because there are many tourists. There are more franchise stores now, but there are still many cute shops everywhere."
reverb83,"다들 찾아가는 아주 번잡한 곳이라. 그 만큼의 운치있는 사색과 생각깊은 장소는 아니라고 생각함 자기애가 강해서, 나를 내 개인적 기준으로 높은 프라이드를 가지는 사람들이 그 가치를 흉내내는 곳으로 적합한 동네라고 생각함. 그야말로, 아류쟁이들이 많은 동네임.",1,311,"It's a very busy place where everyone's visiting. I don't think it's such a tasteful place to think about and think of myself as a good place for people with high self-love to imitate the value of my personal standards. Indeed, it's a neighborhood full of lousy people."
자몽쥬스00,한때 엄청 자주 갔던 삼청동길 조용하게 길을 따라 걸으며 가게 구경도 하고 맛집도 많아 그거 찾아가서 먹는 재미가 가득했어요 요즘은 사람은 많아지고 가게는 오히려 다양화가 저하된 느낌이 있지만 그래도 종종 가게되는 곳입니다.,4,311,"Samcheong-dong-gil, which I used to go to a lot of times, was quiet along the road, looked around the shops, and there were many good restaurants, so I had a lot of fun visiting and eating them. Nowadays, there are more people and the variety of shops seems to have decreased, but it is still a place where people go often."
엔도마메,우리나라 옛 모습 그대로 거리거리가 이쁜 곳입니다. 나가사키 카스테라 때문에 한동안 많이 방문하기도 했었죠. 동네가 이쁘고 걷기 좋아요.,4,311,It is a beautiful street just like the old days of our country. I've been visiting a lot for a while because of Nagasaki Castella. The neighborhood is pretty and it's nice to walk around.
ComiNyang,"먹을것도 많고 산책하기도 좋은 곳 같아요~ 삼청동이라도 음식점이 다 비싸다곤 하지만 잘 찾아보면 저렴하게 즐길수있는 식당도 있어요~ 근처에 산도 있고 ^^ 학생,커플할것없이 사람도 부적부적합니다~",4,311,"I think it's a good place to go for a walk with lots of food. I heard that all restaurants in Samcheong-dong are expensive, but if you look carefully, there are restaurants that you can enjoy cheaply. There's a mountain nearby. ^^ Students, people are inadequate regardless of couples."
kelly7778,데이트코스로 많이 갔었는데 요즘은 관광객도 많고 사람들도 너무 많아서 사람들한테 치이는 느낌이다. 아기자기한 카페가 많은데 가격대가 높은편이라 아쉽다.,3,311,"I used to go on a date course a lot, but these days, there are so many tourists and so many people that I feel like I'm being run over by people. There are a lot of cute cafes, but it's too bad that the price is high."
올리브521,삼청동길은 획일적인 강남에서 마주치기 어려운 진짜 서울의 모습을 하고있다.경복궁앞 현대미술관에서 부터 북쪽으로 쭈욱 길따라 걷다보면 작고 아기자기한 소품가게들.디저트가게들..맛집들.갤러리들이 이어진다.중간 유로주차장이 몇개있고 여의치않으면 현대미술관에 파킹하고 걷는것도 방법이다.단풍이 지는 어느 가을날..부슬비가 내리는 고즈넉한 흐린날.눈이부실만큼 쾌청한 그날 삼청동길에 나서고싶다.거기서 단팥죽만.혹은 수제비만..아니면 커피한잔만이여도 행복하다,5,311,"Samcheong-dong-gil has the true appearance of Seoul, which is hard to encounter in the uniform Gangnam area.If you walk along the road to the north from the Museum of Contemporary Art in front of Gyeongbokgung Palace, you will find small and cute prop shops.Dessert shops...Delicious restaurants. Galleries follow.There are a few middle Euro parking lots and if it is not possible, it is also a way to park and walk in the Museum of Modern Art.One autumn day when the fall leaves...a sultry, cloudy day with drizzlesI want to go out on Samcheong-dong-gil on a day when it's so bright that it's dazzling.Only sweet red bean porridge.Or just sujebi.Or just a cup of coffee makes me happy."
SU237,맛집도 많고 분위기도 좋음. 다만 사람들이 너무너무 많다..... 딱히 맛집찾아다니는 것보다 길거리 다니다 가보고 싶은 곳 들어가도 괜찮을 듯!,5,311,There are a lot of good restaurants and the atmosphere is nice. But there are so many people... ...more than just looking for good restaurants. It's okay to go where you want to go!
mkla1004,삼청동은 붐비지 않아서 좋습니다. 특히나 맛집이 한집건너 한집이라서 좋고요 . 하지만 대중교통이용해서 접근하기 약간 환승을 해야 하지만 그래도 좋아요 .,4,311,"Samcheong-dong is good because it's not crowded. Especially, it's good because it's one place across the street. But I have to transfer a little bit to use public transportation, but it's still good."
jesusprise,생각이 많을때도 좋고 비오는 날도 좋아요 운치도 있고 분위기도 있고 전통을 느낄 수 있어서도 좋아요~~ㅎㅎ,5,311,"I like it when I have a lot of thoughts and when it rains. It's beautiful, it's moody, it's traditional.~~ᄒᄒ"
빵이아빠,예쁜 카페와 공방.. 맛집들이 모여있는 곳이라.. 데이트 장소로 좋습니다. 식사는 가격이 살짝 비싼편이예요.. 오래전부터 유명한 식당들도 많아요..,4,311,Pretty cafes and workshops. It's a place of good restaurants. It's a good place for a date. The meal is a little expensive. There are many famous restaurants from a long time ago.
haeini,예전부터 참 좋아하던 곳입니다. 정말 아기자기하고 예쁜 길인데...요즘은 관광객들이 너무 많아서 좀 그래요..주말엔 피하시는 것이 좋아요,5,311,I've liked this place for a long time. It's a really cute and pretty road.There are too many tourists these days.You'd better avoid it on weekends.
jjjjj111,몇년전만 해도 정말 자주 갔던 곳인데.. 이제는 특색없는 관광지가 된 것 같다. 많은 화장품 가게들이 그것을 나타낸다.. 그래도 좋아하는 맛집들이 있기에 가끔은 방문함.,2,311,"A few years ago, I used to go to this place very often. I think it has become a tourist destination without features. Many cosmetics shops represent it. But there are good restaurants that I like, so I visit sometimes."
뇽아,삼청동길~ 이런 분위기 너무 좋았어요~ 곳곳에 숨어있는 맛집들 다니는데 재미있고 사진도 잘 나와서 넘 좋았다는 ㅎㅎ,5,311,"Samcheongdong-gil~ I loved this atmosphere. I went to famous restaurants hidden everywhere, and it was fun and the pictures came out well."
inniji,흥미가 있는 것들이 많은 곳이지만 최근들어 너무 상업적으로 변하지 않나 싶습니다. 하지만 관광지로 삼청동을 대체할만한 곳이 없습니다.,3,311,"There are a lot of interesting things, but I think it has become too commercial these days. However, there is no place to replace Samcheong-dong as a tourist destination."
everlsk,삼청동길은 안국역에서 시작하여 팔각정까지 이어지는 길 입니다. 카메라 하나 들고 가서 스트리트 스냅을 담기에 멋진 곳 입니다.,5,311,Samcheong-dong-gil is a road that starts at Anguk Station and extends to Palgakjeong Pavilion. It's a nice place to take a camera with you and get a street snap.
진경 서,날씨 좋을때 천천히 걸으면서 다니면 너무 재미있습니다. 포토스팟 찾아다니면서 사진찍는 재미가 남달라요,5,311,It's so much fun to walk around slowly when the weather is nice. It's fun to look for photo spots and take pictures.
nekoyang h,북촌보다는 좀 더 상업적인 곳이다. 도로를 따라 기와지붕 아래에서 여러 가게들이 줄지어 있다. 주로 맛집도 있고 전시장도 있다. 아무데도 안들어가도 좋다. 그냥 사람들 따라 거리만 걸어다녀도 시간이 금방 지나간다.,5,311,It is a more commercial place than Bukchon. Along the road are rows of shops under the roof of a tile. There are usually good restaurants and exhibition halls. You don't have to go in anywhere. Time flies just by walking along the street with people.
졍,안국역에서 길을 하나 두고 한쪽은 인사동 한쪽은 삼청동 입니다. 데이트하기도 좋고 맛집도 많아 남녀노소 누구나 좋아 할 것 같네요~ 아기자기한 가게들이 많아서 구경삼아 주말에 종종 가곤 합니다. 칼국수와 팥죽 맛집이 있어서 좋아요. 티비에나왔던 갈비집도 있구요. 가족단위로 주말에 가면 괜찮을 것 같아요. 주차는 별도의 공영주차장에 주차해야합니다.,5,311,"Anguk Station has a road, and one side is Insa-dong and the other is Samcheong-dong. It's good for dating and there are many good restaurants, so I think everyone will like it. There are many cute shops, so I often go there on weekends for sightseeing. I like kalguksu and red bean porridge because they have good restaurants. There's also a galbi restaurant on TV. I think it'll be okay to go on weekends as a family. Parking should be done in a separate public parking lot."
parky77,핫한 음식점과 다양한 가게들이 즐비해 있어서 둘러보고 놀기에 시간가는 줄 모르는 곳이에요. 구석구석 구경하다보면 시간이 금방간답니다. 요즘엔 외국인들도 정말 많아요,5,311,"There are many hot restaurants and various shops, so you never have time to look around and play. Time flies when you look around every corner by corner. There are so many foreigners these days."
nayepp,"한번쯤은 이거리에서 식사도하고 독특한 분위기 카페에서 차한잔하는걸 추천한다, 쇼핑가게는 많지는 않으나 아이쇼핑하면서 가볍게 산책해도 좋았다",4,311,"I recommend you to have a meal on this street and have a cup of tea at a cafe with a unique atmosphere. There aren't many shopping malls, but you can take a walk while window shopping."
BlackStar_Lazarus,더 이상 상권이 발전 하지도 않을 것 같다. 삼청동을 느끼는 방법은 북촌한옥마을 가서 삼청공원으로 간 뒤 삼청동으로 내려와서 수제비 먹고 집에 가는 것임.,3,311,I don't think the business community will develop any more. The way to feel Samcheong-dong is to go to Samcheong Park in Bukchon Hanok Village and come down to Samcheong-dong to eat sujebi and go home.
SANTANIM,"북촌팔경 구경 후 삼처동으로 내려와서 갤러리들 보며 돌아보면 참 좋은 것 같아요. 눈나무집과 서울에서 두번째로 맛있는 집, 또는 용수산에 자주 갑니다^^",5,311,"After watching Bukchon Eight Scenic Views, come down to Samcheo-dong and look around the galleries. It's nice. I often go to snow tree house and second best restaurant in Seoul, or Mt. Yongsu.^^"
김쉘리,"아름다운 한옥의 건물들과 돌담길들이 참 이쁩니다. 먹거리도 많이 있구요, 좋은 식당도 많아요",5,311,The beautiful buildings of Hanok and stone walls are very pretty. There's a lot of food. There's a lot of good restaurants.
haeaaa,낮시간에 방문하면 그나마 한적하게 둘러볼수 있습니다 ㅋㅋ 주말에 가면 사람 너무 많아요 진심 ㅠㅠㅠ,4,311,"If you visit during the day, you can look around quietly. There are too many people on weekends. I'm serious."
곰딩꽁꽁,삼청동 길을 거다 보면 아기자기한 가게들도 많고 풍경이 아름다워 연인들끼기 데이트하기에 좋은 곳입니다.,4,311,"If you go to Samcheong-dong street, there are many cute shops and the scenery is beautiful, making it a good place to date couples."
라니니,"학부 때 늘 삼청동 길에 와서 걷고 또 걸었던 기억이 난다. 주변 골목이나 상점들이 둘러볼 곳이 많아서 좋고, 음식점들도 평타이상 한다.",5,311,"I remember always walking and walking on Samcheong-dong Road when I was a undergraduate. It's nice to have many nearby alleys and shops to look around, and restaurants are also out of order."
찌니찌니07,예전엔 볼거리가 많았는데 요즘은 그런게 사라져서 좀 아쉬운 길이네요. 대중교통으로 가시는걸 추천해요. 주말에 차 가져가면 너무 붐비더라구요.,3,311,"There used to be a lot of things to see, but now it's gone, so it's a bit disappointing. I recommend you to go by public transportation. It's too crowded with cars on the weekend."
유진 장,위치가 좋아서 인사동과 함께 나들이 하기 좋은 곳! 밥값이나 찻값이 싸지는 않지만 한두번 놀러가기 좋다!,5,311,"It's a great place to go out with Insa-dong because of its good location! The price of rice or tea is not cheap, but it's good to visit once or twice!"
JYH,많이 상업화 되었다고 아쉬워하는분들도 많지만 그래도 강남과는 다른 느낌의 아기자기함이 있어요~주차할곳은 많지 않아서 대중교통을 이용하시는게 좋을듯해요~근처에 경복궁과 인사동 교보문고 볼거리도 많아요~,5,311,"There are a lot of people who are sad that it's commercialized, but it's different from Gangnam.There are not many places to park, so it would be better to use public transportation.There are many things to see nearby Gyeongbokgung Palace and Kyobo Bookstore in Insadong."
PINKSHOW01,"외국인 친구들이 오면 인사동에서 밥을 먹고 항상 가게 되는 삼청동길. 북촌 8경까지 모두 찍고 돌다보면 경복궁을 포함한 서울시내를 볼 수 있어서 천천히 이야기하며 산책하기 좋음. 비가 오는 날에도 폭우가 아니라면, 운치있는 풍경을 즐길 수 있음",4,311,"Samcheong-dong-gil, where foreign friends come, eat in Insadong and go there all the Samcheongdong-gil. If you take a picture of all the 8 scenic views of Bukchon, you can see Seoul including Gyeongbokgung Palace, so it's good to talk and take a walk slowly. If it's not a heavy rain on rainy days, you can enjoy the beautiful scenery."
귀티멜로디,"밑에서 위쪽으로 올라가면서 하나하나 구경하는 재미 다양한 가게구경, 차마시고 식사하기에 좋은 전통한옥을 많이 볼수 있는 곳이죠.",5,311,"As you go up from the bottom to the top, you can enjoy a variety of shops and traditional Korean houses for tea."
재영 윤,"예전에는 토속적이고 전통의 멋과 맛이 현대적인 모습과 어우러졌는데.. 유명장소가 되면서부터, 점점 예전의 전통 모습이 사라지는게 아쉽습니다. 어디서든 볼 수 있는 그저 그런 젊은이들의 상업지구화 되는게 아쉽네요",3,311,"In the past, the traditional and traditional style and taste were combined with the modern look. Since becoming a famous place, I feel sad that my old traditional self is gradually disappearing. It's a shame that we're becoming a commercial globalization of young people who can be seen everywhere."
뽀오,"삼청동~삼청동 하도 해서 처음가봤을때 '서울에 이런데가 있어?'할 정도로 이쁜 거리에, 아기자기한 샵들에 반했던 곳. 삼청동 길 따라 걷는 것 만으로도 기분전환 산책이 될 것이고, 저가에서 고가까지 다양한 음식을 파는 가게들이 즐비해 누구의 입맛과 주머니 사정도 맞출 수 있는 곳이라는 생각이다.",5,311,"Samcheong-dong~ Samcheong-dong. When I first went there, I thought, ""Is there a place like this in Seoul?'On a pretty enough street to do, where I fell in love with cute shops. Walking along the Samcheong-dong street alone will be a refreshing walk, and there are many shops selling various foods from low to high prices, so it is a place where you can meet anyone's taste and pocket situation."
호호홍홍홍,"그냥 걷는 것만으로도 뭔가 색다른 느낌이에요. 종로 중심가와 가까워서 같이 들리기에도 좋습니다. 분위기 좋은 작은 음식점, 까페도 있어요.",5,311,"Just walking feels different. It's close to Jongno-gu, so it's good to stop by together. There is also a small restaurant and cafe with a nice atmosphere."
SCY,삼청동에는 아기자기한 카페들과 음식점들이 많습니다. 저렴하고 맛있는 음식을 파는 곳들도 많아서 좋습니다. 삼청동길은 꼭 가볼만 한 곳으로 추천합니다.,5,311,There are many cute cafes and restaurants in Samcheong-dong. It's good because there are many places that sell cheap and delicious food. I recommend Samcheongdong-gil as a must-see place.
으스므,요즘은 상권발달때문에 가게들이 많이 이전했고 브랜드샵이 많이 들어와서 특색이 많이 사라졌습니다. 외국인 친구 데려오면 그나마 옛 정취가 남은 곳으로 데려가시는걸 추천드립니다.,4,311,"These days, many stores have moved because of the development of commercial districts and many brand shops have come in, so many characteristics have disappeared. If you bring a foreign friend, I recommend you to take him to a place with an old taste."
2875rosa,고층 건물에 지친 일상에서 벗어나 서울의 옛모습을 느낄수 있는 장소입니다. 예쁜 카페와 식당이 많이 있어요,5,311,It is a place where you can feel the old image of Seoul away from the tired daily life of skyscrapers. There are many pretty cafes and restaurants.
깸잉,이곳에는 이쁜 카페들이 가득한 동네인데요 :) 구두매장을 비롯해 의류매장들이 있고 한옥과 함께 있기에 과거 & 현재가 공존해 있는 느낌을 받는 곳입니다.,5,311,"This neighborhood is full of pretty cafes:) There are shoe stores, clothing stores, and Hanok, so it feels like the past and the present coexist."
마카롱,"가을에 가면 단풍길도 예쁘고, 맛집, 디저트카페, 쇼핑까지 즐길 수 있어서 좋은거 같아요~ 삼청동 갔다가 근처 인사동도 가까우니 시간나면 둘러봐도 좋아요~",4,311,"If you go in fall, maple road is pretty, and you can enjoy restaurants, dessert cafes, and shopping. You can go to Samcheong-dong and look around if you have time since Insa-dong is nearby."
공부를하자,"종로에서 인사동쪽으로 쭉 걸어오면서 인사동 구경하구요, 좀 더 위쪽으로 걸으면 삼청동길이 나와요~ 경복궁을 끼고 있으니, 산책하면서 경복궁 구경을 해도 좋구요, 삼청동길에는 맛집들이 많이 있어요. 다만 가격은 좀 비싼편이라 그 점이 아쉽네요.",5,311,"Walk straight from Jongno to Insa-dong and look around Insa-dong. If you walk up a little bit, you'll find Samcheong-dong-gil. You can take a walk around Gyeongbokgung Palace. There are many good restaurants in Samcheong-dong-gil. But the price is a bit expensive, so I'm sorry about that."
주니룩스,"너무 유명해진 탓에 관광객들로 붐비지만 서울 어디에서 이런 집합소를 찾을수가 있을까요. 식당, 볼거리, 예쁜 가게, 골목들.. 좋은 곳입니다",2,311,"It's so popular that it's crowded with tourists, but where in Seoul can we find such a gathering place? Restaurants, sights, pretty shops, alleys... It's a good place."
