u_id,review,u_rate,p_id,review_en
M.J. KIM,"예쁘고 특이한 카페나 상점이 많아 골목골목 걷기만 해도 눈이 즐거운 곳입니다. 그리고 카페마다 제각각의 특징을 가지고 있어 음료가 맛있는 집, 디저트가 맛있는 집, 인테리어가 예쁜 집 등 본인 취향에 따라 고를 수가 있어요. 오래된 가옥에 숨은 맛집도 곳곳에 있으니 즐길 것이 많은 곳입니다. 다만 그런 만큼 사람들로 북적이고 복잡하다는 것은 유일한 아쉬운 점입니다.",4,311,"There are many pretty and unique cafes and shops, so it is a place where you can enjoy your eyes just by walking in the alley. Each cafe has its own unique characteristics, so you can choose from a house with a good drink, a good dessert, and a beautiful interior. There are many good restaurants hidden in old houses, so there are many things to enjoy. However, it is the only regret that it is crowded and complicated with people."
Jinwuk K,자주가는곳인데 이쁜 카페들도 많고 한옥길을 걸으며 산책하기 좋습니다. 다만 교통이 편한것 같지는 않아요,4,311,"It's a place I go often, but there are many pretty cafes and it's good to walk along the Hanok-gil. I just don't think it's convenient."
joywoong,"한국의 전통적인 부분은 많이 없어졌지만, 근처의 미술관부터 트렌디한 쇼핑과 식음료까지 한국의 현대와 전통을 함께 느낄 수 있는 멋진 거리",5,311,"Many of the traditional parts of Korea have disappeared, but from nearby art galleries to trendy shopping and food and beverage, a wonderful street where you can feel Korea's modern and traditional together."
눈에서레이져빔,산책하기 좋은 곳이다~ 요즘 같은 봄이면 더더군다나 좋다. 와이프와 차한잔 할겸 산책할 겸 간 곳 주말에는 사람이 많아서 피한 평일~ 한껏 여유를 누릴수 있는 곳이다~,4,311,"It's a good place to take a walk. It's even better this spring. I went there to have a cup of tea with my wife to take a walk. On weekends, there were so many people so I could have some free time."
진성 최,삼청동의 멋과 풍류는 사라진지 오래다. 골목이 사라진 서울에서 그냥 별생각없이 걸으려면 갈까 그 이상은 아니다. 외국인들에게나 경복궁투어이후 도보여행코스 정도일 뿐이다.,1,311,"The style and style of Samcheong-dong have long disappeared. It's nothing more than going to Seoul, where the alley is gone, if you just want to walk without thinking about it' It is only a walking course for foreigners and after the Gyeongbok Palace tour."
봉기 문,"예전에 걷던 삼청동길은 조용하고 차분했는데 최근의 이곳은 관광객과 방문객이 많아져 휴일에는 가기 힘든 곳이라는 생각도 합니다. 세계의 요리와 패션 소품이 있고, 각종 갤러리샵들이 찾는 이의 눈길을 끄는 삼청동은 길 끝부분 삼청공원과 더불어 서울 도심의 보물이지요.",4,311,"Samcheong-dong-gil, which I used to walk on, was quiet and calm, but I think it is a difficult place to go on holidays due to the recent increase in tourists and visitors. Samcheong-dong is a treasure of downtown Seoul along with Samcheong Park at the end of the street, which has world-class cuisine and fashion accessories, and attracts many gallery shops."
nkpd00,"오랜만에 가봤는데 까페와 음식점이 더 많아진것 같네요. 개인적으로는 예전이 더 좋았지만, 그래도 관광객들은 많더라고요.",3,311,"It's been a long time since I've been there, but there seem to be more cafes and restaurants. Personally, I liked it better before, but there were still many tourists."
n2cc,"골목골목 걸어다니는 맛이 있는 곳입니다. 카페나 비스트로도 있고 한식, 분식 등 다양한 가게들이 모여 있습니다. 숨은 맛집이나 카페 찾는 재미가 있어요",5,311,"It's a place where you can enjoy walking in alleys. There are cafes and bistro, and there are various stores such as Korean food and snack food. It's fun to find hidden restaurants or cafes."
flyingdonutx100,"먹거리 볼거리 쇼핑거리로 유명하지만, 삼청동에서 동쪽으로는 북촌이, 북쪽으로는 삼청공원이 있습니다. 구석구석 구경해보시길",4,311,"Although it is famous for its food shopping, there is Bukchon-ri to the east of Samcheong-dong and Samcheong Park is located in Samcheong-dong. Take a look at every nook and cranny."
Traveling Foodie,매년 계속 새로운 카페들이 들어서는 것 같습니다. 많이 상업화된 곳이지만 그래도 날좋은날 걸어다니며 데이트하기 좋은 곳입니다. 전반적으로 타겟연령대가 점점 낮아지는 느낌이므로 고즈넉함을 기대하기 보다는 아기자기함을 즐기시는 것이 좋습니다.,4,311,"It seems like new cafes keep coming in every year. It's a very commercialized place, but it's a good place to walk and date on a good day. Overall, it feels like the target age is getting lower, so it's better to enjoy the cuteness rather than expecting quietness."
머튽방,맛집 분위기 관종 모두 만족 거닐다보면 기부니가 조아져서 라라랄라라라라라라ㅏ랄 와따시노 최애 레트로나 파이가 아리마스 ㅠㅠ 쩨짜에 삼청동 못잃어 ㅠㅠ,5,311,"If you enjoy the atmosphere of all the restaurants, you'll be able to enjoy the atmosphere, and you'll be able to see the donation teeth tighten up, so you can't lose your favorite retro or pie, Samcheong-dong, Samcheong-dong, and I can't lose it."
24esa,"아담하고 개성있는 카페, 장난감 카페등이 많아요. 가볍게 산책하며 카페구경하기 좋고 사진찍기 좋아요",4,311,There are many small and unique cafes and toy cafes. It's good to take a walk around the cafe and take pictures.
kkobuk,사계절 언제나 쉬이 한바퀴 걷기 좋아요 ㅎㅎ 다니면서 악세서리도 사고 맛있는것도 먹고~ 다음주에 또 가려구요,5,311,"It's always good to walk around every four seasons. I'll go around, buy accessories, eat delicious things. I'll go again next week."
qberwy,북촌 한옥마을/인사동과 가까어서 함께 묶어서 도보로 둘러보면 좋을 관광지 입니다. 주중에 가면 더욱 한적하게 즐길 수 있습니다.,5,311,"It is close to Bukchon Hanok Village/Insa-dong, so it is a good tourist spot to walk around together. If you go during the week, you can enjoy it more quietly."
Fontainebleaus,"관광지라고 하기에는 다니는 길이 너무 좁아서 계속 비키면서 다녀야하는 불편함이있다. 이쁜 카페들, 플리마켓등 볼거리는 많지만 지나치게 상업화되었다는것이 안타깝다. 그리도 한번쯤 구경하기에는 나쁘지 않다. 구경하는 재미가 쏠쏠하다.",3,311,"It is inconvenient to keep moving away because the road is too narrow to be called a tourist destination. There are many things to see such as pretty cafes and flea markets, but it is sad that it has become too commercialized. It's not bad to look around once. It's a lot of fun to watch."
Yuyumi85,"거리 곳곳과 아기자기한 상점들을 걷다보면 저절로 느긋해지는 거리예요. 너무 도시화된 서울에서 몇 안되는 한국적인 미를 느낄 수 있는 곳이기도 하구요. 사잇길에 있는 계단을 올라 약간 언덕으로가면 삼청동의 예쁜 지붕들을 한눈에 볼 수 있어요! 삼청동길에 유명한 까페와 음식점이 아주 많지만, 여름에 왔다면 냉면을 반드시 먹어볼 것을 권장합니다.",5,311,"It's a relaxing street as you walk through the streets and cute shops. It is also one of the few places where you can feel the beauty of Korea, which is too urban. If you go up the stairs on the Sight-gil and go to the hill a little, you can see the beautiful roofs of Samcheong-dong at a glance! There are many famous cafes and restaurants in Samcheong-dong-gil, but if you come in the summer, it is recommended that you try naengmyeon."
짱짱짱,카페들과 아기자기한 골목길을 가보고 싶다면 방문해도 좋겠다. 아담하고 소박한 북카페에서 친구들과 수다떨기에 딱 좋은 장소들이 많다.,5,311,"If you want to visit cafes and cute alleys, you can visit them. There are many perfect places to chat with friends in a small and simple book cafe."
duck3222,북촌한옥마을에서 계단을 통해서 내려갔엉~ 삼청동으로 가는길에 예븐건물들이 너무 많아요~ 한옥스러운데.. 카페나 다양한 가게가 많아서 신기했어요 골목골목 아기자기하게 잘꾸며진 곳이었습니다. 중간중간 계단이 있었으나 오르락 내리락 할 자신이 없어서 계단은 못올라 가봤습니다.,5,311,"I went down the stairs from Bukchon Hanok Village. There are so many preliminary buildings on the way to Samcheong-dong. It looks like a traditional Korean house. It was amazing that there were many cafes and various shops. It was a cute and well-knit alley. There were stairs from time to time, but I couldn't climb them because I wasn't confident of going up and down."
mmom661,음식점은 딱히 특별한 곳이 있진 않지만 여기저기 있는 카페들은 모두 특색있어 좋은 거리에요. 걷기에 좋습니다.,4,311,"Restaurants don't have any special places, but the cafes here and there are all unique and good streets. It's good for walking."
수정 신,"삼청동 하면 고즈넉한 거리를 생각하게 되는데, 여기는 조금 왁지저껄한 번화가입니다. 아직은 개성 넘치는 가게들이 많아서 좋아요. 메인 거리뿐만 아니라 골목골목 다니면 보석같은 가게들을 찾는 재미도 있습니다.",4,311,"Samcheong-dong reminds me of a quiet street, but this is a busy street. It's good because there are still many unique shops. Not only the main street, but also the shops like jewelry are fun to visit."
pfllalla,"삼청동도,, 많이 변했지만. 교통이 불편해서 그런지 저녁에 가면 사람들이 많이 빠지는 편인것 같아요. 아직까지 갈때마다 만족하는 곳인데.. 음식점은 특별한곳이 없네요. 카페는 만족스런 곳이 많아요",4,311,"Samcheong-dong, although it has changed a lot. Maybe it's because of the inconvenient traffic, but I think there are a lot of people in the evening. It's still a place I'm happy with every time I go. There's no special restaurant. Cafés have a lot of satisfying places."
시리우드,정말 오랜만에 최근에 다시 삼청동길을 걷게 되었는데 날씨는 정말 무더웠지만 골목마다 아기자기한 카페도 많고 가게들이 많아서 보는 재미가 있었습니다. 외국인들도 정말 많았구요. 지금도 예쁘지만 앞으로도 더욱 잘 가꿔지면 좋겠네요,4,311,"It's been a long time since I walked along Samcheong-dong-gil again. The weather was really hot, but there were lots of cute cafes and shops in every alley, so it was fun to watch. There were so many foreigners. She's pretty now, but I hope she'll get better in the future."
양남댁,골목 구석구석 아기자기 카페도 많고 예전과는 다른 분위기지만 지금 분위기도 괜찮아요. 다만 주차공간 부족하고 가격이 점점 올라가는 느낌이네요. 그래도 운치있고 좋아요,5,311,"There are a lot of baby cafes in every corner of the alley and it's a different atmosphere than before, but the atmosphere is nice. However, it feels like there is not enough parking space and the price is going up. But it's beautiful. It'sir."
deuxhan,곳곳에 있는 개성있는 한옥카페에서 차한잔 마시기에 좋은 곳~~ 작은 가게마다 특색이 있어서 천천히 구경하며 걷기에도 좋아요,3,311,"It's a great place to drink tea at the unique Hanok cafes all over the place~~~ Each small shop has its own characteristics, so it's good to take a look around and walk slowly."
연쥬쥬,"길거리 음식이 다양하고 대체로 다 맛있는 편이다. 데이트 장소로 최고이며, 한국 전통 느낌과 현대적인 느낌을 동시에 받을 수 있는 곳이다.",5,311,"Street food is diverse and generally delicious. It is the best place for a date, and you can feel both Korean traditional and modern at the same time."
Wernicke031,다른 리뷰에서도 많이 언급되었지만 삼청동 거리는 더 이상 새롭고 예술적인 거리라기 보다는 상업거리에 가깝다. 하지만 다른 서울 시내 상업거리와 비교했을 때 개성이 강하고 또 여기만의 맛집이 많다는 것은 부인할 수 없다.,4,311,"As mentioned a lot in other reviews, Samcheong-dong Street is no longer a new and artistic street, but rather a commercial street. However, it is undeniable that there are many unique and unique restaurants compared to other commercial streets in Seoul."
Intaek L,"예전엔 정말 조용하고, 분위기 있는 카페들이 드문드문 있어서 좋았는데, 어느새 상업자본들이 유입되어 전문 상업지구로 변모된 모습이다. 예전의 고즈넉한 분위기는 다 어디로 가고, 시끄러운 관광객 천국만이 남았네.",3,311,"In the past, it was good to have a few really quiet and atmospheric cafes, but before I knew it, commercial capital flowed in and turned into a professional commercial district. The quiet atmosphere of the past is gone, and only the noisy tourist paradise is left."
mea culpa,"2~3년 전만해도 과거와 현재가 공존하는 삼청동의 본연의 느낌들이 살아있었는데 이제는 거의 프랜차이점들을 비롯해 아무 특색없는 가게들로 채워지고 있습니다. 이런 데는 상생을 위해 건물주들이나 서울시에서 나서서 입점하는 가게들에 대해 기 준같은 걸 좀 정했으면 좋았을텐데..라는 아쉬움이 남습니다. 이제는 점점 해외 관광객들이 차지하는 동네, gentrification의 길을 모범적을 좇아가고 있는 동네인 듯합니다. 이제는........ 끝물인 듯 싶네요..",3,311,"Two or three years ago, Samcheong-dong's natural feelings of the past and the present coexist were alive, but now it is almost filled with stores with no characteristics, including franchises. It would have been nice if we could have decided on a standard for building owners or stores in Seoul for co-prosperity.That's what I regret. Now, it seems to be a neighborhood that is becoming more and more dominated by foreign tourists, following the example of gentrification. I think it's over."
Urizia J,옛날에는 예쁜 카페도 많고 아기자기한 공방도 많았는데 여기도 현대화의 물결을 비껴가지 못하네요ㅠㅠ 진짜 프랜차이즈 커피숍들은 안 들어왔음 좋겠는데 희망은 희망일 뿐 지금은 많이 변했어요 아 출사 가시는 분들 많아요 사진은 예쁘게 나옴 차는 두고 가세요 주차장 없다고 봐도 무방합니다,3,311,"In the old days, there were many pretty cafes and cute workshops, but they couldn't keep up with the wave of modernization.I really hope that franchise coffee shops don't come in, but hope is hope, but now it's changed a lot. Oh, a lot of people are going out. Leave the pretty car in the picture. It's safe to say there's no parking lot."
투덜스머프,홍대에 버금가는 트렌드를 느낄 수 있는 장소입니다. 주변의 작지만 소박하고 디자인적인 상점들이 많고 맛집 검색하면 맛나는 음식/간식은 보너스~ 그리고 한옥마을까지 걷는 코스를 잡아보세요~,5,311,"It is a place where you can feel the trend comparable to Hongdae. There are a lot of small but simple and design shops around here, and if you search for good restaurants, you can get a bonus for your food/snack, and take a walk to Hanok Village."
SshFanny,외국에 나가사는 친구가 한국에 들어와서 향수도 느낄겸 걸었던 공간^^ 아기자기한 가게들과 이쁘고 깨끗한 길덕에 여행느낌도 물씬 느꼈던 길^^,5,311,The place where my friend who lives abroad walked in order to feel nostalgic when he came to Korea ^^^ The road where I felt like a trip thanks to the cute shops and the clean road 길^
MOA S,"크게 화려한 길은 아니지만 아기자기하고, 현대적인것과 옜적인 것이 공존하는 길이다. 큰 기대 안하고 천천히 차 한잔 하면서 둘러보시길 추천한다. 비오는 날에는 당연히 추천 안한는 길이며, 주차도 어렵기 때문에 대중교통으로 가는것을 추천한다.",4,311,"It's not a very colorful road, but it's a cute, modern and co-existing road. I recommend you to have a cup of tea and look around without expecting too much. Of course, it is recommended to go by public transportation because it is difficult to park on rainy days."
lordauch,근래에는 너무 많은 관광객과 상업시설이 들어와 예전의 정취가 많이 없어진 모습입니다. 그럼에도 한두번 가보기에는 나쁘지 않아요 아직도 괜찮은 레스토랑과 카페가 있어서요. 주말 보다는 평일 낮에 가기를 권합니다.,3,311,"These days, too many tourists and commercial facilities have come in, and the atmosphere of the past has been lost a lot. But it's not bad to go once or twice. There are still good restaurants and cafes. I recommend you to go on weekdays rather than weekends."
파도피아노,"삼청동길은 아름답고 예쁜 건축물들과 분위기 있는 카페와 식당, 한가롭게 거닐 수 있는 동선이 어우러져 연인과의 즐거운 데이트 코스로 제격이지요. 맛있는 차나 커피 한 잔 하시면서 정취를 느껴보세요.",5,311,"Samcheong-dong-gil is perfect for a pleasant date course with beautiful buildings, an atmosphere of cafes, restaurants, and leisurely strolls. Have a nice cup of tea or coffee and feel the mood."
mithuki,삼청동은 요새 많이 뜬 곳 같아요 골목 구석구석 예쁜곳들이 많아서 데이트로 종종 가는데요 맛집들이 많아요 항아리수제비집과 떡꼬치 집 강추해요 ㅎ,5,311,"Samcheong-dong seems to be a hot spot these days. I often go on dates because there are many pretty places in every corner of the alley, but there are a lot of good restaurants. I strongly recommend the pot sujebi restaurant and the rice cake skewer restaurant."
nayepp,오랜만에 삼청동길을 걸어보니 특색있는 새로운 가게들이 많이 생겨나고 예쁜 물건들이 진열되 있어 볼거리가 풍성해졌다,4,311,"Walking along Samcheong-dong-gil for the first time in a long time, many unique new shops were opened and beautiful items were on display, giving me plenty of things to see."
livia941,인사동과 이어져 있는 삼청동길~ 분위기 있는 다양한 메뉴의 맛집이 많고 갤러리도 많아 데이트 장소로 너무 좋아요.,3,311,"Samcheongdong-gil, which is connected to Insadong-dong. There are a lot of good restaurants and galleries with a lot of good atmosphere. It's a great place to date."
펭귄뒷구르기,"특색있는 까페거리가 넘 좋아요. 밖에서 구경만해도 시간 가는 줄 모르겠습니다. 커피도, 까페마다의 특색있는 디저트도 다 맛있어서 자주가도 질리지 않는 장소입니다.",5,311,"I love the distinctive cafe street. Just looking outside makes me lose track of course. Coffee and cafe-specific desserts are all delicious, so I don't get tired of going there often."
wis지니,오붓하고 한적한 느낌은 이제 찾기는 어려워요 사람들이 너무 많아서 번잡합니다 좀 안타까워요,5,311,"It's hard to find a cozy, secluded feeling. It's crowded because there are too many people. It's a little sad."
Munyeong,"주변에 인사동이나 경복궁, 한옥마을 등이 있어 연계해서 나들이 하기 좋아요. 카페들이 워낙 많아서 산책하다 지치면 들어가서 커피를 마시며 여유를 즐기기에도 좋습니다. 그리고 아기자기한 카페나 가게들이 많아서 구경하는 재미도 쏠쏠합니다.",4,311,"There are Insa-dong, Gyeongbokgung Palace, and Hanok Village nearby, so it's good to go out together. There are so many cafes, so when you get tired of taking a walk, it's good to go in and enjoy coffee and relaxation. And there are many cute cafes and shops, so it's fun to look around."
lulu0257,분위기 있고 맛집들도 정말 많아요 외국인 친구가 있으면 경복궁 구경하고 삼청동길에 있는 맛집에 데려가보세요 굉장히 좋아하더라고요,5,311,"The atmosphere is great and there are so many good restaurants. If you have a foreign friend, visit Gyeongbokgung Palace and take him to a good restaurant in Samcheong-dong-gil. He loved it."
hl7ylz,"삼청동 하면 카페거리가 제일 유명하다. 빙수집, 커피집, 간단히 먹을 수 있는 음식점들이 많아요. 그리고 악세사리들이랑 소품들 살수 있는 곳도 있고요. 길도 깨끗하고 산책겸 마실 나오기 좋네요.",4,311,"The cafe street is the most famous place in Samcheong-dong. There are many bingsu restaurants, coffee shops, and simple restaurants. And there's a place where you can buy accessories and props. The road is clean and it's nice to take a walk and drink."
밀키롤,인사동길을 지나 삼청동으로 진입하면 조금은 더 세련된 모습의 길과 인테리어들이 즐비하다 물론 맛집도 많고 구경거리도 믾은곳이기도하다,5,311,"Passing Insadong-gil and entering Samcheong-dong, you will find a more refined way of walking and interior design. Of course, there are many good restaurants and many things to see."
knay303,경복궁구경을 다하고 삼청동으로 넘어가 구경을 하였는데 거리가 아기자기하게 너무 이쁘게 되어있어요. 전체적으로 구경하기 좋은곳 같아요.,4,311,"After watching Gyeongbokgung Palace, we went to Samcheong-dong and looked around. The streets were so cute and pretty. I think it's a good place to look around in general."
이스엘,인사동과 가까워 함께 투어를 즐기기에 괜찮음. 맛있는 음식점들과 고즈넉한 분위기의 카페들도 많이 있음. 소소한 쇼핑 할 수 있는 가게들도 있음,4,311,It's close to Insadong so it's good to enjoy the tour together. There are many delicious restaurants and cafes with a quiet atmosphere. There are also shops where you can do small shopping.
하하하89,"날씨는 추웠지만, 고풍스러운 분위기와 현대적인 분위기가 공존한 거리를 산책해서 아주 즐거웠습니다. 아기자기한 가게들도 많이 있습니다.",4,311,"The weather was cold, but I had a great time taking a walk along the street where the antique and modern atmosphere coexist. There are many cute shops, too."
HyesungKim,"삼청동길의 고즈넉한 느낌이 점점 사라져가서 아쉽습니다. 예전대비 대기업 브랜드들이 좀 들어와버렸구요. 하지만 아직 이전의 음식점들이 좀 있고, 편집샵이 있어서 나름 구경하긴 괜찮구요. 뒷쪽으로 이어지는 북촌쪽 길로 연결해서 구경하기에는 나쁘지 않아요",3,311,"It's a pity that the quietness of Samcheong-dong-gil is gradually disappearing. There are more large companies in the market than before. But there are still some old restaurants, and there are editing shops, so it's pretty good to look around. It's not a bad idea to take the back road to Bukchon."
hjk8427_,한옥을 개조한 카페들도 많고 조용하게 산책하기 좋은 장소입니다. 주말에는 다소 붐비긴 하지만 데이트 장소로 제격이에요,4,311,"There are many cafes that remodeled Hanok and it is a good place to take a walk quietly. It's a little crowded on weekends, but it's a perfect place for a date."
체리요정,"거리마다 카페, 맛집이 즐비하고 봄이면 아름다운 벚꽃도 볼 수 있어요 삼청동 눈나무집이 생각나네요",5,311,"There are many cafes and restaurants in every street, and you can see beautiful cherry blossoms in spring. It reminds me of the snow tree house in Samcheong-dong."
DragonT,"요즘 갈수록 많은 한옥집들이 생겨나는거 같아요. 집뿐만 아니라 특색있는 가게, 음식점도 많고 여자친구랑 날씨 좋을때 걸어가면서 구경하기가 좋은거 같습니다.",4,311,"I think there are more and more hanok houses these days. Not only the house, but there are many unique restaurants and restaurants. It is good to walk with your girlfriend when the weather is nice."
