review,u_id,u_rate,p_id,review_en
브이알은 트렌드? 요즘 트렌드는 브이알인 것 같습니다. 그럼에도 불구하고 결국 PC방이 롱런하는 것 같습니다. 다양한 VR을 체험해보는 것은 좋은 경험입니다.,George_Korean,3,333,"V-R is a trend? I think the trend these days is V-R. Nevertheless, the PC room seems to be running for a long time. It is a good experience to experience various VR games."
만원대로 즐기기에 딱 좋은 테마파크 용산역에서 기차 시간 기다리며 방문하였습니다. 혼자여서 조금 민망하였지만 친절한 직원분들덕분에 편하게 시간보내다 갔습니다. 용산역에서 자주 기차 타는데 다음에도 시간이 남으면 또 방문할 것 같습니다!,joey,4,333,"I visited Yongsan Station, a theme park that is perfect for enjoying the 10,000 won range, waiting for the train time. I was a little embarrassed to be alone, but thanks to the kind staff, I spent my time comfortably. I often take trains at Yongsan Station, but I think I'll visit again next time if I have time!"
실내에서 놀이동산 처럼 즐겁게 노는게 가능한 곳 용산역이랑 붙어 있어서 교통도 편리하고 실내에서 날씨에 상관없이 놀 수 있었어요. 생각보다 리얼하고 재미있었어요. 자유이용권으로 구매할껄 후회 했어요.,crista,5,333,"It's a place where you can have fun indoors like an amusement park. It's close to Yongsan Station, so it's convenient to travel and you can play indoors regardless of the weather. It was more real and fun than I thought. I regretted buying it as a free pass."
"VR존 추천 추천! 재미있네용 다양한 VR을 체험해볼 수 있었어요. 좀비 슈팅게임, 비트세이버, 레이싱 게임 체험해 보았는데 비트세이버가 가장 재미있었어요. 이벤트 참여해서 음료수도 무료로 받고 재미있는 경험이 었어요. 다음에는 남자친구와 가볼 예정입니다.",931012,5,333,"VR Zone Recommendation! I was able to experience various VR games. I tried zombie shooting, beat saver, and racing games, and beat saver was the most fun. I participated in the event and got free drinks and it was a fun experience. Next time, I will go with my boyfriend."
신과함께 VR 몇 가지 VR을 경험할 수 있는곳이에요. 슈팅도 있고 권투도 있는데 각각 가격이 달라요. 저희는 제일 인기가 있다는 신과함께 지옥탈출을 경험했는데 지난번에 갔던 인터파크 VR과 비교했을 때 훨씬 화질이 좋았어요. 영화에서 본 비슷한 지옥을 경험하니 좋았고 주지훈이 나와서 좋았네요. 근데 좀 멀미가 났어요. 아주 정교하지는 않았지만 상대적으로 만족했어요. 가격은 1인당 7천원이었어요.,H L,4,333,"It's a place where you can experience some VR games with God. There are shooting and boxing, but the prices are different. We experienced hell escape with the most popular god, and the quality was much better compared to the Interpark VR we went to last time. It was nice to experience a similar hell I saw in the movie and it was nice to see Ju Ji-hoon in the movie. But I got motion sickness. It wasn't very elaborate, but I was relatively satisfied. The price was 7,000 won per person."
