u_id,review,u_rate,p_id,review_en
TravelBuggerTravel,"그냥 아름다운, 풍부한 역사를, 그리고 멋진 정원. 돌아오고 나는 할아버지 를 보여줍니다.",5,4,"Just a beautiful, rich history, and a wonderful garden. When I come back, I show my grandfather."
seagullrob,"서울에 있는 네가지 주요 관광지, 통합 티켓을 얻을 수 있고 종묘 네. 모든 것이 거의 같은 - 사실 창경궁 (단어 가 정말 필요 없음 "" 궁 "", 즉 "" 궁 "" 과 "" 궁 "", 가이드북 보다 쉽게 지원하지만 영어로 나와 같은! 이 바로 옆에 있는 창덕궁, 및 이 두 항목 (티켓 오피스 가 있는 결합 티켓 예약 - 필요한 [10, 000원] 또는 표를 살 수, 하지 않아도 되었지만 다시 하면 다른 항목을 왕복하는 벽! ). 모든 관광지에서 쉽게 지하철을 통해 액세스할 수 있습니다. 이 둘은…",5,4,"0You can get tickets for the integration of four major tourist attractions in Seoul and Jongmyo Yes.The fact that everything is almost the same The Changgyeonggung word is really not needed The palace, which is easier to support than the palace and palace guidebook, but the Changdeokgung Palace right next to me in English and the combined ticket office for these two items did not have to be able to buy the 10 000 won or the ticket, but the wall that goes back and forth again.All tourist attractions are easily accessible by subway.These two."
Kim v,좋은 곳에 돌아다니는 것을 바라본 한국 문화. 할 수 있는 다양한 건물들이 정말 예쁘 춘추.,5,4,Korean culture that saw people walking around in good places. The various buildings that can be done are very beautiful.
ShinYi W,이는 작은 궁전이 다른 곳에 비하. 할 수 있는 숨겨진 역사적인. 그렇지 않으면 좋은 아키텍처.,3,4,The small palace is disparaged elsewhere. Hidden history that can be done. Otherwise a good architecture.
Aliza G,창경궁 팰리스 에는 표시된 했습니다). 객실에 전체적으로 판 마당에. 따라서 산책하고 방은 더욱 만족하는 경우 이 값을 알고 있는 역사적인 현장.,5,4,"Marked on the Changgyeonggung Palace . at a time when the rooms were sold as a lot Thus, a historic site where you take a walk and know this value if you are more satisfied with your room."
QuickWhitTravel,"서울 시내에 있는 아름다운 궁전이 진찌로! 우리는 우리의 발을 살짝 얼 다, 하지만 가는 가치가 없다! 미스 이 합니다.",4,4,"The beautiful palace in downtown Seoul is Jinjiro! We slightly freeze our feet, but it's not worth going! Miss is doing it."
Etienne D,지하철 역 안 하고 사용할 관광 가이드라인 4 연우 소극장 으로. 창덕궁 입구를 통해 할 수 있는. 사랑스러운 곳. 그린 하우스를 방문할 때도 잊지. 매우 편안한 공원을 가로질러. 멋진 서울 역사 등등.,5,4,"To Yeonwoo Small Theater 4, a tour guide to be used without subway station. Can be done through the entrance of Changdeokgung Palace. A lovely place. When you visit the Green House, too. Across a very comfortable park. Nice Seoul history, etc."
Erin W,이 궁 은 경복궁 보다 더 작지만 잘 관리되고 있는 유럽 관광객 changdeonkgung 을 waterborn. 내가 평가할 수 있는 동부의 어느 거리 또는 changdeonkgung 팰리스의 팰리스 자체. (1000원) 입장료 minamal 볼 만하진 않지만 다른 궁궐들이 인상적입니다.,4,4,"This palace is smaller than Gyeongbokgung Palace, but it is well managed European tourist Changdeonkgung Waterborn. Some streets in the east I can evaluate or the Palace itself of Changdeonkgung Palace. (1000 won) Admission fee is not worth a minamal but other palaces are impressive."
VivaHawaii,"하지 않은 경우 찾을 수 있는 큰 궁전이 있는 곳은 중국, 볼 만 하지만 이에 포함합니다. 나는 이 곳에 두 번, 계속 추천합니다.",3,4,"If you don't, you can find a large palace in China, which is worth seeing but includes. I recommend this place twice and again and again."
flyingFrenchman29,"조용하고 아름다운 궁전에 좋은 공원... 한 한국 여자는 전통적인 드레스 의 운을 볼 수 있습니다. 오디오 가이드를 주저하지 말고, 정말 유익한 정보입니다.",5,4,A nice park in a quiet and beautiful palace. A Korean woman can see the luck of a traditional dress. Don't hesitate to use the audio guide; it's very informative.
Hajar B,"영어 가이드 투어도 제안한 하루에 두 번, 전혀 비교할 수의 사람들과 쪽지 이다. 저는 운이 좋게도 저는 하지 않은 가이드, 여행하다, 나중에 검색하여 자신의",5,4,"English guide tours are also proposed twice a day, with a complete comparison of people. I'm lucky that I didn't do a guide, travel, search later and find my own."
Stephenie/Стефи,"아마 모든 사람들이 안 할 목록 위쪽에 있는 서울. 그러나, 이 궁전은 여러 가지입니다 나 약 2 킬로미터 정도 떨어져 있다. 경우 모든 궁전 및 정원은 꼭 대략 반나절, 더 이상 없는 경우. 또한, 걸어갈 수 있는 준비를 하고. 하지만 충분히 가치가 있어서 의식 하고 있기 때문에 매우 독특한 왕궁!",5,4,"Maybe Seoul at the top of the list that everyone won't do. However, there are many different kinds of palaces. I'm about two kilometers away. All palaces and gardens must be approximately half a day, if no more. Also, preparing to walk. But a very unique palace because it is valuable enough to be conscious!"
James T,"내가 좋아하는 서울의 궁궐 아리마를 이었다. 느낌이 조금 벗어나 숨어 그 결과는 다른 사람들이 많은 조용한 사원 들 보다. 같은 지역에 있는 다른 모든 사원 들, 이는 매우 잘 복원",5,4,"It was Arima, the palace of Seoul that I like. Hiding a little away from the feeling, the result is more than the quiet temples with many others. All other temples in the same area, this is very well restored."
Robin1019,"방문하기 좋은 곳으로 한국 역사에 대한 자세한 정보. 우수한 투어 가이드를 소개 한다는 것이 영어, 중국어, 일본어.",4,4,"Detailed information on Korean history as a good place to visit. Introducing excellent tour guides is English, Chinese, and Japanese."
Yosawa,"서울에 있는 작은 궁전. 창덕궁 의 일부로 사용할 수 있습니다. 이 두 가지는 궁전까지 지하철 (걸어 갈 거리에 있지만). 그렇지 않은 분들을 걸어서. 나는 이 궁전에 같은 날 방문 하기를 추천합니다. 첫 번째 -- >창덕궁, 그리고 작은 게이트 (시크릿 가든 입구 근처에 있는) 을 통해 창경궁 할 수 있습니다. 그런 다음 버스 및 지하철을 통해 갈 수 있습니다 (t 머니 카드, 버스 요금 없음). 할 수 있는 작은 수많은 관광객이 팰리스. 주위를 배회 할 때 평화를 찾을 수 있습니다. 1",4,4,"A small palace in Seoul. It can be used as part of the Changdeokgung Palace. These two are on the subway to the palace (although they are within walking distance). I'll walk with people who don't. I recommend visiting this palace on the same day. The first -- >> Changdeokgung Palace, and a small gate (near the entrance to the Secret Garden) allow you to go to Changgyeonggung Palace. Then you can go by bus and subway (t money card, no bus fare). Palace is a small number of tourists who can do it. You can find peace when you wander around. 1"
GuilinAdventure,"한국 역사의 이해, 꼭 가봐야 할 곳입니다. 투어 가이드도 훌륭합니다. 영어 설명은 명확하고 좋은.",5,4,Understanding Korean history is a must-see place. The tour guide is also excellent. English explanation is clear and good.
sacramentan,"우리는 영어 투어, 아주 전문적이었고, 흥미롭고 교육. 이 많은 구조. 그런데 저는 하나 팰리스 착체 호텔이 많음. 따라서 이미 본 메인 팰리스, 이곳의 또는 그 반대로 할 수 있습니다.",5,4,"We were on an English tour, very professional, interesting and educational. This many structure. But I have a lot of Hana Palace hotels. Therefore, you can do the Main Palace you've already seen, here or the other way around."
Susiesuky15,"원래 지 생활, 특히 기품 있 는 귀부인 퀸즈, 보다는 좌품천사 홀, 거대 하 ㄴ 나머지 4 가 아니 었기 때문 이 ㅂ니다, 이 곳 은 풍부 하 ㄴ 역사 를 확실히 넓 고 가볼 만한 가치 가 있 어서, 가장 아름답 고 평화롭 은 공원. 시내 중심. 내 가 제일 좋아하 는 곳 중 하나 이 ㅂ니다. 모두 들 기억 하 ㄹ 수 있 는 궁궐 창덕궁 정상 작동이 확인된 동부 이 ㅂ니다. 후면 정원 모두 동일한 공유 이 ㅂ니다.",4,4,"The original life of the land, especially Queens, a noble lady, was more like a left-handed angel hall than the other four. This place is rich in history and certainly worth a visit. Come on, the most beautiful, peaceful park. Downtown. One of my favorite places is here. Remember all these things: the eastern part where the normal operation of Changdeokgung Palace has been confirmed. All rear gardens have the same shares."
violn,"저는 쇼핑을 할 수 있는 아름다운 사이트 등을 기대하지 않았습니다, 중간에 있는 도시. 티켓 가격은 매우 저렴한 것을, 이 공원을 즐길 수 있는 멋진 건물들을 방문 하기로 했습니다. 평화롭고 아름다운 곳!",5,4,"I didn't expect a beautiful site for shopping, a city in the middle. Ticket prices are very low, so I decided to visit nice buildings where I can enjoy the park. A peaceful and beautiful place and beauty!"
Kelly M,"좋은 오후 이러한핸드레일을 근처에 큰 쇼핑센터. 잘 정비된 그라운드 근처에 모든 종류의 쇼핑, 식사, 박물관.",4,4,"Good afternoon a large shopping center near these handrails. All kinds of shopping, dining and museums near well-maintained ground."
Eva A,보고 모두 관리할 수 있습니다. 건축 디자인이 너무 다른 서울의 궁궐 및 사원 옆에 바로 옆에 있다. 변경의 경비를 가보세요. 언제나 멋진 볼!,5,4,"You can view and manage all of them all. It is right next to the palaces and temples in Seoul, where the architectural design is so different. Go to the expense of the change. Always a nice ball!"
SporeArduino,"이는 역사적인 컨텍스트에 진짜 팰리스 - 이 궁전에서 3rd josen 호텔이 복합 구축할 수 있습니다. 표준 이상 팰리스 아키텍처 및 외관, 광대 한 정원이 있어서 많은 지역 주민들 에 의해 사용된 궁전에 부착된 이야기 나무 그늘 아래에서 이상적인 위치. 정원이 있는 큰 호수가 있는 큰 인스 타 그램 붇돋아주었고 설정을 제공합니다. 따라서 필요한 시간이 더 기커버 마다 팰리스 본.",5,4,"This is a historical context in which the true Palace - the Palace 3rd josen Hotel - can be combined. Ideal location under the shade of a story tree attached to a palace used by many locals with an above-standard Palace architecture and exterior, and a garden of clowns. It has a large, large lake with a garden and provides settings. So every Geekabur needs more time. Palace Bourne."
Nimrod K,이 사이트에서 놓치지 말아야 할 때... 심지어 경우; 할 수 없는 많은 시간과 역사가 봅니다.,5,4,When you shouldn't miss out on this site. Even in the case; a lot of time and history that cannot be seen.
slvi l,"최고의 한국 전통 궁전. 이 궁전, 꽃과 나무들이 있는 아주 아름다운 특히 춘추. 특히나 비원, 약 20 - 30분 거리에 있는 아름다운 전망이 보이는 곳이 주는 서울에서 가장 아름다운 곳입니다. 방문할 가치가 있는.",5,4,"The best traditional Korean palace. This palace, a very beautiful especially spring with flowers and trees. Especially, Biwon, about 20 to 30 minutes away, is the most beautiful place in Seoul. worthy of a visit"
kiltmaker2,역사적인 궁전 유적지 내에 서울 시내. 주요 도로 접근 가능한 가까운 대중 교통,4,4,downtown Seoul in historic palace sites Main Road Accessible Close Public Transportation
Sandra D,최고의 궁궐 이 다섯 가집니다 보존에 의해 세계 문화 유산 유네스코 선단 dyansty. 덕분에 왕궁 의 역사 투어를 하는 배우 다. 특정 시간에 투어가 영어로 우리가 간 날은 오후 4,5,4,"There are five best palaces. By conservation, the UNESCO World Heritage Site, Dyansty, is an actor on a history tour of the royal palace. The day we went on the tour in English at a certain time 4 p.m."
homer000red_12,"환상적인, 훌륭한 역사, 최고로 집을, 할 수 없지만 전망도 좋고 사진 찍은 밖에서 안으로 들어가. 저희는 가이드가 너무 knowlagble 함께 역사, 우리는 정보 헐번.",5,4,"Fantastic, great history, the best home, the view you can't do, and go inside from outside the picture. Our guide is too knowledgelagble history, we're information-hubbing."
Guatekarem,아름다운 색상이 빛나는 햇빛 과 매혹적인 이야기 시간에 사라져 갔다. 서울에서 꼭 봐야 하는 경우,5,4,A beautiful color faded away in the sunshine and fascinating story time. a must-see case in Seoul
minimize940314,"이는 기본 팰리스, 창경궁 이지만 제가 생각하는 가장 아름다운, 잘 정돈 된 궁전. 그리워 할 것입니다. 또한 이 잘 보존된. 궁전을 따라 산책을 할 수 있습니다.",5,4,"This is the basic palace, Changgyeonggung Palace, but it is the most beautiful and well-organized palace I think. I'll miss you. also well preserved You can take a walk along the palace."
thehelpfuldad,"서울의 궁궐 처럼, 좋은 곳이 한국의 문화 / 역사에 대해 배우고. 개인적으로 생각하는 자연 산책 이 최고의 궁전 이 기 때문에 이 곳을 방문하기 아주 좋은",4,4,"Like the palace in Seoul, a good place to learn about Korean culture/history. Personally, I think this is the best palace because of this flag, it's a great place to visit."
David G,"궁전의 건물과 왕궁 을 방문할 수 있는 다른 특별한 것은 서울, 창덕궁 등이 바로 옆에 있다. 하이라이트 가 좀 일찍 20세기 온실, 오른쪽에 있는 아름다운 구조 자체가 입장료. 화초 들 은, 너무.",4,4,"The buildings of the palace and other special things to visit are right next to Seoul and Changdeokgung Palace. The 20th century greenhouse, which is located on the right side of the house, is a bit early. Flower plants silver, too."
TravelswithMJ,아이와 함께 즐기는 가족의 아름다움과 정원 산책. 영어 투어를 즐길 수 있는 한 우리의 투어 가이드. 이른 봄에 왔습니다.,4,4,The beauty of the family and the garden walk that children. Our tour guide as long as we can enjoy the English tour. I came in early spring.
Sonia M,"나는 하지 않을 것이라고 부릅니다 기나발루에, 하지만 나는 즐겁게 추위를 물고 이 편집됨, 불구하고. 좋았던 것은 서울의 역사적인 명소로는 무료 영어 투어에 대해 그들이, 할 때는 항상 오른쪽에 있는 가지고 시간. 투어 재미있는, 재미있는, 아주 유익한 정보. 정말, 타이완 여행, 70%는 경험이죠. 저는 더 흥미로운 메인 팰리스 호텔, gyeongbukgong, 똑같이 아름다운, 훨씬 덜 붐비는.",5,4,"I call it not to do. Kinabalu, but I happily hold the cold and this edited, despite. The good thing about Seoul's historic attractions is free English tours, and when they do, they always have time on the right. Tours are fun, fun, very informative, really, Taiwan travel, 70% experience. I'm a more interesting Main Palace Hotel, Gyongbukong, just as beautiful, much less crowded."
B_from_Singapore,"시크릿 가든에 투어를 추천하고 싶다. 저희는 영어 투어 및 소년 아리마를 볼 수 있습니다. 하는 가이드가 없이 액세스할 수 없습니다. 정말 좋은 가이드는 우리가 예전에 방문 장소는 킹스 액침된 에 앉아 차를 마시는 데 남자와 함께 또 한 왕자 의 읽기 위해 사용되는 등이 있다. 하나 팰리스 에만 갈 수 있다면, 다음이 여기오시기. 또한 보다 적은 관광객이 경북 궁역 팰리스.",5,4,"I would like to recommend a tour to Secret Garden. We can see English tour and boy Arima. You cannot access it without a guide. A really good guide is where we used to visit in the old days, such as sitting in a king's liquid bed and drinking tea with a man to read another prince. If you can only go to Hana Palace, then come here. Also, less tourists visit Gungyeok Palace in Gyeongbuk."
HerbavorDallasTx,"정말 멋진 곳이며 서울을 방문 할 경우, 많은 역사와 훌륭한 사람들도 보고!",5,4,"It's a great place and if you visit Seoul, you can see many history and great people!"
Brian H,"생각하고 예약을 해서 필요한 비밀의 정원, 50만명이 답변하기 때문이라고. 하지만 그렇지 않습니다. 이 설명서에는 150 명 이상 방문하는 한. 주장은 비밀의 정원, 않습니다. 이 곳에서 3마일 필요한 팰리스, 일부는 급준파 둥급을. 하지 않다. 시간과 돈만 낭비. 정원에 있는 꽃들을 의미 있고, 하나는 행운을 빈다.",2,4,"This is because 500,000 people answer the secret garden that is needed by thinking and making reservations. But that's not true. As long as more than 150 people visit this manual. Argument is a secret garden, not a secret garden. A Palace that needs three miles from here, some of which are in a quiver's nest. Not. Wasting only time and money. The flowers in the garden are meaningful, and one is good luck."
MJ029,이 다섯 가집니다 주요 궁궐 중 가장 조용한 궁전 중 하나. 많이 붐비지 않는 창덕궁. 나와 내 여동생은 사람들이 이 곳을 방문 했을 때가 있습니다.,5,4,These five. One of the quietest of the main palaces. Changdeokgung Palace is not very crowded. There were times when people visited this place with me and my sister.
Jóna J,"매우 아름다운 궁전 및 팰리스 정원. 매우 사랑스러운 산책 8월 더위에, 체크 아웃 후에는 궁전 자체가 좋은 산책에 공원이 있습니다. 하지 않은 다른 궁궐 이 인상적인 수, 은 아니지만 멋진 보든.",5,4,"A very beautiful palace and Palace garden. A very lovely walk In the heat of August, after checking out, the palace itself has a park for a nice walk. The other palace that did not do is impressive number, not silver, but wonderful Borden."
Dala,"나는 운이 좋게도 제가 할 수 있기 때문에 일상 생활에 대한 재연 할 수 있는 작은 왕궁 의. 우리는 우리의 이름을 쓰기에 들어가기 전에 id 카드 및 해당 스레딩된 wooder 게이트 가아드 을 보여 주었다. 킹, 퀸, 경비... 그들은 정말 실제 모습, 정말 잘 치 말씀드렸고. 나는 2번 에, 그리고 하나 투어에 대해 설명하는 1st 결합할 잘 팰리스, 왕궁과 철학의 정보, 정보 간의 차이점을 여자용 건물 및 기타 건물. 좋은.",5,4,"I'm lucky to be able to reenact the daily life of a small royal palace because I can. We showed the id card and the corresponding threaded wooder gate guard before we started writing our names. King, Queen, Guard... They were really real. They were really good. I'm number two, and one st to combine, explaining one tour, the information of the royal palace and philosophy, the differences between the information, the women's buildings and other buildings. Good"
itsxjackie,강력하게 추천 하던 분들이 볼 수 있었어요. 매우 잘 마련되어 있어 내가 가이드와 함께 제공할 수 있는 개요 등 역사적 중요성은 궁 입니다. 또한 추가로 정원을 マイクロ!,4,4,"The people who recommended it could see it. The historical importance, such as the outline that I can provide with the guide, is the palace. Also, additional gardens!"
lulu a,서울에서 제일 좋아하는 궁궐같은 아키텍처. 단 한 시간에 갈 수 있다. 사람이 많이 붐비지 않습니다. 주어진 정보를 거의 한국어와 영어가 최대화 하라고.,4,4,Seoul's favorite palace-like architecture. You can go in just one hour. It's not very crowded. To maximize the information given in Korean and English.
angelzhizni,"멋진 궁전. 작은 것들 중, 덜 붐벼서, 체크 아웃을 했지만 여전히 멋진. 제가 여기서 위병 교대식 이 시작된 팰리스 통해 이동하는 도시.",4,4,"Wonderful palace. Of the small ones, less crowded, checked out, but still wonderful. The city I'm traveling from here through the Palace, where the guard rotation began."
Pauline J,아주 관광객이나 그 모든것이 초현실적 유감 같아요. 이 궁전은 이 매우 큰 궁전 단지 우리가 커버 하지 않은 호텔... 어떤 이유로 우리는 't' 정보를 궁전과 역사의 결론. 따라서 만일 관광 한국 보다 지식의 서비스를 제공할 수 있었더라면 더 팰리스 감사합니다.,3,4,"It's like a tourist and everything is surreal. This palace is this very big palace just a hotel we didn't cover... For some reason we have the 't' information in the palace and the conclusion of history. Therefore, I would appreciate The Palace if I could provide more knowledge service than Korea."
ChaiMK,이 곳이 아름다운 궁전. 는 정문은 또한. 지붕 에는 형형색색 색상과 무늬 선으로 독특한 스타일. 모든 건물이 좋은 조건을 가진 길.,4,4,This is a beautiful palace. The main gate is also. The roof has a unique style with colorful colors and pattern lines. A road where every building has good conditions.
DrSYu,"이런, 도어맨 모두 액터들. 괜찮다고 보지 않고 놓친 경우 바깥.",3,4,"Oh, doorman. All the actors. Outside if missed without looking fine."
SeungC202,가장 잘 보존된 궁전과 역사 또한 한국과 한국 문화에 대한. 가이드 투어가 있는 아름다운 궁전.,5,4,The best preserved palace and history are also about Korea and Korean culture. Beautiful palace with guide tours.
oppm4life,"대규모 지역 콘디션닝, 하지만 전체적으로 모든 건물이 비교적 동일한. 넌 안으로 들어가, 밖에서 보면 만. 겨울 추워 이런 활동. 그래도 가보시기. 실내 궁전은 영국 또는 실패.",4,4,"Large-scale local condensation, but overall, all buildings are relatively the same. You go inside, only if you see it from the outside. Winter is cold. This kind of activity. Still go. The indoor palace is either England or a failure."
Hanbyeol,"나는 놀랍게도 나쁜 경험을 했을 때 서울에서. 저는 도시 방황 좀 엉망, 나 투어 버스에서 내려서 생각 없이 궁 창경궁 정말. 처음엔 그냥 큰 뜰 생각하는 빌딩은, 하지만 더 오래 이곳에 더 해 보니 이곳은 너무나 크고 많은 숨겨진 작은 장소가 아름다운 풍경을 즐길 수 있는 환경. 이곳에서 오랫동안 둘러보면 나무 뒤쪽 섹션 및 굴곡이 궁전 건물, 무척 평화로웠습니다. 도울 지나가다 내지는 멋진 만남: 피지 매우 사랑스러운 정지 만약 시티 투어 버스! 추천합니다",5,4,"Surprisingly, when I had a bad experience in Seoul. I'm a bit out of town. I got off the tour bus and thoughtlessly went to Changgyeonggung Palace. At first, it's just a big courtyard-thinking building, but after doing it longer here, it's so big and there are so many hidden little places where you can enjoy the beautiful scenery. If you look around here for a long time, the rear section of the tree and the ridges were very peaceful. DOUL GENERAL METHOD: Fiji Very Lovely Stop If City Tour Bus! I recommend it."
ndh38317,"아름다운 경관과 함께 정말 멋진 잘 보관 역사 구조물. 또한 storytellings 대한 팰리스. 제가 가본 여름에는, 정말 멋지고 인상적이었습니다.",5,4,"A really nice well-preserved historical structure with beautiful scenery. Also Palace for storytellings. In the summer that I've been to, it was wonderful and impressive."
IanPHamilton,항상 사랑 실천 의 역사 로 돌아가려면 한국이 ' 비교 평가한 인력 및 눈금자를. 변화의 속도도 달콤한 휴식에 서둘러 현실 생활 속 현대 한국 사회의 남쪽 38th 병렬. 이동. 어!,5,4,"In order to return to the history of love practice, Korea should compare and evaluate the manpower and ruler. The pace of change is also in the 38th parallel of the South Korean society in real life, in a hurry to take a sweet break. Move. Uhh!"
BangkokPhil,제가 가본 중에 깊이 한국 겨울 기온은 영하 이 때 세븐 아마 제가 가장 생소합니다 지 않은 주변의 마음에 계속 걸리적거리 복합 사원 중국 단체 관광객 소리. 저는 그렇게 큰 팬의 사찰 또는 종교 역사와 저는 이 곳은 특별히 생각 하지 않았다. 내 반 지루 는 시간.,3,4,"I've been to a deep place in Korea, when the winter temperature is minus seven, I'm probably the most unfamiliar. The sound of a group of Chinese tourists at a complex temple that continues to be strung to the hearts of the people around him. I didn't particularly think of this place with such a big fan's temple or religious history. My half boring time."
