u_id,review,u_rate,p_id,review_en
Carly,친구들과 산책할겸 방문했어요. 도심 속 역사가 살아있어서 너무 좋았어요~ 등도 선착순으로 받을 수 있고 해설사분도 너무 설명을 잘 해 주셔서 학창시절 배운게 조금씩 추억되도락 요. 오래오래 보존되었으면 좋겠어요.,5,4,"I visited with my friends to take a walk. It was so nice to have a history in the city. You can get your back on a first-come, first-served basis, and the commentator explained it so well that you can remember what you learned in school. I hope it will be preserved for a long time."
미숙 황,가을단풍을 도심에서 완전 흠뻑 적셨네요~~화담숲 입장료 비싸게 갔는데 여기가 더 좋은것 같아요 사견이지만^ 즐거운 한나절 보낼수있어요 가을이맘때 강추 한복입으면 입장료 무료,5,4,"You've soaked the fall foliage in the city.~I went to Hwadam Forest expensive entrance fee, but I think this place is better. Though it is a private opinion, I can have a pleasant half-day. Admission is free if you wear Korean traditional clothes in autumn."
Jiyoun,경복궁보다 조용하구 이쁜풍경들로 산책하기 좋았습니다. 공사중인 구간도 있었지만 관람하기 불편하지는 않았어요 창덕궁 예매하기 힘들구 다음에 또 방문할꺼예요 온실에 동백이 필때도 가고싶어요^^,4,4,"It was quieter than Gyeongbokgung Palace and it was better to take a walk with beautiful scenery. There were some sections under construction, but it wasn't uncomfortable to watch. It's hard to book a reservation for Changdeokgung Palace, so I'll visit again next time. I want to go to the greenhouse when the camellia blooms.^^"
pic_bd,"경복궁, 덕수궁에 비하면 정말 조용하게 사색을 즐길 수 있는 곳이다. 최근 광복절 기념 무료행사에 오랜만에 다시 찾았는데 야간개장에 빌려주는 청사초롱도 들고 즐거운 시간을 가질 수 있었다. 25일까지 야간개장 및 무료개방을 하니 다들 놓치지 말길! (월요일 휴무)",3,4,"Compared to Gyeongbokgung Palace and Deoksugung Palace, you can enjoy meditation very quietly. Recently, I visited a free event to celebrate National Liberation Day after a long time, and I was able to have a good time with Cheongsa Cho-rong, which I lent to the night opening. Don't miss the open at night and free open until the 25th! (Closed on Mondays)"
213hyekyungc,"다른 서울의 궁들과 비교하면 아담하면서 아기자기한 곳이네요. 연못과 나무들도 많고, 온실도 있죠. 역시 한국의 자연의 정원이 최고예요.",5,4,"Compared to other palaces in Seoul, it is a small and cute place. There are many ponds, trees, and greenhouses. Korea's natural garden is the best."
194ren,대학로 쪽에 나갈 일이 있으면 가끔 가보는 곳이다. 경복궁과는 또다른 매력으로 아담하고 아름다운 정원이 예쁜 곳이라고 생각한다.,3,4,"If you have to go to Daehak-ro, you can go there from time to time. I think the small and beautiful garden is a beautiful place with another charm from Gyeongbokgung Palace."
EDGAR.S,예전에 일본이 창경원으로 동물을 전시해놓았던 슬픈 역사가 있는 궁궐입니다. 비원과 연결되던 시절엔 일석이조로 좋은 관광이 가능했었습니다. 지금 현재 비원과의 연결고리는 공사중입니다.,5,4,"This palace has a sad history of displaying animals in Changgyeongwon. When I was connected to Biwon, I could enjoy a good tour with two birds with one stone. The connection with B1 is currently under construction."
starrr m,서울의 여러 궁 중에서도 아름다운 곳입니다. 경복궁과 창덕궁과 더불어 아름다운 장소입니다. 이곳에 한복을 입고 놀러 가는 것을 추천합니다,5,4,It is a beautiful place among all the palaces in Seoul. It is a beautiful place along with Gyeongbokgung Palace and Changdeokgung Palace. I recommend you to go here wearing Hanbok.
KIM Gyunghee,"고궁은 창덕궁이나 덕수궁을 추천합니다. 하지만, 이 곳은 야간개장을 하니까, 야간 고궁의 멋을 보려 할 때 가시길 권해 드려요.",3,4,"I recommend Changdeokgung Palace or Deoksugung Palace. However, this place is open at night, so I recommend you to go when you want to see the beauty of the night palace."
다혜 추,겨울이라 온실이 있는 창경궁을 방문했습니다. 창덕궁에 비해 작지만 산책로는 아름다웠습니다. 생각보다 작은 온실이여서 약간 실망했습니다 1월부터 야간관람이 가능하다 하여 날씨좋은 밤에 다시 방문하려고 합니다,4,4,"I visited Changgyeonggung Palace where the greenhouse is located because it is winter. Although it is small compared to Changdeokgung Palace, the trail was beautiful. I was a little disappointed because it was a smaller greenhouse than I thought. I am planning to visit again on a fine night because I heard that night viewing is available from January."
snoopy419,창덕궁을 둘러본 후 창경궁으로 바로 넘어갈 수 있어서 편하게 이동했습니다. 어렸을 때 부모님과 동물원인 창경원으로 놀러와서 궁을 동물원으로 격하시킨 일제의 만행인지도 모르고 좋아했던 기억이 납니다. 다행히 궁으로 복원된 창경궁을 방문할 수 있어서 마음이 좋았습니다.,4,4,"After looking around Changdeokgung Palace, I could go straight to Changgyeonggung Palace, so I moved comfortably. When I was young, my parents and I came to Changgyeongwon, a zoo, and I remember liking it without knowing it was the atrocities of Japan that degraded the palace to a zoo. Fortunately, I was happy to visit Changgyeonggung Palace, which was restored to the palace."
한기 문,창경궁은 고종때 일본의 감시를 피해서 잠시 몸을 피했던 곳으로서 매우 중요한 장소이다. 나는 입장료 없이 무료로 들어갔으며(24세 이하)후원 같은경우 처음에 창경궁 들어갈때 구입하던가 아니면 후원 및 창덩궁 매표소에서 구입할 수있는데 이건 학생도 따로 구입해야 한다. 또한 현재는 3시까지 판매를 하니 가기전에 시간을 한번 알아보고 가기를 추천한다.,4,4,"Changgyeonggung Palace is a very important place to avoid Japanese surveillance during King Gojong's reign. I went in free of charge without entrance fee (24 years old or younger), and in case of sponsorship (under 24 years old), you can buy it at Changgyeonggung Palace ticket office or at Sponsor and Changdong Palace ticket office, but students have to buy it separately. Also, it is currently on sale until 3 o'clock, so I recommend you to check the time before you go."
imjjdpark,한복입으면 입장이 무료!! 한국의 문화와 건축기법을 알수 있으며 야간 개장에는 더욱 아름답다. 외국인들이 꼭 가야할 곳중에 하나이다.,5,4,Admission is free if you wear Hanbok! We can learn about Korean culture and building techniques and it is more beautiful at night. It is one of the must-go places for foreigners.
Jinny MC,산책하면서 예쁜 사진을 찍기 원한다면 강력히 추천한다. 특히 근처에 있는 한복대여점에서 한복을 대여하면 입장료가 면제된다. 꼭 체험하길 바란다.,5,4,"If you want to take a pretty picture while taking a walk, I strongly recommend it. In particular, if you rent hanbok from a nearby hanbok rental shop, you will be exempted from admission fees. I hope you experience it."
bluejay3786,"창경궁은 일제에 의해 동물원으로 격하된 역사가 있기 때문에 많은 건물들이 복원되지 못한 상태입니다. 그러한 점에선 많은 아쉬움이 남는 곳이지만 다행히 아름다운 자연은 그대로 보존되어 있어 가족들과 한가롭게 산책하기에 가장 좋은 곳입니다. 창경궁 복원을 위해 많은 한국인들이 뜻을 모아주었으면 좋겠네요. 추천 장소 1. 창경궁 대온실 2. 창경궁 춘당지(호수) 3. 문정전, 사도세자의 마지막 4. 통명전 서쪽 연지, 인현왕후 저주 사건 5. 양화당과 영춘헌 사이의 너럭바위",5,4,"Many buildings have not been restored because Changgyeonggung Palace has a history of being demoted to a zoo by the Japanese. In that sense, it is a place that leaves a lot of regrets, but fortunately, the beautiful nature is preserved as it is, making it the best place to take a leisurely walk with your family. I hope many Koreans will join forces to restore Changgyeonggung Palace. Recommended Place 1. Changgyeonggung Daegongsil 2. Changgyeonggung Chundangji (Lake) 3. Munjeongjeon, Sado Seja's Last 4. Yeonji west of Tongmyeongjeon, Queen Inhyeon's Curse 5. Neodeokbawi between Yanghwadang and Yeongchunheon"
sanrio2018,경복궁의 으리으리함은 없지만 산책로가 너무도 아름다워요~~ 창덕궁까지 다음엔 꼭 같이 보고싶네요 . 해설까지 들으면서 보시길 추천해요!,5,4,"There is no grandeur of Gyeongbokgung Palace, but the trail is so beautiful.~~~ I really want to see Changdeokgung Palace together next time. I recommend you to watch it while listening to the commentary!"
PINKSHOW01,"한때 일제 시절에는 궁궐로 대접받지 못하고 동물원으로 사용되었던 아픈 역사가 남아 있는 궁궐입니다. 경복궁이나 창덕궁에 비해 상대적으로 덜 알려진 곳이라 생각이 되었었는데, 의외로 내부가 무척이나 넓고 오래된 나무들이 많아서 청량한 느낌이었습니다. 그리고 오래된 서양식 온실이 남아 있어서 그 내부를 구경하는 재미도 좋았습니다.",5,4,"This palace has a painful history of being used as a zoo and not treated as a palace during the Japanese Colonial Period. It was thought to be a relatively lesser-known place compared to Gyeongbokgung Palace and Changdeokgung Palace, but the interior was surprisingly wide and there were many old trees, which made it feel refreshing. And it was fun to see the interior of the old Western-style greenhouse."
Andrew_Snail,싸고 저렴하다. 또 산책하면서 볼만하다. 한번쯤은 필수로 들를만한 관광지코스다. 창경궁 창덕궁 연계가 되어있는걸로 알고있기 때문에 같이 가면 좋을듯,4,4,"Cheap and cheap. It's also worth taking a walk. It is a must-visit tour course at least once. As far as I know, Changgyeonggung and Changdeokgung are connected, it would be nice to go together."
승예 이,"인터넷 예매하고 갔어요. 고궁음악회 감상 중 해가 지며 아름다웠어요. 조선의 왕 성종이 할머니와 어머니, 작은어머니를 위해 만든 궁이라 다른 궁보다 아담한 느낌입니다. 밤에 보는 춘당지와 대온실이 빛으로 물들어서 멋있어요. 다만 궁을 돌며 역사를 생각하면 마음이 좀 아프다는 함정이 있네요. 잊지말고 잘 기억합시다.",5,4,"I made a reservation online. It was beautiful as the sun went down during the palace concert. The palace was built by King Seongjong of Joseon for his grandmother, mother, and mother, so it feels smaller than other palaces. It's cool to see Chundangji and Dae greenhouse at night. However, there is a trap that it hurts to think about history while walking around the palace. Let's not forget and remember well."
ᄌ ᄀ,너무 아름답고 아기자기한 궁궐이에요. 특히 후원 관람은 너무나 특별하고 좋았습니다. 조용하게 자연과 어우러진 후원은 정말 아름다웠어요,5,4,It's such a beautiful and cute palace. Sponsored viewing was especially special and nice. The quiet nature of the sponsorship was so beautiful.
용마사,5대 궁 중의 한 곳이에요~ 현재는 아름다운 궁의 모습이지만. 과거 일제에 의해 동물원였다가 다시 복원을 한 슬픈 역사를 지나고 있는 곳입이다.,4,4,It's one of the five palaces~ Although it is a beautiful palace now. It is a place that is passing through a sad history of the restoration of the zoo after the Japanese colonial rule in the past.
Jelsomina,서울에 많은 궁들이 있지요. 궁들은 모두 너무 멋진 것 같아요. 궁나들이 좋아해서 자주 가는데 꼭 가보세요.,4,4,"There are many palaces in Seoul. I think the palaces are all so cool. I go there often because I like gungnadae, so make sure to go there."
인경 전,낮에 보는 궁도 멋있지만 저녁에 입장해서 어두워질때까지 산책할수있는 야경투어도 궁을 방문했다면 한번쯤은 경험하면 좋은 멋진 광경,5,4,"The palace you see during the day is cool, but if you visit the palace in the evening and take a walk until dark, you can experience it once."
성희 소,창경원으로 일제가 한때 격하시켰던 궁이예요... 궁이였는데 동물원으로 만들고 놀이공원처럼 만들었대요ㅠㅠ 그래도 지금은 복원되서 궁으로서 당당하게 자리잡아서 너무 좋아요.,5,4,"It was once downgraded by the Japanese to Changgyeongwon... It was a palace, but it was made into a zoo and an amusement park. But now it's restored, so I'm so happy that I'm firmly established as a palace."
Seohyeong J,경복궁과는 다른 매력이 있는 창경궁이랍니다. 보통 시크릿 가든인 비원도 같이 보면 좋아요. 내부에 온실 식물원도 다시 재개장했다고 하니 꼭 가보세요,4,4,"Changgyeonggung Palace has a different charm than Gyeongbokgung Palace. It's usually a secret garden, so it's good to watch it together. The greenhouse plant inside has been reopened, so be sure to go."
dkfma0657,궁은 언제가도 너무 좋습니다 특히 사람이 많지 않을때 방문하면 금상첨화죠 또 갈꺼예요 ㅎㅎㅎ,5,4,"I always love the palace. Especially when there aren't many people, it's icing on the cake. I'm going to go again."
이안팍,야간에 궁 오픈시 방문하면 좋아요 국악공연도 너무 좋았어요 도심에 있어서 방문하기 편해요 버스 접근성이 좋아요,5,4,It's good to visit at night when the palace opens. The Korean traditional music performance was so good. It's easy to visit because it's in the city. The bus has good accessibility
강한여자,가을이면 꼭 방문하는 곳입니다 서울의 고궁중에서 단풍의 모습이 제일 절경을 이룬다고 생각합니다 주말이면 외국인이나 가족단위로 방문하는 사람들로 꽤 분주하지만 그래도 꽤 넓어서 한바퀴 돌다보면 고궁 자체의 고즈넉한 분위기에 취해 시간 가는줄 모릅니다. 가끔 고궁 자체에서 이벤트로 여러가지 행사도 하니 참고하세요,4,4,"It's a must-visit place in autumn. I think autumn leaves are the most beautiful among the ancient palaces in Seoul. On weekends, it is quite busy with foreigners and family members, but it is still quite spacious, so if you take a walk around, you will be drunk with the quiet atmosphere of the palace itself. Sometimes the palace itself has various events as an event, so please refer to them."
민영 송,길을 걷다가 등장해서 다녀옴. 따로 돈을 안냈던것으로 기억 지금 단풍이 이쁩니다 다녀오세요,4,4,I walked along the street and came back. I remember you didn't pay separately. The autumn leaves are pretty now. Go ahead.
yusoooooo,"아기자기하고 여성스러운 느낌이 가득한 한국의 궁 경복궁도 좋지만, 야간개장시 꼭 가봐야 할 곳 중 하나",4,4,"Gyeongbokgung Palace, a Korean palace full of cute and feminine feelings, is also good, but one of the must-visit places at night."
Stereos,창경원일때 동물원 코끼리를 본 기억도 있는 아픔의 궁궐이죠. 연인과 함께 데이트 하기 좋아요,3,4,It is a painful palace where I remember seeing a zoo elephant when I was in Changgyeongwon. It's good to date a lover.
lao717,서울은 궁의 도시라는 말도 있던데요. 서울의 모든 궁은 한번쯤 들러서 구경할만 하다고 생각해요. 창경궁 역시 궁 투어를 시작했다면 꼭 한번 들러야 할 곳인데요. 예쁘고 멋스러운 창경궁을 돌다보면 한국의 궁의 미에 푹 빠질 거라 생각합니다.,4,4,"I heard that Seoul is also a palace city. I think every palace in Seoul is worth visiting. Changgyeonggung Palace is also a must-visit place if you start the palace tour. If you look around Changgyeonggung Palace, you will fall in love with the beauty of Korean palaces."
S.S. LEE,"지난 시절 창경원으로 기억된 창경궁. 대학로를 방문하는 길에 둘렀다. 우연히 시간이 맞아 해설사의 설명을 듣고 같이 창경궁을 걸었다. 장희빈과 인현왕후, 숙빈 최씨의 이야기. 역시 아는 만큼 보이는가보다.",5,4,"Changgyeonggung Palace, once remembered as Changgyeongwon. I was surrounded on my way to Daehak-ro. By chance, I walked through Changgyeonggung Palace together after hearing the explanation of the commentator. The story of Chang Hui-bin, Queen Inhyeon, and Suk Bin Choi. I guess you can see as much as you know."
seungjoy,"창덕궁은 4계절 아무때나 가셔도 상관없지만, 특히 더울때, 야간방문을 추천합니다. 다만, 1일 입장객수의 제한이 있음으로 사전에 확인 및 예약하셔야 합니다. 만약 야간투어를 예약 못하셨다면, 좀더 비싼 방법이 있습니다. 이벤트성으로 창덕궁에서 야간에 하는 공연이 있습니다. 창덕궁입장료와 공연관람료가 포함되어 있어 비싸죠. 그런데, 공연을 위주로 하시면 야간방문이 어려울수도 있습니다. 공연을 좀 보시다가 야간의 궁후원을 구경하는 것도 좋습니다. 그러나, 창덕궁은 보기보다 넓습니다. 아무쪼록 더운",4,4,"It is okay to go to Changdeokgung anytime during the 4 seasons, but I recommend you to visit at night, especially when it is hot. However, there is a limit on the number of visitors per day, so you need to check in advance and make a reservation. If you haven't made a reservation for the night tour, there is a more expensive way. There is a nightly performance at Changdeokgung Palace as an event. Changdeokgung entrance fee and performance fee are included, so it's expensive. However, if you focus on performances, it may be difficult to visit at night. It's also good to watch some performances and see the palace at night. However, Changdeokgung Palace is wider than it looks. hot enough"
Hunkim seoul,고궁 나이트 투어의 경우 여름 시즌에만 잠시 하는 이벤트 같은 행사로 항상 가고 싶었던 곳이였는데 이번에 처음으로 가봤구요. 고즈넉하니 너무 좋았습니다. 서울 한도심에서 조용하게 고궁 산책을 하니 좋더라구요. 고궁 음악회도 매우 좋았습니다. 추천합니다!!,5,4,"In the case of the old palace night tour, I always wanted to go to an event that was held only during the summer season. This is my first time going there. It was so quiet and nice. It was nice to take a quiet walk in the old palace at Hanjeongsim in Seoul. The old palace concert was very good, too. I recommend it!!"
봉기 문,어릴 적 추억만으로 방문한 창경궁은 복잡한 대도시에서 궁궐을 애전과 외전 그리소 춘당지라는 연못까지 볼 수 있어 지친 현대인의 쉼터로 추천합니다.,4,4,"Changgyeonggung Palace, which was visited only by memories as a child, is recommended as a resting place for tired modern people because you can see the palace in a complex metropolis, including the pond called Ajeon, Ojeon, Griso, and Chundangji."
hyomin78,"종묘구경후 길따라 15분쯤 걸으면 보임. 꽃이 너무 예쁘게 있는 정문 오른쪽의 정원쪽이 무척 아름다움. 소요시간이 많이 걸리지 않음. 창경궁, 창덕궁 같이 보면 좋음. 연결되어 있음. 한국보다는 외국이라는 느낌이 많을 정도로 외국인 정말 많음",4,4,"Walk along the road for about 15 minutes after Jongmyo. The garden on the right side of the main gate, where the flowers are so pretty, is very beautiful. Not taking much time. Changgyeonggung Palace and Changdeokgung Palace are good to see together. Connected. There are so many foreigners that there are more foreign countries than Korea."
Project39,"창경궁, 창덕궁은 함께 보는게 좋은데 특히 지금 이맘때 진행되는 야간개방은 꼭 한번은 다녀오는게 좋습니다! 낮에는 모래바람이 불거나 그늘이 없어 더울 수 있지만 해질녘의 궁안 산책은 훨씬 돌아보기 쉽고 새로운 경험을 하게 해줍니다. 궁이라고 해서 너무 유적지같지도 않고 친근하고 정겹습니다. 경복궁과는 다른 아기자기한 풍경들을 보면서 연인들의 산책로로 강추!",5,4,"It's good to see Changgyeonggung Palace and Changdeokgung Palace together, especially at this time of the year, it's good to visit the open night at least once! During the day, it can be hot because there is no sandstorm or shade, but walking in the palace at sunset is much easier to look back on and give you a new experience. It doesn't seem like a historical site just because it's a palace, and it's friendly and friendly. Looking at the cute scenery different from Gyeongbokgung Palace, I strongly recommend the lovers' walkway!"
Ryan3034,평소엔 너무 가까이에 있어 잊고 살지만 문득 이런 점이 좋게 느껴질 때가 있어요. 입장료도 저렴하고 외국인 친구들에게 어필도 하고 참 좋습니다.,5,4,"I usually forget because I'm too close, but sometimes I feel good about this. The entrance fee is cheap and it appeals to foreign friends and it is very good."
장두현,남자는 경복궁을 선호하고 여자는 창경궁을 선호한다는 말이 있더군요. 창경궁은 경복궁보다 선이 명확하고 굵지 않은 대신 미려한 아름다움이 돋보이는 궁궐입니다. 나홀로여행보다는 커플여행이나 가족여행으로 더 어울리는 곳이지요. :),5,4,"There is a saying that men prefer Gyeongbokgung Palace and women prefer Changgyeonggung Palace. Changgyeonggung Palace is a palace that has a clearer line and less thick line than Gyeongbokgung Palace, but has a beautiful beauty. It's a better place to go on a couple trip or a family trip than a family trip. :)"
vstellav,"창경궁만 보기에는 조금 작을수있는데 창덕궁이랑같이 묶어서 관람하면 좋습니다. 지금 식물원은 공사중? 이라 못보지만, 식물원 앞이 멋있어서 거기까지 꼭 들어가보세요",5,4,"It may be a little small to see Changgyeonggung Palace, but it is good to watch it with Changdeokgung Palace. Is the botanical garden under construction? I can't see it, but the front of the botanical garden is so nice that you should go there."
KWONG,가을의 단풍이 고궁과 너무 잘 어울리는 곳. 창덕궁과 경복궁과 다르게 조금 더 아기자기한 맛이 있는 장소이다. 창덕궁과 이어지는 입구가 있으니 창덕궁과 창경궁 모두 여행해보는 것도 좋을 것이다.,4,4,"A place where autumn foliage goes so well with the old palace. Unlike Changdeokgung Palace and Gyeongbokgung Palace, it has a slightly more cute taste. There is an entrance to Changdeokgung Palace, so it would be good to travel to both Changdeokgung Palace and Changgyeonggung Palace."
duck3222,고궁투어중에 한곳입니다. 서울 중심에 멋찐 고궁을 투어할수있는 코스로 투어 일정을 짲습니다. 다행이 야간개장까지 진행이 가능하다하여~ 노을지는 시간에 들어갔습니다. 야간개장때문에 사람은 인산인해를 이루었지만 관람객들중에 한복을 입은 모습들을 볼수있어서 현재와 과거가 공존하는 곳이란걸 느낄수 있었습니다. 넒은 잔디 밭이 펼처진곳도 있고 숲길을 따라 산책로가 있습니다. 통명전 앞에서 연회가 열리고 있기때문에 볼거리도 있습니다.,3,4,"It's one of the old palace tours. We have a tour in the center of Seoul where we can tour the cool palace. Fortunately, it's possible to open at night. We've entered the sunset time. Due to the opening of the night, people were crowded, but we could see people wearing hanbok, so we could feel that the present and the past coexist. There is a stretch of grass and a trail along the forest path. There are also things to see because a banquet is being held in front of Tongmyeongjeon Hall."
mmom661,"원래 개방을 하지 않는 것인지 제가 방문한 날엔 대온실이 개방되어있지 않고, 앞에 불도 모두 꺼져있어서 좀 실망한 것말고는 아름다운 관광명소입니다.",5,4,"It's a beautiful tourist attraction other than being disappointed because the greenhouse is not open on the day I visit, and all the lights in front of me are turned off."
p-yering,홈페이지를 참고하시면 해설 시간을 확인할 수 있습니다. 시간에 맞춰 가신다면 해설가의 설명을 들으며 창경국의 역사를 훨씬 이해하기 좋습니다. 1시간 가량의 해설을 들은 후 자유롭게 산책로를 걸으신다면 정말 좋을 것입니다.,5,4,"You can check the comment time on the homepage. If you go on time, it is better to understand the history of Changgyeongguk by listening to the commentator's explanation. It would be great to walk freely after listening to an hour's commentary."
