u_id,review,u_rate,p_id,review_en
호태2015,최고의 해설사와 멋진 해설과 아름다운 궁을 기분좋게 잘 관람 하였으나 주차 요금이 별도로 5000원 정도 났왔어요 주차요금 당연히 내여야 하지만 나중에 확인해 보니 주차 입차시간은 당겨져 있고 주차 나가는 시간은 늘어져 있어 왠지 씁슬 했어요 주차 시계가 고장인가 봐요 정확한 장치를 하여야 시비가 없을듯 빠른 조치를 부탁합니다.. 국가의 대표 궁궐 주차장인데 수준이 동네 수준입니다..,4,4,"I enjoyed the best narrator, great commentary, and beautiful palace, but the parking fee was 5,000 won separately. Of course, I have to pay for the parking fee, but later I checked and found out that the parking time was pulled and the parking time was stretched out, which made me sad. I think the parking clock is broken. I need the correct device to make sure there is no dispute. It's the representative palace parking lot in the country, and it's a neighborhood level"
부산양정남자,"아주 좋았습니다. 그저 우리의 것을 잊고 산지 참 너무 오래됐구나 생각하면서, 편안하고 즐거웠습니다. 관리도 잘 되고 있어서 참 여러가지고 편안하게 구경할 수 있었습니다~",5,4,"It was very good. It was comfortable and enjoyable, thinking that it's been so long since we've just forgotten our own. It was well managed, so I was able to look around comfortably."
Seon Young,어릴 때는 창경원이란 이름으로 방문을 했었는데... 얼마 전 다시 가본 창경궁은 너무 아름답더라구요 한국적인 멋을 가지고 아름다운 곳,5,4,"When I was young, I visited under the name Chang Kyung-won. Changgyeonggung Palace was so beautiful. a beautiful place with a Korean style"
richard0271006071,창경궁 야간개장 1년에 얼마 안하는 시간에 갔다왔어요~ 우리나라 전통 궁을 야간에 본다는 것이 정말 특별한 기억이였습니다. 또한 연못을 돌아다녀면서 야간에 경관에 감탄했습니다.,4,4,I went to Changgyeonggung Palace at a short time a year.It was a special memory to see our traditional palace at night. I also walked around the pond and admired the view at night.
masa s,"소규모의 왕궁이지만, 조용하고 마음이 차분해지는 왕궁입니다. 화려한 왕궁은 아니지만, 주변의 나무숲을 산책하면서 고요함을 맛볼 수 있는 좋은 장소입니다.",5,4,"It is a small palace, but it is quiet and calm. It's not a fancy palace, but it's a great place to take a walk in the surrounding forest and enjoy the tranquility."
Bintang27,"창경궁은 조선시대의 궁전으로, 남쪽으로는 종묘, 서쪽으로는 창덕궁과 인접해 있습니다. 원래는 1419년에 건축되어 성종의 할머니, 생모, 양모 3명의 대비를 살게 하기 위해 창건된 왕궁이라고 하며, 현재는 사적 123호로 지정되어 있는 서울의 관광 명소 중의 하나입니다. 자유롭게 자신의 다리로 돌 수도 있지만, 일본어 무료 가이드가 있으니 효율적으로 돌고 싶은 분은 이 쪽을 이용하면 좋습니다. 내부는 상당히 넓습니다. 한가로이 산책하고 있는 한국 사람들도 있었습니다. 제가 갔을 때는 대만",4,4,"Changgyeonggung Palace is a Joseon-era palace, adjacent to Jongmyo Shrine to the south and Changdeok Palace to the west. Originally built in 1419, the royal palace was built to provide a living space for Seongjong's grandmother, mother, and mother-in-law. It is currently designated as Historic Site No.123 as one of the tourist attractions in Seoul. You can freely turn around on your legs, but you can use this way if you want to turn around efficiently because you have a free Japanese guide. It's quite spacious inside. There were also Koreans who were taking a walk. When I went to Taiwan,"
チュンチュ,"창덕궁에 인접한 궁전입니다만, 방문하는 사람도 적기 때문에 천천히 산책할 수 있습니다. 관광객의 대부분은 창덕궁 또는 경복궁으로 안내되므로 창경궁까지 들르는 사람은 적은 것 같네요. 건물의 대부분은 소실되거나 철거되거나 해서 왕궁의 분위기도 적게 느낄 수 있었습니다.",4,4,"This palace is adjacent to Changdeokgung Palace, but you can take a walk slowly because there are few visitors. Since most of the tourists are guided to Changdeokgung Palace or Gyeongbokgung Palace, few people seem to visit Changgyeonggung Palace. Most of the buildings were destroyed or demolished, so the atmosphere of the palace was less pleasant."
jrrjr619,"이것은 서울 관광 목록에서 꼭 봐야 할 곳이었습니다. . 가드를 교체 할 때 찌르십시오. 또한 경비원의 사진을 찍을 수 있으며, 손을 대지 않는 한 사진을 찍을 수도 있습니다. 환상적인 사진 촬영 경험이 있습니다.",5,4,"This was a must-see place on the Seoul tour list. Poke when changing your guard. You can also take a picture of a security guard, or you can take a picture without touching it. I have a fantastic photo-taking experience."
Steve J,시청 광장 맞은 편에 위치한 서울의이 궁전은 매우 좋습니다. 그들은 당신이 가입하고 행사에 참여할 수있는 궁전 경비 프로그램을 가지고 있습니다.,5,4,"Located across from City Hall Plaza, Seoul Yi Palace is very nice. They have a palace security program where you can join and participate in the event."
Mtch,이것은 놀라운 장소이며 우리는 너무 재미있었습니다! 우리는 그들의 전통 의상 (한복)을 시도하고 궁전 주위를 여행했습니다. 돌아 다니는 거대한 장소와 매우 흥미로운 역사!,5,4,This is an amazing place and we had so much fun! We tried their traditional costumes and traveled around the palace. A huge place to roam and a very interesting history!
Stephen C,"대부분의 한국 사적지와 마찬가지로이 건축물은 대부분 재건되었지만 문은 불, 전쟁 및 일본 철거 명령에서 어떻게 든 살아 남았습니다. 튀기기 쉽다.",3,4,"Like most historic sites in Korea, most of these buildings were rebuilt, but the doors survived fire, war and Japanese demolition orders. Easy to fry."
HappyMarga,나는 평화로운 땅을 좋아합니다.이 궁전의 아름다움을 감상 할 수 있습니다. 온실은 흥미 롭습니다. 경복궁보다 관광지가 적습니다. 나는이 궁전이 특히 봄 시간에 완벽하다고 확신합니다.,5,4,"I like peaceful land.You can appreciate the beauty of this palace. Greenhouses are interesting. There are fewer tourist attractions than Gyeongbokgung Palace. I'm sure this palace is perfect, especially in spring time."
Krishhere,이 궁전은 창덕궁 옆에 있으며 작고 인상적이지 않습니다. 두 개의 궁을 분리하는 벽이 있으며 게이트가 있습니다. 궁전 정원은 광대하다.,4,4,The palace is next to Changdeokgung Palace and is small and unimpressive. There is a wall separating the two palaces and a gate. The palace garden is vast.
Malcolm Q,유료 입장이지만 외부 가이드는 추가 교육의 일부로이 궁전을 무료로 보여주기 위해 제공합니다. 영어 이름은 빌과 그의 아버지 터미네이터였습니다! .,5,4,"Although paid, external guides are provided to show the palace free of charge as part of further training. The English name was Bill and his father Terminator!"
Michael P,"서울 중심부에 위치한이 문화 유적지를 방문 할 가치가있는 매우 평화 롭고 차분한 분위기. 근거는 정말 훌륭하다. 나는 피크닉을했고, 앉았다. 그리고 사람들은 보았다.",5,4,"A very peaceful and calm atmosphere worthy of visiting this cultural heritage site in central Seoul. The rationale is really good. I had a picnic, and I sat down. And people saw."
chaletaria,다른 궁전과 마찬가지로 아름답지만 매력이 다릅니다. 온실이 특히 아름답습니다. 무료 여행은 매우 좋았습니다. 작은 (표시되지 않은) 사이드 게이트는 Secret Garden 투어로 이어집니다. 놓치기 매우 쉽습니다.,5,4,"Like other palaces, they are beautiful but have different charms. The greenhouse is especially beautiful. The free trip was very good. A small (unmarked) side gate leads to the Secret Garden Tour. It's very easy to miss."
LichfieldBoy,"이웃 인 경복궁만큼 인기가없고, 규모가 작지만 현재 재건축 중이지만 여전히 인상적입니다. 아름다운 숲이 우거진 정원만으로도 가을의 화창한 날에 나무의 색이 변하는 방문 가치가 있습니다.",5,4,"It is not as popular as the neighboring Gyeongbokgung Palace, and although it is small in size, it is still impressive even though it is under reconstruction. A beautiful forested garden alone is worth visiting on a sunny autumn day."
ErkiBear,"창경궁은 가장 아름다운 궁전이 아니며, 정직하게 말하면 우리가 비밀 정원 투어를 마쳤을 때 그 문이 바로 거기에 있었기 때문에 갔지만 궁전 통과가 있으면 빨리 둘러 볼 가치가 있습니다.",3,4,"Changgyeonggung Palace is not the most beautiful palace, and honestly speaking, we went because the door was right there when we finished our secret garden tour, but if there is a passage through the palace, it is worth looking around quickly."
StrangeTrout,"나는 방문하기에 훌륭한 장소 였을 것이라고 생각 하면서이 별 4 개를주고 있지만 거기에 접근 할 수없는 사람들이 너무 많습니다. 나는 가드의 변화가 느리고 둔한 것을 보았고, 그들이 거짓 수염을 쓰고 있는지 알아 내려고 노력하면서 시간을 보냈지 만 그 광경보다 나에 대해 더 많이 말한다고 생각합니다. 계절이 아니거나 나보다 환자가 많을 경우 가치가 있습니다.",4,4,"I'm giving these four stars, thinking it would have been a great place to visit, but there are too many people who can't access them. I've seen the changes in the guard slow and dull, and I've spent my time trying to figure out if they're wearing false beards, but I think they talk more about me than about the sight. It's worth it if it's not the season or if you have more patients than me."
vichy,"경복궁이나 창덕궁에 비해이 궁전은 크기가 훨씬 작고 볼 거리가 훨씬 적습니다. 별은 건물이 아닌 정원에 있으며, 대부분은 파괴되었지만 아직 재건되지 않았습니다. 궁전 자체는 항상 다른 두 사람에게 더 작은 궁전으로 여겨졌으며, 다 저거 여왕과 첩에 대한 숙소입니다. 정원 산책을 정말로 좋아한다면, 그만한 가치가 있습니다. 화합물의 일부인 예쁜 연못 정원이 있습니다. 그렇지 않으면 반드시 필수는 아닙니다. 특히 다른 두 가지 중 하나 또는 둘 다를 다룬 경우 특히 그렇습니다. 이 궁에 어떤",3,4,"Compared to Gyeongbokgung Palace or Changdeokgung Palace, this palace is much smaller and has much less to see. Stars are in gardens, not buildings, most of which have been destroyed, but have not yet been rebuilt. The palace itself has always been considered a smaller palace for the other two, and it's all about the queen and her concubine. If you really like gardening, it's worth it. There is a pretty pond garden that is part of the compound. Otherwise, it is not mandatory. This is especially true if you are dealing with one or both of the other. What kind of palace is this?"
Oldjack,15 세기 중반에 지어진이 건물은 16 세기에 일본인들에 의해 본질적으로 파괴되어 재건되었습니다. 1900 년대 초 일본인들은 다시 해냈습니다. 인상적이고 방문 할 가치가 있습니다.,4,4,"Built in the mid-15th century, the building was essentially destroyed and rebuilt by the Japanese in the 16th century. In the early 1900s, the Japanese did it again. Impressive and worth visiting."
Mr C,창경궁은 서울의 5 개의 궁전 중 하나입니다. 이웃 창덕궁만큼 크거나 인상적이지는 않지만 모두 똑같이 볼 수있는 좋은 장소입니다. Josean 스타일 아키텍처의 좋은 예. 정원은 특히 좋으며 Crystal Palace를 모델로 한 온실이 있습니다. 1000 KW에서 좋은 가치. 인접한 창덕궁에서 입구를 가질 수 있습니다.,5,4,"Changgyeonggung Palace is one of the five palaces in Seoul. Although it is not as big or impressive as neighboring Changdeokgung Palace, it is a good place to see all the same. A good example of Josean style architecture. The garden is especially nice and there is a greenhouse modeled after Crystal Palace. Good value at 1000 KW. You can have an entrance at the adjacent Changdeokgung Palace."
Vera K,한국의 전통 건축. 궁전은 전쟁 후 부분적으로 복원되었지만 지붕 타일과 같은 일부 부품은 정품입니다. 매우 분위기있는 사진을 얻습니다.,5,4,"traditional architecture of Korea The palace was partially restored after the war, but some parts, such as roof tiles, are genuine. Get a picture with a very good atmosphere."
Ann C,"4 궁궐과 10, 000 (약 8 달러, 80 달러)에 왕실을 포함 왕궁의 패스를 구입 고려하고 입구에서 영어 안내 책자를 선택해야합니다. 원래이 위치에 있던 궁전에는 정원이 없었습니다. 이제 그랜드 온실뿐만 아니라 경내에는 정원과 연못이 있습니다. 적은 사람들이이 궁전을 방문하는 것처럼 보입니다. 덜 혼잡합니다.",4,4,"4 Consider buying passes from the royal palace, including the royal family, for the palace and 10, 000 (about $8, $80) and select an English brochure at the entrance. There was no garden in the palace where it was originally located. Now there are gardens and ponds in the compound as well as the Grand Greenhouse. It seems like a few people visit the palace. It's less crowded."
TravelingLia,* 재미있는 사실 : 1900 년대 초 일본의 점령 과정에서 한국인의 존엄성을 위협하는 단계에 따라 일본은 동물원으로이 궁전을 돌 렸습니다. 이 장소는 나중에 해방 후 복원되었습니다. 훌륭한 사진 촬영 기회와 함께 한국 역사에 대해 배울 수있는 좋은 곳입니다.,5,4,"* Funny fact: In the early 1900s, Japan took a tour of the zoo at a stage that threatened the dignity of Koreans during Japan's occupation. This place was later restored after liberation. It is a great place to learn about Korean history with a great photo opportunity."
Gow,"나는 10 월에 여기에 갔고 그 당시 휴가가 있었고 많은 사람들, 특히 소녀들은 전통 의상을 입고있었습니다. 방문 할만한 가치가있는 곳. 서울은 정말 아름다운 도시입니다.",5,4,"I went here in October and had a vacation at the time and many people, especially girls, were wearing traditional costumes. a place worth visiting Seoul is a beautiful city."
Isabel Dekeyser,모든 궁전을 방문해야합니다. 모두 거기에 자신의 방식으로 특별하다. 경복궁과 창경궁을 꼭 방문해보십시오.,5,4,You must visit all the palaces. All are special there in their own way. Be sure to visit Gyeongbokgung Palace and Changgyeonggung Palace.
Calvin C,서울에서 가장 인기있는 4 번째 궁전인데 가장 매력적인 곳은 아니지만 매력적인 자연 경관과 평화 로움 때문에 내가 좋아하는 곳입니다. 많은 사람들이 여기를 방문하는 것은별로 좋지 않습니다. 나는 8 월에 두 번 방문하면서 4 번이나 여기에 왔습니다. 입력하는 데만 1 천원이 든다. 그것은 또한 좋은 연못과 온실이 있습니다.,4,4,"It is the 4th most popular palace in Seoul and it is not the most attractive place, but it is my favorite place because of its attractive natural scenery and peace loom. It's not good for many people to visit here. I came here four times in August, visiting twice. It costs 1,000 won just to input. It also has good ponds and greenhouses."
German F,"궁전 으로 간다, 창경궁 에 있는 궁전은 크기 면에서, 개방성 및 아키텍처. 이 놀라운 벽에서 현대적인 도시.",5,4,"Go to the palace, the palace in Changgyeonggung Palace, in terms of size, openness and architecture. From this amazing wall, a modern city."
Russ Lacuata,"팰리스 로드 3 이 경복궁 에서 창덕궁 투어는 제작 후, 원래의 수가 3 퀸즈 레지던스 kiving 공간 부족으로 인해 창덕궁 근처에. 알 이 작은 복도 가 있는 몇 가지 타사 구체적인 레이아웃을 팰리스. 건물들이 아닌 특정 방향으로 정렬하는 포토그래피 게 위치해 있다. 주거 내부 복도 보다 크고 정교한 관리 였는데 원래 외부 복도로 주거 지역에 있었어요. 모두 투어 도 있지만 별도의 티켓 조합 수 있어야 하며 구입할 수 있습니다. 비밀의 정원을 놓치지 마세요. 별도의 요금을 지불하면 티켓의",4,4,"Palace Road 3 The tour of Changdeokgung Palace, after production, was near Changdeokgung Palace due to the lack of space for the original number of three Queens Residence Giving. Palace has several specific layouts of the third party with this small hallway. Photographs are located that align in a specific direction, not in buildings. It was a larger and more sophisticated management of the inner corridor, but it was originally located in the residential area of the outer corridor. All are tourable, but there must be a separate combination of tickets available and can be purchased. Don't miss the secret garden. If you pay a separate fee, you'll get a ticket."
Robert G,특별한 건 없지만 흥미로운 곳은 몇 시간 동안. 우리는 우리의 방문 했지만 더운 날 때문에 오래 머물지 않을 만큼 이다.,3,4,"Nothing special, but interesting places for a few hours. We have made our visit but not long enough because of the hot weather."
SamWorld,가까이에 위치해 중앙 지역. 창경궁 은 아름다운 궁전 사진 촬영. 사람들이 많지 않습니다. 따라서 평화로운. 1 시간은 충분한 이 곳. 나는 서울에 있는 고궁 과 유사하다. 대신에 1 또는 2를 방문 할 수 있다.,4,4,"Located nearby, the central area. Changgyeonggung is a beautiful palace photo shoot. There aren't many people. thus peaceful This place has enough time for an hour. I am similar to the old palace in Seoul. Instead, you can visit 1 or 2."
KariXO,매 시간마다 맨 위에있는 변경할 수 있는 안전 요원. 이 흥미로운 역사와 아름다운 궁전. 안 가고 사진을 빌려서 hambok.,5,4,"A changeable safety guard at the top of every hour. This interesting history and beautiful palace. I borrowed the picture and didn't go, so hambok."
MrMrsMsTan,"평화롭고 조용한 평일 가면, 빌릴 수 있어 입어 근처에 있는 왕궁 의 아름다운 사진 거리 하고. 주의해야 할 경비 변경 사항을 기존의 관습.",4,4,"If you go on a peaceful and quiet weekday, you can borrow it. Wear it. Beautiful photo street of the royal palace nearby. Conventional convention on changes in expenses that should be noted."
timoshym,이 보다 더 좋은 것은 없지만 조금 더 큰 경복궁 이 매우 흥미로운 정보 이다. 역사적인 건물들이 있는 큰 공원.,3,4,"There's nothing better than this, but a little bigger Gyeongbokgung Palace is a very interesting piece of information. A large park with historic buildings."
LENNARD C,"흥미로운 역사 가는 곳이기 때문에. 저를 생각 나게 베이징의 자금성, 중국. 쉽게 걸어갈 수 있는.",3,4,"Because it's an interesting place to go to history. Beijing's Forbidden City, China. Easy to walk."
zacharysmithr,"이는 작은 궁전, 좋은 나무가 우거진 지역 을 산책, 그 큰 잉어와 오리들 은 호수. 불행하게도, 현재의 생각 까지 폐쇄 2017년 11월 10일 그린 하우스. 하지만 일부 식물이 한 이동된 있는 표시, 좋았습니다.",4,4,"It's a small palace, a nice wooded area, a lake of big carp and ducks. Unfortunately, it's closed to the present thought. Green House on November 10, 2017, but some plants have been moved, and it's good."
Charl0tte2012,우리가 우리 자신의 투어 가 있습니다. 왕궁은 보너스가 정말 좋은 멋진 의상 의 경우 모든 문화. 모든 아름다운 볼 수 있습니다. 할 수 있는 훌륭한 건축 및 단지 아름다운 정원.,4,4,We have our own tour. The royal palace is all about the culture of fine costumes with really good bonuses. You can see all the beautiful things. A fine architecture and just a beautiful garden to do.
helenacp,"방문하기 좋은 장소에 대한 자세한 내용은 투어는. 입구는 정말 저렴한 가격에 제공하는 무료 가이드 투어를 특정 시간, 추천 한다. 하고, 마침 여행 때, 계속 돌아다닐 것이 다 - 여행!",5,4,"For more information on good places to visit, the tour is. The entrance recommends a free guide tour at a certain time, at a really low price. And then, just in time, on a trip, everything to keep going. - Travel!"
vaccarile,서울에 있는 동안 꼭 했습니다. 이 공원은 아주 좋고 잘 정비가 되어. 서울에 있는 기념관 스트럿 재구성할 수 있는 ' 70 s. 다소 차가운 좋아요. 나는 더욱 활기찬 실제와 같은 커피 제공. 입구가 궁전 근거 (2000) 가격 대비. 지불 가치 가. 모든 것은 (또는 대부분의 it) 따라서 설명을 자세히 읽어 재구성할 필요가 파악할 수 있습니다. 전반적으로 좋지만 압도 경제적이지는 않,3,4,"I did it while I was in Seoul. This park is very nice and well-maintained. 70 s for reconstruction of Memorial Hall Strut in Seoul. It's a bit cold. I offer more lively real-life coffee. Entrance against Palace Base (2000) Price. Value of payment. Everything (or most it) so you can read the description carefully to see if you need to reconstruct it. Overall good, but not overwhelmingly economical."
Kamioni-Avioni,"꼭 봐야 하는 곳, 하지만 아주 특별한 않습니다. 어떤 곳이 문을 닫을 수 있었습니다. 이는 한국 역사 가 중요합니다. 위치가 매우 좋고 지하철과도 가깝습니다.",3,4,"It's a must-see place, but it's not very special. Somewhere could be closed. Korean history is important. The location is very good and close to the subway."
RyanLCK,이 궁전은 큰 정원 안에 있었다. 사진을 찍지 않을 아주 좋은 곳. 궁전은 매우 깨끗하고 풍부한 역사를 뒤에 있을 수 있습니다. 5 시에 일찍 와서 같이 할 수 있어.,5,4,This palace was in a large garden. A very good place not to take pictures. The palace is very clean and can have a rich history behind it. I can come early at 5 o'clock and do it together.
Miguel P,그랜드 팰리스 재밌는 사이트 또한 위병 교대식 이 매일. (우리가 본 1 시). 주위에 로밍 이 될 수 있지만 이 무료로 추가할 수 있는 입장료 를 입력합니다. 사람들은 확실한 첫 번째 참조해야 합니다.,5,4,Grand Palace's fun site also has a guard rotation every day. (At 1 o'clock we've seen it' Enter an admission fee that can be roaming around but can be added free of charge. People need to make sure that the first reference is made.
Mdecker17,이는 나를 보고 주변에 큰 궁전 였는데 비가 쏟아져. 이와 함께 보는 세계 문화 유산.,5,4,"It was a big palace around me, but it rained. The World Heritage Site is also viewed with this."
Al_Tsch,"반나절의 여유가 있다면 서울, 팰리스 를 방문하여 이동. 서울의 유일한 궁전 파악해야 합니다. 비가 내리지 않은 경우, 수 하고 있지 않아, 이 나무 그늘에서 휴식을 취할 수 있는 연못에서 물고기를 볼 수 있는 나.",4,4,"If you have half a day to spare, visit Seoul, Palace and go. Find out the only palace in Seoul. If it doesn't rain, I'm not embroidered, I can see fish in the pond where I can rest in the shade of this tree."
Dino Santos Jr,"거대한 곳입니다. 길 건너에 쇼핑을 할 수 있는 빌려 입어 대여, 무료로 궁 창경궁 입력합니다 (경우에 옷을 입고 있어 입어}. 모든 것을 내어 입어 궁전을 스냅 수 있습니다. 좋은 재미",5,4,"It's a huge place. Rent for shopping across the street, enter the palace and Changgyeonggung Palace free of charge. You can take everything out and snap the palace. good fun"
