u_id,review,u_rate,p_id,review_en
으헤헤헤헹,도심한가운데서 자연을 느낄 수 있고 운치를 느낄 수 있습니다. 먹을 거리가 있는것은 아니므로 다 둘러보시고 주면에 좀 나가서 맛있는것을 드시면 될것 같습니다.,5,4,"You can feel nature and the scenery in the middle of the city. There's nothing to eat, so you can look around and go out to eat something delicious."
양남댁,궁자체도 너무 좋지만 후원을 거닐면서 산책하면 너무나도 좋습니다. 문화해설 시간 맞춰서 같이 들으면 더 좋아요,5,4,"It's great to take a walk, but it's great to take a walk while walking through the sponsorship. It's better to listen to it together on time for the cultural commentary."
파도피아노,봄과 가을에 멋진 고궁의 경치를 감상하며 분위기 있는 데이트를 즐기고자 하는 분들에게 추천드립니다. 절대 후회하지 않을 거에요.,5,4,I recommend it to those who want to enjoy the beautiful scenery of the palace in spring and autumn and enjoy a nice date. You'll never regret it.
dahun H,낮의 창경궁과는 정말다르고요 음악회가 정말 재밌습니다 시간금방가요 둘러보고 연못도보고 단돈 천원에 누나랑정말재밌었어요,5,4,"It's really different from Changgyeonggung Palace during the day. The concert is really fun. It was so much fun with my sister for only 1,000 won."
Euphem_Korea,부모님과 함께한 야간개장. 선선한 바람을 맞으며 고궁을 산책하니 좋았습니다. 한국의 전통 악기로 하는 음악회 역시 즐거웠구요. 미리 예약하기가 힘들지만 가볼만 합니다.,5,4,"Night opening with parents. It was nice to take a walk in the old palace in the cool breeze. The concert with Korean traditional instruments was also fun. It's hard to make a reservation in advance, but it's worth visiting."
hyeje0n9,창경궁 또한 아름답다. 꽃놀이를 위해 방문했지만 꽃보다 궁이 더 좋았다. 입장료는 아주 저렴하다.,5,4,"Changgyeonggung Palace is also beautiful. I visited for flower viewing, but I liked the palace better than the flowers. Admission is very cheap."
HN0610,"조용하고 아름다운 곳이라 머리 식히며 천천히 산책하기 좋은 곳입니다. 다만, 볕이 너무 뜨거운 날은 피하시는 것이 좋겠습니다.",5,4,"It's a quiet and beautiful place, so it's a good place to take a walk slowly and cool your head. However, you'd better avoid it when the sun is too hot."
pang2mom,문화재해설해주시는 분이 계시니 시간 맞춰 방문하시길 권해드립니다. 현재 식물원은 보수중입니다. 산책겸 방문하기 좋습니다.,4,4,We recommend that you visit on time since there is a cultural commentator. The botanical garden is under repair. It's good for a walk.
rupin09,고궁의 고즈늑한 분위기를 도심속에서 느낄 수 있어요. 창경궁 야간개장을 온 손님들에게 작은 고궁음악회도 즐길거리입니다. 작은 연못에 비추인 조명이 멋있어요.,5,4,"You can feel the cozy atmosphere of the palace in the city center. For guests who come to Changgyeonggung Palace at night, a small palace concert is also a place to enjoy. The lighting in the small pond is wonderful."
이안팍,이번에 야간특별관람시 방문했는데 경복궁 야경보다 잔체적으로 좋았다 특히 여기서 본 고궁음악회는 최고였다,5,4,"This time, I visited during the night special, and it was better than the night view of Gyeongbokgung Palace. Especially, the palace concert I saw here was the best."
hyeje0n9,창경궁 또한 아름답다. 꽃놀이를 위해 방문했지만 꽃보다 궁이 더 좋았다. 입장료는 아주 저렴하다.,5,4,"Changgyeonggung Palace is also beautiful. I visited for flower viewing, but I liked the palace better than the flowers. Admission is very cheap."
HN0610,"조용하고 아름다운 곳이라 머리 식히며 천천히 산책하기 좋은 곳입니다. 다만, 볕이 너무 뜨거운 날은 피하시는 것이 좋겠습니다.",5,4,"It's a quiet and beautiful place, so it's a good place to take a walk slowly and cool your head. However, you'd better avoid it when the sun is too hot."
pang2mom,문화재해설해주시는 분이 계시니 시간 맞춰 방문하시길 권해드립니다. 현재 식물원은 보수중입니다. 산책겸 방문하기 좋습니다.,4,4,We recommend that you visit on time since there is a cultural commentator. The botanical garden is under repair. It's good for a walk.
rupin09,고궁의 고즈늑한 분위기를 도심속에서 느낄 수 있어요. 창경궁 야간개장을 온 손님들에게 작은 고궁음악회도 즐길거리입니다. 작은 연못에 비추인 조명이 멋있어요.,5,4,"You can feel the cozy atmosphere of the palace in the city center. For guests who come to Changgyeonggung Palace at night, a small palace concert is also a place to enjoy. The lighting in the small pond is wonderful."
이안팍,이번에 야간특별관람시 방문했는데 경복궁 야경보다 잔체적으로 좋았다 특히 여기서 본 고궁음악회는 최고였다,5,4,"This time, I visited during the night special, and it was better than the night view of Gyeongbokgung Palace. Especially, the palace concert I saw here was the best."
moonkyoung j,정기 입장료 구입하면 평일에 할인된 가격으로 입장 가능하고 한적합니다 ^^ 단 본인만 사용 가능하니 참고바래요,5,4,"If you buy a regular admission fee, you can enter at a discounted price on weekdays. Please note that only you can use it."
bjh3676,"가까운 지하철역으로는 1호선 종로5가, 4호선 혜화, 3호선 안국역 등이 있는데 도보로 오기에는 약간 무리가 있습니다. 안국역에서 창경궁 쪽으로 가는 버스가 많습니다. 경복궁이나 창덕궁에 비해 사람이 적은 편이어서 오히려 더 운치있습니다.",4,4,"Nearby subway stations are Jongno 5-ga on Line 1, Hyehwa on Line 4, and Anguk Station on Line 3, which is a little too much to walk. There are many buses from Anguk Station to Changgyeonggung Palace. Compared to Gyeongbokgung Palace or Changdeokgung Palace, there are fewer people, so it is more beautiful."
체리요정,조선시대에 지어진 서울에 남아있는 궁궐중에서 세번째로 지어진 창경궁. 세분의 대비를 위해 지어진 효심의 공간입니다. 창경궁에 오시면 다양한 이야기들이 기다리고 있으니 꼭 해설을 들어보시기를 권유합니다^^,5,4,"Changgyeonggung Palace, the third of the remaining palaces in Seoul built during the Joseon Dynasty. It is a space of filial piety built for three people. If you come to Changgyeonggung Palace, you'll find a variety of stories waiting for you, so I recommend you listen to the commentary.^^"
miyani0613,가끔 주기적으로 야간개장이 열릴때마다 티켓 구하기가 전쟁인데 작년에 운이 좋게 구하게 되어 다녀왔습니다. 낮에 보는거랑은 또 다른 매력이네요~ 한번쯤은 다녀와보길 추천!,5,4,"It is a war to get tickets every time the night opening is held regularly, but I was lucky to get them last year. It's a different charm than watching it during the day. I recommend you to go at least once!"
crazyngel,겨울에 갔었는데 조용하고 창덕궁과 함께 둘러보기 좋은 위치에 있고 가이드 분들과 함께 설명들으며 구경하면 더 좋을꺼같아요,4,4,"I went there in the winter, but it is quiet and it is a good place to look around with Changdeokgung Palace, and I think it would be better to look around while listening to the explanations with the guides."
진규 이,창경궁은 궐 내의 전각들보다는 그 전각들 사이에 펼쳐진 정원들이 더 아름답고 예쁘다. 물론 그 둘의 조화로움 역시 뛰어나다. 다른 궁들보다 더 넓고 탁 트인 곳이 많아 이리저리 거니는 것만으로 마음이 평화롭고 넉넉해진다. 나라를 다스리는 일로 어지러웠을 옛 임금님들의 마음을 달래주었을 궁의 정원이었던 만큼 지금의 나도 우리도 시끄러운 세상살이에 지친 우리의 머릿 속을 식혀주고 마음 속을 고쳐주는 좋은 장소이다.,4,4,"Changgyeonggung Palace is more beautiful and beautiful than the pavilions in the palace. Of course, the harmony between the two is excellent as well. There are more spacious and open places than other palaces, so just walking around makes your mind peaceful and generous. As it was a palace garden that would have soothed the minds of the old kings who would have been dizzy from governing the country, it is a good place for us to cool our heads and heal our minds tired of the noisy world."
파란소나기,경복궁보다 작다고 느껴질 수도 있지만 고즈넉하게 산책하기 좋은 곳입니다. 저는 야간개장때 갔었는데 개인적으로는 낮이 더 아름다울 것 같아습니다.,4,4,"It may feel smaller than Gyeongbokgung Palace, but it is a good place to take a quiet stroll. I went during the night opening, but personally, I think the day would be more beautiful."
Yobhike,"많은 분들이 공감하시겠지만, 정말 예쁜 궁입니다. 대학로에 놀러 갔을 때 가볍게 산책하기도 참 좋았습니다.",5,4,"I'm sure many of you agree, but it's a beautiful palace. When I went to Daehak-ro, it was nice to take a walk lightly."
soobok,서울에 있는 궁중에서 걷기에 좋은 장소입니다. 예전 동물원과 식물원이 있기도 했지만 조선의 역사가 살아 숨쉬는 곳입니다.,4,4,"It is a good place to walk in the palace in Seoul. There used to be a zoo and a botanical garden, but it is a place where the history of Joseon lives."
sunnyje,"다른 고궁에 비해 정원이 넓고 녹지가 많아 산책하기 좋습니다. 일제시대에 일본인들이 우리 문화의 위상을 떨어뜨리기 위해 창경궁을 창경원으로 격하시켰다고 합니다. 동물원도 만들고, 궁 안에 벚나무를 심는 등 공원 시설로 만들어버린 거죠. 그 영향인지 창경궁 안에는 벚꽃나무가 많습니다.",5,4,"Compared to other ancient palaces, the garden is wider and has more green areas, so it is good to take a walk. During the Japanese Colonial Period, the Japanese downgraded Changgyeonggung Palace to Changgyeongwon in order to lower the status of our culture. They built a zoo, planted cherry trees in the palace, and made it into a park facility. Perhaps because of that, there are many cherry blossom trees in Changgyeonggung Palace."
자몽쥬스00,여기 봄에 정말 좋아요. 꽃필때쯤 가면 그렇게 넓지도 않고 조용히 산책하기 너무 좋습니다. 역사를 느끼며 이런저런 생각도 하게되고 가격도 저렴하고 ^^,4,4,"It's really nice here in spring. It's not that big when it blooms and it's great to take a walk quietly. I feel history and think about this and that, and the price is low ^^"
say895,지하철을 이용하기는 조금 번거롭고 버스를 타면 가까운 정류장이 있습니다 ㅎㅎ 다른 고궁보다 조용한 편이고 관광객도 적은 것 같아요~,4,4,"It's a bit cumbersome to use the subway, and there's a bus stop nearby. I think it's quieter than other palaces and there are fewer tourists."
빵이아빠,화려하거나 큰 궁궐은 아니지만.. 산책삼아 방문하기에는 좋은 곳입니다. 안쪽에 연못과 식물원도 있습니다.,4,4,"It's not a fancy or big palace, but... It's a good place to visit for a walk. There is a pond and a botanical garden inside."
everlsk,"창경궁은 춘당지가 개인적으로 가장 아름답습니다. 봄 벚꽃과 가을 단풍을 가장 멋지게 볼 수 있는 곳이 춘당지이며, 야간개장 시에는 고궁 야경의 아름다움을 느낄 수 있습니다.",5,4,"In Changgyeonggung, Chundangji is personally the most beautiful. Spring cherry blossoms and autumn foliage are the best places to see in Chundangji, and you can feel the beauty of the night view of the palace at night."
Sujung,"야간 개장 표를 다행히 예매할 수 있어서 가을 밤을 잘 즐기고 왔습니다. 다른 궁에 비해서는 작지만, 아기자기한 멋이 좋습니다.",5,4,"Fortunately, I was able to reserve tickets for the opening of the night, so I enjoyed the autumn night well. It is small compared to other palaces, but I like the cute look."
로라 킴,전 덕수궁은 못가봤고 창경궁만 가봤는데 고즈넉하다는 표현을 쓸수있을만큼 너무 좋아요 서울에선 보존 잘해서 나중에 대대손손 우리 후손들도 볼 수 있었으면 좋겠어요,5,4,"I've never been to Deoksugung Palace, and I've only been to Changgyeonggung Palace, and it's so good that I can use the expression ""neutral."" I hope to preserve it well in Seoul so that we can see our great-grandchildren in the future."
Hye Jin L,창경원이라는 가슴 아픈 역사를 가진 궁궐로 동물원 자리는 정원과 연못으로 잘 복원되었다. 근대화 일제식 건물인 대온실은 남아 있으나 크게 거슬리지는 않는다.,5,4,"Changgyeongwon is a palace with a heartbreaking history, and the zoo's location has been well restored to gardens and ponds. A modernized Japanese-style building, a large greenhouse, remains, but it does not bother you much."
mkla1004,경복궁에 비해 작지만 아기자기한 멋이 있습니다. 아이들과 가서 사진 찍기 좋고 해설사 설명도 선 예약후 한번 들어보시면 좋을거 같습니다.,3,4,"It is smaller than Gyeongbokgung Palace, but it has a cute look. It's good to take pictures with children and listen to the explanation of the commentator after making a reservation."
jjbar,서울의5대고궁에들어가며특히봄에야간계장이너무나멋있으며아이들과꼭한번쯤은다녀와야한다고봄니다그런데주변에먹거리가부족해요,4,4,"Entering the 5 great palaces in Seoul, especially in spring, the Chief of the Night's Night is so cool and I think I should go there with my children at least once.But there's not enough food around."
124gracie,우리나라 사대궁중에 하나에요. 얼마전에 우리꽃 전시회가 있어서 다녀왔네요. 어느 궁이나 마찬가지듯이 이뻐요. 만 24세 미만은 입장료 무료..!,5,4,It is one of the four great palaces in Korea. I went to our flower exhibition not too long ago. It's as pretty as any palace. Admission is free for those under 24 years of age.
znzl,다른 궁들보다 크기가 작은편이지만 연못에 작은 섬이 있고 조금더 가면 아담한 온실이 있어서 다른 궁보다 더 예쁘다고 느꼈습니다. 입장료도 부담없어서 대학로에서 식사하고 산책겸 둘러보면 좋을 것 같아요.,4,4,"Although it is smaller than other palaces, there is a small island in the pond and a small greenhouse so I felt that it was prettier than other palaces. The entrance fee is no burden, so I think it would be good to have a meal at Daehak-ro and take a walk around."
2875rosa,지하철역에서도 가깝도 소박하고 아담한 궁입니다. 돌담길을 산책해도 좋을 곳이예요 시청 근처입니다,5,4,It is a simple and cozy palace near the subway station. It's a good place to take a walk along the Stonewall Walkway. It's near City Hall.
퍼언,"경복궁, 창덕궁, 창경궁, 덕수궁 중 저는 창경궁이 가장 마음에 들더라구요 일단 입장료가 쌉니다. 1000원. 그리고 고즈넉합니다. 혜화역에서 오려면 서울대병원을 넘어야하기 때문에 늘 한적한 편이에요 그리고 큽니다. 식물원과 호수까지 가려면 상당히 걸어들어가야 하는데, 여기까지 가면 한적하고 조용하고, 뭔가 도심의 휴식처 같은 느낌이 듭니다. 창경궁 바로앞에 서울대병원 암병원이 있는데 여기 5층에 카페가 있습니다. 여기서 보는 창경궁의 전경도 매우 멋지니 꼭 봐보세요",5,4,"Among Gyeongbokgung Palace, Changdeokgung Palace, Changgyeonggung Palace, and Deoksugung Palace, I like Changgyeonggung Palace the most. First of all, the entrance fee is low. 1,000 won. And it's quiet. It's always quiet and big because I have to go over Seoul National University Hospital to come from Hyehwa Station. You have to walk quite a bit to get to the botanical garden and lake, and it's quiet and it feels like a resting place in the city. There is a Seoul National University Hospital Cancer Hospital right in front of Changgyeonggung Palace, and there is a cafe on the 5th floor. The view of Changgyeonggung Palace from here is very nice, so make sure to watch it."
SCY,"서울 중심가를 걷다보면 고궁들과 아기자기한 골목길들이 있습니다. 저는 경복궁과 창경궁을 하루 안에 다 관람하였는데 매우 좋았습니다. 일제시대 후로 창경원 이라는 동물원으로 쓰인 아픈 역사가 있지만 현재는 다시 고궁의 분위기로 돌아왔습니다. 청소년 무료입장과 성인의 입장료는 천원 이라는 매우 합리적인 입장료와 창덕궁으로 이어져있고, 궁 밖에는 돌담길이 있는 덕에 매우 아름답습니다. 아쉽게도 창덕궁을 입장하려면, 삼천원을 내야 합니다. 하지만, 창경궁을 관람하는 것 만으로도 충분히 좋습니다.",5,4,"There are old palaces and cute alleys in downtown Seoul. I watched Gyeongbokgung Palace and Changgyeonggung Palace within a day and it was very good. After the Japanese Colonial Period, there was a painful history of being used as a zoo called Changgyeongwon, but now it has returned to the atmosphere of the ancient palace. The free admission fee for teenagers and adults is 1,000 won, which leads to a very reasonable admission fee and Changdeokgung Palace, and it is very beautiful because there is a stone wall road outside the palace. Unfortunately, if you want to enter Changdeokgung Palace, you will have to pay 3,000 won. However, just watching Changgyeonggung Palace is enough."
아무야,"가을이면 꼭 찾아가는 창경궁이에요. 단풍이 너무나도 이쁘고, 문화해설사가 있어서 자세한 설명을 들을 수 있어서 좋아용",4,4,"It's a must-visit Changgyeonggung Palace in autumn. I like autumn leaves because they are so pretty and there is a cultural commentator, so I can listen to the detailed explanation."
bcbggogo,대학로 나갔다 시간이 남으면 들러서 산책해요 혜화역에서 10분 15분안에 걸어서 도착 가능합니다 복잡한 곳에 있다 궁에 들어가면 서울이 아닌듯 고요하고 마음이 차분해집니다 특히 가을에 단풍들면 더 아름답구요 춘당지 호수? 쪽 벤치에 앉아있으면 참 좋아요 입장료 천원이 절대 아깝지 않아요~ 가을 나들이로 추천합니다,5,4,"If you have time, stop by and take a walk. You can get there by walking from Hyehwa Station in 10 minutes and 15 minutes. When I enter the palace, I feel calm and calm like I'm not in Seoul. Especially in autumn, autumn leaves are more beautiful. Chundangji Lake? It's nice to sit on a side bench. The entrance fee of 1,000 won is not a waste. I recommend you to go out in autumn."
serendipity0a0,"우리나라 고궁의 장점은 저렴하게 이용 가능하다는 것 같아요. 물론 이게 단점이 될 수도 있겠지만 모두 깨끗이 이용한다면 자주 방문할 수 있어서 너무 좋아요. 청소년은 무료로, 성인은 천원으로 궁을 입장할 수 있고, 산책하기 좋고 안에있는 식물원도 좋습니다. 언제든 다시 방문하고 싶은 곳입니다 :)",5,4,"I think the advantage of Korea's ancient palaces is that they can be used cheaply. Of course, this may be a disadvantage, but if you use it all cleanly, it's great to visit often. Teenagers can enter the palace for free, adults can enter the palace for 1,000 won, is good for a walk, and the botanical garden inside is good. It's a place I'd like to visit again anytime :)"
동양동의별,7월달에 무료개방을해서 가보게되었어요 연인과 산책하기도좋고 고궁을보면서 역사를 다시한번 생각해보게되고 너무좋은거같아요 여름날에 산책을하면 도 좋은거같아요,5,4,"I visited there in July because it was open for free. It's good to take a walk with a lover, and I think it's great to think about history while looking at the old palace. I think it's good to take a walk on a summer day."
nanal78878,서울의 여러 궁 중에 제일 예쁜곳입니다. 경복궁보다 사람도 많지 않아서 쉬엄쉬엄 구경하기 좋아요,5,4,"It is the prettiest palace in Seoul. There aren't as many people as Gyeongbokgung Palace, so it's good to take a look around."
차씨,개인적으로 덕수궁보다는 창경궁이 더 아기자기하고 이쁜거 같아요~ 걷기 좋은 길이에요 벤치에 앉아서 쉬기에도 좋아요~,4,4,"Personally, I think Changgyeonggung Palace is more cute and pretty than Deoksugung Palace. It's a good way to walk. It's also good for sitting on a bench and resting."
darkjedi73,"가끔은 마음을 정돈하기 위해서 가볼 만한 곳으로 여겨진다. 사람이 붐비지 않는 틈에 가면 더욱 좋고, 아침 무렵 조용한 시간이 가는 것도 권장함.",3,4,"Sometimes it is considered a good place to go to get your mind straight. It's better to go when it's not crowded, and I recommend quiet time in the morning."
bahajia,산책하기 좋은 곳입니다. 경복궁보다는 좀 더 한적해서 조용히 걷기에 좋았던 기억이 있습니다. 시간에 맞춰가면 설명도 들으실수 있습니다.,4,4,"It's a good place to take a walk. It was quieter than Gyeongbokgung Palace, so I remember it was good to walk quietly. You can listen to the explanation if you go on time."
miramiramiramira,가장 아름다운 궁궐 중 하나예요. 비원이랑 연결되어 있는 표를 사면 좋습니다. 가이드 해설을 듣지 않고 그냥 하염없이 걷기만 해도 아주 좋은 곳이예요.,5,4,It is one of the most beautiful palaces. It's good to buy a ticket that's connected to B1 It's a great place to walk without listening to the guide's commentary.
yuiwing,북촌마을이랑 가까워서 걸어서 갈수있고 같이 연계해서 움직이기 좋더라구요 거기다 입장료도 저렴한데 너무 멋진 궁들을 볼수 있어서 너무 좋아요,5,4,"It's close to Bukchon Village, so you can walk there and it's good to move together. In addition, the entrance fee is cheap, but I am so happy to see the beautiful palaces."
지호효운은유아빠,궁궐이라고 하기보다는 잘 가꾸어진 공원을 방문하는 느낌. 일제가 궁으로의 격을 떨어뜨리기 위해 동식물원을 만들었던 슬픈 역사가 있는 곳을 아이들에게 설명해 줬어요.,4,4,It feels like visiting a well-groomed park rather than a palace. The Japanese explained to the children where there was a sad history of creating an animal and botanical garden to demean the palace.
koodpang,"단풍이 물들 때 낙엽이 떨어질 때 그리고 눈이 쌓일 때 본 창경궁을 정말 아름답습니다. 연인이 함께 산책에 너무나 좋은 고궁, 창경궁 이번 가을에 한 번 방문해 보세요. ^^",5,4,"The Changgyeonggung Palace, which I saw when the leaves fell when the autumn leaves were colored, and when the snow was piled up, is really beautiful. Visit Changgyeonggung Palace this fall, an ancient palace where lovers can take a walk together, this fall. ^^"
junfff,서울의 상징적인 건물중 하나로 가끔 야간개장을 하기도 하는 곳. 1시간정도 시간을 잡으면 둘러보기 좋습니다.,4,4,It is one of the iconic buildings in Seoul and sometimes opens at night. It's good to take an hour to look around.
mokujino,경복궁이 너무 많은 관광객들로 북적일때면 오히려 창경궁을 가라고 추천하고 싶음. 나무도 많아서 시원하게 산책하기에 좋음,4,4,"When Gyeongbokgung Palace is crowded with too many tourists, I would recommend you to go to Changgyeonggung Palace. There are many trees, so it's good for a cool walk."
Redboom10,창덕궁 근처에 위치한 창경궁. 사람은 그렇게 많지 않아 한가로이 산책하면서 여유를 느낄수 있어 좋은 곳. 외국인들도 드문드문 보여 우리나라를 알릴 수 있는 곳 같아 기분도 좋아지는 곳.,4,4,"Changgyeonggung Palace, located near Changdeokgung Palace. There aren't that many people. You can relax while taking a walk. Good place. It's a place where foreigners can be seen from time to time, so it's a place where we can promote our country, too."
