review,u_id,u_rate,p_id,review_en
숨겨진 곳 조선왕릉이 서울에 많지만 생각만큼 잘 찾아가지 않게 되는곳이에요. 입구가 좀 이상하게(?) 생기긴 했지만 안에 들어가니 평화롭고 좋았습니다.,czdy,4,455,"There are many hidden Joseon Royal Tombs in Seoul, but they don't go as well as I thought. The entrance was a little strange, but it was peaceful and nice to go inside."
헌인릉. 양재 꽃시장에서 462버스로 조금더 성남방향으로 가다보면 나오는곳입니다. 헌인릉. 태종이방원과 옛날 세도정치때 순조대왕릉이 잇는곳입니다. 천원내고 들어갓던 기억이 납니다. 엄청 높아요 위치가. 왕릉이라 그런지 굉장히 크더군요. 순조는 세도가들 때문에 힘도 못쓰고 허수아비임금 이엇던 사람이엇고 태종은 이방원이라. 정도전을 숙청하고 자신의 입지를 다졋던 사람이지요. 자신의 아버지 태조와 함께한 개국공신들을 자신이 왕자리에 임금이 된후 반란을 일으킬까봐 다 죽인 사람입니다. 개국공신들을 다,태걸 황,4,455,"Huninneung. You can find this place by bus 462 from Yangjae Flower Market. Heonin Tomb. Taejong Hospital and King Sunjo's Royal Tomb during the reign of King Seodo. I remember paying 1,000 won. It's very high. It was very big maybe because it was a royal tomb. Sunjo was a man who could not work hard because of the powerful, and King Taejong was Lee Bang-won. He purged Jeong Do-jeon and established his position. He killed all the founding contributors with his father, King Taejo, for fear that he would revolt after becoming king of the throne. all the contributors to the opening of the country"
참 오묘한 위치에 있는 곳입니다. 이 곳을 찾아 가다 보면 아주 의외의 재밌는 건물이 있습니다. 바로 국정원이죠. 그 국정원을 지나 주차장에 주차하고 나서 입장료를 지불 홍살문을 거쳐 들어가면 아름 다운 숲과 정원을 느낄수 있습니다. 묘의 주인은 철혈 군주 태종의 묘이구요. 숲과 정원이 주는 그늘에 앉아 위를 쳐다 보면 묘가 보입니다. 햇살이 내려쬐고 있고 ..서울 근교에서 잠시 쉬었다가기 참 좋은 곳입니다.,406대현김,5,455,"It's a very strange place. If you visit this place, you will find a very interesting building. It's the NIS. After parking in the parking lot after passing through the NIS, you can feel the beautiful forest and garden if you go through the Hongsal Gate to pay the entrance fee. The tomb belongs to King Taejong, the iron lord. If you sit in the shade of the forest and garden and look up, you will see the tomb. The sun is shining down...It's a good place to take a short break in the suburbs of Seoul."
최고의 조선 묘지 헌릉은 태종이 묻힌 곳이에요. 세종의 아버지로서 태종은 한국에서 무자비하지만 능력 있었던 왕으로 유명해요. 그의 아들인 세종대왕은 한글을 창제했어요. 1400년에서 1500년은 조선시대의 첫번째 황금시대로 널리 알려져 있어요. 이곳은 서울의 어느 곳에서도 쉽게 올 수 있어요. 두번째로 제가 방문했을 때 봉분에 들어갈 수 있어서 더 많이 볼 수 있었어요. 조선시대의 무덤은 보호되어 있고 대부분의 묘지는 제한구역이 있어요. 특히 묘지를 볼 수 있는 곳이 그래요. 하지만 대부분의 방문객들에게 돌에,kjmagnuson,5,455,"Heonneung Royal Tomb, the best Joseon cemetery, is where King Taejong was buried. As King Sejong's father, King Taejong is known in Korea as a ruthless but capable king. His son King Sejong created Hangul. 1400 to 1500 is widely known as the first golden age of the Joseon Dynasty. You can easily come from anywhere in Seoul. When I visited for the second time, I was able to go into Bongbun, so I could see more. The tombs of the Joseon Dynasty were protected, and most of the tombs had restricted areas. Especially where you can see the cemetery. But for most visitors, there's a stone."
"조선 시대 왕릉 중 하나. C (20.03.18) 조선 시대 귀에는 18 개의 왕릉이 있었으며 태종과이 아내 3 대 왕, 선조와 그의 아내 23 대 왕이 묻혔다. 무덤 지역은 많은 나무와 좋은 분위기로 걷기에 좋았습니다. 조용하고 차분했으며 쳐다 보는 것이 좋았습니다. 주차장이 넓고 입장료가 저렴했습니다.",CanisHan,4,455,"One of the royal tombs of the Joseon Dynasty. C (20.03.18) There were 18 royal tombs in the ears of the Joseon Dynasty, and King Taejong's wife, King Taejong's wife, King Seonjo, and his wife's 23rd king were buried. The tomb area was good for walking with many trees and a good atmosphere. It was quiet and calm, and I liked to look at it. The parking lot was spacious and the entrance fee was cheap."
