u_id,review,u_rate,p_id,review_en
gr kim,꽃알못인데..정말 잼었어요 새벽에 도착해서 피곤했는데 생화도매시장 들어가니 와~~~와~~~계속 감탄사 난발하면서 돌아다녔어요 같이 간 지인이 꽃이람 식물 무지 좋아하셔서 약 20 만원치 지르셨어요 저한테도 종이꽃이랑 국화 한다발씩 선물해주셨어요~~^^ 고터도가봤고 지방꽃시장도 가봤거든요 양재가 갑이에요~ 자주는 아녀도 가끔 갈듯합니당~~~,4,467,"I didn't know the flowers, but it was really fun. I was tired when I arrived at dawn, but when I went into the real flower wholesale market, wow~~~~~~~~~~~~~~~~~~~~~~~~~~~~~~. An acquaintance I went with loved flowers and plants, so I spent about 200,000 won. She gave me a bunch of paper flowers and chrysanthemums.I've been to a local flower market. Yangjae is the best. Not often, but sometimes."
형근 김,꽃가게들이 모여 있습니다. 대중교통 이용해서 가기 조금 불편한데 지하철역 기준 신분당선 양재 시민의 숲 역이 제일 가깝습니다. 여러 가게가 같이 있어 가격이 저렴한 것 같네요.,3,467,"Flower shops are gathered. It's a little inconvenient to use public transportation, but Yangjae Citizens' Forest Station is the closest to the subway station. I think it's cheap because there are many stores together."
W.C. Seoul,주말에 꽃사러 갔다가 이쁜 꽃바구니 잘샀음 양재동에서 고속도로 빠지는 구간이라서 차가 너무 막히므로 시간 여유를 두고 가는 것을 추천 자상주차장,4,467,"If you bought a pretty flower basket on the weekend, you should leave your time at the self-contained parking lot because of the traffic jam in Yangjae-dong."
hojung S,점심 시간 정도에 방문했는데 주차장에 차가 가득가득.. 좀 더 일찍 가시거나 조금 늦게 가세요 물론 문닫는 시간 잘 체크하시구요~ 두시반에 나올 때는 주차장에 차 많지 않았구요. 가게마다 나름 컨셉이 있는 집들이 많아서 정말 눈돌아갑니다..많이 싸지는 않은데 구경하기 정말 좋아요.,5,467,"I visited around lunchtime, but the parking lot was full of cars... Go a little earlier or a little later. Of course, check the closing time. There weren't many cars in the parking lot when I left at 2:30. There are many houses with their own concept, so my eyes are really turning.It's not that cheap, but it's really nice to look around."
재우 이,햇살이 너무 따뜻해서 이제 봄의 향기를 느끼고싶어 양재동 화훼센타로 향했다. 온 천지에 가득한 꽃향기와 싱그러운 녹색의 숲. 이곳은 항상 봄을 가득않고 우리를 기다린다.,5,467,"The sun was so warm that I wanted to feel the scent of spring, so I headed to Yangjae-dong Flower Center. A flowery, fresh green forest, full of heaven and earth. This place is always waiting for us, not full of spring."
dongsup s,선인장 구입을 위해 방문했는데 의외로 볼게 많습니다. 생화는 도매가로 살수 있으니 그게 좋구요. 각종 화분식물 판매장도 아주 좋습니다. 조화만 파는 매장도 있고 나무묘종 파는 곳도 이끆어서 일괄적으로 여러가지를 볼수 있어 좋습니다. 주차료도 아주 저렴합니다.,4,467,"I visited to buy cactus, but there are a lot of things to see. You can buy raw flowers at wholesale prices, so that's good. All kinds of flowerpot plants are also very good. There are stores that sell only artificial flowers and tree seedlings, so it's good to see many things in a lump. Parking is also very cheap."
Jiyeon H,2월이라 꽃이 좀 비쌌지만 만원에 프리지아 한다발을 샀습니다. 꽃집보다는 확실히 싸더라구요. 한3월에는 프리지아가 더 싸다고 하다고 하고 날이 풀리면 봄꽃이 많이 들어올테니 그 때 가시는 것이 좋을 듯합니다. 가격대는 비슷비슷하니 좋은 꽃이 보이면 바로 사시는 것이 좋을 것 같아요.,5,467,"The flowers were a bit expensive in February, but I bought a bunch of freesia for 10,000 won. It was definitely cheaper than a flower shop. In March, Frisia is said to be cheaper and spring flowers will come in when the weather gets warmer, so you'd better go then. The price range is similar, so if you see a good flower, you'd better buy it right away."
올리브521,봄이 오기전 부모님을 모시고 가는게 연례행사중 하나다.정말 작은 돈으로 봄을 집안에 모셔올수있다.미니선인장 하나 천원씩.허브 이천원씩..아름다운꽃과 향기들에 행복한 하루를 보냈다,5,467,"One of the annual events is to take my parents with me before spring comes.I can bring spring home with a really small amount of money.1,000 won each for a mini cactus.Two thousand won each for herbs.I had a happy day with beautiful flowers and smells."
soobok,양재동 현대자동차 본사 맞은편에 있습니다. 주차시설이 잘되어있고 다양한 꽃을 감상할 수 있고 가격도 저렴합니다.,4,467,"It's across from Hyundai Motor headquarters in Yangjae-dong. The parking facilities are well-equipped, you can enjoy various flowers, and the price is low."
순둥2,"양재역에서는 걸어가기 조금 멀긴 하지만, 주차장은 넓게 잘 되어 있어서 차량 이용하는 것이 좋아요. 꽃가격도 저렴하고, 근처 회사 있는 분들은 점심시간에 사러 가기도 하더라고요. 화분 등도 저렴하게 있어서 집들이 가기 전 들러서 구입하기도 합니다.",4,467,"It's a little far from Yangjae Station, but the parking lot is wide and it's good to use a car. Flower prices are low, and some people from nearby companies go to buy them at lunchtime. Flowerpots are also cheap, so I stop by and buy them before going to the housewarming party."
ambisun,"대중교통으로는 찾아가기가 조금 힘든 편입니다만, 다양한 꽃과 식물을 둘러보고 저렴하게 구입할 수 있어서 좋습니다. 주차하더라도 필요한 것만 신속하게 구매하고 나오면 무료시간에 이용할 수 있어서 요금좋았습니다. 화분 등도 대체적으로 저렴하고 종류가 다양했습니다.",5,467,"It's a little hard to find by public transportation, but it's good to look around various flowers and plants and buy them cheaply. Even if you park, you can buy only what you need quickly and use it during free time. Flowerpots were generally inexpensive and varied."
Eunhee Y,새벽부터 꽃시장이 들어서는 곳으로 점심즈음에 꽃시장에 가면 꽃을 싼 가격에 살수 있습니다. 꽃시장의 꽃 가격을 알고나면 아마 다른데서 꽃 주문 못하실걸요~ 계절꽃은 한단에 2~3천원하는 것들도 있어요 꽃 뿐만 아니라 2층에는 아기자기한 크리스마스 소품이나 끈 등을 팔고 있으며 화분도 저렴하고 팔고 있어요. 가까이 살아서 주말에 기분전환하러 가기도 합니다 :),4,467,"You can buy flowers at a cheap price if you go to the flower market around lunchtime. If you know the price of flowers in the flower market, you won't be able to order them anywhere else. There are some seasonal flowers that cost 2,000 won to 2,000 won. Not only flowers, but also cute Christmas props and strings are sold on the second floor, and flower pots are cheap. Sometimes I live close by and go to refresh myself on weekends :)"
Kat,나는 여기 오는 것을 절대적으로 좋아합니다. 나는 보통 낮에 열려있는 식물 시장에 간다. 나는 합리적인 가격으로 시장에서 많은 식물을 얻었다. 장소는 거대하고 서울을 떠나 열대 여행을 떠나는 것은 물론 여행하기에 좋습니다. 나는 10 월에 손님을 데려 와서 녹색 분위기에 매우 만족했습니다. 그녀는 그곳에서 일하는 사람들이 쾌적하고 친절하게 대단한 경험을했습니다. 나는 확실히 미래에 돌아올 것이다. 내 크리스마스를 여기에서 고칠 생각.,5,467,"I absolutely love coming here. I usually go to the open plant market during the day. I got a lot of plants in the market at a reasonable price. The place is huge and it is good for traveling as well as leaving Seoul for a tropical trip. I was very satisfied with the green atmosphere because I brought a guest in October. She had a great experience with the people who worked there, pleasantly and kindly. I'm sure I'll be back in the future. Thinking of fixing my Christmas here."
lionheart_sg,"우리는 월요일 아침에 거기에 가서 다음을 발견했습니다.  1) 신분 당선 양재 시민의 숲 4 번 출구 이용. 약 10 분 걸었다. 주요 도로를 따라 남동쪽으로. 시장 센터가 오른쪽에 있습니다. 2 층짜리 도매 경매 건물, 식물을위한 1 층짜리 거대한 흰색 캔버스 텐트와 커다란 꽃을위한 후면의 1 층짜리 건물이 있습니다.  2) 우리는 1 층짜리 거대한 흰색 캔버스 천막에서 가장 많은 시간을 플로팅 식물을 보며 보냈습니다. 주로 난초, 다육 식물 및 공기 식물을 판매합니다. 다른 나라들은 이국적인",5,467,"We went there on Monday morning and found the following.  1) Access to Exit 4 of the Forest of Yangjae citizens. I walked for about 10 minutes. To the southeast along the main road. The market center is on the right. There is a two-story wholesale auction building, a huge white canvas tent for plants and a one-story building for large flowers.  2) We spent the most time looking at the floating plants in a huge, one-story canvas tent. It mainly sells orchids, succulent plants and air plants. Other countries are exotic."
MouMou,"이것은 내가 평생 동안 방문한 가장 잘 조직되고 깨끗한 꽃 시장입니다. 꽃 애호가에게는 사탕 가게에 들러 붙는 것과 비슷합니다. 비거주자인데도 한국 꽃의 선물로 사용되는 꽃과 화분에 담긴 허브를 얻을 수있었습니다. 신선한 잘라 꽃을 사려고하는 것이 어렵 기 때문에 12시 정오에 의도적으로 도착했습니다. 완전히 방문을 즐겼다! ! 신선한 잘라 꽃 섹션 :  - 최대 1 pm  - 먼 길에서, 주요 도로에서 멀리 떨어져.  - 2 층 : 위층에 신선한 꽃과 인공 꽃, 바구니, 리본 등을 찾을 수",5,467,"This is the best organized and clean flower market I've ever visited in my life. For flower lovers, it's like sticking to a candy store. Even though I was a non-resident, I was able to get herbs in flowers and pots used as gifts for Korean flowers. I arrived at noon on purpose because it was difficult to buy fresh cut flowers. I totally enjoyed the visit! ! Fresh cut flowers section : - Up to 1 pm - away from the main road, away from the main road. - Floor 2: Fresh flowers, artificial flowers, baskets, ribbons, etc. can be found upstairs."
leesharon2709,즙이 많고 크고 작음을 좋아했습니다. 집에 가져갈 작은 물건 7 개만 나오기가 어려웠습니다. 이 장소에는 다양한 화분 및 식물 액세서리가 있기를 소원합니다.,4,467,"I liked juicy, big and small. It was hard to get only 7 small items to take home. I hope there are various flower pots and plant accessories in this place."
lilmizsara,"꽃 시장 이 하나 발견 하였고 예하 투어에 서초. 사실 정말 가까운 강남 이지만 보이지 않는 것이 다. 매우 기이 한 동네는 조용하고 주변이 산 근처에 있는 것이 원인 (이름 모르) 이지만 공기가 매우 신선하고 시원한. 양재 시민의 숲의 출구에서 걸어서 4 줄의 신분 당선. 옆에 있는 것이 신선한 공기가 정말 순간 들을 걸어 다니는 것 (한 서울). 따라서 이는 충분한 공간! 시장에는 많은 여러 영역 함께 결합 구성 및 오키드, 나무, 꽃 을 참조하십시오. 절대적으로 화려한. 나 같은 경우는 꽃",5,467,"I found a flower market and Seocho on the pre-ha tour. Actually, it's really close to Gangnam, but I can't see anything. The reason is that the neighborhood is very quiet and the surrounding area is near the mountain, but the air is very fresh and cool. a four-line walk from the exit of the Yangjae citizens' forest What's next to you is the fresh air walking around in real time (Han Seoul). So this is enough space! For the market, see Combining many different areas together and Orchids, Trees, Flowers . absolutely splendid In my case, flowers."
jaeheonl142,"모든 꽃 볼 수 있습니다. 그리고, 욘 꽃 향기가 은은하게 감도는 냄새가 봄 가을에 가면 있는. 사랑의 꽃 이라면 추천 합니다. 그리고, 지하철 "" sinbundang 라인 "" 을 사용할 수 있습니다.",4,467,"0You can see all the flowers.And if you go in the spring and fall, the scent of the Yon flower is subtle.I recommend the flower of love.And you can use the subway sinbundang line."
okiecb,"이 곳을 찾는 웹 서핑을 플랜트 시장. 토요일 에서 짧은 드라이브를 실망시키지 않았어요. 1 단지 25분 정도 남쪽으로 접근하기 쉽고 ic의 서울. 할 수 있는 것이고 모든 것을 모든 관련하여 만개 하고 공장 또는 정원. 많은 주차 공간 (서울에서 보기 드문). 저희는 2시간 정도, 주차 W2500, 걸리는 $2.50. 실내, 실외 열, 흙, 플랜 터스, 수상 정원.... 합니다 그 이름입니다. 공급업체 및 샤워실이 있어, 실내외. 드라이브 및 만들 수 있습니다. 양재 시민의 숲 옆에 위치하고",5,467,"Plant market to surf the web to find this place. I didn't disappoint the short drive on Saturday. 1 Seoul of ic, easy to approach south for just 25 minutes. It can be done and everything is in full bloom in all relation to the factory or garden. Lots of parking spaces (unusual in Seoul). We're going to park for about two hours, park W2500, $2.50. Indoor, outdoor heat, soil, plantus, water garden. That's the name. Supplier and shower room, indoor and outdoor. Drive and create. Located next to the Yangjae Citizens' Forest,"
hazinheira,"더 좋은 장소는 양재 꽃 시장을 허브 꽃 뿐만 아니라, 또한 좋은 큰 도시에서 탈출 하죠. 안에 들어오면, 처음 한 것은 우리가 아는 침묵. 방은 연결된 시장은 여러 장, 거의 모든 종류의 식물과 꽃 한가지 수, 나무, 허브가 생기는 것. 불행하게도, 이 조직의 특정 유형의 복도 없는 것 / 꽃 식물, 특정 항목을 찾을 수 있기 때문에 데 시간이 걸릴 수 있습니다. 이후 작업은 녹색 복도, 내부는 정말 따뜻한.",4,467,"A better place to go is to escape Yangjae flower market not only from herb flowers but also from good big cities. When you come inside, the first thing you did is silence we know. The room has several connected markets, almost all kinds of plants and flowers, trees, and herbs. Unfortunately, it can take time because you can find certain types of hallwayless / flowering plants, certain items of this organization. The work after that is green corridor, and inside is really warm."
PamelaCheong,"나는 어떻게 알고 싶어 하는 말은 꽃 시장 도매 겨울 이른 봄 이. 그래서 우리는 기차가 이 시장이 특히 호텔에서 1시간 정도. 한 가진 여행객을 참고. 컷 꽃 도매 시장 옆에있는 화분 식물 도매, 닫기 전에 오후 1. 그래서 거기 항질염성. 이것은 계절의 프리지아 을 본 많은 시장 및 심지어 insading 꽃이 함께 트럭을 조종 및 판매 꽃에 저녁.",4,467,"What I want to know is flower market wholesale winter early spring. So we've got a train for about an hour in this market, especially in hotels. with reference to one traveler. Potato plant wholesale next to cut flower wholesale market, before closing 1. So antiseptic there. This is many markets that have seen the season's freesia and even evening in-sitting flowers controlling and selling trucks together."
