u_id,review,u_rate,p_id,review_en
Knut N,"얼마나 흥미로운 옛 방식으로 석탄 발전소 었다. 이 박물관은 무료 입장. 좋은 장소, 잘 조직.",4,562,"What an interesting old way of doing coal power plants. Admission to this museum is free. Good place, good organization."
Michael S,"박물관 건물 자체도 매우 좋았어요. 너 한번 방문에 관심이 있다면 기계와 산업화. 박물관의 레스토랑, 그러나, 아리마를. 이는 단지 에 비해 너무 비싼 가격, 이 보통.",4,562,"The museum itself was very nice. If you're interested in visiting once, machinery and industrialization. A restaurant in the museum, but Arima. It's just too expensive for something, this average."
FlaviaMotta,"제가 보는 정말 좋은 특별전 그러나 가장 감동 시키는 단면 전용의 역사 전기. 어떻게 보면 이 도시를 iluminated 에 옛날, 발전의 전기 에너지 생성 및 에는 방에서 아이와 놀 전기. 저는 아이가 없나, 아주 재미 다.",4,562,"It's a great special exhibition that I see, but it's the most touching sectional biography. In a way, the city was iluminated long ago, generating electrical energy from power generation and electricity to play with children in rooms. I don't have children, it's so much fun."
Rui F,"후회 하지 않는 박물관입니다. 박물관은 매우 잘 보존, 이 많은 볼거리가, 처음 처럼 전기 찬 데 포르투갈, 사이 소. 아인 또한, 이후 많은 교훈 적인 게임을! 호텔은 무료 입장, 그렇게 부끄러워하지 마라! 2 월 초까지 다 끝내 설명에, 얼마나 사람들을 라이프 및 세계. 오직 너희들 2 €, 돈을 전부 도둑 무료 치과 사업.",5,562,"It's a museum that I don't regret. The museum is very well preserved, and there are so many things to see, like the first time it's electric, Portuguese, Sai Saw. Ahin also played a lot of moral games afterwards! The hotel is free, don't be so shy! By the beginning of February, we've finished explaining how many people there are in life and the world. Only you two €, all your money is stolen free dental business."
Johnix,"만약 전기 호기심, 그리고 알고 있어야 합니다. 또한 임시 문합장 exihbits 및 기타 evernts. 근접한 편리한 강 은 이 장소에서 투어 강변 언로킹. 인근 belém 변형대.",5,562,"If you're curious about electricity, you have to know it. In addition, the adjoining Convenience River is an unlocation of the Tour Riverside from this location. Nearby belém strainer."
Shawniguy,"우리 4살짜리 제 박물관 아리마를 손자와 아버지와 좋은 시간을 보냈어요. 우리, 어른, 박물관 및 역사적 측면을 복원된 전기 생산 장비. 우리 모두의 전기 장치의 대화를 즐겼다. 내 손자 이 너무 마음에 들어서 그 주장을 다시 박물관 며칠 뒤에. 두 번째로 많은 모두가 즐길, 많은 수는 있습니다. 또한 무료!",5,562,"We had a good time with our grandson and father at my 4-year-old museum, Arima. We, adults, museums and restored electrical production equipment for historical aspects. We all enjoyed the conversation of electric devices. I loved my grandson so much that he made the claim again a few days after the museum. Second, there are many things that everyone can enjoy. Also free!"
Ana L,"리스본에서 가장 흥미로운 박물관. 입장 무료, 및 내마모재가 상설 전시, 기획전 이 언제나 흥미롭습니다. 자신에게 허용 전체 아침에 이곳!",5,562,"The most interesting museum in Lisbon. Admission is free, and the permanent exhibition and planning exhibition are always interesting. Allow yourself in the morning here!"
Miguel S,"이는 옛날 석탄 발전소, 즉 아주 잘 보존 가 많이 diagramas 및 대화형 물건 너희들 방문 보다 정치,, 무료로. 놓쳐서는 안 될.",5,562,"That's a lot more of the old coal power plants, much better preserved than Diagrams and interactive items, for political, free. You shouldn't miss them."
JOAOBMONIZ,"이 박물관은 한 '잃어버린 지금 apearance 된 nt 전원 주택. 바로 앞에 강, 아주 잘 mantained, 포지션 은 (하나의 세계 최고의 사진) 이 단 2 €도착! 이 또한 바 착호 amo - te 테조, 즉 사랑 도시에는 (강 바로 앞)",4,562,"The museum is a 'lost now-appearance nt rural home.' Right in front of the river, very well wanted, position is (one of the best pictures in the world) This single two € Arrival! This is also a bar sign amo - te Te Tezo, or Love City (just in front of the river)"
