review,u_id,u_rate,p_id,review_en
다소 복잡한 골목 필요한 물건이 있어 찾아간 용산 전자상가 골목골목 상점들을 찾는데 어려움이 있었다 필요한 전자제품을 찾긴했으나 가격도 싸지않고 물건이 오래된 듯하여 구입하지는 않았다,Qjr,3,578,"It was difficult to find the shops in Yongsan Electronics Market Alley Alley Alley Alley because of the need for some complex alleys. I found the electronics I needed, but I didn't buy them because they weren't cheap and seemed old."
옛추억의 장소 옛날에는 뭐 사려면 용산이나 테크노마트 큰맘먹고 갔는데 이제는 워낙 인터넷구매가 대세라서 많이 분위기가 다운된 느낌이에요. 대신 즐길거리가 많이 생겼으면 좋겠습니다.,juou,1,578,"It's a place of old memories. In the past, I used to go to Yongsan or Techno Mart to buy things, but now the internet shopping is so popular that the atmosphere is very gloomy. Instead, I hope there will be many things to enjoy."
"용산역 용산역에있는 전자상가 예전에 가보고 그뒤로 처음가보았는데 새로 단장을해서 볼것도 많고 내부에 공원같은형식 쉼터가있어서 좋더라고요, 그리고 용산역 몰들어가기전에 뷰보는것도 좋았어요.",Alpertbyun,4,578,"I went to the electronic shopping mall in Yongsan Station for the first time since then, and it was nice to see a park-like shelter inside the building, and it was nice to see before we went to Yongsan Station."
"너무나 감격적인 장소 연휴주말을 이용해 서울에 갔었는데,제가 반드시 하고 싶었던 일이 용산 전자상가에 가는 일이 었습니다. 일요일에 갔는데 점포중 약 70%가 열려 있었다. 기대치 이상이었지요. 저는 마치 사탕 가게에 온 아이처럼 이층 저층 누비며 아침 내내 시간을 보냈습니다. 누구든 그 곳에서는 원하는 것은 무엇이든지 찾을 수 있으리라 확신합니다. 계획하신 대로 가보세요. 가시기 전에 무엇을 사실지 미리정하시고 가셔서 즐겁게 방문하세요 .",730christic,5,578,"I went to Seoul using the holiday weekend, and what I really wanted to do was to go to Yongsan Electronics Market. I went on Sunday and about 70% of the stores were open. It was more than I expected. I spent the whole morning wandering two floors, like a kid in a candy store. I'm sure anyone can find anything they want there. Go as planned. Before you go, decide what to buy in advance and enjoy your visit."
사라져가는 예전에 정말 잘나가던 곳인데 인터넷가격과 경쟁이 안 되어서요.ㅜㅜ 마이크를 사러 갔는데 인터넷가격에 맞춰주신다고 해서 가격 보여줬더니 그 가격으론 안된다면서 인터넷으로 사라고 ㅜㅜ 거기선 거의 2배로 파신다고요 ㅜㅜ 슬펐어요. 좀,H L,2,578,"It's a place that used to be really popular, but it's not competitive with Internet prices.ᅮᅮᅮ I went to buy a microphone, but when I showed you the price because they said they would match the price on the internet, you told me to buy it on the Internet. ᅮᅮᅮ They sell it almost twice as much as I was sad. Some"
조립 컴퓨터 저렴하게~ 컴퓨터 조립 맞추러 방눔했습니다. 다나와 최저가를 그대로 맞춰 줍니다. 서비스도 좋구요 예전에 악명스런 그런 모습은 전혀 없습니다. 믿고 컴퓨터를 사도 좋을것같습니다.,Charlie5150,5,578,"Assembling computers at low prices. I've been sharing rooms to assemble the computer. It matches Dana and the lowest price. The service is good, and there's no such thing as the infamous one before. You can trust me and buy a computer."
사기꾼 천국 장사가 인터넷의 여파로 잘 안 되기 시작하면서 사기꾼들이 더욱 기승을 부리는 곳이다. 지나가기만 해도 온갖 호객을 하며 조금 어수룩해보이면 바로 등쳐 먹으려고 한다. 만만해 보이면 욕도 한다. 안 가는게 정신건강에 좋다.,richardpN4937UU,1,578,"It is a place where fraudsters are more rampant as the business in heaven begins to go bad in the aftermath of the Internet. Just passing by, he tries to make all sorts of calls, and if he looks a little dreary, he tries to turn his back on him. If they look easy, they curse. It's good for your mental health not to go."
예전 전자제품의 집합소 90년대 pc판매의 메카로 불린곳이죠. 지금은 인터넷의 영향으로 옛 명성은 사라졌지만 직접 비교하기위해 찾는곳입니다.,soobok,3,578,"The old electronics store was called the mecca of PC sales in the '90s. Now, due to the influence of the Internet, the old reputation has disappeared, but this is a place to compare directly."
옛날명성은 사라졌네요 스마트폰이나 인터넷이 활발하기전 대한민국 최대의 전자상가였는데 그러다 보니 나쁜 판매상들도 많고 사기도 많고 가격도 사람따라 다르고 요즘은 가격이 인터넷에 다 공개되니 사람들이 많이 찾지 않는다 그래도 정 급하면 가게되는곳,민석 권,2,578,"The old reputation is gone. Before smartphones and the Internet were active, it was the largest electronic shopping mall in Korea. So there are many bad vendors, fraud, and prices are different depending on people, and these days, the prices are all on the Internet, so not many people visit it. But if they are in a hurry, they go there."
전자제품 사기 좋은 곳 한국에서 가장 유명한 전자상가입니다. 예전보다 점포가 많이 사라졌지만 아직도 대부분의 부품 판매 업체들이 용산에 위치하고 있습니다. 인터넷에서 부품 가격을 미리 알아가면 저렴하고 빠르게 부품을 구할 수 있지만 불량 업체도 있으니 주의가 필요합니다.,트립마니아,3,578,"It is the most famous electronic shopping mall in Korea. Although many stores have disappeared more than before, most parts vendors are still located in Yongsan. If you know the price of parts on the Internet in advance, you can get the parts cheap and fast, but there are some bad companies, so be careful."
호객행위가 너무 심한 곳 인터넷으로 미리 알고가야 바가지를 안 쓸 수 있습니다. 호객행위도 심해서 기분좋은 쇼핑은 하기 힘들구요. 시설도 오래되어 여러모로 쇼핑의 매력도가 떨어지는 곳입니다.,지구별여행자2015,2,578,"Where there are too many solicitors, you need to know through the Internet in advance to avoid being ripped off. It's hard to shop pleasantly because of the heavy solicitation. The facilities are old and the shopping is not attractive in many ways."
전자제품 사기엔 이만한 곳이..더 있어요.. 어려서부터 많이 다닌 곳이지만 요새는 더 체계적이고 편리하게 구성된 듯. 전자제품 사기에 적절하긴 합니다. 돈이 많으시다면요. 그게 아니라면 미리 알아보고 지식을 가지고 들어가시길. 안그럼 바가지 씁니다.,G1345QDjasonl,3,578,"There's a place like this for electronics.There's more... I've been to this place a lot since I was young, but it seems to be more organized and convenient these days. It is suitable for buying electronics. If you have a lot of money. Otherwise, I hope you find out in advance and go in with your knowledge. Otherwise, I'm going to rip you off."
잘 모르겟어요.... 유명한 용산 전자상가... 저렴하고 좋은거 많다고 하는데... 잘 모르겠어요 .. 잘 알아보고 가야 좋을 거 같아요 ...,ji00328,2,578,I don't know... The famous Yongsan Electronics Market... They say there are a lot of cheap and good things... I don't know... I think it would be good to go and find out...
잘 아는 사람들이 가서 구매하는 곳 4호선 신용산역에서 내려 용산 아이파크몰을 방문하거나 1호선 용산역에 내려 아이파크몰에 있는 연결통로를 이용하여 전자상가를 방문할 수 있다. 시설이 낙후된 느낌이 있으며 주말에는 영업하는 곳이 별로 없지만 알만한 사람들은 저렴하게 전자제품을 구입할 수 있는 곳. 단 전자제품에 미숙한사람은 잘 알아보고 가길 권장합니다.,junfff,4,578,"You can visit Yongsan I'Park Mall by getting off at Shinyongsan Station on Line No. 4 or by getting off at Yongsan Station on Line No. 1 to visit an electronic shopping mall using the passageway at I'Park Mall. It feels like the facilities are outdated and there aren't many places open on weekends, but it's a cheap place to buy electronics. However, it is recommended that people who are not good at electronics should look into it."
전자제품 사기 좋은 곳! 여러가지의 전자 제품 매장들이 줄지어 있으며 그 주변엔 대형몰도 위치해 있어 쇼핑하기에도 좋고 식사하기에도 괜찮은 곳인것 같다. 하지만 이곳까지 가는 길이 주말에는 교통이 많이 밀린다는 단점이.. 여러가지 제품 비교해보면서 살수 있는 장점이 있어 방문 해 보면 좋을 듯!!!,Redboom10,4,578,"A good place to buy electronics! There are various electronic product stores, and a large mall is located around it, so it is a good place to shop and eat. But the downside is that there's a lot of traffic on weekends. It's good to visit because you can compare various products and buy them."
관광객을위한 것이 아닙니다 잘 알려지지 않았으며 매우 좁은 범위의 제품으로 특별하거나 주목할만한 가치가 없습니다. 현지인을위한 일반 상업 지역 일뿐입니다. 내가 현지에 있더라도 하드웨어가 필요하지 않고 온라인으로 구매할 수 없다면 구입하지 않을 것입니다.,Bruno Lamps,2,578,"It's not for tourists. It's not well known, and it's a very narrow range of products that aren't special or worth noting. It's just a commercial area for locals. Even if I'm in the local area, I won't buy it if I don't need hardware and can't buy it online."
"좋은 거래와 나쁜 거래가 있습니다. 외국인 관광객에게는 권장되지 않습니다. 이 시장은 용산역 근처의 넓은 지역을 나타냅니다. 특별한 건물이나 복잡한 건물이 아닙니다. 이 지역에는 많은 작은 딜러가 있으며 많은 사람들이 좋은 거래를하지 않습니다. 그렇다고이 시장이 해고로 가득 찬 것은 아닙니다. 그러나 필요한 물건과 가격을 이미 알고 있지 않으면 희생자가 될 가능성이 큽니다. 또한, 대부분은 외국인 방문객에 관심이 없습니다. 명동이나 동대문과는 다릅니다. 팁 : 좋은 딜러는 붐비는 지역의 모퉁이에 위치합니다.",JHL,3,578,"There are good and bad deals. Not recommended for foreign tourists. This market represents a large area near Yongsan Station. It's not a special or complex building. There are many small dealers in this area, and many people don't make good deals. That doesn't mean the market is full of layoffs. But if you don't already know what you need and what you need, you're more likely to be a victim. Also, most of them are not interested in foreign visitors. It is different from Myeong-dong or Dongdaemun. TIP: A good dealer is located on the corner of a crowded area."
"전자 제품을 위해 여기에 가지 마십시오 가격을 기준으로 누군가가 긍정적 인 리뷰를 할 수있는 방법을 이해하지 못합니다. 흥얼 거리더라도 가격은 끔찍합니다. 그들은 완전한 보증으로 무언가와 경쟁하려고합니다. 거기에 방문할만한 가치가있는 상점은 거의 없지만 대부분 비즈니스를 유지하는 방법을 궁금해합니다. 나는 더 많은 것이 있어야한다고 생각했지만, 그렇지 않았다. 인터넷과 빠른 배송이 가능 해짐에 따라 양질의 상품과 서비스를 제공하는 상점을 제외하고이 장소는 곧 사라질 것이라고 생각합니다.",Gunnar,2,578,"Don't go here for electronics. I don't understand how someone can do a positive review based on price. Even if you hum, the price is terrible. They want to compete with something with full assurance. There are few stores worth visiting, but most people wonder how to keep their business going. I thought there should be more, but it wasn't. As the Internet and fast delivery become possible, I think this place will soon disappear except for stores that offer quality goods and services."
합리적인 가격으로 모든 전자 장치를 갖춘 훌륭한 장소 방문이 필요합니다! 저렴하고 접근 가능하며 잘 배치되어 있습니다. 다양한 전자 제품의 가격이 10 % 이상 저렴합니다.,Companion12207721588,4,578,"You need a great place to visit with all your electronics at a reasonable price! It's affordable, accessible, and well-placed. The price of various electronics products is 10% or more cheaper."
"전자 제품의 바다 전화, 태블릿, 카메라 드론 등과 같은 전자 제품을 구매하려는 외국인에게 가장 적합한 장소입니다. 특히 중고 전자 제품을위한 최고의 장소입니다",Semusa,4,578,"This is the best place for foreigners who want to purchase electronic products such as ocean telephones, tablets, camera drones, and so on. It's the best place, especially for used electronic products."
방문할만한 가치가 없다. 이 지역은 방문 할 가치가 없습니다. 컴퓨터 나 휴대 전화를 찾는다면 범위는 적당하지만 가격은 경쟁력이 없습니다.,Budgong g,1,578,"Not worth a visit. This area is not worth visiting. If you are looking for a computer or a mobile phone, the range is reasonable, but the price is not competitive."
"다양한 전자 제품 작년에 용산을 방문한 곳은 평온한 곳이었고 주민들 만이 저렴한 가격으로 거래 할 수있는 곳으로 적합했다. 심지어 내 한국인 친구는 나에게 거기에 가라고 조언하지 않았다. 그러나 나는 아직도 보려고 갔다. 내 새 집에 대한 디지털 도어록을 찾고 있었지만 문제를 발견했습니다. 묘사 된 그늘하고 나쁜 장소를 찾지 못했습니다. 많은 전자 제품 가게와 나는 가격이 더러웠다라고 생각하지 않는다. 그러나 아마 지방 주민은 교섭하고 좋은 가격을 얻을 수 있었다. 어쨌든 검색 한 후 포기하고, 디지털 자물쇠",teamilk,4,578,"Various electronic products Last year, the place to visit Yongsan was peaceful and suitable for residents to trade at a low price. Even my Korean friend didn't advise me to go there. But I still went to see it. I was looking for a digital door lock for my new house, but I found a problem. I couldn't find the shadowy and bad place described. Many electronics shops and I don't think the price was dirty. But perhaps the local people could negotiate and get a good price. Anyway, you search, you give up, digital lock."
"용산전자상가 이 곳에 전자 다양한 종류의 장치에서 찾을 수 있습니다. 영업 현금 돈을, 빌, 보증 없음 없습니다. 카드를 통해 결제 경우 가격이 10 % 정도 높았습니다. 동일한 장치, 가격은 다른 가게에서 꽤 큰 차이가 있습니다. 또한, 깊이 조사할 경우 동일한 장치 온라인 상점 저렴한, 보증, 빌 찾을 수 있습니다. 아시아에서 가장 큰 전자상가 광고된. 하지만, 제 생각으로는 매우 매력적이고 쉽지 않습니다. 나는 쇼핑 할 추천하지 않습니다.",Okarahan,2,578,"Yongsan Electronics Market. You can find it on various electronic devices here. No operating cash, no bills, no guarantees. The price was about 10% higher for payment by card. The same device, the price is quite different in other stores. In addition, if you look deep, you will find the same device online store, affordable, guaranteed, and bill. advertised in Asia as the largest electronic shopping mall However, I think it is very attractive and not easy. I don't recommend shopping."
Bill / Warranty가없는 전자 제품에 적합 전화 가격은 매우 저렴하지만 보증 또는 청구서를 내지 않습니다. 그러나 Apple 전화의 경우 Apple 웹 사이트에서 IMEI를 확인할 수 있습니다.,Mohit S,4,578,"For electronics without Bill / Warranty, phone prices are very low, but no warranty or invoice. However, for Apple phones, you can check IMEI on the Apple website."
"전자 제품 유명한 쇼핑몰 전자 제품 층은 제품 와이드, 휴대 전화, 노트북, 가제트, 카메라, LED / LCD, 아동용 장난감으로 나뉘어져 있습니다. 판매 소녀와 상점 주인은 당신에게 높은 가격을 말합니다. 그래서 두려워하지 말고 그들과 거래하십시오. 당신이 좋아하는 것을 1 / 2 가격표로 인용하십시오. 유일한 것은 당신에게이 시장에서의 성공을 당신의 좋은 협상 기술이라고합니다. 한국에서 소비자 기술이 싸다고 믿습니다. 쇼핑몰 시간은 엄격하므로 시간을 적절하게 관리하고 적절한 현금 (한국 원화),",Xeeshu,4,578,"Electronics Famous shopping mall electronics floors are divided into product wide, mobile phones, laptops, gadgets, cameras, LEDs / LCDs, and children's toys. The girl selling and the shopkeeper tell you a high price. So don't be afraid to deal with them. Please quote what you like as a price tag of 1 / 2. The only thing I can tell you is that success in the market is your good negotiating skills. I believe that consumer technology is cheap in Korea. The shopping mall time is strict, so you can manage your time properly and cash appropriately (Korean won),"
방문할만한 가치가 없다. 이 지역은 방문 할 가치가 없습니다. 컴퓨터 나 휴대 전화를 찾는다면 범위는 적당하지만 가격은 경쟁력이 없습니다.,Budgong g,1,578,"Not worth a visit. This area is not worth visiting. If you are looking for a computer or a mobile phone, the range is reasonable, but the price is not competitive."
"다양한 전자 제품 작년에 용산을 방문한 곳은 평온한 곳이었고 주민들 만이 저렴한 가격으로 거래 할 수있는 곳으로 적합했다. 심지어 내 한국인 친구는 나에게 거기에 가라고 조언하지 않았다. 그러나 나는 아직도 보려고 갔다. 내 새 집에 대한 디지털 도어록을 찾고 있었지만 문제를 발견했습니다. 묘사 된 그늘하고 나쁜 장소를 찾지 못했습니다. 많은 전자 제품 가게와 나는 가격이 더러웠다라고 생각하지 않는다. 그러나 아마 지방 주민은 교섭하고 좋은 가격을 얻을 수 있었다. 어쨌든 검색 한 후 포기하고, 디지털 자물쇠",teamilk,4,578,"Various electronic products Last year, the place to visit Yongsan was peaceful and suitable for residents to trade at a low price. Even my Korean friend didn't advise me to go there. But I still went to see it. I was looking for a digital door lock for my new house, but I found a problem. I couldn't find the shadowy and bad place described. Many electronics shops and I don't think the price was dirty. But perhaps the local people could negotiate and get a good price. Anyway, you search, you give up, digital lock."
"용산전자상가 이 곳에 전자 다양한 종류의 장치에서 찾을 수 있습니다. 영업 현금 돈을, 빌, 보증 없음 없습니다. 카드를 통해 결제 경우 가격이 10 % 정도 높았습니다. 동일한 장치, 가격은 다른 가게에서 꽤 큰 차이가 있습니다. 또한, 깊이 조사할 경우 동일한 장치 온라인 상점 저렴한, 보증, 빌 찾을 수 있습니다. 아시아에서 가장 큰 전자상가 광고된. 하지만, 제 생각으로는 매우 매력적이고 쉽지 않습니다. 나는 쇼핑 할 추천하지 않습니다.",Okarahan,2,578,"Yongsan Electronics Market. You can find it on various electronic devices here. No operating cash, no bills, no guarantees. The price was about 10% higher for payment by card. The same device, the price is quite different in other stores. In addition, if you look deep, you will find the same device online store, affordable, guaranteed, and bill. advertised in Asia as the largest electronic shopping mall However, I think it is very attractive and not easy. I don't recommend shopping."
Bill / Warranty가없는 전자 제품에 적합 전화 가격은 매우 저렴하지만 보증 또는 청구서를 내지 않습니다. 그러나 Apple 전화의 경우 Apple 웹 사이트에서 IMEI를 확인할 수 있습니다.,Mohit S,4,578,"For electronics without Bill / Warranty, phone prices are very low, but no warranty or invoice. However, for Apple phones, you can check IMEI on the Apple website."
"전자 제품 유명한 쇼핑몰 전자 제품 층은 제품 와이드, 휴대 전화, 노트북, 가제트, 카메라, LED / LCD, 아동용 장난감으로 나뉘어져 있습니다. 판매 소녀와 상점 주인은 당신에게 높은 가격을 말합니다. 그래서 두려워하지 말고 그들과 거래하십시오. 당신이 좋아하는 것을 1 / 2 가격표로 인용하십시오. 유일한 것은 당신에게이 시장에서의 성공을 당신의 좋은 협상 기술이라고합니다. 한국에서 소비자 기술이 싸다고 믿습니다. 쇼핑몰 시간은 엄격하므로 시간을 적절하게 관리하고 적절한 현금 (한국 원화),",Xeeshu,4,578,"Electronics Famous shopping mall electronics floors are divided into product wide, mobile phones, laptops, gadgets, cameras, LEDs / LCDs, and children's toys. The girl selling and the shopkeeper tell you a high price. So don't be afraid to deal with them. Please quote what you like as a price tag of 1 / 2. The only thing I can tell you is that success in the market is your good negotiating skills. I believe that consumer technology is cheap in Korea. The shopping mall time is strict, so you can manage your time properly and cash appropriately (Korean won),"
"Kr 에서 최악의 경험 이 곳에 가지 마세요. 매우 모호한 곳입니다. 사람들은 안전한 느낌을 주지 않는다 (보라, 전혀 좋은 거래에 만들지 수 있습니다.",Kristof_Ge,1,578,"Kr's worst experience. Don't go here. It's a very vague place. People don't feel safe. (Look, you can make a good deal at all."
"이 덤프, 주지 찾기 힘들다. 걷는 보행자 다리 를 ipark 신라 면세점 에서 쇼핑을, 판지 상자와 자 부랑자들. 냄새가 있었어요. 시장에서 많은 아무 것도 없습니다. 아마 일요일 이 면 상점이 문을 닫는 것. 디지털 쇼핑몰에 많지 않은 새 ipark 포장 마차. 앞으로 시간 낭비 입니다.",Dr C Tan,1,578,"This dump, it's hard to find you. Shopping for walking pedestrian bridges at ipark Shilla Duty Free Shop, cardboard boxes and ja vagrants. There was a smell. There's not much in the market. Probably closing this cotton store on Sunday. New ipark wagons, not many in digital shopping malls. It's a waste of time from now."
시간 낭비 10 중심부에서 멀리 떨어져 있다. - 15분이면 지하철 역. 뒤에 있는 큰 전자 시장 imall. 하지만 아시아 시장과 비교하여 매우 비싼 편. 해당 제품을 저렴한 가격에 온라인. 좋은 품질의 제품 많이 사용되는 않습니다. 해당 quote 에 매우 높은 가격. 있는 잖아요. 시간 낭비 하지 마세요. 지 않다.,SamWorld,2,578,"Waste of time away from the core of 10. - 15 minutes to the subway station. The big electronics market behind me, but it's very expensive compared to the Asian market. The product is online at a low price. Not many good quality products are used. a very high price for the quote It's there is. Don't waste your time. Don't lose."
비싸고 오래된 괜찮은 점이 전자 제품 시장. 저는 홍콩에서 일본 가전 시장. 이에 비해 특별한 어떤 것도. 저는 비싼 편이라 관광객들이 볼 수 없는. 이 곳을 추천하지 않습니다.,timoshym,1,578,"The expensive and old fine thing is the electronics market. I'm from Hong Kong to the Japanese home appliance market. Nothing special compared to this. I'm expensive, so tourists can't see it. I don't recommend this place."
"특별할 것 없는 경우 일본, 홍콩, 또는 미국. 저는 평일에 가서 약 5pm. 저는 일본에 살고 있는 곳이나 방문한 홍콩 이. 어쨌든 나는 물건들을 본 전시는 음성 레코더 및 cd 플레이어 등 이 더 이상 표시되지 않습니다. 컴퓨터는 개인 적지 않을 것이지만 미국 이 여기에 살 것을 생각하면 첫 번째, 두 번째 및 세 번째 홍콩의 일본.",LNM981,2,578,"Japan, Hong Kong, or the United States, if nothing special. I go there on weekdays and about 5pm. I live in Japan or visit Hong Kong. Anyway, the display that I saw the items no longer displays, such as voice recorders and CD players. Computers may not be small, but the first, second, and third, Hong Kong's Japan, considering that the United States will live here."
실망 국제 시장 보다 높은 가격. 용산 전자 시장 실제 표시 없이 표시합니다. 이용자 사진 정확하지 않습니다. 많은 붙은 찾을 수 없습니다.,naseem25,1,578,Price higher than disappointing international market. Displays Yongsan Electronics Market without actual display. The user picture is not accurate. Not many matches found.
