review,u_id,u_rate,p_id,review_en
"너무 큰, 너무 많은, 싼 가격 더 나은 가격에 보다 더 많은 곳을 볼 수 있는 5000 전자 상점. 그것은 마치 거대한 수 있는 대로 단어 수 없습니다. 원하는 것을 찾을 수 없는 언어 때문이다. 가격이 비싼 것 같지만 제가 전화를 하는 것 같은 느낌을 주 교섭이 하지 않는다. 이에 지쳐 가는 위험 및 비용을 지불한 제품 보다 실제 가격. 보는 경험이 라 하지 않을 것이지만 나는 걸어간 전자 제품 구입",Igal G,3,578,"Too big, too many, too cheap 5000 electronics stores where you can see more places at a better price. It can't be worded as if it's huge. It's because of the language that I can't find what I want. The price seems expensive, but I feel like I'm making a phone call. The actual price rather than the product for which the risks and costs of the product have been paid. It's not going to be a viewing experience, but I'm going to buy a walking electronic device."
"많은 것들, 아니 너무 특별한 주요 구매 위치 - 많은 전자 제품 이 tv, 오디오 장비와 카메라. 이 다소 흥미로운 방문자 의 관점에서, 모두 선택할 수도 있지만 가격이 매우 눈에 띄는 일 인터넷 온라인 쇼핑. 전자 제품을 본 적이 없는 경우에만 아시아 지역의 주요 영업 지역 - 가볼 만합니다 켜짐, 하지만 나는 여기 가 더 저렴한 가격에 관한 그 어떤 것 보다 더 이국적인 것 보다도 찾을 수 있는 인터넷 또는 즉시 사용할 수 있습니다. 저는 매우 낮은 순위 입니다 합니다 - 목록 들 을 봅니다, 심지어 사람 살아남을",gdude,3,578,"A lot of things, or a major purchase location that is too special - a lot of electronics this TV, audio equipment and camera. From this rather interesting visitor's point of view, you can choose everything, but the price is very high, online shopping on the Internet. Major Sales Areas in Asia - worth visiting only if you haven't seen any electronic products Turn on, but I can use the Internet here, or I can use it right away, more exotic than anything else about cheaper prices. I'm very low on the list, and I even see people survive."
"전자 제품의 좋은 장소 저는 서울에 올 때마다 이 곳을 방문할 때 나는 &, 이 거대한 곳을 모든 종류의 전자 제품, 카메라, 컴퓨터, 휴대 전화 액세서리 y, 요 많은 거래가 되지만, 의미 있는, 환자 상담 시 한 수 &, 특히 휴대, 많은 이들이 알 수 있는 재생 제품 소형화의 여지가 있음, 구입 시 잘 보살펴 주었기 때문에 그들은, 있을 수도, 현금을 선호하는 등, 그들은 미화 할 수도, 유로. 여전히 가치입니다.",Shady Bekhit,5,578,"A good place for electronic products Whenever I come to Seoul, I visit this huge place with all kinds of electronic products, cameras, computers, mobile phone accessories y, many deals, but meaningful, there is room for patient counseling, especially portable, for small-sized regenerative products that many people know about, so they may have, or prefer cash, etc., they can beautify it. It's still worth it."
"큰 시장 꽤 큰 온갖 종류의 전자 제품 시장, 중앙에 있었고, 서울 어디에서 쉽게. 나는 유럽에 비해 아주 매력적인 가격을 찾을 수 없습니다, 가볼만한 가치가 있지만.",JohnHartson9,3,578,"Big market pretty big, all kinds of electronics market, in the middle, easily anywhere in Seoul. I can't find a very attractive price for Europe, though it's worth visiting."
"아 큰 상점 큰 상점 을 방문하여 시간과 비용을 절약할 수 있습니다. 그 중 하나는 컴스 합니다. 시장에 가면 동일한, 터널이 나와서 되는문제점을. 그 건물 오른쪽에 보면 컴스 어표. 지하에 있는 가게입니다. 여러 종류의 컴퓨터 센터 관리자가 해당 컴퓨터 액세서리 합니다. 제가 원하는 몇 가지 어댑터. 제가 본 사람들은 그들이 무엇을 컴스 목록이 있는 도금계를. 지역 주민들이 쇼핑하는 알고있다.",Kairat,5,578,"Ah, you can save time and money by visiting a large store. One of them is coms. When you go to the market, the same tunnel comes out. On the right side of the building, it's a Combs' note. It's a store in the basement. Various kinds of computer center managers do the computer accessories. A few adapters that I want. The people I've seen are what they're doing with a plating machine with a coms list. I know that local people shop."
많은 전자 상점 구경 정말 다양한 관련 e 있습니다. 내 제안이 먼저 있을 찾을 수 있는 정보를 저렴한 가격도 하기 전에 용산. 비싼 가격 때문에 많이 준비 하기도 하잖아요.,germanlust,4,578,"There are a lot of electronic shops and there are so many related e. Before I can find the information that I can find first, Yongsan. They prepare a lot because of the high price."
"일요일에 열 슬프게도. 나는 이 착체 가져올 수 없습니다. 여러 리뷰를 읽은 것 같은 좋은 곳에 가서, 영업 시간 10: am 아침이 라고 한 그러나. 저는 일요일에 도착해서 다음날 아침, 사람들은 정보를 저장하여 보안 문을 닫는. 겨울 시즌 마감이 될 수도, 전화 통화 할 가치가 있는 라면.",Dale S,1,578,"Sadly, on Sunday. I can't get this fuselage. I went to a good place like I read a lot of reviews, and said business hours 10: am morning, but. I arrive on Sunday and the next morning, people save information and close the security door. It could be the end of the winter season, or ramen worth talking on the phone."
"한국의 전자 시장 거대한 시장, 필요한 모든 것을 찾을 수 있습니다. 팁 쇼핑이 있는 것이어서 점에 유의하십시오. ""저렴 합니다"", 일은 하지 않는 첫 번째 리라는 것을 믿는다. 가격 흥정을 하지 않아. 나는 그의 제안을 하이 마트 같은 온라인 또는 할인 매장",Kim T,2,578,0You can find everything you need in Korea's electronic market.Please note that there is a tip shopping.It's cheap. I believe it's the first Lee who doesn't work.I don't bargain over the price.I have his offer online or discount stores like Hi Mart.
좋은 곳 밤에 하는 거대한 장소 였습니다. 지하철 역과 쇼핑몰에 쉽게. 그냥 가서 방문.,Rafael N,4,578,It was a great place at night. Easily at subway stations and shopping malls. Just go and visit.
