u_id,review,u_rate,p_id,review_en
windstravel,대학로쪽으로 낙산공원에 오르면 80년대 분위기의 골목도 지나고 둘레길과 함께 낙산공원에서 서울의 전경을 바라볼 수도 있어 서울의 옛날과 현대의 자연스러운 조화를 느낄수 있다.,5,596,"If you go up to Naksan Park towards Daehak-ro, you can see the entire view of Seoul from Naksan Park along with the Dulegil after passing through the alley in the 80s."
천막족,점심시간에 운동하랴 엄청 올랐던 곳. 내가 사는 곳에는 큰 호수 공원에 근처에 있어서 그닥 재미는 못 느꼈던 곳. 점심시간에 가면 가볍게 조깅하시러 온 어르신들도 있고 가벼운 피로를 산책으로 풀어주면 좋다. 벽화마을을 지나가므로 간단하게 들러도 좋다. 하지만 관광을 생각하며 갔다간 진짜 별로임.,2,596,"The place I worked out at lunchtime and went up a lot. The place where I live is near a big lake park, so I didn't feel much fun. When you go to lunchtime, there are elderly people who came to jog lightly, and it's good to take a walk to relieve their light fatigue. You can stop by simply because you are passing by the mural village. But it's really bad to go there thinking about sightseeing."
solmarutimsd,다 좋아요. 다만 언덕길의 연속이다 보니 올라갈때 조심하세요 구두도 위험해요~ 겨울에는 곳곳이 얼어있고 급경사랍니다.,3,596,"It's all good, but be careful when you go up the hill. Shoes are dangerous too~ It's freezing and steep in winter."
난나아야,"낙산 공원은 공원 자체 뿐 아니라 서울 둘레길과 벽화 마을,그리고 대학로를 두루 함께 둘러볼 수 있는 장점이 있다.",4,596,"Naksan Park has the advantage of being able to look around Seoul's Dulegil, Mural Village, and Daehak-ro as well as the park itself."
classian,산이라고 하기엔 가볍게 걸어가기 괜찮은 곳. 대학로 주변에서 식사하고 친구들하고 산책하기 좋은 장소이다,3,596,A good place to walk lightly for a mountain. It is a good place to eat and take a walk with friends around Daehak-ro.
everlsk,"낙산공원에서 바라보는 서울의 전경이 멋지며, 특히 야경이 더욱 아름답습니다. 낙산공원을 간 김에 근처 이화벽화마을과 대학로도 함께 방문하면 좋습니다.",5,596,"The view of Seoul from Naksan Park is wonderful, especially the night view is more beautiful. It is good to visit nearby Ewha Mural Village and Daehak-ro as you go to Naksan Park."
seoulyoung,대학로에서 연결된 길로 올라가시면 그렇게 높지도 않지만 서울을 훤히 볼 수 있습니다. 도심 밖으로 나가지 않고 상쾌하게 도시를 한 번 볼 수 있어 좋습니다. 대신 겨울에는 길이 미끄러우니 조심하셔야 합니다.,4,596,"If you go up the road connected from Daehak-ro, you can see Seoul clearly even though it's not that high. It's good to see the city without going out of the city center. Instead, you should be careful because the roads are slippery in winter."
ahye0ng,"혜화에서 공연을 보고 낙산공원을 산책하면 딱 좋은 코스죠 맛집들도 주변에 많고, 성곽을 만날 수 있어 좋네요",5,596,"It's a perfect course to take a walk in Naksan Park after watching a performance in Hyehwa. There are many good restaurants around, and it's nice to meet the fortress."
찌니찌니07,낙산공원 출사갔었는데 외국인들이 의외로 많아서 놀랬어요. 평일날 출사가서 그나마 한가했어요. 서울시내가 한눈에 내려다보이고 한적하게 산책하기는 좋은곳,3,596,I went to Naksan Park and I was surprised that there were a lot of foreigners. I had some free time because I went on a business trip on weekdays. It's a nice place to take a walk with a view of Seoul.
mkla1004,대학로 구경하시고 밤에 한번 올라가보시면 서울이 한눈에 보입니다. 아름다워요 ...서울야경 .,4,596,"If you look around Daehak-ro and go up at night, you can see Seoul at a glance. It's beautiful...the night view of Seoul"
lee r,"시간이 많은 거주자라면 상관없지만, 시간이 적은 외국인에게 낙산공원은 정말 최악의 선택 중에 하나입니다. 뷰 또한 다른 곳에서 비슷하게 볼 수 있고요. 접근성이 떨어지고 수준높은 볼거리가 있는 곳은 아닙니다.",3,596,"It doesn't matter if you're a time-consuming resident, but for a foreigner who doesn't have much time, Naksan Park is one of the worst choices. The view can be seen similarly elsewhere. It's not a place with low accessibility and high quality attractions."
say895,혜화역이나 버스정류장에서 15분-20분정도 걸어야합니다. 가는 길에 볼거리도 많아서 지루하지는 않고요 무엇보다 야경이 너무나도 아름답습니다.,5,596,"It takes about 15 to 20 minutes to walk from Hyehwa station or bus stop. There are many things to see on the way, so I'm not bored. Above all, the night view is so beautiful."
sodal00,성벽에 앉아서 서울 야경을 내려다 보는 즐거움은 최고다. 요즘은 연인들이 많이 앉아있어서 나만 아는 장소를 뺏긴 기분.,5,596,"The pleasure of sitting on the wall and looking down at the night view of Seoul is the best. These days, I feel like I've lost a place that only I know because many lovers are sitting down."
쩡양,서울 야경좋은곳 참 많지만 낙산공원은 특별한 느낌이 있는것 같다. 성곽때문인지 뭔가 고풍스러운 느낌 ^^ 요즘은 좀 춥지만 9월쯤 방문하면 맥주한잔 하기 참 좋은곳이다.,4,596,"There are many good night view places in Seoul, but Naksan Park seems to have a special feeling. It's a bit old-fashioned because of the castle. It's a bit cold these days, but it's a good place to have a beer in September."
Homin R,서울시내 전망이 좋은 공원입니다. 낮보다 밤 야경이 더 좋구요. 가는길이 가파르긴하지만 그걸 상쇄할만큼 몇배는 더 좋습니다.,5,596,"It is a park with a good view of Seoul. Night view is better than day. The road is steep, but it's several times better to offset it."
Moonkyu K,창신동에 살적에 대학로에 있는 중학교로 가는 길이었습니다. 고불고불 말그대로 산을 타고 다녔는데 공원으로 깔끔하게 바뀌어 아쉬우면서도 야간의 뷰가 정말 좋습니다. 운동하시는 분들도 많이 계시고 대학로에서 커피한잔을 들고 올라오기엔 조금 벅찰수도 있겠지만 성곽에 기대어 야경을 보며 마시는 커피와 바꿀만한 가치가 있습니다.,4,596,"I was on my way to a middle school in Daehak-ro when I was living in Changshin-dong. I literally went hiking in the mountains, but it was changed to a park, so I'm sad but the night view is really good. There are a lot of people exercising, and it may be a little overwhelming to bring a cup of coffee from Daehak-ro, but it is worth changing it to coffee that you drink while looking at the night view against the castle."
빵이아빠,오르는 길이 좀 가파르지만.. 저녁 산책하기에 아주 좋습니다.. 올라가면 종로 일대가 한 눈에 보입니다. 운동하시는 주민 분들이 많습니다,4,596,"The climb is a little steep, but... It's great for an evening walk. If you go up, you can see the whole Jongno area at a glance. There's a lot of people who work out."
롬롬,걷는 길이 조금 가파르니 편안한 신발을 필수로 준비해야 해요. 따뜻한 계절에 방문하면 좋을 것 같아요. 너무 더운 여름은 빼고요.,3,596,"The walking path is a little steep, so you must prepare comfortable shoes. It would be nice to visit during the warm season. Except for the hot summer."
Wanimyo,"대학로 뒤쪽에 위치한 의외로 사람들이 잘 모르는 곳. 과거 성벽터도 보이고, 약간의 경사를 지나면 대학로의 번잡함을 벗어날 수 있는 곳",3,596,"Unexpectedly located behind Daehak-ro, where people don't know much about it. You can see the past fortress walls, and after a slight slope, you can get out of Daehak-ro's hustle."
swmmmmm,요즘같은 날씨에 가면 너무 좋습니다. 걸어올라가는 골목골목 너무 운치있고 좋아요. 야경보기에도 좋습니다.. 추천하는 데이트코스입니다 ㅋ,4,596,It's so nice to go in this weather. Walking up the alley is so beautiful and nice. It's also good for night views. I recommend this date course. LOL
znzl,동대문에서 마을버스를 타고 가면 좀 더 편하게 방문할 수 있구요. 경사가 좀 있지만 대학로에서 산책겸 올라가는 것도 괜찮아요. 이화동 벽화마을 구경도 할 수 있고 출사나 데이트 코스로 괜찮습니다.,3,596,"If you take a village bus from Dongdaemun, you can visit more comfortably. There are some slopes, but it's okay to go up for a walk in Daehak-ro. You can see the mural village of Ewha-dong and it's okay to go on a business trip or a date course."
alice,특히 해지고 야경볼때 너무 좋은 곳입니다. 둘레길 따라서 산책하면 이보다 더 분위기가 좋을 수가 없어요. 꼭 운동화를 신고가야 한다는 단점아닌 단점.,5,596,"It's a great place to see the night view especially after sunset. If you take a walk along the Dulegil, the atmosphere can't be better. The downside is not that you have to wear sneakers."
DMSTMD,서울이 넘 잘 보이는 곳 ㅡㅡ 그러기 위해서 계단을 ㅡㅡ 다리 아프게 올라야 하는 곳 ㅡㅡ,5,596,The place where you can see Seoul so well -- the stairs to do that -- the place where you have to climb with a sore leg.
파랑나비,계단으로 걸어 올라가기 힘든곳입니다. 여름에 캔맥주에 오징어 로망 생각하고 가셨다가는 모기에 뷔페 차려주십니다.,4,596,"It's hard to walk up the stairs. If you think of a squid dream in canned beer in summer, you will prepare a buffet for mosquitoes."
주니룩스,대학로길을 따라 올라가면 만날수 있는곳. 낮보다 밤이 더 아름다운 곳입니다. 연인들은 꼭 들려야하는 필수 코스,4,596,"If you go up the Daehangno-gil, you can meet. It's a place where nights are more beautiful than day. a must-see course for lovers"
가나다라마,올라가는 길은 조금 힘들지만 이 곳에서 내려다 보는 서울시내 조망이 매우 훌륭합니다. 도심에서는 밟기 어려운 흙길이 있다는 것도 큰 장점인 공원입니다.,5,596,"The way up is a little hard, but the view from here in Seoul is very good. Another big advantage is that there is a dirt road that is difficult to tread in the city center."
Romy870226,낙산공원은 여름의 명소라고 할 수 있죠. 탁 트인 전망과 저녁이 되면 들어오는 은은한 조명들이 너무 좋습니다,4,596,Naksan Park is a hot spot in summer. I love the open view and the subtle lighting that comes in in the evening.
MIN221,서울 시내가 한 눈에 내려다 보여서 굉장히 좋아하는 곳입니다. 경사가 있어 올라가기는 약간 힘들지만 보통 걸음으로 15분~20분이면 올라갈 수 있어요 밤에 보이는 야경도 너무 이쁘고. 깨끗하게 꾸며져 있습니다. 데이트 코스나 산책 코스로 좋아요. 금요일이나 주말 밤에는 항상 사람들이 북적여 평일 낮에 종종 가는 편입니다.,5,596,"I really like this place because I can see downtown Seoul at a glance. It's a little hard to climb up the slope, but you can get up in 15 to 20 minutes at a normal pace. The night view is so beautiful. It's decorated clean. It's good for a date or a walking course. On Fridays and weekends, people are always crowded, so I often go during weekdays."
HelloKH,대학로에 연극보러 갔다면 시간 있을때 산책하기 좋은 곳이에요 가는길이 오르막이라 걷기 힘들긴하지만 커피한잔 사서 가벼운 마음으로 천천히 걸어 올라가면 서울시내가 한눈에 보이고 좋아요,4,596,"If you go to Daehak-ro to see a play, it's a good place to take a walk when you have time. It's hard to walk because the road is uphill, but if you buy a cup of coffee and walk slowly, you can see Seoul at a glance."
ddneverland,성곽길을 따라 걸어올라가면 나오는 낙산공원. 별거없는 공원터이지만 날이 맑으면 서울 시내도 잘 내려다 보이고 친구들과 혹은 연인과 바람쐬기 좋은 곳이다. 서울 시내의 모습을 담으러 출사나가기에도 좋다. 대학로 쪽으로 내려가서 막걸리 한잔^^,5,596,"If you walk up the fortress road, you will find Naksan Park. Although it is a park spot, if the weather is clear, you can see downtown Seoul well and enjoy the breeze with your friends or lovers. It is also good to go out to capture images of downtown Seoul. Go down to Daehak-ro and have a glass of makgeolli."
대봉 조,여친과 함께 인사동구경을 하고 삼청동에서 데이트를 즐기고 저녁에 낙산공원을 갔죠 등산로 처럼 산책로가 있더군용 사람들이 많았어용 ㅋㅋ 커플들이 역시 많더군요 여친과함께 올라가서 정상이라고 해야 하나요?? ㅋㅋ 정말이지 밤야경이 너무 이쁘고 멋지더라구용 여자친구도 말없이 바라 보기에 저도 한동안 같이 서울의 밤야경을 바라보았네여 이렇게 이쁜밤야경은 남산하고 여기 낙산공원이 짱인거 같아용 접근성도 좋구요 아름다운 야경을 보면서 데이트를 즐기고 넘좋았어용^^ 서울의 다른 이쁜 저녁야경을,4,596,"I went to Insa-dong with my girlfriend, enjoyed a date in Samcheong-dong, and went to Naksan Park in the evening. There were a lot of people taking a walk like hiking trails. There were also many couples. Should I go up with my girlfriend and say normal? LOL The night view was really pretty and cool. GFRIEND looked at the night view of Seoul for a while. The night view is Namsan and Naksan Park is the best. It has a good accessibility. I enjoyed the beautiful night view and enjoyed the beautiful night view of Seoul."
sang cheol h,서울 중심지에 위치해 있고 날씨 좋은 날 방문하면 탁트인 전망을 볼 수 있습니다 대학로 부근에 위치해 있어서 데이트 장소로 아주 좋다고 생각되네요,5,596,"It is located in central Seoul and you can see the view of Takt-in on a fine day. It's located near Daehangno, so I think it's a great place for a date."
Diviva,지하철역에서 낙산 공원까지 걸어가는 것은 쉽지 않은 일이지만 걸어가는 시간은 짧습니다. 낙산 공원에서 서울 성벽과 서울의 일부를 볼 수있었습니다.,4,596,"Walking from the subway station to Naksan Park is not easy, but walking time is short. You can see the walls of Seoul and parts of Seoul at Naksan Park."
Haliza Ali,"낙산 공원은 아름답고 깨끗하며 조용한 공원으로 휴식을 취하고 경치를 즐길 수 있습니다. 나는 한판 승부 1 시간 동안 거기에 있었다. 나는 이화 벽화 마을 근처의 꼭대기와 더하기 점을 좋아합니다. 추천 노선-낙산 공원에서 이화 벽화 마을까지, 동대문까지",4,596,"Naksan Park is a beautiful, clean, and quiet park where you can relax and enjoy the scenery. I was there for an hour in a game. I like the top and plus dot near Ewha Mural Village. Recommended route-Naksan Park to Ewha Mural Village, Dongdaemun"
kksfv,"한국과 같은 젊은 나라에서는이 공원이 많이 바뀌 었습니다. 공원의 역사와 변화에 대해 배우는 가장 좋은 방법과 공원 주변의 벽은 무료 도보 여행을 예약합니다. 이것을 서울 요새라고하며 약 2 시간이 걸립니다. 한국의 역사, 4 개의 정문에 대해 배우고, 벽 박물관을 방문하여 공원의 정상까지 올라가 서울을 잘 볼 수 있습니다. 가이드를 만나려면 동대문역에 가야하기 때문에 2 ~ 3 시간이 걸립니다.",3,596,"In a young country like Korea, this park has changed a lot. The best way to learn about the history and change of the park and the walls around it book a free walking tour. It takes about 2 hours to call it a fortress in Seoul. You can learn about Korean history, four main gates, visit the Wall Museum, climb to the top of the park and see Seoul well. It takes 2 to 3 hours to meet the guide because I have to go to Dongdaemun station."
LG_Kay,"혜화 역에서 나는 마로니에 공원 (Marronnier Park)을 처음 방문하여 낙산 공원에 도착한 후 이화 벽화 마을로 나아 갔다. 공원에 도착하려면 약 450m의 오르막길이 적당합니다. 내가 정오 경 거기에 있었을 정도로 그것은 뜨겁고 양지 바르 렀다. 공원을 이용하는 지역 주민은 극히 소수에 불과했습니다. 이 공원에는 전시실, 전시관, 연장자를위한 센터, 농구 코트, 배드민턴 코트 및 아래 지역의 멋진 전망을 제공하는 여러 개의 광장이 있습니다. 오래된 요새 벽의 일부가 공원을",4,596,"At Hyehwa Station, I visited Marronnier Park for the first time and arrived at Naksan Park before heading to Ewha Mural Village. An uphill climb of about 450 meters is appropriate to arrive at the park. It was hot and sunny enough that I was there around noon. There were only a few locals using the park. The park has an exhibition hall, an exhibition hall, a center for senior citizens, a basketball court, a badminton court and several plazas offering a fine view of the area below. Part of the old fortress wall is the park."
nnhkaren,"벚꽃 시즌의 아름다운 전망, 편안한 공기를 즐기기위한 신선한 공기. 방문 할 또 다른 추천 계절은 10 월에서 11 월 사이입니다. 도심에 위치한 새로 고침 장소. 서울시의 네 산 중 하나.",4,596,"Beautiful view of cherry blossom season, fresh air to enjoy comfortable air. Another recommended season to visit is between October and November. A refreshment site located in the center of the city. One of the four mountains in Seoul."
Soo K,낙산 공원 (Naksan Park) - 한국어로 '낙타'는 낙타를 뜻하며 '산'은 산을 의미하므로 낙타 고비와 비슷한 모양을 의미합니다. 공원에 도착하기 위해서는 대학로 혜화 역에서 450m 정도의 오르막길이 필요합니다. 서울의 중심부에 위치한이 역사적이고 아름다운 공원은 도시 전체를 한눈에 조망할 수 있습니다. 침입자와 적을 보호하기 위해 조선 왕조 시대에 세운 옛 서울 성벽 (서울 성곽)의 일부가 공원을 달린다. 고요한 분위기는 도시의 번잡함에서 완벽한 출입구입니다. 그 경치 좋은 아름다움은,4,596,"Naksan Park - In Korean, ' camel' means camel and 'mountain' means mountain, so it is similar to camel hill. To get to the park, you need an uphill road of about 450 meters from Hyehwa Station in Daehangno. Located in the heart of Seoul, this historic and beautiful park offers a panoramic view of the entire city. Part of the old Seoul wall (Seoul Fortress), which was built during the Joseon Dynasty to protect invaders and enemies, runs through the park. The tranquil atmosphere is the perfect entrance to the city's bustle. That scenic beauty is..."
Jinx_15,모든 K - Drama에서 유명한 곳. 우리는 이화 벽화 마을을 걷다 보니 방문했다. 우리는 낙산 공원 길을 선택하지 않았고 대신 K-Drama가 일어나는 유명한 벽을 찾을 때까지 Ihwa Mural Village를 등반합니다. 낙천이 아니라면 낙산 공원을 하이킹 할 것입니다.,5,596,"Famous places in all K - Drama. We visited Ewha Mural Village as we walked. We didn't choose the path to Naksan Park and instead climb the Ihwa Mural Village until we find the famous wall where K-Drama happens. If it's not Nakcheon, I'll hike Naksan Park."
dxtchy,"이곳에서 친구와 멋진 산책, 산책을 즐기는 야경. 사람들은 이곳에 갈 수 있는.",5,596,The night view enjoying a nice walk and a walk with friends here. People can go here.
Pearl P,"하이킹하기 좋은 곳 였습니다. 그러나 많은 언덕을 오르기 가 매우 뜨거운 최고. 그러나 한 이 시 사용하는 중간 - 하루, 한 태양 였다. 서울에 있는 오래된 도시에 위치해 있고, 깔끔한 았습니다. 가파른 언덕을 올라가게 되지만. 맨, 관 에서 쉴 수 있었고, 좋은 생각이 야. 쉽게 할 수 있는, 더 이상 걷기 최고 였다, 계단을 이용했는데. 또한 근처에 벽화마을. 추천하고싶다, 더 이상 할 수도 있겠지만 매일 밤 이른 아침에 전에 보고선 은 강하 사용자_이름:.",4,596,"It was a good place to hike. But the best is very hot to climb many hills. But it was the middle of one poem - a day, a sun. Located in an old city in Seoul, it was neat. You go up a steep hill. Man, I could rest in the coffin, and that's a good idea. It was easy to walk, it was the best way to walk anymore, I took the stairs. Also nearby mural village. I'd like to recommend it, but I can do it any more, but every night I see it before early morning, and it's a fall user_Name:"
mimo997,"보기에 좋은 곳입니다, 그러나 필요 야 조금 하고 있습니다. 또한 멋진 장소가 있어 전체 연우 소극장 으로 먹을 수 있어.",4,596,"It's a nice place to look, but I'm doing a little bit, if necessary. Also, there is a great place so you can eat it at the entire Yeonwoo Small Theater."
Jn J,저는 겨울에 갔다. 제 생각에 좀 추웠지만 가면 공원의 아름다운 도시 전망 공원 간 ihwa 벽화 볼 수 있습니다. 그러면 ihwamurall 및 라는 귀여운 마을.,5,596,"I went in winter. I think it was a little cold, but if you go there, you can see the ihwa mural between the park's beautiful city view. Then the cute town of ihwamurall."
Sam,이 도시의 전망 좋은 긴 거리. 근처에 벽화마을. 많은 레스토랑과 커피 샵 / 아트 갤러리에 가까운 곳에 있는,5,596,A long street with a good view of this city. a mural village nearby. in many restaurants and coffee shops / near art galleries
Saudade C,낙산 공원을 걷는 동안에 우리는 찾을 수 있는 벽화마을. 이 평화롭고 조용한 산책을 즐길 수 있는 공원을 보고하고. 이 많지 싶지 않다면 더 이상 올라가서. 저는 추천하지 않는 것이 매우 추워지고 쌀쌀한 날 에서 하루를 마무리 하고. 봄 과 가을에 보니 경치가 훨씬 좋네요.,3,596,"While walking in Naksan Park, we can find a mural village. Report the park where you can enjoy this peaceful and quiet walk. If you don't want this much, go up any more. I end my day on a very cold and chilly day that I don't recommend. The scenery is much better in spring and fall."
RinaSalleh,"대신 느끼기, 더 많은 경사는 긴 산책하는 느낌 입니다. 쌀쌀한 날씨 에는 내가 낙산 공원까지 걸어서 dondaemun. 아름다운 풍경. 시간을 가지고 천천히 둘러볼 수 있는 즐길 수 있는 경관.",5,596,"Instead, feeling more inclined feels like a long walk. In chilly weather, I walk to Naksan Park and dondaemun. Beautiful scenery. an enjoyable sight to take your time and look around slowly."
FlyAaron,"찾고 있는 인상을 완화 의 도시의 오래된 벽을 따라, 저는 적극 추천 합니다. 꽤 놀라운 풍경. 산을 볼 수 있고, 스카이 라인, n 서울 타워 등. 전체 단면을 하이킹을 하지 않았다. 지하철에 타게 될 경우, 동대문역 10번 출구에서 내린다. 길을 건너 답변하기 시작하고. 벽을 따라 걸어 나타날 때까지 왼쪽에 주요 공원. 거기서, 중앙 계단을 걸어 내려가면 경로를 지정할 수 있습니다. 먹을 수 있는 편의점이 있었고,. 우리가 자신을 찾을 때 의 예술 동네인 채 갤러리, 레스토랑과 카페들이",5,596,"Along the old walls of the city, I highly recommend the impression you are looking for. Pretty amazing scenery. You can see the mountains, skyline, n Seoul Tower, etc. I didn't hike the entire section. If you get on the subway, get off at Exit 10 of Dongdaemun Station. Cross the street and start answering. Main park on the left until it shows up walking along the wall. From there, you can specify the path by walking down the central stairs. There was a convenience store where we could eat. When we find ourselves, it's an art neighborhood in the city where galleries, restaurants, and cafes are located."
Alice C,"벽에 있는 오래된 도시로 호추적, 부분에 위치하고 있는 낙산. 역에서 지하철을 타고 연우 소극장 으로, 역에서 걸어서 갈 수 있는 일부, 쇳대 박물관 을, 가까운 거리에 있는 언덕 위의 경우 최고, 나는 한, 하지만 전망은 산에 있는 보람이 있다.",3,596,"Naksan, an old city on the wall, located in the part of the lake. From the station to the Yeonwoo Small Theater, some of which can be walked from the station to the Yeonwoo Small Theater, the Iron University Museum, the best on a hill within a short distance, I am Han, but the view is rewarding in the mountains."
Mya Htwe N,"나는 너무 많은 것 같습니다. 나는 그 곳에서 저녁에, 본 도시의 풍경과 석양을 느껴졌다. 또한 걸어갈 수 있는 행사도 아주 좋았습니다.",5,596,"I think I have too many. I felt the view and sunset of the main city there in the evening. Also, the walking event was very good."
