u_id,review,u_rate,p_id,review_en
jebskulker,"유일한 방향을 찾을 수 있는 곳이 역에서 내리는 것 따라 연우 소극장 으로. 표지판을 따라 산책해 대학 주변 도로에 까지 따라 낙산 왼쪽으로 일련의 단계를 저 언덕까지. 그 곳에서 나는 나의 본능 을 따라 가파른 길 위로. 모든 것을 한 시간 반 거리에서 it 지하철 역, 가능성이 적은. 서울의 스카이라인 전망이, 그냥 지나가는 타워 블럭 거리이기 때문에, n 서울 타워의 전망 을 강조 했지만 요새 벽 한쪽에 위치. 요새는 사진을 잡아 벽과 만족도 최고의 전체적인 면에서 가치가 있다.",4,596,"To Yeonwoo Small Theater as you get off at the station, where you can find the only way. Walk along the signs and follow the road around the university to the left of Naksan Mountain. There I follow my instincts up the steep road. Everything from an hour and a half away it subway station, less likely. Seoul's skyline view, because it's just a passing tower block street, emphasized n Seoul Tower's view, but it's on one side of the wall these days. These days, the wall and satisfaction are worth the best overall picture."
Nur Faizah J,"흥미로운 곳을 찾을 수밖에. 또한, 매우 편리한 시간을 보내는 가족이나 친구들. 버스나 지하철을 타고 걸어서 갈 수 있지만 2 km.",3,596,"I have no choice but to find an interesting. Also, family or friends who spend a very convenient time. You can walk by bus or subway, but two kilometers."
Stephanie L,"이는 위에서 ihwa 벽화마을 에 완벽하게, 그래서 우리는 다시 아래를 통해 주요 도로에 공원이 있습니다. 우리가 간 중순 여름에는 멋진 바람과 아름다운 날씨였습니다. 앉아서 쉴 수 있는 룸도 있고 큰 나무 그늘 을 사용할 수 있습니다. 이 멋진 도시를 떠나, 이후 ihwa 벽화마을 을 강력 추천하는 것, 하지 않을 수도 있겠지만 노력하고 있다. 할 수 있는 가장 좋은 전망을 볼 수 있지만 꽤 가파른 상승을 할 수 있는 슬프 지 않았다.",4,596,"It's perfect from the top to the ihwa mural village, so we're going to go back down and have parks on the main roads. In the middle of the summer when we went there, it was beautiful weather and wind. There is also a sitting room and you can use the shade of a big tree. Leaving this wonderful city, I may or may not recommend the ihwa mural village, but I am trying. You can see the best view you can do, but it wasn't sad enough to make a pretty steep rise."
Antoni T,"감사합니다. 좋은 공원. 아주 깨끗했습니다. 이 체육관, 와이파이, 갤러리. 너무 좋은, 아주 좋은. 서울에 있는 사운드 이다. 환영합니다.",5,596,"Thank you. Good park. It was very clean. This gym, Wi-Fi, gallery. Very good, very good. This is the sound in Seoul. Welcome."
lilmizsara,"나는 밤이었지만 근처에서 좀 걸어야 하는 연우 소극장 으로 일부 지역은 가파른 상승 입니다 - 좋은 운동 -! 이 곳은 좋은 친구들과 함께 놀고, 운동, 산책이나 하고 당신의 애완 동물. 또한, 외부 주변 지역에 따라, 더욱 up, 의 얼굴을 벽을 따라, 서울의 경치는 정말 아름다운, 특히 밤에.",4,596,"I was at night, but I had to walk a little nearby Yeonwoo Small Theater, and some areas have steep rises. Good exercise! This place plays with good friends, exercises, walks, and your pet. Also, depending on the area around the outside, more up, along the wall, the scenery of Seoul is really beautiful, especially at night."
Charlottecb,"산책을 좋은 서울의 전망도 좋고, 벽은 예술 상점에서 선물을 구입하는 주식. 다른 곳에서 조용하고 한적하다.",4,596,"Seoul has a good view for a walk, and the wall is a stock that buys gifts from art shops. Quiet and quiet elsewhere."
TwinkleBaby,"시내를 전망할 수 있는 정말 좋은 곳 참조하십시오. 또한 서울의 모든 곳에서, 매우 아름다운.",4,596,"See a really nice place to see the city. Also everywhere in Seoul, very beautiful."
Hongkongboy55,이 벽화 마을에 위치하고 있는 국립 공원을 간다면 ihwa. 우리가 아침에 한 가지의 도시. 수 있기를 기대하지는 않지만 전망이 좋은 밤에 다른 스케줄 때문에 반환.,4,596,"If you go to the national park located in this mural village, ihwa. We have one city in the morning. Returned due to another schedule on a night with a good view, although not expected to be possible."
jkim3,"일요일 아침에 갔다. 정말 조용합니다. 우리는 걸어서 약 1시간 반. 동대문 바로 옆 길 수 있는 가 시작됩니다. 가는 길에 많은 언덕에 있는 개인. 주민들은 집에 가는 산책로 에서 볼 수 있습니다. 이 아름다운 가을 이 나무 색상으로 설정. 나는 멋진 은행 잎 (노란색 사람) 였습니다. 나는 적이 없었는데 보면 서울의 좋은 도시의 중심부에 있는, 할 수 있는 산책로가 있다. 이었죠.",5,596,"I went on Sunday morning. It's really quiet. We walk for about an hour and a half. The long distance next to Dongdaemun begins. An individual on the way on many hills. Residents can see it on the walk home. Set this beautiful autumn to this tree color. I was a nice ginkgo leaf. I've never flown before, but there's a walking trail in the heart of Seoul's good city. It was."
YK N,"우리 가족 4명이 함께 벽화마을 의 주요 목표는 ihwa. 한 길을 따라 벽화가 좁 급준파 의 사진을 찍을 수 없다는 것을 우리는 공원 입구 에 도달했습니다. 우리가 본 최고의 계단 위 공원과 해 계단을 오르기 에는 내가 노인 들이 걸어갈 수 있는 가파른 길을 조금 피곤한 가족. 그럼에도 불구하고, 우리는 우리가 행복에 도착. 공기가 신선하고 좋은 전망의 도시. 가을 잎 들이 흥미로운 조각 들 과 주변은 아름다웠습니다. 이에 따라, 우리는 영화 장면에서 감격 의 시간을 해결 방안.",4,596,"We reached the entrance to the park, where four of our family members together, said, ""The main goal of the mural village is ihwa. There is a narrow mural along one road, so we can't take pictures of the rapids. The park above the best stairs we've ever seen and the family that is a little tired of the steep path I can take for the elderly. Nevertheless, we have arrived at happiness. a city with fresh air and a good view The autumn leaves were interesting pieces and the surrounding area was beautiful. As a result, we have a solution to the emotional time in the movie scene."
Carpediemzzz,"나는 이 곳을 정말 사랑 했기에 식사할 수 있어서 daehak 또는 음료를 동시에 댐핑할. 실제로 과거 요새 였습니다. 이제는 시민 공원이 되었다. 이런 멋진 야경도 가까이에 있는 벽화마을 전자화 벽부를. 모두 방문을 추천하는 데 더 많은 시간을 투자할 수 있을 경우,",5,596,"I loved this place so much that I could damp dihak or drink at the same time. It was actually a fortress in the past. Now it is a citizen park. The wall of the mural village near this beautiful night view. If everyone can spend more time recommending visits,"
avispang,"많은 드로잉에서 뷰 게스트하우스, 서울에 가면 빨간 잎 도 마음껏 즐길 수 있는 시간과 함께!",4,596,"View guesthouse in many drawings. When you go to Seoul, you can enjoy red leaves."
Noura B,믿을 수 없을만큼 아름다운 곳입니다. 나는 모든 사람들이 이 공원을 추천합니다. 날씨가 좋아 정말 진정으로 가기 때문에 서울에서. 나는 진정한 신선한 공기가 느껴지지 었다,5,596,It's an incredibly beautiful place. I recommend this park to everyone. Because the weather is so nice and I'm really going to Seoul. I could feel the real fresh air.
bobshot,"이 좋은 공원을 방문하는 경우에 술을 가지고, 20분 정도 가파른 거리는 상관 없어, 하면 복잡하여, 그리고 이미 지역. 더 크고 좋은 산이 있다.",4,596,"If you visit this good park, take a drink, and it doesn't matter how steep the distance is for about 20 minutes, it's complicated to do, and it's already local. There are bigger and better mountains."
보람 최,"제가 제일 좋아하는 곳이 서울에서, 특히 주변에 종로 대학로 (연우 소극장 으로) 지역. 을 수 있는 방법을 찾을 수 있다, 좀 많이 있다. 하지만, 일단 공원에 도착, 전망을 말하면 gonna 눌라움은. 최고의 신선한 공기가 깨끗하고 좋은 두 주간 및 에서 nightime. 작은 팁, 맥주 한 병을 가지고 가면 (한국의 법률에서 외부 음료).",5,596,"My favorite place is Seoul, especially Jongno Daehak-ro (Yeonwoo Small Theater). find a way to do something However, once we get to the park, the gonna nulaeum is. Two weeks and nighttime with the best fresh air. Small tips, a bottle of beer (external drinks in Korean law)."
MoiChannn,흥미로운 곳은. 벽에 벽화 예술의 모든 부분을 사랑 합니다. 제가 이곳에 와 사진을 찍을 경우 추천,5,596,"Interesting places. I love every part of the mural art on the wall. If I come here and take a picture, I recommend it."
Sakina M,"아름다운 경험이었습니다. 제가 묵는 동안 서울에 와서 나는 알고 있었다. 습하고 더운 날, 그러나 빙수 와 아이스크림을, 우리는 위로 올라가서 공원, 이와 같은 사랑스럽고 아주 젠. 스피커에서 나오고 있는 클래식 음악, 훌륭한 전망을 꼭대기에서. 편리한, 화장실과 벤치가 있다. 근사한 시티 호텔로 벽 위에서 멋진 사진. 참조해야 합니다!",5,596,"It was a beautiful experience. I knew it because I came to Seoul while I was staying. On a humid and hot day, but shaved ice and ice, we go up and we go up to the park, lovely like this, and very Jen. Classical music coming out of the speakers, great view from the top. Convenient, there are toilets and benches. Nice city hotel. Nice picture on the wall. Must be referenced!"
B_from_Singapore,이 공원은 걸어서 가서 벽화마을 을 방문한 다음. 가서 2 3 포인트의 훌륭한 전망을 관찰하여 볼 수 있습니다. 추천할 경우 제목으로 벽화마을.,4,596,I walk to this park and visit the mural village. You can go and see a great view of 2-3 points. Mural Village as the title if recommended.
JennyCheung25,"이 공원의 일부이기 때문에 제가 드라마 장면 이었다. 하고 있는 인근의 명소 - 마을의 벽화 볼 수 있고 오래된 도시 벽, 하지만 freakly 하는, 매우 매력적이다. 서울의 밤 풍경을 볼 수 있는 한, 나는 그곳에 있지만 말이다. 그래서, 되었고 밝은 핫.",3,596,"I was a drama scene because it was part of this park. Nearby attractions - you can see the murals of the village and old city walls, but freaky, very attractive. As long as I can see the night view of Seoul, I am there. So, that's enough. Bright hot."
kimahrikku,"위에 올라가는 서울의 낙산 언산 은 인기 여행지, 강력 추천을 해 보는 게 좋을 우회. 주변을 둘러싼 언덕은 매우 즐거운 (ihwa, hyewha, 대학로), 그리고 공원 자체는 매우 괜찮다. ""공원"" 이고, 작은 언덕 또는 산이 라고. 이 공원은 아주 깨끗하고 아주 좋은 식물들. 오래된 성벽 을 따라 걸어갈 수 있다 서울로 돌아와 따라 (또는 에서) 할 수 있습니다. 어떤 것은 너무 좋은 정보입니다. 둘 해요), 하지만 상당히 낮은 남산타워 (및 마운틴), 낙산 의 경치는 탁 트인, 제공하는",5,596,"0Upstairs, Naksan Eonsan in Seoul is a good way to recommend popular tourist destinations.The surrounding hills are very pleasant ihwa hyewha Daehangno and the park itself is very nice.A park, a small hill or mountain.This park is very clean and very good plants.You can walk along the old walls. You can come back to Seoul and follow or do it in .Some things are too good information.Two. But the view of Namsan Tower and Mountain Naksan is very low."
Mike54BU,"본 주변을 둘러싸고 있습니다. 맑은 날 검사기,인텔 하는 이상적인 궁전 근처에 위치해 있어서, 주요 쇼핑 / 관광 지역, 지하철 노선과 정말 놀라운 오래된 도시 벽 - 수 많은 킬로미터 거리! 좋은 운동을 하고 있거나, 산책은 조금 비싸지만, 그만한 가치가 있다. 이 특별한 곳에서 즐길 수 있습니다!",5,596,"It surrounds the main area. On a clear day, the intel is located near the ideal palace, so major shopping / tourist areas, subway lines and really amazing old city walls - hundreds of kilometers away! Having good exercise, or taking a walk is a little expensive, but it's worth it. You can enjoy it at this special place!"
April Ng,"혜화역에서 걸어 낙산 공원에, 저는 좋아하는 공원. 만약 시계 κ-드라마, 이것이 아마 가장 일반적인 드핀을 곳. 주위에 추천이 5pm-6pm. 이것은 내게 40min, 아주 급경사 겨울이면, 어떠한 짧은보기, 안되어, 길. 루트는 꽤 혼란. 에 걸어서 역. 하지만 전망은 놀라운, 그는 벽 예술! 사진 찍기 좋은 장소.",5,596,"Walk from Hyehwa Station to Naksan Park. My favorite park. If a watch-drama, this is probably where the most common droppin is. Recommendation is 5pm-6pm. This is 40 min for me, very steep for winter, any short example, no way. Root is quite confusing. a station on foot But the prospects are amazing, he's a wall art! A good place to take a picture."
Murat D,"좋은 공원은 도시 전경을 둘러보면 성벽 에 도달. 이 공원은 일반적으로 전체의 커플과 항상 흥미로운 공연, 변경다른 종류의 보여 줍니다. 또한 좋은 예는 이미 도시 변류 이후의 빈민가.",3,596,"A good park reaches the wall when you look around the whole city. This park usually shows different kinds of performances, always interesting performances, and different kinds of shows with the whole couple. Also a good example is already the slums after the urban displacement."
choi0038,"이 장소에 대해 최근까지 몰랐어요, 그리고 저는 단언컨대 이곳은 서울의 야경 중 최고. 누구에게도 이곳을 추천하고 싶어요 나는 서울에서 사는. 그건 그렇고, 자동차도 시도하지 않는 공원 근처 언덕 주차장. 나을 차는 지상 에 걸리지 않는다.",5,596,"I didn't know about this place until recently, and I assure you this is the best night view of Seoul. I'd like to recommend this place to anyone. I live in Seoul. By the way, a hill parking lot near a park where cars don't even try. A sick car doesn't get caught on the ground."
TsengSally,"제목으로. 드디어 올라가지 할때 최고의 장소는 공원, 서울의 아름다운 전망을 보겠다. 나는 네가 거기에서 점을 볼 수 있는 아름다운 전경과 저녁 햇빛 낭만. 이것은 정말 좋은 곳!",5,596,"With the title. When I finally go up, I will see the best place in the park and the beautiful view of Seoul. I have a beautiful panorama where you can see a mole there and an evening sun romance. This is a really nice place!"
Loki_and_Odin,만약 성능 및 휴식 또는 참여 운동 은 낙산 공원은 휴식. 이 앉아서 이야기를 즐길 수 있는 곳에서 도시의 전망 공원의 언덕. 야외 운동 기구가 있는 일부 주민 정기적으로 이용하는. 아마 좋은 장소이지만 그들에게 태워 에너지를 그냥 천천히 아래로 다. 전체 설정은 평화롭고 상큼한. 있는 요새 벽에 고대 동문 의 도시. 보러 오세요 광범위 탐색할 때 서울 공원 동문 은 골목길과 거리. 지하철 4호선 에서 쉽게.,4,596,"If performance and relaxation or participation exercise is rest in Naksan Park. A hill in the city's prospect park where you can sit and enjoy the story. Used regularly by some residents with outdoor fitness equipment. Maybe it's a good place, but just burn them down slowly. The whole setting is peaceful and refreshing. a city of ancient alumni on the walls of a fortress Come and see us. Seoul Park Dongmun is an alleyway and street. Easily on subway line 4."
