u_id,review,u_rate,p_id,review_en
Jiyoun,공연보고 밥먹고 산책하고 마을버스안타고 걸어갔는데 생각보다 가깝고 조금 올라갔다고 풍경이 확 바뀌더라구요 일몰은 시간때문에 못봤지만 충분히 좋았고 이화마을과도 연결되어 좋았습니다,4,596,"I went to the concert, ate, took a walk, took a bus to the village, but it was closer than I thought and went up a little bit, and the scenery changed dramatically. I didn't see the sunset because of the time, but it was good enough and connected to Ewha Village."
teamwhite,마을버스 종로03번을 타고 낙산공원까지 간다. 한양 도성 성과을 따라 걷는 길 자체가 좋다. 약간 높은 곳에서 보는 서울의 모습도 아름답다. 공원길을 걷다가 이화동 뱍화마을 까페에서의 여유또한 즐거움이다.,4,596,"Take the village bus Jongro 03 to Naksan Park. Walking along the achievements of Hanyang City Wall itself is good. The view of Seoul from a slightly higher place is also beautiful. While walking along the park road, it is also a pleasure to relax in the cafe of Bboonghwa Village in Ewha-dong."
Alpertbyun,낙산공원 서울 성곽을 따라 산책도 할수있고 서울 시내뷰도 볼수있어요 특히 일몰시간 야경시간에 맞쳐서 가면 좋은 뷰를 볼수 있는곳.,4,596,"You can take a walk along Naksan Park Seoul Fortress and see the view of downtown Seoul. Especially, if you go to the sunset time and the night view time, you can see a good view."
Hyejin S,"성벽을 따라 올라가는 길도 분위기 있고, 올라가서 보는 서울 야경도 귀한 풍경입니다. 언덕길을 올라가야 하지만 부담스러운 정도는 아니에요. 버스도 있음!",5,596,"The road along the wall has a good atmosphere, and the night view of Seoul is also a rare sight. You have to climb the hill, but it's not too much. There's a bus, too!"
Yooni,"주차하고 가볍게 산책하면서 담도 보고 할수 있다 . 남산근처에ㅡ있고 걸어서 시내쪽으로도 내려갈수 있고 독립운동가 박물관도 옆에 있어서 볼 수있다. 넓진 않지만 운치가 있어서 가족이나 연인끼리 가면 좋은곳이고 , 많이 알려지지 않아서 그런지 사람들이 많지 않아서 좋았다. 언덕같이 위아래로 걸어다닐수 있고 강아지도 델고 오는 사람도 많다. 밤에는 서울의 전망도 보기에 그만이다 . 고즈넉히 산책하기 좋은 잔디 그리고 돌담길이 있는 곳이다",3,596,"You can park, take a walk, and look at the wall. Near Namsan Mountain, you can walk down to downtown and see the Museum of Independence Movement next to you. Although it is not wide, it is a nice place to go with family or lovers because of its beautiful scenery, and it was good because there were not many people because it was not well known. You can walk up and down like a hill, and there are many people who bring their dogs. At night, the view of Seoul is perfect. It has a quiet lawn and stonewall road."
ahirity,야경이 멋진 공원입니다. 혜화역에서 시작하는 코스로 방문하는 사람들이 많습니다. 낮에 방문할 경우 공원 쪽에서 보는 뷰가 멋집니다. 공원으로 가는 길의 놎낮이가 있어 무릎이 안 좋은 분은 택시 및 다른 교통수단을 통해 이동하시길 권장합니다.,3,596,"It's a park with a nice night view. Many people visit the course starting from Hyehwa Station. If you visit during the day, the view from the park is great. It is recommended that people with bad knees move by taxi or other means of transportation because of the daytime on the way to the park."
194ren,여유있는 휴가날 서울 근교 조용한 산책로를 찾는다면 가볼 만한 곳이다. 젊은이들에게 많이 알려진 곳은 아니라서 조용하게 찾아가볼 만 한 곳이다.,3,596,"It is a good place to visit if you visit a quiet trail near Seoul on a leisurely holiday. It's not much known to young people, so it's a quiet place to visit."
Junghak L,낙산공원 처음 갔는데 너무 좋아요. 노을 야경 산책 모든 부분에서 좋습니다. 데이트로도 좋고 혼자 산책하기도 좋고 성벽이 또 은은한 멋을 보여줍니다.,5,596,"It's my first time to go to Naksan Park and it's so nice A sunset walk is good for all parts. It's good for dating, walking alone, and the walls of the castle show a subtle look."
KIM Gyunghee,"남산타워만큼 유명하진 않지만, 고즈넉하고 클래식하게 서울 야경을 볼 수 있어요. 동대문 쪽에서 올라가는 마을버스를 이용하면 쉽게 올라갈 수 있어요. 혜화동 쪽에서도 갈 수 있고요.",5,596,"Although it is not as famous as Namsan Tower, you can enjoy the night view of Seoul in a quiet and classic way. It's easy to get up if you take the village bus that goes up from Dongdaemun. You can go to Hyehwa-dong."
gingertea,이 곳 경치가 단연 서울에서 가장 아름답다고 생각합니다. 공원 인근의 아기자기한 가게들도 좋구요. 낮에 봐도 예쁘고 저녁쯤에 경치도 무척 아름답습니다.,5,596,I think the scenery here is by far the most beautiful in Seoul. The cute shops near the park are also nice. It is beautiful even in the daytime and the scenery is very beautiful in the evening.
정딸링,처음 방문한 곳인데 서울 시내가 한 눈에 내려다 보이고 이화벽화 골목과 대학로로 이어지는 코스로 나들이 하시면 좋은 코스가 될 것 같아요. 최고였어요!,5,596,"It's your first time to visit this place, and you can see downtown Seoul at a glance, and it'll be a good place to go out on a trip to Ewha Mural Alley and Daehak-ro. It was the best!"
starsoo,대학로거리에서 커피 한잔 테이크아웃해서 이곳 낙산공원까지 도보로 10분 올라가서 야경을 보며 커피한잔 하는 여유를 느끼기에는 좋다.,4,596,It's good to take a cup of coffee from Daehakro Street and walk 10 minutes to Naksan Park to enjoy a cup of coffee at night.
sunny,산책삼아 걷기에는 경사가 너무 심해서 조금은 힘들듯... 그래도 올라서면 시내 전경이 보이고 노을지는 모습이 아름답다. 올라가기전에 물한통을 들고가기를 추천한다. 아니면 아예 마을 버스로 올라가는것을 추천함,3,596,"The slope is too steep for a walk, so it's a little hard... Still, if you go up, you can see the whole city and the sunset is beautiful. I recommend you to bring a bottle of water before you go up. Or I recommend you to go up to the town bus."
lihhwa2018,대학로에서 공연을 보고 식사를 한후 도보로 낙산공원에 올라가서 서울 야경을 보면 정말 환상적인 뷰를 제공한다. 정말 좋다.,5,596,"After watching the performance in Daehak-ro and eating, you can go up to Naksan Park on foot and see the night view of Seoul. It's really nice."
evita002,낙산공원에 올라가면 서울 전경을 한번에 둘러볼수 있어요. 특히 야경이 아름다워서 밤에 가볼것을 추천하고 각종 티비나 영화의 촬영지로도 유명합니다.,4,596,"If you go up to Naksan Park, you can look around Seoul at once. Especially, the night view is beautiful, so I recommend you to go at night, and it is famous for filming various TV or movies."
아이언맨66,산책하기 좋아요. 대학로 낙산공원으로 올라가 성벽 타고 걸어서 동대문까지 가면 딱 조은 것 같아요. 가다가 목 마르면 카페 중간중간 많아요.,5,596,"It's good for a walk. If you go up to Naksan Park in Daehak-ro and walk to Dongdaemun by the wall, you will feel tight. When I get thirsty on the way, there are a lot of cafes in between."
lordauch,마을버스로 올라가기 쉽습니다. 그외에 여러곳에서 올라오는 길이 있구요. 한적한 오후에 노을과 야경보기에 좋습니다. 그리고 작고 아담한 가게들도 많아서 차한잔 마시며 시간을 보내기에도 괜찮습니다.,4,596,"It's easy to get on the town bus. There are other roads that come up from different places. Good for sunset and night watch on a quiet afternoon. And there are many small and small shops, so it's okay to spend time drinking a cup of tea."
nanal78878,마을버스를 이용하면 쉽게 도착할 수 있습니다. 서울시내 야경 보기에도 좋은곳이예요. 다만 볼거리는 크게 없습니다.,5,596,You can easily get there by using the town bus. It's a good place to see the night view of Seoul. But there's not much to see.
tree_,야경이 예뻐요. 봄엔 꽃구경 하러 가도 좋고요. 다른 곳에 비해 사람이 북적이지않아 데이트할 때 종종 가곤했어요. 따뜻해지면 또 방문하려고 합니다 ^^,5,596,The night view is beautiful. You can go see the flowers in spring. I used to go on dates because it was not crowded compared to other places. I'm going to visit you again when it gets warm. ^^
Traveling Foodie,서울의 야경을 보기 위해 남산에 갈 필요 없어요 너무 예쁘고 조용하며 주변에 귀여운 카페들도 많아요. 하이킹하는 즐거움도 최고!,5,596,"You don't have to go to Namsan to see the night view of Seoul. There are so many pretty, quiet and cute cafes around. The fun of hiking is also the best!"
Min_Kang,"여기 올라가서 야경을 보세요. 서울 야경 보기 좋은 곳입니다. 나름 분위기도 있고요. 강아지 산책시키기도 딱. 걷기 힘드니까, 창신역에 내려서 종로03 타고 올라가시면 됩니다.",5,596,"Go up here and look at the night view. It's a nice place to see the night view of Seoul. It has its own vibe. It's perfect for walking a dog. It's hard to walk, so you can get off at Changshin Station and ride Jongro 03."
J J,꼭대기에 오르면 서울타워와 동대문 일대가 한눈에 들어온다. 그렇게 높지않아 걸을만하고 마을버스도 다녀 접근성도 좋음,4,596,"When you climb to the top, you can see the Seoul Tower and Dongdaemun area at a glance. It's not that high, it's walkable, it's on the town bus, it's accessible."
ElleElleLL,"낙산공원으로 가는 길이 오르막 길. 낙산공원에 가서도 올라가는 길이 있어서 운동화 신는걸 추천. 그래도 낮에는 서울 풍경, 밤에는 서울 야경이 한눈에 보여서 올라간 보람이 있음.",4,596,"The road to Naksan Park is uphill. There's a way up at Naksan Park, so I recommend wearing sneakers. Still, the view of Seoul during the day and the night view of Seoul at night are worth seeing."
Ju-yeon Y,"낙산공원까지 걸어서 올라가면 정말 힘든데요, 공원에 도착해서도 끝없는 계단을 걸어야해서 너무 힘듭니다 ㅠㅠ 하지만 그걸 다 잊게 만드는 서울 풍경, 특히 야경을 보는 것을 추천합니다.",4,596,"It's really hard to walk up to Naksan Park, but it's so hard to walk on endless stairs even when I arrive at the park. But I recommend you to see the view of Seoul, especially the night view that makes me forget all about it."
Narae K,연극 기다리다가 공원가서 ㅎㅎㅎ 야경 보려고 올라 가서 완전 반해서 내려왔습니다. 잠시시간을 가지고 여유를 두고 올라가는 것도 나쁘지 않다고 생각해요^^,4,596,"While waiting for the play, I went up to the park to see the night view and fell in love with it. I don't think it's a bad idea to take a moment and leave your time behind.^^"
민석 권,혜화문에서 동대문으로 이어지는 도성길에 자리잡은 공원으로 이화마을과도 이어지는 아주 멋진 데이트장소 특히나 해질녁에는 많은 젊은이들이 서울의야경과 조명에 비친 성곽으루배경으로 사진을 찍는 명소,4,596,"It is a park located on the road from Hyehwamun to Dongdaemun. It is also a great date place that connects to Ewha Village. Especially at sunset, many young people take pictures with the night view of Seoul and the lighting of the castle."
apeach11,이화마을과 낙산은 자주 갑니다. 도심에서 접근이 용이하고 간단하게 산책하고 바람쐬고 머리를 식힐수 있는 그런 곳이죠.. 경치전망도 훌륭합니다.,5,596,"I often go to Ewha Village and Naksan. It's accessible from the city center, where you can take a walk, get some fresh air, and cool your head. The view view is great, too."
jeonys63,"낙산공원에서 서울시내를 내려다보며,, 오래된 동네를 바탕으로 모던하게 감각적으로 리모델링한 골목길을 산책하면, 작은 가게들을 구경하는 소소한 즐거움이 있습니다.",3,596,"If you look down from Naksan Park and walk through the modern and sensuous alleyway based on the old neighborhood, you will have a small pleasure to see the small shops."
drevelyn,심심한 뒷 동네 공원 갔지만 의외로 높아서 걸어 올라간 만큼의 보람이 있는 전경을 보여주는 곳 여름에 올라가서 맥주한잔하기 시원하고 좋은 동네,4,596,"I went to the neighborhood park in the back of my boredom, but it was unexpectedly high, so it was worth walking up there. It was nice to go up in the summer and have a nice beer."
junheemin,"혜화 대학로 중심으로 성곽이 있는 부근에 있는 공원, 산쪽이어서 조금 올라가야 하지만 야경이 좋습니다",5,596,"Hyehwa Daehangno is a park near the fortress, so you have to go up a little bit, but the night view is nice."
seulgi l,대학로 근처라면 꼭 가보세요~ 서서히 올라가다보면 서울도 한눈에 볼수 있꼬 성곽길도 볼 수 있어요,5,596,"If you're near Daehak-ro, make sure you go there.If you go up slowly, you can see Seoul at a glance and you can see the fortress road."
호밀빵,이곳은 언제나 데이트의 추억이.. 음 대학로라는 이름이 낭만적이라 갓 성인이 되고 나서 데이트를 목적으로 방문하곤 했는데 그 중에서도 낙산공원이 제일 좋았다. 열심히 도란도란 걷고 나서 서울의 야경을 내려다보며.. 나이 들어서 가니까 올라가는 게 힘들더라,4,596,"This place is always a memory of dating... Well, the name Daehangno is romantic, so I used to visit it for dating after I just became an adult, and among them, Naksan Park was my favorite. After walking hard, I looked down at the night view of Seoul. As I got older, I had a hard time going up."
Paradise655247,야경을보러갔는데 서울시전체가 탁트인채 보여서 너무좋았다 도시에이런야경느낌은 오랜만이였다 하지만 올라가는길이험난하다 조금힘들수있다,4,596,I went to see the night view and it was so nice to see the whole city of Seoul. It's been a long time since I felt this night view of the city. But the way up there is difficult. It can be a little hard.
flyingdonutx100,이화벽화마을을 구경하고 더 올라가면 낙산공원이 나와요. 언덕길을 올라와 힘은 좀 들겠지만 서울시내를 한눈에 볼 수 있어 좋아요.,5,596,"Take a look around Ewha Mural Village and go up further to see Naksan Park. It may be hard to climb up the hill, but it's good to see Seoul at a glance."
kkobuk,추울때 갔지만 경치가 넘 좋았구요 오히려 사진은 더 잘나왔어요 ㅎㅎㅎ 저녁먹고 한바퀴 좀 열심히(?)걸으면 됩니다 야경도 좋고~ 쾌적해요,5,596,"I went when it was cold, but the view was great, and the picture was better. You can walk around after dinner. The night view is nice. It's comfortable."
pang2mom,올라가는 길이 조금은 가파르지만.. 서울한복판에서 종로일대를 내려다 볼 수 있는 곳입니다. 밤에는 운동하는 주민들도 많습니다.,5,596,"It's a little steep up there, but... It is a place where you can look down the Jongno area from Hanbokpan in Seoul. There are many residents who exercise at night."
qberwy,"낙산공원은 올라가기엔 좀 힘들지만, 올라가서 바라보는 야경이나 낙조가 아름다운 곳입니다. 혜화역에서 슬슬 걸어올라가면 됩니다.",5,596,"Naksan Park is a bit hard to climb, but the night view and the sunset are beautiful. Walk up from Hyehwa Station."
Adelaveronica,서울 야경이 예쁜 곳 중에 한 곳. 예전엔 사람이 많지 않았는데 요즘엔 커플이나 가족등 밤에 야경을 구경하러 오는 사람들이 많다. 분위기 있게 서울의 밤을 볼 수 있고 내려가면 바로 대학로라 저녁 먹고 올라오면 딱 좋다.,5,596,"One of the places with a beautiful night view of Seoul. In the past, there were not many people, but nowadays there are many people who come to see the night view, such as couples and family. You can see the night in Seoul with a good atmosphere, and if you go down, you can go straight to Daehangno-ro for dinner."
졍,"근처서 공연보고 해지고 방문했는데, 운치있고 좋았어요~ 젊은이들이 많고 커플들도 많아요~ 위에 봉화대도 있고 아래로 서울시내가 내다보이는데 분위기가 너무 좋았어요. 다음에 또 재방문 의사 있습니다.",5,596,"I went to see the performance nearby, and it was so beautiful and nice. There are a lot of young people and couples. There is Bonghwadae on top and I can see the Seoul smell down there, and the atmosphere was so nice. There is another doctor who will visit again next time."
alma,"서울에 이런곳이 있는걸 몰랐다. 산 아래부터 정상까지 장판처럼 깔려있는 공원이다. 걸어올라가면 당연히 숨은 좀 차겠지만, 서울의 야경을 제대로 즐길 수 있는 곳이다. 낙산공원 정상에 올라 이화마을로 내려오거나, 이화마을로 정상에 올라 낙산공원으로 걸어오거나 둘다 좋다. 이화마을에는 예쁜 까페들도 있으니 한가하거든 꼭 방문해보시길.",5,596,"I didn't know there was a place like this in Seoul. It is a park that is laid out like a floorboard from the bottom of the mountain to the top. If you walk up, you will be able to catch your breath, but you can enjoy the night view of Seoul. Either climb to the top of Naksan Park and come down to Ewha Village or walk to Naksan Park. There are some pretty cafes in Ewha Village, so make sure to visit them when you're free."
양남댁,대학로에서 연극 하나 관람하고 그 전이나 후에 일부러 찾아 올라면 좋아요. 조금 높지만 가는 길 구경하면서 올라가면 시원한 전경이 펼쳐집니다. 밤에도 너무 예뻐요,5,596,"It's good to watch a play in Daehak-ro and visit it before or after that. It's a little high, but if you go up there, you can see a cool view. She's so beautiful at night."
Urizia J,종로 대학로 창신동 여러 방향에서 올라갈 수 있음 밤에 서울 야경 구경하기 아주 좋음 데이트하러 오는 커플들 여기저기 발에 채임 단 볕 피할데가 없어서 한낮에는 넘 덥고 거의 남산 높이를 걸어올라간다고 봐야 함 산꼭대기라서 해질녘에는 바람도 많이 붐,4,596,"It is very nice to go up from various directions of Changshin-dong, Daehak-ro, Jongno-gu, Seoul at night. Couples who come on a date have no place to avoid the sun, so it is very hot in the middle of the day and they walk up the height of Namsan Mountain. It is the peak of the mountain, so the wind is very strong at sunset."
Wernicke031,"운동화는 필수. 낮보다는 밤에 올라가는 게 좋다. 대학로, 서울성곽, 이화동벽화마을을 끼고 관광코스를 짤 수 있으며, 저녁에 맥주 한 잔과 함께 야경을 즐기면 좋다.",4,596,"Running shoes are a must. It's better to go up at night than during the day. Daehak-ro, Seoul Fortress, and Ewha-dong Mural Village offer a tour course, and enjoy a night view with a glass of beer in the evening."
정명진,동대문역에서 걸어 올라 가거나 마을버스 타고 이동이 가능 한 곳 입니다. 야경이 정말 멋진 곳으로서 추천 드리는 장소 입니다.,4,596,You can walk up from Dongdaemun Station or take a village bus. I recommend this place as a place with a great night view.
연쥬쥬,"저녁 해질무렵에 산책하면 분위기가 짱짱 좋은 곳입니다. 이화벽화마을에서 사진찍고 올라가 성곽길을 따라 한바퀴 돌면, 서울 시내가 한눈에 보이는 곳입니다.",5,596,"It's a great place to take a walk at sunset. If you take a photo from Ewha Mural Village and walk around the fortress road, you can see downtown Seoul at a glance."
마카롱,여름에 편의점에서 간단한 안주랑 캔맥주 사가지고 올라가서 담소 나누기 좋아요 야경때문에 분위기도 좋고 대학로에서 연극보고 가면 좋더라구요~,4,596,"It's good to go up to a convenience store in the summer to buy snacks and canned beer. The atmosphere is nice because of the night view, and it's nice to watch a play in Daehakro."
진규 이,"조경이 너무 잘 되서 오히려 좀 지루함이 느껴지는 심하게 평화로운 공원들도 사실 많지만, 낙산공원은 그저 머무르고 거닐기만 해도 기분이 상쾌해지고 그 나름의 재미가 있는 지형이 변화로운 몇 안되는 공원이다. 어쩔 수 없이 서울에서 힐링을 해야 한다면 가보시라, 멀리 떠난 듯.. 평화로움을 누리게 해줄 것이다.",4,596,"There are actually many parks where the landscaping is so good that you feel rather bored, but Naksan Park is one of the few parks where just staying and walking makes you feel refreshed and its interesting terrain changes. If you have no choice but to get refreshed in Seoul, go there, as if you have gone far away. It will make you enjoy peace."
Yobhike,서울 전경을 내려다 보는 경치가 참 좋습니다. 시간 있을 때 천천히 올라갔다 내려오기 좋아요.,5,596,The view of Seoul is very beautiful. I climbed slowly when I had time. It's good to come down.
GivsUsAHint,대학로에서 걸어올라오면 이화동 벽화마을도 만날 수 있다. 낙산공원에서는 서울을 조망할 수 있다. 참고로 올라오는 길이 다소 힘든 감이 있는데 정상까지 다니는 마을버스가 있으니 참고하는 것이 좋다. 하지만 걸어서 올라가는 것을 추천한다. 올라가는 길이 상당히 잘 꾸며져 있다.,4,596,"If you walk up Daehak-ro, you can also see the Byeokhwa Village in Ewha-dong. Naksan Park offers a view of Seoul. For your information, the way up seems a bit difficult, but there is a village bus that goes to the top, so it's better to refer to it. But I recommend walking up. The way up is quite well decorated."
지혜 심,서울시내에서 아경이 아름다운 몇 안되는 곳인것 같아요. 학교 뒤쪽이여서 머리식힐겸 자주 올라갔던 공원이라.. 답답할때 방문하기 최고! 데이트로도 최고!,5,596,I think it's one of the few places in Seoul with beautiful scenery. I went up to the park to get my hair done because it was behind the school. Best to visit when you feel stuffy! Best date ever!
123SDF,이화대학병원부터 명륜동까지 이어진 아름다운 둘레길 봄 가을에 고즈넉하게 걷기 좋은 길이고 동네 사시는분들도 볼수 있어 아련한 옛추억을 느낄수 있게 해주는곳입니다.,5,596,"The beautiful Dulegil from Ewha University Hospital to Myeongnyun-dong is a good place to walk quietly in spring and autumn, and you can see the people living in the neighborhood, making you feel nostalgic memories."
sunnyje,"성곽길 따라 걸으며 서울 전경 보기 좋습니다. 근처에 벽화마을도 있고, 조형물도 설치해 놔서 사진 찍으러 오는 사람도 많았어요. 단, 인도와 차도 구분도 없는 주택가 오르막길을 한참 올라야 나오는 공원이라 가기가 힘듭니다.",3,596,"It's nice to walk along the castle road and see the view of Seoul. There was a mural village nearby, and many people came to take pictures with sculptures installed. However, it's hard to get to the park because it takes a long time to climb up the uphill road of the residential area, which is indistinguishable from India."
bjh3676,"말 그대로 낙산 이라서 작은 산 전체가 공원입니다. 산 중턱까지는 사람이 살고 있는 인가라서 골목 곳곳에 있는 벽화등을 구경할 때 유의해야 할 것 같습니다. 꼭대기에는 서울 성곽이 있어서 역사공부에도 도움이 될 것 같습니다. 밤에는 그 성곽에 조명을 비춰 줍니다. 낙산 공원에서 서울의 동대문 등 서울시의 전반적인 모습을 조망할 수 있습니다. 동대문역, 혜화역에서 가깝고, 꼭대기까지 가는 마을버스가 있습니다.",5,596,"It's literally Naksan, so the whole small mountain is a park. People live in the middle of the mountain, so you should pay attention to the murals all over the alley. There is a castle in Seoul at the top, so I think it will be helpful for studying history. At night, the castle lights up. From Naksan Park, you can see the general view of Seoul, including Dongdaemun in Seoul. Dongdaemun Station, Hyehwa Station, and there is a village bus that goes to the top."
리나 최,의외로 높아서 숨차고 힘듬 ㅋㅋ 그렇지만 밤에 가면 올라간 가치는 있을 정도로 예쁨 먹을건 없음,4,596,"It's unexpectedly high, so I'm out of breath and tired, but there's nothing to be pretty enough to be worth going up at night."
