review,u_id,u_rate,p_id,review_en
"훌륭한 박물관 오늘 이 박물관 방문. 이곳은 경복궁 복합 위치하고 있습니다. 그것은 다른 것은 근본적으로 셀프사진을 찍는 곳이 넓지는 않았지만 전통의상을 입는 재미와 아름다운 배경들을 이용한 멋진 인질범 찾는 자가 장소 궁전 훨씬 더 흥미롭다. 이 박물관은 흥미로운 조선 통치자들이 찾습니다. 위해 궁전 군주국, 프로토콜, 관습 및 일상 생활을. 황제들의 거처였던 좋은 기념품과 그들의 물개, 초상화 및 유물. 로얄 자동차, 가마, 깃발, 주방 마모 있습니다. 이 호기심 많은 역사가 언제나 매혹적인 연극",Nigel G,4,709,"Great museum. Visit this museum today. This is the complex location of Gyeongbokgung Palace. It's much more interesting to find a nice hostage-seeking palace using the fun of wearing traditional costumes and beautiful backgrounds, although other things are essentially not wide self-photos. The museum is visited by interesting Joseon rulers. Palace monarchy, protocols, customs and daily life for. Good souvenirs and their seals, portraits and relics that used to be the residence of the emperors. Royal cars, kilns, flags, and kitchen wear. a play in which this curious history is always enchanting."
"훌륭한 박물관 한국 국립 박물관은 경복궁의 대지 안에. 1992년 문을 열었습니다. 많은 전시물들은 늦은 14세기 주로 조선시대 3궁전 및 날짜. 궁전 경복궁, 창덕궁, 창경궁. 이 박물관은 가운, 보석, 왕들이 쓴 책과 시들을 같은 전시. 거의 50일 디스플레이 000 항목이 있습니다. 낮은 층에 있는 황제 부른다 왕실 차량 - 1918년 제너럴 모터스 캐딜락 리무진. 또한 측우기 강우량 측정 선반. 박물관 로얄 문화유산을 대한 학습 프로그램. 1층에 있습니다. 로얄 출산, 교육, 문화에 대해",Mazmannan,4,709,"Great Museum The Korean National Museum is located in the land of Gyeongbokgung Palace. It opened in 1992. Many exhibits are mainly three palaces and dates of the late 14th century during the Joseon Dynasty. Palace Gyeongbokgung Palace, Changdeokgung Palace, Changgyeonggung Palace. The museum has the same display of gowns, jewels, books and poems written by kings. There is an almost 50 day display 000 item. Emperor Call on the Lower Floor - 1918 General Motors Cadillac Limousine. In addition, the gauge rainfall measurement shelf. A learning program on museum royal cultural heritage. It's on the first floor. About Royal Births, Education, and Culture"
"방문할 가치가 있는 반복합니다 3년 전 이 박물관 방문. 나는 전시물들을 주위에 우리 걸어가서 우리의 많은 질문에 영어 구사 가이드 감명을 받았습니다. 일반 전시 외에도, 이 박물관은 가끔 특별한 전시회와 가끔 작은 요금 아니라 똑같이 종종 무료. 이 번은 미국에서 박물관 어떻게든 결국 그 로얄 씰 전시되어 있었다. 마지막 액트 오바마 대통령은 그들의 정당한 홈 이러한 역사 개체 문화와 반환. 갈등의 시대에 조국의 많은 훌륭한 문화적 역사적으로 중요한 개체는 성들이 약탈되고 제거되었습니다. 이러한 반환된, 미국에서 열린 않은",Patrick K,4,709,"Repeats worth visiting. Visiting this museum three years ago. I was impressed by our English-speaking guide for many of our questions as we walked around the exhibits. In addition to general exhibitions, the museum is sometimes free of special exhibitions and sometimes not small fees are equally often free. This time in the United States the museum somehow ended up displaying the royal seal. The Last Act President Obama has their Just Home This History Object Culture and Return. In an era of conflict, many of the great cultural and historical objects in our country have been looted and removed from the castles. These returned, not held in the United States."
"로얄 씰 멋진 컬렉션. 그리고 경복궁, 체크 아웃 후 박물관도 갔다. 디스플레이 로얄 씰, 로얄 자동차 커플 등 기타 다른 왕립 있었다. 나는 궁전 어쨌든 방문 이후 괜찮습니다.",AhmadDundee,3,709,"Royal Seal Nice Collection. And I went to Kyungbok palace, museum after checkout. There were other royal seals such as Display Royal Seal, Royal Automobile Couples and so on. I'm fine after visiting the palace anyway."
"좋은, 정말 특별하진 않지만 자동차 박물관 도 내 눈을 잡은 로얄 표시됩니다. 그렇지 않으면, 좀 더 다른 박물관. 무료 라, 할 수 있는 것입니다.",CirilB,4,709,"Good, it's not really special, but the car museum is also displayed as Royal, which caught my eye. Otherwise, a more different museum. It's free, so you can do it."
"큰, 종합, 무료 편리한 지하철 연결, 첫 번째 전에 중지 작성하세요 궁 보다 철저히 장소의. 이는 보다 많은 전시 를 보는 3층 보다 훨씬 큽니다 었다. 우리는 2층 은 넘어 시간을 내 아이가 지루해 하고 불안 팰리스 이동합니다. 무료 라, 반드시 그 - 궁전을 방문 할 경우, 또는 짧은 시간에 결정할 수 있습니다 팰리스.",HauGeng,5,709,"Large, comprehensive, free, convenient subway connection, write a stop before the first. more thoroughly situated in the palace It was much larger than the third floor, which saw more exhibitions. We spend more time on the second floor, so the child gets bored and moves to the anxious Palace. Free, must - visit the palace, or make a decision in a short time. Palace."
"좋은 함께 팰리스 입장료 도 무료이기 때문에 마음에 들지 않는다면, 파울 은 없는 곳이 없습니다. 일부 객체는 없지만 정말 멋진 박물관은, 하지만 또한 파악할 수명 및 수명 한국 엠파이어 팰리스 슬픈 수명이 짧습니다. 일반적인 설명은 영어, 영어 이름을 해당 항목에 대한 설명입니다.",D13O,4,709,"If you don't like it because the entrance fee to the Palace is free together, there's no place without a foul. There are no objects, but a really cool museum, but it also has a short lifespan and a short lifespan for Empire Palace in Korea. A general description is the description of the topic, English name."
정말 멋진 디스플레이 기억에 남는 다양한 종류의 유물이 박물관 포함. 레이아웃은 아주 단순하고 명확. 높은 곳은 자동차나 두 burgandy vinatage. 멋진 모습.,429Happy,5,709,A really nice display. Various kinds of relics that remain in memory include the museum. The layout is very simple and clear. High places are cars or two burgundy vintage. Nice look.
팰리스 폐쇄 하 … 여기에 가서 화요일에 도착한 후에 하는 궁전 (때 종료) :). 박물관 에 가기 로 했다(호텔에서 수 있는 무료). 우리는 영어의 시설은 가격대비 해 작은 헤드폰 입니다. 너무 많은 정보를 볼 수 있고. 다행이 우리가 가기 전에 체크인 한 다음 주 팰리스. 좋은 선물 가게 및 비디오 보기 영역. 방문할 가치가 있습니다. 몇 시간 동안 정말 원하는 수 가 대부분.,coopsar230,5,709,"Palace closed... Palace (time to end) after arriving here on Tuesday. Go to the museum (for free at the hotel). Our English facilities are small headphones for the price. I can see too much information. Fortunately, check-in before we go to Palace next week. Good gift shop and video viewing area. It's worth visiting. Most of the things I really want for hours."
"서울에 있는 최고의 박물관 중 하나! 이 박물관은 국립 중앙 박물관 보다 더 흥미로운 것. 또한 많은 한국 전에 대한 자세한 내용은 현대 도시 생활 법률. 레이아웃은 쉽고 잘 생각해. 흥미로운 정보가 많은 쪽이 전시에 오디오 가이드. 우수한 전시 도 많이 본 영상 들 (요일)부터 재구성은 법률 과 같은 의식, 어떻게 하지, 등이 있습니다. 한가지 흥미로운 정보를 다른 코트에 예배 되게 비디오 ancester 방법 및 기본 무덤 들이 로얄. 하나는 먼저 한국에서 아주 흥미로운 다른 객체 사이의 시간 시계, 15세기에 지어진 일, 즉",Lisa A,5,709,"One of the best museums in Seoul! The museum is more interesting than the National Museum of Korea. Also, for more information on many Korean exhibitions, modern city life laws. Think about the layout easily and well. The one with the most interesting information is the audio guide in the exhibition. From Monday, there is a sense of law-like consciousness, how to do it, and so on, the videos that I've seen a lot of excellent exhibitions. Video asster method and basic tombs to make one interesting piece of information worship on another coat. One is first a time clock between different objects of great interest in Korea, a work built in the 15th century."
무료 의해 팰리스 많은 외국인들이 많은 박물관 이 다른 하나였습니다. 하지만 영어를 많이 할 수 있는 모든 것을 전시할 수 있는 항목 이름에 대부분 한 영어. 그 후에 남는 한 가지 눈에 캐주얼 만 있다. 로그인 게시되지 않은 다음에 갈 곳도 있습니다. 나는 아무것도 찾을 수 없습니다 다른 박물관 에서 볼 수 있는 새 이 도착하지 않았다. 때에는 뭔가 다른 영어 설명이 없고,Paul_n_Cris,3,709,"Palace by free was another museum with many foreigners. But most of the time, one English is in the name of an item that can display everything that can speak English a lot. After that, there is only one eye left for casualness. There are places to go after the login is not posted. I can't find anything. The new one, which can be seen in other museums, has not arrived. There is no other English explanation at the time."
"놓쳐서는 안 될 5 궁전 박물관 방문 합니다 때, 방문 가치 있는데, 특히 화면을 볼 수 있는",Sinead W,5,709,"I'm visiting the Palace Museum of Five that I shouldn't miss. When, it's worth a visit, especially when you can see the screen."
고궁 박물관 꽤 큰 박물관. 바로 메인 사원. 입장료는 무료. 풍부한 역사 에 있어서. 좋은 기념품. 1층은 수리 중,Sam,5,709,Palace Museum. Quite a large museum. It's the main temple. Admission is free. in rich history a good souvenir The first floor is being repaired.
경복궁 옆에 위치하고 우리를 방문 하고 박물관이 경복궁 옆. 좋은 문화와 역사에 있는 열에서 휴식을 하고.,HaDa2000,4,709,"Situated next to Gyeongbokgung Palace, visited us, and the museum next to Gyeongbokgung Palace. Rest in the heat of good culture and history."
"서울에 있는 최고의 박물관! 저는 이 박물관은 경복궁에 갔을 때 우연히 - - 사실 게이트를 통해 궁전 박물관은 오른쪽에 - - 숨겨진. 무료로 들어갈 놀라운 전시. 물을 놓칠 수 없는 한국어로 된 시계, 있는 (이 두 층) 은 형용. 이곳은 황량한 토요일. 몇 시간을 보낼 수 있다. 진짜 보석 박물관 이 서울의 첫 번째 추천 할 수 있습니다. 저는 이 박물관에 한 경우 - - - 하는 것입니다. 꼭 가보세요!",chesterchandler,5,709,"The Best Museum in Seoul! When I went to Gyeongbokgung Palace, this museum happened to be -- in fact, through the gate -- on the right side of the palace -- hidden. an amazing display that will go in free of charge A clock in Korean that cannot be missed, with (two floors) is an adjective. This is a desolate Saturday. I can spend a few hours. The Real Jewelry Museum is Seoul's first recommendation. I'm doing -- -- I'm doing it in this museum. You must go!"
"위대한 정지 지 않으면 가이드, 또는 경우, 이 멋진 곳을 구경할 수 있는 시작.",lucycan,5,709,"A guide, or, in the case of a great stop, to see this wonderful place."
"국립 고궁 박물관 역사, 이 곳을 참조해야 합니다. 잘 보존하게. 무료 입장, 참고로. 근처에 팰리스 gyeobokgung. 국 Gyeobokgung.",Cye Rene,5,709,"The history of the National Palace Museum, you should refer to this place. Make sure it's preserved. Free entrance, for your information. Nearby Palace gyeobokgung. Guk Gyeobokgung."
"좋은 박물관 이 박물관의 질은 좋은 지하철을 이용하면 쉽습니다. 여러 전시, 충분히 가치가 있다. 박물관이 있어 자신과 다섯 살 된 전체 시간을 지낼 수 있었습니다.",Jake W,3,709,"Good Museum The quality of this museum is easy to use by good subway. Various exhibitions, well worth it. There was a museum so I could spend the whole time with myself when I was five years old."
"넓고 잘 정리된 박물관 국립 고궁 박물관 옆에 위치해 경복궁. 경복궁역 지하철을 통해 쉽게 갈 수 있는. 왕과 여왕 은 평생 에 걸쳐 3층 파악할 수 있습니다. 자동차의, 회화, 악기, 물개 등 유물 이 있는 주거지 입니다. 하지만 이후는 무료입니다. 경복궁 을 참고할 수 있는 화요일 닫힙니다. 합리적인 가격에 괜찮은 레스토랑 이지만 환상적인 음식을 제공합니다.",Mengyau,4,709,"A spacious and well-organized museum located next to the National Palace Museum, Gyeongbokgung Palace. easily accessible via the Gyeongbokgung Station subway The king and queen have a lifetime of three stories. It is a residential area with relics such as automobile, painting, instrument, seal, etc. But after that, it's free. Tuesday is closed for reference to Gyeongbokgung Palace. It is a good restaurant with reasonable price, but it provides fantastic food."
"친절한 안내와 일정 기간 동안 6대 한국 왕령 이는 이미 여러 해 동안 박물관, 현재는 과거의 거대한 개선. (사실, 모든 한국 국립 박물관에는 크게 향상 지난 십 - 이제 대부분의 무료 입장!) 철저하게 현대적인 모든 것이 아주 인상적인 프레젠테이션 및 멀티미디어 항목을 다시 역사적 nethrcutt. 모든 것이 위대한 보존 및 조명. 하지만 나는 20년 정도 한국에서 살았다. 나는 최근에 배운 한 박물관입니다. 할 수 있는 선물 가게 / 즐거운 전통적인 레스토랑은 1층에 있는 커피 샵 (수 있는 라면 에 메인 입구에 있는 지하로).",TomCoyner,4,709,"The Six Great Korean Kings for a certain period of time and kind guidance. It is already a museum for many years, now a great improvement in the past. (In fact, every Korean National Museum has made a great improvement in the past. - Now most free entry!) Presentation and multimedia items that are very impressive in everything that is thoroughly modern. All are great conservation and lighting. But I have lived in Korea for about 20 years. I am a museum that I learned recently. A gift shop / a pleasant traditional restaurant is a coffee shop on the first floor (to the basement at the main entrance to any ramen)."
"일주일 후에 중국 박물관, (더 나은) 이었고 다른 쉽게, 지하철을 타고 있다. 깨끗하고 조명이, 영어를 매우 잘 설명이 다, 친절한 직원들. 많은 아이들이 할 수 있. 이 오래된 좋은 곳입니다, 젊은, 날짜, 사람. 무료 입장. 비싼 선물 가게. 장엄한 에어컨. 시작할 B1 위로 올라갑니다.",Brad R,5,709,"A week later, it was a Chinese museum, (better) and other easily, taking the subway. Clean, lighting, English very well-explained, friendly staff. Many kids can do it. This old nice place, young, date, person. Free entrance. Expensive gift shop. a magnificent air conditioner Climb above B1 to start."
"훌륭한 박물관! 이 간결한 박물관 아리마를 궁전 바로 옆 서울의 고궁, 영어로 번역된 것은 아니고. 제 남편과 저는 여전히 많은 것을 배우 의 박물관입니다. 이 시간에 더 흥미롭게 팰리스!",QuickWhitTravel,4,709,"Great museum! This simple museum, Arima, is not translated into English, an ancient palace in Seoul right next to the palace. My husband and I are still museums of actors and actresses. More interestingly at this time, Palace!"
단순히 화려한 곳! 박물관은 무료 입장에서는 아무것도 비용 저는 작품의 큰 디스플레이 및 국립 고궁 박물관이 있는 역사! 가능하다면 기록 및 자세한 정보 한국 입니다!,Prinster A,3,709,"Just a fancy place! The museum costs nothing for free. History with a big display of works and the National Palace Museum! Records and detailed information, if possible, is Korea!"
"좋은 컬렉션, 잘 표시 많은 사람들이, 우리가 간 후에는 팰리스 단지. 이곳은 입구 바로 옆에 있는 같은 티켓. 흥미로운 아무것도 변경 또는 세계관에, 하지만 할 수 있는 좋은 작품을 하게. 채광이 좋은 넓은 갤러리와 와가. 대부분의 전시 에는 로얄 협회, 특히 존경 과 매혹적인 컬렉션의 객체와 관련된 로얄 선조 들. 우리는 또한 함께 협면 실행할 수 있는 상태에서 채널선국모드와 의 촬영과 목금, 악기 의 섹션을 참조하십시오. 다양한 레스토랑 및 선물 가게 같은 따뜻한 환영, 현대적인 건물. 함께 사용하면",Stephenbkk20156,4,709,"Good collections, well marked people, the Palace Complex after we go. This is the same ticket right next to the entrance. Change anything interesting or view the world, but do a good piece of work that you can do. A wide gallery and a wagga with good lighting. In most exhibitions, royal ancestors, especially those related to objects in a respectful and captivating collection. We also refer to the sections of Channel SUNGKOOK MODE and 's Filming, Wood, and Instruments in a state where we can perform a narrow plane together. A warm welcome, modern building, such as a variety of restaurants and gift shops. when used together"
"컨텍스트는 뒤에 경복궁 을 방문 국립 고궁 박물관 (무료 입장) 은 두 개의 박물관 부지 경복궁 에 있습니다. 영업 시간은 평일 9 - 6pm, 주말 9 - 7pm, 월요일. 이전에 현대적인 건물은 사우스웨스트 경복궁, 박물관에 방문하는 영업 기회에 대해 배우 jesong 다이너스티, 5 세기는 규칙입니다. 또한 컨텍스트에 대한 컬렉션이 있기 전 또는 후에 궁전의 정원을 봅니다. 하는 역사적인 유물 에 40,000 엔 국립 고궁 박물관, 작은 국보 수 있는 것으로 간주됩니다. 3층에는 11개의 박물관이 있는 역사적인",BradJill,4,709,"The National Palace Museum (free admission) is located at Gyeongbok Palace, the site of two museums. Business hours are 9 to 6pm on weekdays, 9 to 7pm on weekends, Monday. In the past, modern buildings are the rules of the 5th century, actor jesong Dynasty, about business opportunities to visit the Southwest Gyeongbok Palace and museums. You also view the palace gardens before or after a collection of contexts. The museum is considered to be a small national treasure for 40,000 yen in historical relics. On the third floor, there are 11 museums in history."
"지하철로 쉽게 갈 박물관은 매우 잘 설계 및 입구, 서울에 가장 문화적인 장소, 무료입니다. 박물관은 매우 큰 궁전 경복궁. 월요일 을 방지하고, 그 다음이 편집됨,. 멋진 디스플레이가 다양한 갤러리 투어는, 그림과 화면에서 의상 및 종교 의식 의 가운 에서 가구를 채용. 저는 특히 즐겼다 정조의 의 경우 8 접이식 스크린의 조상 의 묘 에 있는 왕의 행진 화성.",FandD2014,4,709,"The museum, which will be easily accessible by subway, is very well designed and entered, the most cultural place in Seoul, free of charge. The museum is a very large palace, Gyeongbok Palace. Prevent Monday, followed by edited, The gallery tour, which has a wide range of displays, features furniture from costumes and religious gowns on pictures and screens. I especially enjoyed it. In the case of King Jeongjo's, the king's march on the tomb of his ancestor with an eight-fold screen."
"훌륭한 박물관 제 남편과 저는 이 박물관에 방문한 화요일. 궁전과 민속 박물관 (모두 국립 고궁 박물관 옆) 화요일에 문을 닫고, 이 사람들이 하루에 몇 가지 않았기 때문에 저희가 박물관을 방문하는 게 좋습니다. 도 없는 박물관에서 책 보다 더 시끄럽고 붐볐어요. 전시 는 완전히 즐겼다, 하지만 2 닫혀 보수 공사 중. 우리는 오디오 가이드를 빌려서 나에게 흥미로운 정보 1000개 설정할 수 있습니다. 또한 각 층 화장실 물 냉각기.",JulieLimSY,4,709,"Great Museum My husband and I visited this museum on Tuesday. The palace and the Folk Museum (all next to the National Palace Museum) are closed on Tuesday, and we recommend that you visit the museum because these people are few in a day. The museum was more noisy and crowded than the books. I fully enjoyed the exhibition, but it was closed and under repair. We can rent an audio guide and set up 1000 interesting pieces of information for me. Also a water cooler for each floor of the toilet."
"과거로 흥미로운 경험 박물관은 무료 입장. 매우 깨끗하고, 고급스러운 재미있고 흥미로웠다. 가이드 투어를 할 수 있는 영어로, 한국어, 일본어 및 중국어.",Megan V,4,709,"Experience Museum, which is interesting in the past, is free of charge. Very clean, luxurious fun and interesting. English, Korean, Japanese and Chinese for guide tours."
좋은 장소와 관련된 기록 투어는 탐색 약 2 - 3시간 가공제. 이 박물관을 방문하시길 추천합니다 경우 경복궁.,Jane H,4,709,The record tour associated with a good place is an exploratory about 2 - 3 hour processing agent. I recommend you visit this museum. Gyeongbokgung Palace in the case.
"시간 부족 이 박물관을 1시간 동안 잠시, 기다리는 동안 청와대 투어. 시간이 부족하며 다시... 입장료는 무료이고 바로 옆이므로 경복궁. 또한 첫 번째 포인트에서 광화문 역 출구 의 명소.",WanXin A,3,709,"Time is running out. Cheong Wa Dae tour while waiting for this museum for an hour. We're running out of time and... Admission is free and right next to it, so Gyeongbokgung Palace. Also, at the first point, the attraction at the exit of Gwanghwamun Station."
"훌륭한 무료 사랑 박물관 및 벌써 큰 사람과 작은 사람은 아시아에서 유럽의 일부 (라오스 는 좋은 예). 이 곳보다 500년 역사의 유물 로부터 평균 에는 조선 왕릉, 약 1500. 그곳에서 900 유물 및 개체 표시, 대부분 영문 라벨, 3층에. 잘 조직되어 눈부시게 표시됩니다. 많은 시간과 자금이 시작하는데 이미 배치할 수 있도록 많은 항목을 빛을 보고 확실히 여러 각도. 가이드 투어는 한국어, 영어 (11am, 14:30), 일본어, 중국어. 최소 크기가 없는 그룹에 두 명 있었는데 정말 좋은 가이드",Patrick K,5,709,"A great free love museum and part of Europe, already big and small, in Asia (Laos is a good example). From the 500 years of historical relics here, the average is the Royal Tomb of Joseon, about 1,500. There, 900 relics and objects are marked, mostly in English, on the third floor. It's well organized and dazzling. The light of many items so that a lot of time and money can already be placed at the beginning, and the angles are clearly different. Guide tours include Korean, English (11am, 14:30), Japanese, and Chinese. There were two people in a group that didn't have a minimum size, and they were"
"모두 함께 박물관은 정말 흔한 학습에 관심이 있다면 한국의 왕조 의 왕궁 정보 및 모든 해당 한국. 알 수 있었는데, 그 대부분의 고려 박물관은 모든 정보를 캐소드부 한국. 하지만. 에 박물관 노트북에서나 외국인 언어에는 약간의 영어 번역. 그럼에도 불구하고 저는 박물관 및 관리되는 종료하려면 한 깊은 이해의 도시의 역사.",Ser_Maximus,4,709,"Together, if the museum is really interested in common learning, the royal palace information of the Korean dynasty and all applicable Korea. I could tell, most of the Koryo museums have all the information in Casodboo Korea. However, some English translations for foreign languages, whether on a museum laptop or on a foreign language. Nevertheless, I have a history of a city of deep understanding to end the museum and its management."
