u_id,review,u_rate,p_id,review_en
Sungeun J,"덕수궁 길 옆에 있습니다. 외관에서부터 상당히 오래된 건물이라는 느낌을 받았고, 박물관 전시 역시 근대 역사의 흐름을 잘 느낄 수 있도록 구성해두었습니다. 외국인 분들이 덕수궁을 거쳐 이 곳에 방문하시기 좋은 코스인 것 같아요.",4,809,"It's next to Deoksugung Palace Road. From the outside, I felt that it was a fairly old building, and the museum exhibition was also organized to make me feel the flow of modern history. I think it's a good course for foreigners to visit here via Deoksugung Palace."
teamwhite,시청역 인근에 있는 한국 최초의 근대식 중등 교육기관의 현장... 박물관 안에 전시되어 있는 나무로 된 책걸상을 사용해 본 1960년대생들에게는 시간 여행의 장소가 될 듯...,4,809,"The site of Korea's first modern secondary education institution near City Hall Station... For those of you in the 1960s who have used wooden desks and chairs on display in the museum, it would be a place of time travel."
Sei-Hyun B,"배재학교에서 고입체력장, 연합고사, 그리고 학력고사도 배재에서 봤습니다. 외조부가 배재학당을 다니신 인연도 있었는데 요즘은 제 아이의 영국문화원 수강 때문에 매주 두번은 저녁에 데리러 갑니다. 밤에 보는 배재학당박물관의 외관은 정말 멋진 야경을 제공합니다. 정동에 딱 어울리는 건물이지요. 낮에 꼭 시간내어 입장해보려 합니다.",4,809,"I also saw the high school entrance exam, the combined test, and the scholastic aptitude test at Baejae School. My grandfather used to go to Baejae Academy, but now I pick him up twice a week in the evening because of my child's English Cultural Center. The exterior of Baejae Hakdang Museum at night provides a really nice night view. It's a perfect building for Jeong-dong. I'm going to take the time to enter during the day."
vlogg,"1885년 8월 3일, 미국의 감리교 선교사인 헨리 아펜젤러가 서울에 세운 한국 최초의 근대식 중등교육기관이며, 배재중학교, 배재고등학교, 배재대학교의 전신이에요. 배재학당 동관. 백년의 기억 이라는 전시가 2017년 10월말까지 진행중입니다. 굉장히 역사적으로 의미깊은 장소이며 외관이 레트로풍이라서 사진찍기에도 좋습니다.",5,809,"On August 3, 1885, Henry Appenzeller, an American Methodist missionary, founded Korea's first modern secondary education institution in Seoul, and is the predecessor of Baejae Middle School, Baejae High School, and Baejae University. the Pai Chai School Building The exhibition ""Memories of 100 Years"" is in progress until the end of October 2017. It's a very historically meaningful place and has a retro look, so it's good for taking pictures."
alaco3,"구한말 학생들의 모습과 학교 분위기를 알 수 있습니다. 오래 걸리지 않고, 즐겁게 볼 수 있습니다. 가까이에 시립 미술관도 있구요.",4,809,"You can see the students at the end of the Korean War and the atmosphere of the school. It doesn't take long, and you can enjoy it. There's also a city art museum nearby."
CanisHan,"C (19.05.08) 이 박물관은 한국 최초의 현대 중등 학교 인 Paichai Hakdang에 전시되었습니다. 그래서 나는 파이 차이 학당과 한국 교육사를 볼 수있었습니다. 건물은 낡았 고 골동품 분위기가 있었고, 전시는 잘 관리되었습니다. 이런 박물관을 더 만들고 싶습니다. 무료로.",4,809,"C (19.05.08) The museum was displayed at Paichai Hakdang, Korea's first modern secondary school. So I could see the Pi Chai School and the history of Korean education. The building was old and antique, and the exhibition was well managed. I want to make more museums like this. free of charge"
Mesy,이곳은 한국 최초의 서양 교육이었던 파이 차이이 연구소에 있습니다. 창립자 인 아펜 첼러 (Appenzeller)와 노블 (Noble)의 두 가족의 역사를 포함하여 여기에 표시된 사진과 물체를 통해 서양 교육의 역사를 배울 수 있습니다.,4,809,"This is the first Western education in Korea, the Pi Chai Institute. You can learn the history of Western education through photos and objects shown here, including the history of two families, the founders, Appenzeller and Noble."
