,u_id,title,review,u_rate,place_name,res_title,p_id
225,Surzen,"놀라운 불교 사원, 방문할 가치가 있는!","서울에 있을 때 즐길 수 있는 조계사, 가장 오래된 도시에 있는 가볼만한 가치가 있... 단 영어를 하는 직원이 많지 않은 것, 그러나 놀아 주어서 직접 걸침기구, 그리고 가장 방문한 모든 같은 큰 부처 상을 방문하기에 3 메인 홀. 점심 시간에 방문하기 좋은 곳이 길 건너에 있는 템플 가 점심 특화정보에, 2nd 층에 좋은 뷔페 레스토랑 제공 만 찾을 수 있는 채식주의 & 쳇발 음식 - 이곳은 정말 좋은, 가격이 KRW8, 000 부페 모두 경백 - 아름다운, 채식주의 음식도 잘 요리하기",4,조계사,조계사,106
226,swisstraveller,매우 바쁜 훌륭한 사원,"제가 한국에서 첫 날 아침. 조계사 에 갔다. 제가 할 수 있는 방법은 불교 사원을 방문하는 태국, 라오스 나 캄보디아. 나는 어, 나의 신발을 신고 들어가기 를. 것을 많은 사람들이 있어서 그 안에 있는 사원, 꿇. 저는 전에 보면. 감히 들어가지 않는 것이. 하지만 저는 이미 내부. 나는 매트에 앉아 자신의 의, 약 한 시간 반을 보낸 신전 내부, 정말 좋았어요. 약 150 (이전의 여성) 이 있는 사람들, 저는 한 유일한 외국인, 환영받지 못하는 느낌 이었지만 나는 하지 않았다. 이",5,조계사,조계사,106
227,Sagar A,좋은 곳,"지정된 시간 동안 한 방문을 관광객들에게 특히 꽃잎 몇 가집니다 작업을 lotus, 좋은 조화된 곳",4,조계사,조계사,106
228,Lee K,이 곳을 방문하는,"평화로운 장소는 좋은, 아름다운 과 금 불상 사원에서 볼 수 있다. 인상적인 것을 보고 내가 타는 기도 에 매달려 살려 놓은 방대한 양.",4,조계사,조계사,106
229,tonyadamron,아름다운,보지 않고 다닐 수 없다고 생각할 수 있는 지역의 역사. 이 사원은 아름다운 없는 것이지만 모든 절 보고하고 울었다 다른 문화를,5,조계사,조계사,106
230,edisupp s,조계사,아주 평화로운 안국 역에서 인사동 거리에서 몇 블록 떨어진 사원. 경우가 아주 아름다운 축제 중입니다. 사진 촬영 하기에 종교적인 장소이기 때문에 이해할 수 있는 풍경 이지만 사람들의 서비스를 염두에 경우가 많은 것이 estrapade 주 중에 이 보다 덜 붐비는 평화로운 시간.,4,조계사,조계사,106
231,Joey M,평화로운,"나는 우연히 서울에 첫 날 종교적. 센터 마크 호텔에서 걸어서 했는데. 거대한 불상 이다. 저는 항상 사진을 찍지 게 수줍어 종교적인 장소, 불쾌 하지 않을 수 있기 때문에 마음 이었지만 아무도 보이지 않았다. 갈 때는 작은 것을 기부 받아 걷는 거리.",5,조계사,조계사,106
232,BonjourMelissa,정말 아름다운,제가 지금껏 경험한 중에서 가장 아름다운 곳. 정말 멋진 풍경과 아름다운. 작업을 수행할 수도 있습니다 (하기로) 할 수 있는 차를 받을 수 있는 독특한 경험.,5,조계사,조계사,106
233,jaseminsibo,고요한 조계사,아침에 한 곳이어서 아키텍처 및 색상을 사용할 수 있습니다. 저는 작은 조각을 기념 해 아시아의 다양성을 비디오로. 할 정도로.,4,조계사,조계사,106
234,flipinny,영적인,빠른 정지 나의 호스트에 데리고 갔다. 그녀는 그녀의 말은 불교 이다. 에 앉아 있는 느낌을 얻을 수 있어서 약간의 사례. 매우 좋았습니다. 정말 아름다운 절 이다.,4,조계사,조계사,106
235,Jane M,사원을 방문할,아름다운 절에 들를 수 있는 서울 시티 투어. 많은 자연 경관이 아름다운 꽃! 가장 중요한 불상 사원 중 가장 한국인 신사 입니다. 쉽게 정지 했다.,3,조계사,조계사,106
236,gladsb,그래서 영적인,호텔은 내가 한국에 갈 때마다. 이곳은 평화를 느꼈다. 저는 불교 신자 이지만 나는 이 생각을 여기에 가서 내 영혼 영적 및 각.,5,조계사,조계사,106
237,Hessa H,아주 좋은 위치,사원은 아주 좋은 위치에 좋은 살리지 지가부착된. 많은 사람들은 작은 사원. 이 지역은 걸어 다니며 보기,4,조계사,조계사,106
238,hum823,위치 좋은 사원,저는 정말 좋은 곳 이었기 때문에 위치가 좋아 서울의 불상이 인상적이었어요. 지금 30 분에서 한 시간을 보낼 수도 있고 구경 하기에 앞서 다음 사이트를 사진 촬영.,5,조계사,조계사,106
239,SouthwoodTruck,"전통, 아키텍처","저는 다행이 쳇발. 뭔가를 할 수 있는 마법 입니다. 건축은 아름다운. 많은 사람들이 기도 에 함께 하는 서비스, 하지만 가까이 쳇발 을 즐길 수 있습니다. 자동차 앞에 주차를 할 수 있고, 일부의 오두막이 있다. 정리할 수 있는 경우, 그러나 안 중에 방문하지 못하게 하다.",4,조계사,조계사,106
240,Dennis R,좋은 사원 의 한 가운데에 있어요.,"경우에는 축제 기간 동안 또는 이벤트 (부처님의 생일 등, 이 곳은 화려한 장식은 커버. 전반적으로 좋은, 평화로운 피난처 에 있다. 깨끗하고 잘 관리된, 확인할 만 체크 아웃할 수 있습니다. 하지만 할 기회가 있는 축제나 행사 중, 최대 4 등급이 갈 것이다.",3,조계사,조계사,106
241,EnjoyTravel99,사원을 방문할 때의 생일 부처님! 살리지,"우리는 운 좋게도 방문 사원의 불상 중 생일 축하 파티라 했습니다. 가수들의 라이브 음악과 함께 수천 종이를 살리지 었다. 어서. 우리는 오래 머물 사람도 적지 않기 때문에, 우리는 이곳에 있는 짧은 방문이었지만 다행이다.",4,조계사,조계사,106
242,TheMediaCompany A,그냥 좋은,이러한 작품 전체 배치할 수 있습니다. 쓰는 것도 있을 것입니다 30000won 카운티까지 쳇발. 또한 사용할 수 있기도 하다.,4,조계사,조계사,106
243,HONkiev,"가운데에, 방문할 가치가 있는","매우 매력적인 다양한 방안이 쳇발. 우리 가기도 할 때, 많은, 많은 사람들에게 많은 색상. 이 때는 어쨌든 도시는 좋은 곳입니다.",5,조계사,조계사,106
244,Josh B,꽤 실망...,"나는 매우 놀라는 빛나는 리뷰 이 명소에 대한 자세한 내용은 을 참조하십시오. 나는 여기에 마지막 날 서울, 작은 사원은 놀랬다. 템플 게이트 단지 구성되며, 실제 드럼 타워 건물 하나 있는 작은 사원. 건물 자체는 보이지 않는 진정한, 실제의 미닫이 유리문이 있고 현대적인 사원! 때에는 많은 공사가 진행 중이어서 더 적은 매력적일 수 있었습니다. 동상 의 불상 이 인상적인, 매우 좁은 공간 안에 이 절은, 그래서 5분 이상 유지되지 않았다. 모든 것을 다. 저는 매우 인상적이었어요. 제가",3,조계사,조계사,106
245,Jan P,경험!,"사원을 방문하는 확실치 않을때 경우, 정보 사무실에서 내리지 작성하시면 바로 왼쪽에 위치한 입구를 입력합니다. 어른이 이해할 수 있는 신사가 필요한 입력 시 쳇발 (누울 기부 해). 우리는 했지만, 여전히 꼭 맞는 것처럼 느껴지고. 여전히 큰 세 개의 부처 상을 낼 가치가 있는 최대 쳇발. 랜턴 페스티벌이 진행할 수 있기 때문에 사진을 찍는 동안의 다채로운 용지의 살리고 있고.",4,조계사,조계사,106
246,drfbehnia,사원 내부 입력 수 없습니다.,의 일부를 볼 수 있는 외부 쳇발. 없다는 로 쳇발 의 모든 부분이 꼭 후크판의. 다른 사원 들에 비해. 나는 그를 추천하지 않습니다.,3,조계사,조계사,106
247,Chris D,서울 중심의 조용한 절,이 사원은 그냥 jongak 역에서 북서쪽으로. 그것은 가볼만 는 지역.,4,조계사,조계사,106
248,Bruge88,정말 좋았어요!,"아름다운, 특별한 가운데 현대 바쁜 도시. 아주 가까운 인사동. 미소녀 iand impresive. 한 방문.",5,조계사,조계사,106
249,MsB_BRKLY,가장 오래된 사원의 서울 중심의,"싶지는 않더라도 불교 로, 이 곳은 시내에 있는 가볼만한 가치가 있습니다. 이 거대한 부처님 이 규칙 내부에 본관, 학습 및 인력 그 앞에 기도, 예쁜 정원, 그리고 건축... 나는 모든 목록.",4,조계사,조계사,106
250,2hotred,고급형.,"아주 깔끔한 곳이다. 나는 나무 작업 및 복잡한 세부 사항. 하지만, 무더위 에 서비스에 있어서 고화방법에 우리 가까이에 조용했다. 전체. 저는 추천합니다.",4,조계사,조계사,106
251,Hugo R,흥미로운,이외 불교. 나는 용이 궁금한 불교 사원. 이 경우는 다시: 이 사원은 조화와 나무 그리고 옆에 정사각형이. 그냥달라고 영어는 더욱 많은 정보 을 역사.,4,조계사,조계사,106
252,TheShis,괜찮은 쳇발.,"이 아름다운 절, 깔끔하게 로도 인사동. 사원 자체는 그렇게 크지 않지만, 구조 및 그 주변이 오히려 매력적인. 항상 부하 사원 안의 사람들, 주로 관광객 처럼 보인다. 이렇게 조용히 사원 안에 시도, 시도와 예배 하러 주민, 거의 안내를 자장, 가 아 지고 - 정중.",3,조계사,조계사,106
253,Manolito M,불교 사원,"는 성스러운 불사. 하지만 관광이 가능합니다, - 때문에 침묵 원방을 많은 사람이 기도. 영어로 가이드 비용 없이 걸침기구 대해 설명합니다. 카메라는 사진을 찍지 지원하지만 밖에서 안쪽 허용되지 않습니다.",4,조계사,조계사,106
254,FlyingMommy2013,정말 아름다웠어요!,마음을 사로잡는 노래. 아름다운 꽃 은 국화 축제! 보고 사랑 조용한 분위기는 바쁜 도시!,5,조계사,조계사,106
255,ces168,보통 사원,"만약 틈, 이 사원 수 있습니다. 이 기능을 제외하고 로페닐 쳇발 없이 다른 부처 상 세. 이 종로구 도시에, 서울, 즉 왜 여정 추가할 수 있습니다. 하지만, 이미 포함되어 있는 경우 봉은사 여정, 여기 갈 필요가 없다.",4,조계사,조계사,106
256,ProfDredge,"좋아한다면 사원, 이동","서울에 있는 사원 중 가장 중요한, 주위에 특히 좋은 여행과 평화로움과 번잡함",4,조계사,조계사,106
257,Nicolaus,매우 감동,"아니라면 매우 익숙한 불교, 당신은 반드시 방문 조계사. 아주 흥미롭고 감동. 안타깝게도 이 곳에 대한 정보 많지 않고 한국 불교 영어, 아서 스스로 조사 전에 이 오.",4,조계사,조계사,106
258,Jess,작은,"본 적이 없는 한국 불교 사원, 이것은 가볼만한 가치가 있습니다. 그러나, 작은 정원이 있고 그들은 방법으로 복용 한 무리의 랜턴. 이거 확인하고 싶다면 인사동에서 걸어 온, 하지만 안 되는 곳으로 중앙.",3,조계사,조계사,106
259,Chaddex,잠깐 들리 ㄴ 장소,이 사원 은 창덕궁 과 걷 어서 잠깐 들리 이상적 이 ㅂ니다. 누군가 가 그곳 에 있 는 동안 은 chanting 세션 으로 불교 분위기 네요. 그것 은 오히려 바쁘 ㄴ 우리 지만 꽤 흥미 롭 은 장소 방문 이 아름답 은 분위기 와 불상.,4,조계사,조계사,106
260,TravelsofCorina,위대한 중지하여!,사원은 잘 관리되어 있었고 꽤! 좋은 곳에서 바쁜 도시 서울. 좋은 위치의 관광지로 그렇다면 꼭 가봐야.,4,조계사,조계사,106
