,u_id,title,review,u_rate,place_name,res_title,p_id
151,SMLove226,화려한 도시의 한 중간에 증설 및,"하고 숨을 곳 입니다! 최근에 방문한 동안 여러 역사적인 사이트에서 투어 가이드입니다. 정말 기억에 남는 것들이 답변하기. 이 절은 놀라울 정도로 복잡하게 꾸며져 있는 황금 불상 및 inside 진찌로 정말 놀랍습니다. Lotus notes 에는 예쁜 꽃 정원, 분수 들, 키가 큰 도는 파고다, 사원 및 다른 흥미로운 기능이 있습니다. 제 남편과 저는 여러 형태의 종이를 살려야 할 문자열을 다채로운 신경질적 아리마를 나무 위에 쳇발. 놀라운 곳이다!",5,조계사,조계사,106
152,Carter G,복잡한 서울에서 조용한 위치,사진을 찍지 하거나 그늘에서 휴식을 취하기 좋은 장소다. 이 가치가 있는 만큼을 사용할 수 있다.,4,조계사,조계사,106
153,Stephen Smith,"멋진 광경, 3 골드 buddahs","이 사원은 쇼핑 지역과 가까이 쉽게 찾을 수 있습니다. 잘못 하지 않는 주변이 모두를 살리지 쳇발. 일부 사원들과는 달리, 사진을 찍을 수 buddahs. 할 수 있다.",5,조계사,조계사,106
154,Osku77,아름다운 곳에,"작은 정원과 주위 나무들이 있는 곳에 있는 절이 있습니다. 또한 쉽게 들키지 낮, 밤에 있는 이 우아한 풍경과 화려한 조명을 살린 종이. 평화로운 오후에 방문 했을 때가 8시 하지 않다.",5,조계사,조계사,106
155,Judi43,있습니다,너무 많은 사원 이지만 또한 많은 작은 것들은 큰 부처님 은 여름에 산책하기,4,조계사,조계사,106
156,Mactaters,하 고요.,이 절은 한 평범한 사람들이 계속 와서 일하는 사원 및 일어났다. 에 큰 드럼 이 특정 시간에 이용할 수 있는 곳을 찾은 방법. 할 수 있는 특별한 사원에서 하얀 소나무 그늘 좌석이 있고. 그들에게 사진을 않 사원 내부. 무료로 방문하기.,5,조계사,조계사,106
157,Parul M,아름다운 불상 사원,"시내 중심에 위치해 있는 사원, 은 쉽게. 화이트 파인 이 희귀 한 나무 앞에 있는 사원, 한국의 국보 있는 것으로 간주됩니다.",5,조계사,조계사,106
158,BlueJewel703,"좋은 사원, 좋은 선물 가게","사원 자체는 아주 좋았습니다. 매우 덥고 습한 밖에 너무 많은 시간을 보낼 수 가 있는. 냉각 선물 가게, 수많은 아름다운 팔찌를 차고 있었다. 나는 내가 본, 사랑 이 더 구입할 것이지만, 저는 더 저렴한 경우.",4,조계사,조계사,106
159,JaqG,살리기,"5월에 갈 수 있는 랜턴 페스티벌 기간 또는 근처. 사원을 밝힐 것이며 전 세계 수만 여 곳의 살릴 볼만한 가치입니다. 나의 부모님과 좋아하는 것들 중 하나는 서울 였던 것 같다. 또한 instadon 근처에 위치하며, 쇼핑할 곳 추천 해주기 때문에 오후, 저녁 식사 후 저녁에 어두워진 사원 이다.",5,조계사,조계사,106
160,bob2bkk,서울에 있는 당신의 영혼 을.,"이 사원을 방문, 서울에서 가장 오래된 불교 사원 이다. 이번 여행은, 행사 진행에 많지 않은 것처럼 이전 방문 시, 걸어 다니는 느낌이 좋은 곳이 있지만, 사람들을 보고 꿇, 조명의 촛불, 편안한 분위기를 진정한 영혼 이 있고. 제가 후기를 찾기 위해, 위치 및 추가 정보. 거리는 여러 단계를 인입구 주, 하지만 전에 골목길을, 측면 및 입력, 또는 박물관 측, 휠체어 접근할 수 있는 지휘자 훌래터. 인사동 길 근처에 있습니다.",5,조계사,조계사,106
161,Amy B,도시의 중심부에 아름다운 광경,"불교 를 하면서, 정말 멋진 경험을 했지만 시간이 좀 쳇발 입니다. 접근하기 쉬운 번화한 지역에 위치한 관광지 이지만 이런 곳에 아주 조용했습니다. 잠시 걷다가, 사람들을 즐길 수 있는 조용한 관찰. 정말 이해를 더해 사람들, 다른 문화를 경험하면서 도시 해외 여행. 컬러를 살릴 수 있는 것만 달의 생일을 축하 하는 도중 아주 좋았지만 여전히 할 정도로 연중 내내 쳇발. 인사동과 매우 가까워서 쇼핑이 gyeongbukgong 궁전이 바로 가기는 를 위해 방문!",5,조계사,조계사,106
162,88sh8,아름다운 사원,"방문자 센터에 있는 남자에게 영어는 투어. 저희는 투어를 하지 않았다, 그는 역사에 대한 우리한테 절과 도 정말 친절했어요.",5,조계사,조계사,106
163,lavender86,예기치 않은,"아름다운! 그냥 산책을 하는 인사동에 있는 이 사원을 발견. 우리는 많은 것을 기대하지 않았다, 하지만 이 곳은 그냥 우리 눌라움은. 화려하고 평화로운 곳. 앉아서 휴식을 취하기 좋은 곳",4,조계사,조계사,106
164,Juan Carlos C,위대한 영적인 장소,이 사원은 아름답다. 사람들이 원하는 영적인 접촉 참조해야 합니다. 서머셋 팰리스 호텔 랜드마크 옆에 있는 인사동.,5,조계사,조계사,106
165,Octcholate,아주 평화로운,"큰 사원이 아닌, 도시에 위치한 평화로움을 느낄 수 있지만. 영어를 할 수 있는 정보를 제공하는 안내 데스크. 그들은 매우 도움이 되었다. 무료로 준 차. 좋은 생각 입니다 콘택마스크와 을 부처님 세징후. 사진을 찍을 수 없이 훌래쉬. 할 수 있는 앉아 있는 사람을 조정하기 위해. 직원들은 걸어서 3 라운드 라 스투파 주변에 있는 현지의 열 저장되어 유물, 다음을 선택합니다. 그들은 당신의 소원 이라고 생각합니다. 배가 고픈 경우, 채식주의 음식을 공양 하길 건너에 있는 직원들이 각 수준에 대해",5,조계사,조계사,106
166,Barbra B,아름다운 나무를 살리지 는,그래서. 나는 한 시간을 보내는 동안 이 우연히 쳇발 에 저녁 먹을 곳을 찾고 있는 분실. 하지만. 제가 말하는 가장 아름다운 이미지가 내 카메라 슬프게도 캡처할 수 없습니다. 그들은 모든 면에서 거대한 나무를 살리지 는 이러한 여러 색상의 단지 과거 정문. 저는 이 사진을 보고 있는 것을 보며 갭처 에 도취 했지만 소용 없어!,4,조계사,조계사,106
167,Mark J,서울 시내의 아름다운 절,아름다운 건축물과 정원. 그곳에 있는 동안 로터스 꽃 만개 했고 특히 즐겼다.,3,조계사,조계사,106
168,Lynn11361,그냥 시작한 투어,"아시아를 통틀어 로서, 너무 많은 사원을 방문하여 보고. 이는 꽤 작은 비교적 를재생. 그러나. 제가 본 여자 중 한 번에 여러 불교 사원이 지! 서비스 기간 동안 함께 있어서 넘침현상. 그는 꽤 흥미로운. 그보다, 이 작은 오히려 비 없는 사원, 불교 사원으로 이동.",3,조계사,조계사,106
169,Taipei_Rider,좋은 식물 쳇발,나는 사원 자체가 영화 승무원 에 대해서 할 수 있기 때문에 사원에서 이벤트 열밀봉. 이벤트가 진행 중이었다. 산책하고 사진이나 사원에서 놀라운 식물 쳇발. 해당 가볼만한 가치가 있었습니다. 나는 일이 있을 것 입니다 쳇발. 이 절은 경복궁과 인사동에서 도보 거리.,4,조계사,조계사,106
170,Brooke D,서울에 있는 사원들을 방문하는,"제가 처음 한 것은 말할 것도 없을 때는 방문할 때는 반드시 이 사원이 현재 한국인들의 예배 의 장소. 뿐만 아니라 다른 관광하기 를. 우리가 여행하는 동안에 발생할 수 있었고 특별한 서비스를 제공하지만 노력해서. 나는 인상을 한 대는 '오래된 작은 여성들이 예배 를 보러 오' 할 수 있지 않은 겉 봐요 봐요. 그럼에도 불구하고, 경내 에 있는 지역은 절과 가이드와 함께 설명을 추천하고 싶은 모든 정거자 '기도' 성과 및 해당 의미를 나타냅니다. 가장 좋은 방법 중 하나일 수 있는 상상 그",4,조계사,조계사,106
171,YJ_Tay,아름다운 사원,"쉽게 갈 수 있는 가까운 인사동 음식 거리 이 cheongyechon. 다양한 색상 위에 매달려 있는 곳에는 살리지 을 놀랄만큼 연결아암 의 사진이 잘 나오는 단어 다. 2: ""은""&""평화로운"".",4,조계사,조계사,106
172,Patricia L,평화로운 경험,인터컨티넨털 호텔이 있는 이 사원은 바로 길 건너편에 위치. 이 아름다운 사원과 영적인 예배 를 경험이 아주 많은 지역이 사람들. 제가 가서 다행이다.,5,조계사,조계사,106
173,youke_worldwide,멋진 밤을,"그래서 여기에 오는 밤에 이 곳은 정말 훌륭했고 10pm. 우선은 조명이 밝고 아름다운 살리고 있습니다. 사원 안에, 세 개의 거대한 부처 상은 - 전 호텔이 매우 조용한 곳에 앉아 명상 에 들 시라고 쳇발 였습니다. 따라서 한 조용하고 평화로운 느낌이 충만한. 절대적으로 놀라운",5,조계사,조계사,106
174,Esther C,한 도시에 있는 진지한,"붐비는, 국제적인, 역동적이고 흥미로운. 이 단어가 꽤 많이 이해 쳇발. 꼭 가보세요, 서울의 경우, 특히 불교 사원을 사랑하고. 하지만, 일반적인 고요한 사원이 아닌. 이 아름다운, 이죠, 다채로운 도시라면 크게 설정, 때때로 사람들 소음. 아마 더 이른 아침에 방문하기. 교통이 편리 합니다, 안국 역에서 쉽게 갈 수 있기에 (라인 3). 이는 다른 사이트에서 걸어서 (관광), 등과 축제같은 경복궁, 북촌 한옥 마을, 국립 박물관 및 기타 여러 가지의 현대적이고 현대적인 예술.",4,조계사,조계사,106
175,HelenaGuerra,아름다운 사원,저녁에 와서 보고 즐겁게 노래 소리는 색상. 여러 사람들이 꿇 말씀드렸고 정말 조용합니다.,4,조계사,조계사,106
176,Mitra W,특별한 장소,"저희가 방문한 기간 동안의 전체적인 공간을 조계사 에 수천개의 불상 생일 축하를 살려 다채로운, 이 아름답고 조용하고 있고. 저는 정말 추천해 중지. 인사동과 매우",5,조계사,조계사,106
177,raniSpain,운영 및 사용,"저는 이 사실을 방문하고 싶어 한 쳇발 1, 3에 부처 상이 큰 사람들이 아주 좋아. 그 외 지역은 일반적으로 또한 매우 좋았습니다. 꼭 가볼 만합니다.",5,조계사,조계사,106
178,fitzga,Lotus notes 를 한 등불,이 절은 서울 중심에 위치해 쉽게 접근 가능. 이 등불 은 장식이 정말 아름다웠어요. 이렇게 아름다운 곳입니다. 춤과 노래로 랜턴 퍼레이드를 본 후에. 하게!,4,조계사,조계사,106
179,Michelle B,도시에서 최고의 사원,슈퍼 에서 일어나고 있는 커뮤니티 이벤트 항상 액세스할 수 있습니다. 아주 좋은 장소인 불교 한국 실지상의.,5,조계사,조계사,106
180,Esraa A,좋은 일,"마음에 드는 3개의 큰 부처 상은, 정말 이 좋지만 모든 사원이 보일 수 있습니다 사람들이 매우 친절합니다. 제가 사진을 찍는 동안의 꿇",4,조계사,조계사,106
181,Ricardo G,첫 번째 budah 쳇발,"에서 한국, 서울의 한 가운데에 있는 다른 시장 관광명소. 나에겐 아주 좋은 내부 이 쳇발. 좋은, 좋은... 우리는 좋은 시간이 갔기 때문에 등불 축제 lotus, 모든 것이 매우 잘 꾸며져 있어서. 좋은 곳은 좋은 경험이 있는 여행자.",5,조계사,조계사,106
182,Natttsss,제가 본 최고의 불교 사원,중국 불교 사원을 본 후에 저는 감동과 이 tahiland. 이 좋은 경우는 없지만 정말 놀라운 본 적이 없,4,조계사,조계사,106
183,blueapril82,신비한 장소,저는 개인적으로 가라 앉은 느낌이다. 안으로 들어가 있는 예배 에 대한 세션 진행에 도착하는 순간부터. 부다 이미지 들이 정말 인상적이다.,4,조계사,조계사,106
184,singinggigi,Lotus 등불,사원을 방문할 때 두 번. 처음에는 주. 조용하고 평화로운 곳이었습니다. 메인 홀을 꿇 경전 읽는 사람들. 나는 채식 점심 뷔페 레스토랑 걸침기구 의 길. 신선한 맛이었습니다. 두 번째는 등불을 제가 할 수 있는 로터스. 나는 서명 퍼레이드 참가자 수 있도록 미리. 약 40명의 참가자들의 퍼레이드. 우리에게 주어진 유니폼 으로 변경할 수 있습니다. 이 사원은 바다를 살릴 수 있는 일로 변환되기 전에. 모든 참가자를 만날 수 있는 토요일 오후. 우리는 그를 살린 표시됩니다. 종로5가 가 쪽으로,5,조계사,조계사,106
185,Esther S,잠시 의 휴식,"저희가 방문한 시간에 대한 불상 의 생일 파티. 많은 사람들을 위로 하고 있게 꾸며진, 물을 이고, 꽃을 선물 쳇발. 저는 제공물 을 방문하는 동안. 이 박물관은 옆에 있는 추가 비용 없이 무료로 사용할 수 있는. 수 모두 쳇발 및 박물관에 기증 하다.",5,조계사,조계사,106
186,Evalu8,고무!,절대적으로 아름다운 사원 이다. 또한 언덕 위쪽에 멋진 풍경. 사원 자체에 들어가기 전에 반드시 신발을 벗고? 꼭 봐야할.,5,조계사,조계사,106
187,amoeboid,불교 사원의 한 가운데에 도시,"근처에 위치해 왕궁, 사찰 은 좋은 곳에서 휴식을 하고 싶다면 일정에 쇼핑이나 먹기 입니다.",4,조계사,조계사,106
188,JennyKauf,불교 할 필요가 없,"절이 위치한 번화한 거리 중 하나로 에서 사 동. 우리는 하나의 제안을 했던 불교 를 멈췄다. 조용하고 평화로운 느낌이 들면 한 번 갈 수 있습니다. 우리의 거친 스케줄 때문에 오래 머물 수 없습니다, 하지만 우리는 진정으로 즐겼다: )",4,조계사,조계사,106
189,Dany H,시간이 충분치 않,"이곳에 들러 여행의 첫 번째 정류장. 우리의 운전 기사는 우리를 우리는 많은 시간을 늦게 한 아오 구경 (시간이었고, 우리는 우리를 기다리고 있다). 적절한 정보를 얻을 기회가 되지 않았다. 봉은사 가 확실히 더 아름다운.",3,조계사,조계사,106
190,VeJokl,사랑스러운 장소,"추천, 좋은 장소를 방문할 때, 적어도 2시간 절약, 그렇게 많이 붐비지 않는 사원들을 다른 사람들, 아름다운 정원 등",5,조계사,조계사,106
191,Seung L,휴식을 취하기에 좋은 곳이라고 하고.,이 불교 사원 중 최고의 쇼핑 센터 바로 옆에 위치하는 인사동. 쇼핑 후 들러 휴식과 명상 이 가능한 사원이 다.,5,조계사,조계사,106
192,Valentina L,예쁜 색상,"세부에 있는 아주 아름다운 절, 이 작지만 자세히 보면 얼마나 많은 시간과 노력을 제가 넣어 볼 것! 좋은 사이트",4,조계사,조계사,106
193,QuickWhitTravel,좋은 사원,"이 아름다운 도시의 중심부에 있는 한 사원 이다. 시간을 꼭 해볼 가치가 있어서, 특히 경우 쳇발 깡총뛰기!",4,조계사,조계사,106
194,Etienne D,매우 실망,여행에서 돌아오는 길에 본 궁전 changgyyeonggung. 시간을 낭비하지 않 도 됩니다. 먼; 가방을 들고 사다리 ciment. 더 이상 무슨 말이 필요하나?,2,조계사,조계사,106
195,Lady_Nathalia,이 아름다운,"처음에 입력한 쳇발. 이곳은 정말 아름다운 곳. 인테리어, 특히나 를 살리지 다 아름다운 천장. 깨끗하고 조용합니다. 보고 있는 다른 많은 수의 쌀 기부 붕삼란에.",3,조계사,조계사,106
196,Dayel1956,휴우... 이 쳇발!,"또 다른 하나의 장기 내. 그들은 모두 유사한 비주얼을 제공하는, 실망시키지 않는 이 곳. 만약에 들러 보세요... 그렇지 않은 경우, 나가는 길도 잘 하지 않는다.",4,조계사,조계사,106
197,Ricardo B,번잡한 거리 한복판에 있는 아름다운 사원,"반대로 재구성된 과거를 제공하는 알림도 있고, 영적인 번영 과 생활을 한 것이 이 사원은. 확실히 방문할 만하다",4,조계사,조계사,106
198,Rama M,서울 중심에 있는 역사적인 사원,"복잡한 도시 중간에 위치한 아름다운 사원, 매우 평화롭고 오래된 나무가 좋다는. 30 45분이 쉽게 커버로.",5,조계사,조계사,106
199,Tinymoonbeams,밤에 갈 수 있...,밤에는 수백 개의 밝은 컬러를 살리지 걸침기구 불이 일어났다. 운이 좋으면 소리를 들을 수 있는 수도승 잠들곤 했어요. 동화 같은 경험하는 가장 바쁜 서울의 분주함.,5,조계사,조계사,106
200,FrankTibackx,작은 도시 한가운데에 활성 쳇발,"이 역에서 환승 투어 인천 공항에서 또 다른 좋은 무료. 좋은 건물 - 고요한 분위기. 활성 쳇발 - ""대중""진행 했을 때. 특별한 볼에 현대적인 건물 ""오래된 세계"" 쳇발.",5,조계사,조계사,106
201,Turtelik,이 도시의 중심에 있는 작은 사원,"이 절은 서울의 시티 센터에 위치해 쉽게 접근할 수 있는 가까운 인사동. 또한 무료로 입력합니다. 국화 축제는 하지 않았는데 시간 및 전체 쳇발 아는 꽃이 만든 동상 이 장식되어 있으며 아름다워 또는 푸가! 또한 내가 오픈 해 사원은 거대한 비즈니스 건물 옆에 있는 볼 수 있도록 천골 과 나란히 profanum. 방문할 가치가 있는, 하지만 한 종교적인 장소는 변경다른 운영 체제를 쳇발 역시 조용하고 사람들을 대해 합니다. 또한 신체 내부 사진을 찍지 었어요 (위치 및 기도 의식이 일어나고)",5,조계사,조계사,106
202,Basspirate,매혹적인 경험,나는 절에 가고 싶어 최근 몇 년 동안 개발 불교 에 관심. 이 매력적인 경험을 축복 하다고 느껴지는 이 '활성' (말하지 방법) 쳇발 간략하게 살펴봅니다. 야외 결혼식을 목격한 부분 했다. 이동이 었습니다. 사원 주변은 아주 평화롭고 아름다운 곳. 나는 매일 방문 할 수 있고 컨텐츠.,5,조계사,조계사,106
203,Seat 2A,시간을 거슬러 돌아간,"하지만 몇 세기 전 원래 쳇발 제거되었습니다 화재, 구조는 현재 교체, 여전히 인상적인 it 아키텍처, 문화의 의미와 역사, 그리고 이에 동의하는 기본.",4,조계사,조계사,106
204,Christine N,작은 사원,"저는 아시아 지역의 많은 사원 들, 이 작은 것들 중에 하나입니다. 좋은 환경에 있긴 하지만, 아마도 30분이 쳇발 내에서 수행할 수 있습니다. 복잡한 도시의 중심에 위치해, it 산만 하다는 것이었어요. 무료로 제공되는 서비스라고 하는 멋진 선물 입니다. 체크 아웃할 수 있다면.",4,조계사,조계사,106
205,Stephenie/Стефи,고무!,이 사원은 아름답다! 나는 많은 불교 사원인 제가 본 것 중의 하나이다. 벚꽃 시즌에 등불 이 있는 지역은 살리고 화려한 사원에 꾸며져 있습니다. 전반적으로 멋진 곳!,5,조계사,조계사,106
206,Mei N,매혹적인 방문,우리는 우리의 방문이 쳇발. 하지만 사람들이 저희를 반기 문에 예배 하는 내부 사진을 찍을 수 있도록 했습니다. 꼭 가볼 만합니다.,4,조계사,조계사,106
207,Danybuilding,놀라운,"매우 으로 beautyful, 그리고 절대 잊지 못할 곳입니다. 그러나 원래 한국인 오래된 사람들, 정말 내다, 싶어 시도할 수 있는 것. :) 에 앉아 있는 베개, 오래된 여자가 나에게 뭔가를 항상 말과 한국어. 우리는 다른 사람에게, 어떤 문제, 하지만 했고: ""그녀는 오래된"". :)",5,조계사,조계사,106
208,GregorySmith,무성한 아름다운 꽃 만발한 정원 쳇발,"채식 식당이 길 건너에 있는 불교, 이 사원을 방문하기 로 했습니다. 정말 아름다운 - 예쁜 꽃들을 하고... 아주 멋졌죠. 이곳이 제가 본 적이 없습니다.",5,조계사,조계사,106
209,hunylac,짧은 방문할 가치가 있는,"사원 자체도 좋지만 정원 주변에 생각보다 흥미로운 방법입니다. 중지에 있어 10 - 15, 많지 않은 것보다.",3,조계사,조계사,106
210,Kristin L,아름답 은 장소,잘 꾸미 어 지 어 있 꼭다발과. 아름답 은 작 은 공간 이 지만 잘 꾸미 어 지 어 있 는 것 도. 이 지역 은 작 은 농축 되 ㄴ 이후 에도 노인 이 ㄴ 것 을.,5,조계사,조계사,106
211,Beth K,아름답 은,아름답 은 작 은 사원. 바로 옆 에 인사 동이 서머셋 팰리스 호텔. 화려 하 ㄴ 꽃 들 이 많 고 제 가 가 ㅆ을 때. 나 의 여행 안내서 라 계절 마다 변경할 수 있습니다.,4,조계사,조계사,106
212,Nutnutchar,좋 은 선택 이 ㅂ니다.,"불교 를 연구, 하룻밤 을 묵 을 수 있 다. 시간 이 좀 있 는 등불 같 은 꽃 축제 와 특별 하 ㄴ 이벤트. 날짜 확인 하 기 때문 에 이 리뷰 는 한국 관광 공사 와 함께 등불 같 은 최대 음력.",4,조계사,조계사,106
213,Erin W,"작은, 아주.","하지만 이 지역에 있는 많은 것을 볼 수 있는 작은 사원. 확실히 이동 (경복궁, 광화문 광장) 근처에 있는 경우. 아주 예쁜 꽃이 피어있는 10분밖에 걸리지 않아 갔다.",3,조계사,조계사,106
214,Global-Bivouac,첫 번째 방문 은 기억 에 남 는,나 는 한국 에서 10 년 살 아 넘치 게 방문 하 ㄴ 적이 이 쳇발. 10월 2015 에. 저 는 서울 에 다시 방문 하 여 보 볏가을을. 와우! 이 인상 적 이 었습니다. 마당 과 정원 모습. 활성 작업 이 매우 바쁘 ㄴ 일 때문 에 여러 작업 쳇발 있을 수 있습니다. 또한 이 사원 템플 프로그램 참여하고 있습니다. 나 는 이 다음 에 한국 활용할 수 있습니다.,5,조계사,조계사,106
215,Howie Y,시내에 위치한 절,이 사원은 하드 를 지나치는 사무실 건물인 구조도 있습니다. 좋은 곳을 방문하는 불교 않습니다. 한국 신앙 생활에 대해 자세히 알아보십시오.,4,조계사,조계사,106
216,annagrem,그래서 stunnihg,"꽃 들이 수백만 에, 궁전 같은 건물은, 아름답지. 인사동과 매우 가까운 영역을 결합하면 신발을 벗고 내부 2.. 멋진.",5,조계사,조계사,106
217,bnelson88,커뮤니티 센터를 진정 아름다운 사원,"내가 방문하는 아시아 투어는 사원의 하이라이트 중 하나. 국화 축제 기간 중 토요일에 도착했을 때, 절이 있어서 외부 및 내부의 두 색상 콘택폭발을. 예배 를 서비스하고 있는 여러 건물 및 드러밍 잠들곤 했어요. 기본 보호 구역, 세 개의 부처 상이 한 수 있는 완벽한 물넘이 용량, 참배 할 수 있고. 도착하자마자 인사를 제공하기 위한 매트 닐링. 제가 느낀 부분을 수신고 서비스였다. 그의 일생 을 경우의 값은 요가와 명상, 생각보다 한국의 여성들이 더 이상 이전, 및 서 번 시간을 닐링 더",5,조계사,조계사,106
218,ShellywUK,아름다운 사원,"살아있는 지난 4개월 동안 서울에서 살고 있는 이 사원에 우리는 운이 좋게도 합니다. 우리는 적어도 4시간이나 지난 통해 쳇발 있다고 아름다운 하루. 이 작업이 얼마나 중요한지 알 수 있는 사찰 로 이곳에 오는 사람들. 아름다운 사원 경내 에는 항상 표시되며, 정말로 합니다. 지하철 역이 아주 가까워서 다른 3 답변하기.",5,조계사,조계사,106
219,tuckpaw,매우 영적,"평화로운 오아시스. 이 절은 많은 사람들이 그들의 영성 을 사용하는 것을. 게다가 쳇발, 존중할 수 있는 사람들이 있는 파고다. 왼쪽에 있고, 죽은 기억. 오른쪽에 있고, 한 사람이 살아.",4,조계사,조계사,106
220,MarcinNI,장소는 서울에서 조용한 거실 쳇발,저는 거의 실수 였는데 정말 평화로운 장소이긴 하지만 상당히 중앙 및 다음 주 성 정원. 불사 가 진행을 방해하고 싶지 않았다 그는 정중하게 안쪽에 조용한 산책 만 몰래 찾기. 이 안에 살고 있는 사람들을 볼 수 있는 외부의 사원이. 작은 정원이 있는 작은 백합 연못 옆에 있는 독특한 아우라 질량이 큰 추가 꼭다발과. 매력적인 패턴이 있는 어떤 물고기의 머리에 숄 (생각) 이 배치되어 있는 것을. 이것이 제가 생각하는 그들이 무엇을 할 수 있는 인형을 가져가기 위해 사람들이 소원을 꿇 또는,4,조계사,조계사,106
221,2oldgeesers,"""전용""은 불교 사원 도시, 산에서 다른 사람들이.",여행 중에 여기에 왔어요. 조용하고 공경 하는 곳입니다. 대부분의 여성들이 남성 들이 그들의 믿음에 연습 하지.,5,조계사,조계사,106
222,Peter O,고 평화롭고 특별한 번잡한 지역에 위치한 호텔,나는 이것이 사고와 매우 가까워 이 실현하지 않았다. 매우 아름답고 평화로운 곳. 특히 좋은 때 (결국 저) 벨을 누른다. 다시 와서 기도를 하면서 하루는 매우 조용합니다.,5,조계사,조계사,106
223,Squeekie,서울에 있는 가장 오래된 불교 사원,"방문 일부로 시티 투어. 좋은 위치에 있는 아름다운 백합 연못 자이나교의 꿇, lotus 꼭다발과. 좋은 예술 beaurtifully 제지 마쉐 칠한 벽, 천장 의 세부 사항은. 지금은 보이지 않는 것이고. 좋은 느낌 뿐입니다. 서울에 있는 동안 합니다.",4,조계사,조계사,106
224,Kristan M,영적인 경험,"서울 시내의 중심부에 있는 또 다른 숨겨진 보석. 불교 는 활기찬 모습. 적 이 특별한 장소. 건축, 그림이 신, 연꽃이 피는 정원에 모두 특별한",5,조계사,조계사,106
