,u_id,title,review,u_rate,place_name,res_title,p_id
161,멍미s2,벚꽃하면 떠오르는곳.!!,"벚꽃, 불꽃놀이 하면 어김없이 떠오르는곳. 그만큼 서울의 대표명소인듯 해요. 많은 사람들에게 사랑받는 이유가 있는곳입니다.",5,여의도공원,여의도 공원,110
162,RRReina,산책하기 좋아요,"엄청난 크기의 공원이라 운동하기 좋아요. 걷기좋게 트랙도잘 되어있고, 중간중간 정자와 의자도 많이 준비되어있어요,",4,여의도공원,여의도 공원,110
163,민희 유,여의도공원에서 한강공원까지,"산책과 운동하기 좋은 공원으로 점심쯤에 가면 많은 직장인을 만날 수 있다. 자전거 대여소가 있어서 자전거나 인라인등을 빌려탈 수 있고, 올해 광복절을 기념해 실제 비행기도 전시해놓았다. 한바퀴에 3km쯤 되는 것 같고 , 중간중간에 오두막이나 산책길 같은 아기자기한 시설도 있다.또한 걷다보면 한강공원과 연결된 지하통로가 있다.예전 비행기활주로 였다는 흔적이라고 하니 한번쯤 방문해보면 좋다",4,여의도공원,여의도 공원,110
164,Wanimyo,여의도 공원,벚꽃하면 떠오르는 곳 차길을 따라 쭉 펼쳐진 벚꽃들을 보는 재미란... 차량통제 전날 차 끌고 가는게 팁,5,여의도공원,여의도 공원,110
165,불만두,벚꽃놀이 철 때마다 방문하는 곳,1년에 두번정도 마라톤을 뛸대나 벚꽃놀이 철때 방문하는 곳이예요. 집에서 멀어서 자주는 못가지만 그래도 벚꽃놀이 할때 사람많고 북적여도 벚꽃사이에서 기분을 낼 수 있는 곳입니다.,3,여의도공원,여의도 공원,110
166,Danny_S_starrr,봄 벚꽃철에 제격입니다.,벚꽃시즌 여의도 공원은 나들이에 제격이라고 생각해요. 특히 야간 조명을 받은 벚꽃들은 장관입니다.,5,여의도공원,여의도 공원,110
167,nanal78878,여의도,벚꽃축제할때는 길거리 곳곳을 점령한 노점상때문에 정신이없어요. 평상시에 걷기 괜찮은곳입니다.,4,여의도공원,여의도 공원,110
168,호호홍홍홍,여유로움을 즐기며 여의도 공원에서.,"봄에는 벚꽃, 여름의 푸르름, 가을의 단풍과 낙엽, 겨울의 황량함까지 다양한 자연의 색을 볼 수 있습니다. 산책하거나 자전거 타며 여유를 즐기기에 좋은 곳입니다. 한강과도 가까워 더 좋습니다.",5,여의도공원,여의도 공원,110
169,victoria,인라인 타러 가는 곳입니다.,"여의도 공원은 벚꽃 놀이할때는 정말 가지 말아야 할 곳 중에 하나죠. 하지만 평소에는 한강을 끼고 있기도 하고 운동하러 가기 좋은 곳이 여의도 공원입니다. 산책하는 사람, 자전거 타는 사람 인라인타는 사람들이 좀 뒤섞여 있기는 하지만 그래도 접근성이 좋고 한강공원에서 올라오기도 좋은 곳이라 자주 이용하고 있습니다. 인라인 타기좋은 곳입니다.",4,여의도공원,여의도 공원,110
170,RaaaaaY,언제 가도 좋은 곳,워낙 벚꽃으로 유명하지만 봄부터 가을까지 한강 소풍으로도 최적화된 곳. 강변에서 시켜먹는 각종 배달음식을 경험해 조시길!,4,여의도공원,여의도 공원,110
171,주니룩스,봄에만 좋은 곳,한적한 도시속 확 트여진 공원입니다. 하지만 상업적인 동네라 그런지 차가운 느낌이 많이 듭니다,3,여의도공원,여의도 공원,110
172,mokujino,여행객을 위한 공간은 아님,"여의도 주변 직장인들에게는 너무나도 고맙고 좋은 공간이지만, 일반 여행객들이 찾기에는 지극히 평범하고 특별할 것 없는 공간.",3,여의도공원,여의도 공원,110
173,죠이어,갈만한 공원,자전거 타러 가거나 소풍 가기에도 좋구요. 여의도 벚꽃축제도 사람이 엄청 많기는 하지만 멋져요.,5,여의도공원,여의도 공원,110
174,bahajia,산책하기 좋은곳,빌딩숲안에 이런 공간이 있다는게 좋았고 걸으면서 순간 뉴욕의 센트럴 파크를 걷는 느낌이 드는 곳도 있었어요.,4,여의도공원,여의도 공원,110
175,HelloKH,가볍게 산책하기 좋은곳,여의도 직장인들 점심시간 산책으로 너무 좋은곳이에요 주변에 빌딩숲이 있는거와 달리 여기 있으면 숲속에 들어온 느낌이 들어서 좋네요 새소리 풀벌레 소래도 많이 나서 정말 힐링하는기분,5,여의도공원,여의도 공원,110
176,eoto34,좋습니다,여의도공원 가족들과 함께하기 너무좋은곳이에요 아이들도 마음것뛰어놀수있고 너무너무좋네요!!!,5,여의도공원,여의도 공원,110
177,수호천,벚꽃엔딩 노래가 생각나는,버스커버스커 벚꽃엔딩 하면 떠 오르는 이곳 넓은 공원에서 자전거 타면 스트레스도 풀리고 모두 행복한 모습~!,4,여의도공원,여의도 공원,110
178,MapostyleSun,도심속의 산책,여의도는 한국의 금융 중심지 입니다. 그러다보니 쭉쭉 뻗은 멋진 건물이 많은곳이구요 여의도 지역은 특히 봄철의 벚꽃이 유명해요~ 벚꽃핀 시기가 아니더라도 여의도 공원은 잘꾸며져있어서 산책삼아 가기 좋은 곳입니다. 멀리서 올필요는 없고.. 근처에 있을 때 공원 가고싶을땐 가보세요,5,여의도공원,여의도 공원,110
179,흰토끼,벚꽃 구경 짱,"벚꽃 구경하고 싶은 가족들이나 연인이 찾기에 좋은 곳. 산책하며 즐기기에 여유롭고 편안한 장소,",5,여의도공원,여의도 공원,110
180,sang cheol h,강을 따라 산책,한강을 따라 산책하고 자전거도 타고 도심 속 운동장에서 농구도하고 여의도는 도심속에서 큰 의미를 가진는 곳이네요 언제든 여유를 부릴 수 있는 곳,5,여의도공원,여의도 공원,110
181,Redboom10,힐링하기 좋은 곳!!,쉬는날 사랑하는 사람과 함께 힐링하기에 좋은 곳!! 이번엔 벚꽃축제도 하고 있어서 더욱더 좋았던 것 같다!! 사진도 찍고 걷다 보면 여의도 공원도 나오는데 잔디밭에서 휴식도 취하기 좋고! 배가 고프면 편의점에서 먹을거리도 사서 먹구! 기회가 되면 자전거를 이용하는 것도 좋을 듯!!,4,여의도공원,여의도 공원,110
182,LOVESSU,언제나 기대가되는 여의도벚꽃,"다음주면 또다시 시작되는 벚꽃축제 작년에도 다녀왔지만, 언제나 멋진 풍경은 나를 설레게한다. 매년 4월에 벚꽃축제가 열리는 여의도는 봄나들이를 준비하는 가족,커플에게 적극추천!!!! 주말에는 사람이 너무많아 붐비기쉬우니 평일 한산한 시간대에 가서 여유롭게 산책하는걸 추천하고싶다.",5,여의도공원,여의도 공원,110
183,큐큐,봄에 방문하면 제일 좋아요.,여의도 공원은 봄에 방문하면 정말 좋아요. 예쁜 벚꽃들의 향연을 만날 수 있거든요. 한강공원하고도 이어져 있어서 산책을 하거나 조깅을 하기에도 정말 좋은 장소입니다. 연인/친구와 자전거를 타도 좋고 (자전거를 대여해줍니다.) 여러모로 만족도가 높은 곳입니다.,5,여의도공원,여의도 공원,110
184,goodtripgo,도심 속 대형 공원,여의도 빌딩가 사이에 있는 나름 대형 공원. 자전거길과 산책길이 잘 관리되어 있고 작은 정자도 있어서 운치가 있다 근처에 IFC도 있어서 쇼핑과 식사를 하기에도 좋음.,4,여의도공원,여의도 공원,110
185,ゴールデン,일부에 한국 정취의 정원이 있습니다,"오피스가의 한가운데에 거대한 공원이 있습니다. 한겨울이었기 때문에 눈이 쌓여있었고, 사람 그림자도 찾아보기 힘들었지만, 계절이 좀 더 좋았다면, 도쿄에서는 히비야 공원, 오사카라면 나카노지마랑 비슷한 느낌의 풍취가 있는 것 같습니다. 북쪽의 한강에 가까운 쪽은 한국정원으로 이루어져 있어서 물새가 사는 연못이나 자못 한국 분위기가 나는 색채의 팔각정이 있거나 해서, 간단한 기념사진을 찍기에는 알맞은 것 같습니다. 가까운 IFC몰에서는 큰 길의 횡단보도를 건너서 바로 있습니다. 이번에, 몰에서",4,여의도공원,여의도 공원,110
186,Bintang27,도시의 오아시스,"오피스 거리의 가운데에 있는 서울 시민의 오아시스 여의도 공원 이곳 여의도 공원의 부지는 무려 약 7만평으로 꽤 큰 공원입니다. 이 근방에서는 드라마 촬영도 자주 하고 있고, 제가 갔을 때도 촬영을 하고 있었습니다. 또 벚꽃시기에 여의도 공원은 서울 벚꽃명소로 유명합니다. 한강을 따라 여의서로에 줄지어 있는 벚꽃을 보고 있으면 전국 각지에서 매년 많은 사람들이 옵니다. 때문에 벚꽃의 계절 주말에는 많은 사람들이 옵니다. 1.7km 구간에 제주도 원산지의 벚꽃나무 1641 그루를 비롯해 진달래와",3,여의도공원,여의도 공원,110
187,GoChangingman,비즈니스 거리의 쉼터?,KBS 스튜디오 견학 후에 들렀습니다. 여의도 자체가 비즈니스 동네로 갔을 때가 평일이어서 정장을 입은 사람이 벤치에 앉아 있어서 마치 일광욕 공원 같았습니다. 그리고 매우 넓어서 해방감이 있었습니다. 왜 인지 농구대가 있는 것은 놀랐습니다.,3,여의도공원,여의도 공원,110
188,kay003,밤 벚꽃 구경,벚꽃 축제에 갔습니다. 국회도서관 뒤쪽 한강 부근 길을 차량 통제 하여 보행자 천국이 됩니다. 벚꽃 구경은 그 길을 따라 이벤트를 하거나 기업 주관의 텐트 사진관 음식 노점상 등등. 아직 춥지만 색색의 라이트를 비춘 벚꽃도 한국 다워서 이야깃거리가 될 것 같다. 이 시기 서울에 간다면 꼭 가보세요.,4,여의도공원,여의도 공원,110
189,jyoheki,비즈니스 거리의 차분한 분위기가 있습니다.,"명동과는 전혀 느낌이 다릅니다. 도쿄의 마루노우치, 가스가세키 주변 차분한 분위기가 돌고, 방송국 및 국회 의사당 부근에 있습니다. 사무실이 많은 탓인지, 현지의 샐러리맨이나 OL이 먹는 싸고 맛있는 가게가 많이 있었습니다. 여기에서 좋아하는 레스토랑을 찾는 것도 즐거울지도 모릅니다.",4,여의도공원,여의도 공원,110
190,Jennifer H,좋은 곳을 걸어,몇 몇은 이곳에서 사진 촬영. 이 도시에서 잠깐 휴식을 하기 좋은 곳. 아주 조용한 공원 이 아니면 큰 중간에 있습니다.,4,여의도공원,여의도 공원,110
191,nilintentum_reliquit,저는 서울 근처에 로그인,공원을 돌아다니면서 즐거운 강 을 향해 오른쪽 다리를 지나 사용자_이름: 저는 사진찍 서명 입니다. 가장 가까운 지하철 역에서 여의나루 라인 5. 이 리뷰가 도움이 되었습니다 감사합니다 투표 수 없습니다.,4,여의도공원,여의도 공원,110
192,Graciela A,방문할 가치가 있는,"벚꽃 시즌은 과거 도, 아침이나 저녁에 산책을 가기는 가기 (또는 자전거를 빌려).",4,여의도공원,여의도 공원,110
193,Bandit-One,꽤 편안한 곳,"여의도 한강 공원 을 방문한 다음 체크아웃을 하는 아주 좋은 공원 입니다. 벚꽃 시즌을 놓치는 일 뿐입니다 지. 하지만 너무 즐거운 산책 에 좋습니다. 이에 좋은 다른 산책, 자전거 도로와 차선. 우리는 이 곳에 평일에 있었고 매우 편안했어요. 몇 가지 - 대부분의 지역 - 오. 조용해서 좋았어요. 분주 한 다운타운 지역을 방문하기에 좋은 숨을. 큰 필드에 있는 공원이 있는 한, 이 훌륭한 세종대왕 동상, 여러 놀이터, 벤치가 있는 작은 커피 가게와 많은 관광명소. 좋은 곳에 함께 있는",4,여의도공원,여의도 공원,110
194,TheTalamia,가장 놀라운 도시 공원!,"여러 가지 테마 - 단면을 따라, 이 공원에서는 많은 것을 보고. 이러한 작업을 수행하는 동안 각 섹션에서는 까노에 마다 별도의 공원에 충분한 것 같은 한적한 느낌. 우리는 공원을 가로지르는 9에서 걸어 갔다 - 11시였고 wonderous. 우리는 강가의 야경은 앞으로 이다. 매우 안전한 느낌이 많은 사람들이 토요일 밤 늦게까지 계속되고, 자정 이후에도 저희가 게스트 하우스 를 통해 자정쯤 으로 돌아가는 지하철이 있습니다. 이 공원은 정말 보석과 같은 곳에서 자정을 처음 방문한 것입니다.",5,여의도공원,여의도 공원,110
195,Pawan C,진정한 친구들과 함께.,대부분의 벚꽃이 유명한 곳 입니다. 이 곳에 처음 방문 이 아름다운 봄 벚꽃 나무가 보는 정말 굉장 하다.,5,여의도공원,여의도 공원,110
196,FYLP2202,아름다운 꽃,이 과정을 바람이 다. 밝고 아름다워 꽃. 생각해 보니 본 벚꽃을 볼 수 있었다. 평화로운 지역에 있는 방향 전환 또는 주기,4,여의도공원,여의도 공원,110
197,429Happy,가장 즐거운,이 공원에는 네 부분으로 구성되어 있습니다. 일부 사랑스러운 나무 shrubs. 하지만 보는 겨우 벚꽃. 긴 하루를 즐기는 것은 정말 좋은 곳이 한국인 가족. 매우 드라마틱 한 조각을 볼 수 있는 지.,5,여의도공원,여의도 공원,110
198,khoedebecke,가족과 함께 좋은 방문,"우리 가족은 여기에 가서 벚꽃 시즌 동안 풍경 사진 / 이 장관 였다. 이 곳은 합리적인 한강 과 가까운 "" 나는 서울 이 "" 기호. 즐길 수 있는!",5,여의도공원,여의도 공원,110
199,luvholiday9,벚꽃,정말 아름다운 벚꽃 시즌에 방문하는 끝없는 벚꽃! 하는 것은 매우 붐볐지만 볼 만한 :),4,여의도공원,여의도 공원,110
200,Romain,한국 중앙 공원!,한국 중앙 공원! 이 곳에 위치한 여의도 비즈니스 타워. 이 공원은 정말 조용하고 깨끗하고. 아름다운 풍경과 새 를 물고기도 많이 있습니다!,5,여의도공원,여의도 공원,110
201,PhilippineTraveler,체리 나무 행,저희는 운이 좋게도 벚꽃 나무가 만개의 치수에 해당. 행에 있는 벚꽃 이지만 의 행이 조금 까다로운 경우가 있어 이 나무 에만 피는 벚꽃이 지난 10 일 년. 여기에서 아침 부터 점심 시간 - 많은 사람들이 거리에 공원 /.,4,여의도공원,여의도 공원,110
202,Heng How N,벚꽃 산책,"따라 할 수 있습니다. 이 공원은 여러가지 활동. 걸어갈 수 있는, 실행, 자전거 & 변경다른 작업을 수행할 수 있습니다. 한강 주변을 따라 있는 국회 의사당. 공원에 가서 이른 아침이나 저녁. 벚꽃 사진을 찍을, 그는 조용한 길을 걷는 사람들이 가장 이른 아침에 좋은 해결할 수 있는 지.",4,여의도공원,여의도 공원,110
203,mariannellacer,벚꽃,네 마음에 야간 조명 이 나무와 시원한 날씨와 안전한 거리 에서 자신 또는 그룹,5,여의도공원,여의도 공원,110
204,Donnaven,아름다운 봄!,"서울에 있는 가볼만한 가치가 있다면 꼭 중간 이 한 - 4월. 그리고 이 매우 아름다운 벚꽃 나무에 블룸. 정말 혼잡 이 공원, 주말. 자전거를 빌려 타고 트랙 수에 들 수 있다.",4,여의도공원,여의도 공원,110
205,liyana1987,아름다운 공원,"아름다운 공원이 있다. 봄에 나는 2017 여의도 공원. 아름다운 벚꽃 들이 있습니다. 산책을 갈 수 도, 또는 자전거를 빌려 공원을 가로지르는 스케이트. 제 남편과 저는 함께 바이크를 빌리는 것이 가장 좋은 방법은 그 주변을 공원. 우리는 짧은 시간에 이 공원 전체가 피곤한 중. 시설도 아주 좋은 공원 - 공용 화장실이 많았고 주변에. 세종대왕 동상 이 있는 공원을 수도 있습니다.",5,여의도공원,여의도 공원,110
206,Patrisha A,사랑스럽고 아름다운,이 때문에 / 사쿠라 벚꽃 시즌 동안 갈 수 있는 것도 없었고 이후 많은 를 참조하십시오.,5,여의도공원,여의도 공원,110
207,Tintin L,아주 평균,"매우 바쁜 주말 동안에 모든 정직하지 않은 것 같아요 좋거나,. 물론, 이 벚꽃 나무가 많지 않지만 좋았습니다. 저는 근처에 있는 강이나 근처에서 산책을 제안 한 대신 picknick 공원.",3,여의도공원,여의도 공원,110
208,kristap341,좋은,벚꽃이 피는 때 에 이곳에 왔다. 멋진. 아주 아름다운. 많은 젊은 사람들이 걸어 다니게 되었다. 이 공원은 당신의 마음을 업데이트한 후 가장 좋은 곳은 힘든 시간.,5,여의도공원,여의도 공원,110
209,GuyJW,긴 산책 지역 사람들 중에 괜찮은 곳,"우리는 도시에 의심의 여지 없는 사람들이 벚꽃 축제 를 즐길 수 있지만 (않은 간밤에) 공원에서 산책하기. 많은 아름다운 꽃 이 지역 사람들이 많은 사이트를, 특히 가족. 일부 운동을 쉴 수 있는 좋은 방법입니다. 도시의 빌딩을 배경 좋은 자연 풍경, 지역적인 자전거와 스케이트 도 수",5,여의도공원,여의도 공원,110
210,Sam,여의도,이는 의심 할 여지없이 가장 아름다운 공원에 서울! 전망 좋은 강이! 63 빌딩 이 국회 도 여기에 있다. 나는 이,5,여의도공원,여의도 공원,110
211,shoresoftheworld,아름다운 꽃들과 멋진 곳이 한,"벚꽃 시즌에 방문하는 아름다운, 예쁜 오후에 즐기는 모든 사람들이 해. 모든 종류의 음식 노점상이 있는 다 할 수 있는 길을 따라, 사람들은 걸어 다닐 수 있으며 에서 캠프. 서울에 있는 더 좋은 곳에 사진을 설치 강 은 맑은 날. 지하철역에서 조금만 걸어가면.",4,여의도공원,여의도 공원,110
212,Steve K,여의도 공원 에서 관광을,여의도 공원 은 지하철 역에서 500 m 다. 아주 좋은 곳이며 조깅. 공원에서 자전거를 빌릴 수 가 있다.,5,여의도공원,여의도 공원,110
213,Diane M,벚꽃 축제,"우리는 우리가 해주는 나무 보기 영역을 가족들은 묘목을 지원하지만 몇 가지 나무들 블룸. 꽃이 더 나와서 일주일 후에 있었습니다. 나무들이 아름다운 블룸, 꽃도 많습니다.",4,여의도공원,여의도 공원,110
214,TeeNianHowe,괜찮은 곳이지만 …,"정말 마음에 드는 곳이 다. 아주 좋은 공원이 있습니다. 주변에 자전거 를 렌트 사이클 입니다. 하지만 내가 방문하는 날, 블룸 완전히 꽃. :(",5,여의도공원,여의도 공원,110
215,AngelC83,아직 이른 시간에 벚꽃,"이 공원에 가서 4월 3일 성과나 벚꽃 나무가 많이 있지만 해당 피어랑,. 예쁜 꽃 시설들이 있는 좋은 작은 놀이터 이다. 좋은 공원 산책.",4,여의도공원,여의도 공원,110
216,amniza030,좋은 곳으로 산책,"가장 아름다운 벚꽃이 만개할 때 서늘하. 좋은 공원, 어디에 가는 활동 에 많은 시간 은. 한강 의 전망을 즐길 수 있어서 연결되어 있어 방문객들의 강.",5,여의도공원,여의도 공원,110
217,menarosli93,Beuautiful,잊지 말고 사진을 볼 수 있는 나무가 아주 많습니다. 풍경과 마음이 있는 것은 피크닉 에.,5,여의도공원,여의도 공원,110
218,Sam Majid,이곳에 올 때 야외 icepark,"섬 자체에 한강, 기차를 타면 20 분도 채 서울에서 중앙 야외 스케이트장, 썰매를 즐길 수 있고. 아이들이 가자 좋은 겨울의 한 가운데에 있어",4,여의도공원,여의도 공원,110
219,Saudade C,벚꽃!,"나는 이곳에 친구랑 4월에 체크 아웃 이 예쁜 벚꽃. 단, 주차가 어려운 사람들이 붐비는 지역. 전에 벚꽃을 즐길 수 있다. 내가 사람들과 거리 음식들이 사방에 카트가 있다. 이곳은 시각적 즐거움 이 아름다운 벚꽃 나무 아래 있는 모든 카트. 괜찮은 사진 할 수 없을 수 있기 때문에 쓰레기가 배경 이라고 할 수 있는 카트. :( 에 길거리 음식, 하는 곳에 쓰레기통 찾기도 힘들었고 쓰레기를. 저는 벚꽃을 볼 수 있지만 가장 좋은 곳이라고 생각 하지 않는 경우에는 그냥 방문을 꼭다발과. 우린",3,여의도공원,여의도 공원,110
220,maria,벚꽃,저희는 운이 좋게도 방문한 경우 계속 소모 공원 벚꽃. 이 많이 붐비지 않는 것이기 때문에 제가 일찍 가 ㅆ었어요. 이 좋은 곳 중 하나이며 친구들의 이 산책 / 가족.,5,여의도공원,여의도 공원,110
221,TehFarahaini,사랑스러운 공원,"여의도 공원 은 경치 좋은 큰 공원. 한강을 따라 자전거를 빌려 자전거. 여기에 가서, 지하철을 타고 여의도 역 4번 출구 (line 9) #로.",4,여의도공원,여의도 공원,110
222,MarcSantaCruz,좋은 공원 지역 에 있는 경우,"이 지역 이었는데, 아주 좋은 공원이 있었는데 늦은 가을, 단풍 길이 좋습니다. 할 수 있는 조깅 트랙 및 산책로, 작은 연못과 잔디 knolls. 남부 지역 과 다른 활동거리가 큰 포장된 농구 코트.",4,여의도공원,여의도 공원,110
223,Kiragi27,시간을 보내고 점심 시간에 완벽한 장소,"몇 개의 거대한 공원의 입구, 하지만 걱정 하지 마세요, 지도 에 있는 모든 문, 항상 알고 즐길 수 있기 때문에, 헤드의 방향 또는 특정 장소를 찾는다면, kbs 방송국 과 같은 건물. 여러 벤치, 그리고 걸어서 이루어진 특수 재료 - 생각해보니, 선수에게 - , 이 경우는 하루 종일 걸어서 갈 수 도, 발을 다치지 않습니다. 점심 에 적합한 장소인 여행중에 또는 반사. 하고, 먹을 수 있는 사람, 일하는 건물 주변에 공원에서 휴식을 취할 수. 세종대왕 동상 이 있는 한, 복제본을",5,여의도공원,여의도 공원,110
224,tatietm2015,서울에 있는 최고의 장소인 가을 visist,"여의도 공원 은 정말 아름다운 가을에. 색상 이 아름다운 나뭇잎. 여의도 역 (서울역) 에서, 약 5분 정도 걸어갈 수 있는 종료 3.. 그런 다음 사항을 교차, 그리고 큰 여의도 공원 - 흰색 간판은 길 건너에 있어요. 나는 아침 입니다. 정말 상쾌한 것.",5,여의도공원,여의도 공원,110
225,Yong Kian Tan,"좋은 곳이며, 휴식을 취하고 사진","좋은 사진 좋은 곳 여의도 공원 을, 바람을, 심지어 조깅 / 피크닉 주위주기. 지하철은 또한 통해 액세스할 수 있음 (았는지 여의나루 역에서, 서울 지하철 5)",5,여의도공원,여의도 공원,110
226,LiketoeatCincinnati,큰 공원,"선을 5, 여의도 역 3번 출구 또는 2 의 naru. 자전거를 대여하는 타거나, 걷거나 조깅 시설도 좋고 한강 뷰! ! 또한, 수 (12000원) 투어 또는 크루즈 보트 티켓을 구입.",5,여의도공원,여의도 공원,110
227,Brian F,훌륭한 정원은 공원,좋은 공원이 금융 지역의 중심에 있는 할 정도로. 많은 꽃과 나무와 몇 개의 조각 들. 지하철 역,4,여의도공원,여의도 공원,110
228,MBenzinger,좋은 공원이 하며,"이 좋은, 작은 공원. 이곳에 봄 소풍 도시락을 추천하는 때 에 벚꽃이 만개.",4,여의도공원,여의도 공원,110
229,travelmike320,오픈 된 공간에 있는 사람이,"여의도에 있는 것을, 주요 금융 지구, 이 공원은 놀라울 정도로 크고 넓은. 날씨가 좋은 때 라 고 사람들은 조금 붐비는 점심 시간에. 하지만, 이 많은 오픈 되어 있고, 산책로와 연못과 꽃과 같은 다른 착시 현상이 줄어듭니다. 이 아이들은 놀이터, 너무. 서지 오른쪽 길 건너편에 있는 ifc 몰 (지하철 역에서 액세스 터널). 이곳은 서울의 이 곳에서 잠깐 휴식을 강조.",4,여의도공원,여의도 공원,110
230,MrPhileasF,비즈니스 지역의 중심부에 있는 좋은 공원,"이 좋은 서울의 비즈니스 지구에 의 한 가운데 있어서, 한국 전통의 숲 지대 가 아무 것도 볼 수 레이크, 선조 들의 동상 은 빌딩과 창립. 또한 exted 더 걸어 강 긴 거리.",3,여의도공원,여의도 공원,110
231,Edna B,"아주 좋은 공원, 몇 가지 제안을 했는데?","나는 몰라 이 호텔 밖의 발견 이 기 때문이다. 여전히, 마음, 전반적으로 가지고 있는 것이 였다 할 만큼의 간판. 하지만, 서울의 흔적은 물론 현지 언어는 영어와 중국어. 좋은 선물이 될 건지 데는 몇 가지 단어들 의 경우에는 자전거를 빌려서 자전거 대여 할 수 있는 영어 / 중국어 들, 너무?",4,여의도공원,여의도 공원,110
232,lelanie s,정말 멋진 경험이었어요 오후 공원,"공원에서 2시간 전에 도착해서 석양이 다! 여의도 역에서 내리는 오후, 관광 쪽으로 조금 들어가며 강과 공원, 환상적인 경치와 멋진 기능 정보를 찾는 구불구불 90min 및 정보의 2/3 를 할 수 있다. 이 아름답고 평화로운 도시 관광명소 및 확실한 경우 이다. 선셋 도 사진에 좋은 시간!",5,여의도공원,여의도 공원,110
233,Micz0p,이곳을 사랑해요!,"그곳에 가서 벚꽃! 하는 것은 매우 좋은... 이 곳에서 멀리 떨어진 지하철역, 어쨌든 5분 정도 걸어서 갈 수 있다.",5,여의도공원,여의도 공원,110
234,Samuelang,그냥 일반 공원,방문하기 좋은 겨울. 많은 사람들이 주위에 로밍 와 멋진 분위기를 볼 수가 있을 것이다. 추천합니다,4,여의도공원,여의도 공원,110
