review,u_id,title,u_rate,p_id
서울만큼 대도시에 갈만한 산이 많은 도시도 잘 없죠. 산이 생각보다 힘들었지만 날씨가 좋고 경관도 멋져서 아주 좋았습니다.,czdy,갈만해요,3,117
수락산이라는 명칭답게 7호선 수락산역에서 금방 도착할 수 있는 곳입니다. 또한 서울에서 괜찮은 계곡으로 유명한 곳이라 여름철에는 사람이 정말 많습니다.,winnie_,지하철로 가기 편한 산,4,117
"왜 리뷰가 없는지 모르겠네요..ㅠ 저는 장암역에서 석림사 쪽으로 해서 올라갔구요, 초입에 계곡이 흐르고 있어 시원하고 좋았습니다. 흙길 밟으며 쉬엄쉬엄 오르기 좋은 산이에요 ㅎ",902,오르기 편한 산이에요~,5,117
"서울의 다른 많은 산들과 비교할 때, 수락산 트레일은 조금 더 어려우며 그중 일부는 봄 (2019 년)에 떨어졌기 때문에 길을 걷는 것이 다소 위험합니다. 전망은 훌륭합니다.",AnttilaKarri,조금 더 어려운,4,117
나는 한국의 등산 / 등산을 즐긴다. Surak Mountain (수락산)은 훌륭한 전망을 가지고있다. 등반은 좋은 운동이지만 과도하게 과세하지는 않습니다. 날씨가 좋으면 많은 등산객을 볼 수 있습니다. 나는 적극 추천한다.,EvaW145,서울 북쪽의 멋진 전망,5,117
