,u_id,title,review,u_rate,place_name,p_id
81,lee9675,연인이나 기족과 산책을...,주로 봄이나 가을이 좋습니다. 가까운 곳에 잠실 롯데월드가 있기 때문에 연인과 영화나 식사 후 산책하면 좋습니다.,4,올림픽공원,12
82,으헤헤헤헹,여름에 가지마세요.,봄에 산책할겸 나들이 가세요 주변에 역이 있으니 접근성도 좋아요 다만 먹을게 문제라서 잠실까지 가셔서 맛난거 드세요.,5,올림픽공원,12
83,Songmi H,날이 좋을때 산보하고 공연하면 한류팬들이 참가하기 좋을듯합니다.,콘서트를 많이 하니까 한류팬들이 공연보러 오기 좋고 날이 좋으면 산보하면서 둘러보기 좋아요. 크게 볼거리는 없어요.,4,올림픽공원,12
84,deuxhan,한밤에 달리기~~,친구들과 자전거 들고 찾았던 올림픽공원 !! 조깅하기에 좋은 코스예요 운동삼아 가보면 좋은데 그 외에 일부러 찾아갈껀 없는듯합니다,3,올림픽공원,12
85,수진v,올림픽 공원 좋아요,"공원 조성 너무 잘되어있구요 봄,가을에는 피크닉하고 여름밤엔 산책하기 좋아요 지하철 버스 잘 되어있어서 접근성도 좋은거 같아요 다만 콘서트 있을때 끝나는 시간에는 지하철에 사람들 몰려서 타기가 힘듭니다",5,올림픽공원,12
86,체리요정,도심에서 휴식을 취하고 싶을때 방문하면 좋아요,돗자리 하나 들고 맛있는 음식을 가지고 가서 피크닉 하기 좋습니다. 산책하기에도 최적의 장소이구요 나무도 많아요 사진찍기도 좋구요,5,올림픽공원,12
87,원이와민이,넓은 공간의 도심 속 다채로운 휴식처,"도심속에 자리잡은 다채로운 휴식처에요 넓은 공간이라 산책로도 잘 되어 있고, 얕지만 언덕길도 있구요, 다양한 체육경기장에서 각종의 공연도 자주 열리고, 배드민턴 등 가볍게 운동하는 사람들도 있어요. 잔디밭도 넓고 조각품도 많아서 사진 찍기도 참 좋구요. 공원안에 롯데리아, 커피숍, 패밀리 레스토랑 등 다양한 음식점도 있어서 이용하기도 편리합니다. 공원 입장도 무료여서 자주 이용합니다.",4,올림픽공원,12
88,hyeje0n9,너무 넓다.,버스에서 정신 못차리면 비슷한 정거장이 너무 많아 엉뚱한 곳에 내리게 된다. 정신 똑바로 차리고 다닐 것.,4,올림픽공원,12
89,Minjin J,집근처! 운동하기도 좋고 피크닉에도 좋은,"집근처라 애기때부터 다니던 공원이에요 어렸을땐 각종 소풍과 학교 행사들이 다 이곳에서 이뤄진지라, 다른 곳도 가고싶었는데 커서 다니니 더 좋은 이곳 피크닉에도 좋구요. 운동하기도 아주 좋아요. 안에 시설들도 다 잘되어있는 편이고 초여름에 오면 야생화와 장미를 볼 수 있어서 더 멋진 장소에요.",5,올림픽공원,12
90,SeungchulShin,드넓은 공원,송파구에 위치한 올림픽공원입니다. 언제나 방문해도 자연을 느낄 수 있는 곳입니다. 주말에 가끔씩 콘서트가 열리면 조금 시끄럽기는 하지만 그 외에는 좋습니다.,5,올림픽공원,12
91,하나러브,조아요,잠실에 살아서 산책할 겸 운동겸 자주 가는데 갈때마다 힐링이 되요 유모차끄는 엄마들도 많고 연인 가족끼리도 많고 다양한 연령층이 서울 도심에서 힐링할 수 있는 공원이에요 공원 안 경기장에서 콘서트도 마니 개최되기도 하고 웨딩스냅 찍으러도 마니 와요,4,올림픽공원,12
92,vstellav,아무때나 가기좋은곳,"운동하러 가기도 좋고, 산책하며 거닐기에도 좋고, 공연이나 행사도 종종 열려 재밌습니다. 5,8 호선으로 접근가능하니 교통도 괜찮습니다. 밤이나 새벽에가면 공기도 상쾌해서 좋습니다",5,올림픽공원,12
93,투덜스머프,88올림픽이 생각나는 그 곳,세자르의 작품인 엄지손가락이 있고 88올림픽의 감동을 확인 할 수 있는 올림픽 공원. 다시한번 올림픽의 감동을..,4,올림픽공원,12
94,dongwookl28,서울의 최고 공원,넓기도 넓지만 서울 시내에 이렇게 나무와 잔디가 잘 되어 있는 곳도 없지요. 봄부터 가을까지는 가족들 나들이로도 최고인 공원이에요,5,올림픽공원,12
95,파도피아노,산책 및 운동에 최적화된 공원!,"올림픽 공원은 서울의 공원들 중에서도 매우 넓은 곳에 속하며 탁트인 시야와 잔디밭, 그리고 각종 조형물 등을 관람할 수 있는 곳입니다. 가족 단위의 산책이나 피크닉 등을 즐기시기에 적합하며 운동을 하시기에도 매우 좋은 곳이라 추천합니다.",4,올림픽공원,12
96,HAPPINESSWISHER,88서울올림픽을 되새기며 산책할 수 있는 곳,1988년 서울에서 처음 열린 올림픽 경기 때 우리 국민들이 열광했던 그 아름답고 즐거웠던 추억을 되새기며 잘 조성된 산책로를 따라 가족이나 친구들과 함께 걷다보면 어느새 편안해짐을 느끼게 됩니다.,5,올림픽공원,12
97,메이링,탁 트인 공간은 좋지만...,넓고 탁 트인 공간이라서 좋지만 한여름이나 행사가 없을 떄 가기에는 다소 아쉬운 점이 있을 수도. 인근에 산다면 산책하기 좋은 곳.,3,올림픽공원,12
98,아롱이집사,올림픽공원,올림픽을 기념해서 만들었다. 그래서 그런지 올림픽 기념물이 많다. 또한 공원에 녹지가 많아서 많은 사람들이 쉬기 좋다. 5월에 장미공원등해서 구경거기리가 많다. 하지만 밤에는 너무 사람이 한적해서 내부 깊게 들어가기를 권하지 않는다.,5,올림픽공원,12
99,사자비,넓디 넓은 공원,가족나들이로 적당하다. 일단 공원이 매우 넓고 이용하는 사람이 많아서 주차하기가 어렵다. 주변에 카페나 맛집들도 상당수 있다. 공연도 많이 하고 전시회도 많고 운동시설도 다양하게 갖춰져있는 만능공원.,3,올림픽공원,12
100,hyunjooy2014,우리나라의 최고의 공원,우리나라의 최고의 공원 같아요. 모든 연력대가 즐길수 있는 곳이예요. 각종 행사도 많고 곳곳이 아름다워요.,5,올림픽공원,12
101,haruleo,여유롭고 편안한 공간,"이것저것 다 갖춰진 공원입니다. 돗자리 하나 챙겨 몸만 와도 편하게 쉬다 갈 수 있구요. 한바퀴 다 둘러보는데 40분~1시간 정도는 걸릴 정도로 규모가 큽니다. 산책로는 크게 두가지가 있는데, 바깥쪽 산책로를 따라 돌아도 되고 몽촌토성을 따라 약간 오르고 내리며 걸어도 됩니다. 가벼운 먹거리와 함께 쉬다 가면 좋구요. 한편으로 소마미술관과 한성백제박물관이 있어 같이 둘러보기 좋습니다. 또한 스포츠시설이 정말 잘 갖추어져 있는데, 올림픽공원 수영장의 경우 50미터 국제규격 수영장으로 시설이",5,올림픽공원,12
102,97097320,주말 이곳에서 여유를.,딱히 할것이 있거나 그런 장소는 아니다. 주말에는 자전거족과 산책하는 사람들이 많다. 해가 지면 언덕에 올라가 잠실송파 시내 야경을 볼 수 있으며 올림픽 공원 앞쪽으로는 각종 까페들과 나름 유명한 맛집들이 있으니 한번쯤 들려보는 것도 좋다.,5,올림픽공원,12
103,Hot6,4계절 이벤트 있는 곳,"주말 주차는 어렵습니다. 필히 대중교통을 이용하세요. 주말엔 연예인 공연등으로 사람이 많이 모여 편의점 등에서 간식거리 구하기 어려울 수 있으니 간단한 먹을거리는 준비해가세요. 치킨, 피자등은 배달됩니다.",5,올림픽공원,12
104,은경 김,넓고 편안한 휴식공간,각종 예술작품이 전시되어있고 부담없이 편안한 휴식을 취할수 있는 공간..겨울에는 부담없는 가격으로 즐길수 있는 아이스링크장까지..,4,올림픽공원,12
105,It-will_be_ok,대표적인 공원,"꽤 넓고 주말이면 가족단위로 많이들 오는 공원이에요. 낮에는 산책하는 사람들, 저녁이면 운동하는 사람들도 많고요. 안에 식당도 꽤 다양하게 많고요.",4,올림픽공원,12
106,livia941,추억이 있는 곳,공원 진~짜 넓어요. 탁 트인 잔디밭. 다른 공원과 다르게 언덕이 있어서 위에서 내려다 볼 수 있는 공간도 있고 탁 트인 공원 중앙에 유명한 나무도 있어서 그림 같고 멋졌어요. 저녁에 돋자리 깔고 누워서 하늘 보는 사람들도 많았어요,4,올림픽공원,12
107,bjh3676,엄청 넓습니다.,"8호선 몽촌토성역이나 5호선 올림픽 공원역에서 갈 수있습니다. 올림픽 공원역으로는 경기장과 가깝고, 몽촌토성역에선 공원이 가깝습니다. 공원이 매우 넓고, 공원 안에 몽촌 토성이 있어서 역사 공부도 될 듯 합니다. 사적과 공원이 잘 어우러져 있습니다.",5,올림픽공원,12
108,양선미,정말 최고의 공원,런던 하이드파크 갔을때..시민들이 자유롭게 잔디밭에서 책읽고도시락 싸서 피크닉 하는 모습을 보고 참 부러웠는데... 서울에서도 가능한 곳이 있다 바로 올림픽공원이다 집을 올림픽공원 근처로 이사하고는 거의 매주 공원 산책을 다니고 있다.. 호돌이 열차도 가끔 아이와 타고 넓은 잔디밭에 돗자리 깔고 도시락 까먹기 하면 참 좋다 자전거도 빌려주고 있으며 곳곳에 편의점이 있어 바가지 염려없이 한적함을 즐기기에 좋다 특히 평일은 정말 한가하니 관광객이라면 평일 방문을 추천한다,5,올림픽공원,12
109,sunnyje,매우 넓습니다.,"녹지도 많고, 산책하기 좋은 공원입니다. 계절마다 다른 풍경을 보여줘서 어느 계절에 찾아도 좋습니다. 공연 시설도 많고, 운동 하기도 좋습니다.",5,올림픽공원,12
110,474eunjungp,봄소풍하기 좋은 곳,"가까워서 주말에 산보삼아 아이들과 함께 나들이 가는 곳입니다. 언덕도 예쁘고 돗자리 펴고 앉을 수 있는 피크닉 공간도 따로있고 공원안에 식당도 있어 식사해결도 꼭 도시락이 아니어도 가능하고 매력만점입니다 다만 공원이 상당히 커서 한번에 전체를 구경하자면 지치실수도 있습니다 코스를 잘 짜서 너무 많이 걸어 지치지 않도록 조심! 무엇보다 누군가 만나기로 약속하셨다면 어느문에서 만나는지 알아두는건 필수입니다!! 문은 평화의문, 남2문, 동2문, 북2문 등이 사방 정 가운데고 중간중간 문이 더",4,올림픽공원,12
111,진인 이2fg5dtuk,올림픽 공원,"잠실에 있는 공원으로 산책하기에도 무척이나 좋고, 특히나 조각들이 많이 전시되어 감상하기에도 좋다.",4,올림픽공원,12
112,Kyungmin L,최고의 휴식지,많은 의자 많은 그늘 넓은 언덕 마음을 탁 터놓고 시원한 바람을 느낄 수 있는 멋진공간. 가족 연인 친구들과 함께 간단한 피크닉 및 레크리 에이션 가능,5,올림픽공원,12
113,hjk8427_,가깝게 가족 산책하기 좋아요,공원이 생각보다 꽤 커서 나들이 소풍하기에도 좋고 바로 옆에 몽촌토성이 있어서 묵어서 보기에 좋습니다.,4,올림픽공원,12
114,징징8,산책하기 좋은공원,전 결혼전 웨딩스냅찍기위해 방문했었어요~ 넓고 스팟별로 이쁜곳이 분포해있어~ 사진을 찍기도 찍히기도 좋은곳이에요~ 꽃이 많을때가면 더 좋을 것 같아요~,4,올림픽공원,12
115,miyani0613,산책하기 매~~우 넓음!,걷기인 매우매우 넓은 곳이라 자전거타고 돌아다니기 좋아보이네요~ 가끔 공연도 자주 하니 송파구 주민분들은 편리할듯...,4,올림픽공원,12
116,LOVESSU,서울시내에서 천천히 산책하기 좋은 공원,날씨좋은 날 가족들과 올림픽 공원을 찾았습니다. 바람이 살짝부는 선선한 날씨에 찾기좋은곳 같네요. 천천히 걷다보니 공원한바퀴를 도는데 2시간쫌 안걸렸던갓 같습니다. 꽃들도 예쁘게 피고 가족들과 사진찍기에 참좋을듯. 주변에 석촌호수와 롯데월드가 있어 하루나들이 코스로도 손색이없을것 같네요,5,올림픽공원,12
117,nanal78878,올림픽공원,안이 굉장히 넓어요. 공연보러 갈때 지하철역에서 특정 건물까지 걸어가는 거리가 꽤 되서 시간을 넉넉히 잡는게 좋습니다.,4,올림픽공원,12
118,밍시안,서울을 대표할만한 터줏대감 공원 (봄엔 벚꽃이 너무 예뻐요~),"봄에 꽃구경 하면 여의도보다 먼저 생각나는 올림픽공원, 안에 자전거 인라인 킥보드 조깅 하는 주민들이 상당히 많고 주민들에게 사랑 받는 장소, 특별하게 사진 찍기 멋진 포인트 장소들이 있어서 야외촬영 성장앨범 스냅등을 찍기에도 좋은 장소",5,올림픽공원,12
119,달래,오디가 자라나는 공원,공원 그 자체보다는 공연이나 경기를 보러 방문하는 곳입니다. 나무들을 보면서 쉬다가 오디가 있는 것을 발견했습니다. 장난치다가는 손이나 옷에 물들 수도 있으니 조심하세요.,3,올림픽공원,12
120,고다이바한,Take it easy,"언제나 사람들이 몰리지만 다 이유가 있는 곳이지요. 잠실 주민들이 너무나 사랑하는 곳이기도 합니다. 예전 잠실 살았을 때 종종 산책을 했었는데 먼 곳으로 이사를 갔지만 추억이 생각나거나 스트레스 받을 때 가끔 들르곤 합니다. 가족들이 같이 가서 웃으며 걷고, 자전거나 인라인도 타고 각종 스포츠를 즐길 수 있는 곳입니다. 근처 방이동 맛집들도 많으니 같이 경험해 보시면 좋을 겁니다.",4,올림픽공원,12
121,leechunkyu,가족 나들이 명소,"가족 나들이하기 참 좋은 장소 입니다. 호수,공원,공연 등등 참 한가로이 산책하기 좋아요.",5,올림픽공원,12
122,kris,점점 더 좋아지는 공원모습,"이 공원이 생긴지 30년 가까이 되어갑니다. 공원안의 나무들도 그만큼 자라고 뻗어서, 원숙한 공원의 모습을 갖추게 된 곳이라고 생각합니다. 곧 다가오는 벚꽃계절에 들려보시길 추천드립니다.",4,올림픽공원,12
123,여행은언제나즐거워,기분 좋은 공간,조깅과 자전거 인라인 등 간단한 운동이 가능하며 다양한 스포츠 활동이 가능한 공원이다. 최근에는 외식까지도 가능하여 가족과 하루 나들이 장소로 충분한 곳이다,4,올림픽공원,12
124,떼류니,좋아요~,서울 중심이랑 멀지만 한가로이 산책하기 좋습니다. 봄에 벚꽃구경하기도 여의도 만큼 멋져요~,5,올림픽공원,12
125,cheum3,야외스냅찍기 좋은 올림픽공원,여기도 야외스냅을 찍으러 갔는데 너무 예쁘게 나왔어요. 공원도 생각한것보다 훨씬 넓고 다양한 느낌이 있어서 다양한 컨셉으로도 찍을수있고 봄날에 도시락 싸들고 놀러가고싶어요,4,올림픽공원,12
126,soobok,88올림픽의 역사가 살아 숨쉬는 곳,잠실종합운동장과 더불어 88올림픽 경기가 열렸던 곳입니다. 각종 경기장과 공원시설이 잘 되어 있어서 가족이나 연인끼리 오기에 좋은 곳입니다.,4,올림픽공원,12
127,은경 장,나들이 하기 좋은 곳,"주말에 도시락싸서 산책하기 좋은 곳이에요. 나홀로 나무근처에서 셀프 웨딩으로 사진 찍는 예비 부부들도 많고, 넓어서 편한 신발 신고 가세요.",5,올림픽공원,12
128,자몽쥬스00,봄 가을에 너무 좋아요,봄에 가을에 따뜻한날 즐기기에 너무 좋아요 천천히 산책하면서 사진 찍으면 사진 찍을 곳도 많아서 자주 가게되는 곳인것 같아요,4,올림픽공원,12
129,mango1030,가족과 함께 나들이 가기 좋은곳,서울에서 가족과 함께 나들이 가기 좋은곳 중의 한곳입니다. 편의시설도 잘 갖춰져 있고 봄엔 꽃구경하기도 좋고 공원안에 놀이터며 미술관도 있고 까페도 있어서 하루종일 시간 보내기 좋아요,5,올림픽공원,12
130,PAYNEss,1988년 서울올림픽 개최 장소,"1988년 서울 올림픽이 열린 경기장이 자리잡고 있는 공원입니다. 백제시대 토성 위에 지어져 역사적으로도 의미 있는 장소입니다. 서울에서 보기드물게 큰 녹지공간을 확보하고 있어 자연속에서 휴식을 취하기도 적절한 장소입니다. 현재는 백제, 신라, 조선시대의 유적을 추가적으로 발굴하고 있습니다.",5,올림픽공원,12
131,ji sun m,산책하기 좋은 공원,"동네 근처라 자주 산책을 나갑니다. 산책하기도 좋고, 날 좋을때는 피크닉 하기에도 참 좋습니다. 갈때마다 사계절이 새로운 공원이라고 느낍니다.",5,올림픽공원,12
132,애니69,정말 공원다운 공원....서울 시내에 이런 공원이 더 많았으면,넓고 편안하고 아름다운 공원입니다. 가족들이 아이들을 뛰어 놀게 하기도 좋고 연인들이 산책하기도 좋습니다. 이런 공원이 서울 시내에 하나만 더 있었으면 좋겠습니다.,5,올림픽공원,12
133,난이언니,푸른 잔디와 함께할수있는곳,봄가을 화창한날씨에 가장 좋은곳 가족들과 산책하기도 좋고 아이들이 뛰어놀기도 좋고 연인들과 데이트 장소로도 좋다,5,올림픽공원,12
134,리나 최,"걷기도, 자전거 타기도 좋아요","공간이 넓고 한적해서 사진찍고 놀기도 좋고, 걷거나 자전거 타는것도 좋습니다. 한적한 여유로움이 있는곳",5,올림픽공원,12
135,혜원 윤,스케이트 & 계절밥상,"스케이트를 타러 조카들과 올림픽 공원으로 고. 스케이트 입장권을 가져오면, 계절밥상에서 유아1명이 공짜랍니다. 언제까지 스케이트장이 운영되는지 모르겠지만, 내년 겨울방학에도 이용할 생각입니다^^",4,올림픽공원,12
136,동글라미,산책과 휴식,자전거를 타도 좋고 걸어도 좋습니다. 평화의문에서 천천히 한바퀴 크게 걸으면 한시간 정도 걸리는데 중간중간 쉬면서 가면 금방 갑니다. 가다보면 토끼를 만나기도 합니다.,4,올림픽공원,12
137,solmarutimsd,응답하라 1988,응답하라 1988의 배경 올림픽 공원입니다. 주차가 좀 어려우니 조심하셔야 합니다. 자전거나 도보로 걷고 여행하기 좋고 서울서 넓은 초원이 있는 몇 안되는 곳입니다.,5,올림픽공원,12
138,Danny_S_starrr,도시락 + 가족나들이 참 좋습니다.,넓은 잔디밭과 산책로가 있어 간단한 나들이로 추천합니다. 봄/가을에는 공연들도 많고 사진찍을 만한 명소도 많이 있습니다.,4,올림픽공원,12
139,밍키멍멍,도심속의 휴식과 산책하기좋은 멋진공원,근처에 맛집들과 편의시설이 많아서 자주방문하게되는 올림픽공원 도심속에 넓은 공원이 있어서 좋아요 산책하거나 날씨가 좋을때는 맛있는음식을 가져가서 피크닉을 즐기기에도 좋습니다 주변 맛있는음식점들이 많아서 식사후에 산책하고 풍경을 즐기기에 참 좋아요 계절마다 매력이 넘치는 공원입니다,5,올림픽공원,12
140,죠이어,넓어요~,매우 넓은 공원이에요. 공원안에도 매점이 있지만 간단하게 먹을거 사서 가는게 좋더라구요. 공원 잘 꾸며져있어서 좋습니다.,5,올림픽공원,12
141,우리우정,무전으로도 누릴 수 있는 혜택,송파의 자랑 녹지가 우거진 곳에서 산책과 문화공연 관람 체육시설과 각종 행사에 참여할 수 있는 송파의 관광명소,5,올림픽공원,12
142,mmom661,공연보러 방문한 올림픽 공원,공연 관람을 위해 저녁무렵 도착해 공원을 오랫동안 둘러보지는 못했지만 넓고 산책하기 좋아보였어요.,4,올림픽공원,12
143,bdragon8,공연보러 갔습니다.,"공연보러 처음 가봣는데, 꽤 넓고 산책하기 좋아보였습니다. 주변에 토성도 있어서 같이 구경하면 좋을것 같습니다.",5,올림픽공원,12
144,해달별,올림픽공원 - 마슐소 보러 감!,올림픽공원에서 최현우 마슐쇼 할 때 보러갔어요ㅎ 생각보다 엄청 크더라구요! 깨끗하고! 그냥 둘러보러 가도 좋을것 같아요,5,올림픽공원,12
145,OverjoyM,"봄, 가을에 나들이 하러 가기 좋은 곳","자전거도 대여할 수 있고, 분수도 있고 나름 꽤 커요 중간에 사먹을 곳도 많고요. 또 공연장과도 가까워서 함께 즐기시면 좋습니다.",4,올림픽공원,12
146,ssh5252,봄.가을.산책하고 운동하기에 좋아요,"올림픽 공원은 조경도 잘 되어있고, 산책으로도 정말 멋지게 만든 공원이라 생각합니다. 남자친구와 인라인도 타고 겨울엔 스케이트 탔던 추억이 있는데, 지금 남자친구는 제 남편이 되어있답니다. ^^ 대신 한 겨울엔 추워요. 따듯한 봄.가을날 가시길 추천합니다.",5,올림픽공원,12
147,everlsk,4계절이 모두 아름다운 올림픽 공원,4계절이 모두 아름다운 올림픽 공원. 왕따나무는 영화 엽기적인 그녀 이후 전국적인 명소가 되었습니다.,5,올림픽공원,12
148,parky77,멋진 휴식처 공원,가족끼리 놀러가기에 정말 좋아요. 2인용 자전거나 4인용 자전거를 타고 공원을 돌며 놀아도 재미있고 미니기차타기도 신나요. 여러가지 휴식처가 많아서 하루종일 놀기에도 시간이 모자라요.,5,올림픽공원,12
149,수진 이,자전거 타기 넘 좋아요,자전거 타기 너무 좋고 데이트하기에도 너무 좋은 장소입니다 친구들과 종종 들리는 곳이기도 하죠,5,올림픽공원,12
150,BlackStar_Lazarus,올림픽 공원 방문기,올림픽공원도 맑은 가을이나 봄에 나가 산책을 하는 것이 좋다. 일부러 갈 필요는 없다. 동네 주민에게만 좋음,4,올림픽공원,12
151,jaeunjanah,강동쪽의 좋은 공원,전시장 도 있고 산책로 도 잘 되어있음. 조금 조악 스러운 곳도 있지만 전체적 으로는 괜찮은 공원,4,올림픽공원,12
152,Youngmin Cho,산책하기 좋은 공원,"올림픽공원역, 몽촌토성역에서 접근 가능합니다. 사계절 언제 가도 항상 좋은 곳이에요. 몽촌토성 산책로를 추천합니다.",5,올림픽공원,12
153,Michael,자전거 타고 나들이,지난 여름에 한강을 따라 자전거타고 들린 올림픽공원입니다. 도심속에서 여유롭게 자연을 즐길 수 있습니다.,5,올림픽공원,12
154,spring308,소풍과 산책을 위한 최적의 장소,"일단 대중교통으로도 편하게 갈수 있고, 무지 넓어요. 넓게 펼쳐진 나무들과 잔디밭을 보고 있으면 가슴이 탁 트이기도 해서 좋아요. 봄과 가을에는 돗자리와 도시락 싸서 소풍으로 가기도 하고요, 셀프웨딩촬영으로도 적합한 장소더라구요. 풍선이랑 웨딩드레스 입은 커플을 많이 봤어요. 주변에 편의점과 스타벅스 등 다양한 음식점이 있어서 연인이나 가족단위로 한번쯤 나들이 겸 가보시기를 추천드려요~",4,올림픽공원,12
155,1kim2parks,송파구 공원,"가을이나 봄이나 올림픽공원에 가서 피크닉이나, 사진등을 찍고 음식점에서 식사하게 됩니다. 넓어거 좋아요.",5,올림픽공원,12
156,bbdad2015,산책과 티타임,"올림픽공원은 너무 넓어서 다양하게 즐길수 있다. 년중무료행사들도 많고, 기분전환하게 커피숍들도 많이있다. 무료 백제박물관 올림픽박물관도 좋다.",5,올림픽공원,12
157,jjbar,강남의산책장소,강남에위치해있으며부지가굉장히넓어서걷깅조금ㅎㅁ들어요소마미술관도있어서관람해도좋으며그런데먹거리가조금부족해요,4,올림픽공원,12
158,PINKSHOW01,다양한 즐거움이 있는 곳,"친구 따라 콘서트장에 가기 위해 찾게 된 올림픽 공원인데, 막상 가 보니 넓은 광장도 많고 여기저기 쉴 곳도 많고, 음식점도 있어서 소풍온 기분으로 놀다 올 수 있었음. 굳이 음식점에 안 들어가더라도 전철역 근처에 있는 빵집이나 편의점에서 간단한 먹거리를 사들고 벤치에 앉아서 먹어도 좋을듯.",4,올림픽공원,12
159,만옥이네,조깅 뛰기 좋은 곳,특별히 들리기 보다 역동적인 활동을 하기 좋은 곳이다. 조용히 운동하고 싶다면 들리기 좋은 곳.,4,올림픽공원,12
160,하얀나무2,강남 3구에서 가장 큰 공원,넓은 풀밭을 가지고 있어 가족들하고 같이 산책하고 나들이 하기 좋음. 그러나 특별한 테마를 가진게 아니라서 조금 아쉬움,4,올림픽공원,12
161,쥬쥬쥬,자주 찾는 곳,올림픽공원을 자주 찾아요 풀밭에 누워 치킨을 먹거나 중국집 시켜 먹으며 친구들과 수다 떨으면 이런게 행복이구나 합니다,4,올림픽공원,12
162,Cestlavie1976,산책하기도 액티비티 즐기기도 좋아요~,잠실의 대표적인 공원 올림픽 공원. 가족들과 산책하기도 좋구요 여러가지 액티비티 즐기기도 참 좋은 공원이에요~,5,올림픽공원,12
163,으스므,생각보다 멉니다.,경기권 사시는 분들은 차가져가시길 추천드립니다. 대중교통으로 생각보다 굉장히 멉니다. 특별한 행사 아니고서야 들리기엔 비추.,3,올림픽공원,12
