,u_id,title,review,u_rate,place_name,p_id
236,Jay J,이 경우 너무 올림픽을 방문해야합니다,"거대한, 생활 - 난 아주 즐거운 시간 이 올림픽 팬. 건물과 부지가 매우 잘 되어 있으며 매우 맑은 지역 안내판이 이동할 수 있습니다. 기념비 적인 탐색 을 모두 올림픽의 역사 한국 medal 확인해 보세요. 하이라이트는 잠실 야구 경기장 였습니다. 나는 언젠가 또 다시 가 실제로 볼 수 있는 게임 플레이!",4,올림픽공원,12
237,SMLove226,"거대한, 아름다운 공원 을 무료로 즐길 수 있는 가족과 친구들과","너무 많은 것을 할 수 있는 아름다운 공원을 볼 수 있습니다! 남편과 저는 오후에 산책, 올림픽을 즐기는 테마, 야외 조각상, 노점상, 및 엔터테인먼트 옵션. 이 거대한 공원 이 많고 많은 사람들이 쉽게 오픈 공간 및 지원할 수 있습니다. 우리는 자전거를 빌려 오는 것을 수도 있는 동안 스쿠터를 빌릴 수 있고 페달 - 코치 제어 기능을 - 캐노피가 달린 그늘에서 사용할 수 있습니다. 점심을 먹고 소풍을 즐길 할 수도 있고 여러 잔디 영역 의자. 우리가 방문할 때, 우리는 올림픽을 돌아 - 박물관",4,올림픽공원,12
238,coke3721,방문하기 좋은 곳,"서울에 있는 올림픽 파크 로 여행 한 것이 다. 저는 그곳에 봄, 여름, 가을 및 겨울. 모든 계절에 방문하는 모든 사람들에게 적당 합니다. 이곳은 휴식을 취하기에 좋은 곳.",5,올림픽공원,12
239,Jmtnyn,많은 흥미로운 풍경을 볼 수 있는 아름다운 공원,"그런 그 가 한 음악 축제 - 제 남편과 저는 방문한 때는. 않는 것 들 이 기 때문에 하지 않은 티켓을 얻을 재생 및 로컬 / 한국 밴드 이었어요. 너무나 많은 사람이 확인할 수도 있지만 전체적으로 이 곳은 좌절 하지 않고! 우리는 호수에 앉아 있는 밴드의 연주 그곳들을. 정말 기억에 남는 경우는 저희가 서울로 다시 생각, 우리는 꼭 다시 방문할 기회가 있다면 올림픽 공원.",5,올림픽공원,12
240,piriot,환상적인 아침 에 대해 phographers,"고대 요새 좋은 산책 의 중간에 팍, 사용 후 바로 정문 왼쪽 계단을 오르고, 걸어서 의쉬크 주변 경치 좋은 투어는 2 km. 좋은 경험!",5,올림픽공원,12
241,windycity08,아니 불가능한 노인,"저는 작은 대비하는. 수를 하는데 지하철 중역들을 호도하고 있다기보다는. 내리지 후, 먼 길 을 걸으면 합니다. 이 거대한 주차장을 따라 걷다 (올림픽 공원 남문 주차장 및 사용할 수 있는 카페, 브랜드는 스타벅스나 커피 콩. 그리고 답변하기 하는. 만약 관광, 이 잃어버린 느낌. 현재 많은 스포츠 센터에 보시면, 같은 자전거 경주 장 테니스, 수영,? 모든 직원들은 별도의. 아, 이 정도는 무료로 제공되는 정부 "" 투어 버스 ""; 하지만 오늘 방문한 웹 사이트가 있는",1,올림픽공원,12
242,dingerbel,아주 좋은 자전거를 주차하고 편안한,"제가 기억나는 게임을 하게 된 1988 어떻게 말을 해 볼, 아니 100미터 의 최종 전체에 실망했습니다. 그 날 저는 서울 올림픽 공원 에 가 하고, 제가 이 마침내. 내 기억에 내 마음 단단히 포함된 출발 이 환상적인 공원에 산책, 각 조각들을 보기를 팀과 시설 을 계속 사용할 수 있습니다. 우리는 자전거를 타고 한시간 가량 오 및 주변에 커피 샵 중 하나를 사용할 수 있습니다. 올림픽 공원 은 함께 제공되는 멋진 곳에 처음 12 년 전, 가볼만한 가치가 있기.",5,올림픽공원,12
243,tatietm2015,목적지 입니다.,"올림픽 공원에 위치하고 있다. 지하철, 올림픽 공원 역 3번 출구 의, 올림픽 공원 의 기념비 볼 수 있습니다. 그게 아니라 강조 표시, 뒤에 있는 거리 모뉴먼트는 합니다. 큰 호수와 아름다운 나무 사이에 있습니다. 정말 좋은 오후 입니다.",4,올림픽공원,12
244,Joefred P,볼 게임 을 의,"여기에 게임을 볼 수 있는 전문적인 야구. 만약 야구 시합 시즌 동안에는 기회, 가족이 있고. 내 제안 - 이곳에 앉아서 격려 가 되는 섹션 (있는 경우 티켓을) 즐겁게 놀고. 많은 음식 또는 가족 이 두가지 옵션이 있습니다. 할 것이다",5,올림픽공원,12
245,dontbekhoi,영광스러운 가을에 잎!,"가장 마음에 드는 일이 있어서 오는 서울. 공원은 넓고, 아름답고 아주 잘 되어 있습니다. 입구 바로 옆에 있기 때문에 이에 대한 첫 번째 행은 거리가 유명한 노란색 을 나무 (잊어 버린 이름! ) 이었지만 멋진 공원 자체는 딱! 아주 평화로운, 좋은 산책과 피크닉. 작은 스피커에서 클래식 음악이 공원 에 나오는 귀여운 느낌. 이곳이 정말 좋았어요!",5,올림픽공원,12
246,Fish_EDI,산책하기 좋은 곳,"올림픽 파크는 좋은 조건이 지는 여전히 좋은 날 멋진 곳에 있습니다. 다른 지역이기 때문에 큰 공원 입니다. 아직 사이트에는 스포츠 시설, 자전거 대여 및. 올림픽 정신도 사, 게임 등 많은 사항들의 조각상, 거대한 아치 길, 각 민족의 깃발 과 돌 약품을 사용할 부분. 일부 나라들 도 더 이상 계속 할 수 있는 노스탤지아 좋거나, 여행자들에게 인기가 높습니다. 이 마지막 올림픽 게임이 많은 나라.",4,올림픽공원,12
247,Bixychix,"재미, 오픈 된 공간에 많은","즐거운 놀라움 이 있기에 지하철을 타고. 세 시간 동안이나 이곳에, 모든 것을 보시면 내 목록이 남아 있지 않았다. 많은 재미 에 흩어져 있는 조각상 (현대 미술) 부지 1988 올림픽 있습니다. 이 아닌지 개방적이고, 박물관 안으로 들어갈 수 있는 멋진 예외가 되지 않았다. 재미있는 활동 중 하나인 고대의 문 후 너무 많이 있어요. 신선한 공기, 아름다운 정원, 아동 카운티까지 가는 기차를 타는 것이 1200 wan.",5,올림픽공원,12
248,bethaniaphung,멋진 풍경,이는 보기 좋은 올림픽 공원. 자전거를 빌려 갈 수 있고 주변의 아름다운 풍경을 보면 패.,4,올림픽공원,12
249,Lynn G,아름다운 정원과 특이한 예술 작품,"우리 가족은 자전거를 고용 한다. 하는 생각을 한 시간도, 할 수 있는 조금 더 할 수 있다. 모두 즐거웠고 주위에 자전거 사용된 모든 다른 스포츠 홀. 좋은 뷔페 레스토랑에서 점심을 먹을 수 있는 다양한 현지 음식을 시도해 보았는데. 매우 합리적인, 한 것은, 영어가 아니기 때문에 항상 알고 먹을 수 있는 것은 하지 않았다",4,올림픽공원,12
250,ChunChunMaru,더 좋은 건 없었지만,서울의 올림픽 공원이 좋은 것이 사용할 수 있습니다. 이 곳은 오래된 것을 볼 수 있는 역사적인 스타디움 과 함께. 하지만 그보다 더 많은 것을 할 수 있습니다. 짧은 여행을 계획입니다. 서울시 수도 경통과 공원에서 이벤트 운 합니다.,3,올림픽공원,12
251,MBenzinger,특별한 아무것도,특별할 것 없는 이 곳. 그 때 다시 한 올림픽 한국에서 1988. 하지만 지금 여기 를 볼 수 있네요. 여행자가 없습니다. 해당 지역 주민들 에 있습니다.,2,올림픽공원,12
252,OISEAU_K,멋진 곳이 있어서!,"거대한 장소! 많은 아이들과 함께 가족들. 커피숍, 레스토랑, 작은 상점이 있습니다. 아름다운 나무와 잔디. 수영장에 가는 길에, (반나절 입장 6,000 KRW,=약 6 USD, 아침이나 오후 세션 세션을 선택할 수 있습니다). 나는 내가 할 수 있는 수영장을 즐길 수 있는 역에서. 이 수영장은 이용하는 올림픽 게임 1988, 수영장은 아주 재미 볼 수 있습니다. 했던 에너지. 나는 앉아서 책을 읽고 싶은 좋은 날씨 에서. 잔디가 대한 입력 겨울, 나는 알지.",4,올림픽공원,12
253,Hogandoc1,준비되고 있는,"이 곳이 최고의 여행이 될 것이라고 생각하는 자전거. 그들은 허용할 수 있는, 하고 싶은 많은 단계 저장할 수 있습니다. 우리는 한 시간 정도, 많은 건물 안으로 들어가 수 있지만, 축제같은 체조 경기장, 실내 풀, 등이 있습니다. 할 수 있는 기념품 가게 를 찾습니다. 많은 큰 동상 이 있다. 이 경로를 사용하면 곡면의지압봉 산책로 걸어 많은 종류의 돌, 나무, 등이 있습니다. 그 운동의 발. 인쇄 지도한다, 라고 생각하실 거, 영어를 못하면. 길을 따라 많은 음료 자판기가 있고, 공용",4,올림픽공원,12
254,Kane M,큰 공원,"9월 - 2016) 내 아들은 올림픽 공원 이었다. 전철을 이용하는 홍대, 걸어갈 수 있는 어린 아이들이 많고, 즐길 수 있는 올림픽 박물관 ""박물관 baejke"" (조각 공원 옆)... 둘다 무료! 소마 미술관 올림픽 으로 하지 않는 한 장소 또는 makevitto 많이 걷기 8yr 제가 오래 된.",4,올림픽공원,12
255,Sam,좋은 추억,서울에 있는 올림픽 파크는 거대한! 좋은 여행이 될 것이다 1988 대한 올림픽. 완벽한 사람들을 위해 할 수 있는 좋은 시간을 보낼 수도 있고.,5,올림픽공원,12
256,Anna L,좋은 공원,올림픽 공원은 녹색 영역에는 계속된 올림픽 스타디움 이 꽤 많아. 이는 현재 리오 올림픽 주변을 산책하는 것.,4,올림픽공원,12
257,Camfiend,센트럴 파크 동쪽의 작은 도시입니다.,서울의 다른 모든 접근 방식을 쉽게 할 수 있습니다. 주변에 레스토랑과 쇼핑 몰과 맛있는 음식. 산책하기에 좋은 공원이 면 시간 +.,5,올림픽공원,12
258,Elf L,아이들과 함께 멋진 타고 n 연결아암,즐길 수 있는 편안한 사이클을 타고 내 아이 시터 4에 공원이 있다. 본 푸르고 아름답지 scrupltures. 캡처 멋진 사진입니다.,4,올림픽공원,12
259,Taipei_Rider,세계 평화 가 gate 주변 구조를 볼 수 있습니다.,"이 공원은 올림픽 공원 역 근처에 위치해 편리한 서울역 또는 지하철 5호선 몽촌 토성 (mongchontoseong) 역에 가서 내려서 올림픽 공원 이지만 8. 실제로 몽촌 토성 (mongchontoseong) 역이 기 때문에 세계 평화 가 있습니다. 그 주변에 여러 가지 구조 (한 모든 플래그) 최고의 사진을 찍지 다. 이 큰 공원으로, 어떤 나쁘지 않다 단순히 풍경을 위해 휴식을 취할 수 있는 운동. 선택하면, 해당 시스템에 실제로 사용할 수 있는 피트니스 센터입니다.",3,올림픽공원,12
260,Flemming R,그냥 공원,"좋은 공원이 있어서 도시 중심부, 더 많은 것을 아니지만, 많은 표지판에 영어를 하지, 나는 무엇을 아는가 하는 문제가 좀 있어 돌아다니기에 또는. 좋은 점은, 놀라울 정도로 조용한 토요일 이 되어 있어요. 나는 긴 거리로 걸어서 아름다운 장소, 하지만 그렇게 많은 올림픽. 일부 스타디움 및 다른 건물이지만 주변의 박물관이 있습니다. 아름다운 일 이었고, 그래서 나 같은 느낌이 들지 않을 내가 멋진 공원에서 산책. 많은 길을 자전거 경로. 자전거를 대여할 수 있습니다.",3,올림픽공원,12
261,Anders80,지역은 산책,"우리는 공원 산책을 할 수 있어, 괜찮은 곳이고 휴식을 즐길 수 있는 풍경. 외로운 나무도 고르는 메인 분수. 트롤리와 자전거를 빌릴 수 있었어요 diffrent 공원 입구에 있습니다.",4,올림픽공원,12
262,Jessie P,음...,저희는 차로 다녀 오... 올림픽 링을 찾지 않았다. :( 있는 것은 없을 것 같은 느낌에 그 이전 올림픽 빌리지에. 간.,3,올림픽공원,12
263,Daniel A,나는 올림픽을 하기 때문에,"그런 다음 다시 계속할 것이 많지 않지만 이 올림픽 공원의 1988 경연회. 올림픽 박물관이 있기 때문에 여전히 볼라안테나. 을 하지 않으면 자전거, 준비를 할 수 있는. 이제는 좀 2008 베이징 올림픽 이 기 때문에 많은 사이트에서 20년 이상 발생한. 가장 좋았던, 한 사람은 밤에 음식을 사랑하고, 할 수 있는 수집되어 전 세계의 음식을 했고. 할 수 있는 즐거운 저녁이 전 세계 음식의 맛.",4,올림픽공원,12
264,Gianina S,"아름다운, 하지만 tthere 의 많지","아름다운 풍경과 좋은 공원의 구조 및. 하나 또는 두 개의 박물관을 방문할 수가 있는 것이 근처에 있어서. 자전거 대여도 있다, 라고 생각할 수 있습니다 가장 흥미로운 것은 이 작업을 수행할 수 있습니다. 하지만 전체적으로, 이 경우 주변에서 많은 올림픽 공원 및 작업을 수행할 수 있어야 합니다. 다른 어떤 것도 좋지만 사진 라테스톤을.",4,올림픽공원,12
265,msmcy19,빅뱅 은 올림픽 공원,빅뱅 의 콘서트에 오 3월 2016 볼 수 있습니다. 이 곳은 걸어 다니며 사진을 찍어. 노점상들이 있기 때문에 걱정하지 않아도 배고픈 것. 이상한 이유에 대한 몇 가지 보고 택시가 택시를 잡은 후 문이 있었는데 입구에서 내렸습니다. 내가 실수로 다른 택시를 여기에 콘서트에 6pm. 재앙이었습니다. 지하철을 타고 가는 이 보다 쉽고 빠르게 출근 시간.,5,올림픽공원,12
266,Natttsss,잘 설계된 파크,"저는 스포츠 매니아들이 방문할 수 있는 올림픽 공원. 입장료는 무료이며 현대적인 예술 조각을 긴 경로. 소마 미술관 올림픽 가는 피지 (서울 올림픽 미술관) 은 가상 이 올림픽 3,000 및 비용 절감 - 돈을 낭비.",5,올림픽공원,12
267,Eva L,복잡한 도시에서 쉴 수 있는 곳,"좋은 산책, 평화롭고, 조용한 곳입니다. 너무 많은 기대는 하지 않지만, 그냥 공원, 하나도 안 해주고. 두 번 자전거를 대여할 수 있는 자동차, 그가 이미 너무 나쁜 시기를 떠나, 우리는 꼭 한번 잡으실려면.",3,올림픽공원,12
268,Ирина Ц,거리,세 번까지 있었어요. 이 공원은 기대하지 않습니다. 직원들이 롤러스케이트를 즐기기로 되어 있다고 봤을 때 직원들이 완전히 비어 있는 나를 걷다.,1,올림픽공원,12
269,r2cook,"우리가 밤비 봄 꽃, 버기를 타고 있었다!","갈 가치가 있는, 하지만 피는 봄 꽃 이나 여름철 때까지 기다립니다. 우리는 자전거를 렌트하여 두어야 하는 재미를 볼 수 있다.",3,올림픽공원,12
270,TravelBuggerTravel,"사람들을 구경하기 좋은 곳, 주변에 자전거, 및 읽을 수 있고","사람들을 구경하기 좋은 곳, 주변에 자전거, 읽을 수 있고 이불과 친구들과 함께. 음식을 작은 곳이다.",5,올림픽공원,12
271,Willem B,좋은 공원 산책 또는 조깅,"올림픽 공원은 걸어서 편안하게 즐길 수 있는 좋은 곳에 가서 죠그. 많은 현지인들도 많은 공원에서 운동을 하고 모든 시설과 같은 시설을 이용하실 수 있습니다. 게다가 성격 중 하나를 즐길 수도 서울에서 올림픽 스타디움 아키텍처를 구축할 수 있는 하나의 박물관을 방문 할 것. 또한 자전거 대여 를 들 수입니다. 저는 겨울에 생각이 많은 여름에는 공원 환경에서, 즐겁게!",4,올림픽공원,12
272,Katie C,큰 공원,"자전거 대여 할 수 있는 큰 공원이, 함께, 또는 카트를 나누어 주다. 흥미로운 조각상이 있는 정원, 호수, 넓은 방. 여기에 아무것도 할 수 있는 마음에 들지 않는 올림픽 영역 참조해야 합니다. 2개의 지하철 역이 있고 여기에 해당. 저는 잘못한 사람들을 만나서 35분 정도 걸리는 거리 타단.",5,올림픽공원,12
273,Family L,좋은,"갔을 때는 매우 깨끗했고, 이른 아침에, 거의 빈. 이 때 필요한 모든 것을 볼 수 있는 광대 한 종료합니다.",3,올림픽공원,12
274,Yoinji J,멋진 곳,"이 곳은 나쁘지 않고 아이들과 함께 가족들이 있는 호텔로 해 하루를! 저는 평일에 가는 사람들을 피하기 위해 강력하게 추천하지만 대량의 사람들은, 하지만 전체적으로, 이 좋은, 넓은, 아이들과 좋은 시간 보내. 불행하게도 아이들을 위한 놀이 구조가 되지 않을 것, 나쁘지 않은 곳이지만 자전거나 롤러 블레이드 정도.",4,올림픽공원,12
275,Foonglin,야외 아이스 링크,"우리 가족도 즐거운 야외 아이스 링크. 저희가 간 평일 오후, 덜 붐비는 어떤 의미. 한 사람당 비용만 2000Won 의 항목을 포함하는 좋은 시간 1 1/2 스케이팅 신발 & 타모드실행중. 해 사용할 수 있는 시간. 주변 환경은 아주 아름다운, 너무. 자전거가 있는 가족들, 보이는, 하지만, 우리는 어쨌든 봐 끝나는 어두운 시간이 5pm 아이스 스케이팅을 할 정도. 또한 2분 내에 올림픽 박물관 입구에서 왼쪽을 향해 걸어. 입장료는 무료. 마지막 입구는 17:30 여행팁: 몽촌 토성",5,올림픽공원,12
276,Basspirate,고 할 수 있는 공원,"우리는 수많은 물건을 발견할 수 있는 공원. 결혼 사진 촬영을 하는 것도 본! 이 지역은 바이킹, 하이킹 지역 음식 / 쇼핑. 이 멋진. 한국에 있는 것처럼, 더 할 수 있는 쓰레기통에.",5,올림픽공원,12
277,Joel D,좋은 방법을 몇 시간...,"이 곳은 좋은 산책로 (또는 자전거를 빌리지). 좋은 공원 이다. 좋은 조각상 및 음식점. 정말 큰 문제 아닙니다 큽니다. 이 많은 역사가 있는 게임이 기 때문에 여름 동안 1988, 수는 있지만 모든 건물이기 때문에 정말 아무 것도 할 수 있는. 주변에 보면 큰 스타디움. 공원에서 산책을 좋아한다면, 이 호텔입니다. 올림픽 착체의 여행을 한다면, 그 일이 지.",3,올림픽공원,12
278,Roxanne S,할 수 있는 신선한 공기,만약 이 곳을 방문할 때... 가장 편안한 신발을 신을 수 있습니다... 걸어갈 수 있는 이름이 게임 이...,4,올림픽공원,12
279,Sam Kim,가장 큰 이유는 좋은 곳에 살고 있는 송파,이 거대한 공원이 잘 되어 있고. 항상 방문하기. 부동산 가격에 할 수 있는 공원이 많은 곳이기 때문에. 가장자리에 있는 커피숍이 있어서 정말 좋았어요.,4,올림픽공원,12
280,Mandyseo,산책하기 좋은 곳,하나의 야외 조각 공원에서 봐야 관광명소 (소마 미술관 등에서) 를 포함한 전 세계의 유명한 예술가들의 조각과 200 개 이상의 치받이의.,4,올림픽공원,12
281,Fairuz N,방문 가치,"저는 여기 추천하는 하루, 큰 공원이 있고 너무나 많은! 토요일에는 많은 일들이 일어나고 - 모임, 있어서, 에어로빅 - 활기 넘치는 곳 이다.",4,올림픽공원,12
282,Martin H,비오는 올림픽,"아름다운 공원. 심지어 비가 내렸습니다. 할 가치가 있는 여행. 올드 스타디움 계속 사용하고, 명백하게 하기 위한 대부분의 콘서트. 공사 중에 공원에서, 여전히 많은 멋진 뷰를 제공합니다. 거기에 가려면 지하철을 탈 경우 먼저 거대한 광장에 위치 싱출구가 계속해서 올림픽 타는 불.",4,올림픽공원,12
283,Jacmac00,방문해야합니다,"올림픽 공원을 방문하는 동안 물에 한국에서 최근에 비즈니스, 시간이 아깝지 하기도 한 일을 역사적인 장소",4,올림픽공원,12
284,OLK1974,조깅을 위한 완벽한,"저는 서울에 머무는 동안에 사용할 수 있는 올림픽 공원 / 작업 시. 정말 좋았어요. 많은 경로, 기복. 전체적으로 아주 좋은 곳이라 걸어서 방문.",5,올림픽공원,12
285,FandD2014,게임에서 같아 1988,"이곳은 광대 한 잠실 지역과 가깝습니다. 8 행 지하철 역을 했는데 몽촌 토성 (mongchontoseong). 1988 위해 올림픽 게임, 깃발 도 아직 가지는 모든 볼라안테나. 공원, 호수 솜씨로 조경을 하고, 현대적인 조각상과 폭포, 또는 자전거 타는 - 좌석과 두 번 자전거를 탐색할 수 있습니다 차를 4시간 정도를 합리적인 가격. 스페이스 한시간, 갈 수 있는 장치가 하나 있었어요 대부분이 사진을 찍고 있다. 추천하고 싶어요 - 재미있고 즐거운.",4,올림픽공원,12
286,JaromChao,커플들에게 좋은 곳.,"이곳은 정말 좋은 곳에 있는 깨끗하고 따뜻하고, 수 많은 연인 들, 오래된 남성 또는 여성, 및 개 childern. 걸어서 갈 수 있는 가장 활동, 하이킹을 갈 수 있지만. 를 방문할 수 있는 희망과 사랑하는 사람.",5,올림픽공원,12
287,Lee K,올림픽 공원은 1988,걷다 보면 시 가장 먼저 볼 수 있는 거대한 역은 올림픽 퍼게이트를. 이 공원은 아주 깨끗했습니다.,4,올림픽공원,12
288,Nikki W,공원 화창한 날,"은 좋은 게 대한 정보를 올림픽 공원 에서 게임, 벽, 바닥.",3,올림픽공원,12
289,calliesk,아름다운 공원,위대한 올림픽 공원 을 방문하는 올림픽 공원 - - 저는 몇 가지 큰 조각 공원 -- 보고하고 정말 인상적 입니다,5,올림픽공원,12
290,Paul K,큰 공원!,"이 곳은 모든 것이다. 작은 강, 레스토랑이 근처에 있고, 지하철 역, 버스 정류장, 잠실 근처인, 거대한 로즈 가든에... 야외 풍경은 아름답고 깨끗하고! 하루에 할 수 있을!",5,올림픽공원,12
291,956marciw,방문 할 때 이 다!,아주 좋은 공원을 방문. 할 수 있는 아주 좋은 곳이 많은 시간을 보낼 수 있는 소풍. 정말 아름다운 야외에 있는 작품은.,5,올림픽공원,12
292,Bridgewaterboy,기회가 된다면 한국 정원 스타일 보기,"첫 번째, 정원이 이 공원을 좋아하지 않는다면 지루하고 오지 않는 시간 낭비가 스테이징될 것입니다. 한편 이 같은 경우는 정원을 즐길 수 있는 사이트를 방문하는 한국의 정원이 요소에 스타일. 걸어야 할 것이 과거로 내려오면 입구 영역 주위에서 시계 방향으로 물과 돌 다리 건너편에 있는 호수. 까지 오는 깊이 있는 고고학 에 따라, 소속 2000여 주민들 로부터 검색 경로 가서 몇 년 전에 갈 수 있는 언덕, 원래 성루 마을이 었습니다. 찾을 수 있는 길을 따라 꽃의 아버 및 필드 (늦은",5,올림픽공원,12
293,Margaret L,조용하고 아름다운,제가 주었고 대부분 비어 이다. 조용하고 아름다운 이는 정말 마음에 들어요. 이 시간을 걸어 다니며 여행의 가치가 있다. 입구에는 큰 기념물을 놓쳐서는 안된다.,4,올림픽공원,12
294,thehelpfuldad,한국 야구 게임,본 야구 경기 에 폭발 이다. 아마도 서울 여행의 하이라이트. 한국 야구 하는 우리 보다 훨씬 더 재미 있기 때문에 할 수 없는 팬 에 앉아서 자신의 춤을 추는 모든 배 전체가 응원 입니다. 최고!,5,올림픽공원,12
295,Nicharee W,더 아무것도,"매우 넓은 지역에 있는 휴식을 취하기에 특별한 건 없고. 버스를 타고 자전거를 빌릴 수 있는 공원 내 를 구경. 그러나, 이 경우에는 매력적인 장소를 방문할 때 를 기대.",3,올림픽공원,12
296,AutumnRain1988,크고 멋진 공원,"정말 크고 멋진 공원이 있어서 좋은 정보가 아니라 쓸게 없다. 이는 고려하지 않을 곳이지만 "" 기나발루에 "" 볼 만 하면 주변에. 체크 아웃할 수 있는 올림픽 박물관 이 있는 동안 (지금). 사이드 노트: 이는 아주 예쁜 공원 가을 때 색상 변경하여.",4,올림픽공원,12
297,Sang M,"거대한 공원, 할 수 있고 하루에!","여기에 서울에 머무는 동안 콘서트에 갔다. 이 공원은 거대한! 충분한 시간을 허용하지 않기, 꼭 일찍 도착해서 다음 시간에 많은 활동입니다.",5,올림픽공원,12
298,mereytan,매혹적인 공원,"이 기간 동안 4월에 제가 갔을 때 벚꽃을 매그놀리아 /. 저는 호텔 올림픽 파크텔 에서, 앞에 있는 공원. 호텔 방에서. 매일 아침 일어나는 화려한 일출. 저는 자전거를 빌리고 주위에 순환 전체 공원. 서식지 의 응집 물 에 대한 코코, 다람쥐 토끼도 보고 주위를 황급히 달려. 올림픽 박물관 도 가봐야 할 보석 같은 곳 - 방문. 이 중에서 많은 사람들이 젊은 이전 제공하는 zhangijiajia",4,올림픽공원,12
299,geographyguy_11,내가 제일 좋아하는 서울,"나는 충분한 정보를 잘 하지 못하고 올림픽 공원. 꽤 먼 역을 첫 번째 단계를 monchongtoseong 역과 증가 해서 세계 최대의 평화를 엿볼 수 있는, 한 번 표시된 올림픽 떼, 주변 가로수 의 플래그에 해당 국가의 올림픽 1988 수신고. 저는 더 이상 나라의 깃발 아리마를 너구리 있는 이벤트에 대한 현재 읽지 긴 기념관 옆에 있는 아름다운 호수의 게임 1988, 맨 위에있는 아름다운 분수가 있는 시간에 와서. 광범위한 공원이 아름답게 관리되어 있으며 고대 성벽 위를 따라 산책로",5,올림픽공원,12
