,u_id,title,review,u_rate,place_name,p_id
164,COPYnWRiter,엄청난 크기의 복합 공원,"그도 그럴 것이 올림픽 게임이 끝나고 남은 시설이니 규모가 크다. 한쪽은 몽촌토성으로 백제의 유적지이기도 하다. 사계절 모두 아름다워 주민들의 좋은 쉼터가 된다. 콘서트 등 대규모 행사도 자주 열리고, 미술관, 박물관도 있고, 주민들이 와서 즐기는 문화공간도 있다.",4,올림픽공원,12
165,블루밍나디아,"가볍게 산책, 소풍에 좋은곳","가까워서 종종 산책과 소풍으로 방문합니다. 공간이 넓어서 운동하기에도 좋은곳입니다. 연인들끼리 걷기도 좋고, 특히 스냅사진촬영이 많더라고요",4,올림픽공원,12
166,묘롱이,자주가는 산책로 에요,"서울 시내에 있는 공원중 가장 큰 공원이에요. 내부에 공연장, 체육관, 수영장 있고요. 주차장이 커서 차가지고 오셔도 괜찮은 곳입니다. 가족단위로 바람쐬기 좋은곳이에요",4,올림픽공원,12
167,Moonkyu K,운동하기 좋은 공원!,"각종 경기(본 적은 없지만), 공연을 할 수 있는 커다란 공연장과 경기장들이 가득하고 성내천을 둘러 수많은 사람들이 운동을 하는 정말 멋진 공원입니다. 낮에는 가족이나 연인단위의 사람들끼리 데이트를 하거나 피크닉을 즐기고 밤에는 운동하는 사람들로 가득합니다. 밤 10시가 지나면 메인 문 몇개를 제외하고는 작은 문들은 폐쇄하니 시간과 열리는 문을 체크하시는 것도 좋을 것 같습니다.",4,올림픽공원,12
168,znzl,후기,공원이 크게 조성되어있어서 시민들이 이용하기에 좋고 공연이나 행사를 자주 해서 가볍게 즐기기 좋습니다.,4,올림픽공원,12
169,2875rosa,도심속의 넓은 공원입니다.,송파구에 위치한 넓은 공원으로 날씨 좋은 날 피크닉 가기에 좋은 곳입니다. 아주 넓어서 다 돌아다니기에는 좀 힘들수 있어요,4,올림픽공원,12
170,hayul13,서울에서 가장 멋진 공원,"잔디가 많아 아이들이 뛰어놀기에도 좋고, 봄 여름 가을 언제든 아름다운 꽃과 함께 할 수 있어 좋은 것 같아요. 가끔씩 펼쳐지는 야외 공연과 맞물린다면 더 즐거운 산책과 피크닉을 즐길 수 있답니다.",4,올림픽공원,12
171,울끈불끈차차차,좋아요~~,호수도 넓고 공원 자체가 굉장히 커요!!ㅋ 입점해있는 레스토랑도 깔끔하고 요즘엔 웨이팅이 엄청나긴 하지만 한식부페도 생겨서 자주 가네요~~ 학창시절 소풍장소로 갈때는 너무 싫었는데 요즘은 가고싶어서 찾아갑니다ㅎㅎ 자전거 대여도 되고 데이트하기에도 좋아요!,5,올림픽공원,12
172,Ho Sang Y,엄청 넓어요!!,걸어도 걸어도 벗어날수 없을 정도로 커요!! 산책코스도 등산로처럼 단조롭지 않게 잘 되어있고 웨딩촬영하러 많이 올 정도로 예쁜곳도 많아요ㅎ,5,올림픽공원,12
173,SONGHEE L,서울시내에 이렇게 넓은 공원이 있다니,"광대한 규모의 공원이에요. 몽촌토성이라는 백제 문화제와 함께 어우러져 있어요. 그래서 안에는 작은 전시관도 있고, 백제시대 목책이나 토성을 볼 수도 있어요. 자전거 대여해서 한바퀴 둘러보기도 좋고요. 애들 데리고 피크닉하기도 정말 좋아요. 5,6월에는 장미정원이 정말 아름답구요. 가을에는 들꽃마루도 정말 아름다워요. 사진찍기도 정말 좋습니다.",5,올림픽공원,12
174,renahoony,올때마다 좋아요!,올림픽공원은 다른 공원보다 커서 좋습니다! 사람이 많아도 그렇게 복잡하다 생각이 들지 않기 때문이죠 :) 올림픽공원의 매력은 봄에 제대로 느낄 수 있습니다. 이곳저곳 사진 찍을 장소가 많아 남자친구와 사진만 몇 십장 찍었답니다 ㅎㅎㅎㅎㅎㅎㅎㅎ 다만 자전거 타고 쌩쌩 달리시는 어린이들이 있어 놀랐어요 ㅠㅠ 그외에는 정말 좋은 곳입니다!,5,올림픽공원,12
175,재영 윤,좋아요 꿩도 있는거 같아요,꿩도 있는지 꿩소리를 들었어요. 매우 넓고 깨끗하고 조성이 매우 잘 되어 있어서 산책하기에도 좋고 사진찍기에도 좋아요 그 안에 미술관도 있고 키즈카페도 있어서 하루종일 시간보내기에도 부족함이 없어요.,4,올림픽공원,12
176,Juhee K,나홀로나무가 멋있어요,올림픽공원에 방문할땐 반드시 좋은 카메라가 필요해요. 사진을 찍으면 정말 예술로 나와요..,5,올림픽공원,12
177,nadajin,엄청커요,"가끔 공연도 열리고 산책,보드,자전거 등등의여가활동하기 좋은 곳입니다.운동하다 지칠정도로 꽤 큽니다.",4,올림픽공원,12
178,hellohs7,솜사탕 나무,완전 사랑하는 곳!! 자전거 타고 돌기에도~ 걸어서 느긋이 산책하기에도 최고예요. 특히 솜사탕 나무는 완전 사랑입니다!,5,올림픽공원,12
179,성복동,넓은 공원. 편한 신발이 필요해요.,넓은 공원. 매우 넓으니 시간이 없으신 분들은 호수 쪽 주변을 걷는 것을 추천합니다. 눈이 오면 더 멋있어요. 식당과 카페들이 주변에 있으므로 근처에서 식사하셔도 됩니다.,3,올림픽공원,12
180,주빈,교통이 편해요,올림픽공원 가족끼리 소풍가면좋은곳 연인끼리도 산책하면서 커피한잔의 여유즐기기 좋은거같아여 지하철과도 가깝고 좋네요,4,올림픽공원,12
181,yorange,요맘때 방문하면 노란 코스모스!!,올림픽 공원에는 여러가지 식물들이 있지만 특히 가을에는 흔히 볼 수 없는 노란 코스모스가 절경입니다~ 멀리 꽃구경 가기 힘드실때 가족과 나들이로 추천합니다!,5,올림픽공원,12
182,shigemura3,훌룡해요.,깻끗합니다.그리고 아름답고 각국의 사람들이 와서 다양한 문화의 부럽습니다. 우리나라는 역시 가볼곳도많고 모든사람의 놀이공간이라고 생각합니다.,3,올림픽공원,12
183,reembom,벚꽃산책,여기저기 흐드러지게 핀 꽃이 아름다워요. 가까운 곳에 자연을 볼 수 있는 곳이 있는데 생각보다 자주 못가게 되네요. 북문쪽에 널찍한 음식점과 카페들도 많아요.,5,올림픽공원,12
184,코코,올림픽 공원,"올림픽 공원은 넓고, 잘 가꾸어져 있어 가족들과 나들이 하기에 더 없이 좋은 장소입니다. 근처에 까페와 맛집들도 있고, 또 공원안에서 자전거를 타기에도 훌륭한 장소입니다.",5,올림픽공원,12
185,Dong-geon L,언제나 만족,"살기 좋은 ‪우리동네‬, 올림픽파크 덕분‬ 아이들 뛰어놀기도 좋고, 행사도 자주하고, 돗자리 하나만 있어도 굳~",4,올림픽공원,12
186,Lunar7,넓은 들판을 볼 수 있는 곳,서울에서 보기 어려운 넓은 벌판을 볼 수 있는 곳 입니다. 하늘이 파란 날이나 석양이 질때 가면 특히 아름답습니다.,5,올림픽공원,12
187,kkh2254,한국 대표 공원,"산책하고 자전거 타기 좋은 공원.. 행사도 많아 여러가지 참여할 수 있어요. 계절밥상, 커피빈, 딸기가 좋아 등의 편의시설도 갖추고 있어 편리하고 소마 미술관 관람한 후 산책도 좋아요",4,올림픽공원,12
188,victoria,산책하기 좋은곳,"여의도 공원보다 넓고 인라인 타기 좋은 곳이에요. 슬라럼이나 특이한 기술 하기 좋은 곳들이 곳곳에 산재해 있고 산책로도 크고 넓은 편이어서 가족 단위 소풍객이 많은 곳이기도 하죠. 처음에는 한쪽 부분에서만 있어서 이렇게 큰 줄 몰랐는데 정말 넓더라구요. 주차장도 잘 되어 있고 스틱 하키 하는 분들도 있고 자전거 타는 아이와 어른들도 있고, 보드타는 분들도 많이 볼 수 있는 곳이에요. 하지만 그런거 없이도 연인끼리 산책하기 좋고 벤치도 많이 있어서 산책하다 앉아서 이야기 나누기 좋은 곳입니다.",4,올림픽공원,12
189,darkjedi73,조깅하기에 좋은 장소,"공원으로 사용한다면 산책이 제격이겠지만, 아침에는 조깅을 할 수 있는 장소로 삼을 수 있다. 오래 전부터 이곳을 눈여겨본 이들은 이 공원이 의외로 넓고 편리하다는 사실을 잘 알 것이다.",4,올림픽공원,12
190,레인트리,가족과 나들이하기 좋은 곳.,"넓은 공원에서 산책도 할 수 있고, 백제 시대의 토성도 볼 수 있으며, 갖가지 전시회가 열려 다양한 경험을 할 수 있는 곳이다. 가족끼리 산책하기 좋은 곳.",4,올림픽공원,12
191,eoto34,좋아요 !!,공원 좋아요 뛰어놀기도좋고 근처커피집도 많이있어요! 자전거나 보드타면딱좋은곳이네요 !!!!,5,올림픽공원,12
192,이안팍,넓어서 좋다,정말 넓다 인라인 타는 사람이 많고 자전거 대여해서 한 바퀴 돌 수도 있다 주말에 가족 산책하기 좋은 장소이다,5,올림픽공원,12
193,seongjins2015,따로 갈계획없이 봉사활동하러 잠깐 들름.,따로 갈계획없이 봉사활동하러 잠깐 들름. 올림픽 공원 역시 지하철로 이동 편리함. 넓디넓은 공원에서 친구 여럿 모여 런닝맨 한판!,4,올림픽공원,12
194,Doogangs,이젠 어느덧 옛날 이야기가 된 곳,가볍게 가족들끼리 보내기 좋은 곳 여러공연장과 일부종목의 스포츠관람이 가능하지만 올림픽공원이라는 특별함은 느끼기 힘들다,3,올림픽공원,12
195,NiceBob,걷기 아주 좋은 곳,예술적인 조형물이 군데군데 많이 있습니다. 장소는 아주 넓어서 주변을 걷는데만 2-3시간이 걸립니다. 내부로 들어오면 경기장 들이 많이 있는데 조용히 보낼 수 있는 곳이라고 생각합니다. 또한 소마미술관도 있어서 미술에 취미가 있다면 관람하기에도 좋은 곳이라고 생각합니다.,4,올림픽공원,12
196,seunghoonl627,"엄청난 넓이, 다양한 시설","올림픽 기념관, 소마미술관, 백제박물관 등 올림픽공원 내에서 즐길 거리는 무궁무진하다. 물론 잔디밭에서 뒹굴거리기만해도 충분히 즐겁다. 하지만 여름에는 상당히 더워 산책도 힘들 듯.",4,올림픽공원,12
197,fairy551,올림픽공원,올림픽 공원은 집근처라 자주 갑니다. 환경조성이 너무 잘 되어있고 주변에 먹거리도 좋습니다. 꼭 한번 놀러가세요.,5,올림픽공원,12
198,abulapia,여유롭고 넓은 공원,넓고 여유로운 곳이다. 여러군데 문을 중심으로 건너편과 주변에 맛집과 카페들이 풍성하다. 공원 자체의 볼거리는 많은 편이 아니다. 남이문에 한성백제 박물관을 빼놓지 말자.,4,올림픽공원,12
199,ledzpl,산책하기 좋은 올림픽 공원,반려견이나 아이와 함께 산책하기 아주 좋은 곳 입니다. 공연이나 다른 이벤트 등 볼거리도 있구요. 그늘이 많지는 않아서 여름에는 모자나 선크림이 필요합니다.,3,올림픽공원,12
200,Jung,가족 공원,"다양한 행사와 문화공연, 넓은 공원길을 산책하다 보면 저절로 송파구에 살고 싶어집니다. 가족들과 산책하기 좋아요.",4,올림픽공원,12
201,redinoct,올림픽 공원 계절밥상에서 식사후 산잭하기 좋은 곳.,올림픽 공원내 계절밥상에서 식사을 하고 공원내 광장에서 아이들이 킥보드를 탔다. 가을에는 올림픽공원에서자전가나 스케이트보드 등을 타는 사람이 꽤 많다. 산책하기 좋은 곳이다.,4,올림픽공원,12
202,쏘쏘양,올림픽공원,"깨끗하고 넓음. 역에서 가까움 (몽촌토성역, 올림픽공원역) 돗자리를 가지고 소풍하기에 알맞음",4,올림픽공원,12
203,ChaeWoo Lim,여러가지 볼거리와 산책을 즐길 수 있는 공원,"올림픽 공원은 서울에 동남쪽에 있습니다. 8호선 몽촌토성역, 5호선 올림픽공원역이 있습니다. 드넓은 공원에 호수, 잔디, 박물과, 체육시설 등이 있으며 체육대학도 옆에 있습니다. 평일에는 소풍이나, 단체활동으로 많이들 찾으며, 주말이면 사람들이 피크닉 장소로도 활용됩니다. 드마라 촬영으로도 유명한 장소들이 많으며, 웨딩사진도 이곳에서 많이 촬영을 합니다. 복잡한 시내관광에서 벗어나 자연과 함께 산책하고 나만의 시간을 갖는것도 괜찮을것 같습니다.",5,올림픽공원,12
204,진섭 안,올림픽공원,올림픽공원은 서울 송파쪽에 위치한 대한민국 대표 공원입니다. 드넖은 부지에 전시장이며 운동장들이 위치하고있어 피크닉 가기에 안성맞춤입니다.,4,올림픽공원,12
205,xiapapa,서울 동쪽에서 산책하기에는 이만한 곳도 없어요.,"제가 올림픽 공원 맞은편에서 십년 넘게 살았었습니다. 해서 올림픽 공원 짓는것도 보고 첨부터 오래 돌아 다녔는데요. 고궁이라던지 박물관이 서울 도성 안쪽에만 있고, 서울 동쪽에는 롯데월드 말고는 딱히 랜드마크랄게 없는데 올림픽 공원을 추천할 수 있겠습니다. 주말에는 주차가 좀 힘든데 기왕이면 대중교통(전철이면 '몽촌토성역'에서 내리시고요)을 이용하는게 좋구요. 공원 안쪽에는 광장 근처 말고는 먹거리를 파는 노점이 없으니 마실 물과 작은 돚자리 정도는 챙겨서 움직이면 좋습니다. 너무 넓어서 걷다",5,올림픽공원,12
206,sang cheol h,걷기 좋은 공원,올림픽 공원은 규모가 상당해서 걷기만해도 꽤 시간이 걸린답니다. 가족과 친구와 또는 연인과 함께 걷기 좋은 곳이라 생각해요 주위에 식당들과 카페들도 많아서 먹거리 걱정도 없네요,5,올림픽공원,12
207,채예지,"가족, 연인을 위한 최고의 휴식처","올림픽공원은 사계절이 아름다운 공원입니다. 평화의 광장 주변은 자전거나 인라인스케이트를 타기 좋고, 소마미술관 주변은 돗자리 펴고 한가하게 쉬기에 좋고, 88잔디마당 주변은 아이들과 함께 공놀이도 하고 뛰어놀기에 좋고, 올림픽공원을 방문할 경우는 먼저 맛있는 음식과 돗자리를 꼭 준비하세요. 지하철 8호선 몽촌토성역에 내리면 바로 평화의광장이 나오구요. 자전거를 타고 와도 너무 좋습니다.",5,올림픽공원,12
208,민영 김,넓고 탁트인 공원!,"동호회 활동, 서울시 체육회에서 주관하는 명산 트레킹으로 인해 올림픽 공원을 가보았는데요~ 공원 한바퀴 돌면 시간이 꽤걸릴 것 같더라구요~ 넓어서!날씨 좋을때 돗자리 가지고 와서 잔디밭에 앉아서 구경도 하고 바람도 쐬고 좋을거 같아요! 중간 중간 편의점이나 치킨집, 카페가 있어 편의시설도 꽤 잘되어있는 편이었던거 같습니다~",4,올림픽공원,12
209,flash52,여러가지 볼거리를 갖춘 이곳!,"이곳은 정말 많은 사람들이 방문하는 곳 같다. 외국인들도 포함해서~~ 올림픽공원은 남문 동문 서문등등 여러 방면으로 출입이 가능하며, 산책하기에도 안성맞춤!! 또 이곳에는 여러가지 볼거리도 마련 되어 있어 가족끼리 와서 주말 시간을 보내도 좋은 곳인것 같다. 가까우면 자주 자주 와서 산책하면서 시간 보내도 좋은 곳 같다^^",4,올림픽공원,12
210,774nan,2015년 새해 첫날 해맞이 행사,작년부터 새해 해돋이 행사에 참여 ...각종 행사와 떡국을 맛볼수 있는 기회를 얻을 수있다..사람들이 상당히 많이 참석하기에 어린아이를 동반할때에는 조심해야 한다.,4,올림픽공원,12
211,라파,바람쐬기 좋은 곳,"어렸을 때 학교에서 그림그리러 많이 갔던 곳인데요 다시 가보니 여유있고 좋더라고요. 친구나 애인과 앉아 얘기하기 좋은 곳이에요. 가족단위에 사람들도 많이 오고, 탁 트인 곳이어서 좋습니다. 특별할 게 없기에 더 좋은 곳입니다.",4,올림픽공원,12
212,goodtripgo,한가롭게 산책하기 좋아요,서울 시내에서 산책하기 좋은 곳 중의 하나예요.. 계절마다 다른 주변 경치도 너무 좋구요~~ 특히 가을에는 파란 하늘과 너무 잘 어울리구요 도시락 싸와서 먹으면 정말 최고예요,5,올림픽공원,12
213,PeterJeong,주말에 산책하기 좋은 공원,"입구는 스케이트보드나 신기한 운동기구를 가지고 와서 연습하는 사람들이 있어요. 안쪽으로 들어가면 넓은 잔디밭과 운동할 수 있는 공간이 있습니다. 잔디밭에 누워서 책을 보거나 치킨을 시켜먹거나 하면서 주말 오후 시간을 즐기기 좋아요. 돗자리 깔고 있으면, 배달음식 전단지는 알아서 누군가가 나눠줍니다. 가끔씩 음악회 등도 하는데, 굳이 음악회에 참가하지 않아도 잔디밭에 누워있으면 은은하게 소리 들리는 것도 좋습니다.",5,올림픽공원,12
214,400성욱김,경치좋은 공원,한바퀴도는데 약 5키로정도로 기억. 외곽한바퀴는 평지로 되어있어 운동하기좋고 안쪽은 구릉도 있고 잔디밭도 있어 산책하기좋음,5,올림픽공원,12
215,동네복,도심에서 만나는 숲과 조형! 가장 공원다운 곳,"올림픽 공원은 평화문, 공연장으로 알려져있지만 작은 숲, 조각품, 숨겨진 경치가 아름다운 곳이다. 사진을 못올려 아쉽다",5,올림픽공원,12
216,kazunet,한겨울에는 힘들어요.,8호선 몽촌토성역을 나오면 바로 눈앞에 평화의 문이 보입니다. 원내는 아주 넓어서 산책하고 있는 사람들이 많았습니다. 역시 영하의 날씨에서는 천천히 볼 수가 없어서 다음에 따뜻해지면 천천히 시간들여서 보고 싶습니다.,4,올림픽공원,12
217,juuu4,콘서트,"제일경기장에 콘서트 보러 갔어요. 항상 택시타고 갔는데, 지하철 타보니 생각만큼 멀지 않고 편리했어요. 끝난 다음에 회장입구에서 호객행위하는 불법 택시에는 꼭 주의하세요. 대로에 지나다니는 택시를 잡는 것도 그럴려는 사람들이 많기 때문에 운에 달렸어요.",3,올림픽공원,12
218,GoChangingman,공원내 경기장에서 개최된 콘서트 갔었어요.,"모KPOP 콘서트가 있어서 작년에 이어서 다시 보러 갔어요. 이 공원자체는 아주 넓고, 지하철 출입구 근처에는 편의점이나 식당이 있어요. 단지 콘서트가 있는 날은 혼잡하기 때문에 주의하세요. 콘서트가 개최된 홀은 한국에서는 큰 홀 중에 하나지만 일본의 돔에 비교해보면 작아요. 일본무도관을 좀 작게 만들어 놓은 느낌이라, 아주 잘 보여서 오히려 만족했어요. 또 여기서 콘서트한다면 꼭 다시 가고 싶은 생각이 들게 하는 곳이에요.",5,올림픽공원,12
219,idisnot,사시사철 다른 모습으로...,"집이 근처인지라 자주 갑니다. 사시사철 다른 모습을 보여줌과 동시에 다양한 사람들을 수용하는 넉넉한 포용력과 넓은 공간, 그리고 공원과 함께 자라난 나무들이 편안함을 느끼게 해 주는 곳입니다.",5,올림픽공원,12
220,tastebeer,콘서트 보러...,"이 공원에 있는 체육경기장에서 열리는 콘서트 보러 2번 정도 갔어요. 지하철 올림픽공원역을 나오면 바로 공원이에요. 식당이나 편의점 등도 있고, 아주 넓어서 지역 주민들이 한가롭게 산책하는 모습도 볼 수 있어요. 단지 여기서 열린 콘서트가 2번 다 밤 11시쯤에 끝나서, 관객들이 전부 지하철역에 몰려가서 승강장이 사람으로 넘쳐흐르는 광경을 보게 됐어요. 지하철역 입구 근처에 택시도 많이 대기하고 있으니까, 거리가 멀면 택시 타는 게 좋을지도 모르겠네요.",3,올림픽공원,12
221,nldogbert,방문 기록,"올림픽 개최 지역은 서울 올림픽 때 기본 보기위해 해당. 많은 역사와 정보 및 올림픽 우승자. 좋은 시간을 보내고 하루 반나절. 근처에 롯데월드, 그래서 좋은 아이디어를 모두.",4,올림픽공원,12
222,Kezza2916,올림픽 공원 이 빛난다,"이 공원은 꼭 봐야 하는 모든 관광지. 조각 상어들은 아름답고 다양한 사람의 예술적 취향을 충족. 정원은 잘 - 유지됩니다. 박물관 등을 볼 수 있는 오픈하지 않은 월요일 되지 않은 다른 사이트로 이동한 것이지만, 저는 꼭 한 사람들이 다! 멋진 곳!",5,올림픽공원,12
223,yufliu505,시간이 있다면 좋은 경험,"이 공원은 조금 떨어진 곳. 저는 홍대에 있을 우리는 기억하고 있습니다. 하지만, 이 때문에 조용한 곳이 좋은 산책이나 자전거를 타고 거리를 벗어남 입니다. 많은 사람들이 볼 수 있어서 좋은 토지 의 활용 위해 이전에 수 있는 최신 올림픽 관련 뉴스를 듣고 전혀 사용하지 않거나 있었다. 제가 추천하는 자전거 이 기 때문에 너무 큰 지역 입니다.",5,올림픽공원,12
224,Izzy169,축제!,"저는 포스터를 본 재즈 페스티벌이 다. 거대한 군중 을 봤을 때, 우리는 매우 행복 했습니다. 휴식을 취할 수 있는 평화로운 곳이. 콘센트에 쓰레기가 놓여 있다. 그래서, 우리가 할 수 있는 축제!",5,올림픽공원,12
225,LaciG66,아침은 아주 좋은 공원,"서울에 처음 에 있는 일반적인 관광 명소들이 하고, 서울에 있는 올림픽 공원 에는 제일 좋은 곳이었어요. 이 떨어져 있는 조용한 오아시스 도시 서울 파빌론의 제공합니다. 이 인상적인 입구 에 있는 세계 평화를 놓칠 수 없는, 특히 밤에 아이들과 함께 부모님 플라자 칠 때 자전거 연 에너지. 작은 호수가 좋은 곳을 볼 수 있는 스토리지 시스템의 새 아침이나 시민 운동. 하이킹 경로가 풍부한 노인 이 함께 즐거운 하이킹을 아침 산책 나갑니다. 경우 의 분주함에서 벗어나 및 지역 과 관련된 사람들,",5,올림픽공원,12
226,amooali,좋은 곳,"올림픽 공원, 올림픽 개최 장소에 지금 의 우리를 생각 나게하는 서울 국립 그라운드.",5,올림픽공원,12
227,arapower,"즐거운 산책을 하고, 많은 곳 이지만, 바로 걸어 들어가면","우리가 가는 길에 공원을 가로지르는 롯데몰 과 전망대. 재미는 있었지만 안 보고, 길에 다른 것들을 쉽게 통과하여.",5,올림픽공원,12
228,429Happy,가장 즐거운,구조가 매우 인상적이었어요. 놀라운 조각들이 방문할 만하다. 호수 주변이 매우 포토 제닉.,5,올림픽공원,12
229,yipjcs88,큰 공원 은 산책,"올림픽 공원 에서 그리 멀지 않은 시내와 지하철 을 통해 쉽게 액세스할 수 있도록 지원합니다. 가장 눈에 띄는 부분은 입구에서 한 콘크리트 구조. 저도 4월 초에 매그놀리아 경관을 꼭다발과. 다른 공원에 있었다 현세 의. 굉장히 넓은 공원, 좋은 긴 거리.",4,올림픽공원,12
230,paul d,디자인은 생각 …,". 분명, 주어진 이유를 작성. 많은 사진을 찍을 작품에 잘 배치되어. 아주 인상적인 스타디움 (스타디아). 좋은 몇 시간 거리 - 자전거도 빌릴 수 있습니다.",5,올림픽공원,12
231,Amy P,위대한 역사 의,이것은 정말 좋은 위치의 올림픽 1984 볼 수 있습니다. 우리가 방문할 가치가 있는 전체 다.,5,올림픽공원,12
232,Mdecker17,훌륭한 건축 및 조경,이 공원은 좋은. 독특하고 흥미로운 조각들이 크고. 어린 아이들과 함께 가족 공원과 자전거를 타고 환상적인 연주. 많은 사람들이 주변에 걸어갈 수 있는 실행. 이 곳은 잘 관리되어 있고 나는 정말 오,5,올림픽공원,12
233,Deboracris,좋은 산책,"파크 beautiflu, 가치 및 산책 하기엔 너무나. 물이 보이고, 풀, 꽃, 잘 보존되어 있다. 플래그는 멋진 광장이나 불 에 관심이 있다면 그 의 물건.",4,올림픽공원,12
234,dlboehm912,할 정도로!,"팬에 올림픽, 마음이. 사람들이 할 수 있는 밀링 정보 제목 사진 이벤트. 올림픽 박물관 에 쓰이는 무료로 사용 할 정도로! 모든 정보는 성과 실현을, 뿐만 아니라 한국 선수들과. 입구 게이트 하는 멋진!",5,올림픽공원,12
235,Wingc633,큰 도시 녹화 지역,"큰 공원이 있어서 적어도 하루를 보내고 싶다면 투어에 공원 전체. 이 공원에는 많은 조각상, 또한 이 미술관, 큰 녹화 지역. Centeraapi 가기, 조깅, 자전거 및 피크닉 이 있습니다, 많은 카페와 식당들이 공원 내에, 피곤해 휴식을 할 수 있는 경우. 가격이 합리적이다. 저는 강력하게 권고 하기 때문에 트리 또는 공장 방문 이 없는 겨울 꽃. 나는 이 호텔에서 2017년 3월 19일. 화창한 날이 었습니다. 저는 매우 편안했고, 공간이 넓고 공기도 신선 하다. 그 날. 않고 많은",5,올림픽공원,12
