,u_id,title,review,u_rate,place_name,res_title,p_id
0,say895,쇼핑하기 좋네요,동대문역사문화공원역에서 내리면 바로 있어서 교통편이 좋네요 ㅎㅎ 안에 영화관도 있고 주변에 먹을거리도 많아서 좋아요 ㅎㅎ,4,굿모닝시티,굿모닝시티,1275
1,Yao,굿모닝 시티 빌딩에 있는 전통 한국식 스파,"좋은 점 - 값이 싸고, 마사지 테이블을 사용하지 않으면 - 깨끗해요. 수영장과 사우나는 청결하고 각 방 마다 온도가 달라요 - 50도까지 다양해요. 나쁜 점 - 안내판이 거의 한국어로만 되어 있어요. 직원들이 영어를 못해요. 정말 난감한 것은 아마 남들과는 따로 격리된 곳에서 수건으로 몸을 말릴 장소가 없다는 걸 거예요. 젖은 마사지 테이블에 사람들이 누워 등을 밀고 안마를 받는 모습은 비위생적이예요. 알몸으로 축축하고 뜨뜻한 마사지 테이블에 누워있는 거죠. 여러 사람이 알몸으로 있는 곳이",2,굿모닝시티,굿모닝시티,1275
2,りまりら,싸다!,"근처의 다른 패션 빌딩에 비교해서, 젊은이 용에다 가격이 싼 것도 있다고 생각합니다. 동대문역사문화공원역에서 제일 가까이 있는 패션 빌딩 입니다. 지하의 찜질방은 한국을 방문 할 때마다 이용하고 있습니다. 들어가 곧 왼쪽에 환전소가 있어 편리합니다. ( 환율도 좋습니다.)",3,굿모닝시티,굿모닝시티,1275
3,yosomebody,접근은 좋은데...,"동대문역사문화공원역에 바로 있는 편리한 위치에 있습니다. 밀리오레와 헬로APM과 같은 것 입니다. 나중에 생긴 패션 빌딩이여서 아직 새것 입니다. 그러나, 들어가 있는 세입자의 빈 곳이 눈에 띕니다. 또, 혼잡한 심야에 불구하고 손님의 출입이 적은 것이 신경 쓰입니다.",3,굿모닝시티,굿모닝시티,1275
4,tak824,시부야의 패션 빌딩 같은,"동대문에 있는 패션 빌딩입니다. 들어와 있는 세입자들은 시부야의 패션 빌딩을 상상하시는 게 좋으실 겁니다. 젊은이 대상의 패션 중심입니다. 아침 4시 반까지 영업하고 있습니다. 같은 패션 빌딩인 밀리오레 동대문과도 바로 근처여서, 싼 옷이나 악세사리를 사고 싶으시다면, 이 Good Morning City 근처에 오시면 좋을 거라고 생각합니다.",3,굿모닝시티,굿모닝시티,1275
5,tenjayanti,청실 홍실 기념품 점,처음으로 한국에 간다. 나는 기념품 가게를 제외하고는 내 친구 집 (한국어)에서 밤을 보냈고 모든 것이 준비되어 있었기 때문에 완전히 비어 있었다. 늦은 밤 나는 기념품 가게에 대해 한국에 살았던 인도네시아 친구에게 연락했다. 그 다음 날이 내 한국의 마지막 날이 될 것이기 때문에 그녀는 충실 홍실 기념품 가게에가는 것이 좋다고했다. 이 기념품 가게는 가게 직원이 인도네시아 언어를 아주 능숙하게 말할 수 있기 때문에 인도네시아 관광객들 사이에서 유명합니다. 한국에서의 마지막 날부터 나에게는 좋은,5,굿모닝시티,굿모닝시티,1275
6,Intrepidbirdlady,옷과 가방을 쇼핑,이 멀티 통해 동대문 위해 메가박스 내 이야기를 몰. 그들은 옷과 가방을 판매합니다. 가방을 대부분 짝퉁 가방을. 저는 쇼핑을 하러 가지 않았습니다.,3,굿모닝시티,굿모닝시티,1275
7,Sabrina_witchy,너 운이 좋다면 ....,"한국에서는 주로 몸집이 작은 아시아 크기라고 잘 알려져 있습니다. . 그러나, 그들은 또한 일상적인 여성의 크기를 수용합니다. . . 그러나 플러스 사이즈에는 자체적 인 어려움이 있습니다. 그러나 봄이 끝나갈 무렵에는 ""그냥 체크 아웃 할 수 있습니다""라는 놀라운 결과가 나왔습니다. 따라서 지난 시즌 의류에 대한 Markdowns 또는 Sale 항목이 많았습니다. . . . 습기가 많은 아시아 국가에서 왔기 때문에 우리는 겨울철에 많은 옷을 입지 않았습니다. . 하지만 천국에서 나는 10kw",4,굿모닝시티,굿모닝시티,1275
8,C. W. R.,S 또는 M이라면 좋지만 큰 옷을 가진 가게를 한 번 찾았습니다 (66-120).,"나는 항상 내가 입을 수있는 것들을 사냥하고있다. (Duh, 모두가 아닐까요?) 한국에서 12 위에 오르면 큰 물건을 찾는 것이 쉽지 않다는 것을 알고 있습니다. 아직도, 나는 쇼핑 센터를 샅샅이 뒤지고 부티크에 잠겨, 피할 수없는 ""돼지""sizuh ""코멘트, 또는 그들의 가슴을 움켜 잡고 그들의 머리를 흔드는 여성을 위해 강철을 쓴다. 에버렛! 이번에, 나는 보수를 얻었다! 땡, 땡, 땡! 1 번 게이트를 통해 들어와 우회전 한 후 완전히 내린 다음 왼쪽으로 다시 돌리면 끝까지 도달하기",4,굿모닝시티,굿모닝시티,1275
9,Sam,쇼핑,"가장 영어를 잘 해서 판매. 주변에 저렴한 쇼핑. 주로 여성의류, 이지만 몇몇은 좋은 가격에 남자 찾을 수 있습니다.",4,굿모닝시티,굿모닝시티,1275
10,Groundnuts,품질이 좋지,"구십 퍼센트 여성들이. 일반적으로 가난한 사람들 에 비해 판매 롯데 딱 맞다 품질, 그리고 바로 길 건너에 있어요. 하지만 가격은 아주 저렴하고 상점 주인 영구. 만약 저렴한 예산에, 이 곳이 있을 것입니다.",2,굿모닝시티,굿모닝시티,1275
11,aaong86,가난한,"우리는 놀라울 정도로 거의 모든 고객이 이 몰 실수로 떨어졌다. 많은 상점들이 있지만 고객. T 셔츠 비싸지 30, 000krw 수 있습니다. 다고 생각하는 이유는 고객이 없었다 했습니다. 제공할 것입니다.",2,굿모닝시티,굿모닝시티,1275
12,Donna B,방문하기 좋은 곳,"이 방문하는 아주 좋은 시간을 방문 2월 1일 2016 건물 들로 꾸며져, 한 명의 한국 여자 댄스 스테이지는, 살 수 있는 기념품을 살 수도 있었고, 근처에 작은 게이트를 광희문 합니다. 정말 좋은 볼 수 있습니다.",5,굿모닝시티,굿모닝시티,1275
13,HKeater,모든 곳과 기념품 쇼핑,"모든 곳에 기념품을 살 수 있습니다. 저렴한 옷을 입고 있습니다. 그리고 열이 한 곳에 가서 온천이다. 불가능한 고급 쇼핑몰, 그리고 더욱 흥미로운 것을.",4,굿모닝시티,굿모닝시티,1275
14,FXJIWANTO,쇼핑 장소,마지막 4월 2015 방문한 쇼핑 장소입니다. 많은 것들을 살 수 있다. 우리는 한 시간에 기념품을 구입.,3,굿모닝시티,굿모닝시티,1275
15,Steve M,일반적인 쇼핑 센터,"저, 이 쇼핑 센터는 조금은 지루한, 동대문 지역이기 때문에 많은 사람들이 할 수 있지만 몇 가지 고객들에 둘러싸여 있는 쇼핑몰 내부. 입구 왼쪽에 있는 환전소. 나는 무엇을 할 수 있는 그냥 밖으로 나가고 싶고, 다른 무엇이 있기 때문에 제가 할 수 있는 지하 몰에 있는 전혀 알 수 없",3,굿모닝시티,굿모닝시티,1275
