review,u_id,title,u_rate,p_id
"중부시장 맥주축제 9/20(금) 중부시장 맥주축제 맥주 1,000원 안주 천원 초대가수 진성 안동역에서 불렀어요 즐거웠어요 을지로4가역 7번출구",준일오,9/20 중부시장 맥주축제,5,1357
"건어물, 조기, 견과류, 젓갈류등 전국의 물품들이 한자리에 모여 있는 곳. 소매가격이라고 해도 마트나 동네 재래시장에 비해 월등히 저렴하고 품질도 좋은 제품을 구입할 수 있어서 좋습니다.",Yellow_Windmill,전국의 건어물이 이곳에 다 모였다,4,1357
"가끔 맥주안주로 좋은 건어물을 사러 중부시장에 간다. 저렴한 가격에 맛있는 건어물을 살 수 있어서 좋은 곳이지만, 주차공간이 없어 대중교통을 이용하여 간다. 시장안에 먹거리도 푸짐하여 매우 좋다.",SangChul H,중부시장,4,1357
"건어물로 유명한 시장 답게 마른오징어, 황태 등 건어물 상점이 잔뜩 있었어요. 건어물 이외에도 다른 시장에서 찾아볼 수 있는 식혜, 떡볶이 등을 파는 군것질 가게도 있고, 규모는 근처의 광장시장이나 동대문 시장에 비해서는 작지만 나름 특화된 시장이라고 생각합니다~^^",맹덕신서,서울에서 건어물을 사려면 이곳이 제격...,4,1357
"국내 최대의 건어물 시장이라고 해서, 들렸었습니다. 많은 종류의 건어물등이 판매되고 있었습니다. 잠깐 구경하는 것으로 충분합니다. 이 근처에 유명한 냉면집등이 있으므로, 겸사겸사 전통있는 재래시장을 방문있는데 의미를 두고 방문하신다면 모를까, 일부러 찾아가서 구경할 곳은 아니라고 생각합니다.",kris,건어물을 좋아하신다면...,3,1357
"김이나 과자, 호두, 건어물의 시장입니다. 30cm평방(높이 5cm)의 김이 400원이었습니다. 봉투에 든 청고추도 50엔 이었습니다. 상당히 가격이 쌉니다. 아몬드와 호두도 팔고 있습니다.",りこ298180,마을 사람이 가는 시장입니다.,3,1357
"아쉽지만 일요일에 갔기 때문에 열리 있느 가게가 별로 없었습니다. 김,한방, 녹두당면, 대추등의 건물(말린식품)을 팔고 있습니다. 과자 등도 있었습니다. 벌레도 팔고 있었습니다. 일본어는 별로 통하지 않는 듯합니다. 지역의 느낌이 느껴져 좋았습니다.",りこ298180,건어물이면 이곳,4,1357
"인쇄실이 늘어선 거리에서 가구 도매점 거리를 지난 곳에 있는 해산물이 메인인 시장. 아침에 들렀지만, 관광객은 없다. 일하고 있는 사람들도 큰소리로 장사 하지 않고, 멸치나 미역 등이 비좁게 늘어져 있었다. 어느 정도 전문지식이나 눈썰미가 없으면 괜찮은 물건을 고르기는 어려워 보였다. 분명 히타카산 미역 같은 산지 등의 뭔가 다른 것이겠지 하고 생각하며, 아이들과 구경하며 즐겼다. 맛있어 보이는 미림말림을 산 가게에서 가게주인이 아이들에게 마블 초콜릿를 같이 서비스로 줬다.",shirishiri,해산물 도매상,3,1357
"동대문에서 가깝고, 아담한 시장. 정말로 마을 주민들이 이용 하는 시장입니다. 아쉽게도 일본어는 잘 통하지 않습니다만, 어설픈 일본어와 보디랭귀지로 이야기 할 수 있습니다. 제가 추천하는 것은 해산물. 특히 건어물입니다. 최근 일본에서 진한 된장국물에 멸치를 넣는 것이 적어졌습니다만, 여기 중부시장에는 많은 가게가 있어 어느 곳도 신선하고 품질이 좋습니다. 거기에 일본의 반 정도의 가격에 살 수 있습니다. 아쉽지만 멸치는 슈트케이스에 넣으면 냄새가 배기 때문에 귀찮지만 (경험 했음,",luluyoung,해산물 이라면 이곳,4,1357
"시장에서 바글바글할 줄 알았는데. 멸치나 미역 오징어가 쫙 놓여있었습니다. 관광객이 별로 가지 않는 곳인 듯하여, 가격을 깎는 소리가 전혀 들리지 않았습니다. 가이드북에 실려있는 가게를 찾아 물건을 샀습니다만 그 가게의 점원은 조금 일본어를 할 줄 알았습니다 역시 좀 더 한국어를 공부해서 재도전 하고 싶습니다.",かめさん,건어물이 잔뜩,4,1357
"이 곳은 서울 디자인 플라자, 동대문 문화 공원 및 쇼핑 지역에서 도보로 가까운 거리이며 HopOn HopOff 버스 노선의 일부입니다. 말린 해산물, 발효 식품, 한국 음식 및 기타 건조 식품을 사기에 좋은 곳입니다. 상점 주인, 대부분 한국 노인 여성은 매우 친절하며 훌륭한 가격이나 샘플링을 제공합니다. 방문할만한 가치가 있으며 하루 종일 붐비지 않습니다. . . .",schia48,말린 해산물 및 해산물 요리를 구입하기에 좋은 장소,5,1357
"더 좋은 거래와 함께 다양한 해초, 건어물 및 가장 중요한 고려 인삼이 있습니다. 전반적으로 좋은 경험.",Nicole W,서울 시내에서 인삼을 먹을 수있는 최고의 장소.,4,1357
말린 해산물은 대다수입니다. 그리고 이것은 잘 알려져 있지 않습니다-관광객들에게 알려져 있습니다. 따라서 대부분 혼잡하지 않았습니다. 그러나 다양한 길거리 음식 및 기타 제품도 있습니다. 관광객에게도 좋은 곳입니다.,JHL,잘 유지되고 덜 혼잡,5,1357
C (19.05.08) 이 시장은 건어물 시장에서 가장 큰 시장이었습니다. 시장은 현대적인 형태로 개조되었으며 깨끗한 분위기를 풍깁니다. 서울의 건어물 시장을 사고 싶다면 매우 좋은 시장이있다. 한국 전통 큰 시장 중 하나입니다.,CanisHan,서울의 대 건어물 시장.,4,1357
"미친, 건조한 음식 (대부분은 물고기)을 파는 큰 지붕의 아래의 2 개의 거리! 우리는 그들이 말린 생선 800g을 우리에게 봉인했습니다. 가격은 8 원입니다. 000 - 당신이 오징어를 사랑한다면 increadible price. 사진을 말하게하십시오. . .",N B,말린 생선 시장,4,1357
"저는 12 년 이상 일하 지역 시장 이 을지로 많이 다니고, 많이. 다시 방문하기로 해 시장, 흥미로운 곳 였습니다. 하지만 나는 내 길을 약 10 - 15 분. 이 먼지에 강한 냄새가 나고 말린 생선 만듭니다. 이 문제가 생기는 연주 의 코, 떠나 몇 시간 후 냄새. 슬프게도. 다시는 가지 않겠습니다. 이 경우 중요하지만 흥미 롭 코, 주의하세요. 이 있는 곳을 방문하는 한 남대문, 인사동, 생선 시장 및 예를 들어 노령진.",Fred_Merchant,""" 공기 "" 에 대한 주의 사항",3,1357
많이 건조한 음식을 파는 포장 마차. 많은 사람들이 시장에서 쇼핑하다. 대부분이 영어를 잘 하지 못한 상품. 이 때문에 많은 가르침 및 변환 (인터넷 을 사용할 경우). 방문 가치를 어떻게 로컬 시장을 방문하고 싶은.,ilovehaagendazs,건조한 시장 지역,4,1357
작은 시장에 가 보기 이다. 쇼핑할 수 있는 많지 않습니다. 사람들도 친절하고 좋았어요. 라는 가까운 산 우회할 수 없었다.,Maria Y,좋은 시장,3,1357
"중부 시장은 정말 좋았다. 너무나 전통시장. 시장은 아주 깨끗하고, 물고기 냄새 없이. 친절한 아줌마는 다양한 물고기, 오징어, 미역, gingseng 등. 시장은 확실히 재미있는 곳을 둘러보다. 저는 그냥 방문 사랑 전통시장.",ah_shee,중부 시장은,4,1357
보지 못한 많은 종류의 생선 말리. 없는 경우에도 아무것도 구입은 광경을. 좋은 곳입니다.,Guame,수많은 종류의 생선 말리,4,1357
"제 생각엔 이보다 더 좋을 수 없다 해외 여행 시 현지 시장의 문화 체험 및 진정한 ""chungbu 시장"" (일부 말 중부) 실망하지 않습니다. 수백 시장 노점 에서 온갖 종류의 특산물, ' 물고기 ' 이지만 가장 재미있는, 비록 물고기 냄새를 겪었는데 따르는. 멋진 사진을 찍고 시장 상인 듯 아주 친절했습니다. 나는 토요일 아침 일찍 갔다 (8:30) 은 갓 배치되어 있고 모든 포장 마차 하는 흥미로운 쌓이고 사진. 6 또는 7번 출구에서 도보 2분 거리의 지하철 역에서 녹색 라인",Roberts69,용무 쇼핑 라운지 안도 무척 문화 체험!,4,1357
