,u_id,title,review,u_rate,place_name,res_title,p_id
57,Jennifer O,한국 음식과 문화를 즐길 수 있는 환경에! 이동!,"이 책을 읽었을 투어를 발견해보십시오! 정말 현지 음식들. 아주 차가운 편이지만 사람들이 차가운 정말 무시; 왜? 거리는 따뜻한 음식이 기 때문에 전체 를 제공하는 핫! 믿을 수 없는 경험! 정말 먹을 수 있다면! 을 하지 않고 이 의 k - 드라마 에 해당되는 몇 개의 마켓 투어 예약을 했지만 "" 합니다 - 이동 "" 지역. 서 먹 지원하지만 앉을 수 없음! 가장 오래된 동전을 판 스타일 및 전체 의 다양한 길거리 음식을 판! 사랑해요! 가이드의 너무 감사합니다! 음식을 즐길 수 있는 로컬 및",5,통인시장,통인시장,1384
58,AnonyU,한국 음식 잡고 라테스톤을,"지난 하여, 제가 갔을 때 이 호텔에서 크리스마스. 나는 거의 막히는 것도 관리하지 않고 앉을 수 있는 곳을 찾아. 이 시간, 화요일, 거의 보이지 않는 사람도 있고. 정말 좋았어요. 꽤 유명한 관광 명소가 있기 때문에, 한국인과 외국인이 다, 이 곳은 좀 비싼 편. 음식의 질에 비해, 많은 일들이 ezpensive. 하는 것이 좋은 곳으로 한국 음식의 개요, 사용하는 한국 전통의 동전 (5,000 동전 10 용) 좋은 것은 아니었는지, 그냥 줄 긴 줄어 있습니다. 항상 수행합니다.",3,통인시장,통인시장,1384
59,Tienne2001,도시락 ahjumma,"본격적인 한국 음식을 맛보고 싶은 경우 그다지 비싸지 않게 ahjumma, 그리고 이 곳에 방문하기. 있는 US $5, 수 많은 반찬을 밥과 추가할 수 있습니다. 이 문을 닫는 오후 4시. 저는 여기서 15:20 및 저런... 이 사람이 어서. 이 테이블을 다른 좌석을 찾아 공유하기. 기대하지 마십시오 하고 깨끗한 곳, 전통적인 시장 이다. 맛있는 음식은 대부분 짜고 맵 은...",4,통인시장,통인시장,1384
60,JumpingMarimo,"많이 보고, 괜찮은 음식","아주 작은 시장 이었다. 할머니는 텍스처 맵은 떡 에 좋은 점, 부족한 맛이 라고 생각해요. 기분 좋은 놀라움 이 그린 포도 주스 의 오른쪽 끝으로 시장. 추천하고 싶지만 다른 곳을 생각하는 유사한 음료. 저렴한 가격에 먹을 수 있지만 이곳은 정말 지금까지 입니다. 나는 버스를 추천합니다.",3,통인시장,통인시장,1384
61,Shanneen C,변경다른 스타일을 teobokki,"통인 시장에서 무한 도전이 기 때문에 오는 길에 볼 수 있습니다. 제가 생각하는 이 도 있었지만 닫힌 날 도시락 상자 5000 카페에 갔다. 생각해보니 저는 대부분의 일년 열을 선택하여 잘못된 일이지만. 음식, 오래된 스타일을 시도해야 후라잉된 teobokki! 원하는 경우 spicyness 거리에서 벗어난 채, 확실히 간장 teobokki 호텔을 이용해보세요. 튀긴 감자 팬케이크 도 시도 해봤는데, 저는 가서 괜찮았지만 다른 계획. 을 사용할 수 있습니다. 나는 달콤한 술 (식혜 식해)",4,통인시장,통인시장,1384
62,ptan15,합리적인 가격에 훌륭한 음식,"우리는 시장에서 도시락 카페에서 점심을 먹었다. 5,000 원에 먹을 수 있는 도시락을 만들 수 있는 포장 마차 음식 탁반 위치한 분께. 다양한 종류의 맛있는 반찬을 선택할 수 있다. 식품 업체들이 아주 친절하고 도움도. 방문할 가치가 있는.",4,통인시장,통인시장,1384
63,Dan R,한국 음식의 맛은,이 시장은 많은 시도는 좋은 방법이 한국 음식. 을 얻을 수 있는 다양한 한국 음식과 반찬을 도시락을 이해하고 여러 포장 마차. 경복궁 이 아주 가깝습니다. 나는 이곳을 반드시 추천하는 원본 tteokboki 에서 할머니 떡볶이 (첫 번째 떡볶이 의 왼쪽) 많은 떡볶이 (맵 은 하나는 최고의 나의 생각),4,통인시장,통인시장,1384
64,Sally P,시장의 차이.,"매우 흥미로운 시장이 있었어요. 돈에 대한 엔트리 및 토큰 흑줄무늬 더 스톨 홀더 를 구매하는 방법이. 서 많은 맥주를 맛볼 수 있는 갓 요리된 전시와 판매를 할 수 있는 매우 더운 날 수 있었습니다. 아이스크림 콘 모양의 놀라운 광경이 우리의 첫 번째 j 가득 맛있는 소프트 아이스크림, 더운 다시 한 번 감사합니다. 작은 골목에 있는 방법은 많은 좌석이 2층 계단을 좀 잘라 막대기를 통해 사용할 수 있는, 칼과 차가운 물이 제공됩니다. 즐길 수 있는!",5,통인시장,통인시장,1384
65,tombillinge,훌륭한 시스템,"이 시장에는 푸드 시스템에. 가서 카페, 5000 원이 고 트레이 및 토큰. 그 주위가 증해된 식품 업체 및 토큰 식품 트레이 를 사용합니다. 결과 - 여러 공급업체와 많은 항목을 훌륭한 점심 식사! 최상의 가치 및 다양한 종류의 한국 식품. 은 점심.",4,통인시장,통인시장,1384
