,u_id,title,review,u_rate,place_name,res_title,p_id
0,Monde,다리가 생겨서 가기 쉬워졌어요,다리가 생겨 다니기 쉬워진 보문사입니다 절 밥도 맛있구요 해질때 가면 더 아름다워요^^ 자주가는데 눈썹바위에서 풍경이 아주 멋집니다,5,보문사,보문사,330
1,펄박,가족과 함께 방문했어요~,"저는 보문사를 좋아해서 가끔 방문하기도하는데요 일단 보문사가는길이 좋아요~~~드라이브하기에도 좋구요~예전에 다리가 생기기전엔 배타고 들어가 갈매기한테 새우깡도 주는 낭만이 있었는데요 요샌 다리가 생겨 쉽게 언제든지 기다리지않고 갈수있어요. 절이 다소 경사가 높은 언덕에 있어 올라가기에 젊은사람도 힘들기하지만 막상 올라가면 인천앞바다, 드넓은 갯벌을 보는순간 감탄이 절로 나온답니다. 더 좋은 뷰를 보려면 소원이 이뤄지는 계단을 올라가야하는데 조금 힘들긴하지만 막상 올라가면 올라가기 잘했다라는",5,보문사,보문사,330
2,teamwhite,석모도 여행의 꽃,"한국의 해수관음 성지는, 예로부터 남해 보리암, 양양 낙산사, 강화 보문사, 여수 향일암을 꼽아왔다 관음성지는 "" 관세음보살님이 상주하는 성스러운 곳"" 이란 뜻으로, 이곳에서 기도발원을 하게되면, 그 어느곳보다 관세음보살님의 가피를 잘 받는것으로 널리 알려져있다.",4,보문사,보문사,330
3,J.G.YUN,대표적인 관음성지,"국내 4대 관음성지는 <남해 보리암>, <양양 낙산사>, <여수 향일암> 그리고 <강화 보문사>라고 하네요. 전통사찰이 아니어서 역사적인 중요한 볼거리는 없지만, 기도효험으로 소문난 탓인지 참배객들이 많아요. 이른 시간에 방문하는 것이 좋으며, 가는 길이 오르막이라 신발은 운동화류가 좋을 것 같아요. 보문사 경내에서 강화바다를 조망할 수 있어요.",3,보문사,보문사,330
4,Sangchan Lee,석모도에 가는 이유 중 하나,석모대교로 인하여 과거 바지선에 차량을 싣고 가는 것과 비교할 수 없을 정도로 접근성이 좋아져 자주 가는 곳이다. 보문사입구에 늘어선 식당에서 산채비빕밥등 식사 후 가볍게 산책겸 등산하기 좋은 곳으로 적당히 많은 계단과 높이로 어느 정도 운동량이 필요하다. 보문사 눈썹바위에서 내려다보는 서해바다의 모습이 가장 아름다우며 일몰시 방문을 가장 추천한다.,4,보문사,보문사,330
5,경경 팍,석모도 여행의 필수 코스!,신라 선덕여왕때 창건된 보문사! 석모도 여행을 간다면 필수코스라고 할 수 있을만큼 멋지고 웅장한 보문사~ 사계절 내내 예쁘지만 가을이 더 아름다운 보문사,5,보문사,보문사,330
6,클레오,서울 근교 여행지 추천,"강화도 석모도 보문사에 다녀왔어요. 밴댕이 회정식도 먹고, 보문사 산책하면서 가을도 만끽했답니다^^ 근처 온천까지 하루 풀코스로 딱 이에요~",5,보문사,보문사,330
7,Subin Lee,한번쯤 가볼만해요,근데 보문사는 주차비 2천원에 입장료도 따로입니다. 올라가서 보면 바다도 보이고 가볼만한곳이예요~ 편한신발 신고 가세요!!,2,보문사,보문사,330
8,NAM씨,"강화도 여행 중 들린 멋진 곳, 보문사",종교는 따로 없지만 방문해서 아름다운 풍경과 바위에 세겨진 부처를 보니 매우 신기했습니다. 절에 올라가는데 조금 가파르지만 오르고나면 멋진 풍경을 볼 수 있어 매우 좋습니다!,4,보문사,보문사,330
9,mikee75,가족들이 갈만한곳,석모도에 갈데가 없어 다 이리로 오나보다 주차장에 승용차 주차비 2천원 징수 입장권 성인 2천원 올라가보면 사진찍고 구경하기 좋고 . 산위로 15분 올라가면 경치좋은곳에서 부처님 볼수 있다,3,보문사,보문사,330
10,봉기 문,방문기,"인천 강화도에서 석모도가 다리로 연결된 후 방문한 보문사의 방문기입니다. 훨씬 편리해진 교통편 때문인지 펜션 등 상가가 많이 증가했고, 보문사의 발길도 단체 방문이 종종 눈에 띄었습니다. 눈썹처럼 생긴 바위에 릴리이프로 새겨진 부처님의 영험한 모습은 여전히 변합없이 자애로운 미소로 우리를 반겨 주었습니다.",4,보문사,보문사,330
11,이혜숙,눈썹바위 밑에 마애불,2017년 6월. 석모대교가 개통되었다. 겸사겸사 석모도 여행에 나섰다. 외포리에서 석포리로 가는 배가 사라지면서 뭔가 빠진 듯한 느낌이 들었지만....보문사에는 어마어마한 관광객들이 찾아들었다. 예전과 달리 일주문 밑에 주차장에 차를 대야 했고 주차비 받았으며 일주문까지도 멀었다. 그러니 눈썹바위 밑까지 걸어가는 일은 포기해버렸지만...석모도 눈썹바위 밑에 있는 마애불은 꼭 한번은 가볼만한 곳이다.,4,보문사,보문사,330
12,jsh6136,가볼가치가 있어요,외국인친구 한국에 방문했을때 데려갔는데 너무 좋아했어요. 우선 분위기도 힐링되는 느낌이고 위로 걷다보면 바다 뷰가 좋아요,4,보문사,보문사,330
13,은지 김,많은 소원이 이루어질,세번을 방문하면 한번의 소원이 이루어진다는 보문사에요 멋진 강화도의 절경을 보면서 마음이 차분해지네요,5,보문사,보문사,330
14,icarusjm,"거대한 규모의 와불(臥佛, 누워있는 불상)로 유명한 보문사",단청과 현판이 곱다. 특히 현판 글씨.. 그 새김이 정말 아름답다. 삼성각을 비롯한.. 사찰 이곳저곳을.. 렌즈에 담아본다. 익살스러운 표정에 시선이 간다. ;; 와불전.. 누워있는 불상을 모신 전각으로.. 커다란 하나의 자연석을 조각한 것이라고 한다. 본래 바깥에 있던 불상인데.. 불상을 모시기 위해 그에 맞추어 전각을 지은 것이라고.. 어머님께서는 찻집에서 잠시 휴식을 취하시고.. 젊은이들은 보다 높은 곳에 모셔진 마애불을 보러 간다. 인천 강화 앞바다.. 바다를,5,보문사,보문사,330
15,Jhanasi,올라가는 길이 상당히 가파르지만 확 트인 바다 전망이 좋아요,올라가는 길이 상당히 가파르지만 확 트인 바다 전망이 좋아요. 석모도에 간다면 한번쯤 가볼만 한 곳입니다.,4,보문사,보문사,330
16,Sexyhongjin,석모도 필수 트레킹코스,석모도는 아주 큰섬도 볼거리가 넘치는 관광지도 아니다 하지만 조용하고 느릿하게 걷고 쉴 수 있는 곳이다 그중 한곳이 보문사라고 하겠다 그리 높지않은 곳에 위치해있고 인근에 등산로가 있어서 간단한 트레킹을 하기에 적합하다,4,보문사,보문사,330
17,짱짱짱,새해 소원 기원,인천에서 배타고 들어가야함. 새해 소원을 기원하기 위해 가족과 함께 방문했는데 계단이 400개 정도라서 10분정도? 걸어 올라가야함.,4,보문사,보문사,330
18,yunah282,보문사 소원이 이루어지는 계단 꼭 방문해 보세요^^,자연관경과 어우러져있는 보문사는 강화 석모도 섬 안에 있습니다..^^ 사찰 자체도 멋있지만 그 옆에 소원이 이루어지는 계단을 올라가면 있는 불상들이 아주 경이롭습니다..^^ 강화를 여행가신다면 보문사는 꼭 들러보세요^^ 근처 맛집들도 많아요^^,5,보문사,보문사,330
19,수정 신,생각만큼 높진 않습니다. 가파를 뿐,"드라마 ""밤이면 밤마다""를 보고 처음 방문하였습니다. ""올라오느라 고생했다고 소원 들어주실지도""? 라는 대사처럼 저는 당시의 제 소원을 이루었네요. 명당으로 알려진 곳인 듯 합니다. 종교를 떠나서 보문사 석불이 있는 곳까지 올라서면, 그곳에서 보이는 풍경이 매우 상쾌합니다.",4,보문사,보문사,330
20,다윗,높아요,배를 타고 건너 갔는데 작은 섬에 다양한 그러면서 여러 모양의 사찰도 보구 또 무슨 돌림판 마치 로또 추첨기인줄 착각 ㅋㅋ 한 번 보시면 괜찬아요 또 정말 커다란 부처상도 있네요 산도 따로 올라갈 수 있고,5,보문사,보문사,330
21,bjh3676,석모도의 필수코스,"강화도 외포리선착장에서 석모도로 가는 배가 정기적으로 운행하고 있습니다. 11월에 석모도 자전거여행을 했는데, 바다에 피어있는 붉은 함초들이 정말 예뻤습니다. 석모도 선착장 근처에 자전거를 대여하는 가게가 있으며, 선착장부터 보문사까지 자전거 전용도로가 잘 나있습니다. 보문사는 석모도의 필수코스였는지, 자전거를 타면서 사람 인적을 보기 힘들었는데 보문사에 가니 사람들이 많았습니다. 보문사가 산비탈에 있어서, 꼭대기의 마애석불까지 오르려면 어느정도 등산을 해야 합니다.",5,보문사,보문사,330
22,상기 고,강화 석모도 보문사,"w/ 산행 : 전득이고개 ~ 해명산 ~ 방개고개 ~ 새가리고개 ~ 낙가산 ~ 절고개 ~ 보문사 6.2km/2.5시간 w/ 강화나들길 11코스 석모도 바람길 : 석포항에서 버스로 보문사 관람 후, 보문사 ~ 민머루해변 ~ 석포항 16km / 5시간",5,보문사,보문사,330
23,jodanpapa,석모도의 명승지...,아직까지는 강화도에서 배를 타고 들어가야 하는 석모도... 그 석모도에서 가장 유명한 명승지인 보문사... 유명한 곳이다보니 주말이나 공휴일에는 인파에 시달려야 하는 것은 기본... 올라가는 길도 가파라서 조금은 힘들수도... 하지만 고찰의 분위기를 느낄 수 있음은 물론 마애관음상을 비롯한 볼거리들이 많으니 절대 후회하지는 않을 것... 마애관음상에서 바라보는 서해의 풍경은 단연 압권...,4,보문사,보문사,330
24,hmhmhmhahaha,눈썹바위,사계절이 다 아름다운 곳입니다. 부처님까지 가는 길은 계단이 많아서 틈틈 쉬어야 합니다. 배가 꽤 늦은 시간까지 다니기 때문에 좀 느긋하게 나오면 교통 체증이 덜합니다.,5,보문사,보문사,330
25,Malibu307,아주 좋은 경험,"송도에 왔다가 석모도로 이동하여 방문한 보문사. 강화도쪽에 자주 왔지만 한번도 가보지 못하다 드디어 가보게되었는데, 너무 좋은 곳이었다. 계단을 오르면 위치한 절의 전경이 너무나 아름답다. 석모도로 이동하는 페리는 짧은 거리지만 차량도 탑승 가능.",5,보문사,보문사,330
26,owerea,강화도에 간다면 들러보면 좋다.,강화도에서도 배를 타고 이동해야 하는 곳이지만 가는 길도 낭만적이다. 오르는길이 가파르긴 하지만 전망은 좋다.,4,보문사,보문사,330
27,silverpang,인상적인 마애불,"일단 입구에서 정상까지 거리는 길지 않지만 경사도가 상당히 가파르기 때문에 힘듭니다. 그리고 중간중간 계단도 많구요. 그렇지만 중간에 소원을 적을 수 있는 곳이라든지, 전망을 보면서 쉴수 있는 곳이 있어 그렇게 힘들지는 않습니다. 영험한 곳이라 많은 사람들이 방문한다고 하는데, 가서 소원을 비는 것도 괜찮은거같아요~~",4,보문사,보문사,330
28,sodongpa,석모도 여행에서 구경할곳,"봄에 가면 벚꽃이 이쁘고 갈매기 친구들과 배에서 놀고 석모도 구경에 석모도는 필수코스 그냥절이지만 먼가 조금 다른느낌이있ㅇ,",5,보문사,보문사,330
29,아무야,여러 계단을 올라가면 전망이 좋아요.,강화도에 가서 석모도를 갔다면 꼭 들러봐야할 곳이에요. 계단을 오르긴 힘들지만 올라가면 전망이 좋아요. 소원을 빌면서 천천히 걸어올라가보세요,4,보문사,보문사,330
30,호랭스,돌을 깎아 만든 불상이 있어요,돌을 깎아 만든 불상이 있어요 계단을 올라가는게 힘들어서 노약자나 임산부에게는 힘들 수 있어요 석모도를 한눈에 내려다 볼수 있어요,4,보문사,보문사,330
31,진섭 안,배타고 훌쩍 갔다온곳,누나 커플의 권유로 무심코 강화도에갔다 가치따라갔습니다. 생각보다 고바위 언덕이라 힘들었는데 막상 올라가보니 경치가 너무좋더라구요. 다만 아쉬운점은 나올때 배타러가는 길이 너무막혀 한시간반가량 기다렸네요.,3,보문사,보문사,330
32,주니네,2015 강화도 석모도 기도발 좋은 보문사,기도발 좋다는 석모도 보문사에 왔어요~^^ 먼저 500나한상입니다. 올굴 모양이 모두 다르다네요 바로 옆의 석굴 이 인상적이었고 대웅전을 끼고 돌아 수 많은 계단을 오르니 눈썹바워가 나타났다. 으흠 기도발이 좋기는 한가봐요 스님 한분이 가도내용을 수 없이 마이크에 대고 불경처럼 외우고 있섰습니다.~^^,5,보문사,보문사,330
33,kjmagnuson,먼 불교 사원,보문사는 강화도 앞에 있는 더 작은 섬인 석모도에 위치해 있어요. 보문사는 환상적인 경치를 조망할 수 있는 아름다운 지점에 지어졌습니다. 이 절 자체는 아름답지만 한국의 다른 역사적으로 유명한 절들에 비해 지명도가 떨어집니다. 보문사가 가지는 특색이라면 외딴 지역에 있는 정적이 감도는 아름다운 사찰이라는 점이예요. 제 개인적으로 가장 흥미로운 것은 마애석불좌상이 새겨진 바위예요. 바위에 새겨 놓은 이 부처님 상은 높이가 10미터에 이르고 수 세기 이전에 만들어졌어요. 보문사는 가볼 만한,4,보문사,보문사,330
34,Jake Aller,또 다른 위대한 사원,한국에서 가장 좋아하는 사원 중 하나입니다. 요즘에는 너무 먼 거리에 다니는 것이 어렵지 않지만 새로운 다리를 사용하면 서울이나 공항 근처에 머무르는 것이 당일 치기 여행입니다. 여기에 오는 가장 좋은 방법은 자동차를 렌트하는 것입니다. 대중 교통으로 갈 경우에는 신천역에서 또는 공항에서 버스를 타고 강화에서 하차 한 후 지역 버스 또는 택시를 타십시오.,5,보문사,보문사,330
35,David D,독특한 사원과 정상까지 등반 가치.,"이것은 내가 한국에서 구경했던 가장 멋진 사원 중의 1 개다. 그러나 정상에 오르는 것은 쉽지 않습니다. 매우 더 가파르웠다. 그러나 나이 들었던 많은 한국인이 여행을하고, 어떤 경우에는 더 젊은 세대보다 그것을 잘 다루는 것을 알아 차렸다. 상단에는 돌로 조각 된 부처가 있습니다. 그 매우 복잡하고 명백하게 노동 조합 지부에 중요한 사원. 방문객이 많아서 방문을 서둘 필요가 없습니다. 위대한 전망에서 바다로. 섬으로의 접근은 최근 완성 된 다리입니다. 돌아 오는 길에는 게 요리로 유명한 여러",4,보문사,보문사,330
36,Mic,접근하기 어렵지만 좋은 사원,"놀라운 쳇발, 바로 옆에 바다. 강화도 는 이 새우, 넌 사람들을 많이 볼 수 있는 판매자 와 새우 시장. 하지만 정말 어려운 거기에. 신촌 에서, 탈 수 있는 버스까지 3000 강화도 (강화도). 버스 터미널에 도착하면, 버스를 타거나 oepo 리 외포리 카운티까지 31 37, 페리를 타고 석모도 로 간 (걱모도). 그리고 드디어 도착이 섬, 참 마지막 셔틀 버스로 쳇발. 그래서 서울에서, 당신은 총 4시간 정도 시간이 오실 때가 있고 4시간 정도 돌아와. 했음에도 불구하고, 참 마음이",5,보문사,보문사,330
