,u_id,title,review,u_rate,place_name,res_title,p_id
0,강한여자,LG 아트센터,역삼역에서 바로 연결되어 대중교통을 이용해도 되고 주차 시스템도 잘 되어 있어 편하게 주차도 할 수 있습니다.LG 아트센터는 객석과 무대와의 거리가 가깝고 음향 설비도 잘 되어 있어 공연을 즐기기에 손색이 없는 명실상부 최고의 공연장입니다.,4,LG아트센터,LG 아트센터,547
1,JAEMIN S,위치도 시설도 공연내용도 아주 좋은곳,역삼에 위치하고 지하철과 연결이 되어 있어서 교통이 편할뿐만 아니라 객석과 무대의 거리 기타 부대시설등 시설도 좋고 무엇보다고 좋은 공연을 많이 해서 자주 찾는 곳입니다. 웅산 콘서트를 즐겁게 즐겼습니다.,5,LG아트센터,LG 아트센터,547
2,올리브521,Lg아트센터,"는 신뢰가 가고 실력있는 기획들을 해서 좋다. 연간 기획을 미리 알려주고, 보고싶은 공연을 패키지로 좀 할인받아 미리 사둘수있다. Lg아트센터의 공연들은 믿어도 좋다.다년간의 경험으로.",5,LG아트센터,LG 아트센터,547
3,lordauch,전반적으로 좋은 공연장,역삼역 사거리라 찿기 쉽습니다. 좋은 공연이 많구요. 그리고 클래식을 감상 하기에는 예술의 전당보다 음질이 더 좋은듯합니다. 다양한 공연이 많아 일년에 두세번 씩은 꼭 가는 편입니다.,4,LG아트센터,LG 아트센터,547
4,시리우드,훌륭한 공연장입니다.,역삼역 지하철출구와 연결이 되어 있어서 이동이 굉장히 편리합니다. 일년에 두번이상은 이 공연장을 찾는데요. 객석과 무대로 비교적 가깝고 사운드도 만족스러워 좋아합니다. 근처에 부대시설도 많아서 더이상 좋을 수 없네요.,4,LG아트센터,LG 아트센터,547
5,jowajin,관객을 위한 배려가 느껴지는 곳,"역삼역에서 바로 연결되어 찾기 쉬운 장점도 있지만 무엇보다 가장 큰 장점은 로비에 대기석이 제법 많이 준비되어 있는 것입니다. 꽤 많은 관람객들이 앉아서 기다릴 수 있는 좌석이 있고, 간단한 스낵도 즐길 수 있도록 되어 있어서 관객을 위한 배려가 느껴지는 공연장입니다.",4,LG아트센터,LG 아트센터,547
6,YOUNG EUN S,뮤지컬 관람하고 저녁먹기 좋아요,역하고 바로 연결되어있다보니 위치야 말할 것도 없고 음식점이 다양하게 여러나라 음식 있다보니 뮤지컬 보고 한끼 식사 데이트하기에 손색이 없습니다. 강가라고 인도요리집 있는데 거기가 아주 괜찮습니다,5,LG아트센터,LG 아트센터,547
7,leonsOwner,계속 찾을 수 있는 공연장,"지하철역에서 아트센터로 들어가는 엘리베이터가 따로 있는데, 이 엘리베이터를 타지 않으면 사무실로 갈 수 있습니다. 그래서 뒤쪽으로 돌아서 가는 것도 하나의 방법입니다. 좌석이 그렇게 넓지는 않습니다. 뮤지컬을 보기 위해 올해 두 번 방문했고, 좌석이 각각 VIP석 1층 7열과 VIP석 1층 11열이었는데, 두 좌석 모두 배우의 표정까지 보여 생생한 느낌으로 공연을 즐길 수 있었습니다.",5,LG아트센터,LG 아트센터,547
8,bahajia,규모도 크고 부대시설 및 서비스가 좋은 곳,"지하철역에서 바로 연결되고, 주변에 레스토랑, 카페도 많아 편리합니다. 주로 규모가 큰 연극이나 뮤지컬 공연장으로 쓰이는데 공연장도 깨끗하고 쾌적합니다. 물품보관소가 있었고 주차가능. 오페라 글라스 대여가능. 음료도 보관가능했던 걸로 기억합니다.",4,LG아트센터,LG 아트센터,547
