,u_id,title,review,u_rate,place_name,res_title,p_id
357,beardy-t,"을 하는데, 주말 및 휴일을 피하 라. 멋진 전망.","타워의 전망 과 이유를. 하지만 바쁜 석양의 주위에 확실한 그림 같은 이유로 heavingly 을 얻는다. 하고 나서도, 줄을 서지 게 되었지만 여전히 타워. 엘리베이터는 다시 아래로 두 줄을 선 사람들. 계단 이 옵션을 사용할 수 없습니다. 사진에서 보는 전망은 정말 멋진 날씨 이 수 있지만 또는 캡처할 수 있습니다. 남자 의 경우 놀이의 일종 (urinals 최고의 뷰? 세계적인) 사람들을 깜짝 놀라게 한 것을 paicture, 아니면 의 풍경.",4,남산공원,남산 공원,595
358,kcmak2015,서울의 랜드마크,"공원까지 케이블카를 타고 옛날 수 있습니다. 대부분의 지역 은 서울 공원은 볼 수 있는 힐탑. 시간이 충분치 싶다면, 수도에 있는 서울의 야경은 노을 공원을 볼 수 있습니다.",5,남산공원,남산 공원,595
359,77Raine27,상쾌한 후 여행이 다!,"호텔 체크인 후에. 나는 휴식 시간. 가 n - 타워에는 길. 좋은 점은 복장을 바꾸는 보다 편안한 옷. 쇼핑몰에 도착했을 때, 많은 음식 가판대 가 할 수 있는 레스토랑에서의 저녁 식사. 가면 절, 벤치. 그들은 그와 관계 되는 몇 가지 라서 자물쇠. 물론, 아름다운 여러 면에서 - n 컬러 조명 - 타워. 할 수 있는 가장 빠른 방법도 사용할 수 있는 케이블 카 타워. 덕분에 시원한 바람 카운티까지 사랑 스러워요. 이 로맨틱한 장소인 것 같아요.",4,남산공원,남산 공원,595
360,Hyeonri,신선한 및 검토자가 복구,"저는 남산공원, 그래서 resfreshing. 등산과 산책 할 수 있습니다. 멋진 경치와 신선한 공기, 노력 합니다",4,남산공원,남산 공원,595
361,Nahlee,"정말 재미있다, 정말 잘 설계된","남산공원 은 오후를 보낼 수 있는 재미있는 곳. 타워를 올라갈 수, 또는 장면을 촬영해야 하고. 에 레스토랑, 카페, 상점들과 외부 휴식 공간, 마당에 작은 것 에서 행동 하는 것이 종종 보여 줍니다. 또한 너무 시끄러운 혼잡하지 않을 것이기 때문에 해당 사용 또는.",5,남산공원,남산 공원,595
362,Fish_EDI,좋은 케이블 카,"이 케이블카는 데까지 n 타워. 슬프게도 그들을 함께 제공하지 않습니다, 저희 두 개 있는 경우 타워도 가보고 싶고. 자전거를 타고 불과 몇 분 안에 최고, 하지만 아주 아름다운.",5,남산공원,남산 공원,595
363,Hidayah AJ,아름다운 풍경,"우리는 3번 출구 명동에서 모든 기본 케이블카 지역. 조용해서 긴 여행은 가파른 슬로프 이러한핸드레일을. 차를 타고 케이블 경험. 가장 아름다운 풍경 였다. 사람들은 ' 이다. 있는 성능 이라고 저녁 로컬 밴드 guitarcarry. 그들의 공연을 보고 굉장히 편안한 재미있는 가게에서 구입한 얼음을 먹는 동안에는 츄러스나 - 크림. 아이스 크림 의 맛도 맛 이지만 부드러운 - 츄러스나, 바삭하고 씹는 맛이 동시에 수행할 수 있습니다.",5,남산공원,남산 공원,595
364,Michael N,계단을!,"긴 줄이 있었는데요. 힐튼 에 묵었던 곳이 길 건너에 있는 계단을 올라가면 올렸다. 꼭 해야 지원하지만 그만큼의 가치가 있는. 한 번의 최고, 전망이 끝내주는 인사를 선택할 수 있습니다. 이 곳에는 레스토랑의 모든 수준에서 가격이 최고의 공원이 있다. 10 노래 공연한 단체 갔을 때는 사람이 있었습니다. 가능한 최고의 일몰 이다. 또한 모든 부품을 도시의 멋진 전망. 위에 도착하면, 이 방법은 저에게 많은 산 사이에 흩어져 리오.",5,남산공원,남산 공원,595
365,cable_consultant,아주 아름다운 인상을 놓칠 수 없는 서울 타워 -,"서울 시내에서, 할 수 있는 아름다운 길 을 최대 서울 타워. 나는 이제 두 번 다 이, 자신을 첫 번째 시간, 길을 잃기 하는 어려운 것이 다. 단지 머리 위에 서울 타워, 결국 업계 최고의 경로 및 표시하여. 에 있는 계단, 하지만 평화로운, 아름다운, 매우 친절하고. 위에서 보는 전망이 좋은, 하지만 모든 것입니다. 다음 경로를 추천 합니다.",5,남산공원,남산 공원,595
366,Zahra K,큰 공원.,꼭 가보세요. 이 공원에 가서 이 때문에 grean 아름다운. 편안함. 그리고 매우 깨끗했어요. 직원들은 매우 친절하고 좋은.,5,남산공원,남산 공원,595
367,LiketoeatCincinnati,큰 공원,"큰 산 의 중심에 위치하고 있는 서울. N 타워는 이 산 꼭대기에 있다. 경우 충분한 시간, 거리 에서 등산을 추천 합니다. 또한, 케이블카 왕복 8500 KRW 대해 사용할 수 있습니다.",5,남산공원,남산 공원,595
368,EmanZYU,아름다운 공원이 도시,"여기서 부터 늦은 오후까지 머물 수 있는 이른 저녁. 속도가 느린 속도로 방문하기 좋은 곳을 좀. 도시 및 정원 전망을 즐길 수 곳. 여러 커플들에게 이상적인 장소에 있는 기념품 가게도 식당 날짜 및 선택할 수 있습니다. 때 가 있는 것 같았다 이 새로 개발된 과정에서 단면 채우기 위해 공백을 상점. 그리고 장난감 박물관 전시실 도 있는 기본 타워 / 너무! ! 그래서 내가 뜨거운 시 를 통해서 방문 케이블카. 하지만 그 가 경고 하다, 좀 가끔 대기 줄 수 있습니다. 때문에 저는 모든 사람들을",5,남산공원,남산 공원,595
369,FlyAaron,서미트 파크,"우리의 의도가 있는 n 서울 타워. 우리는 여기에서 기본 타워도 실현하지 않았다 이다. 전망이 아름다운, 자연과 함께. 저희는 케이블카를 타고 위로 했다. 필요하면 운동, 걸어갈 수 있는 위로. 제가 여행 가이드, 약 한 시간 입니다. 서미트 파크에 갈 때, 여러 다른 먹을 장소도 약국. 먹을 것을 찾아 들고 내려다 보이는 테이블이나 할 수 있습니다. 또한 화장실 사용할 수 있습니다. 마지막으로, 우리는 신경 쓰지 않을 돈을 맨 위로 가기 때문에 n 서울 타워의 전망 은 우리를 만족할 수",5,남산공원,남산 공원,595
370,Kuv Lub N,귀여운 공원,"남산은 서울의 유명한 곳. 이 타워를 방문 할 수백만 애인의 잠금 장치 를 참조하십시오. 전망이 좋은 밤에 수십억 달러 규모의 문자열과 서울. 대중 교통을 이용할 수 있습니다. 하지만 기차, 버스로 갈 수 있어야 위쪽에 더 가깝게 전송할 수 있습니다. 잘 기억나지 않지만 정확한 기차역이 누구에게 말해. 따라서 많은 창백한 밤에 이곳에 가서 밤에 완벽하게 안전. 한국인들은 하이킹, 사람들이 밖에 있어서, 산 이다. 만약 버스를 타고 가서, 아직 볼 수 있는 상당히 가파른 경사 를 걸어서 타워",4,남산공원,남산 공원,595
371,Karen K,장소를 아름다운 석양 과 서울의 경치를 볼,사랑하는 사람들이 있어서 좋은 곳이 진정으로 좋아하는 사람들은 ' 자 다. 로맨틱한 선셋 도 볼 수 있습니다. 아름다운 전망!,5,남산공원,남산 공원,595
372,Raymond L,최고의 밤 (케이블카로 가능),"공원은 해질 무렵 의 야경을 즐길 수 있는 최고의 - 기나발루에, 좋은 서울의 멋진 전망과 함께 산책하는. 아주 바쁜 주말 밤 도착 이 45분을 줄 수 있는 케이블카 + 1 차 (걸어갈 수 있는 최고 속도 이). 전망이 좋은 케이블카도 확실하지 않은 경우 모든 뷰를 않을때 수 있는 경우 중간 에 있다. 짧은 시간에 방해받지 않을 수 대기 중 또는 케이블 카? 도보 또는 택시를 한 경우.",4,남산공원,남산 공원,595
373,trvlbufChicago,재미있는 곳.,"이 재미있는 장소를 방문할 때, 다음부터는 케이블 카를 타고 도시의 멋진 전망을 즐기실 수 있습니다. 공원에 도착하면 더 많이 서울의 아름다운 전망에 공원으로 수백만 명의 방문자가 이다. 할 정도로.",4,남산공원,남산 공원,595
374,HappyHeapsGood,아름다운,제가 놀라는 넓은 녹색입니다. 이 공원은 서울의 야외 생활의 큰 부분. 아주 좋았어요.,5,남산공원,남산 공원,595
375,ChunChunMaru,작은 언덕의 중간에 있는 큰 도시,케이블카를 타고 서울 타워 카운티까지. 그런 다음 산책 지역이다. 짧은 휴식하기 좋은 곳을 아스팔트 총림지대.,4,남산공원,남산 공원,595
376,colinmarti,사랑스러운 안전한 곳으로,"나는 매일 아침에 걸어갈 수 있는 매우 안전하다고 느꼈습니다. 자연의 나무 심기, 흥미로운 역사적인 명소와 작은 새들. 복잡한 도시.",5,남산공원,남산 공원,595
377,CNMmsn,멋진 전망,전반적으로 좋은 전망을 볼 수 있습니다. 짧은 대기 시간. 사진 찍기 좋은 장소. (선택 사항) 아래에 있는 사랑스러운 산책,4,남산공원,남산 공원,595
378,iactivenet,좋은 하이킹,대부분의 사람들이 가서 매일 운동하기. 이에 경찰이 있는 데. 그러나 실제 에 있는 모양을 해야 합니다.,5,남산공원,남산 공원,595
379,AnThony C,남산공원,서울 최고의 전망이 좋은 아름다운 공원이 있다. 깨끗하고 잘 유지되어 있는 공원. 할 수 있게 산책을 즐길 수 있는 아름다운 케이블카 위쪽 또는 파빌론의 주변,5,남산공원,남산 공원,595
380,SMLove226,"멋진, 너무 많은 것을 볼 수 있는 구릉 공원","친구와 저는 3 - 4시간 정도 하이킹을 위한 남산공원 지난 주말에 정말 재밌었어요! 자연을 즐길 수 있는 좋은 곳이 길을 따라 워크 아웃. 일부 지역에서는 아주 흥미진진한 것이 될 수 있는 구릉 공원 및. 편안한 신발을 착용 하는 것을 추천한 신발 바닥창 그리피. 사랑스러운 공원 같은 물이 많은 관광객들이 즐길 수 있는 연못, 분수, 그리고 작은 시냇물. 이태원에서 가기 아주 편리한 곳이다. 우리는 꼭 한 번 가고 평화로운 곳입니다!",5,남산공원,남산 공원,595
381,sunnydien,좋은,저는 매우 편안한 곳이 이 공원에 나무와 꽃 들이 있습니다. 하루 반나절 을 보내기 좋은 곳 특히 아이들이 있다면,5,남산공원,남산 공원,595
382,theschuay86,아주 좋은 공원이 많이 보,"아주 큰 공원이 주변의 산 역사적인 기념비 를 포함, 동상, 박물관, 전망대 하는, 많은 트레일, 곤돌라를 원하지 않는 경우에 이 산을 올라가야 합니다. 나는 겨우 1/4 공원을 참조하십시오.",5,남산공원,남산 공원,595
383,Sam,남산,"도시의 좋은 전망까지 n 서울 타워. 입장에 10,000 KRW. 꼭 가봐야 할 곳",5,남산공원,남산 공원,595
384,Anna P,동적 양식이 좋은 서울 여행,"하고 즐길 수 있는 경로를 통해 n 타워입니다. 하지만 쉽지 않은 길, 좋은 변경이 서울의 붐비는 거리. 더 나은 구매 언산 의 물에 발, 또는 충분히 - 저는 위에 유일한 분수도 발견했다. 전 을 얻을 수 있는, 꽤 물 수 없게 됩니다.",5,남산공원,남산 공원,595
385,Elisavil,남산을 사랑합니다 사랑합니다,모든 작업이 얼마나 오래 되었는지 알 수 있는 여러 작업이 계속 까지 한국 노인 거리 공원에 깨끗 합니다. 이 공원은 완벽한 휴식을 취하거나 아름다운 경치에 운동을 할 수 있습니다. 나는 이른 아침에 갈 수 있다. 주말 동안 사람 (많은 어쨌든) 만 합니다.,5,남산공원,남산 공원,595
386,Siobhan C,서울의 멋진 전망!,낮에 방문한! 360도 전망이 환상적인 서울. 특이한 것은 사랑의 자물쇠를. 저렴한 활동. 나는 이 버스를 타고 (5 분) 짧은 다음 영역에서 명동까지 걸어서 꼭대기에 있는 케이블 카 보다 상당히 저렴! 필요하지 않을 멋진 전망 타워로 올라가지 도!,5,남산공원,남산 공원,595
387,Ghado T,좋은 전망,"서울이 좋은 전망, 간 큰 경우 도포수 을 위해 사랑하는 일부 커피숍. 또한 사랑의 자물쇠가 유명한",4,남산공원,남산 공원,595
388,Parul M,맨 시티 뷰,"가서 케이블카 가 최고, 하이킹이나 시간이 있다면. 케이블 카도 짧은 실행 시간을 탔습니다. 위에서 볼 수 있는 멋진, 더 나은 해가 지는 설정 및 도시의 불빛 에 오기 시작.",4,남산공원,남산 공원,595
389,Will,운동화를,"조용하고 평화로운 공원. 도시의 중심에 있었지만 충분, 및 녹색인 경우 건물 주위에서 흐트러뜨리다. 벽과 바닥은 한 순간에 역사 애호가. 하게 하고 운동화 / n 서울 타워로 올라가는 계단 길. 를 자신의 레저 및 몇 가집니다 단계를 통해 멈추개 에 멋진 사진 있습니다.",4,남산공원,남산 공원,595
390,Nicaella H,와우,케이블카를 타는 것은 멋진 광경은 놀랍게도 및 에서. 우리는 다시 이곳에 다시 올 것이 오.,5,남산공원,남산 공원,595
391,SingaporeVirgo,인상 좋은,근사한 곳에서 걸어서 산 걷는 게 가장 사랑스러운 경치가 멋진 하루 간격이 있었고 전통적인 성능을 볼 수 있는 사랑스러운 쇼핑 센터와 바에서 정말 멋진 휴가 홉핑,4,남산공원,남산 공원,595
392,Barbra B,멋진 도시 - 인기!,"이 도시에 가서 몇 가집니다 변경다른 회의에 회의 참석자 마지막 밤. 우리는 택시를 타고 이곳에 오는 아주 쉽게. 케이블카를 타고 올라갈 수도 있지만 나쁘지 않았어요 꼭 가 아 더 많은 (다른 많은 사람들이 같은 생각에 있었다!). 처음 부분에 있는 공원에 있는 모든 잠금 (자물쇠가 많이 있기 때문에! ) 및 사진을했다. 그런 다음, 다음 레벨까지 가서 공원 입구에 있는 n 서울 타워는 추가 비용, 위로 이동할 수 있는 하지 않았다. 들이 있기 때문에 많은 사람들이 붐비긴 했지만 재밌었습니다.",4,남산공원,남산 공원,595
393,Clare_Alicia,더 나은 오는 밤,"이곳은 붐비는 여기에 작동을 살 수 있습니다. 도쿄 타워의 불빛이 후에는 19:30 리모키에 우리는 택시를 타고 타워로 온 케이블카. 추락 시, 택시 기사가 우리를 20,000 원에 케이블카 역 하는 여행. 너무 비싸! 무료 셔틀 버스를 이용할 수 밖에 케이블카 역까지 무료. 우리에게 가장 가까운 mrt 역이 있다.",4,남산공원,남산 공원,595
394,Ferry_Kasenda,남산타워에 케이블카를 타,"남산 공원까지 케이블카를 이용하여 이 도시에서 할 수 있습니다. 남산 타워가 있기에. 좋은 전망을 볼 수 없는 것이 한 개의 케이블카. 곧 도착 했을 때 우리가 찾는 카페, 레스토랑, 기념품 가게. 전에 모든 레스토랑, 가게, 등, 우리는 계단을 올라가야...",3,남산공원,남산 공원,595
395,lottamatilda,멋진 풍경은 아니었지만 약간 실망스러운 케이블카,"케이블카를 타고 정상까지 수 공원과 가까운 방향을 본 풍경. 긴 줄이 있었고 점심에 들어서자마자 케이블카. 운이 좋으면, 창이 다음 사진을 찾을 수 있다. 짧은 타고 가면 좋은 방법이지만.",4,남산공원,남산 공원,595
396,bLiselotte,즐거운 시간을 걸어,이 공원은 남산 타워와 완전히 주변 많아서. 가장 인기 있는 것은 바로 아래에 있는 케이블 카. 케이블카를 타고 걸어 가기로 하고. 저희는 밤에 타워를 천천히 걸어 보였다. 이 옵션을 사용하면 하게 할 전망을 즐길 수 있는 가장 격렬한 방법이다.,4,남산공원,남산 공원,595
397,BlondeMint,"아름다운 경치, 날씨 좋은 날에","케이블카를 타고 올라가면, 이 좋은 풍경은 그만한 가치가 있다. 타워 꼭대기에 있는 너무 멋지고, 있는 것과 같은 많은 계단을 올라가면 가파른 언덕 위에 있어요.",4,남산공원,남산 공원,595
398,Tymberman,하지만 즐거운 격렬한,"앞서 가는 케이블카 위, 활기찬 느낌이지만 걷기 결정했습니다. 해당 경로를 가지고 다양한 수 위. 짧은 계단을 라우트할 수 있습니다. 발끈 하는 것에 해당하고 팽창. 우리는 화려한 고무 코팅된 경로가 더 좋은 이었고, 많은 사람들이 보고, 폭포와 화장실. 도착했을 때 맨 위에 있는 전통적인 한국의 검술 demonstartion. 좋은 서프라이즈!",4,남산공원,남산 공원,595
399,hashhh,아름다운 공원,"남산공원, 타워 꼭대기에 앉아 있는 언덕 위에 아름다운 공원인 가치가 있습니다. 타워가 몇 가집니다 방법이 있습니다. 케이블카, 버스를 답변하기 다. 제가 2번 버스 각각 케이블카 했다. 해밀턴 호텔 맞은편에 있는 버스 정류장에서 버스를 타고 바로 이태원 에 가 최고. 서울의 아름다운 전망을 위로 하기 위해서 하는 것입니다. 또한 선택을 은 케이블 카를 타고 너무 뷰.",4,남산공원,남산 공원,595
400,Shinta WG,당신의 다리를,"남산 공원은 산책하기에 언덕 공원 계획이 있다면, 당신의 다리 을 준비하고 있다. 이 할 만한 도시를 볼 위에서, 특히 밤에. 더 나은 전망을, n 서울 타워 가 있습니다.",3,남산공원,남산 공원,595
401,rohizani,이곳은 아름다운 풍경,"우리는 남산타워에 케이블카에서 보이는 풍경도 아름답다. 그러나, 같은 다른 케이블 카를 타고... 더 아무것도 할 수 있는, 전망을 즐길 수 있고.",5,남산공원,남산 공원,595
402,BPY123,훌륭한 공원,"그랜드 하얏트 바로 맞은 편에 있는 이곳은, 좋은 흔적 으로 이어지는 타워. 하고 싶은 아름답고, 즐거운 아침 산책이나 한다. 길을 따라 많은 시설이 있다.",5,남산공원,남산 공원,595
403,Abdul R,공원에 있는 유명한 타워 힐,남산공원 은 매우 매력적인 면에서 기본 제공 방식을 통해 언산 정상에서 찾을 수 있는 또 다른 유명한 곳이고 n서울타워에 가는 길에 서울 방문해야합니다 케이블카를 타고 정상에 쉽게 갈 수 있는 그 사람들이 야 물을 운반해야 한 서울의 도시의 멋진 전망,4,남산공원,남산 공원,595
404,carmella m,아름다운,놀라운 공원. 타워에서 걸어 나와 내 딸이 있는 공원 안에 위치. 전망은 놀라운 꽃을 가진,5,남산공원,남산 공원,595
405,sueloves-escapades,남산 타워로 otw,가장 좋은 방법은 당신의 여행을 즐길 수 있는 남산 타워. 여행객이 직접 케이블카 로 하지 말았다. 하고 있다. 수 있지만 힘든 가치가 있습니다. 전망도 좋고 해!,5,남산공원,남산 공원,595
406,Arick M,경치가 좋은 좋은 하이킹,그들은 모두 포함하는 패스 numerouspaths 공원에 위치한 타워는 최고입니다. 그는 아래와 같은 경우에만 사용할 수 있는 리프트 업/다운 / 방향 이다. 주말에 가기 위해 특별한 이벤트는 타워. 타워에 있는 레스토랑에서 보기 및 기타 기본 또는 백업 작업도 최고. 대중 교통 (버스) 맨 옵션도 있습니다.,4,남산공원,남산 공원,595
407,Chul A,환상적인 경치 좋은 곳,"맨 아래 공원, 남산 공원이 걸어서 30분 정도 위에 있는 ca. 할 수 있다면. 난 걸어서 산 꼭대기. 에도 갈 수 있는 케이블카를 이용하여 산 꼭대기.",5,남산공원,남산 공원,595
408,1canadianbear,걸어서 가볼 만한 곳,서울 중심부에 있어서 화려한 공원이. 정원도 잘 정돈되어 있었고 (시내 버스를 제외하고) 이 거의 않음. 타워로 올라가는 하지 않는 너무 비싸다고 느꼈습니다. 도시의 전망 데크 주변 에서도 볼 수 없는 산 꼭대기.,4,남산공원,남산 공원,595
409,Meijuan T,전망은 멋진,멋진 전망이 있다. 꽃 은 아름다운 기념비. N 서울 타워 (15- 30분 같은) 근처에.,5,남산공원,남산 공원,595
410,travelerinva801,좋은 전망!,체크 아웃 비율은 서울의 멋진 곳. 아름다운 전망을 즐기실 수 있습니다. 케이블카를 타면 재미는 하지 않는 것 같은 느낌.,5,남산공원,남산 공원,595
411,Ablanchi,남산공원 펌핑효율을,길을 걸어갈 수 있는 아주 좋은 약 2시간. 많은 작은 곳도 이곳의 전통적인 느낌을 줍니다. 아주 좋은,4,남산공원,남산 공원,595
412,Kstravel61,훌륭한 전망과 등산 하기 좋은 곳,"좋은 오후에 하이킹 하는 놀라운 전망입니다. 버려진 길을 따라 있는 사원 이다. 좋은 장소를 찾을 수 없는 사진의 스카이라인 이었어요. 사용하는 경우 최대 수 충계 좋은 인상, 무료.",5,남산공원,남산 공원,595
413,Toby Cheong,경치가 좋고,우리는 호텔에서 걸어갈 수 있는 - 그랜드 호텔 명동 역에서 케이블카. 15분 정도 걸리는... 공원이 보이는 전망은...,5,남산공원,남산 공원,595
414,manucanuck,보기 좋은 위에서,"남산공원에서 걸어 n서울타워에 도착, 좋은 장소에서 서울의 중심에 위치한 기념물 들이 서울 안의 벽에 숨지 한 부분을 참조하십시오 인쇄 및 시초 geun 의 손.",4,남산공원,남산 공원,595
415,mcglassa,좀 피곤했지만 훌륭한 전망,"저희는 애초에 케이블카를 타고 남산 정상에 올라오는 것이 잘못 걸어 반만 잘 실현된 케이블카 역 진찌로. 그럼에도 불구하고, 등반 은 합리적으로 쉽게 피곤한 모양 이지만 누군가가 뷰 위쪽 또는 합리적인 가치가 있습니다. 맨 꼭대기에 있는 카페에서 역사에 있는 언덕 위에 과거 봉홧불. 우리는 운 좋게 볼 수 있는 전통적인 한국인 무술 의 일부인 것입니다. 저는 꼭 이곳을 추천한 남산타워에 올라가서 전망은 맨 - 근처에 앉아 음료를 마실 수 있는 모서리의 아래에 있는 표를 구입한 통합 - 한 시간",5,남산공원,남산 공원,595
416,Santi C,좋은 뷰 포인트,"오래된 시내에 가까운, 할 수 있는 케이블카를 타고 남산타워 카운티까지 좋은 최고. 좋은 전망과 좋은 레스토랑.",4,남산공원,남산 공원,595
417,Kathryn S,사랑스러운 곳으로 산책,"모든 계절에 정말 멋진 곳. 산책로, 산책하기 tather 외도 foralised, 안내 꽃 침대, 나무가 우거진 지역 및 연못. 그리고 온천 지역에는 몇 가지 운동 영역 /. 가파른 언덕 전망이 아니라 몇 가집니다 문제를 해결할 수 있지만 가 있다. 공용 화장실이 있는 많은 피크닉 지역. 음식을 하는 곳은 없고 해서 타워. 전 구역은 없다. 좋은 곳은 하루를 실행할 수 있습니다.",5,남산공원,남산 공원,595
418,SandrineLondon59,아름다운 공원. 서울 타워 방문 결합하여 합니다!,다음에 케이블카를 추천하고 싶은 타워 꼭대기에 내려갈 nasam. 이 좋은 날 나온 서울 이다.,5,남산공원,남산 공원,595
419,akaneantares,나는 큰 기대...,"저희는 케이블카 로 n 서울 타워 맨 아래에 있는 ""공원"" 영역 위에 발견 은 아주 작은. ""잠금"" 지역이기 때문에 이 사람을 찾는 것이 어렵고 좋은 사진. 만약 충분한 양의 시간과 강한 느낌입니다. 나는 오래된 성벽 을 따라 걸어 올라가는 공원을 추천합니다.",4,남산공원,남산 공원,595
420,raniSpain,전망 좋은 공원,"숭례문 안쪽에서 벽을 향해 서 있고 서울 타워가 있다. 이것은 정말 좋은 공원이 다양한 경로가 동상, 몇 곳을 분수를 마시는 물과 화장실. 바쁜 있지, 걷기 싫은 사람들이 할것 이다. 저는 추천합니다.",5,남산공원,남산 공원,595
421,Ken V,가장 좋은 방법은 서울 타워,"할 때는 택시를 타고 서울 타워, 남산공원에서 내려 있는지 확인합니다. 제가 배운 것은 어려운 방법, 서울 타워 걸어서 위, 아래로 운을 견연사",5,남산공원,남산 공원,595
422,bob_neo,벚꽃을 하기 좋은 곳,"주민들은 관광객들로 붐비고 있습니다. 그러나 이유는 벚꽃이 있는 정말 좋은, 산책하기에 시간이 있다면, 그 풍경을 볼 수 없는 낭만적 이 도시.",4,남산공원,남산 공원,595
423,winwingogo,이 곳을 사랑합니다,서울에 가서 약을 먹고 쇼핑하는. 남산 공원은 해줄 수 있는 메모리. 여러 관광명소 사진. 의 가치가 있다.,4,남산공원,남산 공원,595
424,Melasx,경치 좋은,"내려가는 케이블카 타고 일몰 여행했다 방법 중 하나입니다. 놀라운 전망 이었다. 물론, 이 18도인 수 있었습니다. 이 때문에 모든 냉력 여행 다운 그의치료적 명동 쇼핑 거리. 약 30 45분 정도로 갈 수 있는!",4,남산공원,남산 공원,595
425,angie l,"서울에 가면, 안 가.","이 위치를 방문한다면 꼭 봐야 합니다. 완벽한 도시 전망 또한 환경. 방문하기 좋은 밤이나 낮이나. 흥미로운 것들을 할 수 있는, 완벽한 기회에 사진.",5,남산공원,남산 공원,595
