,u_id,title,review,u_rate,place_name,res_title,p_id
563,sambal g,몇 시간 동안 무료로 사용할 경우,"여기에 걸어 낼 수 있는 무료로 사용하는 게스트 하우스. 이 공원은 매우 광범위한 긴 산책하거나 조깅에 좋은 곳. 몇 시간 동안 판매할 수 있다면, 흥미로운 곳이다.",3,남산공원,남산 공원,595
564,mbirgen,"좋은, 뜨거운 거리의 아이들","성곽 을 따라 할 수 있고, 위로 이동할 수 있는 계획은 하지 않는, 할 수 있는 멋진 전망 좋은 언덕 위에 올라가야 합니다. 맨 꼭대기에 있는 많은 문화 들 이 있었는데 아이들이 호기심을 자극하는 데모 춤과 싸움. 저희는 걸어 갈 수 있는 계획은 아래에 와서.",4,남산공원,남산 공원,595
565,0Pete0,신선한 공기를 즐길 수 있는 방문 운동.,"재미있는 장소를 방문 할 때입니다. 우리는 지하철에서 케이블카 (약간 언덕 하이킹). 그 다음 케이블카를 주요. 지하철에서 올라가는 버스도 있습니다. 멋진 풍경이 있는 장소로 서울 대는 커피를, 마시고 먹을 것. 좋은 시간을 보낼 수 있는 사람들을 구경할 수 있. 또한 여러 산책로가 있어서 다시 사용할 수 있어 매우 흥미로운 이러한 (망친다음에!).",4,남산공원,남산 공원,595
566,Jazlynn L,에코 공원,"조용하고, 아름답고 좋은 곳이다. 걸어가시기 n 타워. 시작 n 타워에서 남산공원 을 향해 한국의 집. 모든 길에는 쉬울 것을 보여 주는 것입니다. 걱정 하지 마세요, 길을 잃을 걱정하지 않습니다.",5,남산공원,남산 공원,595
567,Carruthers77,훌륭한 전망 좋은 산책,"남산공원, (바닥에 따라 표시) 할 수 있는 서울의 지리적 중심, 산책을 하기에 좋은 곳에서 멀리 떨어져 있어서 교통 소음, 훌륭한 전망을 즐길 수 있어 동시에 할 수 있는 도시. 많고 많은 노선을 통해 최고의 산책로는 숲, 직접 도로 뿐 아니라 lead 의 최상위 남산, 찾을 수 있는 n 타워, 및, 특히 밤에, 환상적인 전망입니다. 서울에 있는 남산 정접이, 홍콩의 빅토리아 피크 입니다. 맨 위로 케이블카 도 있다면 너무 게으른 걸어서 갈 수 있었어요. 서울 시티 투어 버스 정류장도",5,남산공원,남산 공원,595
568,hazinheira,서울의 멋진 전망,"이 사랑스러운 공원, 주말에는 친구들과 가족과 함께 산책을 위한 완벽한. 길은 잘 관리되어 있으며 신호 화 스페이싱을. 액세스 포인트는 두 가지를 추천합니다: 그랜드 하얏트에서 - 쉽게, 명동에서, 케이블 카 위치를 찾을 수 있습니다. 대신 버스 두 가지가 최고. 길을 따라 사용 가능한 toilettes. 도착했을 때 최고의 경치를 즐길 수 있어요, 그리고 전통을 보여줍니다. 더 나은 전망을 즐길 수 있는 남산 타워를 방문하길 원하는 경우.",4,남산공원,남산 공원,595
569,Susu303,아름다운 정원,마음에 들면 식물원과 느낌입니다. 귀여운 연못에 많은 물고기와 거북이도 아름다운 꽃.,4,남산공원,남산 공원,595
570,hh12323,스카이라인 관광,"장거리를 방문한 도시에 산, 왜 여기에 오지 않는 남산공원. 꽤 재미있는 놀이기구 로 케이블카에서 보는 완전히 새로운 경험이 가장 기본적인 저와 제 친구들. 분위기가 이 지역에서 집중 한 자연의 섭리 에 집과 같은 느낌이 있는 많은 것을 느꼈다. 긴 시간. 나는 이렇게 생각 하지 않았다. 그러나 이제, 이 느낌이 다른 것을 통해.",4,남산공원,남산 공원,595
571,cheapdavid,방문하기 좋은 곳,"남산 공원은 방문할 가치가 있는 타워. 보다 더 좋은 곳은 없을 멋진 풍경을 볼 수 있습니다. 또한 명동 근처에 있어서 많은 나중에 할 것. 한 가지 이었다. 저는 약 15 분 정도를 기다리는 제 견연사. 당신이 가지고 있는 자신의 잠금 또는 사, 아닌. 할 수 있지만 여러 위치에 배치할 잠궈지다. 첫 번째 통과 하는 유일한 위치. 또 다른 하나는 더 높은 계단을 전망대. 너무 서두르지 말고 정보를 추가로 잠금 또는 경우 위에 두 위치. 남산 타워는 거래 수 있는 콤보 2 권, 2 음료,",4,남산공원,남산 공원,595
572,Sue W,서울 보기 좋은,아이들은 매우 작지만 남산타워에 올라가는 파노라마 전망이 정말 잘 볼 수 있습니다. 이 공원에서 가장 행복한 경험을 할 수 있는 작은 듯 해서 케이블카 의 아이콘 입니다!,4,남산공원,남산 공원,595
573,ReuvenM,Reommended,"서울의 근사한 경치. 레일을 reommende, 적어도 으로며. 테라스에 있는 높은 안테나 탑 안에 갈 수도, 폐쇄된 발코니가 있고 서울에서 새 보기 사진 볼 수 있습니다.",5,남산공원,남산 공원,595
574,AttyVicky,자물쇠의 모든 것,"하는 남산 공원을 방문하는 경우에 였습니다. 가서 위의 사랑의 자물쇠 나무 만 보고 펜스 통과 불가능. 하지만 대부분의 경우 몇 가집니다 새로운 철거. 수 있는 메시지의 타일을 사랑합니다. Trend 에 직접 연결할 수 및 잠금 또는 타일 - 가져가거나 사. 살아있는 박물관이 있는데, 작은 café, 위에서 볼 수 있는 수천 의 사람들이 방문하기. 아이스크림과 함께 츄러스나 도 맛이 좋은.",3,남산공원,남산 공원,595
575,Jennifer G,멋진 곳,"경우는 무료로, 이동이 있어서 남산공원, 아름다운. 멋진 전망에 따라 꽃과 나무들이 있는 곳에 있을 경우 whst 아름다운. 쉴 곳을 많은 곳입니다. 많이 걸어 공원, 가치가 있었어요.",3,남산공원,남산 공원,595
576,BBM M,아름다운 경치를 잠금,"택시를 타고 갔는데 약 18:00 케이블카. 도시 전망 을 봅니다 숨을 고르고, 당신이 가지고 있는 업체에서 잠금 또는 잠금 구입할 수 있습니다. 내 유일한 미국인에게는 이었고 된화합물 잠금 잘얼버무리다 경고: 나쁜 무릎에 많은 계단이 너무 많은 경우가 있을 것 입니다 - 알이 수 없는 경우 신체 - 엘리베이터가 있었는지 기억나지 않습니다. 나는 또한, 천천히 걷지",5,남산공원,남산 공원,595
577,MMLee,적극 추천합니다,"버스를 타고 가다 & 케이블카 다. 멋진 전망을 즐기실 수 있습니다. 아이가 너무 많은 것을 첨부 이다. 짧은 버스 정류장에서 걸어서 여행하기에 꽤 종아리 근육을! 귀찮게 하지 않은 파업 과 전망대가 있는 패키지 기다리기보다는 우리 좋은 (어쩌면 제가 잘못된), 내부는 그냥 마시 말씀드렸고 창에 있는 이탈리아 레스토랑 2nd 층의 전망이 좋은 조용한 곳에 도착.",5,남산공원,남산 공원,595
578,m2jscot,아름다운,우리는 남산타워에 케이블카 카운티까지 factastic 의 밤 풍경을 봅니다. 로맨틱한 장소 중 하나인 서울. 우리는 그들의 사랑을 속삭이 는 주위에 많은 연인 들.,5,남산공원,남산 공원,595
579,Brian H,운이 좋으면 1시간 미만일 것 입니다 견연사,"때로는 하기가 불가능하다는 위에 남산타워. 기다리는 짧은 시간 동안 한 견연사 스테이징될 수도 세. 한 하여, 밤에도 볼 수 있는 가치가 있습니다.",3,남산공원,남산 공원,595
580,TomCoyner,"아름다운 자연, 휴식을 취하거나 체크 아웃","서울에 있는 놀라운 약 뒷가죽 서피스의 자연 두번째입니다. 남산, 도시 한 가운데 에서, 대표적인 예 다. 그랜드 하얏트 호텔 서울 타워 간 이 아름다운 공원이 위치한 번 첫 번째 ' 외국인들이 "" 아파트 건물의 초기 60년대. 지금은 사라 아파트, 훌륭한 조경 교체, 완벽한 산책, 걷는 개, 서울의 멋진 전망을 가지고. 일반적으로 말하자면, 이 공원 안에 있는 것은 '보' 범주, 벚꽃 시즌 동안 포오스를. 이 공원에는 우수한 벚꽃 과 가을에, 대표적인 곳이 많은 다른 은행 잎 에서 단풍",4,남산공원,남산 공원,595
581,Bgpow,이 장소를 사랑하는 사람들,"서 있는 높은 곳이 한국 언산 고유한 타워. 남산공원, 서울 타워는 대부분의 경우 전화나 방문해야합니다. 할 수 있는 케이블카를 타고 올라가면 수 수 있습니다. 많은 작은 상점과 레스토랑이 있는 공원이 있습니다. 테디 베어 박물관을 많이 보고 있다. 특정 시간에 (관심 있으면 체크인 하기 전에) 타워 밖에 뮤지컬 공연. 밖에서 볼 때 전체를 구경할 수 있는 완료, 엘리베이터가 맨 타워 입력할 수 있습니다. 이 플랫폼 안 타워 원선도 볼 수 있습니다. 알이 수 있는 겉단장 관광명소 표시",5,남산공원,남산 공원,595
582,Arthur Jr D,로맨틱한 서울에 내려다 보이는 언덕,남산공원 은 전체 도시의 멋진 전망. 이 공원은 깨끗하고 좋은 음식이 최고죠. 꼭 좋은 곳으로 연인들이 사랑의 자물쇠 공원에서 특히 관심이 추가. 우리는 버스의 소리가 들려 온 내 친구가 있지만 여행사를 통해 일부 케이블 카. 많은 다른 투어 버스를 할 때가 있었다. 이와 함께 주민들은 관광객들. 30 분 정도만 머물기에 좋은 곳이지만 저녁을 먹을 시간을 보낸 사랑 이다.,4,남산공원,남산 공원,595
583,CraigTHETraveler,로맨틱한 남산,"처음 온 사람들에게 정말 좋아요. 남산공원 (n tower) 가 늦은 밤에 여자친구와, 이 때문에 좋은 대부분의 여행객들 에 의해 사라져 가는 시간에 도착해서 케이블카 첨두값. 이 곳의 경치를 제공하는 아주 로맨틱한 서울. 공원으로, 이 곳에는 많은 사람들이 사진을 찍을 여유 녹색 영역에 있습니다. 그리고 근처에 있는 상점들이 적당한 느낌없이 너무 상업 및 타워 관광 y.",4,남산공원,남산 공원,595
584,Aryani T,서울의 맛,"남산은 서울은 산 언덕 / 수 있는 놀라운, 많은 한국 드라마 / 영화 나타나는 설정된 서울. 밤에 가면 이곳에 사랑하는 것과 같은 느낌의 모든 파트너는 낭만적인 도시의 불빛 을 수천명의 입니다. 그러나 긴 줄 준비가 2시간 이상 케이블 카 대기 시간이 스테이징될 수 있습니다. 저는 오후에 가기 때문에 태양이 계속 많은 아름다운 경치. 앞으로 경우 가 제한된 시간 동안 오르막을 걸어서 가을단풍놀이 의 계절, 케이블카를 타고 있다 고 - 타워에서 걸어갈 수 있는 아름다운 나무 를 따라 색상이",4,남산공원,남산 공원,595
585,Mei Chern C,긴 줄을 선 케이블,"우리는 일요일에 명동 및 케이블카 역 택시를 시도 해봤는데, 우리는 택시가 있지만 대부분 하지 않습니다. 결국 우리는 택시 운전 기사에게 해 문의할 수 있는 멋진, 그러나 거대한 언덕 위 경사 포끼임, 그리고 마지막으로 케이블카 역에 도착했을 때, 매우 긴 케이블 카 대기 열이 있었다. 제 생각에 2시간을 걸리지 큐우에. 우리는 택시 기사가 우리에게 보내 준 최고의 호텔로 오라고. 저는 평일에 가 미래를 추천합니다.",3,남산공원,남산 공원,595
586,Aerith_Gains,재미있는 관광명소,"본 경우 충분한 k - 드라마, 잘 수 있는 곳일 것이 가치가 있습니다. 그 벽을 잠금 잠금 추가할 수 있습니다. 내부는 유료로 올라가는 타워. 약간 비싸지만 가치가 있지 않으므로 인상적이고 한 번 이상. 서울에 있는 했지만 전체적으로 볼 수 있을 필요 없이 밖에서 유사한 전망 타워, 그리고 더러워진 유리 하기 없기. 저희가 하루 동안 였지만 타워 밤에 더 인상적인 것 같습니다. 그러나, 우리는 조류를 의 - 한 눈에 - 그들은 무술 퍼포먼스 뷰를 바닥에서 타워의 입구에 있다. 저희는 또한",4,남산공원,남산 공원,595
587,raziffjamaluddin,관광지,서울 타워는 정말 유명한 도시에서 볼 수 있었습니다. 타워는 괜찮지만 내 생각에 타워를 올라가는 게 정말 힘들었어요. 앞으로 이곳에 필요한 시간을 때우기 에 후회 합니다.,3,남산공원,남산 공원,595
588,BongoSlave,좋은 곳이다.,시내 버스가 최고. 비쌀 타워. 저희는 걸어 맨 아래에 있는 매우 아름다운 공원. 일단 주변 관광지인 건물은 포장에서 중국인들이 아주 아주 큰 소리로.,5,남산공원,남산 공원,595
589,maxandlester,방문할 가치가 있는,"케이블카는 남산 공원에서 걸어서 명동 지하철 역, 약 10분. 바쁜 아침이나 오후가 될 수 있는 것을, 특히 의 공휴일이 나 주말. 그런 다음 이동하지 않는다면 언제 큐중. 차 후 약 8000 kw 케이블의 비용을 서울 타워 입구. 정상에서 서울의 멋진 전망. 겨울에는 봄 이다, 모두 좋은.",4,남산공원,남산 공원,595
590,WW_Traveller023,N 서울 타워 / 여행 중에서,이 도시에 있는 환상적인 공원인 번영. 당신의 산책로를 따라 벽을 따라 이동할 수 있습니다.,4,남산공원,남산 공원,595
591,Zolike78,음,공원 자체는 좋지만 사람이 붐빕니다. 탑은 바가지. 두 번 지불 (케이블카 타워 엘리베이터) 아리마를 케이블카를 타고 싶지 않습니다. 다음에 올라가서 전망을 즐길 수 있었어요. 피지 사람들이 좋아하지 않는다면.,3,남산공원,남산 공원,595
592,Kellie V,산에 올라 서울!,"거대한 전망이 좋은 곳은 서울의 범위를 제가 겁나 달리게하는. 위를 걸어갈 수 있는 케이블카를 추천 하다. 저는 중간에 날 시간이 야 케이블카를 고려하지 않았다. 놀라 울 정도로 걷는 것을 확인하는 방법을 제공하고, 참여한 것 같지만 여러 점이 패스 - 나는 택시를 타고 갈 수 있는 것 중 하나는 이미 반쯤 하다. 많은 사람들의 머리 위로 언산 너무 - 라고 하는 것은 소프트 경로를 사용하는 산 정상 까지의 매저 키스트 죠그.",4,남산공원,남산 공원,595
593,yfylou,아름다운 전망,남산 타워로 올라가는 하지 않지만 공원 주변을 보면서. 예쁜 봄 꽃 에서 꽃이 피지 다.,3,남산공원,남산 공원,595
594,Purdue_Paul,"볼, 얼마나 큰 서울을 보여줍니다. 하지 않지만 제가 본 $2 가 예쁜 보기",나는 서울로 가는 기차를 타고 역으로. 그곳에서 나는 버스 노선 카운티까지 03. 이 버스의 수 있지만 표시된 라우트를 멈추개 역에서 10번 출구 03 일 것이다. 그곳에서 약 15 가지 꼭대기 전망대. 어쩌면 1/4 마일 의 타워. 30분이나 정말 위에 충분했습니다. 관광버스를 타고 갈 수 있을 뿐인 시내 버스인 공원. 하지만 버스는 엘리베이터에 쉽고 빠르게 할 것이다. 저는 이제 제가 아는 그 무엇을 알고 있었다. 저는 모든 버스가 언덕 아래로 내려가는 방향으로 하고. 저는 계속해서,4,남산공원,남산 공원,595
595,HONkiev,밤에 가서!,"케이블카를 타면 서울에서 볼 수 있는 완벽한 조명! 하지만 긴 케이블카를 타고 아래로 준비되어 있어, 더 나은 거리.",4,남산공원,남산 공원,595
596,Dreamzatwork,"아름다운, 걷는 추천!","이 공원은 아름다운, 사랑스러운 걸으며 산책하기에 강력 추천합니다. 1시간 정도 걸렸습니다. 저는 남편과 함께 갔다. 등산이 아니라 약간은 구릉 이 있는 나무 계단 하나였고요. 자연을 좋아한다면, 좋은 산책을 즐길 수 있는 공원이 꼭 하는 것. 라고 생각하지 않기 때문에 이 방법은 서울 타워. 남산공원 산책을 할 수 있는 타워 아리마를 아닌... 우리의 제안에 우리는 길: 우리는 한강을 걸어 역 출구에서 시작 작성하시면 6 방향선 (직접 사우스) 및 오른쪽에 보이는 나무 계단이 있다. 이 길을",5,남산공원,남산 공원,595
597,Sophy W,그렇,"매우 피곤한 내 연령 이 올라가야 합니다. 낮에 가서, 전망이 인상적이다. 밤이 될 수 있습니다. 를 제외하고 모든 '사랑의 자물쇠, ' 할 수 있는 정말 많지 않은 것을 수행합니다. 에 레스토랑, 카페 ', 그리고 달콤한 가게들.",3,남산공원,남산 공원,595
598,Dungca k,보기 좋은,시간은 충분하지만 0.5. (약 1시간 내지 1.5 시간) 이 좋기 밤에 추천합니다. 모든 세계에서 볼 수 있는 몇 가지,4,남산공원,남산 공원,595
599,csbernard,남산 타워는 꼭,서울에 올 때 가서 남산타워. 도시 전체를 이 시점에서 볼 수 있다. 케이블카를 탈 수 있지만 걸어서 갈 수 있습니다 주요. 또한 지불의 티켓 으로 실제 타워. 그만한 가치가 있는.,5,남산공원,남산 공원,595
600,Chae O,보기 좋은 도시,"5분 정도 걸리는 케이블카를 타고, 창문에 서 답변하기 때문. 더 걸어 대한 뷰 또는 최대 treelined. 이 탑은 역사, 현대적인 건물이지만 시간입니다. 스페이스 니들이 다른 높은 점수를 생각나게 하는 도시. 놓치면 이, 아닙니다 큰 거래. 두 번째. 처음. 탑 타워 에 가서 식사를. 모든 레스토랑은 좋은 음식 아닙니다 방사에 세계를 얻을 수 있는, 그러나 지불하는 절경 이다.",3,남산공원,남산 공원,595
601,Kwan A,"멋진 풍경, 석양을 즐길 수 있는","우리는 엘리베이터를 타고 케이블카 역을 타고 남산 케이블 카 최대. 언덕 전체가 벚꽃, 케이블카 올라가는 경우 아주 좋은 장면. 우리는 그곳에 가다 4-5 pm, 덜 붐비고 짧은 대기. 하지만 제가 갔던 날도 멋진 일몰을 볼 수 있는 안개가 조금. 보기 좋은 사랑의 자물쇠 옆의 벽. 결혼 해서 사진 좋은 곳입니다.",4,남산공원,남산 공원,595
602,MrNicTan,재미를 타고 좋은 곳,수도의 끝을 케이블 카를 타고 레스토랑입니다. 파스타 / 피자 레스토랑은 굉장히 멋진 전망을 제공하는 하나의 도시. 음식도 맛이 꽤 좋았습니다. 이 기간 동안 와서 벚꽃 은 벚꽃을 볼 수에 따라 다른 유형의 꽃 길. 택시를 탈 수도 있고 케이블카를 사용하지 않는 경우.,5,남산공원,남산 공원,595
603,gaurshar,"전망이 아름다운, 조용하고 신선한",2의 옵션이 다음 콘크리트 도로 또는 자연의 흔적. 정장 스타일과 무드. 멋진 전망을 즐길 수 있는 기간 동안 꼭 해야 할 측면.,5,남산공원,남산 공원,595
604,Diane D,"좋은 공원이 있고, 흥미로운 도시 전망",있는 몇 시간 동안 남산공원에서 즐거운 하루를 추적하기 카운티까지 이른 봄 벚꽃 만개. 안전하고 깨끗합니다. 몇 가집니다 단계를 통해 감상할 수 있는 몇 가집니다. 를 타고 타워를 타고 도시 전망. 저는 도시를 전망하는 플래너에 관심. 방대한 규모의 도시는 시내 놀라워. 다른 타워 제어능 시간 및 비용 절감할 수 있습니다 찾을 수 없습니다.,5,남산공원,남산 공원,595
605,Jan P,좋은 전망은 최고,북촌 한옥 마을에서 우리는 케이블카 (오르막 이 있기 때문에 주의할 점)를 케이블카 꼭대기. 확실히 좋은 플레이를 서울에서. 의 작동을 합니다 - 꽤 참신하고 멋진 사진을 만듭니다. 이 곳은 많은 사람들이 여전히 즐거운 오후.,4,남산공원,남산 공원,595
606,Shelby8129,좋은 곳! 버스를 타고 타워를 맨!,내 친구와 나는 걸어서 타워... 2 1/2 시간이 걸리지! 하지만 오래 걸렸죠. 즐거웠습니다. 많은 사람들이 가면 있습니다. 택시 또는 버스를 잡는 것을 추천합니다 최고는 아닌 듯 합니다.,5,남산공원,남산 공원,595
607,Joey N,큰 산을 걷는,우리는 오후에 산을 걷는 대신 케이블카. 자연과 좋은 사진을 찍을 기회도 많다. 벚꽃이 있는 봄 은 주위에 갔다. 걸어서 50분 정도 시간이 걸렸다 하며 사진을 찍어 휴식을 할 수 있습니다.,4,남산공원,남산 공원,595
608,angelzhizni,좋은 전망,"게다가 이 공원에는 남산 타워를 제외한 세트를 한 것이 정말 입니다. 더 이상의 경작 된 및 기타 몇 가집니다 구조와 제자리표. 복구된 서울의 벽이 다, 하지만 가장 좋은 점은 서울 타워. 모든 평면 지형 에 기대하지 않습니다. 또는 위쪽 또는 아래쪽 입니다.",4,남산공원,남산 공원,595
609,Jen Y,포기하지 않고 케이블 카,"일반적인 운동을 하는 사람이라면, 언덕을 올라가지 요. 긴 줄에 있는 케이블 카도 에서 마침내, 이 비좁은 느낌의 중량 초과. 자전거를 타고 5 분이 걸릴 뿐입니다 한 시간 처럼 느껴졌어요. 걸어 갈 수 있는 1/2 만 한시간, 두 시간이 1시간에 걷는 것, 할 수 있는 사람들의 코를 보고 실제로 관광 이고.",3,남산공원,남산 공원,595
610,Douglas T,서울 산책하기,서울에서 가장 좋은 방법 중 하나인 하루를 보낸 날의 여러 경로를 남산 이 있다. 하지만 많은 풍경과 상쾌한 도 비싸지 않습니다.,5,남산공원,남산 공원,595
611,nazrul,가야한다!,"아름다운 공원. 걷는 시도로 남산타워. 아름다운 풍경, 특히 일몰... 걷는 것보다 재미있 싶어요!",5,남산공원,남산 공원,595
612,kaijunjiang,의 분주함에서 벗어나,"주요 도로에서 언덕에 갈 수 있 지. 조용한 분위기에 놀라 선택할 수 있습니다. 매우 쉽게 갈 수 있어서, 좋은 대화와 함께 피어 (s).",4,남산공원,남산 공원,595
613,LeslieConti,경치!,"연애 풍경, 날씨. 이것도 좋은 인상도 카운티까지 이동. 약간의 운동 과 함께 고요함과 존경 은 휴식을 위한 절호의 기회!",5,남산공원,남산 공원,595
614,Carol D,자연 오아시스 도시에서,"저는 케이블카를 타고 언덕 위 이었고 넓으면서 멋진 전망, 일부 지역 역사 정보 및 일부 사람들. 문화 무용곡 및 수행한 무술 디스플레이, 그리고 많은 등산객 쇼핑 및 음식점. 예정보다 훨씬 더 묵었는데, 여행을 즐길 수 있고 (좀 정신없이 바쁜 도시 생활에서 벗어나)",5,남산공원,남산 공원,595
615,Cindy H,서울 타워 재밌.,이 타워는 야간 방문에 최적인 호텔. 위치는 서울에서 최고 360도의 산 보다 도시의 불빛. 가파른 경사를 오르고 나가질 지원하지만 제가 앞서 타워 노력.,5,남산공원,남산 공원,595
616,PKmarc,화려한보기,제가 갔을 때 날씨는 섭씨 6 이고 하늘이 맑아서 더 멋진 사람이 먼저 하는 날씨. 넌 가벼운 하이킹에 던지는 케이블카 의 타워에 8500원 왕복. 운이 좋으면 한국 무용 과 무술 성능. 유일한 관광명소 이지만 타워 꼭대기 말할거야 조금 작은 경우 맞견주다 다른 타워 세계. 중요사항 확인하려면 잠금은 애인의 증거.,5,남산공원,남산 공원,595
617,kang_a_ji,"부모는, 그다지 흥미 있는 일이","놀라운 서울의 전망 공원과 함께 벤치에서 잘 마련, 꽃과 전망대 점. 애들이 였지만 금방 지루해. 계단도 있었는데 하드 에. 것이 참 에 커플인 생각!",4,남산공원,남산 공원,595
618,lovelyyumi,좋은 광 추적 및,"두가지 방법으로 가져올 수 있습니다. 하나는 케이블카 나머지 하나는 트랙. 두 번째 방법을 선호하지만 조금 찾기 어렵죠. 만약 일반 여행객, 케이블카 로 올라간 더. 여긴 정말 좋은 전망과 야경 서울 전체. 한 거대한 그룹의 중국 도 만나 줍니다",4,남산공원,남산 공원,595
619,ChaiMK,"오랜 산책, 매우 피곤함",매일의 연습이 오히려 공원 관광. 너무 많이 먹으면 쇼핑 후. 저는 여기 추천하고 서울에 좋은 사진.,3,남산공원,남산 공원,595
620,Piratacoqui,Vidirt,"방문 일부로 seoulistic 토요일 밤 야간 투어 제공. 많은 커플, 벨소리 로 흥분. 즐기고 경치, 새 친구들과 시간 (seoulistic), 딸. 이 곳은 한 사람. 신선한, 순진한, 순진한 사랑, 현실 생활의 전에 잡아서 는 골고루. 제 생각에 스스로 난 후 방문하면 브레이크 업, 열심히 하는 ""사랑""에 흠뻑 빠지는 것 같아서 듣는 공기.",5,남산공원,남산 공원,595
621,Alexander S,꼭 가봐야 할 곳,"만약 이 있네요. 내가 말하는 이. 탈 수 있고 다양한 하이킹 코스를 좋은 명소, 아름다운 신사 를 패스 북, 수도 서울 요새 벽을 따라 하이킹. 나는 단지 몇 시간의 방황 다양한 경로를 여기에 다시 할 것이다.",5,남산공원,남산 공원,595
622,Alisdair H,"이 공원은 모든 것이다. 자연, 이전, 새, 휴양, 레스토랑과 사랑의 자물쇠.","가봐야 할 곳이다. 나도 약간 회의적입니다 야경이 도시는 매력, 하지만 이게. 그냥 점프 는 케이블카. 도보로 공원, 단계를 선택하면 이 많지만 가치있는. 이 공원은 아름답고, 주민들의 산책을 하고, 분위기 모두 똑같이 스타일 삽착조작이 충족하도록. 작은 휴식 공간. 휴식, 아름다운. 평화로운. 그 다음 케이블카를 탔습니다. 케이블카 도 괜찮다, 하지만 제 생각에 이 뷰가 하단의 타워 우수합니다. 꽤 낮다면 무섭지. 사랑의 자물쇠. 고향 이다. 저는 기대하지 않았지만 삽탈식 됩니다",5,남산공원,남산 공원,595
