,u_id,title,review,u_rate,place_name,res_title,p_id
150,jodanpapa,산책로로 너무 좋은 곳...,"버스를 타고 가는 것도 좋겠지만 개인적으로는 천천히 걷는 것을 더욱 추천... 특히나 단풍이 아름다운 가을에 국립극장 입구에서부터 N서울타워 아랫쪽 버스 정류장을 거쳐 남산도서관까지 이르는 길은 적당히 운동량도 채울 수 있고, 멋진 서울의 가을도 볼 수 있어서 강력하게 추천...",5,남산공원,남산 공원,595
151,Teresa1117,케이블카는 너무 비싸고,남산공원 자체는 좋음. 걸어서 가면 운동도 되고 좋아요. 강력추천. 아님 버스타고 가면 금방. 케이블카는... 음... 비싸기만 함. 데이트시 1번은 추천,5,남산공원,남산 공원,595
152,Tae Min E,케이블카는 비싸다,저는 올라갈때는 순환버스를 타고 내려올때는 케이블카를 이용했는데 케이블카 요금은 비싼 편입니다만 밤에는 야경을 보면서 내려올수 있어서 좋습니다. 다음에 다시 온다면 서울타워 옆에 사랑의 자물쇠를 걸어놓고 와야겠네요,4,남산공원,남산 공원,595
153,졍,서울시내가 한눈에..,4호선 명동역을 이용하여 가시면 편리해요. 명동역에서 10분 정도 도보로 가다 보면 남산공원을 가기 위한 케이블카가 나옵니다. 산에 위치해 있어서 산책겸 걸어가셔도 되고 케이블카를 이용해도 좋습니다. 저는 그래도 케이블카 탑승을 추천합니다. 걷기에는 조금 힘드실 수 있어요. 주차는 따로 되지 않기 때문에 대중교통을 이용해서 가시면 좋아요. 서울 사람들 뿐만아니라 외국인들도 많이 방문합니다.,5,남산공원,남산 공원,595
154,이안팍,서울의 핵심,케이블카를 타도 좋고 걸어 올라가도 좋고 걸어 내려오도 좋다 타워 올라가는 것은 돈이 드니 안 올라가도 좋은 곳이다 밥 집도 타워 밑에 있어서 좋다,4,남산공원,남산 공원,595
155,tank54321,정말 오랫만에 케이블카 타보네요.,단풍이 곱게 물든 남산에서 정말 오랜만에 케이블카를 다시 타보네요. 짧아서 아쉬웠고 중국 관광객 정말 많네요.,3,남산공원,남산 공원,595
156,엔도마메,케이블카 체험 좋아요,걸어서도 가보고 케이블카로도 방문 해 보았습니다. 케이블카로 올라가시면 편하게 갈 수 있습니다.,4,남산공원,남산 공원,595
157,sashenka78,남산나들이,조용한 산책로 나들이도 좋고 남산타워 전망대도 한번은 올라가서 도심야경을 즐기기에 좋았어요.. 대기시간에 비해 탑승시간이 너무 짧아 살짝 당황스러웠지만 아이들과 함께 한 시간이라 즐거웠어요...,5,남산공원,남산 공원,595
158,ComiNyang,산책하기 좋아요~,삭막한 서울에서 나무를 보며 쉴 수있는 가까운 곳인것같아요~ 전 가끔은 계단을 이용해서 운동겸 산책을 하는데요 생각보다 이용객이 많아요~ 공기도 좋고 넓고 식물원도 있고~ 가족이 오기에도 좋은것같아용^^~,5,남산공원,남산 공원,595
159,Moonkyu K,커플들이라면 꼭 가는 필수코스,남산타워를 가는 것도 좋고 케이블카를 타고보는 야경도 좋다. 걸어오른것은 주민 혹은 운동을 목적으로 하는것이 좋을정도로 쉽지는 않다. 자물쇠를 걸고 야경을 보고 근처라면 운동도하고 도서관도가고. 올라가는 코스도 가지각색.,5,남산공원,남산 공원,595
160,밍키멍멍,외국인친구덕분에타본 남산 케이블카,남산근처만 지나다니다 외국인친구덕분에 저도 오랫만에 남산 케이블카도 타보고 남산공원 구경도 했네요 드라마속 남산이 자주나와서인지 꼭 보고프다던 남산공원에서 열쇠도 걸어보고 사진도 엄청 찍고 남산공원근처의 맛집도 가보고 즐거운 시간이였습니다 케이블카로 보이는 도심속의 모습이 이쁘더라구요,5,남산공원,남산 공원,595
161,엘리양,돈가스도맛있고 전통적인관광지,돈가스도맛있고 전통적인관광지예요 케이블카타고 올라가기 계단걷기 특히 봄벗꽃놀이 하기좋은 공기좋은곳,4,남산공원,남산 공원,595
162,죠이어,한번쯤 가볼만 한곳,한번쯤 가볼만 한 곳입니다. 서울시 내려다보이는 경치도 멋지고 케이블카 타고 구경하는 것도 재미있어요~,5,남산공원,남산 공원,595
163,reverb83,케이블카는 가격만큼의...,케이블카를 타는 것은 물론 추천하고 싶지만 그 가격만큼의 가치보다는 차라리 남산 순환버스를 추천함. 한강 이북의 서울 도심의 중심산으로 그 가치가 충분히 인정되는 곳임,4,남산공원,남산 공원,595
164,Jiyoon Y,서울의 야경을 한눈에 감상♡,맑은날에는 낮에도 밤에도 다 예쁘지만 특히 밤에는 남산타워가 요술봉(?)으로 변신하는 모습을 확인할수 있답니다! 서울의 야경이 가장 아름다운곳ⓛⓞⓥⓔ,5,남산공원,남산 공원,595
165,Heui Ho K,서울 시민의 휴식처 남산 공원,"케이블 카를 타도 좋고, 걸어 가도 좋다. 봄에 가도 좋고, 가을에 가도 좋은 남산 공원. 계절을 느끼고 싶을 때, 가족과 나들이 가고 싶을 때 추천한다.",4,남산공원,남산 공원,595
166,nayepp,추천해요,남산공원에서 산책하고 케이블카에 탑승했어요~주말이라 꽤 붐볐지만 시내전경도 감상하고 색다른 경험을 오랜만에 하니 즐거웠어요,4,남산공원,남산 공원,595
167,진규 이,서울의 계절 신호등 남산!,"남산이 있는 위치는 정말 절묘하다. 서울의 복판에 어떻게 그렇게 아름답고 아담한 산이 존재할 수 있는지.. 조물주의 손길에 감사의 마음을 표한다. 산의 색깔이 계절마다 변하여 아름답게 물드니 그 산 자체가 계절을 나타내는 신호등 역할을 한다. 그래서 그 산에는 많은 사람들이 정겹게 모여든다. 그걸 알고 도시는 세심한 배려의 손길을 펼쳐놓아 이 또한 고맙다. 자연의 경관을 헤치지 않으면서도 그 곳곳에 즐길거리들이 많고, 자연 그 자체를 즐길 수 있는 시설도 잘 되어 있는 편이다. 케이블카가 그렇고",4,남산공원,남산 공원,595
168,jjjjj111,이곳은 봄에!,가을 단풍질 때 가도 멋진 곳이지만 역시 남산은 봄에 벚꽃 필 때가 가장 아름답지 않은가 싶다.,4,남산공원,남산 공원,595
169,TristanKim,산책하기 좋은 곳.,적당히 산책하기 좋은 곳이다. 공원입구에서 정상까지 20분 정도 걸으면 충분히 도착한다. 케이블카는 관광객으로 만원이다. 오히려 걷는게 구경하기에 더 좋다. 남산타워도 좋으며 타워 1층에 있는 햄버거 가게가 맛있다.,5,남산공원,남산 공원,595
170,안전하게,근처 에 있는 남산공원 케이블카 탑승,밀레니엄 힐튼이 남산타워에 가까이 있어서 케이블카를 탔습니다. 다행이 명동성당에서부터 남산케이블 까지 운좋게도 사람이 많지 않아 편하게 탈수 있었습니다.,4,남산공원,남산 공원,595
171,뇽아,남산공원 방문,작년에 가족들과 처음으로 방문한 남산공원! 케이블카도 타고 경치도 감상하고 너무 좋았어요~ 다음에도 또 방문해야겠어요 ㅎㅎ,5,남산공원,남산 공원,595
172,everlsk,서울의 상징인 남산,서울에서 북한산과 더불어 명산으로 꼽히는 남산. 남산에 위치한 남산 공원은 케이블카와 N서울타워가 유명합니다. 또한 일몰과 일출을 모두 볼 수 있는 곳이기도 합니다.,5,남산공원,남산 공원,595
173,진경 서,벗꽃놀이에는 남산이 최고,봄에 벗꽃하고 개나리가 너무 예쁘게 피어서 좋았어요 케이블카 줄 너무 길고 주자할 곳이 너무 없으니 대중교통이용하고 걸어올라가야해요,5,남산공원,남산 공원,595
174,firstclimax,외국인들의 명소,올라가면 서울 시내가 한눈에~ 야경도 너무 멋지고. 커플들은 자물쇠도 걸어보시길.ㅎㅎ 올라갈땐 케이블카 내려올떈 걸어서~^^,5,남산공원,남산 공원,595
175,mkla1004,케이블카보단 걸어올라가시길 .,케이블카는 줄이 너무 길고 20여분이면 남산타워까지 갈수 있는데 . 걸어서 풍경보면서 가는거 추천합니다.,4,남산공원,남산 공원,595
176,다님,서울 시내에서 나무 냄새가 맡고 싶을때,"여름이나 가을 단풍일 때 케이블카에서 내려다보는 남산 숲은 정말 아름답습니다. 매연 냄새 가득한 시내에서 남산 중턱만 올라가도 나무 냄새를 맘껏 맡을 수 있습니다. 남산 버스를 타고 올라가면 천천히 숲 속에 쌓여 올라갈 수 있어서 좋고, 케이블카를 타고 올라가면 비용은 좀 되지만 위에서 내려다볼 수 있어 좋습니다. 걸어올라가 본 적은 없지만 건강을 위해서라면 이 방법에 제일 좋겠지요. 외곽에 있었다면 평범한 산이었겠지만 서울 한복판에 있기 때문에 귀중한 산이네요.",5,남산공원,남산 공원,595
177,상준 박,서울 명소,서울 명소 남산~~ 주말에는 케이블카 타려면 오래 걸리고 한번 벌어서 올라가 보는것도 좋네요~~ 특히 가을에 너무 이쁘네요 ^^,4,남산공원,남산 공원,595
178,jjbar,서울의명소,서울남산에있어서서울시민들이라면꼭가야라는장소입니다봄가을이특히운동겸산책하기좋으며연인들데이트장고로도좋습니다,4,남산공원,남산 공원,595
179,쩡양,서울야경구경하기 좋은곳..,서울 야경구경하기 참 좋은곳이다. 근데 케이블카 비용이나 엘리베이터 이용비용이 좀 비싸다. 예전처럼 차가 올라가지 않으니 한산한 느낌은 좋지만 케이블카 비용이 좀 저렴해졌음 싶다.,3,남산공원,남산 공원,595
180,DH Shin,여전히 연인들의 추억 장소,"케이블카를 타던지, 남산 순환 버스를 타던지, 남산으로 올라가는 길은 너무 좋습니다. 꼭대기에 있는 정자나, 타워도 여전히 서울의 모습을 감상하기에 가장 좋은 곳입니다. 도쿄에도 비슷한 타워가 있지만 전망은 서울 타워가 훨씬 좋습니다.",4,남산공원,남산 공원,595
181,만옥이네,외국인에게 추천하고 싶은 곳,낮에는 명동에서 서울을 느끼고 밤이 되면 저녁을 먹고 산책겸 올라가서 서울 야경을 보는 것을 강추한다.,4,남산공원,남산 공원,595
182,피스치오,서울의 야경을 한눈에,남산공원에 올라가 보는 서울의 야경은 정말 명품인것 같습니다. 탁 트인 공간에서 시원한 바람과 함께 사방을 다 볼수 있는 남산공원은 누구와 함께 해도 손색없는 장소입니다,5,남산공원,남산 공원,595
183,파랑나비,자물쇠 들고,"남산은 버스, 케이블카, 걸어서, 택시, 자차 등 여러가지 방법으로 올라갈 수 있습니다. 자물쇠 거는 커플들 엄청 많고요.",4,남산공원,남산 공원,595
184,Suk Yeon K,서울에서 꼭 가봐야할 곳,날씨가 덥지 않을때는 산책로를 따라 걸어서 올라가는것도 좋습니다. 남산 꼭대기에서 남산타워도 구경하고 차도 마시고 야경도 보고 정말 좋아요. 자주 가보고싶은 곳이예요.,4,남산공원,남산 공원,595
185,alfo5,남산공원 실개천길,남산 하얏트 바로 옆에 있는 주차장에 주차하고 실개천이 있는 곳으로 가서 놀았어요 새소리 바람소리 모두 좋아요,5,남산공원,남산 공원,595
186,에종이,답답할때 숲이 필요할 때 들리면 딱 좋은곳!,"북적이는 명동에서 벗어나 잠시 자연을 느끼고 싶을때 케이블 카 타고 올라가면 남산공원이 펼쳐진다. 2시간 하이킹 코스로도 좋고, 나무 사이를 걷다보면 스트레스는 싹- 주말 아침 한나절 기분좋게 운동할 수 있는곳^^",5,남산공원,남산 공원,595
187,quus,서울의 중심,서울에는 산도 많지만 남산이 그 한가운데이다. 이 큰 도시의 한가운데 남산이 있어 참 다행이다. 국립극장입구부터 남쪽 순환로로 올라가는 숲길이 제일 좋다. 승객용일반 버스는 전기버스라 괜챦은데 일반 관광버스는 매연때문에 시민들에게 불편을 준다. 개선되었스면 좋겠다.,5,남산공원,남산 공원,595
188,ssh5252,서울에서 가장 이쁜공원,"근처 도서관도 있고, 호텔도 있고 무엇보다 남산공원이 넓게있어 정말 원없이 산책하기 좋은 곳이랍니다. 운동기구와 화장실도 깨끗하게 되어있어 늘 올때마다 기분좋은곳",5,남산공원,남산 공원,595
189,JYH,사계절의 모습~,남산은 대한민국의 사계절의 모습을 가까이 볼 수 있는곳이죠 부담없이 걷기에 안성맞춤 봄 여름 가을 겨울 언제든 방문해도 그 나름의 모습이 감동을 줍니다,5,남산공원,남산 공원,595
190,놀아놀아,야경은 100만불입니다.,야경이 너무 예쁜곳입니다. 주차는 힘들어서 늘 대중교통을 이용하구요 케이블카도 줄서있는거 보면 엄두가 안나서...올라갈땐 걸어올라가고 내려올때만 타고 내려오곤합니다. 타워입장료가 비싸긴하지만 올라가서 보는 야경은 정~말 예쁩니다~,5,남산공원,남산 공원,595
191,hayul13,봄가을이 예쁜 산,명동에서 가끔씩 남산에 오르고 싶을 때 버스를 타고 자주 찾았었는데요. 특히 봄 가을이 아름다운 산입니다. 체력이 된다면 걸으면서 남산을 즐기는 게 가장 좋구요. 버스와 케이블카로 정상에 오를 수 있습니다.,4,남산공원,남산 공원,595
192,경구 한,오랜만에 들린 남산,예전 데이트할때 많이 갔었는데 오랜만에 와이프와 남산에 올라 갔다왔어요. 개인적인 의견이지만 남산 야경은 어디에 내놔도 속색없다고 봅니다.,5,남산공원,남산 공원,595
193,공부를하자,남산공원 바람쐬기 좋아요.,"케이블카 타고 올라가면 재미있긴 하지만, 케이블카 타려는 사람들이 많아서 항상 오래 기다려야해요. 충무로역에 가면 남산공원으로 가는 버스가 있으니 그거 타고 가는게 더 좋습니다~",5,남산공원,남산 공원,595
194,2875rosa,케이블카를 타야합니다.,계단으로 올라가다가 너무 힘들었어요 많이 기다리더라도 케이블카를 이용하시는게 좋을것 같습니다.,3,남산공원,남산 공원,595
195,ehsghk,야경보러 갔었어요.,야경보러 갔었어요. 케이블카는 안탔고요. 전망대 올라갔는데 입장료가 제법 비쌌네요. 그래도 볼만했어요 ^^,4,남산공원,남산 공원,595
196,renahoony,저녁에 야경이 예쁜 곳-,남자친구랑 기념일 맞아 다시 찾은 남산공원! :) 이번엔 버스타고 올라가지 않고 케이블카를 타고 올라갔는데 재밌더라구요 ㅎㅎㅎ 고소공포증 때문에 걱정하다 탔는데 케이블카안에서 잔잔한 음악도 나오고 반짝반짝 서울의 야경이 예뻐서 넋을 놓고 바라봤어요! 한겨울이라 덜덜 떨 정도로 추웠지만 남산에서 바라보는 서울의 야경이 정말 예술이더라구요 :) 안에서 따뜻한 커피도 한잔하고 이것저것 파는 것도 구경하고 내려왔어요~ 남산타워 꼭대기까지 올라가려다 비싸서 포기했는데 다음엔 꼭 올라가보고 싶어요!,5,남산공원,남산 공원,595
197,lkimsoyeonl,날씨 좋으면 서울시내가 한눈에,낮에도 밤에도 낭만적인 곳이에요 서울의 4계절을 볼 수 있는 곳이라 어느 때라도 좋습니다 미세먼지가 많지 않으면요 ....,5,남산공원,남산 공원,595
198,최쁘,데이트하기 좋은곳,데이트하기 좋은곳 날씨좋은날 케이블카 타고 올라가서 야경구경하고 남산타워 구경하는거 좋아요 단 주말이나 특별한 공휴일은 피하는게 좋아요 사람너무 많고요,4,남산공원,남산 공원,595
199,음식유목민,남산공원:영원한 사랑의 고백처,천송이가 도민준에게 사랑의 고백을 받고 싶어하던 곳입니다.서울을 내려다보면서 사랑을 고백받는다면 로맨틱하겠죠.자물쇠도 하나 준비해보세요.영원한 사랑을 고백하기에 좋은 곳입니다.,5,남산공원,남산 공원,595
200,inthesub,산책하기 좋은 남산공원,남산 타워는 높아서 부담되면 남산공원에서 나들이 하는 것도 좋아요. 도심에서 살짝만 벗어나도 상쾌한 기분을 느낄 수 있어요.,4,남산공원,남산 공원,595
201,hana,매력있는곳~,"케이블카는 줄이 너무 길어서, 가깝겠거니 하고, 걸어 올라갔는데 너무 힘들었어요... 마을버스 타고 가시는거 추천해요!!! 전망대에 올라가지 않아도, 어느정도 서울전경은 보여요~ 4계절 다 가보았는데, 나름대로 다 좋았어요~ 제가 갔을땐 풍물놀이 갔은것도 했는데 잘 맞추어 가시면 구경거리가 많을것 같아요! 다음번에 케이블카 꼭 타보고 싶네요~",4,남산공원,남산 공원,595
202,jowajin,서울을 한 눈에~,서울을 풍경을 한 눈에 볼 수 있는 것 만으로 충분히 방문할만 한 곳입니다. 승용차로는 전망대까지 갈 수 없고 걸어서 오르기엔 적잖이 힘든 곳이니 대중교통을 잘 활용해야 합니다.,3,남산공원,남산 공원,595
203,뽀오,숨겨진 서울명소,"신세계 백화점 본점 근처의 엘레베이터 타고 올라가서 만나는 남산 공원이 빽빽한 빌딩숲에서 숨통트이게 하는 마법같은 길이라고 생각한다. 산책로도 왕복 1~2시간이면 가능하고, 지나가는 길에 목멱산방에서 차 한잔하기도 좋은 한나절 서울 나들이 코스.",4,남산공원,남산 공원,595
204,Wanimyo,남산 공원,"서울하면 떠오르는 남산공원 버스를 타고 가도 좋고, 케이블카를 타도 좋고, 걸어서 올라가도 좋고... 무료전망대에서 보는 야경이 좋은 곳",4,남산공원,남산 공원,595
205,white57a,남산 공원,"요즘 남산 공원에는 중국 관광객들이 많습니다. 드라마 영향으로 관광버스를 타고들 오더군요. 다소 혼잡할 수 있으나, 날씨 좋은 저녁 남산 공원에서 보는 야경은 참으로 아름답습니다.",4,남산공원,남산 공원,595
206,주빈,서울여행의 필수,서울여행의 필수 택시타고 이동도 가능하구요 남대문에서 엘리베이터로 이동도 가능합니다. 서울 야경잘보여요,4,남산공원,남산 공원,595
207,dowonjj,남산 공원,서울에서 야경을 보기 가장 좋은 곳이라고 생각한다. 낮과 밤의 분위기가 많이 다르다. 맥주와 간단한 간식거리를 가지고 올라가 앉아 야경을 보며 먹는 것도 좋은 경험일 듯!,4,남산공원,남산 공원,595
208,묘미,별로에요,예전이나 크게 변함이 없는 그 곳 남산 이제는 좀 더 큰 변화가 있어야 할 거 같아요. 가볍게 케이블카 타기에는 좋습니다.,2,남산공원,남산 공원,595
209,미경 박,남산의 뷰~좋은걸요.^^,남산 타워에서 보는 서울 시가지의 뷰가 정말 멋있더라구요.^^ 외국인들도 한국인들도 서로 셀카를 찍던데요.^^ㅎ 뷰는..정말 짱이었습니당.^^ 한번쯤은 남산~~올라갈만한 곳인거 같아용.^^,5,남산공원,남산 공원,595
210,주리3370,남산공원 거닐기 좋아요 ㅎ,남산에 케이블카가 있다면 남산에는 남산공원이 있답니다 ㅎㅎㅎ 저 역시 이곳에 거닐며 한가로이 산책해 보았는데 너무 좋았어요 ㅎㅎ,5,남산공원,남산 공원,595
211,Stacyk_55,산책하면 남산 돌기,남산은 국립극장쪽에서 천천히 돌면서 산책하며 올라가기 좋아요. 산을 30분정도 걸려 올라가면 산 정상에 남산 타워가 있어요. 타워 앞에 식당들도 있어서 간단히 식사하고 커피 마시기도 좋아요. 단 낮에 가시면 조용하진 않아요. 관광객들이 많이 있어서요.,4,남산공원,남산 공원,595
212,e송,야경,케이블카는 안 타봤고 항상 순환버스 타고올라가는데 버스타고 올라가는 길도 멋있고 좋아요. 그런데 타워내 식당은 별로였던기억이,4,남산공원,남산 공원,595
213,ji00328,티비에 자주 나오는 곳~,항상 티비 예능 프로에서 자주 나와서~ 오랜만에 가봤어요~ 가볍게 걷기는 좋은데~ 사람들이 너무 많아서 정신이 없네요 ... 자물쇠도 이제 정말 많아져서 무너지진 않을지 .//.,4,남산공원,남산 공원,595
214,nanal78878,남산,"케이블카,순환버스,도보 세가지 방법으로 올라가봤는데 다 각자 나름의 재미가있어요. 경치 굿~",4,남산공원,남산 공원,595
215,Jeon_Js,남산 서울 성곽길 0.5K의 가벼운 산책길,"서울 성곽길. 서울의 내사산을 잇는 서울성과길은 정말 멋있게 조성이 잘 되어 있음. 가볍게 한바퀴 돌 수 있는 시간과 거리로 구성되어 있고, 팔각정에서 내려다본 서울 시내의 모습또한 너무 멋있음.",5,남산공원,남산 공원,595
216,Vankd,케이블카 이용 비추,하산하는 케이블카 줄이 너무 길다. 한시간은 기다린 것 같고 그 어떤 이도 케어해 주지 않는다.,3,남산공원,남산 공원,595
217,Lunar7,서울 중심의 명소,서울 한 복판이지만 서울이 아닌듯한 느낌을 받을 수 있는 곳 입니다. 특히나 정상부근까지 케이블카와 버스가 운행하니 올라가기도 편합니다.,5,남산공원,남산 공원,595
218,열하광인,서울하면 생각나는 관광지~,서울하면 떠오르는 제1의 관광지~ 케이블카 타고 남산 꼭대기도 쉽게 올라갈 수 있고 유명한 남산 돈까스도 먹을 수 있는 곳입니다.,4,남산공원,남산 공원,595
219,nekoyang h,서울 중심의 남산공원,남산은 서울 중앙에 있는 산인데요. 이곳에 올라 서울을 한눈에내려다 보면 재미있어요. 굳이 전망대까지 안올라가도 아래에서도 즐길거리가 많아요. 아트샵에서 자물쇠를 가져와 사랑하는 연인들의 이름을 적어 꼬옥 잠궈 걸어두는 곳도 있어요~ 이곳에서 낮에 구경하다 노을보면서 이태원거리까지 걸어오는것도 추천합니다,5,남산공원,남산 공원,595
220,hmin912,서울 하면 남산!,"서울의 중심부에 위치해 있으며 서울의 상징이기도 한 남산, 서울의 전경을 한 눈에 볼 수 있는 이 곳에서 서울을 즐겨보자.",4,남산공원,남산 공원,595
221,올리브521,벚꽃필때,부모님을 모시고 남산에 갔다. 관광객은 많았지만 천천히 걸어올라가는데 한시간쯤걸린듯.차를파킹해놓은 국립극장에는 버스 2번을 타고 충무로쪽과 동대역을 지나 국립극장으로 돌아오는 전기버스를 탔다.꽃이 흐드러진 남산서 내려다본 서울은 아름답다,5,남산공원,남산 공원,595
222,eoto34,좋아요!!,남산공원 올라가서 내려다보는경치는 참좋습니다 !! 연인들과 가족들이가기좋은것같아요 !!!!,5,남산공원,남산 공원,595
223,선아 박,서울을 왔다면 남산은 꼭:),한낮에 가시는 것 보다는 노을이 질쯤 올라가서 노을을 바라보고 식사를 하고 야경까지 보고오면 딱 좋을 것 같아요!! 완전 짱짱,5,남산공원,남산 공원,595
224,shigemura3,강추,시간만 나면 가는곳으로 운동도하고 시내에서 가기도편하고 지하철과 버스로 이동하기도편해 자주감,5,남산공원,남산 공원,595
225,흰토끼,남산공원 짱,일단 케이블카 왕복 티켓을 구매하기를 추천합니다. 그러면 레스토랑 식사권이 나옵니다. 그기의 치즈피자가 그렇게 맛있더라구요. 지금도 잊을 수 없습니다. ^^그리고 자물쇠도 하나 공자로 주더라구요.,5,남산공원,남산 공원,595
226,mokujino,케이블은 타볼것!,케이블카 한번쯤은 타볼만함. 그리고 옥상에서 커플 자물쇠 하나 사볼만함. 그런데 그거고 나면 할게 없음. 그냥 산책산책,4,남산공원,남산 공원,595
227,togbuss,남산타워와 케이블카 여행의 필수,남산타워와 케이블카는 꼭 가보아야 함 남산타워가면 서울전부 다보여여 케이블카는 타면 명동역에서 내려 바로 쇼핑이 가능하죠.,5,남산공원,남산 공원,595
228,별88,도심에서의 휴식,서울의 복판에 자리잡은 남산은 예로부터 서울의 중심으로서 그리고 한국의 대표적 산 가운데 하나로 정평이 나있다. 이러한 남산이 사계절을 보내면서 다양한 볼거리로 변모하면서 아직까지 우리 곁에 우뚝 서있어 남녀노소 모두에게 쉽게 찾는 곳으로 명성을 떨치고 있다. 그동안 실시해온 남산 보호는 산의 전체적인 구성 등을 통해 자연스럽게 어우러지는 풍광을 만들어 내고 있으니 언제 산을 올라도 그때 그때 갖는 마음은 다른 것 같아서 이곳의 산행을 권하고 싶다. 남산은 쉽게 그리고 빨리 케이블카를,4,남산공원,남산 공원,595
