review,u_id,title,u_rate,p_id
"재미있는 곳. 이 많은 음식, 음료 카페. 대부분 어린 동물 이지만 좋은 곳을 방문하는 사람들.",EdKoo,"재미있는 장소, 많습니다",4,685
"안전한 느낌이 아주 좋은 지역. 대학교 근처에 있는 젊은 사람들이 거리를 가득, 공원, 레스토랑과 바는 낮과 밤. 저녁에 형 아리마를 이불과 피크닉 과 잔디 로 덮여 있는 모든 식사를 하고 있지만 술좀 난폭 한 적이 없습니다. 제가 묵었던 4 곳이 서울에 있었기 때문 였다 내가 좋아하는 좋은 분위기.",Forza_DFC,"위치도 좋고, 낮과 밤의",5,685
"토요일 예술가 에 의해 만들지 수 없는 경우 6pm 시장, 마세요... 이미 포장 및 공급업체 17:30 시에 도착해서 하루를 시작... 저는 다음을 할 수 있는 초!",dokeydog1973,토요일에 닫 6PM 아티스트 시장 급기관을!,4,685
"이 센터는 홍대, 큰 학생들과 함께 있고 훌륭한 클럽, 인디 록, 그리고 시원한 바. 서울에 있는 제가 가장 좋아하는 공간. 홍대는 젊음 과 활기가 넘치는 회사 전체가 보다 강남 영향을 줄 수 있습니다. 중간 답변하기 시대에 금요일 밤에 약 22, 꽤 오래된 정보 라 느낄 수 있습니다 경우 또는 이전 및 30s 지나!",jrh825,서울의 가장 멋진 角部,4,685
"훌륭한 곳이 가게. 음식, 쇼핑 및 문화 지역 거리 전체 향힘. 밤 늦게 까지 함께 열립니다.",bob_neo,여기서 hongdea 에 위치,5,685
"체크아웃을 해야 하는 장소 중 하나 위에 wkend! 바, 상점, 카페... 머무를겁니다! 좋은 바이브!",Vanessa C,역동적인 위치!,4,685
"이 거리는 살아 밤새 뮤지션, 가수, 연주자, 음식, 쇼핑이 즐거운 밤을 보낼 수 있다 서울 합니다. 놀라운 장소를 보내고 새로운 사람들과 춤과 상호 작용!",ItchyFeetAviator,좋은 곳에서의 경험과 서울의 상호 작용하는 유스,4,685
우리는 토요일 밤에 가서 식사를 하는 다른 대부분 일찍 문을 닫지 않았다. 이곳은 완전히 다른... 복잡하고 활기찬 도 지난 1,Yuvraj J,활기찬,5,685
"쇼핑이 즐거워. 가격도 좋고 품질도 좋고 유행에 따르는 옷. 또한, 카페, 요리사 & 창 대금 에 닭이 있고. 다음에 꼭 다시!",xushibi,쇼핑을 할 수 있습니다!,4,685
이 또한 매우 좋은 레스토랑이나 쇼핑할 수 있는 수백 저장하고 이 곳을 강력 추천합니다. 이 같습니다!,Maya_M00k,멋진,4,685
홍대에 위치한 아픈 적이 몇 번 & 입니다. 상대적으로 저렴한 가격에 좋은 옷을 얻을 수 있는 곳이 식당 / 카페가 있습니다. 서로 일 & 밤 볼 수 있습니다. 낮에도 밤에도 쇼핑을 하는 더 많은 노력을 집중할 수 있는 식당 & 술집. 이번 서울 여행한다면 꼭 가봐야 할 곳이 한 곳에서 일어나고 있는 경우는 &.,EnjoyGoodFood96,쇼핑하기 좋은 곳,5,685
"홍대 거리 내에 두 번째 방문이다. 그것은 나의 마지막 방문 기간 동안 이 되지는 않습니다. 아마 평일 밤이었습니다. 밤에 거리 baskers 보지 못했다. 꽤 실망스러웠습니다. 그 가게에 마지막으로 보았다. 이 시기, 나의 시선 과 잡은 많지 않다. 그럼에도 불구하고, 좋은 경험 했지만 저녁에 산책하기. 우리는 아주 멋진 세련된 카페에 아직 발견했다. 2층에 있는 독특한 카페. 편안하게 쉴 수 있는 피곤한 발은 뜨거운 커피나 차를 마실 수 있는.",PCSim,목요일 밤에 안 baskers,3,685
의 주위에 쇼핑한 곳! 지하철에서 내릴 때는 많은 레스토랑과 상점들을 볼 수 있는 레스토랑. 이 훌륭한 쇼핑 공간이 있었지만 보다 작지만 편안한 곳이 명동 보다 돌아다니기에 좋습니다.,sukihehe,훌륭한 지역,5,685
"주말에는 매우 붐비는 곳이다. 동시에, 좋은 음식과 좋은 특가 입니다 모두 있어야 합니다. 여기 옷은 저렴한 명동 쇼핑 센터. 있는 것을. 그 중, 원한다면 고양이, 개나 양 카페, 코너에 위치에 있다. 확실히 밴처산업 주변의 좋은 장소",Michelle,어서!,5,685
"저는 홍대 지역을 정말 좋아하는, 그리고 많은 것을 할 수 있는, 좋은 곳, 쇼핑하고 커피. 라이브 공연도 항상 즐거운 시간! 밤에 클럽에 갈 수도 있지. 이 멋진 지역에 가서 친구들과 또는 혼자.",Haru S,내가 제일 좋아하는 장소 중 하나!,5,685
"좋아 하는 일인지 경우의 라이브 공연도 보고 쇼핑하는 동안, 가장 좋은 곳이 오. 목격하는 공연이 있다.",Wandering Teacher,닿을 거리에 있는,4,685
이 길은 활기찬 밤에 날아 빠른 시간에. 많은 공연을 볼 수 있는 기타 연주가 이곳에 젊은 사람들이 케이팝 에 솔로 로 춤 으로 유명한 10 곡. 맛있는 길거리 음식 및 상점들을 보내서 돈을 볼 수 있는 멋진 밤!,Joanna S,하지 않을 수가 밤에 속은,5,685
"훌륭한 & 멋진 지역, 합리적인 음식 & 음료. 파크 레지던스에서 길을 따라 지하철에 앉아 음료와 좋은 곳입니다.",ree2545,서울에서 묵을 수 있는 가장 좋았어요.,5,685
"나는 더 많은 수많은 여기에 재미! 많이 볼 수 있는 무료 공연을 보여 줍니다! 가서 먹고, 댄스, 음료를 마시고, 옷을 살 때도 여기에 있습니다! 항상 울었다 할 수 있는 것이 항상 있습니다!",Gabie Woo L,거리 artística!,5,685
"제가 가장 좋아하는 곳이 여름! 거리 공연 많이 있기 때문에, 학생들과 이야기를 하면서 술을 마시며 후운동 공원에서 7 - eleven 편의점에서! 커다란 지갑이 필요하지 않습니다 수 있도록 새로운 사람들과 즐거운 시간을!",Ирина Ц,모든 여행자들을 그 20s,5,685
상대적으로 저렴한 옷가게들과 많은 작은 부티크 한국 패션! 명동 쇼핑 지역과 같은 곳이 더 마음에 들었던. 주변에 훌륭한 음식이 있 :),Emily,최고의 쇼핑!,5,685
"많은 사람들이 와서. 젊은 사람들이 느낄 수 있는 에너지. 그들은 노래를 좋아 하는 일을 몇몇 활동, 다른 춤을.",Jhuangz,흥미있는 장소,4,685
"현재, 홍대 지역에 있는 매우 매력적이 yunnamdong. 오래된 철로 공원에 있는, 아주 독특한 건물들이 새 것이고 대부분 이었지만. 멋진 장소였습니다.",Katie2000HI,우리는 젊은 사람들의 열정 의 에너지를 느낄 수 있고,4,685
"홍대에 갔을 때 한국에 가장 좋아하는 곳 중 하나다. 수백 / 수천개의 레스토랑과 상점. 이는 매우 바쁜 거리, 하고 많은 것들, 거리 공연도 있고, 일반적으로 케이팝 댄스 로.",kinacross,내 마음에 드는 장소!,5,685
"제가 가장 좋아하는 곳이 바로 서울에서 혼자 다니는. 많은 사람들이 음악을 연주하는, 만들어진 상품 판매, 작은 상점, 등이 있습니다.",Jaquelynn G,재미있는 장소를 돌아다니며,5,685
"홍대 함. 서울 하라주쿠 것과 같습니다. 많은 젊은 사람들, 가게들이 있고, 젊은 사람들이 수행 의 거리, 공원에서 파티에서 마시는 한 대학교 학생들. 금요일 또는 토요일 밤을 보내는 아주 좋은 장소 입니다. 정말 좋은 술집과 레스토랑 과 카페들도 있다. 지난 금요일 밤에 매달 하는 클럽에 갈 수 있는 모든 클럽 중 하나는 제가 조금 아쉽긴 했지만 정말 너무 오래 된 해당 pass. 하지만 밤에 즐길 수 있는 좋은 한국식 바베큐, 레스토랑에서 저녁 식사를 - 홍대, 술을 마시고 하룻밤 café",kevinho1979,많은 젊은 사람들. 매우 역동적 인!!,5,685
"여기에 많은 시간을 보내기 때문에 언제든지 할 수 있는 서울 여행 동안에. 거리공연, 클럽, 바 물담뱃대, 쇼핑, 식사를... 많고 많은 사람들이 여기에 젊은 사람들이 하는 경향이 있다. 체크 아웃할 가치가 있습니다.",geobabee,재미 현장의 경우 18 - 20s,5,685
"홍익대학교 는 한국 최고의 예술 학교에 찾을 창조적이고, 손으로 만든 상품 입니다. 거리 공연 많은 상점들이 있기 때문에 잘못된 장소에 미리 계획할 수 있는. 음식 steret, 쇼핑, 음주, 만나서, 등..",Seung L,아주 큰 곳이기 때문에 미리 계획을 세우지 어라.,4,685
꽤 큰 공간이 정말 마음에 드는 홍대 여러 상점과 식당 / 음료. 우리 호스텔은 이곳에서 우리는 주변을 산책하면서 시간이 좀 있었습니다.,INKYHAUS,낮과 밤에 멋진 지역,5,685
"경우 청소년 그룹을 꼭! 여기에 많은 것들을 살 수 있는 일요일 시장에 공원이 있습니다. 많은 사람들이 많이 보고, 거리 공연, 및 젊은 성인들이 모두 있습니다. 다른 장소를 방문할 때는 서울.",H0telH0pper56,"관광, 쇼핑 및 사운드!",5,685
"이 지역에 많이 제공. 거리공연, 커피샵, 저렴한 쇼핑 경험을 할 수 있는 고급스러운 너무; 모든 곳에. 8, 9번 출구에서 걸어 확인하고 h &m 유출구. 관광 도우미 레드 색상을 착용 하면 관광 명소가 어디를 갈 경우 맵 지.",Zihah X,놀기 좋은 곳,4,685
"기본적으로 이 지역은 에 의해 정복 됩니다 youngsterssss. 음식이 쉽게 찾아. 밤에 좋은 곳. 현명한 쇼핑센터, nt 은 이화 대학. 지역.",ShinYi W,좋은 곳이 있습니다,4,685
뭔가를 할 수 있는 모든 사람들이 더 좋아지고 그냥 계속 hongdea 더 :-) 나는 아내와 친구들과 함께 이곳에 혼자 오는 사랑. 이 곳은 지리 와 재미있는 물건들. 서울에서 꼭 봐야 하는,Emil_Yumin,이곳이 정말 좋은,5,685
나는 일요일 밤에 방문한 곳입니다. 홍익 역 9번 출구에서 바로 이 곳이 있습니다. 일부 대학은 학생 (하) 성능 왼쪽 및 오른쪽 작은 상점과 레스토랑이 많이 있다. 확인하기,sinming75,거리의 상점과 공연 전체,3,685
"홍익대학교 근처에 있는 하하 가 있어서 대학교 학생들, 그리고 많은 상점. 꼭 아웃 stylenanda",glinghui,쇼핑,4,685
"음식도, 많은 사람들이 어디서나 거리 공연. 주말을 보내는 곳이 합니다... 전체의 에너지. 쇼핑하기 좋은 장소, 좋은 음식.",lemoncoke07,활기 넘치는 곳,5,685
"대학가 에 위치. 많은 좋은 레스토랑, 로컬 및 비-로컬. 구운 돼지 고기 마디 가보세요, 지하철 9번 출구에서 걸어서 금방. 최신 유행하는 패션 상점들이 많다. 할 수 있는 저렴한 신발 가게에서 지하철 1번 출구. 있는 젊은 친구들, 좋은 음식과 옷을 비싸지 않아서 트렌디한것을. 헬로 키티 카페는 곳입니다.",FatGodzilla2014,맛있는 음식과 쇼핑,4,685
"지난번에 가서 이 지역의 많은 멋진 음식점들이 있습니다. 난, 아주 특별한 부분은, 그냥 음식이 곳이 있어서 아무 것도 할 수 있기 때문에",Got,좋은 음식을 먹을 수 있는,4,685
"옷을 파는 가게가 많고, 액세서리, 화장품 이지만 가격이 저렴한 상품은 주로 젊은 사람들 대상. 이 지역에는 많은 카페와 레스토랑, 1/2일 홍대 거리에서 쉽게 지출 할 수 있습니다.",Quack H,홍대 거리에서 행복한 쇼핑과 식사를 경험,4,685
모든 종류의 음식이 있는 흥미로운 찾을 수 있습니다. 학생들이 바라는 분위기 좋은곳 입니다!,Pangellie,"좋은 음식, 좋은 사람들",5,685
저는 근처에 있는 동안 한국 여행. 우리는 거의 매일 갔다. 저렴한 가격에 좋은 음식과 쇼핑이 많다. 아주 붐비는 주말. 또한 박물관 엔 눈을 diaso.,SforSingapore,경제적인 쇼핑과 식사를 할 곳이,4,685
항상 좋은 면이 주변에 걸어서 갈 수 있습니다. 특히 저녁 시간을 찾을 수 있는 거리에 있는!,Student_HH,이 지역을 사랑합니다!,5,685
사람들로 붐비는 곳... 한 것은 전체의 에너지. 정말 많은 다양한 종류의 상점과 거리 음식 has.a.,Felina O,이 곳 학생들은,4,685
이 지역은 많은 쇼핑을 즐기기에 좋은 카페 가득. 많은 젊은 사람들이 있다. 이 옷은 젊은 사람들에게 맞는 판매.,EllenAndySoo,쇼핑,5,685
"제가 예약한 호스텔이 있나. 지하철 역에 가깝, 이 지역에는 크고작은 커피샵과 레스토랑 바 westren 한국 길거리 음식. 많은 패션 상점을 찾을 수 있는, 영화, 게임 등등. 주민들은 멋진 분위기를",Liran A,훌륭한 지역,5,685
"이 곳은 항상 바쁜 경우, 최고입니다. 찾을 수 있는 길을 따라 액세서리, 옷, 음식, 등이 있습니다. 가격은 저렴한 가격에, 많은 품종. 공원 주변에 찾을 수 있습니다. 이 곳은 관광명소 중 하나인 헬로 키티 카페.",Lynns98816,"장소 해프닝, 혼잡",3,685
"쇼핑 지역. 주로 의류 및 액세서리. 이 곳은 큰 곳을 갈 수 있길, 문제가 되는 사람들을 사랑하는 쇼핑을 하지 않습니다. 아래 가격을 고려하면, 좋은 품질입니다. 주변에 많은 식당들이 있었지만 비교 해봤거든요.",KKYP,쇼핑,4,685
"밤 문화를 찾는다면, 이 거리는 선택할 수 있습니다. 에 있는 많은 카페, 레스토랑, 더 많은 패션 부티크. 사람들로 북적이고, 대부분의 사람들은 아이들이 보고 대학 근처에 있습니다. 긴 긴 하루 뒤에 올",jtsh12,그 밤 lfie,5,685
"매우 바쁜 지역, 사람이 너무 많지 않고, 심지어 밤의 시간일 수 있다. 이 많은 음식, 예술적인 상점, 빈티지 상점도. 아주 좋은!",flyingFrenchman29,밤에 꼭 해야 할,4,685
이는 아주 활기 있고 서울의 분위기에 많은 에너지. 많은 사람들이 젊은 사람들도 있지만 주로 노년층 의 사람들. 수 있는 가게 이 것이죠). 거의 모든 유형의 음식을 선택합니다. 그냥 주변에 에너지는 매우 활기찬 장소인 것 이다.,cindybiding,서울에서 일어나고 있는,4,685
"활기 넘치는 곳이라고 생각 하는 곳이 가득 hongae, 가게를 보는 것. 만약 hongae, 너무 딱딱해서 먹을 수 있기 때문에 그의 결정에 있어서 선택할 수 있는 예쁘고 저렴한 옷을 판매하고 있다는 사실을! (그런데, 제가 가서 hongae. 저는 항상 식당에 들러, 유 ga nae. 슈퍼 맛있는 물건들이! 사람들은 한 번 가 볼 것을 추천한다!) 하지만 가장 좋은 것은 어떤 수행자. 만약 hongae, 공연 의 거리로 가득하다. 사람들이 당, 이후, 환성 을 지르다, 가끔은 이렇게 도",Surhi P,거리 공연 으로 채워진,5,685
나는 한국을 방문한 시간에 방문한 홍익 1st 4th 이 낮에. 나의 의견... 낮에는 활발 하지 않고 할 수 있는 방문하지 밤보다. 더 많은 활동을 하고 있는 밤에 더 활기찬.,Jason L,하루 밤에 방문할 시간이 아닙니다,4,685
"제가 최근에 다시 서울 홍대 여행. 이 지역에 머무는 휴가의 첫번째 선택한 경우 이에 연결된 편리한 지하철 2 대괄호), 의 최고에요. 많은 길거리 음식, 쇼핑, 레스토랑, 카페가 늦은 밤까지 계속 사용합니다. 할 수 있는 이 곳 사람들이 아주 많지만 대학가 의 추천이 있었기 때문에, 저렴한 길거리 음식, 수많은 카페와 상점 을 일찍 닫지 마십시오. 제 친구들도 저를 서울로 처음 여행을 사랑하는 그녀는 이 지역을 위해 그녀가 서울 홍대 지역을 선택할 것이다 :) 현명한 쇼핑 / 식사 /",luvholiday9,의 첫 번째 숙박장소,5,685
제 아내와 저는 너트 크래커 에서 일을 보고 뮤지컬 은 휴일. 이것은 정말 좋은 운영 및 유지할 수 있습니다 내 관심.,Gregory B,Aida 보,4,685
"홍대 거리는 또 다른 쇼핑 천국. 적은 수의 선택 미용 제품, 사람들을 이곳에 더 이상 찾을 수 있습니다.",KelvinOngKB,또 다른 쇼핑 천국,5,685
"단지 자신을 찾을 것 같은 느낌이 나는 주말마다 홍대 슬리퍼까지도 다. 많은 레스토랑, 바, 라운지, 클럽과 그들의 가장 좋은 점은 저렴한 가격. 진짜 밤 문화.",K1 R,젊은 혈기,5,685
"재미있는 장소를 방문 할 때입니다. 이 곳은 젊은 친구들은 모두를 위한 음식만 있다. 다양한 쇼핑 및 길거리 음식. 티라미수 먹는 아이스크림 가격이 아주 상쾌했습니다. 교촌치킨 은, 노력의 가치.",Stephen C,다양한 은신처,4,685
"우리가 묵었던 아파트 위에 홍대역. 쇼핑 거리도 가까운 5분 거리에 있는 dae 를 했습니다. 그리고는 흥미로운 곳이었습니다! 행과 열의 상점 판매 화장품, 의류, 장난감 및 레스토랑까지 모든 장소. 그리고 결코 사람들, 그 밖의 추위도 했다. 거리 음식 파는 포장마차가 줄 수 있는; 한국 청소년 댄스 와 노래 라이브 수행할 수 있습니다. 사람들이 함께, 되게 활기차고 생동감 있는 전체 이다! 방문할 가치가 있는 것이 아니라도 홍대.",jasonteh7,매우 역동적이고 활기찬 장소,4,685
"이 지역은 매우 흥미로운 것들이 가득 차 있기에. 비가 오는 밤이 라 볼 수 있거나 너무 추운 퍼포먼스, 마시고, 춤도 디스코 자동 경우도 있습니다. 따뜻한 개월 수에 이른 오후 늦게 공예품 시장이 있다. 마음이 근처를 산책하면서 브런치 그런 시장입니다.",imariahpapaya,최고의 것들이 서울에서 체크!,5,685
이 곳은 많은 예술가들을 좋은 음악 소리를 들을 수 있다. 또한 저녁에 할 수 있는 좋은 곳.,kriver39,라이브 음악과 소리를 느낀 청년,4,685
"이곳을 사랑해요. 내가 제일 좋아하는 부분입니다. 멋진 라이브 음악, 멋진 거리 공연 (일반적으로 학생들이), 아주 재미있는, 다른 여행자들을 만나기에 좋은 장소.",Paulyo83,멋진 부분의 홍대!,5,685
좋은 곳이 있습니다. 학생은 젊은 사람들이 매일 밤 또는 성능에 한 / busking. 이 곳은 매우 활기찬 곳이었음 은 근처 midnite. 많은 노점상 도 여기에서 찾을 수 있습니다.,Natasha Musafarudin,성능이야 busking,4,685
저녁에 방문했습니다. 이 길을 따라 수 많은 길을 걸어 (?) 대학생 성능. 저녁에 밖에서 놀기에 좋은 곳.,Felicia F,이 새끼 는 활기찬 밤.,3,685
"주변 지역은 화려한 느낌도 있고, 한 젊은 시에서 일치환 스레딩된. 시간을 산책할 가치가 있습니다.",A L,젊은이들 크숍...,5,685
절대 지루해 지 하기에 무한한 수의 볼 수 있는 곳에 물건을 구입할 수도 있고 공연도 볼 수 있는!,367skyv,재미있고 활기찬,5,685
"정말 마음에 드는 홍대 거리. 제가 지금은 한국 여행 중 최고였어요. 저는 모든 분주 한, 재미있는, 즐거운 음악. 거리에는 많은 길거리 공연 같은 느낌이 alive.i 등: 음악. 길에는 재능있는 뮤지션. 많은 상점들이 있습니다. 있고 조용한 거리. 하지만 시끄러운 네이 썬가에 있습니다. 모든 것은 제가 싫어 하는 길고 성능 식출 역 출구 갈 수밖에.",lovetravelling713,"활기찬, 재미 거리",5,685
"이곳에서 꼭 봐야 합니다. 전체적인 느낌이 많은 카페에서 멋진 지역은 얻을 수 있습니다. 우리는 몇 시간을 걸어 다니는 거리 공연과 우연히, 꽤 멋졌다. 많은 음식을 먹을 수 있는 다양한 옵션을 고를 것. 여유 있게 거리에서 모든 나이트클럽, 홍대의 모든 것을 할 수 있습니다.",Brittney T,젊은 분위기,5,685
"원하는 경우 unintimidating 지역 청소년 문화 한국을 경험하고, ""홍대"" 은 지역은. 라이브 음악을 즐길 수 있는 (스트리트 busking), 댄스, 및 기타 엔터테인먼트 로 가득한 거리를 걸어 어린 학생들, 커플, 여행객 모두. 도 있는 부족한 바, 레스토랑, 상점 및 작은 체크 아웃해야 합니다. 할 경우, 반드시 문을 닫고 한밤중에 택시를 타야 하기 때문에 지하철역도 있다 (안전하고 저렴한 편).",Jen N,음악 및 청소년 문화,4,685
사랑 이... 젊 고 활기차 트렌디한것을. 여기 에 좋 은 음식 이 다. 카페 가 많이 있 습니다. 패션 남녀 의류 도 좋 습니다.,Chua K,젊 고 활기차 ㄴ,5,685
"홍대에 있는 좋은 곳에 식사와 쇼핑. 이 곳은 홍대역 바로 위. 저렴한 가격에 판매하는 거리는 저렴한 가격 (10,000원 같은) 옷, 가방 등. 많은 레스토랑과 카페들이 있습니다. 나는 여기에 단순히 사랑에 식사와 쇼핑. 방문해야합니다.",Samantha S,젊은이 가,4,685
"젊은 사람들 / 학생 전체, 상점 및 레스토랑. 좋은 곳에 매달려 있다. 또한 일부 포장 마차 거리에 다양한 상품 판매 / 텐트",PrincessOfLeisure,북적거리는 곳이 유스,3,685
"제가 한국에서 가장 좋아하는 곳. 나는 나를 궁금해 하여 이 지역인 잠도! 나는 이 곳을 지나갈 때마다 /, 하루 동안 분이나 늦은 (약 1am), 하지만 근처에 있는 많은 사람들이 항상 일어나고 거대한 기능! (체크인, 아니, 특수한 프로그램, 이 얼마나 좋은 곳이다.) 한국에서 가장 활기찬 장소 중에 하나이며 여행자들에게 아주 인기가 높습니다. 필요한 경우 쇼핑, 음식, 음료, 성능 등 등... 원하는 경우 여기에 꽤 많은 것을! (고급스러운 제품을 추구하는 경우를 제외하고. 이 대학",shiikaii,생동감 있는! 화려한!,5,685
"춥 은 겨울 이 지만, 아주 즐겁 게 하 ㄹ 수 있 는 연기자 이 었고 정말 즐겁 은 밤 을 통하 여 내량.",Judy N,활기차 ㄴ 밤 라이브 댄스 공연. 상쾌 하 ㄴ 수행자 및 참가 대상에 모두 사용할 수 있습니다. 강추!,5,685
"많은 상점, 길거리 음식이 많은, 많은 음식점, 많은 사람들이 수행에 있어. 하지만 사람이 너무! 여기에 꽤 많은 것을 할 수 있습니다.",Alisa B,사용 가능한 곳,4,685
"슈퍼 혼잡. 여러 거리공연, 기타 연주자의 솔로, 그룹 무용곡, 래퍼, 촌극 코미디, 등이 있습니다. 여러 가지 음식 레스토랑 & 커피 숍, 화장품 가게, 등 불행하게도, 쓰레기를 에 가 볼 수 있다. 좀 더러운 것... _AOMARKBLANKAO_",Putu Prathiwi P,매우 혼잡,3,685
일어나고 있고! 많은 상점과 맛있는 음식과 활동 거리 공연. 방문할 가치가 있는. 많은 사람들이 있지만 저는 오후에 가서 추천합니다. 즐거운 경험이 꼭 다시 갈 것이다.,Isabelle,활동이 많은 지역에 있어서!,4,685
"할 수 있는 시간이 서울대학교 학생들이 무엇을 궁금해 하는 중? 더 먼 거리 홍대. 여기에는 라이브 뮤지션 및 거리공연, 홍대입구역에서 대부분의 대학교 학생들. 이 작은 길은 대학교 학생들이 삶의 엿볼 수 있습니다. 시험 공부 하지 않을 경우, 많은 학생들과 같은 일반적인, 홍익대학교 학생들과 같은 것도 있고. 많은 학생들이 거리에 비즈니스 관리 안 볼 것, 한 다른 방법들을 볼 수 있습니다. 매콤한 틀어치기 주 학생들은 함께 대화 해서는. 먹고 쇼핑 하는지 알려줄 수 있는 최고의 장소, 때로는",sborrink,대학 생활을,5,685
"많은 사람들이 넘치는 거리 홍대 지역, 많은 음악가, 예술가 들 과, 멋진 행복한 분위기! 그 생략하지 않는다!",assaf s,꼭 놓치지 마세요!,5,685
"젊은 사람들이 좋아하는 핫스팟 지역. 밤 문화를 즐길 수 있는 항상. 많은 레스토랑과 카페들이 있습니다. 가끔, 수행자가 있다.",pwau98,가치가 하게 될 경우,4,685
"전체 관광객 및 지역 주민들. 음식도, 우리가 간 곳은 쇼핑 및 패션과 유사한, 과 같은 가격이 더 비싸다. 너무 잘 지, 왜 인기가 있는 곳입니다? 아마 이 곳의 은신처 는 젊은 사람. 특별한 아무것도",Meiko G,바쁜 젊은 패션,5,685
"홍대의 독특한 카페들이 있는 알려진 젊은이 의 분위기, 패션 숍, 고급 식당. 진 곳이 있는 것을 제한.",yvonnetannn,독특한 장소,4,685
최신 유행하는 홍대 가까운 거리이다. 서울에 있는 같은 거리이다. 보통 사람들은 젊은 사람들과 함께 주말. 에는 많은 작은 상점과 식당들이 정장 모두. 모든 일은 주말에 할 수 있습니다. 밤에도 심각한 장면 이다.,edisupp s,홍대 거리,3,685
매일 밤 이 아주 사람. 많은 사람들이 여기에서 수다방. 홍대 카페거리 에서 쇼핑이나 나눌 수,Anindya A,멋지 장소,5,685
"쇼핑, 쇼핑, 쇼핑. 많은 학생들이 거리에서 확인하실 수 있습니다. 여행을 통해 할 수 있는 시간입니다.",JoeyHpe,쇼핑!,4,685
많은 활동을 하고. 많은 레스토랑과 바 체크 아웃합니다. 꼭 밤 문화를 위한 장소,Andrew F,정말 즐겁고 바쁜,4,685
유명한 레스토랑과 흥미로운 상점들이 많다. 나는 이 곳이 유명한 곳은 더 이상 다른 레스토랑과 가게들 때문에 적당한 가격이다. 맛있는 음식을 먹고 싶을 때는. 나는 이 곳은 근처의 살 에 하지 않습니다.,slvi l,우수한 레스토랑과 흥미로운 상점,5,685
"여기에 좋은 쇼핑하고, 매우 합리적인 가격, 쉽게, 조금 저렴 합니다... 모든 것이 합리적이지만 peoplr...",Suzette T,Shpping,4,685
