,u_id,title,review,u_rate,place_name,res_title,p_id
966,Jn J,저와 제 남자 친구는 여행,그곳에 가면 에 있는 마을. 전통적인 한국인 커플이 많이 weared 에 드레스를 가장 좋은 점은 사진은 여태껏 먹어본 맛있는 큰 암소 갈비 hahaha 벌막골.,5,북촌한옥마을,북촌 한옥마을,74
967,HgLoria133,그냥 오래된 건물이 있는 곳의,여기에서 정말 잘 한 것. 사람이 너무 많고 괜찮은 사진. 많은 카페와 갤러리. 미로 의 오래된 건물.,3,북촌한옥마을,북촌 한옥마을,74
968,fojane,좋은 공원에서 산책을 …,"좋은 활동 입니다 서울에서 두 시간. 이 아름다운 작은 거리, 흥미로운 복제본 및 주변에 있는 집. 어린 아이들은 가족 의 탁월한 선택!",4,북촌한옥마을,북촌 한옥마을,74
969,mareealys,고요한,아름다운 정원과 멋진 곳을 두 시간이나 정원과 전통적인 건물들이 그냥 산책.,4,북촌한옥마을,북촌 한옥마을,74
970,jerry k,하루 반나절 을 보내고 좋은 방법,오래된 도시 입니다. 많은 상점과 레스토랑. 보행자 거리를 걸어갈 수 있는 여러 가지. 여기서도 있다. 좋은 방법을 역사 인식을 하루 종일 반 또는 seouls 즐거운 지역. 반드시 방문 중 하나일 수 있었거든요.,5,북촌한옥마을,북촌 한옥마을,74
971,Miguel P,정말 좋은 마을,"전통적인 방법 및 오래된 집 들 을 볼 수 있는 / 입력할 수 있습니다. 흥미로운 것은 이곳에 살. 실제로 이 집에 살고, 의식 의 단계가 있기 때문에 항상 소음 수준 아래로.",5,북촌한옥마을,북촌 한옥마을,74
972,LeoLHR,붐볐지만 여전히 가치를 방문,저는 참 불쌍하게 지역 주민. 아니면 무지한 사람들이 있다는 것은 정말 시끄러운 소음 을 유지할 수 있는 표지판이 있게 물어 있습니다. 저는 생각이 계속 방문할 가치가 있는 마을. 이 지역은 안전한 처럼 쉽게 산책하고 쾌적한 곳에. 많은 사람들이 아침에 일찍 와서 피하세요.,4,북촌한옥마을,북촌 한옥마을,74
973,Aqua4,좋은 동네 를 걸어 전통적인,아름다운 곳을 걸어서 갈 수 있는 전통적인 한국 사람들이 머물고 있는 집 이 있어. 많은 침묵 을 문에 볼 수 있습니다. 산책하기 좋은 곳을 사진.,5,북촌한옥마을,북촌 한옥마을,74
974,sal2258,사랑스러운 봄에 방문하기 좋은 곳,저희는 운이 좋게도 우리는 이 벚꽃의 아름다움을 즐길 수 있는 작은 상점들이 제공하는 흥미로운 산책 지역 찾습니다. 좋은 곳에서 시간을 보내는 편안한 분위기.,5,북촌한옥마을,북촌 한옥마을,74
975,Nhanle81,여행,"많은 것들을 방문 할 수 있는, 전통적인 한국 사람들은 매우 친절하고 볼의 집은 그 마을.",5,북촌한옥마을,북촌 한옥마을,74
976,Patrisha A,문화,"이에 많은 사진을 이곳에 정말 아무것도 할 수 있는 산책이, 전반적으로 이곳은 그냥 괜찮았습니다.",3,북촌한옥마을,북촌 한옥마을,74
977,Amy W,집에 있는 완벽한 사진,"좋은 지역을 걸어서 몇 시간. 많은 곳에 커피, 차와 음식. 작은 상점은 분산되어 구불 구불 좁은 거리. 하지만 많은 사람들이 너무 많은 관광객!",4,북촌한옥마을,북촌 한옥마을,74
978,carnellin,45도 각도,"만약 적이 이러한 런닝 머신 및 팬을 올라가면 모든 게 다. 풍경이 아름답고 문화 유산이 확실히 있습니다. 이는 공공 박물관도, 사람들이 집 안에 있고. 많이 안 것 같아 감사 지원하지만 경고 시끄럽고 주변이 시끄러워서 있는 로컬 십대, 해외에서 온 관광객 이다. 적어도 가 도착했을 때, 모든 게 다 돈을 존중하는 목소리. 많은 여자들이 입어 입어 가 있고 맛있는 요리와 같은 멋진 사진을 낙지, taebokki. 저는 향수도 있고. 꼭 방문해야 합니다. 이 사원은 길 위에서, 조금은 힘든 산책,",5,북촌한옥마을,북촌 한옥마을,74
979,Ladyelle,보기 좋은,최소한 반나절 투어. 5000만 원을 빌려 입어 을 시도해야 합니다. 많은 가게. 멋진 풍경. 또한 많은 식당이 있습니다. 무료 입력합니다.,5,북촌한옥마을,북촌 한옥마을,74
980,Alice Teo,작은 마을을 방문할 가치가 있는,리뷰를 읽고 이곳에 왔다. 다음 지침에 따라 거리를 찾을 지도. 거의 1시간 정도 걸어 다니지,4,북촌한옥마을,북촌 한옥마을,74
981,mikeadey72,좋은 오후!,"주 를 방문한 후 큰 궁전, 북촌 한옥 마을에 있는 자신을 발견. 이 너무 멀리 떨어져 있다. 좋은 이웃 많이 아름다운 가게. 많은 사람들이 있다. 분위기도 좋고. 언제 한국 전통 찻집! 신발 할인. 바닥에 앉아. 아름다운 차!",5,북촌한옥마을,북촌 한옥마을,74
982,fizah s,문화 및 아키텍처,저는 건물의 모습. 아주 매혹 적 아키텍처 및 색상. 사진 찍기 좋은 장소를 빌려 입어 수도 이고 사진 (문화를) 할 수 있다. 많은 좋은 건물. 좋은 하루 반나절 투어.,4,북촌한옥마을,북촌 한옥마을,74
983,Charmaine C,훌륭한 가치가 있는 사진을 찍은 사진.,"엎어지면 한옥 마을에 처음 발을, 우리는 오래된 전통적인 집은 현대적인 트위스트 fl 과 사랑에. 하고 난 지금, 우리는 우리의 결혼식 같은 곳에 가서 가 촬영 한 사진. 이 곳을 방문하는 사람들에게 강력히 추천하고 느긋한 산책이나 갈 수 있는 아름다움이 다.",4,북촌한옥마을,북촌 한옥마을,74
984,Barajasjab,아름다운,"너무 좋은 거리를 지나, 한옥집 을 볼 수 있는 오래된 스타일, 북촌 한옥 마을도 가기 전에 많은 상점 거리로 멋진 기념품이나 음식도.",5,북촌한옥마을,북촌 한옥마을,74
985,Kerryn72,전통 의 현대적이며,"주변에 걸어갈 수 있는 마음. 메인 스트리트 사용하는 모든 현대적인, 상점과 레스토랑. 전통적인 가정 및 주거 지역 옆 을 볼 수 있습니다. 가파른 언덕이 있다. 정말 좋은 볼 수 대비. 많은 중국인들이 한복 과 사진 포즈를! 보는 재미. 제 생각에 꼭 가봐야 할 곳이 다.",5,북촌한옥마을,북촌 한옥마을,74
986,dlboehm912,매우 역사,걸으며 사랑 이 역사적인 지역. 많은 젊은 사람들이 한국인들의 복장은 정말 촬영 다니지 네이티브 를.,5,북촌한옥마을,북촌 한옥마을,74
987,Rachel S,우리는 우리의 사랑 은 시간,"북촌 한옥 마을은 #1 의 것들이 내가 한국에서 기대 를 참조하십시오. 멋진 한옥 게스트 하우스에 묵는 여행을 할 수 있습니다 (체크 아웃 라온 게스트하우스 및 가이드의 호스트 입니다. 왜냐하면 솔직히 한국에서 지낸 우리 시간의 대부분을 이 지역, 시간 보다 도시에서 도시 지역 - 적절한. 하고 독특한 상점과 레스토랑이 라 구경하기에 생활의 본격적인 마을.",5,북촌한옥마을,북촌 한옥마을,74
988,Senorapm,과거의 경험,전통적인 한옥집 / 건물들이 이 지역을 산책. 일부가 복원 훨씬 더 현대적인 분위기. 저는 그 초대를 나눌 수 있게 시간을 즐길 수 있는 로컬 구운 고구마 한다. 또 다른 마음에 드는 곳입니다,5,북촌한옥마을,북촌 한옥마을,74
989,Eric,매력적인 이웃!,"장점: - 이웃과 매력적인 전통 한옥 (다음 아래쪽에 있는 내 음성 레지던스 하우스) - 이른 아침에 와 보면 좋은 그림을. 낮에 많은 관광객들이 있다. - 사진 찍기 좋은 곳을 - 지금 주위를 산책 단점: - 아주 작은 공간. 수 1 시간 이내 완료 - 그리 많지 않은 상점, 카페와 레스토랑이 한 지역. 그냥 집에 있는 대부분의 레지던스 - 구릉 지역을 산책 합니다. - 비오는 날 방문하기 좋은 곳이 아니라 - 나는 보이지 않는 모든 공중 화장실에 영역",4,북촌한옥마을,북촌 한옥마을,74
990,Ching Mun C,지루한,사용하지 않는 한 옛날 아키텍처에 볼만한 데 에 있는 것 같아요. 과 같은 사람들이 밖에서 사진을 찍고 있는 집의 및 (또는 그) 은 외계인 처럼. 나는 방황하는 주택지역에 대대적으로 하고.,1,북촌한옥마을,북촌 한옥마을,74
991,AngelC83,오르막 걷기 준비,문화의 전통적인 마을의 작은 집. 걷기 좋은 신발을 신고 가는 경우가 있습니다. 좋은 몇 가지 기념품 가게 에 있는 멋진 작은 레스토랑들 입니다. 우리는 어느 화창한 토요일 이 라 사람들 였습니다.,4,북촌한옥마을,북촌 한옥마을,74
992,Richard B,현대적인 세계는 과거에 점진적이고,"지난 시간을 느끼면 북촌 한옥 마을 산책 - 한국 전통 한옥의 이름이 집에는 800에 북촌 있습니다. 지식이 있는 줄로 사냥 용 전기, 현대적인 설비 의 완벽한 사진들이나. 한 많은 속성을 한 현대적인 자료로 보인다 gentrified 복원할 수 있고 주변에 식당 및 예술 트렌디한것을 관광객을 위해 빌리지에.",5,북촌한옥마을,북촌 한옥마을,74
993,DShim,매력적인!,"꿈을 꾸고 돌아올 이 마을. 이 사랑스러운 거리에서 사진을 찍고 산책 중 많은 유명한 명소 및 5 6 번 마을. 저는 "" 개인적인 취향 "" kdrama 에 위치한 한옥 사용됩니다. 갈 수 있는 큰 투어 그룹인 방지할 수 있습니다. 제가 전에 9:30 이고 일요일 은 아직 사람이 많지. 이 숙박시설에서 묵을 수 있는 것도 좋을 것 같습니다 다음에 방문할 때 입니다!",5,북촌한옥마을,북촌 한옥마을,74
994,Franclsy,한옥 마을,"한옥 스타일의 홈스테이 이 주변에 많아요. 게다가 관광, 일부 지역에서 만든 공예품 이 포장마차도 있었습니다. 일반적으로 이곳은 주거 지역.",3,북촌한옥마을,북촌 한옥마을,74
995,swzpa,사랑이 마을!,"처음으로 서울을 방문하는 경우, 이 마을은 완벽한 지역으로 바로 경복궁. 그냥 궁전 바로 옆, 조금만 걸지 어. 이 마을에서 걸어갈 수 있는 몇 가지의 유니폼 가이드. 그에게 연속으로, 여기서 걸어서, 안내 지도를 주며 즐겁게 것입니다. 귀여운 카페 가 있는 곳을 이용, 본. 우리는 좋은 일 의 45분에 호텔에 가 포함되어 있는 아이스크림을 먹 마을.",5,북촌한옥마을,북촌 한옥마을,74
996,Dasdo S,세련된 - 좋은,"꼭! 인사동에 위치한 관광지에 아주 가깝습니다. 이러한 환경을 하루 papiolani, 그리고 현대적인 박물관. 하루를 이 특정 지역은 고급스런 노점. 식사도 훌륭했습니다.",5,북촌한옥마을,북촌 한옥마을,74
997,Randal L,흥미로운 지역에 있어서,"이 곳은 전통적인 의상 들 과 젊은 여자와 남자 를 다녀 입어 주는 마법의 느낌이 훨씬 더 작은 거리. 몇 시간 동안이나 관찰 하고, 사진을 찍고, 커피를 마시고 이곳에서 점심을 먹었습니다. 이 좋은 곳에 있는 멋진 날 참조.",4,북촌한옥마을,북촌 한옥마을,74
998,Dino Santos Jr,방문 시간이 있다면,정말 좋은 괜찮은 호텔이지만. 추가 시간 또는 마운트된 경우 angkuk 역; 이유. 가는 길은 꽤 길어서 거의 angkuk 역이 조금 아픈 경우에는 다리 가기. 한 골목길이 제공하지만 그 이전에 저를 위하는 현대 에 살고 있는 흔적이 보이지 않았다 나 배관 의 전기를,4,북촌한옥마을,북촌 한옥마을,74
999,Clyde L,오래된 서울의 맛,"화창한 오후 에 방문 한 말에 - 3 월 창덕궁을 가는 아침. 작은 길을 따라 줄지어 있는 오래된 좋은 - 스타일은, 그 중 일부는 커피 숍. 많은 관광객들이 있지만 개인 로컬 사람들 모두가 인증을 유지하고 조용한 목소리. 전망 좋은 언덕 위에 있는 몇 시간 동안 돌아다니 었다.",4,북촌한옥마을,북촌 한옥마을,74
1000,Csreethong,예전에 걸어갈 수 있는,"10위 "" 기나발루에 "" 목록. 북촌 한옥 마을을 방문할 때 이용할 수 있습니다. 즐거운 놀라움 이 섹션에 있는 서울 시내에 있는 문화의 보존. 내가 유일하게 실수를 계획하고 있습니다. 그에 따라 많은 작은 음식점 골목, 저는 제가 다음에 방문할 때 서약 하다. 많은 사람들이 영어를 구사할 수 없지만, 기꺼이 자신을 잃어버리 ㄴ것 같은 업체의 관광 포인트의 올바른 방향으로. 좋은 카메라를 가져가면, 사진을 좋아한다면. 제가 바라는 것, 하지만 내 카메라 가 전화 내용. 전시 할 때 센터;",5,북촌한옥마을,북촌 한옥마을,74
1001,Al_Subi,너무 많은 관광객들,"있는 지역을 방문할 때 제공하는 무료 도보 투어. 우리의 가이드, 미스 킴, 재미있고 매력적인 오래된 여자 였습니다. 안타깝게도 관광객들로 붐비 었습니다. 정말 좋은 그림이 불가능했습니다. 또한 그들은 아주 시끄러운 정말 고요함이 없었습니다. 제가 느낀 아쉬운 살 수 있는 사람들. 저는 제 하에서 닥터 항비 의 아름다운 역사적인 집, 이 근처에 위치. 관광지도 되는데.",3,북촌한옥마을,북촌 한옥마을,74
1002,suriahagumi,집!,"이 같은 다른 차원, 아키텍처 및 설계 돼! 내가 살고 있는 사람들이 계속 있는! 을 하는 것은 아름다운 곳에 살고 있는 것? 정말 좋은 환경! 또한 이 곳은 정말 가깝 팰리스 gweongbokgung. 아주 멋진 사진을 얻을 수 있어 입어 입에서 이 곳이! 하지만 버틸 수 있는 이곳이 가장 때문이죠! 오르막을 오르고 있음.",4,북촌한옥마을,북촌 한옥마을,74
1003,Suziekim2015,아름다운 마을,우리가 밤에 있어서 아주 조용하고 사람이 많지. 할 수 있는 n - tower 지역. 하는 전통 한옥 스타일의 집! 방문하기 좋은 곳을 붇돋아주었고.,5,북촌한옥마을,북촌 한옥마을,74
1004,Joycelim9,전통적인 집,과거 전통적인 집 들을 지나 같은 느낌 였습니다. 또한 무료로 오픈 하우스는 한 볼 수 있습니다.,4,북촌한옥마을,북촌 한옥마을,74
1005,JoC58,본격적인 한국의,를 배치해야 합니다. 그냥 침묵 지키지 다 있는 주거 지역 및 알 수 있어야 합니다.,4,북촌한옥마을,북촌 한옥마을,74
1006,PING78,관광객들을 위한 완벽한,정말 좋은 곳이 다. 하지만 긴 거리. 진짜 그 집에 일찍 한국 문화 도시 반영합니다. 많은 젊은 사람들도 한옥을 언덕 위를 빌릴 수 있어 사진. 아름다운 풍경이 지원하지만 정말 많이 걸었기 때문에 겨울에 갔다. 결국 땀 카운티까지 하지 않습니다. : D,5,북촌한옥마을,북촌 한옥마을,74
1007,menarosli93,꼭 가봐야 할 곳,정말 기억에 남는 사진을 찍을 수 있습니다. 이 곳은 갈 수 있어서 gyeongbukgong 근처에 위치해 있습니다.,5,북촌한옥마을,북촌 한옥마을,74
1008,tze_dee,서울에 있는 한 포토 제닉,"카메라를 가지고 있는 많은 장소에 포토 제닉. 예, 정말 관광객이 되게 할 수 있는 이른 아침에 가는 사람들이 지. 안국 역에서 10분 거리에 위치한 곳입니다.",5,북촌한옥마을,북촌 한옥마을,74
1009,azizasyasya,환상적인!,이 놀라운 여전히 전통적인 방법 이 되어 이상한 마을이 백 년. 이 곳은 정말 시원하고 상쾌한 방법 을 걸지 사용자_이름:. 걸을 준비를 - 꽤 가파른 언덕 위로. 먹을 수 있는 멋진 카페와 상점들이 이 지역에서 즐길 수 있는 것이 설계 한. 멋진 지역.,5,북촌한옥마을,북촌 한옥마을,74
1010,joycey0707,넣어두면 걸어갈 수 있는 신발을 신고!,"후에 운동화를 넣어, 북촌 문화 센터 안국역 근처에 있는 전통적인 방문 이 첫 번째 개요 및 북촌을 잊지 말고 접는 지도 마. 여유롭게 다니는 다음 경로 또는 직접 추천, 에는 많은 커피샵, 찻집, 음식점, 가게, 삼청 대한 자세한 내용 - 동 쪽. 아주 잘 할 수 있는 것이 전체 로 만든 - 날 행사, 특히 예술 박물관 미술관 앞에서 또는 지역 입니다. 것이라는 기대는 하지 않는 곳에서 보이는 것처럼 미니 도시 투어는 따라 노선을 추천하지만, 건물 벽이 잘 보존 및 처리 됩니다. 이",5,북촌한옥마을,북촌 한옥마을,74
1011,Liz K,방문할 가치가 있는 문화가,"옛날 한국의 문화를 경험할 수, 북촌 마을에 지역 확실히 확인하기! 이 곳에는 귀여운 골목길로 가는, 잘 할 수 있는 워크숍에 참여하여 영역 및. 우리가 할 수 있는 정보가 많은 곳에 멋진 옷을 준비하는 데 실제 섭새김 한국 전통 을 그냥 이해할 것. 정말 귀여운 디자인이 어떻게 집에 다시 한국에 오래 된 일!",5,북촌한옥마을,북촌 한옥마을,74
1012,Leo H,전통 한국 게스트하우스,많은 사람들이 아주 많고 전통 한옥. 오래된 집이지만 무료로 해 주 차 입력할 수 있습니다.,4,북촌한옥마을,북촌 한옥마을,74
1013,GirlsHeaven,전통적인 마을,"전통적인 한국 인 이 설계 하기 좋은 곳, 평화롭고 정돈 되어 있다. 내 제안 은 여름에 방문하기 - 가을, 어쩌면 너무 추워 겨울에는.",5,북촌한옥마을,북촌 한옥마을,74
1014,Prapti B,에서 조금만 걸으면 팰리스,전통적인 주택 의 구조를 볼 수 좋습니다. 전통적인 한옥의 입에서 사진을 찍을 수도 직접) 일부 저장합니다. 전통 가옥에서 하루 보냈다 수 있었으면 하고 있지만 꽤 비싼 집! 다시 가고 싶네요 겨울에 눈이 보고 있는 부분에서,4,북촌한옥마을,북촌 한옥마을,74
1015,PaulistanaCA,전통적인 한국의 맛,"서울에 있는 북촌 은 그 동안 방문해야 합니다. 이 동네 를 볼 수 있었어요 집. 이곳은 주거 지역, 존중 이 아니기 때문에 너무 많은 소음 시도해 보십시오. 제가 이른 아침에, 주변 사람들도 매우 9 및 몇 가지. 하고 감탄 하고 놀라운 사진에 좋았습니다. N 서울 타워 를 볼 수 있는 놀라운 도시 주변에 달리 볼 수 있습니다. 안국 역 근처까지 오는, 고객 센터에 들릴 수 있는 출구 6. 자세한 정보를 확인하고 맵 답변하기 영역 클러스터가 언덕 위 로 집. 집에 머물지 수 있는 몇 가지지",5,북촌한옥마을,북촌 한옥마을,74
1016,Josephine S,교통 이아,"이곳을 사랑 해요. 저는 한국의 문화와 전통적인 집. 걷고, 현대적이고 전통적인 건물들이 있는 조합. 저를 생각 나게 해 정말 이 얼마나 중요한지, 우리의 뿌리 도 잊지 못할.",4,북촌한옥마을,북촌 한옥마을,74
1017,rbtdxb,멋진 건물,하는 건물. 아주 오래된 흥미로운 레이아웃. 무료 이용. 오래된 차로 돈을 지불해야 해. 높은 기대를 가진 오래된 시장 이 있습니다. 많은 사람들이 아직도 살고 있는 집. 왜 그게 더 아무것도 할 수 있는 것.,4,북촌한옥마을,북촌 한옥마을,74
1018,mom511,시간 여행을 …,자주 사용하는 경우 상상력 면을 상상할 수 있는 시간이 다. 오래된 집. 잘 되어 있었습니다. Timeless,5,북촌한옥마을,북촌 한옥마을,74
1019,1canadianbear,산책하기에 자신의 속도 및 한국 전통 주택,"을 볼 수 있는 좋은 일은 오후에 할 수 있는 북촌 한옥 마을. 도보로 약 1시간 정도 를 준비하는 거리 - 친절한 거리, 할 수 있지만 일부 언덕. 만약 방문 때 아주 뜨거운, 절대 후회하지 않을 때 그렇게 더워. 사람들이 집에 살고 있기 때문에 조용하고 개인 정보 관련 요청이 많 어. 바쁜 현대적인 공간이고, 먹을 수 있는 수 많은 레스토랑, 상점 및 처리합니다. 또 다른 하이라이트는 모든 관광객들의 전통적인 한복 입고 - 멋진 사진. 좋은 아키텍처를 감상할 수 있기 때문.",4,북촌한옥마을,북촌 한옥마을,74
1020,Angela N,서울의 다른 측면을 볼 기회가,이 집 원래 유형을 주택지 거리 구성되어 있습니다. 이 언덕에 있어서 또한 좋은 viewpoints 의 오래된 도시를 / 새 대조적입니다. 의 거리가 된.,5,북촌한옥마을,북촌 한옥마을,74
1021,Vasanthi70,방문할 가치가 있다,"북촌 한옥 마을에 갔습니다. 되어. 길은 매우 좁고 가파른 하지만 방문할만한 곳이 다. 하지만, 이 사람이 좀. 걸어 집이 매우 좋았습니다. 길거리 음식 들 이 길을 따라.",5,북촌한옥마을,북촌 한옥마을,74
1022,Jariyasethi,사랑스러운 마을 상점 및 부티크 상점,"우리는 주변에서, 많은 부티크 상점과 전통 가옥 architech. 좋은 지역을 약 3 - 4 시간 정도 할 수 있지만 이 관광지가 궁금해!",4,북촌한옥마을,북촌 한옥마을,74
1023,Thomsonwily,이 작은 전통 마을,"전망 좋은 지점까지 오를 북촌 한옥 마을. 겨울 였는데, 이 에너지를 받은 게 아니라 받습니다. 우리는 전통적인 인삼 쌀 음료와 휴식을 차 에 있는 찻집. 따뜻하게 즐기는 자신을 가지고 조용한 느낌의 마을. 안타깝게도 우리는 한 무리의 관광객들에게 큰 방해 로 짧은 아닙니다 오고 있을 정도. 경계 한 것, 꽤 많은 주거 지역 이 몇 개 없는 찻집 이다. 이 근처에서 볼 수 있는 휴게실 이 기 때문에 찾기 어렵다. 이는 결국 같은 게 또는 그룹 여행객들을 만난 한. 결국, 그들은 그 를 거부했고",4,북촌한옥마을,북촌 한옥마을,74
1024,Fidrildi2707,역사적인 건물들은 카페와 식당,오래된 건물을 이용한 거리. 흥미로운 상점과 식당도 멋진 카페. 가끔 방문 하기 하는 좋지만 약간 오르막.,5,북촌한옥마을,북촌 한옥마을,74
1025,Jelts,아름다운 언덕 이지만 조심하세요!,"이 곳 사람들은 아름다운 아직 상주합니다. 반드시 편한 신발을 신지 이 지역은 구릉. 매일 걸어 오는, 확장 언덕에 조금 힘들지 었습니다. 문은 무척 아름다운 건축물.",5,북촌한옥마을,북촌 한옥마을,74
1026,whitehairmonstress,북촌,"전통적인 가옥은, 흥미로운 시선. 좋은 사진 찍을 수 있는 곳. 보기는 집에, 하나는 지속적인 활동을 할 수 있는 몇 가지 빠른 모양 및 사진 - 결합하고 뻔뻔하 게 을 수 없는 경우, 는 않았다. : 전체 영역을 완료할 필요가 없으므로 매우 긴 p, 30 분 정도 본 것 같은 후 입니다.",3,북촌한옥마을,북촌 한옥마을,74
1027,lbarnes10,흥미로운,"이곳은 아름다운 전통 집 이 있고, 많은 사람들이 전통에 산책. 알 이 작은 사람들을!",4,북촌한옥마을,북촌 한옥마을,74
1028,Tony C,좋은 곳에 가서,많은 문화적 명소가 서울에 없습니다. 수 많은 쇼핑 문화 를 원하지만 오래된 학교. 주변 환경이 쾌적한 산책.,4,북촌한옥마을,북촌 한옥마을,74
1029,Melina Condro,좋은 지역,어 입어 보고 잊지 말 제가 여기에 빌려 입어 볼 수 있는 저는 결국 가지 않을 수 없는 곳에서 멀리 떨어져 있는 것을 사용할 수 있는,5,북촌한옥마을,북촌 한옥마을,74
1030,Paul_n_Cris,수 많은 거리를 궁금해 하는,"이는 곳이 있습니다. 약 한 시간 계획을 보다. 길거리 포장마차에서 먹는 로컬 레스토랑, 다음 탐색 및 카메라와 함께 거리에서 골목 준비. 주로 오후에 관광 버스 언로드, 그러니까 여기에서 아침을.",5,북촌한옥마을,북촌 한옥마을,74
1031,rjyu,""" 오래된 "" 한국을 볼 수 있어 좋은","이 곳은 현지 문화에 - 있는 그대로 유지됩니다. 이곳은 걸어 다니며 다른 집 짓기 및 유지됩니다. "" 오래된 "" 한국 같은 느낌이 들 것이 과거의 일.",5,북촌한옥마을,북촌 한옥마을,74
1032,knightsbridgelvr,꼭 가봐야 할,"관광객들이 항상 꽉 차, 당연히 지원하지만. 가장 매력적인 거리를 걸어 본. 아름다운, 복잡한 아키텍처 마다 (실제로 개인 레지던스) 의 집 이 있고 훌륭한 사진 촬영을 하고. 특히 눈에 띄는 것은 이 때 의 거리를 걸어 그 시간을 거스르고, 현대적인 스카이라인을 배경으로 본 볼 수 있습니다. 어디서 이 지역도 방문해야 합니다. 이 작은, 하지만 아주 아름다운 산이 있는 역사적인 배경 이 있고.",5,북촌한옥마을,북촌 한옥마을,74
1033,jungjik,북촌 에서 본 사랑의 아키텍처,"도보 여행 이다. 바로 북촌 거리를 돌아 다니는 전통적인 한국 스타일의 건축물은 사회 입니다. 실제로 사람들이 살고 있는 집은 징후 요청 이 있어서 전체를 조용히, 하지만 내 생각에 보면 어떤 유적을 구경할 수 있어 관광객들이 매일 걸어 다니는 것에 짜증이 다. 멋진 사진이 하기에 한국말. 많은 골목길을 향하고 있는 임의의 전환 및 삼청동 점심.",5,북촌한옥마을,북촌 한옥마을,74
1034,aimacarmela,걸어서 주위에 사행,"좋은 곳을 걸어 다니며 다양한 활동과 가게들. 이 곳 사람들이 살고 있는 아이들이 실제 유의해야 합니다. 5 앞에 handiworks 많이 경험하고 - 활동. 우리는 그것을 너무 늦게 와서, 하지만 여전히 메안데르 아름다운 곳.",4,북촌한옥마을,북촌 한옥마을,74
