,u_id,title,review,u_rate,place_name,res_title,p_id
60,Donghye PARK,너무 더울때라 후원은 포기했어요,후원 예약을 하지도 않았지만 혹서기때라 후원투어도 조금 줄인다고 하더군요. 후원이 아니더라도 궁 자체가 멋있고 볼 것도 많습니다. 중간중간 나무 그늘이 많다면 여름에는 더 좋겠습니다,4,창덕궁과 후원 [유네스코 세계문화유산],창덕궁,76
61,iris_101202,창덕궁 겨울의 후원 분위기 굿굿!!!!,저는 경복궁 보다 창덕궁이 더 좋았어요! 더 아기자기 하고 후원은 정말 추운날씨에도 감탄할 만큼 아름답더라구요. 꼭 가보세요!,5,창덕궁과 후원 [유네스코 세계문화유산],창덕궁,76
62,JJin,후원 투어를 신청하세요,창덕궁에는 후원이라고 하는 왕의 정원이있습니다. 외국인 대상으로는 영어 투어를 하고 한국인 대상의 투어도 있습니다. 꼭 신청해서 들려보세요,5,창덕궁과 후원 [유네스코 세계문화유산],창덕궁,76
63,SONG E,너무 예뻐요.,"원래 고궁 좋아하기도 하지만 아기자기한 맛은 창덕궁이 제일 인 것 같아요. 입장료는 3천원이구요, 창경궁과 이어져 있어서 창경궁도 둘러볼 수 있어요. 창경궁은 입장료 1천원이고, 창덕궁으로 넘어올 때 입장권 제시하시면 재입장 가능합니다.",5,창덕궁과 후원 [유네스코 세계문화유산],창덕궁,76
64,Jelsomina,한국의 멋 창덕궁,서울에 있는 궁들 다 너무 좋아서 몇번씩 방문하곤 합니다. 경복궁을 많이 가시는데 창덕궁도 너무 좋더라구요. 창덕궁도 많이 방문해 보세요.,5,창덕궁과 후원 [유네스코 세계문화유산],창덕궁,76
