,u_id,title,review,u_rate,place_name,res_title,p_id
0,vlogg,올림픽의 추억,올림픽을 기념하며 만든 서울 올릭픽을 기념하는 곳입니다. 한번쯤 둘러보기좋아서 근처에 왔을때 방문해보세요.,5,서울올림픽기념관,서울 올림픽 기념관,869
1,승연 박,자전거 추천,피크닉 느낌으로 간단한 먹을거리와 돗자리 가져 가시면 정말 환상입니다!! 특히 입구에서 자전거 렌트 해주는데 4륜 자전거라 해야되나? 그거 절대 추천 입니다. 재미도 나고ㅋㅋㅋ,5,서울올림픽기념관,서울 올림픽 기념관,869
2,Bill C,아주 좋은 올림픽 박물관,올림픽 공원에있는이 박물관은 입장료가 무료입니다. 1988 년 서울 하계 올림픽의 하이라이트를 제공하는 것은 훌륭한 일이다. 1988 년 올림픽 게임에 등장한 올림픽 및 개인 스포츠의 역사가 전시되어 있습니다. 최근 2018 년 동계 올림픽 개최 품목도 있었다. 전시는 한국어와 영어로 진행되었습니다. 박물관에는 카페와 선물 가게가 있습니다. 입구 근처에서 박물관의 정보와 레이아웃을 제공하는 무료 팜플렛을 준비하십시오.,4,서울올림픽기념관,서울 올림픽 기념관,869
3,Mazmannan,훌륭한 올림픽 박물관,올림픽 공원 세계 평화를 게이트 멀지 않은 서울 올림픽 박물관. 이 1990년 널리 성공적인 올림픽 Asteroid 열린 1988년 올림픽 나라를 기념하기 위해 설립되었습니다. 입장료는 무료입니다. 개장 시간 오전 10시부터 오후 6시 - 오후 5마지막 입장할 수 있습니다. 30시. It는 월요일에 문을 닫습니다. 이 박물관은 1층에 있는 종신 전시 홀(Hall). 2층에 조화를 홀과 다른 종신 전시 홀 번영을 홀은. 또한 명예를 홀이 있습니다. 지하에 있는 게임 라이브러리. 또한,4,서울올림픽기념관,서울 올림픽 기념관,869
4,OISEAU_K,한국의 올림픽 영웅들을보기,"한국 선수들과 88 서울 올림픽 (여름)에 중점을두고 있습니다. 처음 오신 것을 환영합니다. 2 층에는 커피 숍, 작은 기념품 가게 및 더 많은 전시회가 있습니다.",3,서울올림픽기념관,서울 올림픽 기념관,869
5,AutumnRain1988,만약에 …,"박물관은 갈 생각이 없었지만 "" 참조 합니다 "" 하고 보면 더 나은 아무것도 할 수 있는 지역. 아니 아주 큰 (2 또는 3 층에 기억 했습니다). 시간이 한 시간 정도 가 될 수도 (아마 은 거의). 하지만 스포츠 또는 올림픽 에 관심 없을 것을 왜 몰라. 나중에 올림픽 공원 을 산책하면서 체크 아웃할 수 손전등 굽기, 국가 플래그, 등이 있습니다. 정말 아름다운 가을 은 모든 잎 색상 변경.",4,서울올림픽기념관,서울 올림픽 기념관,869
6,LDALLET,실망 스포츠 박물관,"저는 거대한 팬이 에요 정말 별로 스포츠 박물관, 아닙니다 외국인, 아주 몇몇 infos에 약 한국이 올림픽 경기 하는 나라. 너무 영어 맞춤법 실수, 비디오 아카이브 웹 사이트에서 사용할 수 있는 컴퓨터를 작동하지 않았어요. 나는 심지어 더 목록을 메달 국가별로 예를 들어... 하이라이트는 경쟁, 등등... 매우 실망. 하지 가 제외하고 시간을 들여 올림픽 공원이 아주 좋은 봄 동안 또는 여름과. 또한, 영어 버전이 웹 사이트에서 언급한 3시간 무료 주차권 이 아닌 경우 검증 주차장. 싶지",1,서울올림픽기념관,서울 올림픽 기념관,869
