review,u_id,title,u_rate,p_id
텔레비젼에 나와서 갔는데 너무 재미있었습니다. 연인들과 같이 가도 좋고 아이들하고 같이 가도 좋습니다. 강력히 추천합니다.,JIHWAN RYU,러브 뮤지엄,4,922
여기 티비에 나와서 꼭 가보고싶었는데 ... 오늘 드디어 가보게되었다 여자둘이서 갓는데 남자친구랑도 오면 좋을것같은 장소(?)인것같다 나중에 남자친구랑도 와야지 !!!,안쥴리,짱 좋음,5,922
그저 사진 찍는 곳을 돈주고 간다는 게 처음에는 별로 내키지 않았는데 한 번 경험사마 간 것이 매우만족은 아니지만 나름 한 시간 동안은 재미있었습니다!! 하지만 처음엔 신기해서 재미있었는데 너무 같은 패턴에 종류라서 후반엔 사진도 별로 안 찍고 지루해 져서 조금 아쉽지만 재미있었습니다 저는 소셜커머스로 조금 싸게 갔는데 제값주고 보았다면 조금 더 아쉬웠을 것 같습니다~,손 부,러브뮤지엄!,2,922
너무 재미 있고 큰 웃음이었습니다! 트릭 아이 미술관과 함께해야합니다. 꽤 보수적 인 도시에서 그런 미친 곳을 보는 것은 재미있었습니다. 부끄러워하지 말고 웃으십시오. 재미있는 사진을 찍을 가치가 있습니다!,Holyrood,건방진 약간의 재미와 화려한 사진으로 걸어가십시오!,5,922
"""사랑 박물관""을 생각하면 발렌타인 데이를 생각합니다. . . 이것은 아닙니다! ! LOL. 인간의 성욕과 예술 작품으로 쉽게 기분을 상하게하지 않으면이 부분을 여행의 일부로 만드십시오! ! 너무 재미 있어요! !",Ashley M.,이 장소에 대한 많은 사랑,5,922
이 박물관은 재미 있었다. 나는 한국이 나타내는 것처럼 보수적 인 성 박물관이 한국에있을 것이라고 믿을 수 없었다.,Mobius1053,보수적 인 한국은 꼬임 측면을 보여줍니다,5,922
Ok. 그래서 8000 원은 그렇게 많지 않다. 그러나 우리는 1 시간 미만 동안 여기에 있었다. 그리고 큰 인상적인 박물관은 자유 롭다! 우리는 여전히 즐거운 시간을 보냈습니다! 벽에있는 그림들은 매우 재미 있습니다. 많은 사진 기회가 있습니다! 모델은 우리를 웃게 만들었습니다. 선물 가게를 사랑했을 것입니다! !,Lottelli,조금 비싸지 만 가치가있다.,4,922
"이 박물관은 독특합니다. 재미있었습니다. 마음을 열고 즐겁게 지내고 친구, 파트너와 함께 사진을 많이 찍고 좋은 웃음을 보내십시오. 내부에는 꽤 작지만 흥미롭고 재미있는 작품이 많이 있습니다. 좋은 사진을 찍을 수있는 기회가 많습니다. 내 파트너와 나는 많은 즐거움을 경험했습니다.",Everton,"재미, 재미, 재미",5,922
"이 박물관은 훌륭한 엔터테인먼트와 그림의 기회를 제공합니다. 비록 내가 혼자 여행했지만, 다른 방문객들은 매우 기분이 좋았습니다. 그래서 그들은 물었을 때 많은 사진을 찍었습니다. 입장료는 8,000 원이며, 그만한 가치가 있습니다. 나는 특히 제주 러브 랜드에 가지 않을 사람들에게이 곳을 추천 할 것입니다.",Aleksssa,큰!,5,922
"모든 격찬과 내가이 장소를 방문하는 것으로부터 얻은 즐거움에도 불구하고 나는 여전히 값 비싼 편에서 입학을 조금 찾는다. 이 장소에는 실제로 많은 창의력이 있으며, 특히 커플들은 좋은 시간을 보내는 경향이 있습니다.",Freddy W,좋은 웃음,4,922
그것은 속임수 박물관과 같은 건물에 위치하고 있습니다. 우리는 많은 즐거움을 가지고 돌아 왔습니다. 많은 웃음과 정말로 좋은 환대. 좋은 가치와 그것은 정말로 독특합니다.,Simon R,정말 재미있는 곳.,4,922
"나는 내 아내와 함께이 장소를 방문했으며, 귀엽고 재미 있었다. 우리 둘 다 디스플레이에 놀랐다. 경험하기 좋다. ??",Andrew Chin,재미있는 장소,5,922
나는이 사랑 박물관에 남편과 함께 갔다. 아주 좋고 흥미로운 곳이었다. 우리는 재미 있고 사진 찍는 것을 즐겼습니다. . . . . ??,Pei Ling C,사랑 박물관 리뷰,5,922
박물관 같은 독특한 종류. 부부 및 친구 그룹에 딱. 또한 활동이 많은 Hongig 지역에서 찾으십시오.,Landin Xuan Duyen,독특하고 재미있는,5,922
이 사랑 박물관을 방문했을 때 정말 흥미롭고 재미있었습니다. 나는 그룹뿐만 아니라 부부와 함께 방문하기에 가장 좋은 장소입니다. 좀 더 재미있게 즐기고 싶다면 사랑 박물관 서울을 방문하는 것이 좋습니다.,Data Ram A,재미 있은 장소들,5,922
"서울의 Love musium을 방문했을 때, 정말 재미 있고 놀랍다는 것을 알게되었습니다. 나는이 장소를 커플이나 친구와 함께 방문하는 것이 더 즐겁다 고 권합니다.",Durgadatta,서울에 방문하기에 아주 좋은 곳.,5,922
"나는 그런 특별한 박물관에가 본 적이없는 이유는 사랑 박물관보다 특별한 기억을 찾는다면 100 % 방문하는 것입니다. 배경, 소도구가 어떻게 거기에 정착했는지에 대해 당신은 당황 할 것입니다! 나는 방문하는 동안 줄곧 웃고 있었다. 그것들을 즐기십시오.",El Hani Abdessamad,특별하고 독창적 인,5,922
사랑 박물관은 특히 부부를 방문하는 것이 좋습니다. ) 그것이 트릭 안구 박물관의 2 층이기 때문에 강력히 추천합니다.,Demiana M,사랑 박물관,5,922
"나는 사랑의 박물관에 결코 전에 없었다. 그러나 나는 그들이 한국에있다라고 들었다. 그리고 내가 TrickEye 박물관에 갔을 때, Love 박물관도 거기에 있었다. 그래서 나는 거기에 갔다. 그것은 정말로 훌륭하고 멋진, 매우 시원한 경험이었고, 많은 좋은 그림을 만들었다. 박물관은 그다지 크지 않지만, 당신은 그것을 좋아할 것입니다!",gholesso,놀라운 박물관,5,922
사랑 박물관은 가족이나 친구들과 함께 방문하기에 좋은 곳입니다. 대부분의 클럽과 바가있는 큰 지역에 위치하고 있습니다.,James A,아름다운 장소,5,922
이 박물관을 방문하는 것은 정말로 우스웠다. 그것은 당신이 기대하는 것과는 완전히 다른 것입니다.,MichaelinSeoul,재미있는!,5,922
우리는 항상 웃을 필요가 있었고 약간의 미친 사진을 찍었 기 때문에이 박물관을 좋아했습니다. 확실히 박물관 방문은 결코 잊지 못할 것입니다!,flaviobolli,미친 박물관,5,922
친구와 함께 그곳에 갈 수 있습니다. 친한 친구처럼 말이죠. 왜냐하면 너희들이 충분히 가까이 있지 않으면 너희들이 거기 사진을 찍기 위해 부끄러워 할 것이기 때문이다. 그러나 거기에 가서 어쨌든 경험하는 것은 정말 재미 있습니다!,JeremyyTann 陈,사랑이 넘치는 재미있는 박물관.,5,922
이것이 누구에게나 지루할 수있는 가능성은 없습니다. 박물관 직원이 아니더라도이 경험을 즐길 수 있습니다. 카메라를 잊어 버리지 말고 친구들과 공유하십시오. 사진 촬영에는 추가 비용이 들지 않습니다.,850Lu,당신을 붉게 만들 수있는 박물관 : D,5,922
재미 있은 박물관. 하루 종일 많이 웃을 것입니다. 나는 사진을 찍을 부끄러워. 나는 단지 그것과 그 매우 흥미있는 것을 경험하고 싶다. . 그것을 사랑,Liwanag C,사랑 박물관,5,922
"홍대의 번화 한 거리 가운데 한가운데서,이 곳은 특히 친구 그룹과 꼭 가봐야 할 곳입니다! 재미 있고 유쾌한 재미있는 전시물과 그림이 여러분을 기다리고 있습니다. 내가 가장 좋아하는 것은 어촌 마을의 전형적인 모델 일 것이다. 잘보아야 만한다.)",Melissa P,이제 모든 걸 봤어?,5,922
이 meseum은 최초의 종류입니다. 사진은 조금 창피했지만 가치있는 시간이었습니다. 나는 와서 즐기기 위해 많은 부부를 추천합니다.,희준 이,홍대에 새로운 종류의 무서운,5,922
Trickeye Museum을 구경하고 난 후에 이것은 곧바로이 장소에 갔다. 그리고 그것은 당신이 구경 할 필요가있는 매우 재치가 있고 화려한 장소 나머지 다. 그리고 나는 그것을 당신의 상상에 맡길 것이다,Cheeta A,스트레스 해소,5,922
확실히 재미있는 경험. 나는 친구와 함께 방문했다. 그리고 우리는 확실히 많은 웃음을 가지고 있었다. 그것은 당신이 방문해야만하는 독특한 장소입니다.,Guada A,재미있는 경험,5,922
나는 여자 친구와 함께 그 장소를 방문했고 그것은 매우 멋지다. 우리는 무한한 즐거움을 가지고있었습니다. 디스플레이는 놀랍습니다. 거기에 갈 때 열심히 웃으십시오. 너무 많은 재미있는 전시가 있습니다. 그것은 커플에게 완벽한 장소입니다. 재미 있고 펑키 한 것들을 좋아한다면 거기를 방문해야합니다. 끝날 무렵에 그들은 또한 당신의 얼굴을 스캔하고 TV에 나타나는 TV 화면을 가지고 있습니다. 그런 다음 수건 춤으로 시작합니다. 커플들을위한 꼭 방문해야 할 장소입니다.,Martin,재미와 흥분으로 가득 차 있습니다.,5,922
"이 ""Fulgar"" 개념 같은 성인 내 첫 경험이었습니다. 그러나 도면을 우습게도 이루어지기 때문에 걱정할 필요가 없습니다. 라이브 지루한, 자신을 이런 도전!",Winda L,1그리고 내 인생에서 경험을,5,922
"친구와 사랑을 박물관 방문, 우리는 ""독특성""가 표시됩니다 많았다. 나는 고대 한국의 표시됩니다 매우 흥미로웠다. 또한, 나는 약간 수줍어 하지만 대부분은 좋은 재밌었어요!",Kyla N,"""내 친구가 증진에 - 멋진 추억을 lol",5,922
"Trickeye 박물관, 아이스 박물관 방문 후 생각을 사랑할 박물관 입력하고 안 좋은 선택이 lol 생각함. . 처음 정말 즐거운 시간을 보냈습니다. 멋진 곳!. !",NATALIE S,마약을 곳,5,922
"파트너와 함께 이 곳 정말 즐거운 시간을 보내고 싶다면. Overdramatic 핀 UPS, 섹시한 만화를 보는 지나치게 재미있는 사진을 찍을 수 때도 꼭 가야 합니다. 이 곳은 모든 Sexe 대한 유쾌하고 가벼운 농담을 대한 느낌을 쓰기 풀편했다는 건데 없이 진짜 재미있고 웃을 수 있습니다. 모두가 말도 안되게 재미있는 사진을. 파트너와 조차 더 재미있다.",Leyla P,의 낄낄거리며 많은,5,922
"자카르타에 파트너 곳입니다. 섹스 그러나, Cluntchy 대한 모든. 사람들이 재미있은 그림, 쓰기 풀편했다는 건데 느낌 없이 재미를 걸릴 수 있습니다. !",SlovakBoy,방문하기 좋은,5,922
"합리적인 시설을 갖춘 합리적인 가격. 추천합니다. 그러나 성에 대한 수줍은, 돈 낭비 하지 않을 경우",Jonathan W,멋진 곳,5,922
박물관은 성에 대한 모든 것은 이상한 섹스. 나는 웃었다. 나는 친구와 함께 즐겼습니다. Fun 섹스 여행할 수 있는 많은 곳이 있습니다. 바로 그 가치가 있다.,pigpig7,재미,5,922
이 동상은 섹시한 재미있는 자세로. 저와 제 친구는 웃음을 많이 걸리고 사랑을 박물관 재미있는 사진을 많이!,oliviayeung97,즐거운 하루!,5,922
"이 사랑을 박물관 대신 섹스 박물관 통화. 그 매직 아이 박물관, 제 친구와 저는 방문한 했다 같은 건물에 있습니다. 꽤 명시적, 사진 필요성을 느끼지 않았다, 그러나 나는 많은 사람들이 정선희 가질 수 있습니다.",kordani,내 취향은 아닌걸로,2,922
이 박물관은 눈길을 속여 얼음 박물관 같은 건물 안에 있습니다. 사진을 동상들이 있습니다 무척 멋진 사진을 만들 수 있습니다. 30분 여행을 끝낼 수 있습니다. 훌륭한 레스토랑이 많았어요. 단일 성인 티켓 비용은 8000원. 어린이에게는 추천하지 않습니다.,Brian,"재미, 작은 박물관. 성인 8000원 Tkt",3,922
이곳은 박물관. 이 장소는 섹스 쇼. 단 2 3 방 사진들 로 일부 사진 및 불쾌 불쾌한 동상. 바가지가. 귀찮게 하지 않는다,MKartini,돈을 낭비 하지 마세요,2,922
살아있는 박물관과 비교하면 원래 눈을 다른 사람들도 현실이 박물관이 있는 제공하는지!,Rirji,정말 마음에 들어요!,5,922
매우 놀라운 박물관 niceand. 많은 사진을 찍지 않고 창의적인 방법은 놓치지 마세요. 성인 전용.,rakandakh,놀라운,5,922
