,u_id,title,review,u_rate,place_name,res_title,p_id
0,czdy,만족스러운 공연장,"뮤지컬공연 보기에 아주 괜찮은 공연장 중 하나에요. 레베카, 팬텀, 웃는남자 등 인기있는 뮤지컬도 많이 보고 교통도 편리해요",4,블루스퀘어,블루 스퀘어,976
1,juou,재밌는 뮤지컬이 많아요,이태원과도 가깝고 한강진역하고도 연결되어 있어서 위치도 좋아요. 공연볼 때 주차하기도 생각보다 수월합니다. 재밌는 뮤지컬을 늘 해서 좋아요,4,블루스퀘어,블루 스퀘어,976
2,여행자,가족모이 장소로 좋아요,부모님 뮤지컬 보여드리기 위해서 방문햇엇는데 건물이 깨끗하고 좋았어요. 뮤지컬도 재밋게 조고 주변에서 식사하기도 위치가 좋앗습니다,5,블루스퀘어,블루 스퀘어,976
3,진희 손,식당,기대안했는데 식당 음식이 꽤 맘에 들었어요. 특히 3층 커피숍은 서점과 같이 있어서 책읽기 좋았어요 분위기 좋아서 자주 가보고싶네요,4,블루스퀘어,블루 스퀘어,976
4,deuxhan,프랑켄슈타인 보고 왔어요,블루스퀘어 이태원 한남동 나들이에 들리면 좋아요 전 뮤지컬 보러 다녀왔는데 무대도 괜찮고 북카페가 괜찮네요 꼭 공연이 아니여도 들려보면 좋을 듯,5,블루스퀘어,블루 스퀘어,976
5,zesto0722,인터파크홀에서 공연을 봤습니다.,"교통 편리하고, 내부 깔끔합니다. 대신 수용인원에 비해 대기시간에 할 수 있는 일이 별로 없어서 좀 아쉬웠습니다. 다양한 즐길거리를 만드는 것도 좋을 것 같습니다.",4,블루스퀘어,블루 스퀘어,976
6,비온디산디,깔끔한 복합 센터,도서관을 찾아 방문했는데 생각보다 규모가 크고 역세권에 위치해 찾아가기 쉬웠습니다. 뮤지컬로 유명하다는데 아직 한번도 뮤지컬 관람차 방문은 못해봤네요..,5,블루스퀘어,블루 스퀘어,976
7,902,뮤지컬 관람,"작년에도 가고 올해도 뮤지컬 관람하러 갔는데, 시설은 아주 좋구요, 다만 안에서 파는 식음료들이 너무 비싸서 ㅠ 물 같은 건 역 편의점 같은데서 사오는 걸 추천해요 ㅎㅎ 공연 전까지 시간 보낼 수 있는 북카페가 아주 잘 만들어져있습니다 ㅎ",4,블루스퀘어,블루 스퀘어,976
8,alaco3,즐겁게 뮤지컬 관람~,"위치, 시설 모두 만족스럽습니다. 뮤지컬 시스터 액트를 편하게 즐길 수 있었습니다. 내부에도 식당이 있기는 하지만, 주변 상권과는 거리가 있어 5분 정도 걸어야 합니다.",4,블루스퀘어,블루 스퀘어,976
9,시리우드,아주 잘 만들어진 공연장입니다.,뮤지컬을 아주 좋아해서 일년에 두세번은 블루스퀘어를 찾게 됩니다. 이태원에서 식사를 하고 걸어가면 약 10여분 정도 걸립니다. 블루스퀘어 주변에는 마땅히 식사나 음료를 마실 공간이 충분하지는 않습니다.,4,블루스퀘어,블루 스퀘어,976
10,lhl22,뮤지컬관람후 북파크!,블루스퀘어 주변에 생각보다 즐길거리가 많지않아서 뮤지컬만 보고간적이많았지만 북파크가 생겨서 뮤지컬보고 북파크 가면 딱좋은거같아요 그리고 북파크가 너무 예뻐서 책을 사고싶게만드네요 ㅎ,4,블루스퀘어,블루 스퀘어,976
11,VICTORYKANG,북테마파크 방문,"1층엔 공연장으로 시카고 오리지날 내한공연을 하고 3층은 북카페 테마 용품 팬시 용품 판매, 밀크아이스크림 미성당 같은 ... 쉬고 구경하고 책 보고 중고 책 1000원부터 ㅏㄴ매도 하고 볼 것이 많은 장소이다",5,블루스퀘어,블루 스퀘어,976
12,올리브521,블루스퀘어 3층의 북파크,블루스퀘어에서 킹키부츠를 보았다. 늘 이좋은 장소에 편의시설이 부족한게 이해가 안되었는데 드디어 북 파크라는 서점겸 카페가 생겼다.인터파크의 서점이라한다. 나무로 이루어진 내부도.아름답게 배치된 공간도 커피도 다 만족스럽다.,5,블루스퀘어,블루 스퀘어,976
13,Ghyuk,교통은 좋지만 사용 편의성은 아쉬움이 남는 곳,"지하철에서 바로 진입이 가능하여 대중교통 이용은 편리하지만, 층별로 진입이 가능하고 출입구가 다양하다 보니 돌아다니며 혼란이 올 수도 있을 듯. 바로 인접한 상권이 이태원이라 조금 부담스럽긴 하지만 조금만 걸어가면 주변 골목에 작은 식당들도 존재한다. 큰 불편함 없이 2층에서 공연 관람.",4,블루스퀘어,블루 스퀘어,976
14,chunglang,교통이 편리한 공연장,"뮤지컬 <레미제라블> 관람을 위해 블루스퀘어를 방문했습니다. 경기도 일산에서 아이들 2명과 함께 갔는데, 생각보다 멀지 않았고 지하철역과 바로 연결되어 있어서 매우 편리했습니다. 공연장도 훌륭했구요. 지하철로 바로 연결되었고 밤에 도착해 외관을 잘 못본점은 아쉽네요..",4,블루스퀘어,블루 스퀘어,976
15,선미 박,공연장 자체는 최악,"동네 특성상, 주변 음식점들은 음식값이 매우 비싸고, 블루 스퀘어는 공연장 부대시설이 잘 되어 있는 편에 속하지만, 공연장 자체는 최악의 공연장이예요. 단차가 불쾌한 곳이죠. 좋은 공연을 이곳에서 많이 한다는 게 속상하기까지 해요. 자주 가는 곳이지만 갈 때마다 속상해요. 다만, 스와로브스키 악세사리를 지하 로비에서 저렴하게 팔고 있다는 게 조금 위안이예요.",2,블루스퀘어,블루 스퀘어,976
16,PINKSHOW01,찾아가기 편한 뮤지컬 공연장,"전철역과 바로 이어지는 몇 안되는 공연장 중 하나. 안에 내부가 좀 복잡하고 좌석의 단차가 썩 좋은 편은 아니지만, 그래도 좋은 공연을 많이 상영하고 있어서 자주 방문하게 되는 곳임. 특히 공연장안 여자화장실이 화장품도 비치되어 있고 매우 쾌적하게 꾸며져 있어서 좋았음",3,블루스퀘어,블루 스퀘어,976
17,mmom661,공연 관람하러 갔어요.,지하철 한강진역과 바로 연결되어있어 매우 편리하고 좋았습니다. 공연장도 쾌적하고 괜찮았어요.,4,블루스퀘어,블루 스퀘어,976
18,Moonkyu K,한강진역에서 바로 이어져서 편함,"위키드를 보러 갔었는데 깔끔하고, 이태원에서도 가깝고, 한강진역에서도 바로 이어져서 동선도 편하고 시설도 깔끔했다. 극장은 좀 큰편이라 앞자리에 앉는게 좋다.",5,블루스퀘어,블루 스퀘어,976
19,inthesub,뮤지컬 관람하러 방문,"뮤지컬 관람하러 방문하였습니다. 건물자체도 이쁘고 공연시설도 좋고, 주차장이 살짝 협소하지만 무리 없이 주차할 수 있어서 좋았습니다. 그래도 대중교통을 좀 더 추천드릴 수 있어요.",4,블루스퀘어,블루 스퀘어,976
20,haeaaa,좋습니다! 교통좋아요~!!!!,지하철역이랑 바로 연결되어있어서 일단 가기가 굉장히 편합니다! 그리고 공연장이 굉장히 커서 사람이 많아도 많이 북적북적하다는 느낌을 조금 덜 받았어요 ㅋㅋㅋ 레미제라블 공연 VIP좌서으로 5열중앙에서 봤는데 잘보이더라구요~ 공연장에 뮤지컬관련 제품들 모아둔곳도 있으니 구경하면 좋을것 같아요~ 단점이라면 주변에 먹을데가 마땅치 않더라구요 ㅠㅠ 아쉽습니다 그게 조금,4,블루스퀘어,블루 스퀘어,976
21,정섭 조,뮤지컬관람,"뮤지컬관람을 하였습니다. 서울시내 한복판에 있어, 전철로 이동하였는데, 차 막히고, 주차하고 하는것에 비하여, 전철이동이 편리할것 같습니다. 처음 가봤는데, 관람시설이 좋았습니다. 단점은 관람시설내의 공연장이 공기가 많이 탁하고, 먼지가 많았습니다.",4,블루스퀘어,블루 스퀘어,976
22,leonsOwner,계속 찾을 수 있는 공연장,"지하철과 연결되어 있고, 1층 좌석은 지하철역으로 이어지는 통로가 바로 있어서 편리합니다. 좌석이 그렇게 넓지는 않습니다. 뮤지컬을 보기 위해 올해 두 번 방문했는데, VIP석 1층에서 관람했을 때는 배우의 표정까지 보여 생생한 느낌으로 공연을 즐길 수 있었고, S석 2층에서 봤을 때는 한 눈에 무대 전체가 보였지만, 배우의 표정은 보이지 않았습니다.",5,블루스퀘어,블루 스퀘어,976
23,EP282,지하철역이랑 바로 연결되어 있는,"지하철역이랑 바로 연결되어 있어서 대중교통 이용하기에 편리해요. 공연장 자체는 작은 편이라 눈으로 보기에도 좋아요. 근처에 밥 먹을 곳이 없다고 많이들 말하는데 이태원이 주변이라 조금만 걸어도 맛있는 음식점, 카페들이 많아요. 걸으면서 주변 일대를 보기에도 좋음.",4,블루스퀘어,블루 스퀘어,976
24,H849PQ_,뮤지컬보러,"블루스퀘어에 갔다. 지하철역과 연결되어 있어서 좋았지만 간단한 식사를 할 만한 장소가 마땅하지 않았고, 삼성전자홀 지하3층에 있던 한 카페는 앉을자리도 없어서 불편하게 먹었다. 그런 점들만 빼면 공연보기에도 괜찮고 시설도 나쁘지 않았다",4,블루스퀘어,블루 스퀘어,976
25,퍼언,"뮤지컬 보기엔 최적, 주차는 힘듬","뮤지컬 공연 관람차 방문하였습니다. 예전에는 차를 운전해서 방문한 적이 있었는데 주차공간이 많이 부족하더라구요. 그래서 이번에는 지하철을 이용하였습니다. 한강진 역에서 바로 연결되어 있어 편리하고 바로 입구에 편의점도 있어 끼니를 때우고 갈 수 있었습니다. 시설은 매우 깔끔하고 홀 역시 보기 편하게 되어 있습니다. 뮤지컬 보러 가시는 분들, 지하철 타고 가시면 만족하실 겁니다",4,블루스퀘어,블루 스퀘어,976
26,Juhee K,방문하기 좋았음,뮤지컬 전문 극장으로 방문하였는데 시설도 좋고 음향도 좋음. 주변에 이태원이라 맛있는 음식도 먹을 수 있음,5,블루스퀘어,블루 스퀘어,976
27,halsherm3,한국에서의 레미제라블,끝내주는 경험이었습니다. 노래는 전부 한국어였고 굉장했습니다. 지하철로 가기는 편한데 끝나고 택시 잡기가 힘듭니다.,5,블루스퀘어,블루 스퀘어,976
28,KileyS93,공연 하기 좋은 곳,"오페라의 유령을 봤습니다. 극장도 좋고, 교통도 좋고, 공연 전후로 간단한 음식을 사 먹거나 커피를 마시기 좋습니다. 무대 장치나 공연도 좋았습니다.",4,블루스퀘어,블루 스퀘어,976
29,Citrus4,"블루스퀘어에서 ""위키드"" 관람","블루 스퀘어는 근처에 갤러리도 있고 아름다운 곳입니다. 옆에 귀여운 이탈리아 식당(Kraze Restaurant)이 있고 2층에는 쓸 데 없이 비싼 중국집이 있습니다. 외국인은 표를 사기가 조금 까다로웠는데, 영어로 대화할 수 있는 전화번호를 주어서 쉽게 샀습니다. 건물이 아주 좋고 깨끗하며, 기다릴 때도 앉아서 쉴 곳이 많습니다.",4,블루스퀘어,블루 스퀘어,976
30,Bobby091,과대 평가,"이 극장은 좋은 점도 있지만 전체적으로 세계 수준에는 못 미칩니다. 건물 설계가 형편 없습니다. 입구에 들어서면 3층 발코니입니다. 여기서 표를 끊습니다. 코트 보관소는 1층입니다. 커피숍이 몇 개 있는데 자리가 너무 부족하고 위치도 이상해서, 처음부터 고려한 것이 아니라 나중에 대충 이런 것들을 정해서 집어 넣은 느낌입니다. 입구인 3층에서 1층과 2층으로 가는 계단이 하나 뿐입니다. 너무 작아서 깜짝 놀랐습니다. 비상 상황 같은 게 일어나지 않기를 바랄 뿐입니다. 이 계단으로는 사람들이",2,블루스퀘어,블루 스퀘어,976
31,Jillian M,블루스퀘어에서의 즐거웠던 두 번의 경험,"한국에 머문 두 달의 기간 중에 정말 운이 좋게도 블루스퀘어에 두 번이나 갈 수 있었다. 처음에는 가장 큰 객석에서 뮤지컬 '엘리자벳'을 보았다. 제작사는 장소를 잘 꾸며 놓았고 무대도 환상적이었다. 많은 기술적 장치 덕에 뮤지컬이 펼쳐지는 곳에 있는 것처럼 느껴졌다. 한 달 후 다른 뮤지컬('캐치 미 이프 유 캔')을 보기 위해 다시 방문했다. 이번엔 2층 객석에서 관람하였는데, 깨끗하고 따뜻한 분위기에 감명 받았다. 좌석은 놀라울 정도로 편안했고 소리는 전 객석에 완벽하게 전달되었다.",5,블루스퀘어,블루 스퀘어,976
32,Kat,나는 책장을 방문했다,지난 토요일에 블루 스퀘어에있는 책장을 방문했습니다. 별도의 VIP / 라운지 층이있어 매우 좋습니다. 수천 권의 책과 재미있는 좌석 공간이 있습니다. 2 층에는 발코니가 있고 좌석 공간이 많은 카페가 있습니다. 내가 이상하게 발견 한 유일한 것은 2 층에 화장실이 없기 때문에 3 층으로 올라가거나 1 층으로 내려 가야한다는 것입니다. 1 층에는 극장과 커피 숍이 가까워서 큰 줄이있었습니다. 따라서 3 층에있는 것을 사용하는 것이 좋습니다. 나는 블루 스퀘어에서 공연을 보지 않았지만 가까운 시일,4,블루스퀘어,블루 스퀘어,976
33,canter2u,"아름다운 장소, 쉬운 지하철 이용, 편안한 좌석 Wegmans room, professional musicals","어젯밤 엘튼 존스 아이다를 보았습니다. 훌륭한 사운드와 조명, 놀라운 연주자.",5,블루스퀘어,블루 스퀘어,976
34,ILoveFoodComa,뮤지컬 극장,"뮤지컬 애호가로서, 외국에있는 방문 극장은 항상 나의 할 일 목록에 있습니다! 그것은 변태 시동을 보여주고있었습니다. 나는 LA에서이 쇼를 보았다. 한국어 버전을 기다릴 수 없어! 언어는 장벽이되지 않습니다. 무대 공연, 노래, 춤 등을 완전히 즐기고 있습니다. 아주 멋진 극장. 좋은 크기의 로비는 캐스트 사진을 보여줍니다. 레드 카펫 지역, 완전히 사진 기회 순간을 사랑해! ! 중형 극장 2 층. 좋은 음향 효과. 내가 서울을 다시 방문한다면 분명 다른 쇼를 볼 것입니다!",4,블루스퀘어,블루 스퀘어,976
35,jeissler,공연을 하기 좋은 곳,나는 그 두 가지를 볼 수 있었다 보 미충족분에 제가 직원들이 인상 깊었습니다. 직원들은 친절하고 도움이 되었습니다. 쇼 자체는 매우 높은 품질을 즐길 수 있었어요. 확실히 뭔가 다른 것을 볼 수가 있다.,5,블루스퀘어,블루 스퀘어,976
36,afylam,매우 친절하고 상냥한 직원!,"나는 뮤지컬 티켓 예약을 2 보려면 ""jeckyll & 하이드"" 저녁의 15년 3월 4일. 불행히도, 우리는 지하철에서 잃어버리고 오랜 시간을 극장에 도착. 도착했을 때의 극장, 공연이 시작. 제가 운이 좋아서 그 만나서 매우 친절하고 상냥한 foh 관리자 지하철 enrance 극장, 그는 나의 쿠폰, 가르쳐 주는 매표소 에 내 주장을 가르쳐 주고 티켓을 오른쪽 도어 안내인 은 문을 잡는 즉시 우리 좌석을 보여 주었습니다. 모든 이미 2분. 나는 그들의 노력에 깊이 감사를. 은 방문자가 한국에,",5,블루스퀘어,블루 스퀘어,976
37,Alvin W,음악 감상하기 좋은 곳입니다,위치는 지하철역 바로 옆에 있었고 지하 역 직접 접속합니다.,5,블루스퀘어,블루 스퀘어,976
38,Matthew W,고양이 느낌,"극장 은 경험! 제 가 있 던 목다리 때, 직원 들 이 매우 도움 이 되 는 저 에게는 동안 저장하여 표시할. 극장 은 현대 적 이 고 강력 하 ㅂ니다.",5,블루스퀘어,블루 스퀘어,976
