user_id,title,content,rating,place_name,res_title
snoopy419,청계천에 대해 생각하게 되는 박물관,"청계천 산책 중에 우연히 방문하게 된 박물관입니다. 옛날과 오늘의 청계천 비교, 역사와 변화에 대해 잘 정리되어 있어서 관람하기 좋았습니다. 위부터 관람하면서 아래로 이동하는 건물 구조라 이동도 편하고 복잡하지 않아 좋았어요. 1층에는 북카페가 있어서 자료들도 볼 수 있습니다.",5,청계천박물관,청계천 박물관
vlogg,청계천 인근,청계천 산책로와 가까운 곳에 있어서 지나가면서 한번 둘러보기 좋아요. 청계천 지역의 과거와 현재에 관해 나와있습니다. 개인적으로 과거의 자연스러웠던 청계천이 더욱 마음에 들었어요.,5,청계천박물관,청계천 박물관
TOPTEN93,도심에서 힐링을,도시를 걷다가 발이 피곤하면 잠시 쉬어갈수 있는 청계천...시내 중심부에 이런 힐링 공간을 가지고 있는게 복입니다.,4,청계천박물관,청계천 박물관
CanisHan,청계천 역사에 관한 좋은 박물관.,C (20.01.28) 박물관은 청계천의 과거와 미래를 보여줍니다. 박물관은 내가 생각했던 것보다 더 크고 잘 관리했습니다. 나는이 박물관을 기대하지 않았지만 청계천의 역사에 대해 알만한 좋은 박물관이있었습니다. 서울이 운영했기 때문에 요금이 무료였습니다. 서울의 역사에 대해 알고 싶다면 좋은 곳이 있습니다.,4,청계천박물관,청계천 박물관
R_A617,방문 할만한 가치가있는 곳,서울의 상징적 인 랜드 마크인 청계천의 개울에 관한 이야기를 들려줍니다. 오래된지도와 많은 오래된 사진으로 15 세기부터 현재까지의 역사를 추적합니다. 그것이 어떻게 커버되고 그 후에 밝혀 졌는가. 도로 건너편에있는 원래 목재 죽마 하우징의 일부를 놓치지 마십시오. 메트로로 들어가서 쉽게 접근 할 수 있으며 짧은 도보 거리에 있습니다.,5,청계천박물관,청계천 박물관
wwks26,청계총의 변화를 보여주는 위대한 박물관,"도시 역사나 도시 개발에 관심이 있다면이 박물관은 청계총이 지난 10 년 동안 어떻게 변화했는지를 배우기에 절대적으로 좋은 곳입니다. 그것은 2 차 세계 대전 이후 경제 호황과 강 복원의 세부 사항으로 인해 일어났던 사회 문제뿐만 아니라 강의 역사적 의미를 포함합니다. 개인적으로, 나는 한국에서이 놀라운 갱신 프로젝트에 관해 많은 것을 배울 수 있기 때문에이 박물관을 많이 좋아합니다. 비록 한국말이 여전히 박물관의 주요 언어이지만 일부 중요한 장소에는 일본어, 영어 또는 중국어 설명이 있습니다.",5,청계천박물관,청계천 박물관
chesterchandler,매혹적인 박물관 chenogyecheon 관한 모든 강 복원,"이 완전히 떨어져 있지만 사람들이 서울 역사 박물관 뮤지엄 은 중간 크기지만 오직 청계천 둔 강 - - 이 역할에 it 의 역사와 서울의 놀라운 이야기 복원 센터 피스 머시닝되도록 서울의 "" 녹화. "" 아름다운 박물관 이 함께 시작 설정 맨 위에있는 역사 박물관 및 작업을 뚫을 맨. 있는 것으로 흐름을 내리막 였다. 좋은 사진과 서울의 과거는 영어로 쉽게 이해할 수 있습니다. 서울 역사 박물관 을 방문할 때도 주 - - 이 발견 은 좀 더 흥미로운 쉽게 이해할 수 있습니다. 몇 관광객을 이곳에",5,청계천박물관,청계천 박물관
Vicsite,훌륭한 박물관 (이 주제),"박물관에 있는 대부분의 사람들은 ""원류"" 스트림의 이동, 방문할 가치가 있는 시간이 있다면 이지만. 옵션 #2 또는 가입이 무료로 서울 도보 여행을 하기 위해 (그는 한). 이 사이트의 복제된 섄티타운 예도 있다. 이 지역은 또한 단면 흘르다 따라 걸어갈 수 있는 소박한 다른 관점이 가치가 있습니다.",5,청계천박물관,청계천 박물관
Quack H,대한,청계천 의 메인 빌딩에 있는 많은 박물관과 같이 비디오 표시 및 교육 박물관 맞은편의 오래된 집의 청계천.,4,청계천박물관,청계천 박물관
