user_id,title,content,rating,place_name,res_title
HyeyeonAhn,인사동의 조용한 찻집,인사동 골목 안쪽에 있는 조용한 찻집이에요. 삱뱔 다양한 차를 맛볼 수 있어요. 여름엔 시원한 빙수가 인기. 인테리어 아늑해요!,4,아름다운 차박물관,아름다운 차박물관
vlogg,ㅠㅏㄴ국의 차 문화,한국의 전통차에 대해 체험해보고 알아볼수 있는 박물관입니다. 종로에 있으며 같이 까페를 운영하고 있어요. 잠시 쉬어갈수 있습니다. 다시 방문하고 싶은 곳이에요. 외국인들에게도 많은 방문이 이어질수 있으면 좋겠어요.,3,아름다운 차박물관,아름다운 차박물관
Jay B,좋아요,"박물관은 규모가 너무 크지 않은, 중간 규모의 레스토랑입니다. 다양한 차를 맛볼 수 있을 뿐 아니라 (물론 돈을 내야 합니다.) 잎차를 살 수도 있습니다. 메뉴판에는 다양한 차 목록과 건강에 좋은 점이 쓰여 있습니다. 아주 도움이 되는 내용이죠. 딱 한 가지 아쉬운 점은 박물관의 위치입니다. 찾는데 한 시간도 넘게 걸렸습니다. 관광객들이 쉽게 찾을 수 있도록 안내 표지판을 잘 만들어야 할 것 같습니다. 다시 오고 싶네요.",4,아름다운 차박물관,아름다운 차박물관
Alex L,천국 조각,우리는 예전과 같이이 곳에서 환상적인 전통 차 체험을했습니다. 차는 조심스럽게 제공되는 작은 차 세트에서 나오며 5 컵 지속되며 정말 맛볼 수 있습니다. 장소의 이름은 약간 오도하기 쉽다 - 우리는 작은 박물관을 기대했다. 그러나 그것은 당신이 차와 도자기를 살 수있는 더 많은 다방 & 상점이다. 또한 표시가 보이지 않아서 우리는 거의주의를 기울이지 않았습니다. 나는 전통 차 한잔에 들러서 매우 추천한다!,5,아름다운 차박물관,아름다운 차박물관
TravelingSarah35,좋은 본격적인 체험,"하지만 작은 박물관은 많지 않습니다. 경험할 가치가 있는 다른 차 다! 프레젠테이션은 분위기. 이 곳은 인사동 떨어진, 진짜 잘 지도를 챙기세요!",4,아름다운 차박물관,아름다운 차박물관
Suad A,말 속에서 지정한 박물관,싶다고 생각하는 골목길에 인사동 가 박물관에서 다양한 노력을 하는 곳이 있는 찻집이 porcalain 의 판매 가격은 다른 종류의 차를 수집하고 비싼 편. 나는 차 를 사 않았지만 선물 나같은 것이 없고 직원들은 친절하고 평화롭고 특별하고 티 하우스 bacardi 술. 살 수 있는 것이 좋지만 본 차 컵 을 판매하는 긴 산책을 하지 못할 만큼 의 무게.,3,아름다운 차박물관,아름다운 차박물관
Mindy,심지어 큰 차를 좋아하지 않는다면!,"저는 큰 차는, 제 남자친구는 저를 설득할 수 있는 곳이, 아주 맛있는 살구 있는 환상적인 아이스 티! :) 이 곳은 휴식 하면서 쉴 수 있는 간단한 쇼핑도 좋고 인사동. 사랑스러운 분위기, 하지만, 다른 리뷰어의 얘기, 안은 박물관: p",5,아름다운 차박물관,아름다운 차박물관
