user_id,title,content,rating,place_name,res_title
Lawrence C,간편한 탐색 내 여러 전시 박물관,"중국 미술을 좋아한다면, 입니다. 3층은 박물관에 전시해 다양한 종류의 체크 아웃. 지하에 있는, 하위 단면 무료로 들어갈 수 있는. 아이들과 함께 즐거운 시간 내에 있는 2!",4,국립고궁박물관,대만 국립 고궁 박물관
MettaJo's Mindb... X,5성급 국립 박물관,보물을 수집 및. 아름다운 건물 과 함께 표시됩니다. 방문할 가치가 있는 경우.,5,국립고궁박물관,대만 국립 고궁 박물관
Ukulele-sam1951,"월드 클래스 박물관, 대만에서 방문해야합니다","만약 중국 문화의 이해, 여기서 최고의 소장품을 중국 역사 에서, 끝없는 디스플레이 3월 에는 모든 주요 변경 항목 표시, 대만 에 방문 할 때는 항상 방문 합니다. 열기 전에 적극 추천합니다, 이는 모든 관광객들이 대만 에 포함된 기능 합니다! 최소 3 4 시간을 함께 게, 하루 방문하는 장점, 다른 레스토랑 (regent 호텔 타이베이 의해 관리됩니다. 다음 건물, 가격은 저렴하지만 음식 질이 지!",5,국립고궁박물관,대만 국립 고궁 박물관
Gao33wy,"훌륭한 박물관, 중국 유물이 인상적인 컬렉션","우리는 두 아이들과 함께 하루 7월 10 년 후. 인상적인 유물 수집한 중국, 초급 등, 옥, 도자기 및 중국 경험. 좋은 오디오 투어 에서 장비를 빌리는 것이 당신의 속도 에 해당 작업을 수행할 수 있습니다. 하나 투어 가이드 또는 서명할 수 있습니다. 타이페이를 방문한다면 추천합니다!",5,국립고궁박물관,대만 국립 고궁 박물관
Hunterboeuf,어떤 보물!,국립 고궁 박물관 은 꼭 - 관광 명소로는 타이베이 를 참조하십시오. 박물관에서 처음 컬렉션 - 가격. 하루 이상이 필요합니다. 모든 것이 잘 - 표시됩니다.,5,국립고궁박물관,대만 국립 고궁 박물관
Cindy R,한 시간 이상 denpassar,"바쁜 일요일 에 방문한 - 실망스러운 점은 모음, 매우 오래 된 접시와 다른 아주 오래된 유물, 흥미로운 정보를 수집하지만 그렇지 않으면 할 수 없는 것에 대한 역사적 맥락 이 한 시대. 내부는 매우 실망스러운 점은 사회주의, 밖에 있는 전통적인 건물 과는 달리 어떠한 로컬 /.",3,국립고궁박물관,대만 국립 고궁 박물관
Mark T,아주 압도적,"저는 조용한 사람. 농장 동물 하지 않는 것 같아 주위에 수용되었다, 이 박물관이 라 조금 어려운 경우가 있습니다. 하지만, 일단 메인 입구 (같은 가축 야드, 박물관은 너무 커서 조용한 코너를 찾으실 수 있는 몇 가지지 2300피트에 대만 사람들의 놀라운 것들을 몰래 가지고 중국. 있다 합니다 정말 큰 화면의 궁전에서 제이드 엠퍼러 suvs! 약간의 조사를 할 수 있는 좋은 생각에 세계의 역사 를 이해하고 고대 중국 의 일부 항목은 표시할 의미 박물관 입니다. 일부 항목을 거슬러 천 년",5,국립고궁박물관,대만 국립 고궁 박물관
Julia T,내 5th 방문,"매번 더 좋아지는 곳입니다. 젊은 때. 내가 가서, 한 진정한 역사 진행하지만 디스플레이를, 내가 5 일 방문, 9 년 마지막 시간, 우리가 간 토요일 오후 늦게 가 6월 초에 박물관. 단체 관광객들이 많지 않고 조용하고. 저는 정말 모든 것이 고대의 유물, 및 탕 다이너스티 아래의 작업에서 놀란 전시합니다. 저는 정말 감사하게 생각하면 에서 문서 보존 박물관. 다시 갈 수 있었으면, 하는 날 알 수 있습니다. 꼭 해 본 박물관 입니다. 아니라면 중국 역사를 잘 알고, 오디오 자체를 빌려 -",5,국립고궁박물관,대만 국립 고궁 박물관
Zoe,엄청난 보물,"국립 고궁 박물관에 들를 가치가 있는 여행. 쉬웠고, 지하철 레드 라인을 타고 많은 버스들이 실린 방향의. 국립 고궁 박물관 옆 사용할 수 를 썼다. 메인 홀 을 한 번에 직진해서 티켓. 한 사람 당 250 nt $이고, 티켓은 작지만 아름다운 정원을 포함한 많은 수의 잉어 물고기 먹이 를 10 nt $상자가 있습니다. 박물관 내, 가는 곳이 바로 3층으로 에너지 합니다. 한 유물이 7000 년 된 옥 으로 조각 다양한 낡음 및 복잡한 의식에 있는 청동. 두 번째 층인 중국 역사 여행을 할",5,국립고궁박물관,대만 국립 고궁 박물관
weiwei_sg,뛰어난,"지난 18 년 전에 방문한 곳은 어둡고 곰팡이 가 여전히 놀란 때문입니다 뛰어난 수집 중국 예술 및 공예품. 현재, 개편 및 현대적인 박물관으로 개조된 이를 수행할 수 있는 뛰어난 품질을 보여주기 때문에 수집이 었죠. 또한 밝고 바람이 잘 통하는, 레이블 지정 및 명확한 중국어와 영어로 가장 훌륭한 오디오 가이드. 또한 쉽게 배치 합니다. 유일한 단점은 통해 이제 금광과 은광의 발견으로 많은 투어 그룹 이 쾅쾅. 하지만 중국 관광객들이 있기 때문에 컷 subsided 금광과 은광의 발견으로 많은",5,국립고궁박물관,대만 국립 고궁 박물관
Nippstik,아주 좋은 박물관.,"멍청이 드는 비용 좀 하고 사진 찍는 것을 보고 나를 찾기. 위대한 조각 과 박물관에는 다양한 스타일. 저는 예술적인 척, 좋은 박물관 이었지만 나는 감사합니다 - 이 호텔은. 주의 할 - 이곳은 마을의 중심부에 있지.",4,국립고궁박물관,대만 국립 고궁 박물관
geehwc,정말 흥미로운,저는 한 사람이 지원하지만 좋은 경험이 있는 박물관 을 방문해 다. 전에 이른 사람들이 반드시 온다. 물론 - 한 해. 이 주위에 있어서 걸어서 다 보면 과거 로 가져온 대만. 저도 전에 알고 있는 제이드 더 배웠다.,4,국립고궁박물관,대만 국립 고궁 박물관
tsem619,국립 고궁 박물관,"저희는 지하철과 버스를 타고 국립 고궁 박물관. 버스를 타고 있을 때 할 수 있고, 그들 만 정확한 변화. 박물관 입장료는 신용 카드. 저는 생각보다 실망스럽기 때문에 역사적인 그림을 표시 및 기타 과거 jewelries.",3,국립고궁박물관,대만 국립 고궁 박물관
Daniele-Donati,정말 흥미로운.,국립 고궁 박물관 을 갈 수 있는 지하철 역에 내리면 필요합니다 (레드 라인). 이후 버스를 합니다. 많은 사람들이 버스를 타고 갈 수 있는 다양한 선택 등 30 npm r - 304 - 255 및 815. 이는 정말 npm 합니다. 사람들은 모두 열정적인 기록 수 대한 전문 지식이 중국 및 대만 이 역사 시대 이후 에서 모두 둘러보세요.,4,국립고궁박물관,대만 국립 고궁 박물관
B A,"아주 좋은 장소를 방문할 때, 특히 해질 무렵 의","사진은 제가 있기때문에, 주위 방문을 해. 덜 붐비고 아름다운 색상. 너무 좋은 곳에 가드 변경 등이 있습니다.",5,국립고궁박물관,대만 국립 고궁 박물관
Chi N,평균 관광 박물관,"공항에서 택시로 45분 정도 타고 박물관은 호텔 근처에 있는 역. 저는 개인적으로 아주 인상적인 궁전의 건축 양식을 고려하지 않습니다 제 나같은 서울 또는 다른 훌륭한 관광지 태국. 많은 흥미로운 유물 이 있었지만 이곳은 붐비는. 우리의 전체 여행을 약 한 시간 반. 이 올 경우 기록 및 고대 하고 기대 이상의 고궁 박물관, 그리고 저는 정말 추천 합니다.",3,국립고궁박물관,대만 국립 고궁 박물관
Nga,여기 친구들이 외국인을 사랑,"내 친구가 와서 대만에 방문할 때 가져가. 또한 5 년 후에 이곳에 와서 처음에 살고 있는 대만. 박물관은 매우 크며, 수가 1 일 역사적인 것에 관심이 있다면. 외부의 장면은 아주 좋습니다. 석양을 즐길 수 있는 갈 때.",5,국립고궁박물관,대만 국립 고궁 박물관
Robynne T,중국의 역사적인 엿볼,"꼭 봐야 할 중국의 역사에 관심이 있다면 - 물론 아닙니다! 박물관 전체의 멋진 컬렉션에서 시대의 보물, 었고요 (영어, 중국어, 일본어) 증거 제시 삼개국어의. 돈을 내고 볼 가치가 있는 경우 자세한 내용은 오디오 가이드.",5,국립고궁박물관,대만 국립 고궁 박물관
Brichford,할 만한 …,". 어린 아이들은 아마 경기 시간 동안 단 에 전시한 "" 특정한 "". 우리 아이들은 박물관을 잘 할 수 있지만 반드시 같은 서예 에 관심. 어쨌든, 대규모 수집, 바빠질 수 있지만 잘 표시 (우리가 방문한 월요일). 밖이 아주 예쁜 설정할 수 있습니다.",4,국립고궁박물관,대만 국립 고궁 박물관
sid888333,매우 큰 박물관 오디오 가이드를 빌릴 수,3층은 박물관 많은 관광객들이 방문자들을 무료로 보는 일 꼭 봐야 할 곳 이 많은 대만 에 대해,4,국립고궁박물관,대만 국립 고궁 박물관
Deric S,많은 고대 중국 보물,"비오는 날에 방문하기 좋은 곳. 조금 멀지만 가장 가까운 지하철 역에서 걸어서 역에서 택시를 타고 안 비쌉니다. 많은 낮에 관광을 오, 밀기 및 밀어서 몇 가지지 있을 수 있습니다. 이른 아침이나 늦은 오후가 방문하기 가장 좋은 수.",4,국립고궁박물관,대만 국립 고궁 박물관
HappyDragon0201,이제 박물관 내부 사진 촬영 도,"박물관 내부는 에어컨이 있었습니다. 천 가지의 입에서 박물관을 것을 추천 한다. 이제 사진을 촬영할 수 있는 museum. 하지만 메인 보물을 "" 삼겹살 돌 "" 을 할 수 있는 걸러 진 다른 전시 를 볼 것이다.",3,국립고궁박물관,대만 국립 고궁 박물관
gabbycpr,가치 방문 이었지만 아주 나쁜 날씨.,"가족과 함께 방문 하여 그곳이 떄문이었고, 사촌 들. 저희가 바로 있습니다. 고등학교 igansus 역. 지금까지 우리는 택시를 타고 가는 꽤 비쌌지만 버스. 여행할 때는 국립 박물관, 정말 많은 비가 내리는 것. 좋은 것은 우리가 가져가는 비 재킷 의 우산 처럼 얻을 수 없습니다! 그는 아픈. 어쨌든, 이 아름다운 건축물 의 아주 거대한 국립 박물관. 엄마가 한 이야기를 하고 카운터에 여직원. 그 때문에, 직원들의 경우에는 노인 에게 접근 방식을 길을 잃 었어요. 저는 싫다고. 알고 있고?",4,국립고궁박물관,대만 국립 고궁 박물관
profc,"예, 할 수 있는 제이드 가 양배추!","저는 이 박물관을 방문해 하기에 정말 비오는 날 - 수 있습니다, 하지만 우리 두 사람들 후기를 읽고 조금 걱정이 사이트. 그는 관심을 둘 필요가 없습니다. 예, 여기에 발생하는 건지, 움직일 수 있지만 대개 몇 분 후. 따라 로컬 소스, 이후에는 50% 로 작년 중국 관광 (대통령 선거 때문에 중국의 누구도 있다고 pro - 사용 가능). 제가 이 흐름을 향상 시 박물관들. 또한 유명한 제이드 양배추, 어떤 박물관의 기념품 가게에서 거의 모든 기능을 knickknack 상상, npm 이",4,국립고궁박물관,대만 국립 고궁 박물관
David B,꼭 봐야 하는,"루브르 박물관 이 아닌, 볼 수 있지만 중국 구축 전시되어 있었어요. 건물 자체 에서 온 여러 보물 콜만큼 임페리얼 팰리스.",5,국립고궁박물관,대만 국립 고궁 박물관
Angela C,관광객들에게 좋은 정보 배우고 싶은 중국 문화,매우 감동적인 유물 이다. 좋은 정보에 항상 자동 규칙이 해당 업소 미술관.,5,국립고궁박물관,대만 국립 고궁 박물관
cteavin,"할 수 있는 루브르 박물관 은, 이것을 모두 표시하지 않습니다.","나는 그곳에 아는 이 세상에서 가장 큰 박물관 에 유물은 중국 nethrcutt. 그의 생각에 표시; 대신에, 회전 내내 작품 전시 뿐 nethrcutt. 여행하는 동안, 하나의 제이드 에서 만든 도자기 전시회 및 변경다른 방법에 초점을 맞춘 craftworks. 박물관에 가면 일 년에 몇 번이나 두 번이나 같은 것은 보지 못했지만 수 밖에 한 번 와서 내비게이션, 복불복 얻을 수 있습니다. 아, 그리고 박물관 정원 에 구성된 진부한 설정 및 유사 바위 (디즈니 랜드를 생각한다). 올",3,국립고궁박물관,대만 국립 고궁 박물관
CrystinePolk,"흥미로운 또한 뜨거운, 비오는 날은 좋은 곳에 가서","도착했을 때는 비가 내리지 었어요. 나는 적이 있지만 두 번 즐길 수 있었다. 이는 좋은 방법을 생각해, 그는 토요일 밤 학교 다음 작업을 수행할 수 있습니다. 우리는 이곳에서 콘서트 하는데 직원들이 아주 좋은 호른 섹션. 그들은 그 에 대해 익숙하기 때문에 많은 미국.",4,국립고궁박물관,대만 국립 고궁 박물관
frank b,큰 전시,예술에 관심이 있다면 중국 에는 중국의 모든 보물 보다 더 나은 곳으로 여기에 있다. 지금은 2 년 전 문을 연 티아보 시티 남쪽 지점에 있는 가치 있는 시간,5,국립고궁박물관,대만 국립 고궁 박물관
Marshall E,훌륭한 컬렉션,"이 저장소에 있는 문화 중국 문화와 예술 이 아니더라도 육지에 다행히 면하 했다. 물론 이는 낭비되는 것에 나 같은 초보, 경험 할 수 있지만 저는 감사합니다.",5,국립고궁박물관,대만 국립 고궁 박물관
Alexander P,인상적인,가장 인상적인 컬렉션 의 박물관 이 집 중국 예술 (양배추 하는 제이드 가입 하는 데 감탄! ). 붐비는 얻을 수,5,국립고궁박물관,대만 국립 고궁 박물관
DRDawson,방문할 가치가 있다,"프랑스 루브르 박물관 은 대만 이 란. 이 아름다운 복잡한 주택 대부분 중식 (유물, 문서 및 아트) 보물 이 되어 1940에 년대의 섬 으로 전송됩니다. 이제 또 다시 중국과 대만 간 충돌 및 중국 이 원하는 모든. 어른들이 학생 티켓 비용 및 nt $150 nt $250 (유효한 id가 필요합니다). 또한 박물관 앞에 멋진 정원 카운티까지 방문 할 수 있는. 한 사람 당 에 nt $20을 it 비용을 절감할 수 있습니다. 여기까지 오는 데, 역으로 지하철을 타고 갑니다. 304…",4,국립고궁박물관,대만 국립 고궁 박물관
britabroad34,편광,"부모님, 부모님과 저는 오늘. 저희 엄마는 다른 사람들이 한 박물관. 몇 몇 층 은 유물을 통해 쉽게 mrt 와 버스 정류장. 한 사람 당 $250 타이완 달러.",3,국립고궁박물관,대만 국립 고궁 박물관
sqweeling,아이들은 생각하지 않,"이 거대한 장소는 이미 세 주 전시. 나는 오디오 세트 내 아이와 나, 우리 둘 다 원하는 교육 세션 수 있습니다. 오디오 세트 너무 오랜 시간이 걸리고 입각한 정보, 상세한, 내 관심 에 장애가 발생하여 캡처할 수 있습니다. 필요로 하는 느낌이 있는 박물관 전시 를 위해 많은 사람들이 3 수준 채웁니다. 여행객들이 올 때. 정신이 없었고. 산책 하고 싶지 않을 사람들의 전시 및 밀기 및 동작들은 는 시작 되었다. 개인적으로 다시 방문해야 할까. 등록하는 투어. 오디오 세트 없이 이동하지",2,국립고궁박물관,대만 국립 고궁 박물관
GrantDSmith,좋은 사람일 수 있지만,저희가 간 공휴일이 어서 매우 바빠 긴 줄. 만약 과거의 역사와 같은 훌륭한 유적을 일부 이 참조해야 합니다.,4,국립고궁박물관,대만 국립 고궁 박물관
K S,역사와 같은 경우를 방문하기에 좋은 곳,만약 ' 수 ' 의 역사와 유물을 볼 수 있는 다른 아시아에 있는 여러 가지를 합니다. 좋은 교육을 열 였습니다.,5,국립고궁박물관,대만 국립 고궁 박물관
Christina H,친화적 인 관광,"건물이 꼭 사진을. 그 많은 기념품을 살만한 판매 (내 생각에 이 있기 때문에 매우 독특하고 대만. 전시회장 자체를 하나의 종료되지 않습니다. 이 박물관은 아주 친화적 인 관광, 오디오 가이드를 대여할 수도 프론트 데스크. 큰 가방을 가지고 없습니다 a 4 용지 크기보다. 가방을 사물함 영역 을 사용할 수 있지만. 내부 레스토랑도 있지만 가격이 비싸고 음식이 많지 않아요. 음식이, 갈 수 있는 shilin 야시장.",5,국립고궁박물관,대만 국립 고궁 박물관
JBTraveIIer,아름다운 정원과 감히!,"박물관 자체 가 매우 웅장 했는데 다른 바쁜 관광지 이 기 때문에 하지 않습니다. 솔직히 놀라운 건물들 이지만, 가장 인상적인 정원. 모두 투어는 하지 않았다, 이렇게 즐길 수 있는 정원을 둘러 보았다. 놀라운 야생 동물 이 있는 것이 주변의 정원. 를 적극 추천합니다!",5,국립고궁박물관,대만 국립 고궁 박물관
angelinecheah81,좋은 정원,"우리는 국제 박물관을 방문 할 일, 있어서 박물관의 입장료는 무료 옆에 있습니다! 우리는 가지 않았다 하지 않는 많은 시간 안에 박물관, 정원에 완벽한 곳이지만 사진을 었다.",4,국립고궁박물관,대만 국립 고궁 박물관
NewManDue,문화와 역사를 큰 다양성,"나는 이 놀라운 박물관 을 방문할 기회가 있고. 다양한 문화 및 문화 유산 박물관 이 매력적인 포함되어 있습니다. (캐나다) 할 수 있는 서양인이 디톡싱에 있는 새로운 형태의 나 다른 전시 로 예술 및 문화 유산. 이 아름다운 도자기 도, 가장 독특한 지역이지만 이곳의 경험 섹션을 참조하십시오. 전반적으로, 박물관을 방문할 가치가 있었습니다. 자신에게 반을 하루 이상 거칠고 사진을 박물관.",5,국립고궁박물관,대만 국립 고궁 박물관
sophws,해서 정신과 예술 - 여전히 좋은!,박물관은 괜찮았어요 - 해서 정신과 예술 (영어 번역 하다). 가장 좋았던 것은 섹션.,4,국립고궁박물관,대만 국립 고궁 박물관
Suz S,제가 원했던 … 하지만 확인,정말 제가 가장 보고싶다면 었어요. 이곳은 제가 원치 / 예상. 이곳에 있는 동안 은 확실히 보물. 나는 많은 유물을 멀리있는 것으로 생각하는 흘러나왔고 침대에는 중국 이전 충돌. 수 있었다. 하지만. 많은 종류의 상상이 나 하지 않나. 나는 서예 슈파 /. 이 지도에는 흥미로운 그러한 스크롤됩니다. 예 및 기타 귀중품 제이드 가 있지. 하지만. 내가 기대했던 것과 같은 방법은 4 시간 1.5 가집니다. 저는 말로 하지 않습니다. 하지만 큰 박물관이나 다른 기대 하지 않습니다. 시간을,3,국립고궁박물관,대만 국립 고궁 박물관
Jonas L,숨겨진 보물,"박물관에 있는 물건이 아주 많아 베이징의 자금성, 민족이 대만으로 그것을 때 떠났다. 가게에 가서, 비록 작은 조금 멀다. 중국 문화에 관심이 있다면 가 볼!",4,국립고궁박물관,대만 국립 고궁 박물관
ToBeOnTheRoad,"루브르 박물관의 아시아, 중국, 예술 은 지식","사람들의 문화와 역사에 관심이 있다면, 이 참조해야 합니다. 모든 연령대 에서 nethrcutt 최고 지. 진흙 병사들 이 아쉽 다는. 또한 현대적인 수집 정보 및 멀티미디어 전시회 가 아주 인상적. 아시아 예술 애호가 를 위해, 이 참조해야 합니다.",5,국립고궁박물관,대만 국립 고궁 박물관
binaratna,확실합니다,"여기에 새로운 경우에 정말 유물 수집, 탕 다이너스티 그림, 도자기, 많은, 모든 것이 좋은 유지 보수, 주변 공원을 거대한 아름다운, 말 그대로, 지루해 하지 않을 수 있게 이곳에서 하루.",5,국립고궁박물관,대만 국립 고궁 박물관
mathlawguy,"환상적인 박물관, 하지만 초만원","환상적인 작품이 있는 박물관 입니다. 그 의 강점. 저 반복: 예술 은 놀라운. 이 두가지 주요 약점은 다음과 같습니다. (1) 사람들이 잘 모르는 처리할 수 있습니다. 제가 갔을 때 (주중 아침, 버스를 이용할 수 있는 지 정말 여행객들이 전시 를 참조하십시오. 뭔가 더 효율적으로 처리할 수 가; (2) 평범한 오디오 가이드인 구입할 수 있습니다. 예, 그 기념 알려줍니다 선택이지만, 솔직히 말해서, 이 따분하고 건조하며 빗물에서 내레이션 입니다. 더 좋은 다른 박물관 입니다.",4,국립고궁박물관,대만 국립 고궁 박물관
analymous,최고입니다,"오후 9시까지 열 박물관 금요일, 토요일 및 일요일. 5 시 이후에 하고 싶다. 많은 사람들이 단체들이 있었기 때문이다. 많은 사람들이 전시장 즐길 수 있는 지. 박물관에 들어가기 전에, 당신의 지갑에 넣어 필요할 때, 배낭을 메고 물 가 있습니다. 물이 없는 수 (물도 한 병).",4,국립고궁박물관,대만 국립 고궁 박물관
Bao Long Pham,사람들은 사랑하기 좋은 중국의 역사,"수도 있었고, 버스 또는 택시로 갈 수 있습니다. 나는 버스 안 여행을 추천 한다. 박물관은 매우 큰. 세가지 중 하나는 지하에 있습니다. 박물관 전시 고대 가공물, 조각상, 그림입니다. 두가지 유형의 티켓. 티켓 가격은 250 $중 한 사람. 다른 곳은 더 비싼, 하지만 이 티켓, 볼 수 있는 휴대용 오디오 장비 - 설명서를 참조하십시오. 수 없습니다 카운티까지 짐 안으로 들어가, 캐비닛을 빌릴 수 있기 때문에 10 $을 계속 사용할 수 있습니다. 2 시간 동안 박물관 에 가서 합니다.",4,국립고궁박물관,대만 국립 고궁 박물관
laculturevulture,아름다운 유물,"큰, 종합 박물관. 전체 가 다양한 왕조 의 아름다운 보물. 우리는 여행 가이드 에 기록된 모든",5,국립고궁박물관,대만 국립 고궁 박물관
Ype D,하면 이,박물관은 꼭 가서 작은 그룹 및 최소 2 시간 은 가이드가 여기에 지출. 타이페이 를 방문해 보아야 할 때 천 년 된 청동 유물이 있는 공예 기술을 상상할 수 없는,5,국립고궁박물관,대만 국립 고궁 박물관
weisionggoh,매우 큰 전시 매우 상세한,큰 범위의 전시. 우리는 하루에. 직원들은 친절하고 도움이 되는 제 아이와 마차. 오디오 가이드 가 있는 매우 편리하고 유익한 정보. 임대 요금이 별도의 티켓 가격.,4,국립고궁박물관,대만 국립 고궁 박물관
_rbrake1,미술관,멋지게 기획 박물관! 뛰어난 전시. 좋은 선물 가게. 아름다운 정원. 본격적인 중국.,5,국립고궁박물관,대만 국립 고궁 박물관
Christine W,우수한,"볼 수 있고 아름다운 보물, 보석 처럼, 페인트 및 유물. 북경 수준보다. 정기적으로 이러한 항목을 변경할 수 있습니다.",5,국립고궁박물관,대만 국립 고궁 박물관
Harry C,하지 않을 수 있습니다,3 또는 4 또는 5 이상 꼭 계획 시간 이상 (또는 일 수 있습니다) 중에 3층 건물을 돌아다니는데.,5,국립고궁박물관,대만 국립 고궁 박물관
Krissey S,좋은,저희는 새해 의 하루가 무료! 항상 좋은 무료입니다. 볼 수 있는 많은 아름다운 유물. 아름다운 전망과 거대한 박물관 이! 좋은 사진.,5,국립고궁박물관,대만 국립 고궁 박물관
KarenBSF,꼭 봐야 하는,"치앙 카이 의 일반 시 - 중국은 장제스 가 급습 하는 사이트가 많은 유물을 가져 자금성과 대만 수 있습니다. 중국의 손실은 물론 대만. 하나의 박물관, 아닙니다 중국 예술 세계에서 nethrcutt. 박물관에 있는 좋은 일이 아직 표시하지 미술 작품 을 공개. 중국 왕조 의 도자기 는 여러 가지지 혁신적인 보실 수 있습니다. 저는 강력하게 추천할 수 있는 가이드를 통해. 너무 많은 것을 얻을 것이 더 많은 내용을 정확하게 왕조 및 변경다른 항목을 통해 중앙 시간. 타이베이에 있는",5,국립고궁박물관,대만 국립 고궁 박물관
Ian G,멋진,"국립 고궁 박물관 은 주로, 박물관 및 궁전 입니다. 이 시기의 서양인인 알리는 동안, 깊이 및 다양한 종류의 중국 문화. 여러 방문할만한 가치가 있다. 주요 투어 전에 없는 초기에 이동합니다. 함께 아름다운 정원에서 휴식을 취하기에 위치.",5,국립고궁박물관,대만 국립 고궁 박물관
Las Buganvillas,중국 최고의 디스플레이는 눈부신 예술,"(거의 30 년 후) 내에 두 번째 방문 이고 여기서, 은 을 통해 최고의 품질을 전시, 반드시 중국 예술을 사랑해. 하나는 로 설정하고 산 위에 있는 박물관에 현대적인 시설. 오디오 가이드 를 꼭 미로에서 길을 찾을 수 있는, 아주 유용한 시스템. 또한 외국인 가이드 가끔 언어, 일치하는 경우 문제가 발생할 수 있습니다. 이상하게도 한 박물관이 있고, 그들의 사진을 flash 사용되지 않을때 수, 예상치 못한 보너스 였는데! 도서관 이 책을 사본도 매우 잘 갖춰져 예술 작품, 엄청 비싼,",5,국립고궁박물관,대만 국립 고궁 박물관
Geerlings,고대 중국 예술품,"훌륭한 예술품. 절대적으로 아름다운 조각이 있는, 흔히 나 다른 듯. 흥미로운 방문.",4,국립고궁박물관,대만 국립 고궁 박물관
