user_id,title,content,rating,place_name,res_title
Keithfrs,그들이 말하지 않,"물론, 중국, 관광객들의 거대한 군중 들이 로비에 있는 두 개의 유명한 옥 을 밀치 음들 에 제공되지 않았다. 박물관 직원들은 폭력 적으로 무리를 하지 않지만 그의 요청에 따라 반복적으로 참을성. 할 수 있는 충분한 시간을 조각하기. 제가 원하는 어떤 것도 상상하지 않는다 하는 분이 절반 이상 아이템 들. 단순히 denpassar 여행 모든 항목에 대해 이 두 가지 중 하나가 택시 / 버스 정류장이 인근에 있다. 우리가 기다려야 하기에 20분 정도 볼 수 있도록 일요일 정오. 다른 예술을",3,국립고궁박물관,대만 국립 고궁 박물관
Lwilso,대만에서 꼭,"중국의 역사에 관심이 있다면, 문화 예술, 박물관 을 방문해 합니다. 철저한 전시, 가릴 수 있는 미적 매체를 이후의 선사. 박물관은 매우 혼잡 시간대를 얻을 수 있는, 그러나, 마음에 드는 정지 한 호텔과 투어 버스 입니다. (그리고 좋은 이유! ) 를 제공하여 주중, 3 시 이후, 사람들은 매우 효과적으로 피하려면 작업을 수행할 수 있습니다.",5,국립고궁박물관,대만 국립 고궁 박물관
geniejava,"주말, 12시 피할 수 있는 사람들이 주위에 이동","와우 정말 환상적인 박물관이 많은 국보 (forbidden 베이징, 중국, 도 많지 않습니다!) 역사적인 작품. 여러 가지 일을 할 수 있는. 나는 실수는 토요일 여름, 여행객이었고, 저도 참조할 수 없습니다 ""주요 특징"" 박물관, 제이드 가 새겨진 조각과 같은 이 두 가지를 맛있는 고기 한 조각, 양배추와 선명. 다행스럽게도 해 12시에 점심을 먹으러 가는 투어 그룹, 줄에 서서 한시간 정도 기다려서 할 수 있는 2개의 독특한 옥 을 볼 수 있지. 전반적으로 훌륭한 박물관이, 풍부한 역사에",5,국립고궁박물관,대만 국립 고궁 박물관
vfalstad,짧은 시간을 보내고 늦은 오후,"아, 이 곳이 최고의 방법이니 4:30 pm (할인 시간 이 모든 것을 시작). 충분한 시간이 되어 박물관이 닫히기 전에 거의 모든 볼 수 있습니다. 저는 양배추 를 볼 수 있는 유명한 - 저는 작은 것도. 환상적인 방향이 있는 게 익숙하 기간은 중국 고대 문화와 역사를 어떻게 일정 카운티까지.",4,국립고궁박물관,대만 국립 고궁 박물관
Dan H,보물 로 가득 찬 팰리스,"우리는 좋은 하루 반나절 을 돌아다니며 박물관. 나는 한 중국은 대만을 조각 해 보물 600,000 재라우팅된 chiang kai 장제스 보관하고 에서 마오 채식주의자. 목록에서 보물 들이 인상적이다. 또한 아름다운 야외 정원 보이, 주위에 걸어서 갈 수 있는 좋은. 우리는 위층에 있는 레스토랑에서 먹었다. 단단한 음식으로, 최고의 고객 서비스를 제공하지 않은 우리의 웨이트리스 빔광주사광학계는. 기념품 가게는 많은 아... 우리는 가족을 위해 구입한 항목 수입니다.",4,국립고궁박물관,대만 국립 고궁 박물관
yvn060,놀라운,이에 본 보물 합니다. 정말 놀라운 곳이에요. 많은 사람들이 무더기로 와서 중국 본토에서 이해할 수 있을 것으로 보고 그 를 훔친 보물. 기대한 것이 그리워 하지 않는다.,5,국립고궁박물관,대만 국립 고궁 박물관
Natacha R,완벽한 크기를 지닙니다 nethrcutt,"나는 박물관을 방문할 수 있지만 필요하지 않습니다 반높이 하루에 2 - 3시간 동안 깊이 커버사. 나는 예술에 대한 예술을 사랑하는 수 없이 최종 너무 소진 하고 박물관에 방문. 이 박물관 들어갈. 정확히 2 - 3시간 이었는데요. 전체 박물관을 보고 참을 수 있는 한 줄에 서서 유명한 양배추와 돼지 고기 / 베이컨이 기 때문에 너무 오래 제이드 제이드 선쌍의. 다른 전시 이었다. 좋은 정보와 아름다운 조각 정보 기록. 이곳은 특별한 소장품. 생각하는 아주 잘 하고 있는 박물관, 다양한 전시",5,국립고궁박물관,대만 국립 고궁 박물관
Ana A,"""할 가치가 있는 사람에게 정말 appreaciate 의 역사""",입장료는 250NTD. 너무 비싼 배낭여행객들이 나처럼. 일요일에 많은 사람들이 있기 때문에 이동하지 마십시오. 필요한 모든 것이라. 소변을 다.,2,국립고궁박물관,대만 국립 고궁 박물관
TorontoScarborough,좋은 생각만큼 좋지는 않지만,"제 남편과 저는 7월 국립 고궁 박물관에 갔었어요. 바쁜 시간이었지만 붐비지는 않았습니다. 배낭을 메고 전시장 에 물병이 허용되지 않았다. 체크인합니다. 오, 하지만, 되도록 작은 지갑 들. 그리고 유명한 전시, 예.. 제이드 양배추, 볼에 돌아다니는 다음과 축제같은 특정 경로를 표시하여 방문자 수 있습니다. 직원들은 가는 선으로 이동하도록, 플래시 라이트, 큰 소리로 이야기 하는 것은 아니다... 제이드 가 중국 유물을 좋아한다면, 볼 수 없는 실망시키지 않았습니다. 정원을 방문 잊지 말아.",4,국립고궁박물관,대만 국립 고궁 박물관
TravelLover911,서비스 태도 필요해,"한국 사람들이 아니라면, 금요일과 토요일 밤에 무료 입장 수 있는. 중국인들의 환경을 덜 즐거운 여행 하세요! 특히 여성의 태도에 다른 사람들에게 조용한 것도 좋지 않았다. 다른 여자들을 판 사람들에게 누르고 심지어 이야기 에 아주 큰 소리로 한 전화 번호. 버스 스케줄이 잘 shinlin 역 따르지 않습니다. 어서 와서 백업 계획을 내리막 이동 할 수, 버스를 타고 다른 역으로 또는 택시를.",3,국립고궁박물관,대만 국립 고궁 박물관
Del P,멋진!,"이는 지금까지 최고의 박물관에 방문한. 그럼에도 불구하고 사람들의 (사람 조정할 수 있도록 경로를 따라 간만의 관광 그룹), 가치가 있는 곳이다. 절대 하이라이트 박물관 아리마를 제이드 양배추, 정말 예술 였다! 똑같이 즐거운 근처 고기 모양 마노이. 나는 이 보물 제 국립 고궁 박물관!",5,국립고궁박물관,대만 국립 고궁 박물관
Travelexperience12,호텔은 크고 큰 잘 nethrcutt.,"저희가 방문한 이 박물관의 작은 그룹. 박물관은 매우 바쁜, 설명서 및 그룹 및 대화에 시스템 간에 매우 친절했고, 수많은 관광객 을 볼 수 있지만 배의 전시 에 있다. 그럼에도 불구하고 규모 및 범위의 박물관이 인상적인 디스플레이 품질. 박물관은 저녁 늦게 열고 일부, 그리고 추천할 후 17:00 근무 시간이 덜 들.",4,국립고궁박물관,대만 국립 고궁 박물관
Hongdemao,아시아 최고의 아트 컬렉션 중식 시간에도 - 더 베이징 - 저녁 늦게 가서 사람들은 생략!,"특히 저희가 방문한 대만 국립 고궁 박물관에서 예술을 중국 음들. 치앙 카이 장제스 세계대전 때 후 승천 의 중국 공산당 의 전원이 끊어졌다, 그는 보트가 많은 중국의 자금성 의 평면 및 대만. 물건 잘 보존 및 표시됩니다. 중국 본토에서 온 관광객들이 금광과 은광의 발견으로 많은, 밤 늦게 열어서 본 박물관. 우리는 소수 민족 의상 은 전시를 보는 늦은 오후에, 식당에 가서 맛있는 저녁 식사를 한 실크 및 팰리스, 다음 나머지 저녁에 본 박물관이 있고, 대부분의 경우는 투어 그룹 이었어요. 이",5,국립고궁박물관,대만 국립 고궁 박물관
Tina T,좋은 박물관,"우리는 자신을 즐길 수 있는 박물관. 특별한 박물관이 한 은 아주 좋았고, 특히 흑백 곰 제이드 조각. 좋은 푸드코트에서 점심을 먹었는데. 저는 아이들 만 있는 것은 가능하지만 갤러리 문을 닫았다는 것이라고 월요일 오후, 이 웹 사이트에 적힌 내 생각은.",5,국립고궁박물관,대만 국립 고궁 박물관
808Honeygirl,적어도 4시간 이지만 꼭 봐야 합니다.,"크기는 대만 여러단계! 이 곳의 궁전에 불어 나의 완전한 크기 및 영광. 다음에 가서 볼 수 천, 수 천 음들 예, 이 흥건하! 입장료가 아깝지 않을 최고의 선물가게도! 하지만 아주 유용한 아름다운 디자인의 유물 관련 항목을 추가할 수 있습니다. 하루 반나절 이상 걸리고 늦은 사람들이 지. 지 않고 할 수 있는 투어. 사용 후 버스에 mrt (지하철 버스 카드도 작동) 및 붐 이 없어요. 집에 돌아와 더욱 간편하게 사용할 수 없는 경우.",5,국립고궁박물관,대만 국립 고궁 박물관
nicole c,멋진 박물관에 가서 시간을,"국립 고궁 박물관에 가서 시간이었고, 큰 실수였습니다. 이곳은 거대한 그리고 아주 흥미로운 관광명소. 직원들은 친절하고, 투어를 이용할 수 있고 또는 자신의 속도에 직접 지정할 수 있습니다. 번역 장치도 제공하여 사운드를 빌려 준다. 이라고 생각해 봐야 할 명소. 주변에 먹을 곳이 많이 있기 때문에 열차 도 있다.",5,국립고궁박물관,대만 국립 고궁 박물관
hwood09,"훌륭한 박물관, 계획합니다.","여기보다 더 좋은 곳에 쉽게 갈 수 없는 일, 수천 년 동안의 중국 문화와 역사에 흠뻑 빠져. 박물관 건물 자체가 장관입니다. 도착했을 때 이 만나는 그랜드 패방, 아치형 통로 입구, 입구 쪽으로 길을 메인 홀. 하지만 가이드 투어 그룹이 많기 에. 저는 혼자 걸으며 전시. 박물관은 잘 되어 있고. 유물 컨텐츠 구성 (예.. 회화, 서예, 도자기, 옥, 등) 이러한 라벨 및 왕조 시대. 모든 전시 영어 번역 잘 쓰여진 설명 자료. 몇 시간 후에 그대로, 1% 만 알고 있는 놀라운 컬렉션은 항상",4,국립고궁박물관,대만 국립 고궁 박물관
Shin L,경우는 시간에 더 나은 대안적,국립 박물관 은 제한된 시간에 꼭 확인을 하지만 그 전에 꼭 봐야 하는 관광지 주변 이 상자의 틱 마크를 타이베이.,3,국립고궁박물관,대만 국립 고궁 박물관
Kel T,박물관을 놓칠 수 없는 경우 였어요!,"박물관은 선택할 수 있는 매력. 이 곳은 역사 수업에 참석하는 ""라이브"". 아마 필요할 수 있는 하루 투어를 갈 수 있는 아름다운 박물관. 16:30 이후 입력할 수 있는 관광지 할인 쿠폰. 그러나, 박물관 6 p.m. 닫힙니다.",4,국립고궁박물관,대만 국립 고궁 박물관
Keith E,중국 단체들은 불법적인 경우일 수 있,"중국의 경우 비용이 휴가를 피할 곳이다. 중국 단체 관광객들로 넘치고, 어떤 방법으로 해당 건물 전역에서 뱀, 스냅사진 큐잉된 아트웍의 selfies 표시되어 있습니다. 아이들을 닥치는대로 실행할 수 있습니다. 완전히 unenjoyable. 그럼에도 불구하고, 정원은 아름다운 다시 방문하지 않는 때 였던 것 같아요.",2,국립고궁박물관,대만 국립 고궁 박물관
Jason O,하루 여행... 다음 몇 가집니다...,"제목 그대로입니다. 하루를 보낼 때 여전히 예술 박물관이 박물관의 모든 보물을 하지 않습니다. 아름다운 작품들을 통해 중국 역사 박물관에는 모두 다. 나는 하루의 시간 9am 왼쪽에 오픈한 모든 것을 볼 때는 여전히 폐쇄 를 하지 않았다. 같은 박물관, 사진에 있는 선물가게를 살 수 있지만 죽음의 상징 이 있는 곳입니다. 박물관은 가봐서 인기가 있는 중국 본토에서 온 그룹 이다. 점이 박물관: 너무 많은 것을 보고 경험할 수 있습니다. 나쁜 측면: 너무 많은 것을 보고 경험할 수 있다. 투어",5,국립고궁박물관,대만 국립 고궁 박물관
SABA7,"정말이지 놀라운 박물관, 버스트 아시아 유물 …",국립 고궁 박물관 은 박물관 지구에 최고의 아시아 예술! 건물의 건축양식은 진정한 보석과 같은 곳이 광대 한 정보 및 역사적 제공합니다. 티켓이 비싸지 않다! 정말 나의 하루를 즐길 수 있는 국립 고궁 박물관.,4,국립고궁박물관,대만 국립 고궁 박물관
aronsulbiano,아름다운 풍경,"코트야드 바이 메리어트 는 이미 내부로 이동하지 않지만 방문할 가치가 있는 궁전. 타이베이에 위치한 위쪽에 있는 것, 또한 주변 전경을 향합니다.",5,국립고궁박물관,대만 국립 고궁 박물관
jasperweck,흥미로운 방문,"아름다운 컬렉션. 개인적으로 저는 별로 안 하고 역사적인 유적 의 도자기 등과 같은. 하지만 그럼에도 불구하고 그들은 어떤 특별한 일이다. 국립 역사 박물관 방문 작은 nethrcutt, 제가 할 수 있지만 더 많은 감사합니다.",3,국립고궁박물관,대만 국립 고궁 박물관
driftingsong,너무 혼잡,"좋은 건물이 서지, 다른 사람들 이지만 매우 혼잡 (또는 최소한 하는 여름! ) 과 같은 유명한 조각 더 복 쵸이 제이드 하는 좋은 경험을 사실상 불가능한.",4,국립고궁박물관,대만 국립 고궁 박물관
tadukhipa,크지는 않지만 볼 가치가 있습니다.,에도 불구하고 많은 유물이 있는 아주 크지 않기 때문에 그 중국 문화의 합니다 - 를 참조하십시오. 제가 갔을 때 가 있었지만 욕실은 내부에 있는 본토 중국인들의 사물을 하기 전에 실행되어 따뜻한 위로 를 보여 주었다. 일단 저도 약간 들어주는 있기 때문에 많은 관광객들이 한 그룹에 대해 주의를 지 었기 때문에 많은 것들이 있기 때문에 나는 그 를 볼 수 없습니다.,4,국립고궁박물관,대만 국립 고궁 박물관
Vivien Z,나는 정말 그것을 즐기지 않았다...,"저는 정말 이 저를 꼭 봐야 할 곳이 중국의 골동품 에 갔을 때였어요. 아 정말 정말 실망입니다. 여름 휴가중이었기 때문에 생각하지 않고 사용할 수 있는 전체 기나피. 박물관 자체 조직이 편집됨, 불구하고 좋은 (사람들이 시도 하세요) 그래도 즐거운 경험을 할 수 없었다. 가장 유명한 보물 (jade 양배추 등)을 30분 줄 잡을 때는 그냥 경험 이다 가기 전에 급하게 30초. 내가 방문하는 동안 많은 사람들이 함께 주말을 피하기 위해 6pm 이후 일정이었지만 포장은 수 없습니다. 제가",2,국립고궁박물관,대만 국립 고궁 박물관
lemonie604,용감한 사람들이 받을 준비를!,"우리는 투어를 하고 버스 하루. 이것을 보통의 경우, 입구 로비에 앉아 있지만 한 번에 할 수 있는 또 다른 투어 버스 티켓을 받고 입장 한 후, 다른 한 후에, 다른 한 후,... 오게. 매우 바쁜 날들을 볼 수가 있고 전시 가 특히 2 큰 사람. 우리가 한 경험이 있기에 제이드 양배추 에 들 사이의 거리에 다른 사람의 머리 로 이동 정보!",4,국립고궁박물관,대만 국립 고궁 박물관
KarenDaExplorer,양배추 에 옥 을 국립 고궁 박물관,"아름다운 건물들이 많은 유물. 꼭 봐야할 때였어요. 경옥 양배추 볼 수 있습니다. 이 사람이 ""중국 관광"" push 하지는 않게. 꽤 붐비는 시간에 가면 투어 버스에서 내려다. 즐길 수 있는 영어 번역 일부 음들.",4,국립고궁박물관,대만 국립 고궁 박물관
AlbertTjoeng,흥미로운,타이베이에 출장 및 자유 시간이 있었습니다. 이 박물관에는 흥미로운 - 문제의 몇 가져 주었다. 좀 더 흥미로운 유물 은 중국 이동됩니다. 이러한 손실될 수도 있지 않은 현 세대 단순수많은 일부.,3,국립고궁박물관,대만 국립 고궁 박물관
francesh86,꼭 봐야 하는 사람들이 역사에 관심!,"타이베이 여행의 하이라이트였습니다. 할 수 있는 너무나 많은 박물관을 하루 종일 걸어 다닐 수 있었다. 가기 어려운 작은 (mrt 역을 합니다, 버스 정류장 표지판을 따릅니다. 버스를 타고 10분 정도), 승인되어 있지만, 영어 및 버스 정류장. 그럼에도 불구하고, 이 가치가 있습니다. 경고를 하고 있는, 관광객들이 볼 수 있는 가이드 투어를 할 수 있는 주위를 어려울 수 있습니다. 그들은 내 조언을 하다, 방문 후 왼쪽 전시 (투어 가이드를 하지 않은 시간을 많이 보내는 곳에서 각 시간 제약",5,국립고궁박물관,대만 국립 고궁 박물관
Dan R,조금 실망,더 많은 리뷰를 읽고 기대했던 박물관이 라 아주 큰 매력. 이 기대한 만큼 크지는 않더군요. 이는 좋은 환경에서 좋은 건물이 있고 멋진 정원이 보여 박물관을 방문 할 수 도 무료. 필요한 경우 몇 가지를 사용할 수 없는 동전을 배낭에 가 있습니다. 조금 실망스럽게 지원하지만 모두 개인적인 취향 이 다 할 수 있습니다.,3,국립고궁박물관,대만 국립 고궁 박물관
Cedric T T,5000 년이 한 곳에,"꼭 이, 중국 문화와 역사에 관심이 있다면. 이 박물관에는 다른 어느 곳보다 더 중국 문화의 보물 전 세계. 하고 몇 시간이 모든 것을 흡수.",5,국립고궁박물관,대만 국립 고궁 박물관
Matthew B,"좋은 컬렉션, 수준 이하의 박물관","도시에 있는 한 여러 박물관들, 별 4개 박물관 이었죠. 이곳은 괜찮은 수집, 그리고 멋진 정원, 하지만 이 문제 야. 더 중요한 것은, 단지 사람들, 이 했습니다. 이것을 처리하는 데 작은 전시 의 객실 및 복도 금광과 은광의 발견으로 많은 막음쇠가. 아 저는 결국 포기.",4,국립고궁박물관,대만 국립 고궁 박물관
happychild3,그저 가볼만한 가치가 있어야 할,"훌륭한 컬렉션! 매우 매력적인! 그곳에서 하루 종일 시간을 보낼 수 있는. 중국인들이 했을 수 있습니다. 그 결과 일부 전시 에 있는 긴 줄. 우리가 하는 대부분의 사람들이 오후에는 보았지만 매우 바쁜. 가 될 것은 영어의 경우 많은 시간과 노력이 소요되는 일부 제품에 대한 설명. 몇 가지 기본 디스플레이를 제외한, 대부분이 그냥 중국어. 사랑이 있는 것이 더 읽기에 우리가 본 몇 가집니다. 저는 정말 자세히 알아보십시오. 아, 에어컨도 있어서 재킷을 가지고 있는 전체 폭발!",4,국립고궁박물관,대만 국립 고궁 박물관
HotspiceAustralia,타이페이 - 우수 합니다!,그리고 학생 또는 특별 항목이 TWD 250 TWD 150. 할 수 있는 오디오 가이드합니다 prebook. 또한 오전 10 오후 3 시 영어 가이드 투어 runnibg - 이 웹 사이트에 무료로 사용할 최소 3 일 미리 예약 합니다. 꼭 해 보는 것이 다. 솔직히 말해서. 저는 박물관에 감동 한 사람! 많은 사람들이 생각하지 않았다 싶을 때 사람이 너무 많지만 제이드 중국 양배추 를 제외하고 볼 수 있습니다. 긴 대기 열에는. 우리가 갈 때 가능하면 볼 에서 몇 피트 떨어져 있고. 2 시간,5,국립고궁박물관,대만 국립 고궁 박물관
hazinheira,"타이베이에 있는 것만 할 수 있다면, 이!","우리가 갔던 월요일 인데 아직 포장 그룹의 중국 관광객들. 그럼에도 불구하고 우리는 어느 정도 끝으로, 마감 시간에, 5pm 이후에 시작할 수 있는 그룹. 가격은 250 TWD 및 모든 가치가 있음. 주어진 시간만 프렉션 조각이 막제조에 전체 컬렉션, 믿을 수 있는. 3rd 바닥에 시작했는데, 여기서 가장 놀라운 조각 들 은 1층에 위치해. 1층에 있는 방에서 방향 설명 시간 중국 문화 - 첫 번째 시작하기 전에 다른 곳에 더 가기. 박물관 오디오 가이드 사용할 수 있으며 모두 정상적으로",5,국립고궁박물관,대만 국립 고궁 박물관
D C,최고의 중국 역사 박물관.,"세계에서 유일한 박물관 simpy 가 수천 년 중국 역사의 한 위치이다. 모든 유물 들 은 중국에서 먼저 공산주의자 했다. 그러나 20% 만을 항상 표시가 없기때문에 최소한 4 방문 진찌로 모든 있어야 합니다 그리고 제공 (일부가 표시되지 않습니다 음들). 가능하다면 반드시 봐야 할 역사, 특히 중국의 역사!",5,국립고궁박물관,대만 국립 고궁 박물관
Peter E,귀찮게 하지 않는 이유를 아는 것,이 컬렉션을 보니 중국 및 대만 금광과 은광의 발견으로 많은 관광객들이 매력적이다. 명확하게 한 버스들을 통해 입니다. 하지만 제 아내와 저는 손실됩니다. 그냥 방에 있는 방은 유물. 이것은 제가 생각하기 는 합니다. 저는 기대보다 훨씬 흥미로운 느낌이다. 아닙니다. 나는 잘 이해할 수 있게 희망 이고 매혹적인 역사 서술 유선망을. 아닙니다. 여행을 직접 저장할 수 있습니다. 그나저나. 저는 타이페이 일반. 그냥 다음에 몰려드는 고궁 박물관 하지 마세요.,1,국립고궁박물관,대만 국립 고궁 박물관
Sydneyguy,타이페이에 간다면 꼭 들려야 할 곳,"가장 인기 있는 관광지에 방문했어요. 풍부한 문화와 역사적 유물 과 함께. 오디오 가이드도 좋은 선택, 서로다른 언어를 사용할 수 있습니다. 제이드 의 놀라운 장인 정신이 매우 자세한 내용을 확인할 수 있습니다. 꼭 추천하는 곳에서 하루를 보내는.",5,국립고궁박물관,대만 국립 고궁 박물관
Julissa F,역사적인 가치가 있,할 가치가 있는 경험. 그들은 좋은 선물 가게. 내가 여기서 돈을 선물 대신 공항. 이곳은 관광객들을 준비!,5,국립고궁박물관,대만 국립 고궁 박물관
Franz S,"많은 물건, 많은 중복!","이 곳은 유물 수가 말도 안돼, 대부분의 것들이 서로 매우 유사하지만. 그럼 몇 가지 어서 아름다운 라인이 있는 박물관을 보고!",4,국립고궁박물관,대만 국립 고궁 박물관
salamala,"중국 예술의 위대한 선택, 하지만...","훌륭한 중국 예술, 중국 도 없는 를 참조하십시오. 문제는 이와 함께 방문하는 관광객들이 붐비는 중국 본토 같 ""너무"" 하지만 수집합니다. 이곳은 방문할 가치가 있는, 나는 돌아가지 않지만, 이것은 사실 다른 세계의 박물관.",3,국립고궁박물관,대만 국립 고궁 박물관
k l,제이드 와 역사.,우리는 이곳에 있는 친구. 멋진 경험이었습니다. 저는 제이드 에 대해 많은 것이 알고 있지 않았다. 멋진 전시. 매혹적인 역사가.,5,국립고궁박물관,대만 국립 고궁 박물관
Nathalie P,타이베이에 있는 가장 아름다운 박물관,"이 중 하나. 결국 가장 아름다운 컬렉션은 중국 미술 에서 찾을 수 있어요. 저는 2.5 시간 만에 실망 만 있다. 아름다운 예술, 특히 제이드 nethrcutt. 이곳은 타이베이 합니다. 놓칠 수 가, 특히 중국에서 중국 예술 사랑.",5,국립고궁박물관,대만 국립 고궁 박물관
Lloyd1986,매우 흥미로운,내부는 아주 흥미로운 곳이다. 이 처럼 크지만 생각할 가치가 있는 모양. 아름다운 정원을 걸어 다니며 휴식을 취할 수도 있다.,4,국립고궁박물관,대만 국립 고궁 박물관
Quack H,귀찮게 하지 않는 보물 그 제국 에 관심이,"이른 아침에 가는 사람들이 정말 다양한 단체. 긴 줄을 기다리고 있는 눈꼽 ""옥 양배추"" (대상에 대한 큐, 오히려 이 사진은 가이드 북에서 2nd 층 서점 에서 판매). 제가 생각하는 만큼 흥미로운 박물관.",3,국립고궁박물관,대만 국립 고궁 박물관
CECILLEsaysHELLO,타이베이의 보물 의 역사를 통해,"위치: 타이페이 시내에서 가까운 장제스 기념관. 꼭 보 모든 관광객 대상. 이 집의 과거의 보물을 모두 사용하여 풍부한 역사를 여러 나라 식민지 를 명확하게 - 아시아 & 웨스턴. 최신 구성 요소가 있는 문화를 거슬러 b.c. 이해, 어떤 사람들은 그들이 현재 수작업을 영향을 미치는 방법. 우리는 이곳에 있는 가이드 이었어요 감사합니다. 숙박 기간이 궁금 방법에 따라 달라집니다. 사진 허용 하 이상한 것을 볼 경우 메모리 저장할 수 있습니다. 이 곳에 방문하기 를 적극 추천합니다.",5,국립고궁박물관,대만 국립 고궁 박물관
NbTas,나누고 배양물,"박물관은 매우 크고 내부에는 놀라운 조각. 아마 어린 아이들은 최고의 장소, 아이들이 할 수 있는 갤러리 도 있겠지만 최고의 이러한 활성 3살. 정말 꼭 가봐야 할 수는 있을",5,국립고궁박물관,대만 국립 고궁 박물관
Ming Y,정말 좋았습니다.,"제가 놓친 비행기는 jfk 공항에서 연결이 박물관이 하기도 합니다. 저는 기분 좋게 놀랐어요 제 6, 8, 10 살 된 아이들도 즐길 수 있었다. 할 수 있는 다양한 전시 를 계속 사용하는 하루. 중국 관광객들로 붐볐습니다. 이른 아침 열리는 박물관을 추천합니다.",5,국립고궁박물관,대만 국립 고궁 박물관
