user_id,title,content,rating,place_name,res_title
Eduardo B,아름다운 모음!,이동해야 합니다... 타이페이... 검색할 수 있는 귀중한 forbiden 의 소리를 들을 수 있습니다. 하지만 그만한 가치가 있는 여행. 하지만 중국 사람들은 사람들이 알고 있는 것 같은 생각을! 아직... 사랑해요!,5,국립고궁박물관,대만 국립 고궁 박물관
Vy.O,괜찮은 곳이지만 사람도 많아요!,"두 번째는 여행은 국립 고궁 박물관, 박물관을 방문해서 오후에 2pm. 많은 사람들이 함께 코치 투어. 생각보다 쉬울 수 있지만 설정할 수 있는 것은 음성, 이 일을 할 수 있습니다! 슬프게도, 우리는 이 곳에 30분 정도의 시간을 보낼 수 있는 가능하다. 피크 기간 동안 방문할 수 있는 박물관이 있어 많은 사람들이 진",3,국립고궁박물관,대만 국립 고궁 박물관
Erik H,놀라운,이 곳은 정말 놀라운 많은 유물 전시되어 있다. 지금부터 당신이 것이다!). 을 보고 증거 의 1% 만 캐비티어셈블리. 유일한 문제가 없다는 것을 본 다음 경로를 사용할 수 있도록 이 가장 좋습니다. 하는 아쉬움이 아주 약간 일반 효차잎을.,4,국립고궁박물관,대만 국립 고궁 박물관
Edward H,"좋은 여행, 서둘러 느낌 이었지만","우리의 여행을 한 날, 비가 있는 이 쪽으로. 우리의 가이드, 펠릭스, 파라솔을 빌려 주었습니다. 하지만 직원들이 최상의 조건이 아닙니다 - 그들은 우리를 보호 비가 오. 많은 기회를 준 순교자 의 아름다운 자연을 즐길 수 있는 성지 건출술의. 그러나, 우리는 위병 교대식 을 보았다. 장제스 기념관 에 카이 창은 시간. 30분 1시간 정도 걸리지만 쳇발 근처에서 왕궁 박물관. 제 생각에 우리는 시간 쇼핑한 수공예 상점 -- 투어 가이드는 우리 자신의 잘못이 아니지만 관심. 미리 알림 수 있지만",3,국립고궁박물관,대만 국립 고궁 박물관
Calvin W,좋은 아키텍처,"외부 사진 좋은 곳, 가 아주 평화로운 정원입니다. 안에 있는 박물관은 오래된 유적.",5,국립고궁박물관,대만 국립 고궁 박물관
marshatraveller,멋진 건물,"여기에 있는 많이 보고, 아 사람들이 아주 많지만 - 아침 일찍 방문할 수 있다. 또한 매력적이면서도 섬세하게 설계된 건물과 정원.",4,국립고궁박물관,대만 국립 고궁 박물관
Daeng D,많지 않은 것을 나에게 ื,"나는 흥분 하지 않은, 제가 본 것을 안 걸었다. 같은 느낌이 없습니다. 중국 역사에 관심을 지녔지만, 하늘이 될 때, 저는 아니지만.",2,국립고궁박물관,대만 국립 고궁 박물관
Volker K,매우 흥미로운 박물관은 역사를,"시간이 있다면 당신은 실망할 수 있도록하는 notbe. 그러나, 꼭 하루 반나절 이상의, 더 나은 하루가 많아서 격다. 좋은 설명이 전시, 또한 틀어치기. 만약 당신이 훨씬 더 유익한 오디오 가이드. 많은 사람들이 자신을 준비하기 위한, 특히 중국 본토에서 온 가끔 아주 시끄러워서 전시장.",4,국립고궁박물관,대만 국립 고궁 박물관
Shawngohys,컬렉션은 기본 디스플레이 영역,"가는 고궁 박물관에 갔었어요. 사람들이나 보고해주세요. 모음의 제한합니다. 제이드 도 유명한 배추 나를 사용할 수 없습니다. 그래서 특별한 진흙 에서 방문하는 대다수의 수집 크사이 ' 수 있습니다. 수집된 수 년 동안의 어떤 호텔이 보여 친환경적, 테라코타. 흥미로운 전시 라고 하지만, 꼭 필요한 경우 별도 지불하고 진흙 을 선택한 다음 결제가 아니라 사이트 메인 박물관. 오히려 작은 수집 품 이 있는 다시 설정하고 볼,",3,국립고궁박물관,대만 국립 고궁 박물관
BigKahuna101,이것은 중국 역사 nethrcutt,"세상에서 가장 매혹적인 박물관 중 하나이다. 아마 이 호텔이 최고의 중국 미술품 컬렉션 중 하나로, 조각, 액세서리를 추구. 역사적으로 가는 10,000 bc 중간 20세기, 수 많은 귀중한 찾을거야 엠페로스, 스콜라 및 예술가. "" 기나발루에 ” 였어요.",5,국립고궁박물관,대만 국립 고궁 박물관
YummySum,정말 놀라운 컬렉션,"역사적인 보물 수거 다음과 축제같은 도자기, 옥 여러 왕조. 또한 종교적 inlcude 등의 조각상 경전. 나는 영어를 함께 이동 헤드폰 사용 설명서를 참조하십시오. 불행하게도, 이 가이드는 아주 작은 부분만 총 nethrcutt. 역사에 관심이 없는 사람, 이 괜찮습니다. 하지만 유명한 유명한 제이드 양배추 가 있었는데 이 전시되어 있다. 그래서인지 이 박물관에 가서 할 수 있습니다! 그래서, 제가 가기 전에 체크인. 불행하게도. 이 곳은 중국에서 나는 너무 많은 관광객, 저는 오히려 불안해",3,국립고궁박물관,대만 국립 고궁 박물관
Kathryn M,좋은 방문,"시간이 있다면 방문하는 것을 추천합니다. 그보다 큰 것은 예상되는 정말 멋진, 하지만 조금 아는 역사를 추천하고 있다.",4,국립고궁박물관,대만 국립 고궁 박물관
Mer21maid,"어두운, 춥고 지루한","미안 해요 좀 부정적인, 하지만 우리는 보고 싶은 국립 고궁 박물관; 하지만 저희는 실망☹. 아름다운 예술 이 있는 것, 잘 안 했는데, 가 본 정보 많이, 아주 희미한 조명이. 책에는 많은, 우리는 약간 지루한 찾을 수 없습니다. 또한 에어컨이 최대 조심하세요, 박물관 및 매우 춥다.",2,국립고궁박물관,대만 국립 고궁 박물관
Franciswon,중국 역대 박물관,"박물관은 고립 된 부분에 타이페이, 타이페이 시내 교통 에서 한 시간 반 정도. 지하철 노선이 잘 연결되어 버스에 연결되어 있지 않지만. 다양한 버스 노선 이었어요. 이곳은 저렴하고, 안전하고, 할 수 있는 아주 좋은 대개 자리를 볼 수 있습니다. 박물관이 라 늘 붐볐거든요. 이와 같이 가지 않기 때문에 단체 관광객들이 있어야 합니다. 일반적으로 사람들이 함께 할 수 있는 잠겨있었고 큐중. 점심 시간에 단체로 가서 사라집니다. 할 수 있는 좋은 레스토랑이 있는, 하지만 저렴한 가격, 음식.",4,국립고궁박물관,대만 국립 고궁 박물관
WeiYang C,작은 버전의 도시 fobbiden,"유명한 드로잉 입니다 (다른 사람에 의해 몇 가지) 이름: 강을 따라 칭 밍 축제 중. 너무 많은 이들이 여기 trasure. 저는 걸어 다니지. 기본적으로 모든 것이 작은 아이템. 해당 항목을 forbbiden 에 가지고 있지 못한 전쟁 중. 사람들에게 사랑을 하되, 도장, 보석 박물관에서 바랍니다. 하루 종일 볼 곳이 많다. 너무 많은 것을 얘기하는, 갈 수 있는 유일한 방법으로 볼 수 있습니다. 확실히 방문할 가치가 있습니다. 그런데 내부는 사진을 찍을 수 없습니다.",5,국립고궁박물관,대만 국립 고궁 박물관
Thom B,좋은 것을...,"관광객들에게 인기가 좋은 것을... 하지만 과다 실행되는 모든 중국인 단체, 흥미로운 경험을 할 수 있는. 좋은 전시, 하지만 초기에 이동합니다.",3,국립고궁박물관,대만 국립 고궁 박물관
Urns388,좋은 문화를 좋아하는 분들,"이 좋은 여름 날 방문한 배제 sun, 중국 역사에서 빠진. 이 두가지 라 한 전시회 가 있는 대규모의 단체 들을 중지할 기준. 한가지 팁은 말로 들릴 것일 - 반대 방향으로 이동합니다. 또한, 배낭 사용할 수 없음, 여성의 핸드백 을 가지고 있지만 무료. 이유는 모르. 이 기괴한 작은.",4,국립고궁박물관,대만 국립 고궁 박물관
David B,초기 이동,"좀 더 빨리 갈 수 있는 많은 것을 보고 큰 투어 그룹이 훨씬 더 평화로운 없이. 카페는 보통 할 점퍼 ac 동결됩니다. 다시 돌아가 볼 수 있는 특별한 전시 가 별도의 건물에서. 수 있지만 오디오 가이드를 기본 영어 오디오 가이드 없이 전시 낙심 특별전. 그 사소한 문제에도 불구하고, 멋진 전시.",4,국립고궁박물관,대만 국립 고궁 박물관
AimPS,놀라운 박물관,대만 아시아의 역사 로 좋은 곳이다. 우리는 4 시간에 걸쳐 전시를 보고 모든 객실. 타이페이를 방문했을 때 적극 추천합니다.,5,국립고궁박물관,대만 국립 고궁 박물관
Ben L,관광객들은 어디서나. 확인을 수집,"나는 할 말이 없는 경우 극다적인 역사, 가야 합니다. 매우 광범위한 컬렉션입니다. 아니, 좀 많이 너무 개성이 었습니다. 주는 것은 매우 좋음, 관광객들이 유치 지원하지만 양은 미친. 이 시간 동안에 한 가지 중 하나. 중국 본토 의 대다수는 악명 높지 단체. 나는 더 힘들고 감상할 수 있기 때문에 상수시 발생하는 소리를 지르고 밀치 답변하기 표시됩니다.",3,국립고궁박물관,대만 국립 고궁 박물관
Angela_kyz,역사를 위한 훌륭한 장소,"사원의 역사를 알고, 중국 및 대만. 좋은 교육 장소인 가족의 아이들!",5,국립고궁박물관,대만 국립 고궁 박물관
Alan J,이 박물관은 놓치지 마세요,나는 강력하게 추천하는 가이드 투어 박물관. 우리가 경험할 때보다 훨씬 더 가치 있는 박물관을 방문해 혼자.,5,국립고궁박물관,대만 국립 고궁 박물관
misstumbler,"아름다운 장소, 기념품을 선택할 수 있을 뿐만 아니라","저는 지난 3 npm. 여러 건물이 하나 착체. 박물관을 방문할 때 가장 큰 하나이기 때문에 바로 위치. 다른 건물들은 관리 부서에 레스토랑과 같은 것이, 이것을 확인하기 때문에 방문객들이 금지되어 있습니다. 첫 번째 웹 사이트의 어떤 전시 확인할 수 있는. 기념품 가게가 1층에 있습니다. 흥미로운 것들을 구매하여 보라. 할 수 있는 독특한 마스코트, 양배추 는. 잊지 말고 마지막 버스 예약. 마지막 버스를 놓치면 때문에 한 번, 이 좀 어려운 겁니다. 마지막으로 저는 이 경우 잘못된 공용 버스",5,국립고궁박물관,대만 국립 고궁 박물관
victoriahhsu,세계에서 가장 아름다운 박물관,"중국의 역사가 잘 보존되어 그들의 아름다운 기획 전시회 이다. 또한 많은 수의 보물을 찾아 집 층 박물관 숍, 가보세요!",5,국립고궁박물관,대만 국립 고궁 박물관
MMXBN,유익한 & 재미있는,많은 흥미로운 물건을 얻을 수 있지만 이 어서 매우 혼잡 하는 약간의 전시회를 방문하는 모든 먹어봐야겠단. 또한 오디오 / 가이드 투어를 이용할 수 있습니다.,3,국립고궁박물관,대만 국립 고궁 박물관
Harriet E,대만의 보물,이 기나발루에 를 방문 taiwai. 가장 놀라운 컬렉션 박물관의 보물 제거된 후 중국에서 중국 공산당 의 인수. 3개 이상의 시간이 필요할 정도였어요. 가기 전에 아침 일찍 사람들. 아쉽게도 사진이 제한이 책이 우리의 기억이 허용되지만 최고의 관광지 중 하나의 인터넷 사진에서 진정한 동남 아시아.,5,국립고궁박물관,대만 국립 고궁 박물관
InYu,사랑스러운 곳이나,"이번이 두 번째 방문 (마지막에 거의 10년 전에) 박물관이 라 기분이 편집됨, 불구하고 관광객들이 이 축제에 전시 한 사람들. 주위에 도착 했을 때에는 9am 에서는 특별 전시홀 을 지원하는 2 테라코타 전사 (참고: 에서 실행되는 2016년 5월 7일 - 2016년 8월 31일, 티켓 가격은 한 사람당 NT280). 전시를 기획 하고 대부분의 단체 여행 일정 표시되지 않습니다 (독출: 이곳은 조용한 수, 운에 따라). 가본 적이 없으면 계속할 가치가 있는 메인 전시장 이 박물관을 방문",5,국립고궁박물관,대만 국립 고궁 박물관
Derek S,바쁜 오후,"오후에 가서, 조금 혼란 이었어요. 큰 큐 에는, 항상 좋은 흐름이 있기 때문에 큰 문제가 있는 단체 관광객들.",3,국립고궁박물관,대만 국립 고궁 박물관
Wef,흥미로운,영어 설명은 흥미로운 역사 유물 을 보면 중화할 수 있는 좋은 곳이 몇 시간 동안.,4,국립고궁박물관,대만 국립 고궁 박물관
Bander AL ALI,답변하기 쇠격자,세계에서 유명한 그림 들이 있을 수 있는 중국 왕조. 찾을 수 있는 환상적인 경험에 익은 매우 긴 세라믹 작품 도자기 전쟁 페인팅 되었다. 이 하루 안 합니다. 할 때 갈 수 있는 정원에서 산책을 한 후에 다음 생선을 먹여.,4,국립고궁박물관,대만 국립 고궁 박물관
Alma R,광범위한 컬렉션,"나의 첫 번째 팁이 편한 신발을 착용. 사용하지 않는 한 택시 서비스를 사용할 수 있는, 및/또는 mrt와 버스를 타고 가장 먼저 합니다. 4층에 있는. 지하에 있는 버스 정류장에서 내릴 수 있는. 또한 이 티켓을 사거나 NT $250 의 입장 이고. 배낭, 음식/음료 와 카메라 사용할 수 없습니다. 사용 가능한 사물함 에 대해 NT $10. 무료 영어 가이드 투어를 제외하고 중국 사용할 수 있습니다. 오디오 가이드 및 다양한 언어 사용 가능한 추가 NT $200 사용할 수 있습니다. 제이드",5,국립고궁박물관,대만 국립 고궁 박물관
chougron,흥미로운 박물관,"멋진 작품들이 많은 흥미로운 박물관은 중국 역사. 현재 특별한 전시 의 ""강을 따라 청명 축제 중"" 라는 멋진 그림. 시간을 준비 하다 보면. 우리는 피곤한 다리 들을 가진, 하지만 행복한 방문!",4,국립고궁박물관,대만 국립 고궁 박물관
Miumiu88,단체들과,제가 이 호텔에 박물관 들을 mobs 및 투어 그룹이 mobs. 그 열정과 관심이 감소한 표시된 항목은 대부분의 시간을 사람들입니다. 질 좋은 흐름 제어할 수 있지만 더 좋은 전시회. 몇 시간을 설정할 수 있습니다 독점 하는 박물관 외에 나머지 시간들을 즐길 수 있는 개별 안심하고 업무에 집중할 수 있습니다.,3,국립고궁박물관,대만 국립 고궁 박물관
Joycelin W,인상적인 컬렉션,"의 거대한 박물관이 있어, 환상적인 전시 에서 수집한 다양한 호텔이었어요. 을 얻을 수 있지만 이 경우 계속 반복한 후에 박물관 들을 보면서. 몇 시간을 보낼 수 있는 준비가 좋은 시간. 박물관 내부 사진을 허용, 로커에 짐을 맡겨 두기 때문. 멀티미디어 가이드 (200twd) 을 추천합니다 - 아이폰 과 함께 한 헤드폰 - 설명을 들을 수 있는 전시. 더 나은 이해를 전시!",4,국립고궁박물관,대만 국립 고궁 박물관
peter s,아름다운,얼마나 아름다운 감동 의 현장 은 특히 오래된 문명의 아키텍처 설계. 있는 사진 이었다. 코이 연못을 방문 하다. 우리가 갔을 때는 사람 이지만 나를 생각 하지 않았지만 계획이 하지 않는 박물관 투어. 기 때문에 소음은 어느 다른 리뷰에서 언급한 그룹.,4,국립고궁박물관,대만 국립 고궁 박물관
Brian B,가장 과대 선전 한 박물관,"할 수 있는 정도의 크기를 생각한다. 미국 역사 박물관은 아시아 예술 및 문학. 꽤 멀리 떨어진 곳에 너무 많이 붐비지 않고. 나는 건물과 정원이 더 좋은 것을. 하여, 입장 후 150ntd 430pm 하는, 시간이 더 중요하지만.",2,국립고궁박물관,대만 국립 고궁 박물관
luckysojourner7,훌륭한 박물관,"저는 여기에 제이드 nethrcutt. 저는 한 유명한 주요 여행지에서, 좋은 보았지만 제이드 중국 역사에서 개발. 그는 또 다른 마음에 드는 그림 들이 올라 친환경적, 밍 섹션을 참조하십시오. 저는 시간에 이 모든 인간의 상세정보 - 정말 아름다웠어요. 나는 궁금해 하는 경우가 그림의 영감 qmsh 왈도? :) 그냥 농담. 앤티크 가구도 생각보다 제한 구역, 기억하고 있나 보다. 글쎄요. 위에서 설명하는 작업과 선보이는 조각 박물관, 할 수 있는 것 같고 내 자신의 속도 불구하고 사람들은",5,국립고궁박물관,대만 국립 고궁 박물관
bee_hapee,화려한 아키텍처 및 교육에 흥미로운,우리가 약 2.5 시간 보기를 표시하지 않은 건물로 마무리를 하기에 시간도 화려한 아키텍처. 어린 아이가 있긴 하지만 좀.,5,국립고궁박물관,대만 국립 고궁 박물관
Kinko_12,훌륭한 박물관 - 매우 교육적 으로,"나는 이틀 전에 이 박물관 - 세번째 방문이 었습니다. 실망스러운 전시하지, 나는 모든 항목들이 소유하고 있는 박물관입니다. 예술과 공예품을 보는 것 - 이에 대해 중국의 역사, 문화, 등이 있습니다. 그들은 이제 중부 지역이 타이완 의 박물관에서 브랜치 (연 2015). 제 친구가 아주 좋아하는 (그녀를 처음 방문하는) 중국의 일부 항목 제이드 간 양배추, 지점에 해! 우리의 가이드를 통해 갈 수 있는 대만의 박물관에서 가장 유명한 전시 3rd floor 의 시작을 찾을 수 있습니다. 저희는",5,국립고궁박물관,대만 국립 고궁 박물관
Salvo,환상적인 박물관,큰 박물관은 중국 지역의 많은 다른 조각 몇 시간. 제가 말하고 싶지 않지만 전문 박물관 (2 시간)을 찾을 수 있기 때문이다. 정말 아름다울 정도로 제이드 예술 공예품 은 확실히 흥미로운 부분,4,국립고궁박물관,대만 국립 고궁 박물관
Hizonfire,흥미로운 사람들이 아주 많지만,"보물 박물관은 중국 제국의 일, 제 1 왕조 의 마지막 황제. 장제스 는 말을 피하기 위해 손으로 떨어지고 몰래 가지고 여기 표시된 귀중한 아마도 의해 공산주의자 제거됩니다. 그 이유 중 하나는 본토 중국인 관광객 대상, 인기 있는 전시를 떠밀 어서 준비에 페인트 및 제이드 같은 다리 nethrcutt. 에서 도자 전시, bronzeware, 회화, 서예, 조각 및 다른 옥 공예. 영어 번역이 있을 경우 대부분의 전자 가이드 추천 의 박물관. 여기에 점점 쉽 변경다른 타이페이 관광 명소는",4,국립고궁박물관,대만 국립 고궁 박물관
Geoff C,많이 보고,너무 많은 중국의 역사적인 보물을 찾을 수 없는 다른 세계에서 전시되어 있다. 항상 많은 관광객들이. 아주 이른 아침에 오시는 방문 또는 오후 늦게.,5,국립고궁박물관,대만 국립 고궁 박물관
Dennison Uy,좋은 곳을 볼 수 있지만,"8 가지의 객실은 전체의 박물관에 전시된 사진들. 나는 더 이상이 있다면, 나는 영어에 있어 지루해 하는 투쟁 때문이다. 박물관은 ""국가"" 에 실망할 수 있는 것.",3,국립고궁박물관,대만 국립 고궁 박물관
Gen O,국립 고궁 박물관,건물 주변은 아름다웠습니다. 박물관 자체는 흥미롭지만 사용할 수 있는 몇 몇은 유물 들이 와서.,4,국립고궁박물관,대만 국립 고궁 박물관
Chloe T,또한 제어능 250NT,"나는 지하철을 타고 갑니다 역에 있는 다른 버스는 국립 고궁 박물관. 주위에 도착하는 날 아침 8am 정규 퀼팅머신용. 구입한 티켓에 있는 박물관에 들어가는 8:30 8:20. 저는 두 번째 줄. 저는 오디오 가이드를 하지 않는, 불만을 만들 수 있지만 저는 친절한 투어 가이드를 따라 다음에 대해 관심을 물에 그의 클라이언트 / 투어 포함. 나는 행복했습니다. 솔직히, 갈색의 붓질로 가득찬 w/ 멋진 박물관 유물 의 아름다운 역사 이야기 /. 하지만, 즉시 9:30 나쁘거나가... 할 수 있는",4,국립고궁박물관,대만 국립 고궁 박물관
Jean C,참조해야합니다,"너무 많은 것을 볼 수 있는 - 확실히 잘 형합된. 우리는 건물 중 하나여서, 나는 한 일이지만. 매력적인.",5,국립고궁박물관,대만 국립 고궁 박물관
Melanie O,나쁘지 않다.,"작은 모음, 지원하지만 품질은 좋음. 특별한 전시 가 환상적이었습니다. 나는 완전히 퍼늘의 이름과 사랑에 빠지지 었다 ""강을 따라 청명 축제 중"". 지금 방문 한다면, 한번 해보지!",4,국립고궁박물관,대만 국립 고궁 박물관
Fernlicht,놀라운 전시,"멋진 공연 의 중국 역사의 신 (新) 시대. 저희가 간 일요일 이 슈퍼 혼잡 도 아니다. 필요한 모든 것을 보는 3 - 4시간. 최소한 90분 을 통해 단순히 펜토서스. 을 가지고 스웨터, 에어컨은 추운 날씨.",5,국립고궁박물관,대만 국립 고궁 박물관
NeilJ-HongKong,정말 멋진 곳이지만 방문할 수 있 id 를 사용할 수 있도록 오디오 가이드...,이 놀라운 박물관 전시 에 따라서 몇 가져 볼 만하다. 해볼 때가 종종 있어서 이른 투어 그룹인 중국에서 열 수 있습니다. 오디오 투어가 매우 좋고 아이들이 있다면 좋은 곳이지만 그들을 즐겁게 하고 오디오 장비 id 등의 내용이 수록되어 있습니다.,4,국립고궁박물관,대만 국립 고궁 박물관
wiserwonders2016,역사적으로 중요한!,사람들을 피하기 위해 일찍 도착. 박물관 안에 있지만 사진을 찍어 외부 카메라 소지가 허용되지 않음. 셀프 가이드 투어 가이드를 사용할 수 있습니다. 훨씬 더 나은 게 방문. 타이페이에 가면 절대 참조해야 합니다.,5,국립고궁박물관,대만 국립 고궁 박물관
MayAllBeingsBeHappy,훌륭한 컬렉션,"이 박물관을, 중국 단체의 금광과 은광의 발견으로 많은 방지할 수 있습니다. 소름 끼치는 bindlestiff. 그들은 좋은 될 수도 있지만 아주 아주 아주 나쁜 아트 박물관의 금고에 감사. 지정된 시간 또는 일 수 있는 단체 여행 -- 그리고 특별한 본토 중국.",4,국립고궁박물관,대만 국립 고궁 박물관
pacpalisadian,기대했던 것보다,오후에 보냈습니다. 지식 도슨트 투어도 무료. 우수한 영어로 설명해 컬렉션. 정말 놀라울 정도로 안고 대상입니다.,5,국립고궁박물관,대만 국립 고궁 박물관
Simon L,이 점을 가장 격다,많은 곳임에도 불구하고 sighseeing 타이페이 (30 - 45minutes 내에서 드라이브) 의 문화와 역사를. 제가 제일 좋아하는 곳입니다. 거대한 왕궁! 이 놀라운 수의 모음. 내 카메라에 있는 모든 것을 할 수 있었으면 하는 경우 캡처를 있게 할 것. 모든 사람들에게 강력 추천합니다! 꼭 다시 올 것을 다시 수집,5,국립고궁박물관,대만 국립 고궁 박물관
joanneliu,방문해야합니다,"저는 타이베이 기차역에서 택시를 타고 있는 정보를 + nt230. 나는 수 많은 사람들이 아침에 피가 권합니다. 때문에 실망스러운 양배추 가 표시할 수 있는 지방 은 고기 흰색 도 없었어요. 하얀 배추 들었다 이제 표시 및 지방 고기는 샌프란시스코에서, 우리는. 다음에 여행을 가도 처럼 보였다. 그 외에는 정말 좋은 전시 볼 수 있습니다.",5,국립고궁박물관,대만 국립 고궁 박물관
David B,정교한 공예품과 미술품들이 전시되어 있는 역사적 유물,오디오 가이드가 되어 좋은 움직임 이다. 이 옵션 중 하나를 테마 투어를 이용할 수 있는 주요 박물관. 이 해줄 수 있는 가장 소중한 부분을 파악하지. 귀중한 역사 유물 이 많고 중국의 역사와 함께 제공되는 고유 정보. 마음에 드는 것은 제 개인적인 갤러리 삼아 '강을 따라 청명 축제 중' '위조' 하는 이 건물의 아주 유명한 오래된 페인팅 으로. 이 위조된 것도 다 자신의 문화 및 아키텍처 변경 사항에 표시할 수 있습니다. 세부는 아름다운 그림 들이 많이 많이 떨어져 있다. 이 그림들은,4,국립고궁박물관,대만 국립 고궁 박물관
Mon G,중국 관광객들에게 아주 인기가,"이 곳이 세계 최고의 박물관 아리마를 보물 은 중국의 광대 한 수집, 저희가 일요일에 완전한 숫자 들의 의해 압도 npm 중국인들에게. 중국 유물 컬렉션을 실망시키지. 3개 층을 청동, 도자기, 회화, 시간에도 여러 문서를 여러 왕조. 소음 아리마를 관광객들에게 좋은 경험이었고 퇴피 의 목소리로 계속할 수 없습니다. 박물관은 좋은 상점에 가서 살 수 있는 기념품 항목. 박물관 밖으로, 멋진 풍경을 배경으로 촬영 한 사진 할 수 있습니다.",4,국립고궁박물관,대만 국립 고궁 박물관
Donald W,국립 고궁 박물관,좋은 경험이었습니다. 제이드 초급 전시 및 철저하게 즐겼다. 입구에는 꽤 걸어야 하기 때문에 편안한 신발을 착용. 사진 또는 비디오를 보지 안을 최첨단 장비이기 때문에 신경쓰이지 않는다. 경제적인 방법을 사용할 수 있고 mtr과 택시를 타고 박물관.,4,국립고궁박물관,대만 국립 고궁 박물관
