u_id,review,u_rate,p_id,review_en
MOA S,1년 365일 복작복작한 광장시장이다. 시장이라서 조그맣고 허름한것을 생각하지만 다 리모델링 되어 있어서 꺠끗하다. 그리고 빈대떡이 너무 맛있다. 육회도 너무 맛있따. 또 가고 싶다!!,5,1404,"It is a square market that has been crowded 365 days a year. I think it's small and shabby because it's a market, but it's all remodeled, so it's clean. And mung bean pancake is so delicious. The yukhoe is so delicious. I want to go again!!"
펭귄뒷구르기,떡볶이 진짜 진짜 맛있어요. 어느집으로 가건 떡볶이가 환상입니다~ 아주 청결한 느낌은 들지 않지만 친구랑 놀러갈 때 꼭 먹습니다. 진짜 맛있고 구경거리 많아서 좋아요~!,5,1404,"Tteokbokki is really good. No matter where you go, tteokbokki is fantastic. It doesn't feel very clean, but I always eat it when I go out with my friends. It's really delicious and there are so many things to see~!"
kwjgirl,많은 먹거리와 볼거리... 먹을 거리 기념품을 사기에도 좋고 다양한 한국음식을 저렴하게 즐기기에도 너무 좋은 곳. 육회와 빈대떡을 배불리 먹었어도 뒤돌아서면 만나는 간식거리들의 유혹을 떨치기 힘든 곳이다.,5,1404,"Lots of food and things to see... It's a great place to buy souvenirs and enjoy various Korean foods cheaply. Even if you are full of yukhoe and mung bean pancake, you will not be able to resist the temptation of snacks you meet when you turn around."
QM11Q,안에 포장마차가 즐비함. 육회와 빈대떡이 특히 유명함. 활기 넘치는 재래시장을 체험할 수 있음,5,1404,There are carts of wagons inside. Especially famous for yukhoe and mung bean pancake. Experience a vibrant traditional market
MINHEE P,한국 재래시장의 모습을 그대로 담고 있는 광장시장입니다. 맛집이 많은 곳으로도 알려져있는데 실제로는 청결과 친절에서는 아직도 더 힘써야할 것 같습니다. 외국인 내국인 모두에게 사랑 받는 곳이긴 하지만...,3,1404,"Gwangjang Market is a traditional Korean market. It is also known as a place with a lot of good restaurants, but I think we should still work harder on cleanliness and kindness. It's a place loved by all foreign Koreans, but..."
아이언맨66,빈대떡이 있고 빈티지원피스가 있고 수수부꾸미가 있는 곳. 맛있는 거 먹고 쇼핑하면 딱 좋은 곳.,5,1404,"A place where there is mung bean pancake, binty support piece, and sorghum bukumi. A perfect place to eat delicious food and shop."
sung58,"밤마다 불야성을 이루는 먹거리 시장입니다. 빈대떡, 김밥, 떡볶이, 족발, 회 등등 먹을 게 엄청 많습니다.",4,1404,"It's a nightly food market. There are a lot of things to eat such as pancake, gimbap, tteokbokki, jokbal, sashimi, etc."
가빈짱,즉석에서 녹두를 갈아서 빈대떡 만들어주시고 마약김밥도 좋구 이것 저것 먹거리가 풍성하고 눈요깃거리도 많아서 좋아요..,5,1404,"On the spot, they grind mung beans and make mung bean pancakes. Drug kimbap is good, and I like it because there are a lot of food and eye dishes."
DragonT,"서울의 오래된 시장으로 각종 맛집들이 아주 많아요. 특히 마약김밥과 빈대떡이 유명합니다. 각종 잡화, 의류를 다양하게 많이 팔고 있으며 옛날 냄새가 물씬한 서울의 재래시장",3,1404,"It is an old market in Seoul, and there are many good restaurants. Especially, drug gimbap and mung bean pancake are famous. It sells a variety of miscellaneous goods and clothing, and it is a traditional market in Seoul that smells like old times."
tembourine,"서울 중심부인 종로구에 위치한 재래시장. 양쪽으로 늘어선 상점과, 그 사이에 즐비한 간이 음식점들. 녹두전에 막걸리도 좋고, 온갖 물건들 구경하는 것도 재미있습니다.",4,1404,"A traditional market located in Jongno-gu, central Seoul. A line of shops on both sides, and a host of snack bars in between. Makgeolli is good in mung bean pancake, and it is fun to see all kinds of things."
chunglang,"서울에 남아있는, 그래도 전통이 살아있는 시장중 하나. 의류나 잡화, 각종 먹거리를 저렴하게 구할 수 있다. 사람 사는 정은 덤으로^^",4,1404,"One of the markets that remains in Seoul, still has tradition. Clothing, miscellaneous goods, and various foods are available at a low price. I don't care about people anymore."
moonkyoung j,역시 진리네요^^ 팀버튼 감독이 와서 먹었다길래 저도 가봤는데 다들 친절하시고 카드 결제도 웃으면서 받아주셨어요~♡ 짱,5,1404,"As expected, it's true. Tim Burton came and ate it, so I went there, and everyone was kind and accepted my credit card payment with a smile.~♡ Jjang"
hyomin78,시장 내부가 굉장히 넓었음. 저녁에 빈대떡 먹으러 오는 사람들로 매우 북적였음. 만원 한장으로 3명이서 저녁식사가 가능했던 곳,5,1404,The market was very wide. It was very crowded with people coming to eat mung bean pancakes in the evening. A place where three people could have dinner with a full house.
유이717,"한복도 팔고 먹을거리도 많아서 빈대떡, 족발, 비빔밥, 마약김밥, 육회등 하루종일 먹으면서 돌아다녀도됨.",5,1404,"They sell Hanbok and there are many things to eat, so you can go around eating pancakes, jokbal, bibimbap, drug kimbap, yukhoe, etc. all day long."
밀키롤,어렷을때 엄마따라서 다녓던 시장길이 생각이 낫다 그안에서 호떡먹으며 따라다녓던 기억을 떠올리며.. 여기서는 육회를 먹엇다 참 맛잇엇다,5,1404,"When I was young, I thought the market path was better because of my mom. I remember eating hotteok in it. We ate yukhoe here. It was delicious."
DREAMING_dream,사람이 너무 붐비는 것을 좋아하지 않는 편인데 주말에는 사람이 너무 많아서 지나가기조차 불편하더군요. 음식도... 글쎄요. 방송에는 많이 나왔지만 그렇게 맛있는 음식들이라고는 생각되진 않습니다.,3,1404,"I don't like it when it's too crowded, but there are so many people on weekends that it's uncomfortable to even pass by. Food... well, it's been on air a lot, but I don't think it's that good."
시리우드,유명한 곳이라 하여 방문하여 보았지만 생각보다 평범하고 음식도 막걸리와 부침개류를 제외하고는 맛있다고 생각되지않았습니다. 특히 마약김밥이라고 파는 포장마차는 최악이었습니다.,3,1404,"I visited it because it was famous, but it was more common than I thought and I didn't think the food was delicious except for makgeolli and pancake. Especially, the cart bar, which is sold as a drug gimbap, was the worst."
봉기 문,"광장시장은 한 TV 프로그램에서 예능인들이 왔다 가 유명해졌다고 하지만 동대문 근처 전통시장으로 원래 명성이 있던 곳입니다. 최근에는 중국인들을 비롯한 외국인들의 발길도 잦아 그 유명세를 더 하고 있습니다.부침개와 닭한마리, 육회골목 등 특화된 메뉴로 시민들의 사랑을 받고 있지요.",5,1404,"Entertainers came to Gwangjang Market on a TV program. It is said that it became famous, but it was famous as a traditional market near Dongdaemun. Recently, many foreigners including Chinese have visited the country, making it more popular.It is loved by citizens for its specialized menus such as pancake, chicken, and yukhoe alley."
HyesungKim,"음식값이 싸지만, 어떤 집은 너무너무너무 맛이 없었어요. 식당 선택만 잘하면 싼가격에 맛있는 음식 먹을 수 있어요",3,1404,"The food is cheap, but some restaurants were very, very bad. If you choose a good restaurant, you can eat delicious food at a low price."
hjk8427_,이곳에 유명한 마약김밥이나 빈대떡등이 있어서 맛집투어하기 좋아요. 음식들도 맛있고 외국인들도 많이 찾는 명소입니다.,4,1404,"There are famous drug gimbap or pancake here, so it's good to tour famous restaurants. The food is delicious and it is a popular attraction for foreigners."
체리요정,"광장시장은 이미 맛있는게 많기로도 유명하죠? 마약김밥(마약은 들어있지 않습니다 ㅋ), 팔뚝만한 순대, 녹두빈대떡에 막걸리~~",5,1404,"Gwangjang Market is famous for its many delicious things already, right? There's no drugs in it. Soondae, mung bean pancake and makgeolli~~"
miyani0613,"만두, 육회, 빈대떡 등등 먹거리 가득한 광장시장.. 주차가 다소 불편한 점은 있지만 활기가 넘치는 시장이라 갈때마다 재밌네요.",4,1404,"Gwangjang Market is full of food such as dumpling, yukhoe, mung bean pancake, etc.. Parking is a bit inconvenient, but it's fun every time I go to the market because it's full of energy."
LOVESSU,없는게 없을정도로 시장구경하기 좋습니다. 근래에는 외국관광객들의 필수코스인지 많이들 눈에 띄더군요. 열심히 구경하다보며 주위 각종먹거리들이 허기진 배들 달래줍니다. 개인적으로는 파전에 막걸리 한잔하고 옆에있는 청계천을 소화도시킬겸 산책하는 코스도 나쁘지않을것 같네요. 이왕이면 초저녁무렵에 방문하는것을 추천합니다^^,5,1404,"It's so good to look around the market that there's nothing missing. Recently, it has been noticed that it is an essential course for foreign tourists. While looking around, various foods soothes hungry stomachs. Personally, I don't think it's a bad idea to take a walk to digest Cheonggyecheon Stream after having a glass of green onion pancake and rice wine. I recommend you to visit early in the evening.^^"
livia941,"시장은 사람구경하러 가는거죠~ 시장 중앙에 먹거리 골목(?)이 있어서 사람들 옥닥복닥하고 마약김밥 말고도 각종 전, 분식류, 족발, 막걸리집까지 먹거리 풍부해서 넘 좋아요.",4,1404,"The mayor's going to see people. There is a food alley (?) in the center of the market, and besides the drug gimbap, there are various kinds of pancakes, snacks, pigs' feet, and makgeolli restaurants."
진규 이,"동대문 지나 종로 5가에 오랜 시간 자리잡고 있는 광장시장은 언제부터인지 그 시장 전체가 맛집들의 집합장터가 되었다. 음식말고도 볼게 많고 파는 게 많은 시장인데, 이제는 으레 뭘 먹으러가는 시장이 되었다. 순희네 빈대떡 집은 재료도 좋은 걸 쓰지만 기름 듬뿍 부어 튀기듯 지지는 그 맛이 원래 고소한 녹두맛을 사방에 튀어 올린다. 외국사람들이 경찰에 신고 당할까봐 먹기를 꺼려한다는 마약 김밥은 마약은 안들어갔지만 정말 중독성있는 것은 맞고, 자꾸 생각난다. 먹고나서 도핑테스트에 걸리지는 않겠지만",4,1404,"Gwangjang Market, which has been located for a long time in Jongno 5-ga past Dongdaemun, has been a gathering place for good restaurants since some time ago. It is a market with many things to see and sell other than food, but now it is a market where people go to eat something. Soon-hee's pancake restaurant uses good ingredients, but the taste of the pancake, which is fried with plenty of oil, splashes the original savory taste of mung bean everywhere. The drug gimbap, which foreigners are reluctant to eat because they are afraid of being reported to the police, has no drugs in it, but it is really addictive, and I keep thinking about it. I'm not gonna get a doping test after I eat,"
hanw00ll,광장시장에서는 빈대떡과 육회를 먹어야한다. 그러기 위해.. 광장시장에 가는 것이 아닌가 싶다. 왁자지껄한 사람들 속에서 시시콜콜한 이야기를 나누다 보면 여기가 사람사는데구나 싶다.,5,1404,"You have to eat mung bean pancake and yukhoe at Gwangjang Market. To do that... I think we're going to Gwangjang Market. When we talk about small things among the noisy people, I realize that this is a place where people live."
호밀빵,"구제 시장으로, 그리고 마약 김밥과 육회 등으로 유명한 시장. 여느 유명한 시장들보다 좀더 특색이 강하다. 특히 먹거리에 있어서는, 칼국수, 분식, 김밥, 육회, 부침개 등등 먹고싶은 게 너무 많아서 뭘 먹어야 될지 늘 고민.",4,1404,"A market of relief and fame for its drug gimbap and yukhoe. It is more distinctive than any other famous market. Especially when it comes to food, there are so many things I want to eat, such as kalguksu, snack, kimbap, yukhoe, and pancake, so I'm always thinking about what to eat."
낸시,그 유명한 광장시장!! 전통시장의 면모를 보여주어 시간 가는줄 모르고 다녀보면 그야말로 빈대떡 김밥 순대 고기전 생선취김 그리고대구 생선 해물탕등 등 먹거리의 모든것이 손님들의 발걸음을 멈추게하여 모두 모두 모여 앉아 맛있고 재미 있는 시간을 보냅니다. 음식 먹는 사람들과 즉석에서 음식 만드는 사람의 표정과 모든 상점의 물건까지 구경하기 재미 있어요.,4,1404,"That famous plaza market!! If you go around without knowing the time passing by by showing the aspect of traditional markets, you will be able to sit down and enjoy the delicious and fun time as everything you eat, such as pancake, kimbap, sundae, meat pancake, fish-cold seaweed soup, codfish, seafood soup, etc., stops the customers from walking. It's fun to see the faces of food eaters, instant cookers, and even the items of every store."
Hyunsuk Kim,종로4가역에서 가까워 다니기 쉬웠습니다 여러가지 전통시장의 볼거리와 중앙거리에 빈대떡과 마약김밥등 먹거리가 많았습니다 다만 사람이 너무 많아 조금 이동이 힘들고 구경하기가 힘드네요,4,1404,It was easy to get around Jongro 4-ga Station. There were many things to see in various traditional markets and food such as pancake and drug kimbap on the central street. But there are so many people that it's hard to get around and see.
숏스탑,"먹거리가 아주 유명한 곳이지요. 특히 마약김밥, 전, 왕순대 요 3개가 에이스였습니다. 술한잔 하면서 담소나누기 좋은 옛날 느낌의 시장입니다.",5,1404,"It's a very famous place for food. Especially, these three were drug gimbap, jeon, and Wang Sundae. It's an old-fashioned market where you can have a drink and chat."
연쥬쥬,"빈대떡부터, 육회, 마약김밥, 잡채, 횟집, 호떡.. 등등 맛있는게 너무 많아서 배를 비우고 가야 많이 먹을 수 있음.",4,1404,"From mung bean pancake, yukhoe, drug gimbap, japchae, sashimi restaurant, hotteok... There are so many delicious things like that I have to empty my stomach to eat a lot."
dddaisy1,광장시장은 녹두전~ 마약김밥~ 육회까지 너무 맛난 여행이에요.. 거리가 좀 멀긴하지만 너무 저렴하고 맛있어서 가끔 찾는 곳이에요! 특히 육회!! 강츄에요~ 넘나 신선하고 저렴하고 맛있답니다.,5,1404,"Gwangjang Market is a delicious trip to Nokdujeon, Drug Gimbap, and Yukhoe. It's a bit far, but it's so cheap and delicious that I visit it sometimes! Especially yukhoe!! It's Gangchu~ It's so fresh, cheap, and delicious."
지혜 심,광장시장은 마약김밥이랑 녹두전 먹으러 자주 가는것같아요! 전집이 너무 맛있고~ 시장보는 재미도 쏠쏠합니다!,4,1404,I think I often go to Gwangjang Market to eat drug kimbap and mung bean pancake! The whole house is so delicious. It's fun to go to the market!
Jay cho,맛있는 마약김밥 빈대떡 시장의 먹거리를 경험하고 싶은 사람들에게 강추합니다. 관광객들도 많이 찾는 이곳 언제나 사람들이 북적북적 인근의 청계천과 연계하여 산책도 할 수 있는 곳입니다.,4,1404,"I strongly recommend it to those who want to experience the delicious food of the market. This place is visited by many tourists, and people can always take a walk in connection with Cheonggyecheon Stream near the bustling area."
123SDF,광장시장이 매스컴에 많이 나오면서 외국인들도 많아졌더라구요광장시장에 가시면 꼭 순대를 맛보시바래요 진짜 최고의 맛입니다. 떡볶이 빈대떡등 다양한 분식류도 많이 판매되고 있고 사람사는 냄새가 느껴지는 곳입니다.,3,1404,"As Gwangjang Market was on the media a lot, there were more foreigners.If you go to Gwangjang Market, you should try sundae. It's the best taste. Various kinds of snacks such as tteokbokki and mung bean pancake are also being sold, and people live in a place where they can smell the smell."
newkies,"여러가지 물건을 파는곳. 하지만 주로 먹거리를 위해 찾는곳. 광장시장은 녹두전과 칼국수, 육회가 유명함. 현지인들과 섞여서 녹두전에 막걸리 한잔~! 추천함.",4,1404,"a shop selling various goods But it's mostly a place to look for food. Gwangjang Market is famous for mung bean pancakes, kalguksu and yukhoe. Mix with the locals and have a glass of rice wine before mung bean pancake. Recommended."
여행가자구요,광장시장에 가서 빈대떡 하나와 막걸리 한잔 하면 아주 그만이죠 ㅎ 다만 옷에 그 기름냄새가 베겨서 한참 간다라는건 감수하셔야죠~,4,1404,A pancake and a glass of rice wine at Gwangjang Market would be great. But you have to endure the smell of oil on your clothes that lasts a long time.
ㄱㅎㄱㅎ,그냥 딱 길거리 음식 수준이예요. 엄청난 맛을 기대하고 가면 실망할 듯. 생각보다 비싸고 맛은 그저 그렇고. 한번 가본 걸로 만족.,3,1404,It's just like street food. You'll be disappointed if you expect a great taste. It's more expensive than I thought and the taste isn't as good. I'm satisfied that I've been there once.
sunnyje,물건을 사고파는 것보다 먹을거리로 더 유명한 시장입니다. 시설은 그다지 깨끗하지 않지만 다양한 재래시장 먹을거리를 즐기고 싶다면 가볼만 합니다.,4,1404,"It is a market that is more famous for food than buying and selling things. The facilities are not very clean, but it is worth visiting if you want to enjoy various traditional markets."
bjh3676,우선 먹거리가 풍부한 것이 장점. 개인적으로 순희네 빈대떡과 수수 부꾸미가 맛있었다. 마약김밥과 육회도 유명함. 하지만 워낙에 외국인들에게 유명한 명소이다 보니 밤만되면 사람이 너무많아 통행할 공간이 별로 없음. 깔끔한 것을 우선하는 분들에게는 먹는 것이 힘들 수도 있음.,5,1404,"First of all, it is good to have plenty of food. Personally, Soonhee's pancake and suusu bukumi were delicious. Drug gimbap and yukhoe are also famous. However, since it is a famous attraction for foreigners, there is not much space to pass through because there are too many people at night. It may be hard to eat for those who prefer neat things."
jay600,"동대문, 남대문 시장에 이어 다양한 먹거리, 볼거리가 있는 광장시장. 인사동을 구경하고 들를 수 있어 접근성이 좋음. 육회, 전 등이 유명함.",5,1404,"Gwangjang Market with a variety of food and attractions following Dongdaemun and Namdaemun markets. You can visit Insadong and visit Insadong, so it's accessible. Famous for yukhoe, jeon, etc."
lordauch,이곳은 여기저기 둘러보며 맛있는 군것질도 할수 있는곳이에요 원단시장이 있고 구제 시장도 있고 한복을 파는곳들도~ 그러다 배고프면 수많은 노점이나 식당에 가면됩니다. 위생적인걸 최고로하시거나 까다로운 분이라면 힘들수도 있어요~ 둘러보고 청계천으로나와 산책하기에도 괜찮은듯 합니다.,4,1404,"This is a place where you can look around and eat delicious snacks. There's a fabric market, there's a foot-and-mouth market, there's a hanbok store. If you're hungry, you can go to a lot of street vendors and restaurants. If you're the most hygienic or picky person, it might be hard. It's good to take a walk around Cheonggyecheon Stream."
sodal00,사람이 너무 많습니다. 길이 좁아서 통행도 불편하고요. 아시아권 관광객들 많은데 조금 민망할 정도로 질서가 없습니다. 값도 지나치게 비쌉니다. 맛도 별로였습니다. 유명한 가게는 오랫동안 줄을 서서 기다려야 합니다. 무척 짜증스러울 수 있습니다.,1,1404,"There are too many people. The traffic is inconvenient because the road is narrow. There are many Asian tourists, but there is no order to be embarrassed. It's also too expensive. It didn't taste good either. Famous stores have to wait in line for a long time. It can be very annoying."
beruary,광장시장은 서울 시내에서 보기어려운 시장의 모습을 가지도 있으면서 먹거리로 넘쳐나는 곳입니다. 빈대떡분만이 아니라 육회 생태탕 술안주거리들도 즐비합니다.,5,1404,Gwangjang Market is a place full of food as it has a rare market to see in downtown Seoul. Not only the pancake but also the Yukhoe Ecotang and Sulanju Street.
slow1717,"비가 갑자기 쏟아져 내려서 급히 노선을 바꿔 외국인친구들과 들어간 광장시장. 떄에 맞춰 빈대떡냄새가 참 맛있었고, 다양한 먹거리가 즐비했습니다. 산낙지/육회를 먹었는데 참 좋았습니다.",4,1404,"Gwangjang Market, where the rain suddenly poured down, changed course and entered with foreign friends. The smell of mung bean pancake was very delicious and there were various foods. I ate raw octopus/yukhoe and it was really good."
천재리더,"말로만 듣던 광장시장을 방문했었다. 소문대로 수많은 사람들도 북적대던 광장시장, 그 유명한 빈대떡, 육회, 마약김밥 등등 어딜가나 푸짐해보이던 음식들, 즐거워하는 사람들의 모습..모두 보기 좋다. 하지만 어디까지나 내 입맛인가? 음식들이 맛있다는 느낌은 전혀 들지 않아서 이것저것 많이 맛보긴 했지만, 내내 아쉬움이 남았다. 언젠가 남대문의 칼국수집들이 유명하다 들어서 갔지만 밍밍하기만한 멸치육수가 아쉬웠던..그날의 기분과 흡사했다. 어쩌면 너무 많은 관광객들 덕에 상인들의 정성이 초심을 잃은건",4,1404,"I visited Gwangjang Market, which I've only heard of. As the rumor has it that Gwangjang Market, the famous pancake, yukhoe, drug kimbap, etc. seems to be plentiful everywhere, and the people who are enjoying it.Everything looks good. But how much is my taste buds? I didn't feel that the food was delicious at all, so I tasted a lot of this and that, but I was disappointed all the time. One day, I went to Namdaemun Kalguksu restaurant because I heard it was famous, but I felt sorry for the bland anchovy broth.It was similar to the feeling of the day. Maybe because of so many tourists, the merchants lost their motivation."
FLYANDRUNANDY,"티비에도 많이 나오고 먹방 찍으러 간 곳입니다.. ""전""도 싸게 팔고, 순대, 닭강정 등 맛있는 게 넘칩니다. 주말에 가면 사람이 많으니 평일 낮에 가는 것을 추천합니다.",4,1404,"0It's a place where I went to shoot mukbang a lot on TV.Jeon Do is sold cheaply and there are lots of delicious things such as sundae and chicken gangjeong.If you go on weekends, there are a lot of people, so I recommend you to go during the daytime on weekdays."
핀란드,위치는 종로 5가 지하철역으로 나가면 바로 있고 이곳 해동이네 가 10년 단골입니다. 각종 전부터 육회 막걸리 마약 김밥까지. 정말 즐겨 찾는곳입니다^^,5,1404,"The location is right at the subway station on Jongno 5-ga and Haedongnega is a ten-year-old regular. Yukhoe, Makgeolli, Narcotics and Gimbap. It's a favorite place.^^"
선미 박,"광장시장은 서울의 대표 시장이예요. 관광객들이 워낙 많아서 이동에 불편함이 있긴 하지만, 다양한 걸 맛볼 수 있고, 다양한 것들을 살 수 있어요. 특히, 갈 때마다 '양념게장'을 잊지 않고 사오고, 육회를 꼭 먹는답니다. 푸짐하게 즐길 수 있거든요. 종로, 대학로 등 인근에 볼거리도 많다는 것도 꼭 알아둬야해요!!",5,1404,"Gwangjang Market is the representative market of Seoul. There are so many tourists that it's inconvenient to travel, but you can taste various things and buy various things. Especially, whenever I go, I always remember to buy 'Spicy Marinated Crab' and eat yukhoe. You can enjoy it a lot. Be sure to know that there are many things to see around Jongro, Daehakro, and so on!!"
inthesub,"먼가를 사러 가기보다는 빈대떡이나 다른 거 먹으러 가는 것 같아요. 빈대떡집이 많아서 골라서 갈 수 있고, 음식도 꽤 다양하게 있어요.",4,1404,"Rather than going to buy something far away, I think we're going to eat mung bean pancakes or something else. There are a lot of pancakes, so you can choose one, and there are quite a variety of foods."
난이언니,광장시장은 맛집이 많이있고 사람들로 항상붐빈다. 시장을 경험하는 외국인들에게도 인기가많다.,5,1404,Gwangjang Market has many restaurants and is always crowded with people. It is also popular with foreigners who experience the market.
