u_id,review,u_rate,p_id,review_en
Peter0516,2017년 12월 27일 어제 처음으로 광장시장을 방문하였습니다. 가장 가운데 위치한 떡복기 오뎅 순대 김밥을 먹었습니다. 원조 마약김밥 앞이며 또 원조 빈대떡 앞가게입니다. 먹는 도중 가격으로 주인과 어떤 손님과 다툼이 있었습니다. 이상하게 생각햤었는데 우리도 같은 사건을 겪었습니다. 분명히 13000원이었는데 15000이 나와 이상하게 생각햤었는데 가격표에 따라 계산해보니 15000원이라 그냥 지불했는데 어제 오면서 생각하니 주인이 2종류의 메뉴를 사용하고있었습니다. 처음메뉴는 순대가격이,4,1404,"I visited Gwangjang Market for the first time yesterday, December 27, 2017. I ate rice cake fish cake fish cake and sundae kimbap in the middle. It's in front of the original drug gimbap and the original pancake shop. There was a quarrel between the owner and a customer over the price while eating. I thought it was weird, but we went through the same thing. It was 13,000 won, but I thought it was strange because it was 15,000 won according to the price list, so I just paid 15,000 won, but when I came here yesterday, the owner was using 2 kinds of menu. The initial menu is the price of sundae."
Relax825963,육회+산낙지에 소주한잔 하러 몇번 가봤는데 외국인들 이거 먹이는 재미가 있고 나도 맛있어서 좋고.. 다만 가격은 좀 쎈편이다. 빈대떡도 유명하다. 근처에 명동 동대문 다 가까워서 한번쯤 들릴만한 곳이다. (알게모르게 집어먹다보면 배가 부름),4,1404,"I've been to raw beef + raw octopus and soju a few times, and I like it because it's fun to feed foreigners and I like it because it's delicious. However, the price is a bit high. Pondae tteok is also famous. Myeong-dong and Dongdaemun are all close by, so it is worth visiting. (Eating without knowing makes me full.)"
bluejay3786,사실 광장시장에서 파는 음식의 맛은 그렇게 특별하진 않습니다. 어디까지나 서민 음식이니까요. 하지만 서울 사람들의 삶을 현장에서 생생하게 볼 수 있다는 점에선 분명 충분히 가치 있는 곳입니다. 현지인들과 어깨를 맞대고 현지의 음식을 먹는 건 분명 여행이 주는 즐거움 중 하나이니 꼭 방문해보시길 권합니다. 방문 전에 1000원짜리 지폐를 충분히 챙겨가세요!,4,1404,"In fact, the taste of food sold in Gwangjang Market is not that special. It's a commoner's food. However, it is definitely worth it in that you can see the lives of the people of Seoul vividly. Eating local food shoulder-to-shoulder with locals is definitely one of the pleasures of traveling, so I recommend you visit. Take enough 1,000 won bills before your visit!"
nanes,"동대문과 가까워서 동대문에서 쇼핑을 한후에 출출함을 달래기 위한 식사 코스로 추천드립니다. 족발, 빈대떡, 떡볶이, 순대, 마약김밥 시장이 커서 왠만한 한식메뉴는 다있고 대부분 장사가 잘되서 왠만하면 다 맛있습니다. 주차가 까다롭고 화장실 가기가 조금 불편한 단점이 있습니다. 주차는 광장시장 노상주차장은 주차가 비싸고 자리가 없을때 뺑뺑이를 돌아야 할수도 있으니 동대문쇼핑몰을 이용하신다면 차라리 근처 쇼핑몰에 주차하시고 구매후에 주차권을 받는 것을 추전드립니다. (살짝 걸어야 함)",4,1404,"As it is close to Dongdaemun, I recommend it as a meal course to relieve my hunger after shopping at Dongdaemun. The market for jokbal, mung bean pancake, tteokbokki, sundae, and drug gimbap is big, so there are all kinds of Korean food menus and most of them are good, so they are all delicious. Parking is difficult and it is a little inconvenient to go to the bathroom. Parking is expensive and you may have to run around when there is no parking space, so if you are using Dongdaemun Shopping Mall, you should rather park at a nearby shopping mall and get a parking ticket after purchase. (Walk lightly)"
Min Chol Kim,"녹두전, 육회를 중심으로 많은 먹거리가 있는 곳이다. 비교적 예전 모습의 식당들이 많기 때문에 위생상 깨끗하다고는 할 수 없지만, 전통적인 재래시장 체험을 하기에는 더할 나위 없이 적합한 장소라고 생각한다. 음식을 주문할 때 가격표가 있는 곳에서 주문하는 것이 좋으며, 카드 결제가 되지 않기 때문에 현금을 두둑히 가지고 가는 것을 추천한다.",4,1404,"It is a place where there are many foods around mung bean pancake and yukhoe. Although it is not hygienic because there are many restaurants with a relatively old appearance, I think it is a perfect place to experience traditional markets. When ordering food, it's better to order at a place with a price tag, and since it doesn't pay by credit card, I recommend you to bring a lot of cash."
Traveling Foodie,"광장시장의 마약김밥+떡볶이는 거의 다 비슷비슷합니다. 굳이 유명한 곳을 찾아가실 필요는 없어요. 어차피 겨자소스맛으로 먹는거니까요. 마약김밥보다 떡볶이에 차이가 좀 있습니다. 소스를 넉넉하게 쓰는 곳과 박하게 쓰는 곳이 차이가 눈으로 구별이 됩니다. 검붉은 소스로 범벅이 된 곳을 찾으세요. 여기 오빠네는 매스컴을 좀 많이 탄 곳이예요. 고든램지와 브리라슨등이 다녀갔습니다 떡볶이 소스를 충분히 시뻘겋게 넣고요, 마약김밥에는 깻잎이 들어가있습니다. 각각 3000 원씩인데 한명이 먹기",4,1404,"Narcotic Gimbap and Tteokbokki in Gwangjang Market are almost the same. You don't have to visit famous places. We're going to eat it with mustard sauce anyway. There is a slight difference in tteokbokki than drug gimbap. The difference between a generous amount of sauce and a thin amount of sauce can be distinguished by the eye. Find a place covered with dark red sauce. My brother's been on the media a lot. Gordon Ramsay and Brirason and so on. Add enough red tteokbokki sauce, and there are perilla leaves in the drug gimbap. It's 3,000 won each, but one person eats it."
H L,광장시장 안에 있는 자선네에서 어묵 순대 만두 국수 김밥을 시켜서 배부르게 먹었네요. 광장시장은 맛있는 음식과 사람들이 북적거려서 분위기가 참 좋아요. 실컷 먹었는데 48000원정도밖에 안 나왔어요. 그런데 광장시장에서는 현금만 받으니까 꼭 현금을 준비하세요.,4,1404,"I ordered fish cake, sundae, dumpling, noodles, and kimbap at the charity store in Gwangjang Market and ate it full. Gwangjang Market has a great atmosphere because it is crowded with delicious food. I ate as much as I could, but it was only 48,000 won. But only cash is accepted at Gwangjang Market, so make sure to prepare cash."
ye0ngjus,서울의 유명한 시장 중 하나로 맛있는 먹거리들이 많은 곳이다. 전통 시장 느낌을 체험해볼 수 있는 곳이라 외국인 관광객들이 한번쯤 방문해봐도 좋을 곳이다.,3,1404,It is one of the famous markets in Seoul and has many delicious food. It is a good place for foreign tourists to visit because they can experience the traditional market feel.
DominicLee9014,"유튜브 보고 너무 맛있어보이는 저렴이 못난이 김밥, 전이라면 환장하는 저로써는 너무 맛나게 먹었던 전!! 그리고 구수한 시장 냄새로 사람의 정이 느껴졌던 하루네요 ㅎ 다시 온다면 또 다른 먹거리들을 한번 찾아봐야겠어요 ㅎㅎ다음엔 국밥도 빵종류도 각양각색으로 많다던데 호떡도 그렇고 곧 추워지니 뜨끈하게 먹고 녹두 빈대떡에 막걸리도 한잔 해봐야 겠네요 ㅎㅎ",5,1404,"The cheap ugly kimbap that looks so good on YouTube, and the pancake that I am crazy about, I ate it so deliciously!! And it's been a day since I felt the sweet smell of the market. If you come back, I'll have to look for other foods. Next time, there are many different kinds of rice soup and bread. Hotteok and soon it's getting cold, so I'll eat hot, mung bean pancake, and makgeolli. Haha"
Choi.J,"광장시장에 가면 먹어야할 것들을 알려드립니다. 1. 육회 2.빈대떡+완자 3.마약김밥 4.수수부꾸미 다른것들은 옵션이고요, 저것들은 꼭 드세요 ㅋㅋㅋ",5,1404,Let me tell you what to eat at Gwangjang Market. 1. Raw beef 2. Bindaetteok + Wanja 3. Drug Gimbap 4. Water-puffer sweetener is an option. Make sure to eat those. LOL
당신또,평생 서울에서 산 나는 몇년전 지나가다 여긴 머지 하고 시장안으로 처음 들어갔으나 입구 부터 쾨쾨한 냄세에 ... 서양외국인들 광장시장 중간에서 젓가락질 하고 있던데 이런곳에 왜에,2,1404,"I lived in Seoul for the rest of my life and went into the market for the first time a few years ago, but from the entrance, it was in a stale pot... You were using chopsticks in the middle of Gwangjang Market. Why are you here?"
407yjj,"마약김밥, 빈대떡, 납작만두 등등 어떤 시장보다 재밋고 맛있는 곳이에요. 외국인 친구를 데려가면 아주 재밌어할거에요. 중간중간 테이블 앞에서 연주 해주시는 분들도 잇어요",5,1404,"Drug Gimbap, pancake, flat dumplings, etc. are more fun and delicious than any other market. It'll be a lot of fun to take a foreign friend. There are people who play in front of the table from time to time."
sei0402,"다양한 먹거리와 음식점들, 싸고 질 좋은 음식들 호객 행위가 아주 조금 있지만 신경쓰이지 않을 정도! 필수는 역시 육회가 아닐까..",5,1404,"Various foods, restaurants, cheap and high-quality food. There is a little bit of solicitation, but I don't care! I think yukhoe is a must."
woo junggil,"사람도 많고 재미있는 시장이다. 떡볶이, 빈대떡, 육회 등 한국 길거리 음식들을 맛볼 수 있다. 이모님들이 적극적으로 호객 행위를 하신다.가격도 저렴하고 어느 음식점을 가던 다 맛있다. 한국의 시장문화를 체험하기 좋은 곳이다.",5,1404,"It is a crowded and interesting market. You can taste Korean street foods such as tteokbokki, mung bean pancake, and yukhoe. The aunts are actively soliciting.It's cheap and delicious at any restaurant. It is a good place to experience Korean market culture."
jerry,"해가 지날수록 사람들이 많아져 주말이면 사람들로 인해서 지나다니기 힘들정도이지만 육회, 빈대떡, 순대등 광장시장만의 맛이 있는 음식점들이 많아 자주 찾습니다",5,1404,"As the years go by, the number of people increases, so it's hard to pass by on weekends, but there are many delicious restaurants in Gwangjang Market such as yukhoe, pancake, and sundae, soondae."
MyEveryTime,주변 약국 도매점이 많아 겸사겸사 들른다. 비교적 저렴한 가격으로 사람들이 많이 붐비는 곳으로 특히 녹두빈대떡을 먹기 위해 줄을 선 사람들이 대박이다.,4,1404,"There are many drugstore wholesalers around here, so I stop by at the same time. It is a crowded place with relatively low prices, especially those who line up to eat mung bean pancakes."
밥쟁이,"먹거리도 많고, 활기차요. 시장마다 분위기가 있다하면 여긴 활기차고 좋습니다. 바빠서 불친절할수 있는데, 가는곳마다 이모님들 너무 친절하시구 좋아요.",4,1404,"It's full of food and it's full of energy. If there's an atmosphere in every market, it's lively and nice here. I can be unfriendly because I'm busy, but my aunts are so kind wherever I go."
Yooni,서울에 있는 광장시장 . 미국에서 온 한인교포가 같이 가보고 싶다고 해서 갔다. 마약김밥이 맛있다고 유명하다고 가보자고 했다. 나도 잘 모르는데 같이 가서 먹었다. 사람들이 많았고 소소한 작은 시장안에 아줌마들이 여러음식을 팔았다. 마약김밥은 맛있는 줄 모르겠다. 다시는 가고 싶지않은 평범했다 . 식혜는 맛있었다. 주차는 근처 유료 주차장에 했다 지나가는 공간이 협소해서 사람들과 계속 치이면서 다녔다,3,1404,"I went to Gwangjang Market in Seoul because a Korean American from the U.S. wanted to go with me. Let's go because drug gimbap is famous. I don't know either, but we went and ate together. There were many people and women sold various foods in a small market. I don't know if drug gimbap is delicious. It was normal not to want to go again. Sikhye was delicious. Parking was done in a nearby paid parking lot. The passing space was small, so I kept getting hit by people."
yong2lee,"항상 사람들이 너무 많아 붐비지만 혜화동 대학로를 쭈욱 따라 거닐고 내려오면서 막걸리와 먹는 녹두빈대떡은 너무 맛있어서 기분이 업 되요 마약김밥, 그리고 순대는 너무 맛있어요",4,1404,"It's always crowded because there are so many people, but the mung bean pancake that I eat with makgeolli while walking down Daehak-ro in Hyehwa-dong is so delicious that I feel excited. Drug kimbap and sundae are so delicious."
stryuji27,요즘에 광장시장에 가면 다른때보다 관광객이 엄청 많이 보입니다. 평일에도 주말에도 늘 붐비는 곳이지만 그만큼 먹을것도 많은 곳이죠. 대단히 구경할 건 없지만 싸고 맛있는 음식을 다양하게 먹어볼수 있으니 추천합니다,5,1404,"These days, when I go to Gwangjang Market, I see more tourists than ever. It's always crowded on weekdays and weekends, but there's a lot to eat. I don't have much to see, but I recommend you to try various cheap and delicious foods."
W.C. Seoul,어제 광장시장 가서 빈대떡 포장해 왔다 광장시장 음식이 너무 많고 관광객도 엄청 많다 음식을 먹기 위해서는 현금이 필요하다 맷돌로 콩을 갈아서 빈대떡 만드는 과정을 볼 수 있어서 흥미롭다,5,1404,I went to Gwangjang Market yesterday and packed pancakes. There are too many food in Gwangjang Market and so many tourists. You need cash to eat food. It is interesting to see the process of grinding beans with millstones and making mung bean pancakes.
cheryl,"광장시장 대표먹거리인 마약김밥, 빈대떡, 육회 정말 맛있습니다. 방소에 많이 나오다 보니 평일에도 사람이 많습니다. 그래도 맛집탐방을 하다보면 붐비는 사람들 틈에서도 재미를 느낄 수 있습니다.",4,1404,"The representative foods of Gwangjang Market are drug gimbap, pancake, and yukhoe. There are a lot of people on weekdays as they come to the room a lot. But if you go on a tour of restaurants, you can have fun in the midst of crowds."
Sunshine827559,토요일에 갔었는데 길도 너무 좁고.. 사람이 너무 많아서 밀려서 다녔어요. 음식은 맛있어요. 먹고싶은거 너무 많아서 조금씩 사서 먹으면서 돌아다녔어요 ㅎ,5,1404,"I went there on Saturday, but the road was too narrow. There were so many people that I was pushed around. The food is delicious. There were so many things I wanted to eat that I bought a little bit and went around eating. Hah!"
Wanderer08401651835,"광장시장 먹거리인 빈대떡, 꽈배기, 수수부꾸미, 육회, 마약김밥 등을 하루에 모두 맛보기 위해 방문했다. 줄을 길게 서서 기다린 끝에 조금씩 맛을 보는 재미가 즐거웠다. 기다리는 지침이 있었지만 달콤한 맛이 기다림을 잊게 했다. 먹거리 시장투어는 항상 재미있고 푸짐한 재미를 갖다준다",4,1404,"He visited Gwangjang Market to taste mung bean pancakes, ggwabaegi, susoobukkumi, yukhoe, and drug gimbap all in one day. After waiting in line for a long time, it was fun to taste it little by little. There were instructions for waiting, but the sweet taste made me forget waiting. Food market tours always bring a lot of fun."
EJ K,다양한 먹거리와 볼거리 살거리가 있어서 유명한 곳이지요. 저녁에 술 한잔 할 때도 서민적인 맛을 즐길 수 있구요. 빈대떡도 유명하고. 점심에도 길거리 음식을 비롯해서 다양한 맛을 즐길 수 있어요.,4,1404,It is famous for its variety of food and attractions. You can also enjoy a common taste when you have a drink in the evening. Bindaetteok is also famous. You can enjoy a variety of flavors including street food at lunchtime.
선우 남,한국적인 음식도 많이 맛볼 수 있고 전형적인 전통시장의 풍경도 볼 수 있는 곳입니다. 가격도 전반적으로 저렴하거나 적정한 편이라고 생각이 듭니다. 다만 상인분들이 당연하게 카드를 안받으시는데 이 부분만 개선되었으면 하는 바람이 있습니다.,5,1404,"It is a place where you can taste a lot of Korean food and see the typical traditional market. I think the overall price is reasonable or inexpensive. However, merchants naturally don't accept cards, so I hope this part will be improved."
공쥬님,시장 중 먹거리가 많은 시장 하면 광장시장이라고 생각합니다 빈대떡도 있고 떡갈비에 육회까지 술안주들이 즐비한 시장입니다,4,1404,"I think Gwangjang Market is a market with a lot of food. This market is full of rice cake, grilled short rib patties, yukhoe, and other side dishes."
sukiri_beomkiri,"빈대떡, 대구탕, 육회, 칼국수, 김밥, 비빔밥, 해산물 등등 정말 맛있는거 천지여서 꼭 굶고 가셔야합니다. 먹고싶은거 다 못먹고와서 넘 아쉬워서 다음에 또 방문 예정입니다.",5,1404,"Bindaetteok, codfish soup, yukhoe, kalguksu, gimbap, bibimbap, seafood, etc. It's really delicious, so you have to starve. I'm so sad that I couldn't finish what I wanted to eat, so I'm going to visit again next time."
Hyuck Joon Lee,"전통 시장인데 먹거리가 특히 풍부하다. 빈대떡, 육회, 비빔밥, 마약김밥, 족발, 순대... 어느 것 하나 빠지지 않는다. 침구류, 의류 원단 등 다른 살 것도 많다.",4,1404,"It's a traditional market, but there's especially plenty of food. Bindaetteok, yukhoe, bibimbap, drug kimbap, jokbal, sundae... Nothing is missing. There are many other things to buy such as bedding and clothing fabrics."
백종윈,맛집도 맛집이지만 저는 구제마켓을 더 열심히 이용합니다 ㅋㅋ 외국인 관광객들도 많아서 북적이는 활발한 시장입니다!! 먹거리는 저는 육회 추천입니다,5,1404,"A good restaurant is a good place, but I use the market harder. It is a crowded market because there are many foreign tourists. I recommend yukhoe for food."
W.C. Seoul,"청계천과 가깝고 유네스코인 종묘의 대각선에 위치해 있다 지하철 3호선 종로3가역 귀금속거리에서 걸어갈 수 있고 지하철 1호선 종로5가역에서 더 가깝다 한복과 옷 가게로 유명하며 오래된 전통시장이다 한국의먹거리를 맛볼 수 있다 반찬가게, 광장시장 먹자골목에는 많은 관광객으로 붐빈다",4,1404,"Located on the diagonal line of Jongmyo Shrine, which is close to Cheonggyecheon Stream and is UNESCO You can walk from the precious metal street of Jongno 3-ga Station on Subway Line No. 3 and it is closer to Jongno 5-ga Station on Subway Line No. 1. It is famous for hanbok and clothing stores, and you can taste Korean food. Side dish shops, Gwangjang Market Food Alley are crowded with many tourists."
선경 김,예전만큼의 향수를 느낄수 있는 곳은 아니지만 그래도 한달에 한번은 생각이 나는 곳이예요 조금 혼잡하지만 평일에 낮에 가면 딱 좋아요,5,1404,"It's not as nostalgic as it used to be, but it's a place that comes to mind once a month. It's a little crowded, but it's perfect during the day on weekdays."
Soo_in_Seoul,"안에 식당들을 다 못 먹어봐서 아쉽긴 한데 외국인 관광객을 상대로 하는 듯한 느낌..이 살짝 있었던 것 같고, 그래서 그런지 더 비쌌어요.",3,1404,"It's a shame that I haven't eaten all the restaurants inside, but it feels like I'm targeting foreign tourists.I think it was a little bit, so it was more expensive."
경경 팍,광장시장 사람 항상 많고 결혼 준비하려고 한복 맞추러 간 광장시장~ 먹을거리가 엄청 많아서 마약김밥 빈대떡 등등 엄청 맛나요! 그런데 가격이 일반시장에 비해 비싼편이에요ㅜ,4,1404,"There's always a lot of people at Gwangjang Market and I went to get my hanbok ready to get married. There's a lot of food to eat. Drugs, kimbap, pancakes, and so on. It's really delicious! But the price is more expensive than the general market.ᅮ"
snoopy419,빈대떡이나 마약김밥도 먹고 시장 구경도 할 겸 자주 방문하는 곳입니다. 사람들이 모여있는 모습이나 장사하시는 모습을 보면 사람사는 냄새가 느껴지고 활력이 넘칩니다.,4,1404,"It is a place I visit often to eat mung bean pancake or drug kimbap and to look around the market. When I see people gathering and doing business, I can feel the smell of human life and it's full of vitality."
deuxhan,공휴일에 갔다가 사람에 치이는줄 알았어요 먹거리 가득한 시장인데 사람이 너무 많고 길도 좁아 아이들 데리고 움직이는 것 조차 어려웠어요 한복 찾으러 갔다가 들였는데 공휴일인 피해야겠네요,3,1404,"I thought I'd be run over on a holiday. It's a market full of food, but it's so crowded and narrow that it's hard to even move around with the kids. I was looking for hanbok. I should avoid it as a holiday."
Jaewook Lim in Seoul,"서로가 원조 논쟁을 벌이고 있다. 방송에 서로 많이 나왔다고 경쟁한다. 그러나, 카피가 대세인 세상이라, 그 맛이 그 맛이다. 마약김밥은 충무깁밥 스타일에 겨자를 더한 맛인데, ""그렇게 대단하진 않은데?""하면서도, 얼마 지나지 않아 꾸역꾸역 먹고 있는 자신을 발견할 수 있을 것이다. 그래서, 이름이 마약김밥이다. 한 번 쯤은 권해보라 추천하고 싶다.",4,1404,"0The two sides are engaged in a dispute over aid.They compete with each other for being on TV a lot.However, the taste is so delicious because copy is popular in this world.Drug gimbap is a Chungmu Gibbab style with mustard, but it's not that great, but you'll soon find yourself eating it.So its name is Drug Gimbap.I would recommend it at least once."
spy0516,육회를 좋아하는 가족과 함께 방문하여 미슐랭가이드에 올려진 곳을 방문하여 육회를 즐겼고 그밖에 순대나 떡볶이등 여러가지 음식을 즐기기에는 좋았으며 외국인도 많이 보였다.,5,1404,"I visited the restaurant on Michelin Guide with my family who like yukhoe and enjoyed yukhoe. Besides, it was good to enjoy various foods such as sundae and tteokbokki, and there were many foreigners."
Hwangilyong,저는 이곳에서 맛있는음식이랑 구제옷쇼핑을 했는데 시장안에 음식은 정말맛있고 (녹두전강추!!)볼거리도 정말많습니다 시장안에 구제옷 파는 건물?? 같은게있는데 거기서 많이 샀습니다 의외로 이쁜옷들많고 가격도 저렴 팍팍 세일하고 다만 먼지가 많습니다 빨아입어야하고 여기는 계속 주기적으로 와야할것같습니다!!,5,1404,"I bought delicious food and clothes here, and the food in the market is really delicious and there are so many things to see. A building selling vintage clothes in the market? There's the same thing, but I bought a lot there. Surprisingly, there are many pretty clothes and cheap prices, but there is a lot of dust. I'm gonna have to suck it up, and I'm gonna have to keep coming here on a regular basis!"
Sabina Kim,언제나 먹거리와 사람들이 넘쳐나는 곳입니다. 가격도 저렴하고 맛있는 것들이 남쳐서 언제나 방문하고 합니다. 이번 방문에는 육회와 빈대떡을 먹었습니다. 다음에는 다른 음식을 도전하고 싶습니다,4,1404,"It's always full of food and people. I always visit there because it is cheap and delicious. I ate yukhoe and mung bean pancake during this visit. Next time, I want to try different foods."
sanrio2018,가족과 시장구경하러 하루 날잡고 들려봤어요. 먹을거리가 너무 많아서 다먹지못해서 아쉬울정도로 족발부터 비빔밥 마약김밥 빈대떡등 ~ 한끼만 해결하기에 아쉬울 정도로 맛있는게 많았습니다. 아이들 한복사러도 많이 가더라구요.,4,1404,"I stopped by to see the market with my family. There were so many things to eat that I couldn't finish it, so I was sad that I couldn't finish it. From jokbal to bibimbap, drug kimbap, mung bean pancakes, etc. There were so many delicious things that I couldn't finish. Many people go to buy Hanbok for their children."
seongeun y,종로에 있는 광장시장에 가면 빈대떡과 마약김밥을 맛보는 것은 필수중에 필수이다. 한복을 맞추러 갔었는데 한복마추고 허기진 배를 달래기에 아주 좋았다.,5,1404,"If you go to Gwangjang Market in Jongno, it is essential to taste mung bean pancakes and drug gimbap. I went to get Hanbok, and it was very good to get rid of hunger after having Hanbok."
