u_id,review,u_rate,p_id,review_en
Mei Chern C,"상대적으로 쉽게 갈 수 있는 종로5가 가 (0) 에서 - 지하철 ga 시점에 제공될 예정입니다. 시장 판매에 있어 중앙에서 맛있는 팬케이크. 제가 구입한 전통 과자, 말린 점과 김치. 포장 마차 가격 비교할 간을 최고의 좋은 딜.",4,1404,"It will be provided at (0) Jongno 5-ga, which is relatively easy to get there - at the time of the subway Ga. Delicious pancakes in the middle of the market sale. The traditional snack that I bought, dried dots and kimchi. The best deal to compare the price of a cart bar."
manucanuck,"본 사람들은 부산 과 대구, 이는 훨씬 더, 대구에서 한 비교. 다시 갈 것이라고 할 수 있는 유일한 이유는 음식 (정말 좋은 한 컷 손당면의 미꽝), 그렇지 않게 하지 않습니다.",3,1404,"Those who saw it were in Busan and Daegu, which is much more, compared in Daegu. The only reason I can say I'm going back is because of the food."
Kathryn S,"좋은 곳 다니는 것도 아니고 특별히. Fabric 에 있는 포장 마차, 거리는 좋은 음식. 나는 감자 케이크 들 은 정말 저렴한 가격. 이 거대한 빈티지 의류 영역 크기 선택의 폭이 넓어요. 제가 볼 수 있는 매매!",4,1404,"I don't go to any good places. Especially. Packaging wagons in Fabric, good street food. I love potato cakes at a really low price. There is a wide range of choices for the size of this huge vintage clothing area. The sale I can see!"
Cheehau,"이런 종류의 시장은 어디에서나 찾을 수 있는 서울. 광장시장 가치로 갈 수 있지만 이 모든 것을 한꺼번에 시장에 입을 수 있습니다. 다음 wetmarket, 해산물을 구입할 수 있는 요리를 할 수 있는 레스토랑입니다. 모든 종류의 한국 음식을 맛볼 수 있는 다양한 영업, 인삼 김치 만두 스프, 한국식 팬케이크, 비빔밥, 심지어 쌀 보리 음료. 나는 이 곳에서 한 사람의 사정을 10/10 갈구 음식이 서울. 가격 또한 괜찮았어요!",4,1404,"This kind of market can be found everywhere in Seoul. You can go to the value of Gwangjang Market, but you can wear it all at once. Next Wetmarket, a restaurant where you can cook seafood. Various sales, ginseng kimchi dumpling soup, Korean pancakes, bibimbap, and even rice barley drinks, where you can taste all kinds of Korean food. I have a situation here where October 10th is Seoul. The price was good, too!"
akaneantares,"제가 기대했던 것 보다 작지 입니다. 모두 비슷한 물건을 파는 노점 도, 함께 벼락치기, 그래서 매우 뜨거운 시장입니다.",3,1404,"It's smaller than I expected. All the stalls selling similar goods, cramming together, so it's a very hot market."
Pepe_masa,"우리는 우리가 찾던 곳인 신선한 거칠은. 저는 기대하지 않는 다른 다양한 음식을 찾아 음식을 판매하는 업체, 만두, 국수, 팬케이크. 우리가 김치 의 맛도 정말 좋고 신선한 만두 국수 가격도 좋았습니다. 할 정도로.",4,1404,"We've been looking for fresh roughness. I'm a company that sells food in search of other foods that I don't expect, dumplings, noodles, pancakes. The taste of kimchi was really good and the price of fresh dumpling noodles was good. To the extent that."
23cynthiae87,"시장에 가 볼 수 있기 때문에 조금 더 전통적인 한국 음식을 해 보고 각 판매 포장 마차 같은 음식이 하나 있습니다. 너무 많은 업체들과 계속 부르고 선택해야 합니다 ahjumas 배치할 수 있습니다. 이 중에서 본 한국은 정말 문제가 서로 경쟁하는 물건들 같은 사람들을 보실 수 있는 가장 인기 있는 곳. 우리는 전통을 bimbimbap, 떡볶이, 만두 손을 자르면 꽤 괜찮다. 그들은 영어를 구사할 수 없지만 중국어도 있지만 중국인 관광객 증가에 한국의 거의 대부분이 영어 메뉴를 먼저 먹을 수",4,1404,"Since you can go to the market, try more traditional Korean food and there is a food like each cart bar. You have to keep calling and choosing with too many companies. Allows you to place ahjumas. Among them, Korea is the most popular place where you can see people who are really competing with each other. We're pretty good when we cut off traditional bimbimbimbap, tteokbokki and dumpling hands. They can't speak English, but they have Chinese, but with the increase in Chinese tourists, almost all of Korea can eat English menus first."
Rohan F,정말 멋진 곳이 기념품 항목 및 다양한 크기의 다른 쇼핑 센터 방문 일정. 근처에 지하철 역이 바로 옆에 위치에 쉽게 다이빙을 하고 쇼핑. 그냥 자신에게 시간을 약간 더 저렴한 가격과 같은 것들을 둘러보고 1min 이후 시장.,4,1404,"What a nice place to visit, souvenir items and other shopping centers of various sizes. Diving easily and shopping right next to the subway station nearby. Just look at things like a slightly cheaper price for yourself and the market after 1min."
camelot77,"서울 에도 몇 번 한 적이 있는, 전통적인 남대문과 남대문 시장 내어 모험을하지 않습니다. 이 곳은 찾기 어려워서 꽤 깨끗하고 있어. 이 시장에서 볼 수 있는 가장 유명한 항목 (녹두 팬케이크) bintaettok. 저는 솔직히 하지 않았지만 많은 사람들에 대해서 많은 것들을. 인수 맛 입니다. 것 같아요. 여러 음식 가판대 샘플도 구매할 수 있습니다 로컬 음식을 반찬 으로 천천히 즐기다 호텔 (작은 반찬) 할 수 있습니다. 나는 많은 것을 보지 못하지만 예쁜 한복 가게에 많은 쇼핑. 저는",3,1404,"We don't take chances in traditional Namdaemun and Namdaemun markets, which we've done a few times in Seoul. This place is pretty clean because it's hard to find. The most famous item to see in this market (green bean pancake) bintaetok. I honestly didn't do it, but about many people. It tastes like Insoo. I think so. You can also buy samples of various food stands. You can enjoy local food slowly as a side dish at a hotel (small side dish). I don't see much, but I shop a lot in a pretty hanbok store. I am"
PCSim,"마지막으로 이 시장을 방문할 수 있는 기회를. 지하철 근처에 위치한 편리함. 이는 매우 손쉽게 찾을 수 있습니다. 어떤 게 깎아 지른듯한 크기였는데 정말 에 들떠 있었다. 많은 음식 제공. 하지만, 후에 가게들이 거의 동일한 유형의 정보를 제공하는 실현 이다. 그럼에도 불구하고, 여전히 일부 지역 음식을 시도해 보는 재미 에. 많은 한국 전통 의상 이 있습니다. 체크 아웃 할 기회가 너무 나쁜 했다. 한국 전통 음식을 팔고 있고 의상. 또한 시장. 다양한 신선한 음식 제공. 해산물, 각종",3,1404,"Finally, a chance to visit this market. Convenience located near the subway. It's very easy to find. Something was a sheer size and I was really excited about it. Serious catering. However, later it is the realization that stores provide almost the same type of information. Nevertheless, it is still fun to try some local food. There are many traditional Korean clothes. The chance to check out was so bad. They sell traditional Korean food and costumes. Also a market. Offering a variety of fresh food. Seafood, various kinds of food"
ehsepzmfl,"몇몇 음식점 특히 마약김밥 및 빈대떡, 순대 등이 유명하여 굳이 줄 서서 먹었으나 너무너무 실망했다. 마약 김밥 축제같은 경우는 비싸지 않지만 줄 서서 먹을 것도 아니고 이름 하나 잘 지어서 (이란 ""마약"" 이름이 우리나라 사람에게 흥미로와서) 대박 난 듯... 너무 상업화 되었고 교통이 편한 편도. 차라리 망원 시장이나 경복궁역 근처의 없을 아니니 굳이 갈지 필요는 듯 통인 시장이 더 좋을 듯 하다. 나는 긴 시간이 어서 대기 는 이러한 것들을 주민들은 ""더 먹어야한다"" (마약 김밥) 등",3,1404,"0Some restaurants, especially drug kimbap and mung bean pancake sundae, were famous, so I had to wait in line, but I was so disappointed.In case of the drug gimbap festival, it's not expensive, but it's not something to eat in line, and the name of the Iranian drug is very interesting to Korean people.a one-way way too commercialized and convenient for transportationIt would be better to go to Tongin Market because there is no Mangwon Market or near Gyeongbokgung Station.I think residents should eat more of these things that wait a long time. Drug gimbap, etc."
KLPow,"조리 된 음식과 길거리 음식을 파는 시장이 있는 것 같은 모습. 이러한 음식 같은 경우, 이 시장입니다. 영어를 할 업체. 1000원 2000원 이지만 대부분의 음식이나. 손 또는 손가락 제스처에 1 2주 이 기 때문에.",4,1404,"The appearance of a market selling cooked and street food. For these foods, it's this market. an English-speaking company It's 1,000 won and 2,000 won, but most of the food. Because of one or two weeks of hand or finger gestures."
Vio,"지하철 역에 가깝고! 전통 시장에 비해, 이 시장은 놀라울 정도로 깨끗하다. 할 수 있는 유명한 전통 음식. 좋은 아침 식사나 점심 식사. 수 많은 상인들의 중국어도, 쉽게 하고, 그들은 친절하고, 작동 및 신체 언어 입니다! 게다가, 작은 선물 축제같은 몇 가지고 갈 수도, 책 등이 있어 입어 표시합니다. 比想像中乾淨很多, 大多的攤飯也會說中文, 這裡你可以嘗到各種美食, 當成早餐或午餐都很棒, 此市場離地鐵站非常近! 在這裡不只食物, 還可以買到一些小紀念品或者伴手禮",5,1404,"It's close to a subway station! Compared to traditional markets, this market is surprisingly clean. Famous traditional food you can do. Good breakfast or lunch. Countless merchants' Chinese is also easy, and they are kind, working and body language! In addition, there are some things you can take with you like a small gift festival, books, etc., so you can wear them. 比想像中乾淨很多, 大多的攤飯也會說中文, 這裡你可以嘗到各種美食, 當成早餐或午餐都很棒, 此市場離地鐵站非常近! 在這裡不只食物, 還可以買到一些小紀念品或者伴手禮"
delie dell C,"현지 음식과 같은 해초 의 케이크, 초콜릿, 아몬드, 인삼, 혈액 소시지, 만두 어묵,, 김밥 의, tokkboki, 등이 있습니다. 광장시장 을 방문하는 장소. 여기에 있는 시장 들 과 다른 음식이 싼 방법에서 500 - 4000원. 또한 함께 걸지 행상인. 이 곳은 사람들로 붐빈다. 꼭 들려야 할 곳 :)",5,1404,"There are cakes, chocolate, almonds, ginseng, blood sausage, dumpling fish cakes, kimbap yui, tokbaki, etc. in seaweed such as local food. a place to visit Gwangjang Market 500 - 4,000 won for the markets here and other cheap ways. Also, hang together as a peddler. This place is crowded with people. A must-visit place :)"
mic_leow,이는 매우 전통적인 시장의 다양한 음식들로. 또한 fabric 및 기타 다른 섹션 들을 판매. 하지만 이 되는 모든 종류의 한국 음식을 파는 음식 섹션. 이곳에 올 식사를 하지 않을 수 있습니다. 그들은 저렴한 가격에 좋은 문화 체험도 있고!,4,1404,It is a variety of foods in a very traditional market. Also selling fabric and other sections. But the food section that sells all kinds of Korean food. You may not have a meal to eat here. They also have good cultural experiences at low prices!
missrojak,"이 곳은 찾기 어렵다, 일단 할 수 있지만, 거기서 식사를 해야 합니다! 보리 비빔밥을 다하고, 김밥 mayak, 녹두 팬케이크 & 팥바 죽. 정말 좋아요! 이곳은 전통적인 시장, 및 판매하지. 해산물 어 입어. 그가 야 한다!",5,1404,"This place is hard to find, you can do it for now, but you have to eat there! Done with barley bibimbap, gimbap mayak, mung bean pancakes & red bean bar porridge. It's great! It's a traditional market, and it sells. Put on some seafood. He's the one!"
Toonny S,"많은 맛있는 음식과 전통 음식을 쉽게 갈 수 있는, 한 번에 이동해야 합니다. 시장 포장마차가 너무 많습니다.",5,1404,"That can easily go a lot of delicious food and traditional food, shall be moved at a time. There are too many cart bars in the market."
Evalu8,"진짜 서울을 보고 싶으시다면, 이 곳. 팔 은, 다양한 거대한, 엄청난 감각과 압도 고요함의. 꼭 가볼 만합니다.",5,1404,"If you want to see real Seoul, here. Arm silver, various great, great sensation and overwhelming tranquility. It's worth a visit."
lilmizsara,"한국에 있는 동안. 제가 좋아하는 전통 시장, 그냥 저를 생각 나게 너무 많은 것들이 다소 어렸을 때. 광장시장 도 예외는 아니고. 이 거대한 수 많은 것들을 하지 않을 기존 시장에 일반적으로 외부에서 찾을 때. 그래서, fabric, 농산물 건조 식품 등이 있다. 과일 의 신선하고 저렴한 음식에는 많은 이 지역의 중심에 위치. 빈대떡 을 먹어 봤는데, 이 곳이 서울 에서만 하는 팬케이크 (의 것들). 하지만, 사람들이 정말 11am, 주변 검색을 하고 있어서 더 천천히, 일찍 도착하고. 많은",4,1404,"While in Korea. My favorite traditional market, just so many things that remind me of me, when I was young. Gwangjang Market is no exception, when you are looking outside for an existing market that won't do so many things. So, there are fabric, agricultural products, dried food, etc. Fresh and inexpensive foods of fruits are located in the center of many areas. I've tried pancakes that are only available in Seoul. However, people are really searching for 11am, so they arrive more slowly and earlier. Many"
Mabel L,"광장시장 이라고 알려진 음식. 모두의 음식. 식당이 있는 것 같은 종류의 음식으로 분류되는 시장, 거리에 있는 모든 다른 종류의 요리가 제공됩니다. 주의할 수 있는 위생 상태. 한 가게의 부스러기 나 먹는 맵 은 스튜 (모험을 즐기고 있는) 오래된 저장 및 실행 아가씨 전체 바닥에 떨어 소시지, 위로를, 다시 스튜 냄비 촙드 위로 넣어. 나는 정말 좋은 그런 느낌이 들지 않았다. 하지만, 모든 음식이 맛있었습니다! 사람들이 조심하세요, 및 중국어를 사용하는 경우, 저장하기 를 강요하는",4,1404,"food known as Gwangjang Market Everyone's food. A market classified as the kind of food that has a restaurant, all different kinds of food are served on the street. A state of hygienic conditions. A store's crumbs or eating maps fall on the whole floor of the old storage and execution lady and put the sausage, comfort, and back on the stew pot. I didn't really feel that way. However, all the food was delicious! Be careful, and if people use Chinese, force them to store"
karencsh,"음식의 다양성 은, 올 해 합니다. 또한 많은 것들을 할 수 있는 판매하지 않는 한국어를 할 수 없을 것",4,1404,"Food diversity, this year. Also, you won't be able to speak non-sold Korean because you can do many things."
Brian,"굳이 쇼핑을 하지 않을 수 있다. 어떤 이는 길거리 음식 유명 합니다. 초기 열 오후 늦은 밤에, 항상 여기 사람들은 쇼핑을 하고. 정말 최고의 맛을 서울의 모든 장소에서 길거리 음식은 천장. 수 등을 지역의 반찬, 신라면 팬케이크, 소시지 에 편리한 장소에 있다.",5,1404,"You may not have to shop. Some people are famous for street food. Late in the afternoon of the early tenth afternoon, people here always go shopping. The best taste is everywhere in Seoul, and street food is the ceiling. Sui, etc. are conveniently located in local side dishes, Shinramyeon pancakes, and sausages."
Shi Ching T,진 음식입니다. 녹두 는 팬케이크 도 비빔밥을 확인함. 가격도 합리적이다,5,1404,It's a lost dish. Mung bean pancakes and bibimbap are also checked. The price is reasonable.
TravelBuggerTravel,"서울에서 사는 동안 나는 내 시간을 일 년에 먹을 수 있는 최고의 장소. 이 곳에서 기대 이상이었습니다. 많은 음식 가판대 를 구경하면서 아 잠시동안 쉬 ajashis. 저는 대부분의 시간을 혼자 앉아서 머리 정오쯤 합니다. 저는 항상 옆에 앉아 먹을 수 있는 잡채 를 해서 오래된 사람, 아이스크림, 막걸리 와 소주(蘇州) 는 미니 김밥 과 함께 공유하는 동안 나는 보리밥 이 되고 있는 것을 알고 있지 그는 그냥 무작위로 멀리 채팅 퍼믹스. 환상적이었어요! 이 멋진 정보 공유해서 음식 아직 번역",5,1404,"While living in Seoul, I am the best place to eat my time a year. It was more than I expected here. I sit alone most of the time around noon, watching a lot of food stands. I always make japchae for sitting next to me and sharing it with old people, ice cream, makgeolli, and soju with mini kimbap. I know I'm becoming barley rice. He's just randomly chatting permix. It was fantastic! Share this wonderful information and translate the food yet"
Tommy-YuShun,"서울에 있는 전통적인 시장입니다. 나는 이 곳을 추천해줄 경우가 최고의 동대문, 이 두곳은 정말 가깝습니다. 또한 아침이면 전통 시장이 있을, 모든 것은 아주 저렴합니다. 어쨌든 우리는 이 시장에서 보낸 좋은 시간.",4,1404,"It is a traditional market in Seoul. I recommend this place, Dongdaemun, which is the best place to visit, and these two places are really close. Also, everything is very cheap, with traditional markets in the morning. Anyway, we had a good time in this market."
pochie,"이곳을 사랑해요! ! 분주 한 사람들의 음식! ! ! 이국적인 음식을 먹지 않는 ^^! 시장이 줄지어 있어 기념품을 편안한 침대 저장합니다. 그에 비해 저렴한 다른 관광객들은 있는 곳. 음식 준비 해 함께 요리 의 한 가운데에 있고 모두가 신선하고 좋은! 적인, 낙지 회 바다 멍게 사용해 볼 수 있습니다. 비는 나, 나 처럼, 보고, 의 안전한 팬케이크, 오덴, 반찬 과 김밥.",5,1404,"I love this place! The food of busy people! ! !! Don't eat exotic food! The market is lined up to store souvenirs in comfortable beds. By comparison, there are other tourists who are cheap. Get your food ready. We're in the middle of the cooking together. Everyone's fresh and good! Enemy, octopus sashimi, sea squirt, can be used. Rain like me, Bogo, safe pancakes, Auden, side dishes and gimbap."
Tina L,"우리가 묵었던 동대문. 처음에, 우리는 시장. 약 45분이 걸리지만 다양한 포장 마차 에 들러 / 가게들이 길을 따라. 두 번째로, 우리는 지하철 역이 5분 거리에 시장도 안됩니다. 저희는 녹두 팬케이크와 김밥 mayak. 우리가 매일 먹는...",5,1404,"Dongdaemun where we stayed. At first, we're the mayor. It takes about 45 minutes, but stop by various wagons/ along the street. Secondly, we can't even market within 5 minutes of the subway station. We have mung bean pancakes and gimbap mayak. Every day we eat..."
michael p,이 시장은 눈을 지나 좋았습니다. 먹을 수 있는 테이블에 앉아 있는 당신의 마음을 치료 하고 지역 주민들의 배. 모든 사람들이 친절하고 무엇을 얻을 수 데 도움이 됩니다. 멋진 음식. 한 요리 하지 않습니다.,5,1404,This market was good past the snow. Treat your mind sitting at an edible table and the belly of the local people. Everyone is kind and helps to get something. Great food. I don't cook one dish.
Alex W,"저희는 음식 리뷰 온라인. 많은 상점들이 문을 닫고 일요일, 모험 했지만 음식이 다. 사람이 있고, 즐길 수 있는 경우 이러한 까다 롭고 공룡 이!",4,1404,"We're online for food review. Many shops were closed and on Sundays, they took risks, but the food was all. If there's a person and you can enjoy it, you're such a picky dinosaur!"
Orator11,"인사동 근처에 위치한 곳이 모두 같은 아침에 방문 할 수 있습니다. 물론 여기에 들려 있는 김치 찐 게 많아요. 1층에서 풍성한 음식, 침대 시트는 물론, 인수를 발판으로 한국 기념품. 이 거대한 영역을 커버, 2층에, 많은 옷 가게들이 찾을 수 있는, 그 대부분이 중국에서 만들어 준 옷. 제가 본 것 보다 더 비싼 것 같은 것이 있는데요, 여기에 다양한 좋은 있지만, 청바지를 호주머니 에서 가져오세요. 계단이 가파르고 미끄러운 수의 일부, 특히 젖은 경우, 조심하세요. 3층에 있는 데",3,1404,"You can visit all the places near Insa-dong in the same morning. Of course, there are a lot of steamed kimchi in here. Korean souvenirs based on the acquisition of abundant food, bed sheets, and abundant food on the first floor. Cover this huge area, on the second floor, a garment that many clothing stores can find, most of which are made in China. I think it's more expensive than what I've seen, and here are a variety of good things, but bring jeans from your pocket. Be careful of a portion of the steep and slippery number of stairs, especially if wet. It's on the third floor."
Brian C,"이 곳은 매우 컸고, 유일한 단점이 있는 업체는 대부분이 똑같은 물건을 각 저장할 수 있습니다. 정말 좋은 경험이었지만!",4,1404,"This place was very big, and most of the companies with the only drawbacks could store the same stuff. It was a great experience!"
Shaka_Frank,"제 아내와 저는 이 시장을 본 실사 비디오를 보고 싶었는데 이곳 (감사합니다, 수도 cory) 및 이후에 미친 넘는 듯 보였어요. 한, 우리는 실망하지 않았다. 쇼핑 몰 입니다 (물론 거의 안 나오지만 콜드) 와 협상이 교차 운용할 수 있는 미로 같았어요. 남쪽에서 입력, 청계천 에서 흘르다, 만남 또한 음식 포장 마차 산책로 중간에 위치하고 있습니다. 되어 있는 쪽은 음식 (제한되어 있는 앉아서) 식사. 하지만, 사람들은 그 자리에 스쿠터를 조심 해 드라이브 같은 산책로까지 제공. 상상할 수",5,1404,"My wife and I wanted to see a live video of the market, and it seemed like we were going crazy here and after. Han, we weren't disappointed. It was like a maze where negotiations with the mall could cross-operate. Entering from the south, flowing from Cheonggyecheon Stream, Mannam is also located in the middle of the food cart trail. The side where it is served is food (restricted sitting), but people are careful with scooters on the spot, even offering trails such as drives. imaginative number"
QuickWhitTravel,"이 시장은 매우 밝고 아름다운 것이기 때문에, 이용할 수 있는 다양한 기념품도 보여. 나는 방문을 추천합니다!",4,1404,"Since this market is very bright and beautiful, there are also various souvenirs available. I recommend you to visit!"
glinghui,"좋은 곳에 시장이 있어서 문화를 살펴보겠습니다. 음식을 시도해 보고 살 수 있는, 작은 가격이 나지만, 전반적으로 괜찮은, 시장은 매우 깨끗했어요.",3,1404,"There is a market in a good place, so let's take a look at the culture. The market was very clean, with a small price to try and buy food, but good overall."
lemoncoke07,"나는 이곳에서 음식을 사랑합니다. 점심/저녁 식사를 이 곳에 두 번이나 입을 충분히 할 수 있는 김밥 mayak! 이 곳은 또한 꽤 큰 음식 섹션, 옷, 액세서리 등 이다. 가치 있는 방문",5,1404,"I love food here. Gimbap mayak, enough to have lunch/dinner here twice! It is also a fairly large section of food, clothing, accessories, etc. a valuable visit"
YiWen_lyw,좋은 경험을 할 수 있는 지역. 대개의 전통적인 음식을 시도해 보고. 또한 전통적인 한국 의류 에 찾을 수 있습니다. 사람들을 위한 최고의 로컬 음식을 시도해 보고! 빈 배가!,5,1404,An area where you can have a good experience. Try most traditional foods. You can also find traditional Korean clothes. Try the best local food for people! An empty boat!
Lady_Nathalia,제가 정말 좋아하는 곳입니다 음식. 서로 다른 유형의 본격적인 한국 음식을 먹을 수 있습니다. 살고 있는 문어? 여기에 먹을 수 있습니다. 나는 모험을 시도하지 않은 나는 아직 하지. 하지만 그들이 좋은 맥주를,4,1404,This is my favorite place. Food. You can eat different types of Korean food. The octopus that lives? You can eat here. I still do it because I haven't tried adventure. But they don't want to drink good beer.
Quack H,"시장은 전체 식당, 줄기, 작은 레스토랑, 식료품 가게, 옷 가게 등등. 하루 반나절 을 보낼 수 있는 지역 요리를 경험할 수 있는. 광장시장 은 외국인들 중에서 매우 인기 있는 주민들.",5,1404,"The market is full of restaurants, stems, small restaurants, grocery stores, clothing stores, etc. You can experience the local cuisine that you can enjoy for a day and a half. Gwangjang Market is very popular among foreigners."
