u_id,review,u_rate,p_id,review_en
짱짱짱,진관사 절에 방문하는것도 있지만 옆에 산책로가 있어서 산책하기 좋아요. 진관사에서 차 한잔 하는것도 추천합니다. 특히 대추차가 맛있어요!,4,16,"Some visit Jingwansa temple, but there is a walkway next to it, so it is good to take a walk. I also recommend having a cup of tea at Jingwan Temple. Especially jujube tea is delicious!"
떠나볼래,고등학교때부터 절 주변을 많이도 다녔던 경험이 있습니다 벌써 20년이 흘렀지만 변한건 하얗게 변해가는 제 머리색깔뿐이네요 조용하고 경치좋고 서울에서 접근성도 좋아 북한산을 찾는 등산객들이 주로 찾는곳이기도 하나 일부 등산객이나 관광객들의 좋지못한 행동으로 얼굴을 찌푸리게 하네요 자신이 가지고온 쓰레기는 봉투에 담아 하산할때 쓰레기통에 버려주시고 절 주변 및 북한산 국립공원은 담배를 피울수없는 곳입니다 진관사엔 조그마한 계곡도 있으며 폭포도 있어 무더위를 식힐수 있는 장소이기도 합니다 또한,4,16,"I've been around a lot since high school. It's already been 20 years, but the only thing that's changed is my white hair color. It's quiet, scenic, and accessibility from Seoul, so it's a popular place for hikers to visit, but it makes some hikers and tourists frown at the bad behavior. Please put the trash you brought in an envelope and throw it in the trash can when you go down the mountain. Around the temple, Bukhansan National Park is a place where you can't smoke. Jingwansa Temple has a small valley and a waterfall, so it is a place to cool off the heat. Also"
정명진,북한산 기슭에 있는 조용한 사찰 입니다. 경치도 좋은 곳이라 산책하기 좋은 장소로서 한번 들러 보시기 추천 드립니다.,4,16,"It is a quiet temple at the foot of Bukhansan Mountain. It's a great place to take a walk, so I recommend you to visit."
storylovers,저는 2016 년에 한국에서 컨퍼런스에 참석하기 위해 한국에 갔을 때 주최자에게 세종대왕 관련 사이트에 대해 물었습니다. 그는 서울의 유명한 조각상 만 알았습니다. 나는 한 농부가 하루에 배울 수 있도록 한국어 알파벳을 만들기 위해 세종대왕의 대담한 프로그램과 관련된 모든 유적지에 더 관심이있었습니다. 나는 지배적 인 중국인으로부터의 반발을 피하기 위해 세종대왕이 한국의 현재 알려지지 않은 위치에있는“숨겨진 실험실”에서 학자 팀을 격리 한 방법을 읽었습니다. 이 팀은 1 년 넘게 일하면서,5,16,"When I went to Korea in 2016 to attend a conference in Korea, I asked the organizer about the site related to King Sejong. He only knew about the famous statues in Seoul. I was more interested in all the historical sites related to King Sejong's bold program to make the Korean alphabet so that a farmer could learn in a day. I read how King Sejong isolated a team of scholars from a"" hidden laboratory"" in Korea's current unknown location to avoid a backlash from the dominant Chinese. This team has been working for over a year."
KIHOON CHOI,이 곳은 도심에서 조금 떨어져 있습니다. 그러나이 사원 근처에는 북한산과 은평 한옥 마을이 있습니다. 또한 분위기가 차분하고 템플 스테이 프로그램을 운영합니다. ???? ???? ??? ????? ??? ??? ??? ??? ??? ??? ??? ???? ?????. ? ??? ?? ??? ??? ???? ??? ?????.,5,16,"This place is a little far from the city center. However, there are Bukhansan Mountain and Eunpyeong Hanok Village near this temple. Also, the atmosphere is calm and the temple stay program is run. ???????????????????????????????????????????????????????????????????????????????????????????????????????????????????????????????????????????????????????????????????????????????????????????????????????????????????????????????????????????????????????????????????????????"
dev_ehsan,"나는 일몰 전에 사원을 방문하기를 원했고, 징안사는 서울과 그 가장 유명한 지역 중 한 곳에 있기 때문에 첫 번째 선택이었습니다. 찾기가 어려웠지만 그 곳을 둘러 보는데 한 시간 씩 걸 렸습니다. , 그렇지만 그만한 가치가 있었어! 내가 찾던 때마다 가치가 있었다! 그 당시 축제의 종류가 있었는데 그것에 대해 아무것도 이해하지 못했고, 모든 논문과 기도문은 한국어로 쓰여졌지만 그 지역은 꽃이 가득한 곳이었으며,이 신자들과 승려들과 관광객들과 함께 내가 가장 많이 방문한 장소 중 하나였습니다.",5,16,"I wanted to visit the temple before sunset, and Jing'an Temple was the first choice because it was in Seoul and one of its most famous areas. It was hard to find, but it took me an hour to look around. But it was worth it! It was worth every time I looked for! There was a kind of festival at the time, and I didn't understand anything about it, and all the papers and prayers were written in Korean, but the area was full of flowers, and it was one of the most visited places for me along with these believers, monks and tourists."
Nancy S,굉장히 아름답다. 모든 화려한 제등을 보는 것은 산뜻했다. 사원에는 3 개의 큰 황금의 Buddha가 있었다. 문화 탐닉을위한 훌륭한 장소.,5,16,It's very beautiful. It was refreshing to see all the colorful lanterns. There were three large golden Buddha in the temple. an excellent place for cultural indulgence
tanhi810,"저는 처음 경험하는 템플 스테이, 즐길 수 있습니다. 즐겁게 매 순간 jingwansa. 많은 교훈을 가르쳐 준 시니어 고향에 있는 내 마음의 평화와 고요함. 복잡한 생활에도 불구하고 외갑채, 냉각 팅물의 의 모든 수업이 있을 것이다. 나는 일어나서 잠을 자지 도 및 시 21:30 시 4pm, 하지만 나는 그리 신선하게 느껴졌다. 그런 다음. 제가 느끼기에 부복 한 후에 108 마음의 평화. 음식은 정말 맛있는, 나는 훨씬 더 다른 예상.",5,16,"I can enjoy Temple Stay, which is my first experience. jingwansa joyfully every moment The peace and quiet of my mind in my senior hometown that taught me many lessons. Despite the complicated life, there will be all the classes of the single arm, cooling ting-mul. I get up and sleep at 21:30 a.m., 4pm, but I felt so fresh. And then. I think 108 peace of mind after ups and downs. The food is really delicious, I have a much different expectation."
MendoPOM,저는 잘 모르는 내용이 buddist 쳇발. 아름다운 자연의 놀라운 한곳에 있어서 평화를 찾을 를즉시. 다른 사원 들 과 뒤엉키 는 수도승 잠들곤 했어요. 좀 어렵지만 동작 방법을 알고 기대 다 괜찮았어요. 친절한 사람들 중에 가장 좋은 카페. 올 마음을 템플 스테이.,5,16,"I don't know much about Buddist Chetbal. to find peace in one wonderful place of beautiful nature. The monk used to fall asleep in a tangle with other temples. It's a little hard, but I knew how to do it and I was able to expect it The best cafe among kind people. Temple stay."
